松屋,群馬県,松屋　Ｒ伊勢崎宮子町店,群馬県伊勢崎市宮子町3426-1,920,980,60
松屋,群馬県,松屋　Ｒ伊勢崎上泉町店,群馬県伊勢崎市上泉町175番4,920,980,60
松屋,新潟県,松屋　Ｒ亀田インター店,新潟県新潟市中央区姥ｹ山63-1,870,920,50
松屋,群馬県,松屋　Ｒ高崎下之城店,群馬県高崎市下之城町177-4,920,980,60
松屋,群馬県,松屋　Ｒ高崎江木町店,群馬県高崎市江木町601-1,920,980,60
松屋,群馬県,松屋　Ｒ高崎問屋町店,群馬県高崎市問屋町1-10-4,920,980,60
松屋,新潟県,松屋　Ｒ上越藤野店,新潟県上越市大字藤野新田字上長池245-1,870,920,50
松屋,長野県,松屋　Ｒ上田秋和店,長野県上田市秋和492-5,900,950,50
松屋,埼玉県,松屋　Ｒ上尾緑丘店,埼玉県上尾市緑丘3-3-7,950,1000,50
松屋,新潟県,松屋　Ｒ新潟女池店,新潟県新潟市中央区女池5-7-10,870,920,50
松屋,新潟県,松屋　Ｒ新潟米山店,新潟県新潟市中央区米山5-14-5,870,920,50
松屋,神奈川,松屋　Ｒ川崎枡形店,神奈川県川崎市多摩区枡形1-5-9,980,1000,20
松屋,群馬県,松屋　Ｒ前橋元総社町店,群馬県前橋市元総社町90-1,920,980,60
松屋,群馬県,松屋　Ｒ前橋三河町店,群馬県前橋市三河町2-16-16,920,980,60
松屋,群馬県,松屋　Ｒ前橋上小出町店,群馬県前橋市上小出町2-41-7,920,980,60
松屋,東京都,松屋　Ｒ多摩ニュータウン店,東京都八王子市松木33-3,950,980,30
松屋,東京都,松屋　Ｒ多摩愛宕店,東京都多摩市愛宕4-7-3,950,980,30
松屋,埼玉県,松屋　Ｒ大宮吉野町店,埼玉県さいたま市北区吉野町1-2-3,950,1000,50
松屋,埼玉県,松屋　Ｒ大宮奈良町店,埼玉県さいたま市北区奈良町51-4,950,1000,50
松屋,新潟県,松屋　Ｒ長岡堺東町店,新潟県長岡市堺東町7,900,920,20
松屋,東京都,松屋　Ｒ帝京大学前店,東京都八王子市大塚131-8,950,980,30
松屋,長野県,松屋　Ｒ東御店,長野県東御市加沢1406-51,900,950,50
松屋,東京都,松屋　Ｒ日野三沢店,東京都日野市三沢1-19-2,950,980,30
松屋,新潟県,松屋　Ｒ柏崎店,新潟県柏崎市東柳田23-3,870,920,50
松屋,埼玉県,松屋　Ｒ蓮田関山店,埼玉県蓮田市関山2-7-7,950,1000,50
松屋,東京都,松屋　ときわ台店,東京都板橋区常盤台1-2-5町田ビル1F,920,970,50
松屋,神奈川,松屋　稲田堤店,神奈川県川崎市多摩区菅2-1-1,950,980,30
松屋,東京都,松屋　下赤塚店,東京都板橋区赤塚1-7-2,920,970,50
松屋,東京都,松屋　下板橋店,東京都豊島区池袋本町3-25-13,920,970,50
松屋,大阪府,松屋　花園町店,大阪府大阪市西成区鶴見橋1-3-5ビュアファースト花園1F,920,1000,80
松屋,群馬県,松屋　高崎駅前店,群馬県高崎市八島町17-10,920,980,60
松屋,東京都,松屋　小田急永山店,東京都多摩市永山1-18-2小田急マルシェ永山,950,980,30
松屋,東京都,松屋　上板橋店,東京都板橋区常盤台4-33-13丸萩ビル１F,920,970,50
松屋,埼玉県,松屋　上尾東口店,埼玉県上尾市宮本町3-16グロアール上尾,950,1000,50
松屋,新潟県,松屋　新潟駅前店,新潟県新潟市中央区東大通1-6-1,870,920,50
松屋,新潟県,松屋　新潟万代シテイ店,新潟県新潟市中央区万代1-1-22,870,920,50
松屋,東京都,松屋　成増店,東京都板橋区成増2-17-23,920,970,50
松屋,東京都,松屋　千川店,東京都豊島区要町3-38-3長崎ビル1F,920,970,50
松屋,大阪府,松屋　大国町店,大阪府大阪市浪速区敷津東1-9-16,920,1000,80
松屋,東京都,松屋　大山店,東京都板橋区大山東町58-2,920,970,50
松屋,東京都,松屋　中板橋店,東京都板橋区中板橋21-2中板堂ビル,920,970,50
松屋,東京都,松屋　東武練馬店,東京都板橋区徳丸3-1-26大川ビル1F,920,970,50
松屋,東京都,松屋　板橋桜川店,東京都板橋区桜川3-22-9ノイエルハイム桜川1Ｆ,920,970,50
松屋,東京都,松屋　氷川台店,東京都練馬区氷川台3-39-9,920,970,50
松屋,東京都,松屋　分倍河原店,東京都府中市片町2-22-1山ニビル,950,980,30
松屋,東京都,松屋　平和台店,東京都練馬区早宮2-17-39ミリオンアネックス平和台,920,970,50
松屋,東京都,松屋　北野店,東京都八王子市北野町546-2横溝ビル,950,980,30
松屋,埼玉県,松屋　蓮田店,埼玉県蓮田市東5-2-9NKB2ビル1F,950,1000,50
