吉野家,大分県,吉野家 10号線別府店,大分県別府市汐見町7‐36,1050,20240504
吉野家,静岡県,吉野家 136号線函南店,静岡県田方郡函南町塚本142‐1,1100,20240504
吉野家,静岡県,吉野家 139号富士伝法店,静岡県富士市伝法2379‐1,1100,20240504
吉野家,愛知県,吉野家 153号線和合店,愛知県愛知郡東郷町和合牛廻間166‐1,1150,20240504
吉野家,愛知県,吉野家 155号線刈谷店,愛知県刈谷市新富町3‐411,1150,20240504
吉野家,大阪府,吉野家 163号線門真店,大阪府門真市寿町21‐30,1100,20240504
吉野家,大阪府,吉野家 171号線小野原店,大阪府箕面市粟生新家4丁目1-2,1100,20240504
吉野家,広島県,吉野家 183号線古市橋店,広島県広島市安佐南区古市1丁目26-2,1100,20240504
吉野家,大分県,吉野家 197号線大分萩原店,大分県大分市牧2丁目1-7,1000,20240504
吉野家,愛知県,吉野家 1号線安城店,愛知県安城市東栄町3丁目816-6,1100,20240504
吉野家,愛知県,吉野家 1号線岡崎東店,愛知県岡崎市大平町杉本7‐1,1150,20240504
吉野家,愛知県,吉野家 1号線豊明店,愛知県豊明市前後町ほら貝1389‐1,1100,20240504
吉野家,佐賀県,吉野家 208号線佐賀大学前店,佐賀県佐賀市本庄町大字本庄字五本杉577‐1,1000,20240504
吉野家,鹿児島,吉野家 225号線鹿児島宇宿店,鹿児島県鹿児島市新栄町1-23,1000,20240504
吉野家,愛知県,吉野家 247号線名和店,愛知県東海市名和町三番割中31‐6,1100,20240504
吉野家,愛知県,吉野家 248号線豊田店,愛知県豊田市錦町2‐44,1150,20240504
吉野家,佐賀県,吉野家 34号線佐賀店,佐賀県佐賀市卸本町5‐34,1000,20240504
吉野家,長崎県,吉野家 34号線長崎大村店,長崎県大村市松並1丁目370‐1,1000,20240504
吉野家,長崎県,吉野家 35号線佐世保大塔店,長崎県佐世保市大塔町18‐11,1000,20240504
吉野家,北海道,吉野家 36号線苫小牧店,北海道苫小牧市若草町3丁目2‐2,1030,20240504
吉野家,北海道,吉野家 38号線帯広店,北海道帯広市西1条南1丁目1-2,1050,20240504
吉野家,岩手県,吉野家 4号線盛岡南店,岩手県盛岡市南仙北2‐308‐2（地番）,950,20240504
吉野家,長崎県,吉野家 57号線長崎諫早店,長崎県諫早市小川町1-1,1000,20240504
吉野家,島根県,吉野家 9号線出雲店,島根県出雲市渡橋町740‐6,1250,20240504
吉野家,千葉県,吉野家 GLPアルファリンク流山5店,千葉県流山市小屋字土深割158番1,1100,20240504
吉野家,東京都,吉野家 羽田空港第 3 ターミナル店,東京都大田区東京都大田区羽田空港2-6-5 空港第3ターミナルビル内,1200,20240504
吉野家,北海道,吉野家 環状通美園店,北海道札幌市豊平区美園4条6丁目3-10,1030,20240504
吉野家,京都府,吉野家 京都競馬場店,京都府京都市伏見区葭島渡場町32京都競馬場内1F,1020,20240504
吉野家,熊本県,吉野家 熊本駅店,熊本県熊本市西区春日3-15-30 熊本駅構内,1000,20240504
吉野家,山梨県,吉野家 甲府バイパス向町店,山梨県甲府市向町503-11,1050,20240504
吉野家,山梨県,吉野家 甲府バイパス竜王店,山梨県甲斐市富竹新田1280,1050,20240504
吉野家,山梨県,吉野家 甲府駅前店,山梨県甲府市丸の内1丁目2番13号,1050,20240504
吉野家,長崎県,吉野家 佐世保下京店,長崎県佐世保市下京町1‐1,1000,20240504
吉野家,鹿児島,吉野家 鹿児島伊敷店,鹿児島県鹿児島市伊敷1-3-15,1000,20240504
吉野家,鹿児島,吉野家 鹿児島住吉店,鹿児島県鹿児島市住吉町10‐16,1050,20240504
吉野家,鹿児島,吉野家 鹿児島中山店,鹿児島県鹿児島市中山2丁目1-2,1300,20240504
吉野家,大阪府,吉野家 新梅田食道街店,大阪府大阪市北区角田町9‐17,1400,20240504
吉野家,愛知県,吉野家 西尾店,愛知県西尾市下町神明下59,1150,20240504
吉野家,北海道,吉野家 千歳店,北海道千歳市北栄2丁目3番2号,1030,20240504
吉野家,兵庫県,吉野家 川西店,兵庫県川西市下加茂1丁目14-14,1030,20240504
吉野家,北海道,吉野家 大通西10丁目店,北海道札幌市中央区大通西10丁目4‐173,1030,20240504
吉野家,大阪府,吉野家 大日店,大阪府守口市大日町3丁目1‐13,1150,20240504
吉野家,大分県,吉野家 大分竹町店,大分県大分市中央町1丁目5‐1,1000,20240504
吉野家,大分県,吉野家 大分府内大橋店,大分県大分市畑中1丁目2番29号,1000,20240504
吉野家,大阪府,吉野家 中央環状線久宝寺店,大阪府東大阪市大蓮東4丁目11-33,1100,20240504
吉野家,大阪府,吉野家 長居公園通り店,大阪府大阪市東住吉区照ヶ丘矢田1‐23‐1,1100,20240504
吉野家,長崎県,吉野家 長崎駅前店,長崎県長崎市大黒町9‐31アンガスビル1F,1000,20240504
吉野家,長崎県,吉野家 長崎滑石店,長崎県長崎市滑石2‐1‐40,1000,20240504
吉野家,北海道,吉野家 苫小牧新開町店,北海道苫小牧市新開町2‐2‐2,1030,20240504
吉野家,大阪府,吉野家 内環状線江坂店,大阪府吹田市穂波町6‐20,1100,20240504
吉野家,山梨県,吉野家 南アルプス桃園店,山梨県南アルプス市桃園1454-6,1050,20240504
吉野家,北海道,吉野家 南郷通6丁目店,北海道札幌市白石区南郷通6丁目北3-36,1030,20240504
吉野家,兵庫県,吉野家 尼宝線池尻店,兵庫県伊丹市池尻2丁目1-15,1030,20240504
吉野家,兵庫県,吉野家 尼宝線労災病院前店,兵庫県尼崎市稲葉元町3丁目21,1050,20240504
吉野家,福岡県,吉野家 博多デイトスアネックス店,福岡県福岡市博多区博多駅中央街1番1号JR九州築紫口ビル1階,1100,20240504
吉野家,埼玉県,吉野家 鳩ヶ谷店,埼玉県川口市三ツ和2-12-1,1130,20240504
吉野家,鳥取県,吉野家 米子市役所前店,鳥取県米子市加茂町1丁目100,1000,20240504
吉野家,愛知県,吉野家 豊田インター通り店,愛知県豊田市深田町1丁目74‐1,1100,20240504
吉野家,静岡県,吉野家 本市場店,静岡県富士市本市場424‐2,1100,20240504
吉野家,北海道,吉野家 羊ヶ丘通清田店,北海道札幌市清田区清田2条3丁目3-53,1030,20240504
