吉野家,静岡県,株式会社吉野家ホールディングス静岡工場,静岡県御殿場市神場3-2,1050,20240622
吉野家,千葉県,吉野家 コーナン京葉船橋インター店,千葉県船橋市海神町2‐3‐1,1200,20240622
吉野家,千葉県,吉野家 都賀駅前店,千葉県千葉市若葉区都賀3‐3‐1,1150,20240622
松屋,東京都,すし松 吉祥寺南店,東京都武蔵野市吉祥寺南町1-8-4,1300,20240622
松屋,東京都,トゥックントゥックン 羽村店,東京都羽村市五ノ神1-2-12,1150,20240622
松屋,北海道,松のや すすきの店,北海道札幌市中央区南4条西3-1-1,1100,20240622
松屋,北海道,松屋 すすきの店,北海道札幌市中央区南4条西3-1-1,1100,20240622
松屋,東京都,松屋 稲城矢野口店,東京都稲城市矢野口517-2,1200,20240622
松屋,東京都,松屋 京王八王子店,東京都八王子市東町1-1-20第6岩下ビル1F,1250,20240622
松屋,東京都,松屋 国立店/マイカリー食堂 国立店,東京都国立市中1-8-5,1250,20240622
松屋,北海道,松屋 札幌駅前通店,北海道札幌市中央区北1条西3丁目3番地 敷島北一条ビル,1100,20240622
松屋,北海道,松屋 新琴似店/松のや 新琴似店,北海道札幌市北区新琴似6条1丁目386-1(地番),1050,20240622
松屋,北海道,松屋 西町店,北海道札幌市西区西町北4-1-8,1050,20240622
松屋,東京都,松屋 西八王子店,東京都八王子市台町4-47-11,1250,20240622
松屋,神奈川,松屋 川崎枡形店,神奈川県川崎市多摩区枡形1-5-9,1200,20240622
松屋,東京都,松屋 多摩ニュータウン店,東京都八王子市松木33-3,1200,20240622
松屋,東京都,松屋 多摩愛宕店,東京都多摩市愛宕4-7-3,1200,20240622
松屋,東京都,松屋 中河原店,東京都府中市住吉町2-2-2,1200,20240622
松屋,神奈川,松屋 中野島店/マイカリー食堂 中野島店,神奈川県川崎市多摩区中野島1-9-2,1200,20240622
松屋,東京都,松屋 帝京大学前店,東京都八王子市大塚131-8,1200,20240622
松屋,北海道,松屋 南郷通店,北海道札幌市白石区南郷通9丁目南5-10,1050,20240622
松屋,東京都,松屋 日野神明店,東京都日野市神明2-1-1,1250,20240622
松屋,東京都,松屋 日野店,東京都日野市大坂上1-30-24,1200,20240622
松屋,東京都,松屋 八王子店,東京都八王子市旭町7-1 豊栄ビル,1250,20240622
松屋,東京都,松屋 府中本町店/マイカリー食堂 府中本町店,東京都府中市本町1-29-1,1200,20240622
松屋,東京都,松屋 分倍河原店,東京都府中市片町2-22-1,1200,20240622
松屋,東京都,松屋 豊田店,東京都日野市多摩平1-2-1,1200,20240622
松屋,東京都,松屋 北野店,東京都八王子市北野町546-2 横溝ビル,1200,20240622
松屋,東京都,松屋 立川錦町店/マイカリー食堂 立川錦町店,東京都立川市錦町2-1-3 ,1300,20240622
松屋,東京都,松屋 立川柴崎町店/松のや 立川柴崎町店,東京都立川市柴崎町6-10-8,1250,20240622
松屋,東京都,松屋 立川店/マイカリー食堂 立川店,東京都立川市曙町2-12-15 立川金水ビル1F,1300,20240622
松屋,東京都,松屋 立川北口店,東京都立川市曙町2丁目3番地3,1300,20240622
