すき家,静岡県,すき家 139号富士田島店,静岡県富士市田島142-1,1030,20220924
すき家,神奈川,すき家 ソニー厚木テクノロジーセンター店,神奈川県厚木市旭町4-14-1,1090,20220924
すき家,東京都,すき家 蒲田南店,東京都大田区蒲田4-42-12新生ビル1F,1150,20220924
すき家,東京都,すき家 小平店,東京都小平市中島町22-19,1080,20220924
すき家,東京都,すき家 西葛西店,東京都江戸川区西葛西1-15-9スカイビル,1150,20220924
すき家,東京都,すき家 西新宿店,東京都新宿区西新宿7-10-16千徳ビル,1150,20220924
すき家,宮城県,すき家 仙台クリスロード店,宮城県仙台市青葉区中央2-2-29,930,20220924
すき家,東京都,すき家 大山店,東京都板橋区大山町24-10常磐ビル1F,1120,20220924
すき家,東京都,すき家 竹ノ塚店,東京都足立区西保木間1-17-20,1100,20220924
すき家,東京都,すき家 南大井店,東京都品川区南大井3-7-20,1200,20220924
すき家,東京都,すき家 府中店,東京都府中市宮西町2-21F,1120,20220924
すき家,千葉県,すき家 流山店,千葉県流山市南流山7-1-10,1050,20220924
