吉野家,静岡県,吉野家 136号線函南店,静岡県田方郡函南町塚本142‐1,900,950,50
吉野家,静岡県,吉野家 150号線焼津店,静岡県焼津市八楠4‐3‐11,900,950,50
吉野家,愛知県,吉野家 155号線刈谷店,愛知県刈谷市新富町3‐411,930,950,20
吉野家,愛知県,吉野家 1号線岡崎東店,愛知県岡崎市大平町杉本7‐1,930,950,20
吉野家,愛知県,吉野家 1号線豊明店,愛知県豊明市前後町ほら貝1389‐1,930,950,20
吉野家,愛知県,吉野家 247号線名和店,愛知県東海市名和町三番割中31‐6,930,1000,70
吉野家,新潟県,吉野家 燕三条店,新潟県三条市上須頃323番地,800,900,100
吉野家,静岡県,吉野家 静岡瀬名川店,静岡県静岡市葵区瀬名川2‐4‐10,900,950,50
吉野家,静岡県,吉野家 藤枝小石川店,静岡県藤枝市小石川町1‐6‐19,900,950,50
松屋,愛知県,松屋　R笠寺店,愛知県名古屋市南区千竈通7丁目8-1,900,1000,100
松屋,愛知県,松屋　R植田一本松店,愛知県名古屋市天白区一本松2-701,950,1000,50
松屋,愛知県,松屋　R森孝店,愛知県名古屋市守山区森孝4-507,950,1000,50
松屋,愛知県,松屋　R平針駅前店,愛知県名古屋市天白区平針3-7-11,950,1000,50
松屋,愛知県,松屋　R野並店,愛知県名古屋市緑区鳴海町字杜若7-1,871,950,79
松屋,東京都,松屋　押上店,東京都墨田区押上1丁目11-3押上滝ビル,1000,1100,100
松屋,東京都,松屋　浅草国際通店,東京都台東区浅草2-11-7和田ビル,1000,1100,100
松屋,東京都,松屋　本所吾妻橋店,東京都墨田区吾妻橋3-7-4ライオンズマンション吾妻橋,1000,1100,100
すき家,神奈川,すき家 134号横須賀池田店,神奈川県横須賀市池田町5-14-12,1000,1020,20
すき家,神奈川,すき家 134号横須賀長坂店,神奈川県横須賀市長坂2-11-2,1000,1020,20
すき家,愛知県,すき家 155号稲沢一色店,愛知県稲沢市一色下方町285-3,980,1000,20
すき家,富山県,すき家 156号砺波店,富山県砺波市新又135-1,950,1000,50
すき家,富山県,すき家 160号氷見店,富山県氷見市窪851-1,950,1000,50
すき家,奈良県,すき家 168号生駒壱分店,奈良県生駒市有里町108-1,900,950,50
すき家,神奈川,すき家 16号横須賀安浦店,神奈川県横須賀市安浦町3-24-3,1000,1020,20
すき家,大阪府,すき家 170号羽曳野西浦店,大阪府羽曳野市西浦3-2-1,930,950,20
すき家,大阪府,すき家 170号熊取店,大阪府泉南郡熊取町紺屋2-5-5,930,950,20
すき家,山口県,すき家 190号宇部西割店,山口県宇部市大字妻崎開作871-2,900,920,20
すき家,岐阜県,すき家 19号土岐店,岐阜県土岐市泉仲森町1-17,950,1000,50
すき家,熊本県,すき家 208号荒尾原万田店,熊本県荒尾市原万田字八反田618-3,820,870,50
すき家,奈良県,すき家 24号五條今井店,奈良県五條市今井1-11-57,900,950,50
すき家,大阪府,すき家 26号岸和田下池田店,大阪府岸和田市下池田町1-2-3,930,950,20
すき家,大阪府,すき家 26号泉佐野鶴原店,大阪府泉佐野市鶴原1855-3,930,950,20
すき家,大阪府,すき家 26号泉大津店,大阪府泉大津市北豊中町2-17-24,930,950,20
すき家,大阪府,すき家 309号堺黒山店,大阪府堺市美原区黒山168-1,930,950,20
すき家,熊本県,すき家 325号菊池店,熊本県菊池市隈府字北原597-2,820,850,30
すき家,富山県,すき家 359号婦中店,富山県富山市婦中町下轡田444-1,980,1000,20
すき家,鹿児島,すき家 3号いちき串木野店,鹿児島県いちき串木野市浜ケ城12283-2,800,850,50
すき家,熊本県,すき家 3号山鹿店,熊本県山鹿市大橋通401-2,820,870,50
すき家,富山県,すき家 41号大沢野店,富山県富山市上大久保1052-1,980,1000,20
すき家,富山県,すき家 472号射水店,富山県射水市下条新1482-1,950,1000,50
すき家,福岡県,すき家 496号行橋店,福岡県行橋市西宮市4-2-11,880,900,20
すき家,富山県,すき家 8号滑川店,富山県滑川市柳原253-1,980,1000,20
すき家,富山県,すき家 8号高岡北島店,富山県高岡市北島婦計459-2,950,1000,50
すき家,大阪府,すき家 はびきの伊賀店,大阪府羽曳野市伊賀4-5-6,930,950,20
すき家,北海道,すき家 イオンモール旭川西店,北海道旭川市緑町23-2161-3,850,900,50
すき家,北海道,すき家 旭川永山店,北海道旭川市永山六条5-77-54,850,900,50
すき家,北海道,すき家 旭川神居店,北海道旭川市神居2条1-1-17,850,900,50
すき家,北海道,すき家 旭川豊岡店,北海道旭川市豊岡十四条6-8-15,850,900,50
すき家,神奈川,すき家 横須賀衣笠店,神奈川県横須賀市衣笠町43-17,1000,1020,20
すき家,神奈川,すき家 横須賀中央店,神奈川県横須賀市若松町1-4味ビル1F,1000,1020,20
すき家,神奈川,すき家 横須賀野比店,神奈川県横須賀市野比1-4-25,1000,1020,20
すき家,東京都,すき家 下石神井店,東京都練馬区下石神井5-16-3,1020,1050,30
すき家,東京都,すき家 下赤塚駅前店,東京都板橋区赤塚新町1-23-5プロスパービル上野1F,1000,1050,50
すき家,大阪府,すき家 貝塚北町店,大阪府貝塚市北町17-15,930,950,20
すき家,岐阜県,すき家 各務原蘇原店,岐阜県各務原市蘇原瑞穂町2-62-1,920,980,60
すき家,福岡県,すき家 苅田店,福岡県京都郡苅田町尾倉1-3-1,880,900,20
すき家,東京都,すき家 環八羽田店,東京都大田区羽田4-3-3,1100,1200,100
すき家,大阪府,すき家 岸和田磯上店,大阪府岸和田市磯上町4-23-25,930,950,20
すき家,大阪府,すき家 岸和田和泉IC北店,大阪府岸和田市田治米町343-1,930,950,20
すき家,富山県,すき家 魚津本江店,富山県魚津市本江字雲雀作2555-1,980,1000,20
すき家,神奈川,すき家 京急久里浜駅前店,神奈川県横須賀市久里浜4-5-4,1000,1020,20
すき家,三重県,すき家 桑名大仲新田店,三重県桑名市大仲新田字屋敷319-119,980,1000,20
すき家,東京都,すき家 江古田駅前店,東京都練馬区旭丘1-71-7土井ビル1F,1000,1050,50
すき家,富山県,すき家 高岡熊野店,富山県高岡市熊野町5-30,950,1000,50
すき家,富山県,すき家 高岡中曽根店,富山県高岡市中曽根290-3,950,1000,50
すき家,富山県,すき家 高岡南店,富山県高岡市駅南5-5-5,950,1000,50
すき家,高知県,すき家 高知中万々店,高知県高知市中万々字目賀計27-1,830,850,20
すき家,大阪府,すき家 堺片蔵店,大阪府堺市南区片蔵1333-1,930,970,40
すき家,愛媛県,すき家 四国中央川之江店,愛媛県四国中央市川之江町314-1,900,950,50
すき家,鹿児島,すき家 鹿児島天文館店,鹿児島県鹿児島市呉服町1-4チサンイン鹿児島店1F,800,860,60
すき家,鹿児島,すき家 鹿児島東谷山店,鹿児島県鹿児島市東谷山2-52-22,800,830,30
すき家,愛知県,すき家 春日井中央店,愛知県春日井市瑞穂通7-16-1,960,1000,40
すき家,愛知県,すき家 春日井桃山店,愛知県春日井市桃山町3-224-2,960,1000,40
すき家,東京都,すき家 勝どき三丁目店,東京都中央区勝どき3-7-6,1100,1200,100
すき家,福岡県,すき家 小倉北神岳店,福岡県北九州市小倉北区神岳2-6-30,870,900,30
すき家,大阪府,すき家 松原阿保店,大阪府松原市阿保6-871-1,930,950,20
すき家,大阪府,すき家 松原南新町店,大阪府松原市南新町4-107-17,930,950,20
すき家,島根県,すき家 松江菅田店,島根県松江市菅田町24-1,900,950,50
すき家,東京都,すき家 上石神井駅前店,東京都練馬区上石神井1-13-17,1020,1050,30
すき家,神奈川,すき家 新杉田店,神奈川県横浜市磯子区杉田1-6-6&nbsp;第3アズサワビル,1000,1020,20
すき家,東京都,すき家 神宮前三丁目店,東京都渋谷区神宮前3-23-3トリニティビル1F,1170,1220,50
すき家,東京都,すき家 成増店,東京都板橋区成増2-18-7吉田屋第一ビル1F,1000,1050,50
すき家,東京都,すき家 晴海二丁目店,東京都中央区晴海2-5-24&nbsp;晴海センタービル1F,1100,1200,100
すき家,東京都,すき家 千川駅前店,東京都豊島区要町3-10-10,1000,1050,50
すき家,大阪府,すき家 泉大津松之浜店,大阪府泉大津市松之浜町2-1-12,930,950,20
すき家,大阪府,すき家 泉南中小路店,大阪府泉南市中小路2-383,950,970,20
すき家,東京都,すき家 代々木一丁目店,東京都渋谷区代々木1-37-6,1170,1220,50
すき家,岐阜県,すき家 大垣上面店,岐阜県大垣市上面4-1-1,920,1000,80
すき家,大分県,すき家 大分中央店,大分県大分市日岡1-3-22,880,900,20
すき家,東京都,すき家 築地四丁目店,東京都中央区築地4-12-2シグネットビル1F,1100,1200,100
すき家,神奈川,すき家 追浜駅前店,神奈川県横須賀市追浜町3-8,1000,1020,20
すき家,大阪府,すき家 藤井寺駅前店,大阪府藤井寺市岡2-8-46アコ-ルアン1F,930,950,20
すき家,高知県,すき家 南国BP店,高知県南国市明見字大政所960-1,830,900,70
すき家,東京都,すき家 氷川台駅前店,東京都練馬区氷川台3-40-15氷川ガ-デンハウス1F,1000,1050,50
すき家,富山県,すき家 富山掛尾店,富山県富山市掛尾町401-3,980,1000,20
すき家,富山県,すき家 富山五福店,富山県富山市五福字中割2325-3,980,1000,20
すき家,富山県,すき家 富山呉羽店,富山県富山市本郷東部9-1,980,1000,20
すき家,富山県,すき家 富山中川原店,富山県富山市秋吉182-1,980,1000,20
すき家,富山県,すき家 富山豊田店,富山県富山市豊田2-70-4,980,1000,20
すき家,東京都,すき家 北参道駅南店,東京都渋谷区千駄ヶ谷3-13-20第7宮庭マンション1F,1170,1220,50
すき家,神奈川,すき家 本牧店,神奈川県横浜市中区本牧町2-364,1000,1050,50
すき家,愛知県,すき家 名古屋大野木店,愛知県名古屋市西区大野木4-30,980,1000,20
すき家,岐阜県,すき家 名鉄岐阜駅前店,岐阜県岐阜市神田町9-14,900,950,50
すき家,富山県,すき家 立山利田店,富山県中新川郡立山町利田629-1,980,1000,20
すき家,東京都,すき家 練馬関町南店,東京都練馬区関町南1-11-2,1020,1050,30
すき家,東京都,すき家 練馬南大泉店,東京都練馬区南大泉1-17-17,1020,1050,30
すき家,東京都,すき家 糀谷店,東京都大田区南蒲田3-3-1&nbsp;こうじや駅前ビル1F,1100,1200,100
