吉野家,群馬県,吉野家 天川大島店,群馬県前橋市天川大島町1丁目33‐4,1050,20250412
松屋,神奈川,松のや 伊勢佐木町店/マイカリー食堂 伊勢佐木町店,神奈川県横浜市中区伊勢佐木町2-76-3,1200,20250412
松屋,埼玉県,松屋 桶川西口店/松のや 桶川西口店/マイカリー食堂 桶川西口店,埼玉県桶川市若宮1-2-8,1150,20250412
松屋,群馬県,松屋 前橋上小出町店,群馬県前橋市上小出町2-41-7,1200,20250412
松屋,福島県,松屋 白河店,福島県西白河郡西郷村字豊作東1,1080,20250412
すき家,広島県,すき家 184号尾道店,広島県尾道市栗原西2-7-14,1050,20250412
すき家,岡山県,すき家 2国笠岡店,岡山県笠岡市三番町2-30,1050,20250412
すき家,広島県,すき家 2国福山高西店,広島県福山市高西町4-4-9,1050,20250412
すき家,神奈川,すき家 横浜善部町店,神奈川県横浜市旭区善部町16-1,1200,20250412
すき家,山口県,すき家 山口維新公園前店,山口県山口市大字維新公園5-2-10,1020,20250412
すき家,東京都,すき家 芝四丁目店,東京都港区芝4-7-1 西山ビル1F,1380,20250412
すき家,神奈川,すき家 城山向原店,神奈川県相模原市緑区向原3-1-4,1200,20250412
すき家,神奈川,すき家 新杉田店,神奈川県横浜市磯子区杉田1-6-6 第3アズサワビル,1162,20250412
すき家,神奈川,すき家 相模原上鶴間店,神奈川県相模原市南区上鶴間2-7-2,1162,20250412
すき家,東京都,すき家 池袋西店,東京都豊島区西池袋2-39-11,1300,20250412
すき家,神奈川,すき家 都筑東山田店,神奈川県横浜市都筑区東山田3-18-5,1200,20250412
すき家,神奈川,すき家 平塚店,神奈川県平塚市平塚1-9-26,1162,20250412
すき家,沖縄県,すき家 北谷国体道路店,沖縄県中頭郡北谷町上勢頭544-6,1050,20250412
すき家,東京都,すき家 蓮根駅西店,東京都板橋区蓮根2-29-6 蓮根ビル1F,1250,20250412
すき家,東京都,すき家 六本木五丁目店,東京都港区六本木5-9-22 第2千陽ビル1F,1380,20250412
