吉野家,東京都,吉野家 府中中河原店,東京都府中市住吉町1丁目20‐1,1250,20240302,1200,50
吉野家,埼玉県,吉野家 武蔵浦和駅前店,埼玉県さいたま市南区別所7丁目7‐34,1250,20240302,1200,50
吉野家,東京都,吉野家 武蔵小金井駅前店,東京都小金井市本町2丁目5‐2,1250,20240302,1150,100
吉野家,神奈川,吉野家 武蔵小杉南口店,神奈川県川崎市中原区小杉町3丁目441‐26,1250,20240302,1200,50
吉野家,東京都,吉野家 武蔵村山店,東京都武蔵村山市中原3丁目1‐2,1200,20240302,1150,50
吉野家,愛知県,吉野家 伏見通錦店,愛知県名古屋市中区錦2丁目9‐23,1250,20240302,1200,50
吉野家,京都府,吉野家 伏見南店,京都府京都市伏見区横大路下三栖辻堂町38‐1,1100,20240302,1070,30
吉野家,福井県,吉野家 福井二の宮店,福井県福井市幾代2丁目1501,1100,20240302,1000,100
吉野家,広島県,吉野家 福山手城町店,広島県福山市手城町4丁目7‐10,1050,20240302,1000,50
吉野家,広島県,吉野家 福山新涯店,広島県福山市新涯町5丁目34‐14,1050,20240302,1000,50
吉野家,東京都,吉野家 福生店,東京都福生市福生799‐5,1200,20240302,1150,50
吉野家,愛知県,吉野家 平手店,愛知県名古屋市緑区平手南1丁目201,1100,20240302,1050,50
吉野家,愛知県,吉野家 平針店,愛知県名古屋市天白区平針5丁目102,1100,20240302,1050,50
吉野家,神奈川,吉野家 平塚大神店,神奈川県平塚市大神8丁目2番1号,1200,20240302,1120,80
吉野家,大阪府,吉野家 平野店,大阪府大阪市平野区平野元町7‐13,1100,20240302,1080,20
吉野家,兵庫県,吉野家 宝塚高松町店,兵庫県宝塚市高司5丁目1‐8,1100,20240302,1030,70
吉野家,沖縄県,吉野家 泡瀬ベイストリート店,沖縄県沖縄市泡瀬4丁目20‐11,950,20240302,920,30
吉野家,愛知県,吉野家 豊橋曙町店,愛知県豊橋市曙町南松原8‐1,1100,20240302,1050,50
吉野家,愛知県,吉野家 豊橋平川店,愛知県豊橋市平川町34‐1,1100,20240302,1050,50
吉野家,大阪府,吉野家 豊中市役所前店,大阪府豊中市中桜塚3丁目10‐30,1150,20240302,1100,50
吉野家,大阪府,吉野家 豊中庄内店,大阪府豊中市庄内栄町4丁目21‐36,1150,20240302,1100,50
吉野家,埼玉県,吉野家 北浦和西口店,埼玉県さいたま市浦和区北浦和4丁目2‐5 サクラレジデンス北浦和1F,1250,20240302,1200,50
吉野家,埼玉県,吉野家 北越谷駅前店,埼玉県越谷市北越谷4丁目2‐9,1150,20240302,1100,50
吉野家,大阪府,吉野家 北花田店,大阪府堺市北区北花田町3丁32‐6,1100,20240302,1080,20
吉野家,東京都,吉野家 北新宿百人町店,東京都新宿区百人町1丁目24‐4,1300,20240302,1250,50
吉野家,大阪府,吉野家 北巽店,大阪府大阪市生野区巽北3丁目15‐24,1100,20240302,1080,20
吉野家,愛知県,吉野家 北名古屋店,愛知県北名古屋市井瀬木郷前9‐1,1100,20240302,1050,50
吉野家,鹿児島,吉野家 霧島店,鹿児島県霧島市国分野口町4‐26,1000,20240302,950,50
吉野家,愛知県,吉野家 名駅サンロード店,愛知県名古屋市中村区名駅4丁目7‐25,1150,20240302,1100,50
吉野家,愛知県,吉野家 名駅太閤通口店,愛知県名古屋市中村区椿町7‐4,1200,20240302,1100,100
吉野家,愛知県,吉野家 名岐一宮店,愛知県一宮市富士3丁目3‐6,1100,20240302,1050,50
吉野家,岐阜県,吉野家 名岐岐南町店,岐阜県羽島郡岐南町伏屋6丁目179,1100,20240302,1050,50
吉野家,沖縄県,吉野家 名護バイパス店,沖縄県名護市大北5丁目22‐23,1000,20240302,950,50
吉野家,三重県,吉野家 名四長島店,三重県桑名市長島町福吉516,1100,20240302,1050,50
吉野家,愛知県,吉野家 名四飛島店,愛知県海部郡飛島村竹之郷2丁目2‐18,1100,20240302,1050,50
吉野家,愛知県,吉野家 名四要町店,愛知県名古屋市南区丹後通4丁目6‐1,1150,20240302,1100,50
吉野家,愛知県,吉野家 名鉄堀田駅前店,愛知県名古屋市瑞穂区塩入町4‐15,1100,20240302,1050,50
吉野家,愛知県,吉野家 名鉄名古屋駅店,愛知県名古屋市中村区名駅1丁目2‐1,1150,20240302,1100,50
吉野家,兵庫県,吉野家 明石魚住町店,兵庫県明石市魚住町清水2360‐5,1130,20240302,1050,80
吉野家,東京都,吉野家 明大前店,東京都世田谷区松原1丁目38‐4,1250,20240302,1200,50
吉野家,東京都,吉野家 目黒駅前店,東京都品川区上大崎2丁目27‐2,1400,20240302,1300,100
吉野家,石川県,吉野家 野々市店,石川県野々市市粟田6丁目386,1050,20240302,1000,50
吉野家,東京都,吉野家 有楽町店,東京都千代田区有楽町2丁目9‐18,1450,20240302,1400,50
吉野家,大阪府,吉野家 淀川通塚本店,大阪府大阪市淀川区塚本2丁目13‐20,1150,20240302,1070,80
吉野家,兵庫県,吉野家 立花駅前店,兵庫県尼崎市立花町1丁目3‐1,1100,20240302,1050,50
吉野家,東京都,吉野家 立花店,東京都墨田区立花5丁目2‐1,1300,20240302,1250,50
吉野家,東京都,吉野家 立川駅北口店,東京都立川市曙町2‐6‐5,1550,20240302,1450,100
吉野家,兵庫県,吉野家 龍野店,兵庫県たつの市龍野町富永796‐1,1080,20240302,1030,50
吉野家,大阪府,吉野家 緑一丁目店,大阪府大阪市鶴見区緑1丁目19‐2,1130,20240302,1100,30
吉野家,大阪府,吉野家 臨海岸和田店,大阪府岸和田市下野町3丁目10‐39,1100,20240302,1080,20
吉野家,大阪府,吉野家 臨海二色の浜店,大阪府貝塚市澤877‐1,1100,20240302,1080,20
吉野家,大阪府,吉野家 臨海緑町店,大阪府堺市堺区緑町1丁14‐1,1100,20240302,1080,20
吉野家,東京都,吉野家 練馬店,東京都練馬区練馬1丁目5‐4,1300,20240302,1200,100
吉野家,埼玉県,吉野家 蓮田店,埼玉県蓮田市西新宿1丁目7,1150,20240302,1100,50
吉野家,岡山県,吉野家 連島店,岡山県倉敷市連島3丁目8‐35,1000,20240302,950,50
吉野家,埼玉県,吉野家 蕨駅前店,埼玉県蕨市塚越1丁目4‐1,1250,20240302,1200,50
吉野家,愛知県,吉野家 杁中店,愛知県名古屋市昭和区隼人町6‐19,1100,20240302,1050,50
すき家,岩手県,すき家 106号宮古店,岩手県宮古市長町1-5-17,980,20240302,950,30
すき家,宮崎県,すき家 10号宮崎島之内店,宮崎県宮崎市大字島之内997-1,970,20240302,950,20
すき家,宮崎県,すき家 10号都城都北店,宮崎県都城市都北町5928-1,1000,20240302,980,20
すき家,香川県,すき家 11号観音寺植田店,香川県観音寺市植田町字東原3-1,1050,20240302,1020,30
すき家,香川県,すき家 11号高松屋島店,香川県高松市高松町3009-9,1000,20240302,970,30
すき家,香川県,すき家 11号高松春日店,香川県高松市春日町1626-1,1000,20240302,970,30
すき家,香川県,すき家 11号高松檀紙店,香川県高松市檀紙町1513-5,1050,20240302,1000,50
すき家,愛媛県,すき家 11号松山久米窪田店,愛媛県松山市久米窪田町1162-1,1000,20240302,950,50
すき家,香川県,すき家 11号東かがわ店,香川県東かがわ市白鳥字田高田131-1,1020,20240302,1000,20
すき家,徳島県,すき家 11号徳島川内店,徳島県徳島市川内町平石古田36-2,1000,20240302,950,50
すき家,茨城県,すき家 124号神栖木崎店,茨城県神栖市木崎2848-1,1100,20240302,1050,50
すき家,秋田県,すき家 13号秋田牛島店,秋田県秋田市牛島東1-5-3,960,20240302,930,30
すき家,東京都,すき家 14号江戸川一之江店,東京都江戸川区一之江1-8-4,1220,20240302,1160,60
すき家,東京都,すき家 14号江戸川篠崎店,東京都江戸川区篠崎町7-1-17,1210,20240302,1160,50
すき家,東京都,すき家 14号江戸川松江店,東京都江戸川区松江1-8-8,1210,20240302,1160,50
すき家,岐阜県,すき家 156号岐阜芥見店,岐阜県岐阜市芥見長山3-8-3,1000,20240302,950,50
すき家,大阪府,すき家 163号門真殿島店,大阪府門真市殿島町7-13,1150,20240302,1100,50
すき家,神奈川,すき家 16号横浜下白根店,神奈川県横浜市旭区川島町2846-5,1200,20240302,1140,60
すき家,東京都,すき家 16号瑞穂南平店,東京都西多摩郡瑞穂町南平1-6-6,1150,20240302,1130,20
すき家,京都府,すき家 171号向日店,京都府向日市鶏冠井町清水7-1,1080,20240302,1050,30
すき家,埼玉県,すき家 17号BP戸田美女木店,埼玉県戸田市美女木7-1-1,1100,20240302,1080,20
すき家,埼玉県,すき家 17号さいたま辻店,埼玉県さいたま市南区辻3-2-28,1150,20240302,1100,50
すき家,群馬県,すき家 17号沼田店,群馬県沼田市硯田町590-5,1120,20240302,1080,40
すき家,埼玉県,すき家 17号本庄店,埼玉県本庄市本庄4-7-11,1110,20240302,1080,30
すき家,広島県,すき家 183号三次店,広島県三次市十日市中1-1-10,1100,20240302,1030,70
すき家,山口県,すき家 188号光浅江店,山口県光市浅江1-11-7,1050,20240302,1000,50
すき家,徳島県,すき家 192号吉野川店,徳島県吉野川市鴨島町上下島字宮内87-8,1000,20240302,950,50
すき家,徳島県,すき家 192号徳島国府店,徳島県徳島市国府町観音寺大溝122-1,1020,20240302,950,70
すき家,大阪府,すき家 1国城東関目店,大阪府大阪市城東区関目5-3-3,1150,20240302,1100,50
すき家,神奈川,すき家 1国鶴見下末吉店,神奈川県横浜市鶴見区下末吉4-4-18コーポ鶴石1F,1200,20240302,1140,60
すき家,熊本県,すき家 208号荒尾原万田店,熊本県荒尾市原万田字八反田618-3,1000,20240302,980,20
すき家,東京都,すき家 20号日野万願寺店,東京都日野市万願寺5-14-8,1150,20240302,1130,20
すき家,大分県,すき家 210号大分わさだ店,大分県大分市市85-1,1000,20240302,980,20
すき家,宮崎県,すき家 221号小林店,宮崎県小林市堤3013-1,970,20240302,950,20
すき家,鹿児島,すき家 226号指宿店,鹿児島県指宿市西方2164-1,1000,20240302,980,20
すき家,北海道,すき家 236号帯広大通店,北海道帯広市大通南3-1-1,1100,20240302,1050,50
すき家,茨城県,すき家 245号日立久慈店,茨城県日立市久慈町4-6-6,1030,20240302,1000,30
すき家,埼玉県,すき家 254号本庄児玉店,埼玉県本庄市児玉町吉田林397-3,1110,20240302,1080,30
すき家,大阪府,すき家 26号高石店,大阪府高石市西取石7-11-1,1120,20240302,1100,20
すき家,大阪府,すき家 26号泉佐野鶴原店,大阪府泉佐野市鶴原1855-3,1120,20240302,1100,20
すき家,鹿児島,すき家 270号南さつま店,鹿児島県南さつま市加世田本町13-5,1000,20240302,980,20
すき家,徳島県,すき家 28号鳴門大津店,徳島県鳴門市大津町吉永四番越471-1,1000,20240302,950,50
すき家,広島県,すき家 2国広島楽々園店,広島県広島市佐伯区楽々園2-2-22,1050,20240302,1000,50
すき家,広島県,すき家 2国広島東雲店,広島県広島市南区東雲3-13-6,1100,20240302,1050,50
すき家,熊本県,すき家 324号天草店,熊本県天草市小松原町7-12,1000,20240302,980,20
すき家,沖縄県,すき家 329号西原店,沖縄県中頭郡西原町字我謝786-2,1000,20240302,980,20
すき家,山形県,すき家 348号山形南館店,山形県山形市南館1201-1,1000,20240302,980,20
すき家,茨城県,すき家 354号土浦南店,茨城県土浦市永国848-9,1030,20240302,1000,30
すき家,北海道,すき家 36号千歳店,北海道千歳市新富1-19-4,1100,20240302,1000,100
すき家,愛媛県,すき家 378号八幡浜店,愛媛県八幡浜市産業通13-12,1020,20240302,1000,20
すき家,福岡県,すき家 389号大牟田店,福岡県大牟田市大正町3-4-3,1000,20240302,980,20
すき家,北海道,すき家 38号帯広柏林台店,北海道帯広市西十七条南1-25-1,1100,20240302,1050,50
すき家,北海道,すき家 39号北見三輪店,北海道北見市東三輪2-831-4,1100,20240302,1020,80
すき家,北海道,すき家 39号北見大町店,北海道北見市大町21-1,1030,20240302,1000,30
すき家,福岡県,すき家 3号八女店,福岡県八女市本村字荷稲559-1,1000,20240302,980,20
すき家,北海道,すき家 40号名寄店,北海道名寄市西四条南10-56-1,1020,20240302,1000,20
すき家,埼玉県,すき家 463号さいたま大門店,埼玉県さいたま市緑区美園6-11-12,1130,20240302,1090,40
すき家,福岡県,すき家 496号行橋店,福岡県行橋市西宮市4-2-11,1050,20240302,1000,50
すき家,埼玉県,すき家 4号杉戸堤根店,埼玉県北葛飾郡杉戸町堤根4024-1,1130,20240302,1100,30
すき家,東京都,すき家 4号足立保木間店,東京都足立区西保木間1-17-20,1220,20240302,1160,60
すき家,福島県,すき家 4号本宮店,福島県本宮市本宮字南ノ内34-7,980,20240302,950,30
すき家,沖縄県,すき家 507号八重瀬店,沖縄県島尻郡八重瀬町字伊覇46-4,1000,20240302,950,50
すき家,徳島県,すき家 55号徳島沖浜店,徳島県徳島市山城西4-1,1000,20240302,950,50
すき家,愛媛県,すき家 56号伊予松前店,愛媛県伊予郡松前町大字恵久美617-1,1020,20240302,1000,20
すき家,愛媛県,すき家 56号宇和島宮下店,愛媛県宇和島市宮下字太田甲191-1,1020,20240302,1000,20
すき家,高知県,すき家 56号高知大原町店,高知県高知市大原町101-1,1000,20240302,950,50
すき家,高知県,すき家 56号四万十古津賀店,高知県四万十市古津賀1-8,1020,20240302,980,40
すき家,高知県,すき家 56号須崎店,高知県須崎市神田2503-1,1020,20240302,1000,20
すき家,愛媛県,すき家 56号大洲松ヶ花店,愛媛県大洲市新谷乙543-1,1050,20240302,1020,30
すき家,高知県,すき家 56号土佐高岡店,高知県土佐市高岡町字野田南ノ丁乙3369-1,980,20240302,920,60
すき家,熊本県,すき家 57号大津店,熊本県菊池郡大津町大字大津1302-1,1000,20240302,970,30
すき家,長崎県,すき家 57号諫早小川町店,長崎県諫早市小川町53-1,1000,20240302,970,30
すき家,沖縄県,すき家 58号読谷店,沖縄県中頭郡読谷村伊良皆661-1,1000,20240302,980,20
すき家,沖縄県,すき家 58号北谷店,沖縄県中頭郡北谷町北谷2-12-6第5松栄ビル1F,1030,20240302,1000,30
すき家,沖縄県,すき家 58号名護東江店,沖縄県名護市東江5-6517-1,1020,20240302,1000,20
すき家,茨城県,すき家 6号石岡店,茨城県石岡市旭台1-1-5,1030,20240302,1000,30
すき家,茨城県,すき家 6号日立城南店,茨城県日立市城南町2-10-1,1000,20240302,990,10
すき家,東京都,すき家 JR町田駅南口店,東京都町田市原町田1-2-6第2ひろせビル1F,1160,20240302,1140,20
すき家,東京都,すき家 あきる野睦橋通り店,東京都あきる野市秋留2-1-5,1150,20240302,1130,20
すき家,東京都,すき家 とうきょうスカイツリー駅前店,東京都墨田区業平1-18-12,1300,20240302,1250,50
すき家,東京都,すき家 ときわ台駅北口店,東京都板橋区常盤台2-6-5,1250,20240302,1200,50
すき家,茨城県,すき家 ひたちなか店,茨城県ひたちなか市中根3319-6,1050,20240302,1020,30
すき家,東京都,すき家 アキバ田代通り店,東京都千代田区外神田4-5-8松孝商事ビル1F,1300,20240302,1250,50
すき家,香川県,すき家 イオンモール綾川店,香川県綾歌郡綾川町萱原822-1イオン綾川ショッピングセンター3F,1050,20240302,1000,50
すき家,埼玉県,すき家 イオンモール浦和美園店,埼玉県さいたま市緑区美園5-50-1イオンモール浦和美園3Fフードコート,1150,20240302,1100,50
すき家,鳥取県,すき家 イオンモール日吉津店,鳥取県西伯郡日吉津村日吉津1160-1,1030,20240302,1000,30
すき家,東京都,すき家 イオン東雲店,東京都江東区東雲1-9-10イオン東雲店2Fフードコート内,1300,20240302,1250,50
すき家,東京都,すき家 イトーヨーカドー国領店,東京都調布市国領町8-2-64イト-ヨ-カド-国領店1F,1200,20240302,1180,20
すき家,東京都,すき家 ウィラ大井店,東京都品川区勝島1-6-16,1350,20240302,1300,50
すき家,東京都,すき家 グリナード永山店,東京都多摩市永山1-4グリナード永山1F,1150,20240302,1130,20
すき家,東京都,すき家 サンライズ蒲田店,東京都大田区西蒲田7-51-2ベルコーサ1F,1300,20240302,1250,50
すき家,神奈川,すき家 センター北店,神奈川県横浜市都筑区牛久保東1-32-1,1200,20240302,1140,60
すき家,神奈川,すき家 ノクティプラザ店,神奈川県川崎市高津区溝口1-4-1ノクティプラザ21Fフードコート内,1250,20240302,1180,70
すき家,東京都,すき家 ハッピーロード大山店,東京都板橋区大山町24-10常陸ビル1F,1250,20240302,1200,50
すき家,東京都,すき家 フレスポ若葉台店,東京都稲城市若葉台2-1-1,1150,20240302,1130,20
すき家,東京都,すき家 ワンザ有明店,東京都江東区有明3-6-11TFTビル東館2F,1400,20240302,1350,50
すき家,東京都,すき家 綾瀬駅南店,東京都葛飾区小菅4-10-2,1220,20240302,1160,60
すき家,東京都,すき家 井ノ頭通り吉祥寺店,東京都武蔵野市吉祥寺南町3-33-3,1250,20240302,1200,50
すき家,東京都,すき家 一之江駅前店,東京都江戸川区一之江3-2-14,1210,20240302,1160,50
すき家,東京都,すき家 稲荷町駅前店,東京都台東区東上野5-1-4,1300,20240302,1250,50
すき家,東京都,すき家 稲城矢野口店,東京都稲城市矢野口323-7,1200,20240302,1180,20
すき家,埼玉県,すき家 羽生店,埼玉県羽生市南6丁目21-2,1100,20240302,1080,20
すき家,東京都,すき家 鵜の木駅前店,東京都大田区鵜の木2-15-2山口ビル1F,1300,20240302,1250,50
すき家,埼玉県,すき家 浦和仲町店,埼玉県さいたま市浦和区仲町1-4-12誠志堂ビル1F,1150,20240302,1100,50
すき家,東京都,すき家 荏原町駅前店,東京都品川区中延5-3-10,1300,20240302,1250,50
すき家,東京都,すき家 永福町駅前店,東京都杉並区永福2-51-13,1200,20240302,1150,50
すき家,神奈川,すき家 横浜羽沢店,神奈川県横浜市神奈川区羽沢町1566-1,1250,20240302,1200,50
すき家,神奈川,すき家 横浜善部町店,神奈川県横浜市旭区善部町16-1,1200,20240302,1140,60
すき家,東京都,すき家 王子駅前店,東京都北区王子1-4-1サンスクエア前庭,1250,20240302,1200,50
すき家,東京都,すき家 荻窪駅西口店,東京都杉並区荻窪5-26-11マチダビル1F,1250,20240302,1200,50
すき家,東京都,すき家 荻窪三丁目店,東京都杉並区荻窪3-47-23,1250,20240302,1200,50
すき家,山口県,すき家 下関稗田西町店,山口県下関市稗田西町10-13,980,20240302,950,30
すき家,東京都,すき家 下石神井店,東京都練馬区下石神井5-16-3,1250,20240302,1200,50
すき家,東京都,すき家 下赤塚駅前店,東京都板橋区赤塚新町1-23-5プロスパービル上野1F,1250,20240302,1200,50
すき家,東京都,すき家 下北沢店,東京都世田谷区北沢2丁目12-7大町ビル,1250,20240302,1200,50
すき家,大阪府,すき家 貝塚北町店,大阪府貝塚市北町17-15,1120,20240302,1100,20
すき家,茨城県,すき家 笠間店,茨城県笠間市笠間487-1,1030,20240302,1000,30
すき家,茨城県,すき家 笠間友部店,茨城県笠間市旭町427-2,1080,20240302,1050,30
すき家,群馬県,すき家 笠懸阿左美店,群馬県みどり市笠懸町阿左美630-2,1070,20240302,1050,20
すき家,東京都,すき家 葛飾亀有一丁目店,東京都葛飾区亀有1-14-5,1220,20240302,1160,60
すき家,東京都,すき家 葛飾柴又店,東京都葛飾区柴又5-9-1,1210,20240302,1160,50
すき家,東京都,すき家 葛飾東新小岩店,東京都葛飾区東新小岩2-2-8,1210,20240302,1160,50
すき家,東京都,すき家 葛飾南水元店,東京都葛飾区南水元2-30-5,1220,20240302,1160,60
すき家,大阪府,すき家 蒲生四丁目店,大阪府大阪市城東区蒲生4-21-8,1120,20240302,1100,20
すき家,福岡県,すき家 苅田店,福岡県京都郡苅田町尾倉1-3-1,1020,20240302,1000,20
すき家,東京都,すき家 環七山王店,東京都大田区山王4-12-4,1300,20240302,1250,50
すき家,東京都,すき家 環七西新井店,東京都足立区西新井本町2-2-25,1210,20240302,1160,50
すき家,東京都,すき家 環七平和島店,東京都大田区大森本町2-30-2プレール大森EAST101号,1300,20240302,1250,50
すき家,東京都,すき家 環八羽田店,東京都大田区羽田4-3-3,1350,20240302,1300,50
すき家,東京都,すき家 環八蒲田四丁目店,東京都大田区蒲田4-42-12新生ビル1F,1300,20240302,1250,50
すき家,東京都,すき家 環八高井戸店,東京都杉並区高井戸西1-1-28,1250,20240302,1200,50
すき家,東京都,すき家 環八矢口渡店,東京都大田区多摩川1-7-11榎本ビル1F,1300,20240302,1250,50
すき家,大阪府,すき家 関目店,大阪府大阪市城東区成育2-13-15アイビーマンション1F,1150,20240302,1100,50
すき家,東京都,すき家 亀戸駅北口店,東京都江東区亀戸2-22-10カトウビル1F,1250,20240302,1200,50
すき家,東京都,すき家 久米川駅前店,東京都東村山市栄町2-9-32晃正プラザビル1F,1180,20240302,1150,30
すき家,宮崎県,すき家 宮崎新別府店,宮崎県宮崎市新別府町山宮986-6,1030,20240302,1000,30
すき家,茨城県,すき家 牛久店,茨城県牛久市栄町3-191-1,1030,20240302,1000,30
すき家,東京都,すき家 京王リトナード東府中店,東京都府中市清水ヶ丘1-8-3京王リトナード東府中1F,1200,20240302,1150,50
すき家,神奈川,すき家 京王稲田堤駅前店,神奈川県川崎市多摩区菅3-1-1,1180,20240302,1140,40
すき家,東京都,すき家 玉川学園駅前店,東京都町田市玉川学園7-5-2,1150,20240302,1130,20
すき家,群馬県,すき家 玉村上之手店,群馬県佐波郡玉村町大字上之手1628-2,1050,20240302,1020,30
すき家,群馬県,すき家 桐生新宿店,群馬県桐生市新宿3-2-14,1070,20240302,1050,20
すき家,群馬県,すき家 桐生相生店,群馬県桐生市相生町2-489-1,1070,20240302,1050,20
すき家,東京都,すき家 錦糸公園前店,東京都墨田区太平3-4-8グレイスMM1F,1250,20240302,1200,50
すき家,東京都,すき家 駒沢大学前店,東京都世田谷区駒沢1-20-4,1300,20240302,1250,50
すき家,熊本県,すき家 熊本四方寄店,熊本県熊本市北区四方寄町508-6,970,20240302,950,20
すき家,熊本県,すき家 熊本新市街店,熊本県熊本市中央区新市街7-25第二新世界会館ビル1F,1000,20240302,980,20
すき家,熊本県,すき家 熊本東BP店,熊本県熊本市東区下南部3-17-71,1000,20240302,970,30
すき家,埼玉県,すき家 戸田駅前店,埼玉県戸田市新曽668-2,1100,20240302,1080,20
すき家,東京都,すき家 虎ノ門四丁目店,東京都港区虎ノ門4-1-19,1350,20240302,1320,30
すき家,東京都,すき家 五反野店,東京都足立区足立3-34-5沼野ビル,1220,20240302,1160,60
すき家,東京都,すき家 御徒町駅南口店,東京都台東区上野5-27-2,1300,20240302,1250,50
すき家,広島県,すき家 広島丹那店,広島県広島市南区丹那町5-10,1100,20240302,1050,50
すき家,広島県,すき家 広島堀越店,広島県広島市南区堀越2-3-7,1100,20240302,1030,70
すき家,東京都,すき家 江古田駅前店,東京都練馬区旭丘1-71-7土井ビル1F,1250,20240302,1200,50
すき家,東京都,すき家 江戸川興宮店,東京都江戸川区興宮町33-17,1210,20240302,1160,50
すき家,東京都,すき家 江東塩浜店,東京都江東区塩浜2-14-3,1300,20240302,1250,50
すき家,東京都,すき家 江東区役所前店,東京都江東区東陽4-10-7,1280,20240302,1230,50
すき家,東京都,すき家 江東新砂店,東京都江東区新砂3-2-6SGHレジデンス新砂1F,1300,20240302,1230,70
すき家,東京都,すき家 江東千石店,東京都江東区千石2-9-9,1300,20240302,1230,70
すき家,東京都,すき家 港南四丁目店,東京都港区港南4-2-6,1380,20240302,1350,30
すき家,東京都,すき家 港南二丁目店,東京都港区港南2-4-7石橋ビル1F,1380,20240302,1350,30
すき家,東京都,すき家 高円寺駅南口店,東京都杉並区高円寺南4-45-2メインロードビル1F,1300,20240302,1250,50
すき家,群馬県,すき家 高崎IC店,群馬県高崎市島野町大岩996-1,1100,20240302,1050,50
すき家,群馬県,すき家 高崎棟高店,群馬県高崎市棟高町1868-113,1080,20240302,1050,30
すき家,香川県,すき家 高松郷東店,香川県高松市郷東町483-1,1050,20240302,1000,50
すき家,香川県,すき家 高松寿町店,香川県高松市寿町1-4-3高松中央通りビル1F,1050,20240302,1000,50
すき家,香川県,すき家 高松十川店,香川県高松市十川西町583-1,1050,20240302,1000,50
すき家,香川県,すき家 高松上天神店,香川県高松市上天神町217-1,1050,20240302,1000,50
すき家,香川県,すき家 高松中央IC店,香川県高松市木太町9区550-1,1050,20240302,1000,50
すき家,高知県,すき家 高知中万々店,高知県高知市中万々27-1,1000,20240302,950,50
すき家,高知県,すき家 高知本町店,高知県高知市本町1-2-1白木ビル1F,1020,20240302,1000,20
すき家,東京都,すき家 高田馬場駅北店,東京都豊島区高田3-15-7第1大島ビル1F,1300,20240302,1250,50
すき家,東京都,すき家 高田馬場店,東京都新宿区高田馬場1-28-4工新別館ビル,1300,20240302,1250,50
