吉野家,徳島県,吉野家 192号線佐古店,徳島県徳島市佐古七番町7‐2,1000,20231104,950,50
吉野家,北海道,吉野家 36号線苫小牧店,北海道苫小牧市若草町3丁目2‐2,1030,20231104,1000,30
吉野家,北海道,吉野家 38号線帯広店,北海道帯広市西1条南1‐1,1050,20231104,1030,20
吉野家,北海道,吉野家 環状通美園店,北海道札幌市豊平区美園4条6丁目3-10,1030,20231104,1000,30
吉野家,北海道,吉野家 千歳店,北海道千歳市北栄2丁目1345番29,1030,20231104,1000,30
吉野家,北海道,吉野家 大通西10丁目店,北海道札幌市中央区大通西10丁目4‐173,1030,20231104,1000,30
吉野家,北海道,吉野家 苫小牧新開町店,北海道苫小牧市新開町2‐2‐2,1030,20231104,1000,30
吉野家,北海道,吉野家 南郷通6丁目店,北海道札幌市白石区南郷通6丁目北42‐2,1030,20231104,1000,30
吉野家,北海道,吉野家 羊ヶ丘通清田店,北海道札幌市清田区清田2条3丁目3,1030,20231104,1000,30
松屋,東京都,松のや ル・シーニュ府中店/マイカリー食堂 ル・シーニュ府中店,東京都府中市宮町1-100 ル・シーニュ1-19,1450,20231104,1200,250
松屋,神奈川,松のや 下永谷店,神奈川県横浜市港南区下永谷5-3-10,1350,20231104,1130,220
松屋,神奈川,松のや 茅ヶ崎店,神奈川県茅ヶ崎市新栄町1-6 湘南ISビル,1150,20231104,1130,20
松屋,神奈川,松のや 上大岡西店/マイカリー食堂 上大岡西店,神奈川県横浜市港南区上大岡西2-1-19,1200,20231104,1130,70
松屋,東京都,松のや 西新宿店,東京都新宿区西新宿7-1-7,1500,20231104,1250,250
松屋,東京都,松のや 町田店,東京都町田市原町田4-4-14,1350,20231104,1130,220
松屋,神奈川,松のや 平塚店/マイカリー食堂 平塚店,神奈川県平塚市紅谷町5-14,1150,20231104,1130,20
松屋,愛知県,松屋 サテライト安城店,愛知県安城市住吉町荒曽根30‐8,1100,20231104,1050,50
松屋,愛知県,松屋 安城錦町店,愛知県安城市錦町8-5,1200,20231104,1100,100
松屋,愛知県,松屋 岡崎北店,愛知県岡崎市鴨田町字広元196,1150,20231104,1100,50
松屋,新潟県,松屋 亀田インター店,新潟県新潟市中央区姥ケ山63-1,1000,20231104,950,50
松屋,東京都,松屋 国分寺南口店/マイカリー食堂 国分寺南口店,東京都国分寺市南町3-16-6,1250,20231104,1150,100
松屋,東京都,松屋 三鷹店,東京都武蔵野市中町1-14-5 1F,1300,20231104,1250,50
松屋,東京都,松屋 三鷹南口店,東京都三鷹市下連雀3-34-22 ,1300,20231104,1250,50
松屋,東京都,松屋 小松川店,東京都江戸川区小松川3-90,1200,20231104,1150,50
松屋,新潟県,松屋 新潟駅前店,新潟県新潟市中央区東大通1-6-1,1000,20231104,950,50
松屋,新潟県,松屋 新潟女池店,新潟県新潟市中央区女池5-7-10,1000,20231104,950,50
松屋,新潟県,松屋 新潟米山店,新潟県新潟市中央区米山5-14-5,1000,20231104,950,50
松屋,新潟県,松屋 新潟豊栄店,新潟県新潟市北区かぶとやま2-2-58,1000,20231104,950,50
松屋,新潟県,松屋 新潟万代シテイ店,新潟県新潟市中央区万代1-1-22,1000,20231104,950,50
松屋,新潟県,松屋 新発田店/松のや 新発田店,新潟県新発田市小舟町1-7-6,1000,20231104,950,50
松屋,埼玉県,松屋 大宮桜木町店,埼玉県さいたま市大宮区桜木町2-472-3,1200,20231104,1100,100
松屋,埼玉県,松屋 大宮大成町店,埼玉県さいたま市大宮区大成町3-517,1200,20231104,1100,100
松屋,東京都,松屋 池袋アゼリア通り店,東京都豊島区西池袋5-2-10,1300,20231104,1200,100
松屋,東京都,松屋 池袋トキワ通店,東京都豊島区西池袋1丁目40番4号 川松ビル,1300,20231104,1200,100
松屋,東京都,松屋 東久留米下里店,東京都東久留米市下里3-24-12,1150,20231104,1113,37
松屋,東京都,松屋 東久留米店/マイカリー食堂 東久留米店,東京都東久留米市東本町1-8 神藤ビル1F,1150,20231104,1113,37
松屋,東京都,松屋 東久留米南町店,東京都東久留米市南町4-1-8,1150,20231104,1113,37
松屋,東京都,松屋 東池袋グリーン大通店,東京都豊島区東池袋1-25-17,1300,20231104,1200,100
松屋,東京都,松屋 南池袋店,東京都豊島区南池袋1-18-23,1300,20231104,1200,100
松屋,静岡県,松屋 日本坂PA（上り線）店,静岡県焼津市石脇上字西阿原751番1,1150,20231104,1050,100
松屋,愛知県,松屋 半田店/マイカリー食堂 半田店,愛知県半田市宮本町6-216-7,1200,20231104,1100,100
松屋,東京都,松屋 武蔵小金井店,東京都小金井市本町1-18-8桜並SHビル,1200,20231104,1113,87
松屋,愛知県,松屋 豊橋つつじが丘店,愛知県豊橋市つつじが丘1-6-10,1100,20231104,1050,50
松屋,愛知県,松屋 豊橋藤沢町店,愛知県豊橋市藤沢町138番,1100,20231104,1050,50
松屋,愛知県,松屋 豊田山之手店,愛知県豊田市山之手6-70,1200,20231104,1120,80
松屋,愛知県,松屋 豊田東新町店,愛知県豊田市東新町5-20-1,1150,20231104,1100,50
松屋,愛知県,松屋 豊明店/松のや 豊明店,愛知県豊明市西川町島原8-7,1200,20231104,1100,100
松屋,埼玉県,松屋 北浦和店,埼玉県さいたま市浦和区北浦和4-3-8 USビル1F,1200,20231104,1100,100
松屋,埼玉県,松屋 北浦和東口店,埼玉県さいたま市浦和区北浦和3-2-8,1200,20231104,1100,100
松屋,東京都,松屋 両国店,東京都墨田区横網1-3-8,1250,20231104,1200,50
松屋,東京都,松屋 茗荷谷店/マイカリー食堂 茗荷谷店,東京都文京区小日向4-6-23,1300,20231104,1200,100
