吉野家,岩手県,そば処吉野家 4号線花巻中央店,岩手県花巻市里川口町2‐2,800,850,50
吉野家,宮城県,そば処吉野家 イオンタウン仙台泉大沢店,宮城県仙台市泉区大沢一丁目5番地1,850,900,50
吉野家,栃木県,そば処吉野家 ジョイフル本田宇都宮店,栃木県河内郡上三川町大字磯岡421‐1,900,930,30
吉野家,群馬県,そば処吉野家 伊勢崎宮子店,群馬県伊勢崎市宮子町3450,870,900,30
吉野家,栃木県,そば処吉野家 宇都宮宮の内店,栃木県宇都宮市宮の内3丁目177‐1,900,930,30
吉野家,栃木県,そば処吉野家 宇都宮今泉店,栃木県宇都宮市中今泉5‐37‐4,900,930,30
吉野家,青森県,そば処吉野家 弘前中央通り店,青森県弘前市北瓦ヶ町7‐1,780,830,50
吉野家,山形県,そば処吉野家 山形西バイパス店,山形県山形市西田2‐24‐1,800,850,50
吉野家,宮城県,そば処吉野家 仙台小鶴店,宮城県仙台市宮城野区小鶴3‐9,850,900,50
吉野家,青森県,吉野家 102号線弘前高田店,青森県弘前市高田5丁目2番,780,830,50
吉野家,秋田県,吉野家 105号線由利本荘店,秋田県由利本荘市一番堰155‐1,780,830,50
吉野家,栃木県,吉野家 121号線鹿沼店,栃木県鹿沼市茂呂1059‐6,880,930,50
吉野家,山形県,吉野家 121号線米沢店,山形県米沢市徳町164‐5,800,850,50
吉野家,茨城県,吉野家 123号線茨城大学前店,茨城県水戸市堀町1066‐1,850,900,50
吉野家,秋田県,吉野家 13号線横手店,秋田県横手市前郷字下横山52‐1,810,850,40
吉野家,福島県,吉野家 13号線福島西バイパス店,福島県福島市北中央1丁目1‐1,850,900,50
吉野家,長野県,吉野家 141号線佐久平店,長野県佐久市佐久平駅南19‐1,850,900,50
吉野家,岐阜県,吉野家 156号線芥見店,岐阜県岐阜市芥見長山2‐118‐1,900,950,50
吉野家,富山県,吉野家 156号線砺波店,富山県砺波市太郎丸3‐94,900,950,50
吉野家,三重県,吉野家 165号線名張店,三重県名張市夏見坊垣3222‐2,900,950,50
吉野家,長野県,吉野家 18号線上田国分店,長野県上田市国分1‐962‐1,850,900,50
吉野家,岐阜県,吉野家 19号線恵那店,岐阜県恵那市長島町正家2丁目7‐2,900,950,50
吉野家,愛知県,吉野家 1号線御油店,愛知県豊川市御油町八面横40,900,950,50
吉野家,三重県,吉野家 1号線富洲原店,三重県三重郡川越町豊田318‐1,900,950,50
吉野家,愛知県,吉野家 1号線豊明店,愛知県豊明市前後町ほら貝1389‐1,950,1000,50
吉野家,愛知県,吉野家 23号線花田町店,愛知県豊橋市花田町荒木24‐1,950,1000,50
吉野家,三重県,吉野家 23号線白子店,三重県鈴鹿市白子駅前6‐39,900,950,50
吉野家,福井県,吉野家 27号線敦賀店,福井県敦賀市古田刈12‐1‐1,900,950,50
吉野家,山形県,吉野家 286号線山形南店,山形県山形市南原町2丁目8‐3,800,850,50
吉野家,青森県,吉野家 339号線五所川原店,青森県五所川原市烏森502番地,780,830,50
吉野家,茨城県,吉野家 349号線那珂菅谷店,茨城県那珂市竹ノ内1‐5‐16,850,900,50
吉野家,群馬県,吉野家 354号線館林店,群馬県館林市富士原町943‐1,850,900,50
吉野家,群馬県,吉野家 354号線大泉店,群馬県邑楽郡大泉町中央2丁目1436,870,900,30
吉野家,静岡県,吉野家 414号線沼津南店,静岡県沼津市上香貫1374,900,950,50
吉野家,岐阜県,吉野家 41号線高山店,岐阜県高山市上岡本町3‐78,900,950,50
吉野家,宮城県,吉野家 45号線塩竃店,宮城県塩竈市杉の入4丁目33番,800,850,50
吉野家,宮城県,吉野家 45号線気仙沼最知店,宮城県気仙沼市最知南最知2番8,850,900,50
吉野家,宮城県,吉野家 45号線仙台日の出町店,宮城県仙台市宮城野区日の出町2‐1‐16,850,900,50
吉野家,青森県,吉野家 45号線八戸類家店,青森県八戸市類家4‐1‐2,780,830,50
吉野家,岩手県,吉野家 46号線盛岡インター店,岩手県盛岡市前潟2‐1‐2,800,850,50
吉野家,岩手県,吉野家 4号線一関店,岩手県一関市山目字十二神19‐1,800,850,50
吉野家,福島県,吉野家 4号線黒岩店,福島県福島市黒岩字榎平58‐2,850,880,30
吉野家,岩手県,吉野家 4号線水沢店,岩手県奥州市水沢区佐倉河前田80‐1,800,850,50
吉野家,宮城県,吉野家 4号線大河原店,宮城県柴田郡大河原町20-5,850,880,30
吉野家,宮城県,吉野家 4号線白石店,宮城県白石市福岡蔵本字西町20、屋敷前112の一部,800,850,50
吉野家,宮城県,吉野家 4号線富谷店,宮城県黒川郡富谷町ひより台1丁目43番5,800,850,50
吉野家,福島県,吉野家 4号線福島伊達店,福島県伊達市坂ノ上8‐1,850,880,30
吉野家,福島県,吉野家 4号線福島東店,福島県福島市入江町14‐9,850,880,30
吉野家,岩手県,吉野家 4号線北上常盤台店,岩手県北上市常盤台4‐10‐44,800,850,50
吉野家,栃木県,吉野家 4号線矢板店,栃木県矢板市中930‐1,850,880,30
吉野家,群馬県,吉野家 50号線バイパス太田店,群馬県太田市丸山町1277番地,880,900,20
吉野家,群馬県,吉野家 50号線桐生店,群馬県桐生市広沢町3‐3780‐1,850,900,50
吉野家,茨城県,吉野家 50号線水戸バイパス店,茨城県水戸市河和田2丁目2229‐1,880,900,20
吉野家,茨城県,吉野家 6号線ひたちなか市毛店,茨城県ひたちなか市大字市毛922‐10,850,900,50
吉野家,茨城県,吉野家 6号線石岡店,茨城県石岡市大字石岡字外野3918‐2,880,900,20
吉野家,福島県,吉野家 6号線相馬店,福島県相馬市塚ノ町1丁目14番7,900,1000,100
吉野家,茨城県,吉野家 6号線日立中央店,茨城県日立市神峰町1‐8‐15,870,900,30
吉野家,山形県,吉野家 7号線酒田東町店,山形県酒田市東町2丁目1‐2,800,850,50
吉野家,青森県,吉野家 7号線青森西店,青森県青森市大字石江字高間39‐1,780,830,50
吉野家,山形県,吉野家 7号線鶴岡店,山形県鶴岡市美咲町21番8号,800,850,50
吉野家,秋田県,吉野家 7号線能代店,秋田県能代市字東大瀬2‐2,780,830,50
吉野家,富山県,吉野家 8号線高岡店,富山県高岡市西町4‐25,900,950,50
吉野家,福井県,吉野家 8号線鯖江店,福井県鯖江市東鯖江1-3-2,900,950,50
吉野家,石川県,吉野家 8号線小松店,石川県小松市今江町4‐157,900,950,50
吉野家,静岡県,吉野家 JR静岡駅店,静岡県静岡市葵区黒金町47,950,1000,50
吉野家,茨城県,吉野家 つくば台町店,茨城県つくば市台町2‐3‐14,900,950,50
吉野家,茨城県,吉野家 つくば大境店,茨城県つくば市西大橋593-10,900,950,50
吉野家,茨城県,吉野家 ひたちなか店,茨城県ひたちなか市笹野町1-3169-11,850,900,50
吉野家,栃木県,吉野家 アクロスプラザ足利店,栃木県足利市田中町95‐1,880,900,20
吉野家,栃木県,吉野家 カインズ宇都宮テクノ店,栃木県宇都宮市ゆいの杜5-26-5,910,930,20
吉野家,栃木県,吉野家 宇都宮パセオ店,栃木県宇都宮市川向町1番23番,900,930,30
吉野家,栃木県,吉野家 宇都宮競輪場通り店,栃木県宇都宮市上大曽町361‐1,900,930,30
吉野家,栃木県,吉野家 宇都宮細谷町店,栃木県宇都宮市細谷町326,900,930,30
吉野家,栃木県,吉野家 宇都宮城東店,栃木県宇都宮市城東1-10-26,900,930,30
吉野家,栃木県,吉野家 宇都宮南店,栃木県宇都宮市西川田町936‐6,900,930,30
吉野家,長野県,吉野家 塩尻店,長野県塩尻市大字広丘高出1783‐1,850,900,50
吉野家,愛知県,吉野家 岡崎南店,愛知県岡崎市若松東1‐3‐5,950,1000,50
吉野家,愛知県,吉野家 岡崎北店,愛知県岡崎市井ノ口新町1番3,950,1000,50
吉野家,静岡県,吉野家 掛川店,静岡県掛川市城西2‐5,900,930,30
吉野家,宮城県,吉野家 気仙沼店,宮城県気仙沼市田中前2丁目1‐5,850,900,50
吉野家,三重県,吉野家 亀山店,三重県亀山市東御幸町穴淵224‐2,900,950,50
吉野家,宮城県,吉野家 宮城佐沼店,宮城県登米市迫町佐沼字萩洗2丁目1番3,800,850,50
吉野家,富山県,吉野家 魚津店,富山県魚津市上村木字前飛地848‐2,900,950,50
吉野家,群馬県,吉野家 玉村上飯島店,群馬県佐波郡玉村町大字上飯島269番1,850,900,50
吉野家,石川県,吉野家 金沢新神田店,石川県金沢市新神田2丁目250番,900,950,50
吉野家,富山県,吉野家 高岡宝町店,富山県高岡市宝町2‐18,900,950,50
吉野家,青森県,吉野家 三沢松園町店,青森県三沢市松園町3‐1‐32,780,830,50
吉野家,愛知県,吉野家 市役所通り蒲郡店,愛知県蒲郡市竹谷町松本22‐1,900,950,50
吉野家,秋田県,吉野家 秋田駅ビルトピコ店,秋田県秋田市中通七丁目2番1号,800,830,30
吉野家,栃木県,吉野家 新4号線上三川店,栃木県河内郡上三川町しらさぎ1丁目6‐8,880,900,20
吉野家,茨城県,吉野家 水戸駅店,茨城県水戸市宮町1‐1‐1,880,900,20
吉野家,茨城県,吉野家 水戸笠原店,茨城県水戸市笠原町1194‐2,880,900,20
吉野家,茨城県,吉野家 水戸城南店,茨城県水戸市城南3‐7‐9,880,900,20
吉野家,岩手県,吉野家 盛岡バイパス上田店,岩手県盛岡市上田4‐17‐27,800,850,50
吉野家,岩手県,吉野家 盛岡南店,岩手県盛岡市津志田南1‐1‐40,800,850,50
吉野家,青森県,吉野家 青森駅前店,青森県青森市新町1‐1‐12,780,830,50
吉野家,静岡県,吉野家 静岡呉服町通り店,静岡県静岡市葵区紺屋町6‐12,950,1000,50
吉野家,宮城県,吉野家 石巻バイパス店,宮城県石巻市南中里4‐7‐19,850,950,100
吉野家,宮城県,吉野家 石巻大街道店,宮城県石巻市大街道西1-2-10,850,950,100
吉野家,愛知県,吉野家 赤塚パーキングエリア店,愛知県豊川市市田町北山7‐20,950,1000,50
吉野家,宮城県,吉野家 仙台イービーンズ店,宮城県仙台市青葉区中央4丁目1-1,850,900,50
吉野家,宮城県,吉野家 仙台駅東口店,宮城県仙台市宮城野区榴ヶ岡2‐1‐20HPビル1F,850,900,50
吉野家,宮城県,吉野家 仙台岡田店,宮城県仙台市宮城野区岡田北高屋敷30‐1,850,900,50
吉野家,宮城県,吉野家 仙台宮千代店,宮城県仙台市宮城野区宮千代2丁目2‐8,850,900,50
吉野家,宮城県,吉野家 仙台高砂店,宮城県仙台市宮城野区福室字高砂駅東7‐1,850,900,50
吉野家,宮城県,吉野家 仙台定禅寺通り店,宮城県仙台市青葉区国分町3‐1‐4,850,900,50
吉野家,宮城県,吉野家 仙台北目町通店,宮城県仙台市青葉区中央4丁目9番6‐2,850,900,50
吉野家,静岡県,吉野家 袋井店,静岡県袋井市川井字杉の木990‐5,900,930,30
吉野家,秋田県,吉野家 大館清水店,秋田県大館市清水2丁目1‐1,780,830,50
吉野家,静岡県,吉野家 長泉店,静岡県駿東郡長泉町納米里199‐1,900,950,50
吉野家,愛知県,吉野家 津島金柳店,愛知県津島市金柳町字観音堂20番,950,1000,50
吉野家,静岡県,吉野家 島田店,静岡県島田市中河町8964‐1,900,930,30
吉野家,茨城県,吉野家 日立川尻店,茨城県日立市川尻町4丁目29,850,900,50
吉野家,青森県,吉野家 八戸石堂店,青森県八戸市石堂2-21-8,780,830,50
吉野家,岐阜県,吉野家 美濃加茂店,岐阜県美濃加茂市山手町3‐126,900,950,50
吉野家,静岡県,吉野家 浜松駅店,静岡県浜松市中区砂山町322‐4,900,950,50
吉野家,福井県,吉野家 福井大手店,福井県福井市大手1丁目2－18,900,950,50
吉野家,福島県,吉野家 福島競馬場店,福島県福島市松浪町9-23福島競馬場内FF108,850,880,30
吉野家,三重県,吉野家 名四長島店,三重県桑名市長島町福吉字青鷺517‐1,900,1000,100
吉野家,愛知県,吉野家 名四飛島店,愛知県海部郡飛島村竹之郷2-18,950,1000,50
吉野家,宮城県,吉野家　仙台駅西口店,宮城県仙台市青葉区中央1‐7‐1第一志ら梅ビル1F,850,900,50
吉野家,宮城県,吉野家　仙台広瀬通り一番町店,宮城県仙台市青葉区国分町2‐1‐1,850,900,50
松屋,愛知県,松屋　R安城錦町店,愛知県安城市錦町8-5,900,950,50
松屋,千葉県,松屋　R浦安富士見店,千葉県浦安市富士見3-16-9,1000,1050,50
松屋,埼玉県,松屋　R浦和太田窪店,埼玉県さいたま市南区大字太田窪2840-2,1000,1050,50
松屋,愛知県,松屋　R刈谷日高店,愛知県刈谷市日高町4丁目611,950,1000,50
松屋,群馬県,松屋　R館林店,群馬県館林市松原3丁目16番5,920,950,30
松屋,石川県,松屋　R金沢工大前店,石川県石川郡野々市町扇が丘8-8,900,1000,100
松屋,石川県,松屋　R金沢示野店,石川県金沢市示野中町79街区1イオン金沢示野SC内,900,1000,100
松屋,石川県,松屋　R金沢増泉店,石川県金沢市神田2-2-25,900,1000,100
松屋,埼玉県,松屋　R川口上青木店,埼玉県川口市上青木2-47-1,1000,1050,50
松屋,埼玉県,松屋　R川口並木店,埼玉県川口市並木4-6-20,1000,1050,50
松屋,群馬県,松屋　R太田飯塚町店,群馬県太田市飯塚町1443,920,950,30
松屋,愛知県,松屋　R半田店,愛知県半田市宮本町6-216-7,900,950,50
松屋,富山県,松屋　R富山下赤江店,富山県富山市下赤江町1-1-69,950,1000,50
松屋,富山県,松屋　R富山掛尾店,富山県富山市掛尾町259,950,1000,50
松屋,富山県,松屋　R富山田中町店,富山県富山市田中町4-18-43,950,1000,50
松屋,富山県,松屋　R富山婦中店,富山県富山市婦中町下轡田428-4,950,1000,50
松屋,福井県,松屋　R福井御幸店,福井県福井市御幸4-20-8,900,950,50
松屋,福井県,松屋　R福井大和田店,福井県福井市大和田町29字39,900,950,50
松屋,愛知県,松屋　R豊明店,愛知県豊明市西川町島原8-7,900,950,50
松屋,埼玉県,松屋　R蕨北町店,埼玉県蕨市北町5-4-5,1000,1050,50
松屋,埼玉県,松屋　ふじみ野駅前店,埼玉県富士見市ふじみ野西1-20-2第7松本ビル1F,1000,1050,50
松屋,千葉県,松屋　浦安駅前店,千葉県浦安市当代島1-1-22,1000,1050,50
松屋,千葉県,松屋　浦安店,千葉県浦安市北栄1-15-5RECS浦安駅前,1000,1050,50
松屋,東京都,松屋　蒲田店,東京都大田区西蒲田7-2-3第2醍醐ビル,1000,1100,100
松屋,東京都,松屋　蒲田東口店,東京都大田区蒲田5-25-2コーポ橋本1F,1000,1100,100
松屋,東京都,松屋　後楽園店,東京都文京区本郷1-20-5杉浦ビル,1000,1100,100
松屋,東京都,松屋　神田小川町店,東京都千代田区神田小川町2-1-15 1､2F,1000,1100,100
松屋,東京都,松屋　神田須田町店,東京都千代田区神田須田町1-12-9富士第1ビル1F,1000,1100,100
松屋,東京都,松屋　神田南口店,東京都千代田区鍛冶町2丁目1-2神田南口鋭光ビル,1000,1100,100
松屋,東京都,松屋　水道橋店,東京都千代田区三崎町3-7-13三大ビル,1000,1100,100
松屋,東京都,松屋　西蒲田店,東京都大田区西蒲田8丁目24-8,1000,1100,100
松屋,東京都,松屋　浅草吾妻橋店,東京都台東区雷門2-19-13,1000,1100,100
松屋,東京都,松屋　浅草店,東京都台東区浅草1-12-8大山ビル,1000,1100,100
松屋,千葉県,松屋　船橋北口店,千葉県船橋市本町6-6-4北口スクエアビル,950,1000,50
松屋,東京都,松屋　大鳥居店,東京都大田区萩中3-6-5,1000,1100,100
松屋,千葉県,松屋　南行徳店,千葉県市川市相之川4-17-2メトロセンター南行徳,1000,1050,50
松屋,東京都,松屋　白山店,東京都文京区向丘1-9-23リーラ白山103,1040,1100,60
松屋,千葉県,松屋　幕張本郷1丁目店,千葉県千葉市花見川区幕張本郷1-3-1,950,1000,50
松屋,東京都,松屋　糀谷店,東京都大田区西糀谷4-14-12,1000,1100,100
すき家,神奈川,すき家 129号厚木山際(旧厚木北)店,神奈川県厚木市山際281-1,980,1000,20
すき家,長野県,すき家 141号佐久跡部店,長野県佐久市跡部46-4,920,960,40
すき家,長野県,すき家 18号小諸店,長野県小諸市諸1-5-11,920,960,40
すき家,静岡県,すき家 1国沼津共栄店,静岡県沼津市共栄町19-4,950,1000,50
すき家,静岡県,すき家 1国清水渋川店,静岡県静岡市清水区渋川477-4,950,1000,50
すき家,静岡県,すき家 1国静岡馬渕店,静岡県静岡市駿河区馬渕1-17-38,980,1000,20
すき家,静岡県,すき家 1国富士鮫島店,静岡県富士市鮫島360-1,950,1000,50
すき家,神奈川,すき家 255号小田原成田(旧小田原東)店,神奈川県小田原市成田408-1,1000,1020,20
すき家,神奈川,すき家 412号厚木中荻野店,神奈川県厚木市中荻野580-1,980,1000,20
すき家,静岡県,すき家 52号清水興津店,静岡県静岡市清水区興津中町字金山下1371-1,950,1000,50
すき家,神奈川,すき家 ソニー厚木テクノロジーセンター店,神奈川県厚木市旭町4-14-1,980,1000,20
すき家,神奈川,すき家 海老名さがみ野(旧海老名東)店,神奈川県海老名市東柏ヶ谷6-21-20,1000,1020,20
すき家,神奈川,すき家 海老名河原口店,神奈川県海老名市河原口5-4-28,1000,1020,20
すき家,神奈川,すき家 海老名上河内店,神奈川県海老名市上河内297-3,1000,1020,20
すき家,神奈川,すき家 寒川宮山店,神奈川県高座郡寒川町宮山3460-1,1000,1050,50
すき家,長野県,すき家 佐久店,長野県佐久市大字長土呂260-1,920,960,40
すき家,神奈川,すき家 小田原早川(旧小田原西)店,神奈川県小田原市早川3-19-6,1000,1020,20
すき家,静岡県,すき家 裾野二ツ屋店,静岡県裾野市二ツ屋155-1,1000,1050,50
すき家,静岡県,すき家 清水IC店,静岡県静岡市清水区八坂東2-16-21,950,1000,50
すき家,静岡県,すき家 清水鳥坂店,静岡県静岡市清水区鳥坂字山鼻1231-1,950,1000,50
すき家,静岡県,すき家 静岡安西店,静岡県静岡市葵区安西1-2-18,1000,1050,50
すき家,静岡県,すき家 静岡八幡店,静岡県静岡市駿河区八幡2-14-16,980,1000,20
すき家,静岡県,すき家 静岡流通通り店,静岡県静岡市葵区千代田7-9-25,1000,1050,50
すき家,静岡県,すき家 長泉下土狩店,静岡県駿東郡長泉町下土狩429-1-1,950,1000,50
すき家,神奈川,すき家 二宮店,神奈川県中郡二宮町二宮1352-4,1000,1020,20
すき家,静岡県,すき家 富士厚原店,静岡県富士市厚原99-5,950,1000,50
