吉野家,東京都,吉野家 護国寺店,東京都文京区音羽2丁目2‐2,1250,20240302,1200,50
吉野家,神奈川,吉野家 向ヶ丘駅前店,神奈川県川崎市多摩区登戸2737‐5,1200,20240302,1150,50
吉野家,東京都,吉野家 江古田南口店,東京都練馬区豊玉上1丁目10‐10,1300,20240302,1200,100
吉野家,大阪府,吉野家 江坂駅東店,大阪府吹田市江坂町1丁目22‐12,1150,20240302,1100,50
吉野家,福岡県,吉野家 港町店,福岡県福岡市中央区港2丁目7‐7,1100,20240302,1050,50
吉野家,東京都,吉野家 甲州街道府中白糸台店,東京都府中市若松町1丁目25‐6,1250,20240302,1200,50
吉野家,東京都,吉野家 高円寺駅前店,東京都杉並区高円寺北2丁目4‐7,1250,20240302,1200,50
吉野家,富山県,吉野家 高岡上北島店,富山県高岡市上北島40‐1,1100,20240302,1050,50
吉野家,香川県,吉野家 高松屋島店,香川県高松市新田町甲69番地5,1000,20240302,950,50
吉野家,香川県,吉野家 高松中央インター店,香川県高松市木太町581‐4,1050,20240302,1000,50
吉野家,大阪府,吉野家 高槻若松町店,大阪府高槻市若松町3‐6,1130,20240302,1100,30
吉野家,東京都,吉野家 高田馬場駅前店,東京都新宿区高田馬場1丁目26‐12,1400,20240302,1300,100
吉野家,東京都,吉野家 高島平大門店,東京都板橋区高島平3丁目3‐2,1200,20240302,1150,50
吉野家,愛知県,吉野家 高浜沢渡町店,愛知県高浜市沢渡町5丁目5‐10,1100,20240302,1050,50
吉野家,大阪府,吉野家 鴻池新田店,大阪府東大阪市中鴻池町2丁目1‐7,1130,20240302,1080,50
吉野家,愛知県,吉野家 国際センター店,愛知県名古屋市中村区那古野1丁目46‐12,1150,20240302,1100,50
吉野家,東京都,吉野家 国分寺北口店,東京都国分寺市本町2丁目10‐5,1250,20240302,1150,100
吉野家,東京都,吉野家 国立府中インター店,東京都国立市谷保620‐1,1200,20240302,1150,50
吉野家,大阪府,吉野家 今里店,大阪府大阪市東成区大今里西1丁目30‐10,1120,20240302,1080,40
吉野家,東京都,吉野家 根津店,東京都文京区根津2丁目18‐12,1250,20240302,1200,50
吉野家,山口県,吉野家 佐波川SA下り店,山口県防府市佐野452‐2,1100,20240302,980,120
吉野家,山口県,吉野家 佐波川SA上り店,山口県防府市佐野1431,1100,20240302,980,120
吉野家,香川県,吉野家 坂出店,香川県坂出市元町3丁目5‐2,1100,20240302,980,120
吉野家,大阪府,吉野家 阪急茨木市駅前店,大阪府茨木市別院町3‐1,1130,20240302,1100,30
吉野家,京都府,吉野家 阪急西院店,京都府京都市右京区西院高山寺町12‐1,1150,20240302,1050,100
吉野家,大阪府,吉野家 阪南鳥取店,大阪府阪南市黒田705‐1,1100,20240302,1080,20
吉野家,大阪府,吉野家 堺インター店,大阪府堺市中区平井775‐1,1130,20240302,1080,50
吉野家,大阪府,吉野家 堺石津川店,大阪府堺市西区浜寺石津町西2丁322‐1,1120,20240302,1100,20
吉野家,大阪府,吉野家 堺東駅前店,大阪府堺市堺区中瓦町2丁目3‐26,1120,20240302,1080,40
吉野家,大阪府,吉野家 桜橋店,大阪府大阪市北区曽根崎新地2丁目1‐21,1170,20240302,1140,30
吉野家,東京都,吉野家 笹塚京王クラウン街店,東京都渋谷区笹塚1‐55‐16,1300,20240302,1200,100
吉野家,埼玉県,吉野家 三郷上彦名店,埼玉県三郷市上彦名417‐1,1150,20240302,1100,50
吉野家,埼玉県,吉野家 三郷中央店,埼玉県三郷市中央5丁目45‐6,1150,20240302,1100,50
吉野家,東京都,吉野家 三軒茶屋店,東京都世田谷区太子堂2丁目16‐8,1400,20240302,1300,100
吉野家,山口県,吉野家 山陽小野田店,山口県山陽小野田市日の出2丁目8-4,1000,20240302,980,20
吉野家,埼玉県,吉野家 産業道路さいたま上木崎店,埼玉県さいたま市浦和区上木崎4丁目12‐12,1150,20240302,1100,50
吉野家,東京都,吉野家 四ッ谷駅前店,東京都新宿区四谷1丁目8‐14,1400,20240302,1200,200
吉野家,東京都,吉野家 市ヶ谷駅前店,東京都千代田区五番町3‐3,1400,20240302,1300,100
吉野家,愛知県,吉野家 市大病院前店,愛知県名古屋市瑞穂区瑞穂通1丁目2,1100,20240302,1050,50
吉野家,東京都,吉野家 市谷本村町1F店,東京都新宿区市谷本村町5番‐1号,1400,20240302,1300,100
吉野家,愛知県,吉野家 市役所通り蒲郡店,愛知県蒲郡市竹谷町松本22‐1,1100,20240302,1050,50
吉野家,東京都,吉野家 志村坂上店,東京都板橋区志村2‐1‐4,1200,20240302,1150,50
吉野家,埼玉県,吉野家 志木南口店,埼玉県新座市東北2丁目38‐1,1150,20240302,1100,50
吉野家,大阪府,吉野家 寺田町駅前店,大阪府大阪市天王寺区大道4丁目10‐9,1150,20240302,1100,50
吉野家,鹿児島,吉野家 鹿屋店,鹿児島県鹿屋市寿2丁目8‐7,1000,20240302,950,50
吉野家,東京都,吉野家 芝大門店,東京都港区芝大門2丁目1‐2,1350,20240302,1300,50
吉野家,大阪府,吉野家 守口駅前店,大阪府守口市京阪本通2丁目15‐13,1130,20240302,1100,30
吉野家,東京都,吉野家 秋葉原中央通り店,東京都千代田区外神田1丁目11‐8,1350,20240302,1300,50
吉野家,東京都,吉野家 秋葉原店,東京都千代田区神田松永町10‐1,1350,20240302,1300,50
吉野家,大阪府,吉野家 住之江公園店,大阪府大阪市住之江区南加賀屋2丁目8‐26,1100,20240302,1080,20
吉野家,大阪府,吉野家 十三店,大阪府大阪市淀川区十三本町1丁目8‐17,1150,20240302,1100,50
吉野家,東京都,吉野家 渋谷109前店,東京都渋谷区道玄坂2丁目5‐7,1500,20240302,1400,100
吉野家,福岡県,吉野家 春吉店,福岡県福岡市中央区春吉3丁目21‐21,1100,20240302,1000,100
吉野家,愛知県,吉野家 春日井出川町店,愛知県春日井市出川町8丁目10‐6,1100,20240302,1050,50
吉野家,愛知県,吉野家 春日井店,愛知県春日井市鳥居松町1丁目15‐297,1100,20240302,1050,50
吉野家,福岡県,吉野家 春日宝町店,福岡県春日市宝町4丁目24‐6,980,20240302,950,30
吉野家,埼玉県,吉野家 所沢駅前店,埼玉県所沢市日吉町11‐20,1150,20240302,1100,50
吉野家,愛知県,吉野家 小割通店,愛知県名古屋市港区小割通3丁目1,1100,20240302,1050,50
吉野家,神奈川,吉野家 小田急新百合ヶ丘駅店,神奈川県川崎市麻生区万福寺1‐18‐1,1200,20240302,1150,50
吉野家,神奈川,吉野家 小田急登戸駅店,神奈川県川崎市多摩区登戸3437‐2,1300,20240302,1200,100
吉野家,愛知県,吉野家 庄内緑地公園店,愛知県名古屋市西区南川町15,1150,20240302,1100,50
吉野家,東京都,吉野家 昭島モリタウン店,東京都昭島市田中町562‐1,1200,20240302,1150,50
吉野家,京都府,吉野家 松井山手店,京都府八幡市美濃山出口38‐1,1100,20240302,1070,30
吉野家,千葉県,吉野家 松戸西口店,千葉県松戸市本町20‐2,1200,20240302,1150,50
吉野家,島根県,吉野家 松江学園通り店,島根県松江市学園1丁目17‐20,1000,20240302,950,50
吉野家,愛媛県,吉野家 松山枝松店,愛媛県松山市枝松1丁目9‐8,1000,20240302,950,50
吉野家,愛媛県,吉野家 松山竹原店,愛媛県松山市竹原2丁目1‐39,1100,20240302,950,150
吉野家,愛知県,吉野家 松葉公園店,愛知県名古屋市中川区太平通1丁目13,1150,20240302,1100,50
吉野家,愛知県,吉野家 上社店,愛知県名古屋市名東区上社2丁目241,1150,20240302,1100,50
吉野家,大阪府,吉野家 上新庄駅前店,大阪府大阪市東淀川区上新庄2丁目24‐24,1130,20240302,1100,30
吉野家,埼玉県,吉野家 上尾駅前店,埼玉県上尾市谷津2丁目1‐50‐1,1150,20240302,1100,50
吉野家,東京都,吉野家 上北沢店,東京都世田谷区上北沢5丁目2‐4,1300,20240302,1200,100
吉野家,大阪府,吉野家 上本町店,大阪府大阪市天王寺区上本町6丁目6‐23,1150,20240302,1100,50
吉野家,大阪府,吉野家 城北公園前店,大阪府大阪市旭区生江三丁目16‐34,1120,20240302,1070,50
吉野家,大阪府,吉野家 寝屋川市駅前店,大阪府寝屋川市早子町23‐2,1130,20240302,1100,30
吉野家,大阪府,吉野家 寝屋川昭栄町店,大阪府寝屋川市昭栄町16‐8,1130,20240302,1100,30
吉野家,大阪府,吉野家 寝屋川仁和寺店,大阪府寝屋川市仁和寺町12‐15,1130,20240302,1100,30
吉野家,愛媛県,吉野家 新居浜神郷店,愛媛県新居浜市神郷1丁目41,1100,20240302,1030,70
吉野家,愛媛県,吉野家 新居浜店,愛媛県新居浜市松木町4‐14,1100,20240302,1030,70
吉野家,東京都,吉野家 新橋烏森口店,東京都港区新橋3丁目16‐3,1400,20240302,1300,100
吉野家,東京都,吉野家 新橋東店,東京都港区新橋2丁目18‐5,1350,20240302,1300,50
吉野家,東京都,吉野家 新宿センタービル店,東京都新宿区西新宿1丁目25‐1,1400,20240302,1300,100
吉野家,東京都,吉野家 新宿一丁目店,東京都新宿区新宿1丁目33‐10,1400,20240302,1300,100
吉野家,東京都,吉野家 新宿京王モール店,東京都新宿区西新宿1丁目1,1400,20240302,1300,100
吉野家,東京都,吉野家 新宿四丁目店,東京都新宿区新宿4丁目3‐22,1400,20240302,1300,100
吉野家,東京都,吉野家 新宿靖国通り店,東京都新宿区歌舞伎町1‐6‐3,1400,20240302,1300,100
吉野家,埼玉県,吉野家 新所沢店,埼玉県所沢市けやき台1丁目13‐6,1150,20240302,1100,50
吉野家,東京都,吉野家 新青梅街道島忠小平店,東京都東久留米市前沢5丁目33‐17,1250,20240302,1150,100
吉野家,東京都,吉野家 新青梅街道東大和店,東京都東大和市蔵敷3丁目889‐1,1200,20240302,1150,50
吉野家,東京都,吉野家 新大久保駅前店,東京都新宿区百人町2丁目4‐1,1400,20240302,1300,100
吉野家,兵庫県,吉野家 新長田店,兵庫県神戸市長田区大橋町4丁目3‐5,1100,20240302,1001,99
吉野家,神奈川,吉野家 新百合ヶ丘津久井道店,神奈川県川崎市麻生区片平1丁目7‐5,1200,20240302,1150,50
吉野家,兵庫県,吉野家 神戸伊川谷店,兵庫県神戸市西区伊川谷町潤和1155‐1,1080,20240302,1030,50
吉野家,兵庫県,吉野家 神戸名谷インター店,兵庫県神戸市垂水区名谷町997‐4,1100,20240302,1080,20
吉野家,東京都,吉野家 神谷町店,東京都港区虎ノ門5丁目11‐15,1350,20240302,1300,50
吉野家,愛知県,吉野家 甚目寺店,愛知県あま市下萱津五反田57,1150,20240302,1100,50
吉野家,兵庫県,吉野家 須磨パティオ店,兵庫県神戸市須磨区中落合2丁目2‐1,1080,20240302,1030,50
吉野家,大阪府,吉野家 吹田山田店,大阪府吹田市山田西2丁目7‐14,1200,20240302,1100,100
吉野家,東京都,吉野家 聖蹟桜ヶ丘店,東京都多摩市関戸2丁目41‐1,1200,20240302,1150,50
吉野家,東京都,吉野家 西荻窪駅前店,東京都杉並区西荻北3丁目19‐3,1250,20240302,1200,50
吉野家,兵庫県,吉野家 西宮久保店,兵庫県西宮市久保町11-1,1080,20240302,1001,79
吉野家,兵庫県,吉野家 西宮山口町店,兵庫県西宮市山口町名来2丁目19,1080,20240302,1030,50
吉野家,京都府,吉野家 西京極七条店,京都府京都市右京区西京極佃田町17,1150,20240302,1100,50
吉野家,東京都,吉野家 西新宿8丁目店,東京都新宿区西新宿8丁目4‐1,1300,20240302,1200,100
吉野家,千葉県,吉野家 西船橋店,千葉県船橋市西船4丁目21‐17,1200,20240302,1150,50
吉野家,東京都,吉野家 西大島店,東京都江東区大島1丁目30‐9,1300,20240302,1250,50
吉野家,大阪府,吉野家 西田辺店,大阪府大阪市阿倍野区西田辺町1丁目17‐1,1100,20240302,1080,20
吉野家,東京都,吉野家 西日暮里店,東京都荒川区西日暮里5丁目14‐11,1300,20240302,1200,100
吉野家,東京都,吉野家 西八王子駅北口店,東京都八王子市千人町2丁目20‐2,1200,20240302,1150,50
吉野家,東京都,吉野家 青山一丁目店,東京都港区北青山1丁目3‐3,1400,20240302,1300,100
吉野家,静岡県,吉野家 静岡SBS通り店,静岡県静岡市駿河区中田4丁目7‐21,1050,20240302,1000,50
吉野家,静岡県,吉野家 静岡呉服町通り店,静岡県静岡市葵区紺屋町6‐12,1100,20240302,1050,50
吉野家,静岡県,吉野家 静岡瀬名川店,静岡県静岡市葵区瀬名川2丁目4‐10,1050,20240302,1000,50
吉野家,東京都,吉野家 赤羽東口店,東京都北区赤羽1丁目10‐2,1300,20240302,1200,100
吉野家,愛知県,吉野家 赤塚パーキングエリア店,愛知県豊川市市田町北山7‐20,1200,20240302,1100,100
吉野家,大阪府,吉野家 摂津鳥飼店,大阪府摂津市鳥飼上4丁目1‐38,1130,20240302,1100,30
吉野家,大阪府,吉野家 摂津別府店,大阪府摂津市東別府3丁目6‐12,1130,20240302,1100,30
吉野家,愛知県,吉野家 千音寺店,愛知県名古屋市中川区吉津1丁目1808,1150,20240302,1100,50
吉野家,愛知県,吉野家 千種駅前店,愛知県名古屋市千種区今池1丁目1‐1,1150,20240302,1100,50
吉野家,大阪府,吉野家 千日前店,大阪府大阪市中央区難波千日前12‐41,1200,20240302,1150,50
吉野家,東京都,吉野家 川越街道成増店,東京都板橋区成増1丁目28‐14,1200,20240302,1150,50
吉野家,埼玉県,吉野家 川口駅東口店,埼玉県川口市川口1丁目1‐1,1250,20240302,1200,50
吉野家,埼玉県,吉野家 川口芝店,埼玉県川口市芝3丁目19‐4,1200,20240302,1150,50
吉野家,埼玉県,吉野家 川口上青木店,埼玉県川口市上青木1丁目5‐6,1150,20240302,1100,50
吉野家,埼玉県,吉野家 川口柳崎店,埼玉県川口市柳崎3丁目9‐2,1150,20240302,1100,50
吉野家,神奈川,吉野家 川崎駅前店,神奈川県川崎市川崎区駅前本町2‐1,1250,20240302,1200,50
吉野家,東京都,吉野家 浅草通り稲荷町店,東京都台東区東上野3丁目33‐8,1300,20240302,1250,50
吉野家,大阪府,吉野家 船場中央店,大阪府大阪市中央区南本町2丁目6‐8,1180,20240302,1150,30
吉野家,東京都,吉野家 祖師ケ谷大蔵駅前店,東京都世田谷区砧6丁目39‐6,1300,20240302,1250,50
吉野家,岡山県,吉野家 倉敷市役所前店,岡山県倉敷市白楽町418‐5,1100,20240302,1000,100
吉野家,福岡県,吉野家 早良街道西新店,福岡県福岡市早良区曙1丁目13‐25,1000,20240302,980,20
吉野家,東京都,吉野家 巣鴨南口店,東京都豊島区巣鴨1丁目12‐3,1300,20240302,1250,50
吉野家,神奈川,吉野家 相模大野駅前店,神奈川県相模原市南区相模大野3丁目10‐8,1200,20240302,1150,50
吉野家,岡山県,吉野家 総社店,岡山県総社市中央5丁目10‐102,1100,20240302,1000,100
吉野家,大阪府,吉野家 太子堂店,大阪府八尾市南太子堂2丁目1‐59,1100,20240302,1080,20
吉野家,愛知県,吉野家 打越店,愛知県名古屋市千種区星ヶ丘2丁目80,1150,20240302,1100,50
吉野家,静岡県,吉野家 袋井店,静岡県袋井市川井杉の木990‐5,1050,20240302,1000,50
吉野家,東京都,吉野家 大井町西口店,東京都品川区大井1丁目1‐16,1300,20240302,1200,100
吉野家,愛媛県,吉野家 大街道店,愛媛県松山市大街道2丁目6‐2,1100,20240302,950,150
吉野家,埼玉県,吉野家 大宮西口店,埼玉県さいたま市大宮区桜木町1丁目1‐11,1250,20240302,1200,50
吉野家,奈良県,吉野家 大宮通り芝辻町店,奈良県奈良市芝辻町1丁目3‐23,1000,20240302,980,20
吉野家,埼玉県,吉野家 大宮店,埼玉県さいたま市大宮区仲町1丁目97,1250,20240302,1200,50
吉野家,埼玉県,吉野家 大宮東口店,埼玉県さいたま市大宮区大門町1丁目17‐1,1300,20240302,1200,100
吉野家,大阪府,吉野家 大国町店,大阪府大阪市浪速区敷津東2丁目5‐11,1200,20240302,1100,100
吉野家,大阪府,吉野家 大阪駅前第3ビル店,大阪府大阪市北区梅田1丁目1‐3,1170,20240302,1140,30
吉野家,大阪府,吉野家 大阪京橋店,大阪府大阪市都島区東野田町5丁目2‐28,1150,20240302,1100,50
吉野家,大阪府,吉野家 大阪空港前店,大阪府豊中市蛍池西町2丁目141‐6,1150,20240302,1100,50
吉野家,東京都,吉野家 大崎ニューシティ店,東京都品川区大崎一丁目6番5号,1350,20240302,1300,50
吉野家,東京都,吉野家 大山駅前店,東京都板橋区大山町4‐6,1200,20240302,1150,50
吉野家,大阪府,吉野家 大正店,大阪府大阪市大正区三軒家東1丁目19‐9,1150,20240302,1100,50
吉野家,東京都,吉野家 大泉学園北口店,東京都練馬区東大泉1丁目29‐7,1300,20240302,1200,100
吉野家,大阪府,吉野家 大池橋店,大阪府大阪市生野区中川西3丁目5-32,1100,20240302,1080,20
吉野家,滋賀県,吉野家 大津膳所店,滋賀県大津市におの浜3丁目1‐57,1100,20240302,1050,50
吉野家,愛知県,吉野家 大津通栄店,愛知県名古屋市中区栄3丁目27‐7,1200,20240302,1100,100
吉野家,東京都,吉野家 大塚店,東京都豊島区南大塚2丁目46‐3,1300,20240302,1250,50
吉野家,奈良県,吉野家 大和郡山店,奈良県大和郡山市柳町80‐1,1020,20240302,1000,20
吉野家,奈良県,吉野家 大和高田東室店,奈良県大和高田市曽大根1丁目1‐5,1020,20240302,1000,20
吉野家,愛知県,吉野家 第2環状線笹原店,愛知県名古屋市天白区福池2丁目419,1100,20240302,1050,50
吉野家,東京都,吉野家 池袋北口店,東京都豊島区西池袋1丁目24‐1,1400,20240302,1300,100
吉野家,福岡県,吉野家 築港本町店,福岡県福岡市博多区神屋町9‐14,1200,20240302,1050,150
吉野家,大阪府,吉野家 中央大通深江橋店,大阪府大阪市東成区東今里2丁目2‐6,1130,20240302,1100,30
吉野家,大阪府,吉野家 中環学園町店,大阪府摂津市学園町1丁目7‐44,1130,20240302,1100,30
吉野家,大阪府,吉野家 中環松原丹南店,大阪府松原市丹南4丁目1‐4,1100,20240302,1080,20
吉野家,大阪府,吉野家 中環東大阪若江店,大阪府東大阪市若江南町3丁目8‐53,1100,20240302,1080,20
吉野家,愛知県,吉野家 中村公園店,愛知県名古屋市中村区太閤通9丁目15‐2,1150,20240302,1100,50
吉野家,大阪府,吉野家 中百舌鳥店,大阪府堺市北区百舌鳥梅町2丁3‐3,1100,20240302,1080,20
吉野家,東京都,吉野家 中目黒駅前店,東京都目黒区上目黒3丁目3‐5,1400,20240302,1300,100
吉野家,東京都,吉野家 中野野方店,東京都中野区野方5‐23‐6 ,1250,20240302,1200,50
吉野家,埼玉県,吉野家 朝霞台駅南口店,埼玉県朝霞市東弁財1丁目4‐17,1150,20240302,1100,50
吉野家,大阪府,吉野家 朝潮橋店,大阪府大阪市港区八幡屋1丁目1‐15,1150,20240302,1100,50
吉野家,東京都,吉野家 町田街道小山町店,東京都町田市小山町3647‐1,1200,20240302,1120,80
吉野家,東京都,吉野家 町田根岸店,東京都町田市根岸町1019‐8,1200,20240302,1150,50
吉野家,東京都,吉野家 町田小川店,東京都町田市小川3丁目2‐1,1200,20240302,1150,50
吉野家,東京都,吉野家 調布駅前店,東京都調布市布田1丁目37‐16,1250,20240302,1150,100
吉野家,愛知県,吉野家 長久手南店,愛知県長久手市市が洞3丁目1802,1150,20240302,1100,50
吉野家,大阪府,吉野家 長居店,大阪府大阪市住吉区長居東4丁目2‐3,1100,20240302,1080,20
吉野家,静岡県,吉野家 長泉店,静岡県駿東郡長泉町納米里199‐1,1050,20240302,1000,50
吉野家,三重県,吉野家 津駅チャム店,三重県津市羽所町1191‐1,1050,20240302,1000,50
吉野家,大阪府,吉野家 鶴橋駅前店,大阪府大阪市東成区東小橋3丁目16‐2,1180,20240302,1100,80
吉野家,大阪府,吉野家 帝塚山店,大阪府大阪市阿倍野区帝塚山1丁目12-6,1100,20240302,1080,20
吉野家,大阪府,吉野家 天下茶屋店,大阪府大阪市西成区岸里1丁目2‐9,1150,20240302,1100,50
吉野家,福岡県,吉野家 天神サザン通り店,福岡県福岡市中央区天神2丁目6‐32,1100,20240302,1000,100
吉野家,愛知県,吉野家 伝馬町店,愛知県名古屋市熱田区神宮2丁目6‐12,1100,20240302,1050,50
吉野家,東京都,吉野家 田端店,東京都北区田端新町2丁目8‐8,1300,20240302,1200,100
吉野家,東京都,吉野家 田町駅芝浦店,東京都港区芝浦3丁目15‐7,1350,20240302,1300,50
吉野家,静岡県,吉野家 島田店,静岡県島田市中河町8964‐1,1050,20240302,1000,50
吉野家,埼玉県,吉野家 東浦和店,埼玉県さいたま市緑区東浦和8丁目1‐13,1150,20240302,1100,50
吉野家,岡山県,吉野家 東岡山店,岡山県岡山市中区神下104‐1,1000,20240302,950,50
吉野家,東京都,吉野家 東久留米下里店,東京都東久留米市下里1丁目10‐4,1250,20240302,1150,100
吉野家,東京都,吉野家 東京工科大学店,東京都八王子市片倉町1404‐1,1200,20240302,1150,50
吉野家,東京都,吉野家 東銀座店,東京都中央区銀座3丁目11‐11,1350,20240302,1300,50
吉野家,東京都,吉野家 東小金井駅前店,東京都小金井市梶野町5丁目2‐37,1250,20240302,1150,100
吉野家,大阪府,吉野家 東心斎橋店,大阪府大阪市中央区東心斎橋1丁目10番15号,1200,20240302,1150,50
吉野家,大阪府,吉野家 東大阪八戸ノ里店,大阪府東大阪市御厨南2丁目4‐3,1100,20240302,1080,20
吉野家,兵庫県,吉野家 東灘御影店,兵庫県神戸市東灘区御影中町2丁目2‐14,1080,20240302,1001,79
吉野家,静岡県,吉野家 藤枝小石川店,静岡県藤枝市小石川町1丁目6‐19,1050,20240302,1000,50
吉野家,奈良県,吉野家 奈良広陵町店,奈良県北葛城郡広陵町大塚905‐1,1020,20240302,1000,20
吉野家,福岡県,吉野家 南バイパス太宰府店,福岡県太宰府市梅香苑1丁目1‐41,980,20240302,950,30
吉野家,埼玉県,吉野家 南越谷店,埼玉県越谷市南越谷1丁目23‐1,1150,20240302,1100,50
吉野家,大阪府,吉野家 南港通り平野店,大阪府大阪市平野区平野西1丁目1-6,1120,20240302,1080,40
吉野家,東京都,吉野家 南池袋店,東京都豊島区南池袋2丁目26‐4,1350,20240302,1300,50
吉野家,兵庫県,吉野家 尼崎昭和通店,兵庫県尼崎市昭和通8丁目270‐1,1100,20240302,1050,50
吉野家,兵庫県,吉野家 尼崎尾浜店,兵庫県尼崎市尾浜町1丁目29‐1,1100,20240302,1050,50
吉野家,福岡県,吉野家 博多祇園店,福岡県福岡市博多区祇園町6‐45,1100,20240302,1000,100
吉野家,東京都,吉野家 八王子南口店,東京都八王子市子安町1丁目3‐11,1200,20240302,1150,50
吉野家,京都府,吉野家 八幡久保田店,京都府八幡市八幡久保田35‐23,1100,20240302,1070,30
吉野家,福岡県,吉野家 八幡折尾店,福岡県北九州市八幡西区丸尾町6‐9,1000,20240302,950,50
吉野家,大阪府,吉野家 八尾高安店,大阪府八尾市高安町北7丁目178‐6,1100,20240302,1080,20
吉野家,長野県,吉野家 飯田インター店,長野県飯田市育良町3‐1‐14,1100,20240302,1000,100
吉野家,長野県,吉野家 飯田大門町店,長野県飯田市大門町85‐1,1100,20240302,1000,100
吉野家,埼玉県,吉野家 飯能駅前店,埼玉県飯能市仲町11‐21,1100,20240302,1050,50
吉野家,静岡県,吉野家 磐田二之宮店,静岡県磐田市二之宮東13‐3,1050,20240302,1000,50
吉野家,大阪府,吉野家 肥後橋店,大阪府大阪市西区京町堀1丁目7‐4,1150,20240302,1100,50
吉野家,愛知県,吉野家 尾西店,愛知県一宮市三条道東45‐1,1100,20240302,1050,50
吉野家,愛知県,吉野家 尾張旭印場店,愛知県尾張旭市白鳳町2丁目32,1100,20240302,1050,50
吉野家,愛知県,吉野家 尾張旭三郷店,愛知県尾張旭市井田町1丁目85,1100,20240302,1050,50
吉野家,愛知県,吉野家 尾張一宮PA上り店,愛知県一宮市丹陽町三ツ井東金浦2709,1200,20240302,1150,50
吉野家,岐阜県,吉野家 美濃加茂店,岐阜県美濃加茂市山手町3丁目126,1200,20240302,1100,100
吉野家,兵庫県,吉野家 姫路大津店,兵庫県姫路市大津区恵美酒町2丁目56‐1,1080,20240302,1050,30
吉野家,兵庫県,吉野家 姫路中地店,兵庫県姫路市飾磨区構4‐94,1100,20240302,1030,70
吉野家,兵庫県,吉野家 姫路保城店,兵庫県姫路市保城943‐1,1050,20240302,1030,20
吉野家,東京都,吉野家 品川駅港南口店,東京都港区港南2丁目2‐15,1400,20240302,1300,100
吉野家,香川県,吉野家 浜街道宇多津店,香川県綾歌郡宇多津町浜二番丁20‐17,1000,20240302,980,20
吉野家,静岡県,吉野家 浜松駅店,静岡県浜松市中央区砂山町322‐4,1100,20240302,1050,50
吉野家,静岡県,吉野家 浜松若林店,静岡県浜松市中央区若林町2744‐4,1050,20240302,1000,50
吉野家,静岡県,吉野家 浜松西インター店,静岡県浜松市中央区湖東町3053,1050,20240302,1000,50
吉野家,東京都,吉野家 浜松町店,東京都港区浜松町2丁目7‐1,1350,20240302,1300,50
吉野家,熊本県,吉野家 浜線八王寺店,熊本県熊本市中央区八王寺町31‐13,1100,20240302,1000,100
吉野家,富山県,吉野家 富山駅前店,富山県富山市桜町1‐4‐17,1050,20240302,1000,50
吉野家,富山県,吉野家 富山呉羽店,富山県富山市呉羽町7275‐2,1050,20240302,1000,50
