松屋,東京都,松屋 お花茶屋店,東京都葛飾区お花茶屋1-19-16,1200,20240309,1150,50
松屋,愛知県,松屋 亀島店,愛知県名古屋市中村区則武本通1-36 マシュービル1F,1150,20240309,1100,50
松屋,広島県,松屋 広島矢野店,広島県広島市安芸区矢野西1-2-5,1100,20240309,1000,100
松屋,神奈川,松屋 溝の口店,神奈川県川崎市高津区溝の口1-18-7 澤木ビル1F,1250,20240309,1200,50
松屋,神奈川,松屋 溝の口南口店,神奈川県川崎市高津区久本1-4-10 TKBビル,1250,20240309,1200,50
松屋,神奈川,松屋 高津店,神奈川県川崎市高津区二子5-2-1,1250,20240309,1200,50
松屋,三重県,松屋 四日市日永店,三重県四日市市日永4-1-10,1200,20240309,1100,100
松屋,神奈川,松屋 小田原酒匂店,神奈川県小田原市西酒匂1-9-3,1200,20240309,1150,50
松屋,埼玉県,松屋 川越西口店,埼玉県川越市脇田本町1-7 川越駅西口ビル,1100,20240309,1050,50
松屋,神奈川,松屋 川崎銀座街店,神奈川県川崎市川崎区砂子1-1-7 川崎銀座共同ビル,1300,20240309,1200,100
松屋,神奈川,松屋 川崎砂子店/マイカリー食堂 川崎砂子店,神奈川県川崎市川崎区砂子2-6-19,1300,20240309,1200,100
松屋,神奈川,松屋 川崎西口店,神奈川県川崎市幸区大宮町5-1,1300,20240309,1200,100
松屋,神奈川,松屋 大船駅前店,神奈川県鎌倉市大船1-12-23,1200,20240309,1150,50
松屋,神奈川,松屋 大船店,神奈川県鎌倉市大船1-25-23,1200,20240309,1150,50
松屋,埼玉県,松屋 鶴瀬店,埼玉県富士見市鶴馬2605-1,1100,20240309,1050,50
松屋,広島県,松屋 東広島西条店,広島県東広島市西条町寺家4828-1,1100,20240309,1000,100
松屋,埼玉県,松屋 東松山上野本店/松のや 東松山上野本店,埼玉県東松山市上野本1174-2,1100,20240309,1050,50
松屋,東京都,松屋 布田店,東京都調布市布田2-47-2,1200,20240309,1150,50
松屋,神奈川,松屋 武蔵中原店/松のや 武蔵中原店,神奈川県川崎市中原区上小田中6-21-9,1300,20240309,1250,50
松屋,東京都,松屋 堀切菖蒲園店,東京都葛飾区堀切4-10-2 ,1200,20240309,1150,50
松屋,埼玉県,松屋 本川越店,埼玉県川越市新富町2-33-1,1100,20240309,1050,50
松屋,愛知県,松屋 名駅西店/マイカリー食堂 名駅西店,愛知県名古屋市中村区亀島2-12-1,1150,20240309,1100,50
松屋,三重県,松屋 鈴鹿中央通店,三重県鈴鹿市算所2-2-7,1200,20240309,1100,100
