すき家,静岡県,すき家 袋井川井店,静岡県袋井市川井字杉ノ木996-2,1080,20230930,1050,30
すき家,大阪府,すき家 大国町駅前店,大阪府大阪市浪速区敷津東3-11-10AKI難波ビル1F,1120,20230930,1050,70
すき家,大阪府,すき家 大阪港駅前店,大阪府大阪市港区築港3-6-13,1150,20230930,1070,80
すき家,大阪府,すき家 大阪鶴見今津北店,大阪府大阪市鶴見区今津北4-4-3,1100,20230930,1050,50
すき家,大阪府,すき家 大正三軒家東店,大阪府大阪市大正区三軒家東4-6-12,1120,20230930,1050,70
すき家,大阪府,すき家 大正泉尾店,大阪府大阪市大正区泉尾5-1-4,1120,20230930,1050,70
すき家,群馬県,すき家 大泉中央店,群馬県邑楽郡大泉町中央1-7-20,1050,20230930,1000,50
すき家,大阪府,すき家 大池橋店,大阪府大阪市生野区中川西3-10-10,1120,20230930,1050,70
すき家,大阪府,すき家 谷町三丁目店,大阪府大阪市中央区谷町3-5-5アイドュビル1F,1180,20230930,1120,60
すき家,東京都,すき家 中葛西店,東京都江戸川区中葛西6-1-10メゾンド佐久間Ⅱ,1200,20230930,1160,40
すき家,大阪府,すき家 中環大日店,大阪府門真市向島3-35ベア-ズA棟,1100,20230930,1050,50
すき家,北海道,すき家 中標津店,北海道標津郡中標津町東6条南11-1-2,1020,20230930,1000,20
すき家,神奈川,すき家 朝比奈店,神奈川県横浜市金沢区六浦4-11-34サングレイスビル101,1120,20230930,1090,30
すき家,大阪府,すき家 長吉出戸店,大阪府大阪市平野区長吉出戸5-3-62,1100,20230930,1050,50
すき家,大阪府,すき家 長居店,大阪府大阪市住吉区長居東4-21-2泉第2ハイツ,1120,20230930,1050,70
すき家,静岡県,すき家 長泉下土狩店,静岡県駿東郡長泉町下土狩429-1-1,1080,20230930,1030,50
すき家,兵庫県,すき家 長田浜添通店,兵庫県神戸市長田区浜添通6-1-25,1050,20230930,1030,20
すき家,大阪府,すき家 長堀橋駅南店,大阪府大阪市中央区島之内1-21-19協和島之内ビル1F,1200,20230930,1120,80
すき家,神奈川,すき家 追浜駅前店,神奈川県横須賀市追浜町3-8,1120,20230930,1090,30
すき家,神奈川,すき家 辻堂店,神奈川県藤沢市辻堂東海岸1-2-1,1130,20230930,1100,30
すき家,山形県,すき家 鶴岡西新斎店,山形県鶴岡市西新斎町7-9,1100,20230930,1050,50
すき家,山形県,すき家 鶴岡道形店,山形県鶴岡市道形字二ツ屋61-2,1100,20230930,1080,20
すき家,大阪府,すき家 天下茶屋駅前店,大阪府大阪市西成区岸里1-1-79とれび天下茶屋,1120,20230930,1050,70
すき家,大阪府,すき家 天神橋二丁目店,大阪府大阪市北区天神橋2-4-14盛岡ビル1F,1150,20230930,1100,50
すき家,大阪府,すき家 都島IC店,大阪府大阪市都島区高倉町3-14-27,1120,20230930,1080,40
すき家,大阪府,すき家 都島本通店,大阪府大阪市都島区都島本通3-20-1,1120,20230930,1080,40
すき家,兵庫県,すき家 東園田店,兵庫県尼崎市東園田町4-63-1,1080,20230930,1060,20
すき家,神奈川,すき家 東海大前店,神奈川県秦野市南矢名3-12-3,1120,20230930,1090,30
すき家,大阪府,すき家 東住吉杭全店,大阪府大阪市東住吉区杭全5-13-7,1120,20230930,1050,70
すき家,埼玉県,すき家 東大宮駅前店,埼玉県さいたま市見沼区東大宮5-1-2東大宮東口扶桑ビル1F,1100,20230930,1050,50
すき家,大阪府,すき家 東大阪加納店,大阪府東大阪市加納8-24-7,1100,20230930,1050,50
すき家,大阪府,すき家 東大阪高井田店,大阪府東大阪市高井田本通7-1-30,1100,20230930,1050,50
すき家,大阪府,すき家 東大阪菱屋西店,大阪府東大阪市菱屋西6-9-15,1100,20230930,1050,50
すき家,大阪府,すき家 東大阪菱屋東店,大阪府東大阪市菱屋東2-3-29,1100,20230930,1050,50
すき家,埼玉県,すき家 東武蒲生駅前店,埼玉県越谷市蒲生寿町16-18,1100,20230930,1050,50
すき家,大阪府,すき家 東淀川菅原店,大阪府大阪市東淀川区菅原7-5-31,1120,20230930,1100,20
すき家,大阪府,すき家 東淀川大桐店,大阪府大阪市東淀川区大桐1-7-8,1120,20230930,1080,40
すき家,大阪府,すき家 藤井寺駅前店,大阪府藤井寺市岡2-8-46アコ-ルアン1F,1100,20230930,1050,50
すき家,神奈川,すき家 藤沢湘南台店,神奈川県藤沢市湘南台4-14-4,1120,20230930,1100,20
すき家,大阪府,すき家 道頓堀一丁目店,大阪府大阪市中央区道頓堀1-1-11K-24ビル1F,1200,20230930,1120,80
すき家,福井県,すき家 敦賀木崎店,福井県敦賀市木崎19-14-1,1150,20230930,1100,50
すき家,大阪府,すき家 内環状守口太子橋店,大阪府守口市緑町3-12,1120,20230930,1080,40
すき家,大阪府,すき家 内環状新深江店,大阪府大阪市東成区深江南2-12-22,1100,20230930,1050,50
すき家,兵庫県,すき家 灘中郷店,兵庫県神戸市灘区中郷町3-2-13,1080,20230930,1030,50
すき家,大阪府,すき家 南港通り北加賀屋店,大阪府大阪市住之江区北加賀屋2-11-8北加賀屋千島ビル,1120,20230930,1050,70
すき家,宮城県,すき家 南仙台柳生店,宮城県仙台市太白区柳生1-3-9,1000,20230930,960,40
すき家,大阪府,すき家 南船場店,大阪府大阪市中央区南船場2-2-10,1200,20230930,1120,80
すき家,大阪府,すき家 南堀江店,大阪府大阪市西区南堀江2-1-1EG堀江ビル1F,1200,20230930,1120,80
すき家,大阪府,すき家 難波元町店,大阪府大阪市浪速区難波中3-6-12ナンバグランドビル,1150,20230930,1070,80
すき家,神奈川,すき家 二宮店,神奈川県中郡二宮町二宮1352-4,1180,20230930,1090,90
すき家,大阪府,すき家 梅田太融寺店,大阪府大阪市北区太融寺町5-8ダイヤモンドレジャ-ビル本館1F,1200,20230930,1180,20
すき家,大阪府,すき家 梅田茶屋町店,大阪府大阪市北区茶屋町1-52コモド梅田ビル1F,1200,20230930,1180,20
すき家,大阪府,すき家 梅田堂山店,大阪府大阪市北区堂山町15-15,1200,20230930,1180,20
すき家,大阪府,すき家 柏原片山店,大阪府柏原市片山町14-1,1100,20230930,1050,50
すき家,埼玉県,すき家 白岡岡泉店,埼玉県白岡市太田新井1187-4,1100,20230930,1050,50
すき家,新潟県,すき家 白根店,新潟県新潟市南区鰺潟四反田605-1,1000,20230930,950,50
すき家,北海道,すき家 函館漁火通店,北海道函館市広野町3-3,1000,20230930,980,20
すき家,北海道,すき家 函館鍛治店,北海道函館市鍛治2-9-11,1000,20230930,980,20
すき家,青森県,すき家 八戸根城店,青森県八戸市根城3-4-5,940,20230930,920,20
すき家,京都府,すき家 八幡店,京都府八幡市八幡五反田39-4,1050,20230930,1020,30
すき家,大阪府,すき家 八尾山賀店,大阪府八尾市山賀町1-37,1100,20230930,1050,50
すき家,大阪府,すき家 八尾青山店,大阪府八尾市青山町4-2-38,1100,20230930,1050,50
すき家,大阪府,すき家 八尾南木の本店,大阪府八尾市南木の本4-101-1,1100,20230930,1050,50
すき家,兵庫県,すき家 板宿店,兵庫県神戸市須磨区大黒町3-3-26山本ビル,1050,20230930,1030,20
すき家,静岡県,すき家 富士厚原店,静岡県富士市厚原99-5,1050,20230930,1030,20
すき家,静岡県,すき家 富士今泉店,静岡県富士市今泉1-70-4,1050,20230930,1030,20
すき家,大阪府,すき家 富田林小金台店,大阪府富田林市小金台1-3-10,1100,20230930,1050,50
すき家,大阪府,すき家 富田林川面店,大阪府富田林市川面町2-4-16,1100,20230930,1050,50
すき家,神奈川,すき家 淵野辺北口店,神奈川県相模原市中央区淵野辺3-19-11大黒屋ビル1F,1120,20230930,1090,30
すき家,神奈川,すき家 平塚松風店,神奈川県平塚市松風町11-20,1130,20230930,1090,40
すき家,神奈川,すき家 平塚上平塚店,神奈川県平塚市上平塚1-54,1130,20230930,1090,40
すき家,神奈川,すき家 平塚店,神奈川県平塚市平塚1-9-26,1120,20230930,1090,30
すき家,神奈川,すき家 平塚豊田店,神奈川県平塚市豊田本郷1740-1,1150,20230930,1090,60
すき家,大阪府,すき家 平野町一丁目店,大阪府大阪市中央区平野町1-8-11ルート北浜ビル1F,1200,20230930,1120,80
すき家,大阪府,すき家 弁天町みなと通店,大阪府大阪市港区磯路1-1-7灘浜ビル,1120,20230930,1050,70
すき家,兵庫県,すき家 宝塚安倉店,兵庫県宝塚市安倉西4-608,1050,20230930,1030,20
すき家,兵庫県,すき家 宝塚小林店,兵庫県宝塚市小林5-9-100,1050,20230930,1030,20
すき家,兵庫県,すき家 宝塚中筋店,兵庫県宝塚市中筋6-13-22,1050,20230930,1030,20
すき家,新潟県,すき家 豊栄北陽店,新潟県新潟市北区北陽1-2480-5,980,20230930,950,30
すき家,大阪府,すき家 豊中熊野町店,大阪府豊中市熊野町1-7-15,1100,20230930,1060,40
すき家,大阪府,すき家 豊中曽根店,大阪府豊中市曽根南町3-19-24,1100,20230930,1060,40
すき家,大阪府,すき家 豊中浜店,大阪府豊中市浜4-3-7-2,1100,20230930,1060,40
すき家,神奈川,すき家 本厚木一番街店,神奈川県厚木市中町2-12-1,1130,20230930,1090,40
すき家,神奈川,すき家 本厚木店,神奈川県厚木市中町3-13-1,1130,20230930,1090,40
すき家,大阪府,すき家 枚方山之上店,大阪府枚方市山之上北町1-8,1100,20230930,1050,50
すき家,大阪府,すき家 枚方渚内野店,大阪府枚方市渚内野4-25-1,1100,20230930,1050,50
すき家,大阪府,すき家 枚方招提北店,大阪府枚方市招提北町1-2241-1,1100,20230930,1050,50
すき家,大阪府,すき家 枚方中宮東之町店,大阪府枚方市中宮東之町22-13,1100,20230930,1050,50
すき家,長野県,すき家 箕輪BP店,長野県上伊那郡箕輪町中箕輪11338-1,1030,20230930,1000,30
すき家,兵庫県,すき家 妙法寺駅前店,兵庫県神戸市須磨区横尾1-5リファーレ横尾1F,1050,20230930,1030,20
すき家,大阪府,すき家 門真下馬伏店,大阪府門真市下馬伏町26-6,1100,20230930,1050,50
すき家,大阪府,すき家 門真中央店,大阪府門真市大池町16-25,1100,20230930,1050,50
すき家,大阪府,すき家 淀川加島店,大阪府大阪市淀川区加島2-3-4,1100,20230930,1050,50
すき家,大阪府,すき家 淀川通塚本店,大阪府大阪市淀川区塚本2-14-19,1120,20230930,1100,20
すき家,神奈川,すき家 立場店,神奈川県横浜市泉区中田西1-1-41,1130,20230930,1100,30
すき家,大阪府,すき家 立売堀二丁目店,大阪府大阪市西区立売堀2-4-6DGビルなにわ筋1F,1200,20230930,1120,80
すき家,兵庫県,すき家 鈴蘭台鳴子店,兵庫県神戸市北区鳴子2-1-4,1050,20230930,1030,20
すき家,埼玉県,すき家 蓮田西新宿店,埼玉県蓮田市西新宿2-105,1100,20230930,1050,50
すき家,大阪府,すき家 和泉はつが野店,大阪府和泉市はつが野1-1-13,1100,20230930,1050,50
すき家,兵庫県,すき家 脇浜店,兵庫県神戸市中央区脇浜町2-5-19,1080,20230930,1050,30
