松屋,大阪府,松屋 蒲生四丁目店/松のや 蒲生四丁目店,大阪府大阪市城東区今福西1-7-4(未確定),1250,20260411
松屋,群馬県,松屋 太田丸山店/松のや 太田丸山店,群馬県太田市丸山町1380,1200,20260411
すき家,福岡県,すき家 199号若松駅西店,福岡県北九州市若松区白山1丁目433番13 ,1080,20260411
すき家,大阪府,すき家 なにわ筋堀江店,大阪府大阪市西区南堀江2-1-1 EG堀江ビル1F,1280,20260411
すき家,東京都,すき家 環八穴守稲荷店,東京都大田区羽田4-3-3 ,1350,20260411
すき家,東京都,すき家 原宿明治通り店,東京都渋谷区神宮前3-23-3 トリニティビル1F,1380,20260411
すき家,東京都,すき家 笹塚駅北店,東京都渋谷区笹塚2-19-2 TSK笹塚ビル,1300,20260411
すき家,大阪府,すき家 上本町駅南店,大阪府大阪市天王寺区上本町6-9-20 ,1250,20260411
すき家,東京都,すき家 新宿東南口店,東京都新宿区新宿3-32-2 ,1400,20260411
すき家,東京都,すき家 新大久保駅西店,東京都新宿区百人町1-16-14 マキバビル1F,1300,20260411
すき家,神奈川,すき家 川崎藤崎四丁目店,神奈川県川崎市川崎区藤崎4-19-3 ,1350,20260411
すき家,大阪府,すき家 谷町四丁目駅前店,大阪府大阪市中央区谷町3-5-5 アイドュビル1F,1300,20260411
すき家,福岡県,すき家 天神南駅東店,福岡県福岡市中央区渡辺通5-2-27 ,1130,20260411
すき家,大阪府,すき家 道頓堀東店,大阪府大阪市中央区道頓堀1-1-11 K-24ビル1F,1300,20260411
