吉野家,東京都,からから家　鵜の木駅店,東京都大田区鵜の木2-4-1,940,1000,60
すき家,千葉県,すき家 126号山武松尾店,千葉県山武市松尾町八田7-1,950,980,30
すき家,千葉県,すき家 126号千葉弁天店,千葉県千葉市中央区弁天4-11-26,950,1000,50
すき家,千葉県,すき家 126号東金南上宿店,千葉県東金市南上宿5-38-33,950,980,30
すき家,千葉県,すき家 128号鴨川店,千葉県鴨川市広場字汐入765-1,950,980,30
すき家,千葉県,すき家 128号東茂原店,千葉県茂原市東茂原1-41,950,980,30
すき家,神奈川,すき家 134号横須賀池田店,神奈川県横須賀市池田町5-14-12,950,1000,50
すき家,神奈川,すき家 134号横須賀長坂店,神奈川県横須賀市長坂2-11-2,950,1000,50
すき家,神奈川,すき家 16号横須賀安浦店,神奈川県横須賀市安浦町3-24-3,950,1000,50
すき家,千葉県,すき家 16号千葉長沼店,千葉県千葉市稲毛区長沼町135-4,980,1000,20
すき家,千葉県,すき家 296号酒々井店,千葉県印旛郡酒々井町上本佐倉193-1,970,980,10
すき家,千葉県,すき家 297号大多喜店,千葉県夷隅郡大多喜町船子311-3,950,980,30
すき家,岡山県,すき家 2国岡山早島店,岡山県都窪郡早島町早島3444-1,930,1000,70
すき家,広島県,すき家 2国福山高西店,広島県福山市高西町4-4-9,880,920,40
すき家,石川県,すき家 305号小松今江店,石川県小松市今江町3-700,900,950,50
すき家,石川県,すき家 305号上小松店,石川県小松市上小松町137-1,900,950,50
すき家,兵庫県,すき家 312号和田山IC店,兵庫県朝来市和田山町枚田592-1,900,1000,100
すき家,石川県,すき家 8号加賀加茂店,石川県加賀市加茂町チ65-1,900,950,50
すき家,埼玉県,すき家 ﾓﾗｰｼﾞｭ菖蒲店,埼玉県久喜市菖蒲町菖蒲6005-1,960,1000,40
すき家,東京都,すき家 ﾓﾘﾀｳﾝ昭島店,東京都昭島市田中町562-1,950,1000,50
すき家,長崎県,すき家 みらい長崎ｺｺｳｫｰｸ店,長崎県長崎市茂里町1-55みらい長崎ココウォーク3F,800,820,20
すき家,東京都,すき家 イオンモール日の出店,東京都西多摩郡日の出町大字平井字三吉野桜木237-3&nbsp;イオンモール日の出3F,980,1000,20
すき家,千葉県,すき家 稲毛駅西口店,千葉県千葉市稲毛区稲毛東3-19-18能瀬ビル1F,950,1100,150
すき家,神奈川,すき家 横須賀衣笠店,神奈川県横須賀市衣笠町43-17,950,1000,50
すき家,神奈川,すき家 横須賀野比店,神奈川県横須賀市野比1-4-25,950,1000,50
すき家,埼玉県,すき家 桶川下日出谷店,埼玉県桶川市下日出谷西3-3-2,910,950,40
すき家,埼玉県,すき家 桶川店,埼玉県桶川市末広2-2-8&nbsp;平澤ビル1F,930,950,20
すき家,千葉県,すき家 館山店,千葉県館山市安布里字青木田190-2,950,980,30
すき家,埼玉県,すき家 五領町店,埼玉県東松山市五領町15-15,910,960,50
すき家,神奈川,すき家 高津末長店,神奈川県川崎市高津区末長2-11-18,1000,1050,50
すき家,埼玉県,すき家 鴻巣店,埼玉県鴻巣市天神1-7-6,910,960,50
すき家,千葉県,すき家 佐倉石川店,千葉県佐倉市石川535-6,970,980,10
すき家,千葉県,すき家 佐倉店,千葉県佐倉市王子台2-12-22,970,980,10
すき家,千葉県,すき家 四街道IC店,千葉県四街道市栗山812-6,950,980,30
すき家,千葉県,すき家 四街道鹿放ヶ丘店,千葉県四街道市鹿放ヶ丘459-1,950,980,30
すき家,東京都,すき家 小平店,東京都小平市中島町22-19,950,980,30
すき家,東京都,すき家 小平鈴木店,東京都小平市鈴木町1-215-3,950,980,30
すき家,千葉県,すき家 西千葉駅前店,千葉県千葉市中央区春日2-37-1竹久ビル1F,950,1000,50
すき家,千葉県,すき家 千葉貝塚店,千葉県千葉市若葉区貝塚2-10-1,950,980,30
すき家,千葉県,すき家 千葉小倉店,千葉県千葉市若葉区小倉町862-3,950,980,30
すき家,千葉県,すき家 千葉蘇我店,千葉県千葉市中央区南町1-2-9,950,1000,50
すき家,神奈川,すき家 川崎南加瀬店,神奈川県川崎市幸区南加瀬4-16-9,1000,1050,50
すき家,神奈川,すき家 川崎木月店,神奈川県川崎市中原区木月3-53-7,1000,1050,50
すき家,千葉県,すき家 大原店,千葉県いすみ市大原9539-1,950,980,30
すき家,東京都,すき家 東久留米下里店,東京都東久留米市下里2-6-7,960,1000,40
すき家,千葉県,すき家 東金BP店,千葉県東金市田間846-5,950,980,30
すき家,埼玉県,すき家 東松山店,埼玉県東松山市上野本1164-1,910,960,50
すき家,千葉県,すき家 八街稲荷丘店,千葉県八街市八街ほ945-84,970,980,10
すき家,千葉県,すき家 八街文違店,千葉県八街市文違301-814,970,980,10
すき家,千葉県,すき家 八日市場店,千葉県匝瑳市八日市場イ194-1,950,980,30
すき家,埼玉県,すき家 北本荒井店,埼玉県北本市荒井2-413-1,910,950,40
