松屋,大阪府,松屋 岸和田店,大阪府岸和田市土生町2-7-17,1100,20240713
松屋,和歌山,松屋 岩出店/マイカリー食堂 岩出店,和歌山県岩出市岡田4-1,1000,20240713
松屋,神奈川,松屋 京急久里浜店,神奈川県横須賀市久里浜4-5-2 久里浜ロマンビル,1150,20240713
松屋,大阪府,松屋 恵美須町店,大阪府大阪市浪速区恵美須西2-1-32,1100,20240713
松屋,神奈川,松屋 港南台店,神奈川県横浜市港南区港南台4-1-1,1150,20240713
松屋,大阪府,松屋 高石店/松のや 高石店,大阪府高石市西取石8丁目115・119（地番）,1100,20240713
松屋,和歌山,松屋 小雑賀店,和歌山県和歌山市小雑賀573-9,1000,20240713
松屋,東京都,松屋 新宿1丁目店,東京都新宿区新宿1丁目26-6 新宿加藤ビルディング1F,1200,20240713
松屋,大阪府,松屋 泉大津店/松のや 泉大津店,大阪府泉大津市虫取町1-4-31,1100,20240713
松屋,神奈川,松屋 大船駅前店,神奈川県鎌倉市大船1-12-23,1200,20240713
松屋,神奈川,松屋 大船店,神奈川県鎌倉市大船1-25-23,1200,20240713
松屋,神奈川,松屋 追浜店,神奈川県横須賀市追浜町3-13-13,1150,20240713
松屋,神奈川,松屋 藤沢北口店,神奈川県藤沢市藤沢462番地 吉塚ビル1F,1200,20240713
松屋,愛知県,松屋 名駅西店/マイカリー食堂 名駅西店,愛知県名古屋市中村区亀島2-12-1,1150,20240713
松屋,和歌山,松屋 和歌山加納店/松のや 和歌山加納店,和歌山県和歌山市加納295-1（地番）,1000,20240713
松屋,和歌山,松屋 和歌山向店,和歌山県和歌山市向220-3,1000,20240713
