松屋,東京都,すし松　蒲田1号店,東京都大田区蒲田5丁目16番9号第一カワタビル1F,NA,1100,1100
松屋,東京都,松屋　下石神井店,東京都練馬区下石神井4-1-7MSビル1F,NA,1050,1050
松屋,東京都,松屋　花小金井駅前店,東京都小平市花小金井1-8-6大沢ビル(ビックアロービル),NA,1050,1050
松屋,神奈川,松屋　菊名店,神奈川県横浜市港北区菊名4-2-6,NA,1050,1050
松屋,東京都,松屋　玉川学園前店,東京都町田市玉川学園2-11-21第17通南ビル,NA,1013,1013
松屋,東京都,松屋　江古田店,東京都練馬区栄町34-1,NA,1050,1050
松屋,神奈川,松屋　綱島店,神奈川県横浜市港北区綱島西1-1-3青柳ビル1F,NA,1050,1050
松屋,神奈川,松屋　座間立野台店,神奈川県座間市立野台2丁目20-3,NA,1011,1011
松屋,東京都,松屋　鷺宮店,東京都中野区鷺宮3-18-3エレガンス鷺ノ宮1F,NA,1050,1050
松屋,東京都,松屋　桜台店,東京都練馬区桜台1-4-67,NA,1050,1050
松屋,神奈川,松屋　小田急相模原西口店,神奈川県相模原市南区相模台2-4-6K-フィネッサ,NA,1011,1011
松屋,神奈川,松屋　小田急相模原店,神奈川県相模原市南区松が枝町24-6,NA,1011,1011
松屋,東京都,松屋　沼袋店,東京都中野区沼袋3-4-18,NA,1050,1050
松屋,東京都,松屋　上石神井店,東京都練馬区上石神井2-25-5栄ビル1F,NA,1050,1050
松屋,東京都,松屋　石神井台店,東京都練馬区石神井台6丁目7-2,NA,1050,1050
松屋,神奈川,松屋　相模大野店,神奈川県相模原市南区相模大野3-2-1ボーノ相模大野ノースモール1F,NA,1011,1011
松屋,神奈川,松屋　大和店,神奈川県大和市大和南1-3-4登喜和ビル1F,NA,1011,1011
松屋,東京都,松屋　中井店,東京都新宿区上落合2-20-3,NA,1050,1050
松屋,東京都,松屋　椎名町店,東京都豊島区長崎1-2-4バイオレットインA室,NA,1050,1050
松屋,神奈川,松屋　鶴間店,神奈川県大和市西鶴間1-2-9,NA,1011,1011
松屋,東京都,松屋　鶴川店,東京都町田市能ケ谷町5002-9applestudio1F,NA,1013,1013
松屋,東京都,松屋　田無駅前店,東京都西東京市田無町4-2-12A2ビル1階,NA,1100,1100
松屋,神奈川,松屋　都筑インター店,神奈川県横浜市都筑区早淵3-37-14,NA,1100,1100
松屋,東京都,松屋　都立家政店,東京都中野区鷺宮3-6-1岡田ビル,NA,1050,1050
松屋,東京都,松屋　東久留米南町店,東京都東久留米市南町4-1-8,NA,1050,1050
松屋,東京都,松屋　東長崎店,東京都豊島区南長崎5-16-8平和ビル1F,NA,1050,1050
松屋,東京都,松屋　東伏見店,東京都西東京市東伏見2-4-6高橋イーストビル,NA,1050,1050
松屋,神奈川,松屋　南林間店,神奈川県大和市南林間1-8-1,NA,1011,1011
松屋,東京都,松屋　武蔵関店,東京都練馬区関町北2-27-13下田ビル1F,NA,1050,1050
松屋,東京都,松屋　豊島園店,東京都練馬区練馬4-15-23パークサイドハイツ,NA,1050,1050
松屋,神奈川,松屋　麻溝台店,神奈川県相模原市南区麻溝台1-5-6,NA,1011,1011
松屋,東京都,松屋　野方店,東京都中野区野方5-30-11 2F,NA,1050,1050
松屋,東京都,松屋　練馬店,東京都練馬区豊玉北5-18-11,NA,1100,1100
松屋,福井県,松屋　越前千福店,福井県越前市千福町29,NA,960,960
松屋,神奈川,松屋　金沢八景店,神奈川県横浜市金沢区瀬戸5004番地2（地番）,NA,1020,1020
松屋,愛知県,松屋　入場店/松のや　入場店,愛知県名古屋市港区入場1丁目,NA,980,980
