吉野家,石川県,吉野家 8号線加賀店,石川県加賀市中代町二60‐4,1000,20240210
吉野家,石川県,吉野家 8号線福久町店,石川県金沢市福久町ホ15‐1,1050,20240210
吉野家,茨城県,吉野家 TX守谷駅店,茨城県守谷市中央3丁目2,1000,20240210
吉野家,兵庫県,吉野家 加西北条店,兵庫県加西市北条町横尾352‐1,1300,20240210
吉野家,大阪府,吉野家 京阪くずは駅店,大阪府枚方市楠葉花園町14-1,1100,20240210
吉野家,石川県,吉野家 金沢もりの里店,石川県金沢市もりの里1丁目60,1000,20240210
吉野家,石川県,吉野家 金沢三馬店,石川県金沢市三馬3‐345,1000,20240210
吉野家,石川県,吉野家 金沢新神田店,石川県金沢市新神田2丁目13‐10,1000,20240210
吉野家,石川県,吉野家 金沢畝田店,石川県金沢市畝田西1丁目103,1000,20240210
吉野家,千葉県,吉野家 原木中山駅店,千葉県船橋市本中山7-1152-2,1100,20240210
吉野家,石川県,吉野家 小松店,石川県小松市今江町4丁目157,1050,20240210
吉野家,東京都,吉野家 上野駅前店,東京都台東区上野7丁目3‐2,1450,20240210
吉野家,大阪府,吉野家 東心斎橋店,大阪府大阪市中央区東心斎橋1丁目10番15号,1150,20240210
吉野家,千葉県,吉野家 木更津太田店,千葉県木更津市太田1‐3‐47,1100,20240210
吉野家,石川県,吉野家 野々市店,石川県野々市市粟田6丁目386,1000,20240210
松屋,千葉県,松屋 新鎌ヶ谷店/松のや 新鎌ヶ谷店,千葉県鎌ケ谷市新鎌ヶ谷1-13-3,1100,20240210
松屋,山形県,松屋 米沢店/松のや 米沢店,山形県米沢市金池5丁目3-18,980,20240210
