吉野家,埼玉県,かるびのとりこ 春日部店,埼玉県春日部市中央4-7-6,1100,20240803
吉野家,埼玉県,かるびのとりこ 上木崎店,埼玉県さいたま市浦和区上木崎4丁目12‐12,1150,20240803
吉野家,埼玉県,かるびのとりこ 杉戸高野台店,埼玉県幸手市上高野2071‐1,1100,20240803
吉野家,兵庫県,吉野家 171号線西宮若山町店,兵庫県西宮市若山町11‐12,1100,20240803
吉野家,埼玉県,吉野家 17号線深谷店,埼玉県深谷市国済寺503‐3,1150,20240803
吉野家,東京都,吉野家 ひばりが丘店,東京都西東京市ひばりが丘北4丁目1‐32,1250,20240803
吉野家,沖縄県,吉野家 イオン浦西店,沖縄県浦添市前田3丁目土地区画整理地内19街区40画地の一部,1000,20240803
吉野家,埼玉県,吉野家 ビーンズ戸田公園店,埼玉県戸田市本町4‐15‐1,1150,20240803
吉野家,埼玉県,吉野家 マルイファミリー志木店,埼玉県志木市本町5‐26‐1,1150,20240803
吉野家,熊本県,吉野家 熊本健軍店,熊本県熊本市東区東野2丁目1‐3,980,20240803
吉野家,東京都,吉野家 高田馬場駅前店,東京都新宿区高田馬場1丁目26‐12,1400,20240803
吉野家,福岡県,吉野家 小倉競馬場店,福岡県北九州市小倉南区北方4丁目5‐1,950,20240803
吉野家,埼玉県,吉野家 大宮西口店,埼玉県さいたま市大宮区桜木町1丁目1‐11,1250,20240803
吉野家,埼玉県,吉野家 大宮東口店,埼玉県さいたま市大宮区大門町1丁目17‐1,1300,20240803
吉野家,福岡県,吉野家 六本松店,福岡県福岡市中央区六本松2丁目6‐6 HILLTOP BUILDING1階,980,20240803
松屋,兵庫県,松のや 新長田店,兵庫県神戸市長田区大橋町4-4-9,1375,20240803
松屋,茨城県,松屋 かすみがうら店,茨城県かすみがうら市上稲吉1943-32,1000,20240803
松屋,茨城県,松屋 ひたちなか店,茨城県ひたちなか市市毛字原坪894-36,1050,20240803
松屋,愛知県,松屋 笠寺店/松のや 笠寺店,愛知県名古屋市南区千竈通7-8-1,1200,20240803
松屋,神奈川,松屋 鴨居店,神奈川県横浜市緑区鴨居1-8-10,1500,20240803
松屋,新潟県,松屋 亀田インター店,新潟県新潟市中央区姥ケ山63-1,1000,20240803
松屋,愛知県,松屋 金山店,愛知県名古屋市中区金山4-1-1,1200,20240803
松屋,静岡県,松屋 沼津店/松のや 沼津店,静岡県沼津市筒井町9-7,1150,20240803
松屋,静岡県,松屋 沼津南店,静岡県沼津市上香貫字三園町1372番地,1100,20240803
松屋,愛知県,松屋 上前津店,愛知県名古屋市中区大須4-11-9,1100,20240803
松屋,茨城県,松屋 常陸太田店/松のや 常陸太田店,茨城県常陸太田市塙町字鯉沼4552,1050,20240803
松屋,新潟県,松屋 新潟駅前店,新潟県新潟市中央区東大通1-6-1,1000,20240803
松屋,新潟県,松屋 新潟見附店/マイカリー食堂 新潟見附店,新潟県見附市上新田町字下野沖514-1,1000,20240803
松屋,新潟県,松屋 新潟女池店,新潟県新潟市中央区女池5-7-10,1000,20240803
松屋,新潟県,松屋 新潟米山店,新潟県新潟市中央区米山5-14-5,1000,20240803
松屋,静岡県,松屋 神立店/松のや 神立店,静岡県浜松市中央区神立町118-2,1150,20240803
松屋,静岡県,松屋 静岡池田店,静岡県静岡市駿河区池田404-1,1050,20240803
松屋,静岡県,松屋 静岡八幡店,静岡県静岡市駿河区八幡2丁目3-17,1050,20240803
松屋,東京都,松屋 石神井公園店,東京都練馬区石神井町3-21-2,1200,20240803
松屋,宮城県,松屋 仙台南町通り店,宮城県仙台市青葉区一番町2-7-7,1000,20240803
松屋,神奈川,松屋 大口店,神奈川県横浜市神奈川区大口通58-3,1600,20240803
松屋,新潟県,松屋 長岡店/松のや 長岡店,新潟県長岡市新組町2281-1,1000,20240803
松屋,愛知県,松屋 東郷PA（下り線）店,愛知県日進市米野木町南山978-13,1100,20240803
松屋,愛知県,松屋 東郷PA（上り線）店,愛知県日進市米野木町南山978-12,1100,20240803
松屋,静岡県,松屋 日本坂PA（上り線）店,静岡県焼津市石脇上字西阿原751番1,1050,20240803
松屋,静岡県,松屋 日本平PA（下り線）店,静岡県静岡市駿河区国吉田字西原坪,1313,20240803
松屋,茨城県,松屋 日立桜川町店,茨城県日立市桜川町2-4-12,1000,20240803
松屋,静岡県,松屋 浜松高竜店,静岡県浜松市中央区寺島町1024,1150,20240803
松屋,静岡県,松屋 浜松高林店,静岡県浜松市中央区高林4-14-22,1150,20240803
松屋,静岡県,松屋 浜松初生町店/松のや 浜松初生町店,静岡県浜松市中央区初生町798,1150,20240803
松屋,静岡県,松屋 富士ラウンドワン店,静岡県富士市八代町4-23,1100,20240803
松屋,大阪府,松屋 枚方店,大阪府枚方市岡東町5-24,1100,20240803
松屋,愛知県,松屋 野並店,愛知県名古屋市緑区鳴海町字杜若7-1,1100,20240803
