吉野家,栃木県,吉野家 Dila小山店,栃木県小山市城山町3丁目3‐22,1050,20241123
吉野家,東京都,吉野家 日本橋人形町一丁目店,東京都中央区日本橋人形町1‐7‐9 伊勢兼ビル,1350,20241123
松屋,埼玉県,松屋 越谷下間久里店,埼玉県越谷市下間久里980-1,1150,20241123
松屋,埼玉県,松屋 越谷蒲生店/松のや 越谷蒲生店,埼玉県越谷市蒲生南町15-4,1150,20241123
松屋,埼玉県,松屋 越谷大道店/松のや 越谷大道店,埼玉県越谷市大字大道598-1、602、607,1150,20241123
松屋,埼玉県,松屋 越谷店/松のや 越谷店,埼玉県越谷市弥生町17-1,1150,20241123
松屋,埼玉県,松屋 吉川店,埼玉県吉川市木売1-4-11,1150,20241123
松屋,埼玉県,松屋 三郷戸ヶ崎店/松のや 三郷戸ヶ崎店,埼玉県三郷市戸ヶ崎3丁目586（地番）,1150,20241123
松屋,埼玉県,松屋 三郷店,埼玉県三郷市三郷2-1-4 ふじプラザビル,1150,20241123
松屋,埼玉県,松屋 春日部店,埼玉県春日部市中央1-2-6 M6ビル 1F,1150,20241123
松屋,埼玉県,松屋 春日部豊町店/松のや 春日部豊町店,埼玉県春日部市豊町1-27-2,1150,20241123
松屋,埼玉県,松屋 草加松江店/マイカリー食堂 草加松江店,埼玉県草加市松江6丁目12-27,1150,20241123
松屋,埼玉県,松屋 草加清門町店,埼玉県草加市清門1丁目423-1,1150,20241123
松屋,埼玉県,松屋 草加西口店,埼玉県草加市氷川町2125-4 ウシヤマビル,1150,20241123
松屋,埼玉県,松屋 草加店/松のや 草加店,埼玉県草加市北谷町1-2-14,1150,20241123
松屋,埼玉県,松屋 南越谷店,埼玉県越谷市南越谷1-19-8 吉澤第一ビル1F,1150,20241123
松屋,埼玉県,松屋 北越谷店,埼玉県越谷市大沢3-4-26,1150,20241123
