吉野家,静岡県,吉野家 150号線焼津店,静岡県焼津市八楠4丁目3‐11,1050,20230128,1000,50
吉野家,愛知県,吉野家 1号線御油店,愛知県豊川市御油町八面横40,1050,20230128,1000,50
吉野家,島根県,吉野家 9号線松江店,島根県松江市西津田2丁目6‐23,1100,20230128,950,150
吉野家,熊本県,吉野家 熊本光の森店,熊本県菊池郡菊陽町光の森6丁目2‐2,1100,20230128,950,150
吉野家,香川県,吉野家 高松中央インター店,香川県高松市木太町581‐4,1100,20230128,1000,100
吉野家,静岡県,吉野家 静岡インター通り店,静岡県静岡市駿河区西中原1丁目949‐1,1050,20230128,1000,50
吉野家,愛知県,吉野家 赤塚パーキングエリア店,愛知県豊川市市田町北山7‐20,1300,20230128,1000,300
松屋,東京都,すし松 蒲田1号店,東京都大田区蒲田5丁目16番9号 第一カワタビル1F,1200,20230128,1100,100
松屋,東京都,すし松 西荻窪店,東京都杉並区西荻北3-20-1,1250,20230128,1100,150
松屋,埼玉県,松のや ふじみ野店/マイカリー食堂 ふじみ野店,埼玉県富士見市ふじみ野西1-20-2 第7マツモトビル106,1100,20230128,1000,100
松屋,神奈川,松のや ホテルユニゾ横浜駅西店,神奈川県横浜市西区南幸2-17-6 ホテルユニゾ横浜駅西口,1250,20230128,1200,50
松屋,東京都,松のや 綾瀬店,東京都足立区綾瀬4-7-1,1200,20230128,1100,100
松屋,東京都,松のや 下赤塚店,東京都板橋区赤塚新町1-24-1 暖誠堂ビル,1200,20230128,1100,100
松屋,大阪府,松のや 花園町店,大阪府大阪市西成区鶴見橋1-3-24,1040,20230128,1030,10
松屋,神奈川,松のや 菊名店,神奈川県横浜市港北区菊名4-2-3 菊繁ビル,1150,20230128,1100,50
松屋,東京都,松のや 錦糸町店,東京都墨田区江東橋3-9-15 第3魚寅ビル,1250,20230128,1200,50
松屋,東京都,松のや 江戸川橋店/マイカリー食堂 江戸川橋店,東京都文京区関口1-10-11 朝日江戸川橋マンション105号,1250,20230128,1200,50
松屋,千葉県,松のや 行徳店/マイカリー食堂 行徳店,千葉県市川市行徳駅前2-3 ポニー行徳商業ビル,1100,20230128,1000,100
松屋,東京都,松のや 志村坂上店/マイカリー食堂 志村坂上店,東京都板橋区志村1-14-12,1250,20230128,1200,50
松屋,東京都,松のや 春日店/マイカリー食堂 春日店,東京都文京区本郷4-17-8,1300,20230128,1200,100
松屋,千葉県,松のや 松戸新田店,千葉県松戸市松戸新田289-6,1050,20230128,1000,50
松屋,東京都,松のや 新橋店,東京都港区新橋2-2-5 丸山ビル1F,1250,20230128,1200,50
松屋,東京都,松のや 西新宿店,東京都新宿区西新宿7-1-7,1250,20230128,1200,50
松屋,東京都,松のや 西巣鴨店,東京都豊島区西巣鴨3-25-11 メトロエステート201号,1150,20230128,1100,50
松屋,東京都,松のや 青物横丁店/マイカリー食堂 青物横丁店,東京都品川区南品川2-17-18 SGビル1階,1250,20230128,1100,150
松屋,大阪府,松のや 千鳥橋店,大阪府大阪市此花区四貫島1-1-2 千鳥橋駅南館,1040,20230128,1030,10
松屋,埼玉県,松のや 川越西口店/マイカリー食堂 川越西口店,埼玉県川越市脇田本町6-8 栄光ビル1F,1100,20230128,1000,100
松屋,埼玉県,松のや 川口店,埼玉県川口市川口1-1-1 CuPo・La専門店A107,1100,20230128,1000,100
松屋,神奈川,松のや 川崎銀座街店,神奈川県川崎市川崎区砂子1-1-3 つる屋ビル,1250,20230128,1200,50
松屋,東京都,松のや 中延店,東京都品川区中延4-6-17 エクセレント2 1F,1250,20230128,1200,50
松屋,千葉県,松のや 津田沼南口店/マイカリー食堂 津田沼南口店,千葉県習志野市谷津7-9-16 京葉ビル2,1200,20230128,1050,150
松屋,神奈川,松のや 天王町店,神奈川県横浜市保土ケ谷区天王町2-47-6 日振ビル,1150,20230128,1071,79
松屋,東京都,松のや 東新宿店,東京都新宿区大久保1-3-14 ワールドビジネスセンター,1300,20230128,1200,100
松屋,埼玉県,松のや 南浦和店/マイカリー食堂 南浦和店,埼玉県さいたま市南区南浦和2-36-11 カトレアビル,1150,20230128,1100,50
松屋,東京都,松のや 板橋区役所前店,東京都板橋区板橋2-61-10 藤畑第一ビル,1150,20230128,1100,50
松屋,大阪府,松のや 姫島店,大阪府大阪市西淀川区姫里1-26-18,1040,20230128,1030,10
松屋,神奈川,松のや 武蔵新城店,神奈川県川崎市中原区新城5-1-3 フクシマビル,1150,20230128,1100,50
松屋,東京都,松のや 武蔵新田店,東京都大田区矢口1-16-24,1150,20230128,1100,50
松屋,埼玉県,松のや 蕨西口店/マイカリー食堂 蕨西口店,埼玉県蕨市中央1-23-1,1100,20230128,1000,100
松屋,東京都,松屋 ひばりが丘店,東京都西東京市ひばりが丘北3-3-14,1150,20230128,1080,70
松屋,京都府,松屋 ホテルユニゾ京都烏丸御池店,京都府京都市中京区堺町通押小路下る扇屋町661番,1050,20230128,1000,50
松屋,愛知県,松屋 安城錦町店,愛知県安城市錦町8-5,1100,20230128,1000,100
松屋,群馬県,松屋 伊勢崎宮子町店/松のや 伊勢崎宮子町店,群馬県伊勢崎市宮子町3426-1,1080,20230128,1050,30
松屋,群馬県,松屋 伊勢崎上泉町店,群馬県伊勢崎市上泉町175番4,1080,20230128,1050,30
松屋,栃木県,松屋 宇都宮簗瀬町店,栃木県宇都宮市簗瀬町1984-6,1200,20230128,1050,150
松屋,神奈川,松屋 横浜店,神奈川県横浜市西区南幸2-1-3 相鉄ムービル,1200,20230128,1100,100
松屋,東京都,松屋 王子1丁目店,東京都北区王子1-6-11 都築ビル102号,1200,20230128,1100,100
松屋,東京都,松屋 王子店,東京都北区王子1-13-16 エイムビル1F,1200,20230128,1100,100
松屋,愛知県,松屋 岡崎北店,愛知県岡崎市鴨田町字広元196,1100,20230128,1000,100
松屋,東京都,松屋 下石神井店/マイカリー食堂 下石神井店,東京都練馬区下石神井4-1-7MSビル1F,1200,20230128,1150,50
松屋,京都府,松屋 河原町店,京都府京都市中京区河原町通蛸薬師上る奈良屋町305番地,1060,20230128,1000,60
松屋,大阪府,松屋 河内山本店,大阪府八尾市山本町1-7-1 西田ビル1・4F,1060,20230128,1030,30
松屋,大阪府,松屋 外環八尾店/マイカリー食堂 外環八尾店,大阪府八尾市志紀町南3-190-1,1060,20230128,1030,30
松屋,東京都,松屋 学芸大学店,東京都目黒区鷹番3-8-7,1300,20230128,1200,100
松屋,愛知県,松屋 刈谷日高店,愛知県刈谷市日高町4丁目611,1100,20230128,1000,100
松屋,神奈川,松屋 関内ベイスターズ通り店,神奈川県横浜市中区常盤町2-10 常盤不動産 ビル1F,1150,20230128,1100,50
松屋,群馬県,松屋 館林店,群馬県館林市松原3丁目16番5,1200,20230128,1050,150
松屋,大阪府,松屋 岸和田店,大阪府岸和田市土生町2-7-17,1050,20230128,1030,20
松屋,岐阜県,松屋 岐阜茜部店,岐阜県岐阜市茜部本郷3-159-3,1080,20230128,1030,50
松屋,岐阜県,松屋 岐阜鏡島店,岐阜県岐阜市鏡島2009-1,1080,20230128,1030,50
松屋,岐阜県,松屋 岐阜則武店,岐阜県岐阜市則武西2-19-16,1080,20230128,1030,50
松屋,東京都,松屋 旗の台店,東京都品川区旗の台2-7-6,1200,20230128,1100,100
松屋,神奈川,松屋 菊名店,神奈川県横浜市港北区菊名4-2-6,1200,20230128,1100,100
松屋,東京都,松屋 吉祥寺サンロード店,東京都武蔵野市吉祥寺本町1-15-4,1250,20230128,1200,50
松屋,東京都,松屋 吉祥寺南口店,東京都武蔵野市吉祥寺南町1-5-5 1F,1200,20230128,1100,100
松屋,京都府,松屋 京都三条店,京都府京都市中京区三条通河原町東入中島町97,1060,20230128,1000,60
松屋,京都府,松屋 京都西院店,京都府京都市右京区西院高山寺町12-7,1010,20230128,1000,10
松屋,大阪府,松屋 近大前店,大阪府東大阪市小若江4-13-11 1F・2F,1060,20230128,1030,30
松屋,大阪府,松屋 近鉄八尾駅前店/松のや 近鉄八尾駅前店,大阪府八尾市北本町2-15-32梅村ビル1階,1060,20230128,1030,30
松屋,東京都,松屋 九品仏店,東京都世田谷区奥沢6-25-8,1200,20230128,1100,100
松屋,東京都,松屋 戸越銀座店,東京都品川区平塚1-8-2 山こしビル1F,1200,20230128,1100,100
松屋,東京都,松屋 江古田店,東京都練馬区栄町34-1,1200,20230128,1072,128
松屋,群馬県,松屋 高崎駅前店,群馬県高崎市八島町17-10,1100,20230128,1050,50
松屋,群馬県,松屋 高崎下之城店,群馬県高崎市下之城町177-4,1100,20230128,1050,50
松屋,群馬県,松屋 高崎問屋町店,群馬県高崎市問屋町1-10-4,1100,20230128,1050,50
松屋,東京都,松屋 国分寺南口店/マイカリー食堂 国分寺南口店,東京都国分寺市南町3-16-6,1250,20230128,1200,50
松屋,東京都,松屋 国分寺北口店,東京都国分寺市本町2-2-1 cocobunji EAST106,1200,20230128,1100,100
松屋,愛知県,松屋 今池店,愛知県名古屋市千種区今池5-23-14 コザキ今池ビル1F,1150,20230128,1100,50
松屋,大阪府,松屋 堺大野芝店/松のや 堺大野芝店,大阪府堺市中区大野芝137-1,1050,20230128,1030,20
松屋,大阪府,松屋 堺東銀座街店,大阪府堺市堺区中瓦町2-2-9,1050,20230128,1030,20
松屋,東京都,松屋 鷺宮店,東京都中野区鷺ノ宮3-18-3 エレガンス鷺ノ宮1F,1200,20230128,1100,100
松屋,東京都,松屋 桜台店,東京都練馬区桜台1-4-67,1200,20230128,1100,100
松屋,神奈川,松屋 桜木町店,神奈川県横浜市中区花咲町2-59 白鳥ビル1F,1200,20230128,1100,100
松屋,愛知県,松屋 三河安城店,愛知県安城市緑町2-9-2,1100,20230128,1000,100
松屋,東京都,松屋 三鷹店,東京都武蔵野市中町1-14-5 1F,1250,20230128,1200,50
松屋,東京都,松屋 三鷹南口店,東京都三鷹市下連雀3-34-22 ,1200,20230128,1100,100
松屋,京都府,松屋 四条烏丸店,京都府京都市下京区烏丸通仏光寺下る大政所町677番地,1050,20230128,1000,50
松屋,京都府,松屋 四条大宮駅前店,京都府京都市下京区四条通大宮東入立中町492,1010,20230128,1000,10
松屋,東京都,松屋 自由ヶ丘店,東京都目黒区自由が丘1-12-3 第二元太ビル1F,1250,20230128,1200,50
松屋,神奈川,松屋 鹿島田店,神奈川県川崎市幸区下平間135,1200,20230128,1100,100
松屋,大阪府,松屋 若江岩田店,大阪府東大阪市岩田町3-11-5,1060,20230128,1030,30
松屋,愛知県,松屋 春日井店/松のや 春日井店,愛知県春日井市鳥居松町4-14,1200,20230128,1100,100
松屋,愛知県,松屋 春日井南下原町店,愛知県春日井市西山町3-20-3,1100,20230128,1050,50
松屋,大阪府,松屋 春木店,大阪府岸和田市春木若松町18-31,1050,20230128,1030,20
松屋,東京都,松屋 小金井関野町店,東京都小金井市関野町1丁目3-5,1200,20230128,1100,100
松屋,東京都,松屋 沼袋店,東京都中野区沼袋3-4-18,1200,20230128,1100,100
松屋,東京都,松屋 上石神井店,東京都練馬区上石神井2-25-5 栄ビル 1F,1150,20230128,1100,50
松屋,愛知県,松屋 上前津店,愛知県名古屋市中区大須4-11-9,1100,20230128,1000,100
松屋,愛知県,松屋 上飯田店,愛知県名古屋市北区上飯田通1-13,1100,20230128,1050,50
松屋,愛知県,松屋 植田一本松店,愛知県名古屋市天白区一本松2-701,1100,20230128,1050,50
松屋,愛知県,松屋 新栄店,愛知県名古屋市中区葵1-20-19 芝電ビル1F,1150,20230128,1100,50
松屋,愛知県,松屋 森孝店/松のや 森孝店,愛知県名古屋市守山区森孝4-507,1150,20230128,1050,100
松屋,東京都,松屋 深大寺3丁目店,東京都三鷹市深大寺3-8-7,1200,20230128,1100,100
松屋,東京都,松屋 深大寺店,東京都調布市深大寺北町4-30-3,1200,20230128,1100,100
松屋,静岡県,松屋 神立店,静岡県浜松市東区神立町118-2,1100,20230128,1050,50
松屋,愛知県,松屋 瀬戸店,愛知県瀬戸市共栄通6-4,1100,20230128,1050,50
松屋,静岡県,松屋 清水南店,静岡県静岡市清水区駒越北町4番1号,1050,20230128,1000,50
松屋,東京都,松屋 西荻窪店,東京都杉並区西荻南3-11-8,1200,20230128,1100,100
松屋,東京都,松屋 西五反田店,東京都品川区西五反田1-11-9 司ビル,1310,20230128,1200,110
松屋,埼玉県,松屋 西所沢店/松のや 西所沢店,埼玉県所沢市上新井5-15-15,1150,20230128,1000,150
松屋,埼玉県,松屋 西川口西口店,埼玉県川口市西川口1-23-18,1200,20230128,1100,100
松屋,埼玉県,松屋 西川口店,埼玉県川口市並木2-1-6 1F,1200,20230128,1100,100
松屋,東京都,松屋 西大井店,東京都品川区西大井1-4-20コア・スターレ西大井ショッピングセンター,1200,20230128,1100,100
松屋,東京都,松屋 青物横丁店,東京都品川区東品川3-23-18 アツミビル,1200,20230128,1100,100
松屋,愛知県,松屋 青柳町店,愛知県名古屋市千種区青柳町6丁目21-1,1150,20230128,1100,50
松屋,静岡県,松屋 静岡七ツ新屋店,静岡県静岡市清水区七ツ新屋328-1,1050,20230128,1000,50
松屋,静岡県,松屋 静岡池田店,静岡県静岡市駿河区池田404-1,1050,20230128,1000,50
松屋,静岡県,松屋 静岡八幡店,静岡県静岡市駿河区八幡2丁目3-17,1050,20230128,1000,50
松屋,東京都,松屋 石神井台店,東京都練馬区石神井台6丁目7-2,1150,20230128,1100,50
松屋,東京都,松屋 赤羽西口店,東京都北区赤羽西1-38-2,1200,20230128,1100,100
松屋,東京都,松屋 赤羽店,東京都北区赤羽2-1-19 十一会ビル,1200,20230128,1100,100
松屋,東京都,松屋 赤羽東口店,東京都北区赤羽1-2-6,1200,20230128,1100,100
松屋,東京都,松屋 千石店,東京都文京区千石4-46-14,1150,20230128,1100,50
松屋,東京都,松屋 千駄木店,東京都文京区千駄木2-33-8,1150,20230128,1100,50
松屋,大阪府,松屋 千里丘店/松のや 千里丘店,大阪府摂津市千里丘5-11-3,1100,20230128,1050,50
松屋,埼玉県,松屋 川口上青木店,埼玉県川口市上青木2-47-1,1200,20230128,1100,100
松屋,神奈川,松屋 川崎京町店,神奈川県川崎市川崎区京町1-18-15,1200,20230128,1100,100
松屋,神奈川,松屋 川崎砂子店/マイカリー食堂 川崎砂子店,神奈川県川崎市川崎区砂子2-6-19,1250,20230128,1200,50
松屋,神奈川,松屋 川崎大師店/松のや 川崎大師店,神奈川県川崎市川崎区大師駅前1-6-6,1250,20230128,1200,50
松屋,東京都,松屋 浅草吾妻橋店,東京都台東区雷門2-19-13,1200,20230128,1100,100
松屋,群馬県,松屋 前橋元総社町店,群馬県前橋市元総社町90-1,1080,20230128,1050,30
松屋,群馬県,松屋 前橋三河町店,群馬県前橋市三河町2-16-16,1080,20230128,1050,30
松屋,群馬県,松屋 前橋上小出町店,群馬県前橋市上小出町2-41-7,1080,20230128,1050,30
松屋,岐阜県,松屋 多治見店,岐阜県多治見市白山町4-50,1100,20230128,1050,50
松屋,群馬県,松屋 太田飯塚町店,群馬県太田市飯塚町1443,1200,20230128,1050,150
松屋,東京都,松屋 大井町店,東京都品川区東大井5-6-8,1200,20230128,1100,100
松屋,東京都,松屋 大岡山店,東京都大田区北千束1-40-1 石井ビル1F,1200,20230128,1100,100
松屋,岐阜県,松屋 大垣店,岐阜県大垣市禾森町5-190,1080,20230128,1030,50
松屋,東京都,松屋 大森店,東京都大田区山王2-2-11,1200,20230128,1100,100
松屋,東京都,松屋 大森北口店,東京都品川区南大井6-24-1セブンスターマンション第五大森,1200,20230128,1100,100
松屋,東京都,松屋 大泉学園町店,東京都練馬区大泉学園町7-15-20,1150,20230128,1080,70
松屋,東京都,松屋 大泉学園店,東京都練馬区東大泉1-37-3,1150,20230128,1080,70
松屋,東京都,松屋 大泉学園南口店,東京都練馬区東大泉5-41-14,1150,20230128,1080,70
松屋,愛知県,松屋 大曽根北店,愛知県名古屋市北区山田町4-72,1100,20230128,1050,50
松屋,東京都,松屋 中井店,東京都新宿区上落合2-20-3,1200,20230128,1100,100
松屋,東京都,松屋 中延店,東京都品川区中延4-5-3 智勇第一ビル1F,1200,20230128,1100,100
松屋,神奈川,松屋 中山店,神奈川県横浜市緑区寺山町87-7,1150,20230128,1100,50
松屋,東京都,松屋 中村橋店,東京都練馬区貫井2-2-5 ムツワビル1.2F,1200,20230128,1100,100
松屋,東京都,松屋 中目黒青葉台2丁目店,東京都目黒区青葉台2丁目21-9,1250,20230128,1200,50
松屋,東京都,松屋 中目黒店,東京都目黒区上目黒3-3-1 中津川ビル1・2F,1250,20230128,1200,50
松屋,愛知県,松屋 長久手店,愛知県長久手市武蔵塚702,1100,20230128,1050,50
松屋,大阪府,松屋 長瀬店,大阪府東大阪市菱屋西1-17-14,1060,20230128,1030,30
松屋,東京都,松屋 椎名町店,東京都豊島区長崎1-2-4 バイオレットインA室,1200,20230128,1100,100
松屋,神奈川,松屋 鶴見東口店/マイカリー食堂 鶴見東口店,神奈川県横浜市鶴見区鶴見中央1-3-3,1250,20230128,1200,50
松屋,奈良県,松屋 天理店/マイカリー食堂 天理店,奈良県天理市守目堂町106-2,950,20230128,900,50
松屋,東京都,松屋 田無駅前店,東京都西東京市田無町4-2-12 A2ビル1階,1150,20230128,1100,50
松屋,東京都,松屋 都立家政店,東京都中野区鷺宮3-6-1 岡田ビル,1200,20230128,1100,100
松屋,東京都,松屋 都立大学店,東京都目黒区平町1-27-5,1250,20230128,1200,50
松屋,東京都,松屋 東久留米下里店,東京都東久留米市下里3-24-12,1150,20230128,1100,50
松屋,東京都,松屋 東久留米店/マイカリー食堂 東久留米店,東京都東久留米市東本町1-8 神藤ビル1F,1200,20230128,1130,70
松屋,東京都,松屋 東久留米南町店,東京都東久留米市南町4-1-8,1150,20230128,1100,50
松屋,東京都,松屋 東五反田店,東京都品川区東五反田2-4-1 東五反田レンガビル1F,1310,20230128,1200,110
松屋,東京都,松屋 東十条店,東京都北区東十条4-4-24 宮田ビル1F,1200,20230128,1100,100
松屋,東京都,松屋 東小金井店,東京都小金井市東町4-42-19,1200,20230128,1100,100
松屋,神奈川,松屋 東神奈川店,神奈川県横浜市神奈川区西神奈川1-20-4 加賀ビル,1150,20230128,1100,50
松屋,東京都,松屋 東大井町店,東京都品川区東大井5-21-5,1250,20230128,1200,50
松屋,東京都,松屋 東長崎駅前店,東京都豊島区南長崎5-25-12,1200,20230128,1100,100
松屋,東京都,松屋 東伏見店,東京都西東京市東伏見2-4-6高橋イーストビル,1150,20230128,1100,50
松屋,愛知県,松屋 藤が丘店,愛知県名古屋市名東区藤が丘164番地,1100,20230128,1050,50
松屋,大阪府,松屋 藤井寺駅前店,大阪府藤井寺市岡2-7-18,1060,20230128,1030,30
松屋,奈良県,松屋 奈良駅前店,奈良県奈良市三条本町3番8号,950,20230128,900,50
松屋,奈良県,松屋 奈良三条大路店,奈良県奈良市三条大路3-2-21,950,20230128,900,50
松屋,東京都,松屋 日暮里店,東京都荒川区西日暮里2-25-1-307,1200,20230128,1100,100
松屋,静岡県,松屋 日本平PA（下り線）店,静岡県静岡市駿河区国吉田字西原坪,1050,20230128,1000,50
松屋,東京都,松屋 白山店,東京都文京区向丘1-9-23,1150,20230128,1100,50
松屋,大阪府,松屋 八尾南太子堂店/松のや 八尾南太子堂店,大阪府八尾市南太子堂6丁目76-1(地番),1060,20230128,1050,10
松屋,大阪府,松屋 八尾本町店,大阪府八尾市本町2-8-19,1060,20230128,1030,30
松屋,神奈川,松屋 反町店,神奈川県横浜市神奈川区松本町1-1-9 MKビル,1150,20230128,1100,50
松屋,東京都,松屋 尾山台店,東京都世田谷区尾山台3-22-5 谷岸ビル,1200,20230128,1100,100
松屋,京都府,松屋 百万遍店,京都府京都市左京区吉田泉殿町1-87番地,1060,20230128,1000,60
松屋,大阪府,松屋 瓢箪山駅前店,大阪府東大阪市本町15-15,1060,20230128,1030,30
松屋,大阪府,松屋 浜寺店,大阪府堺市西区浜寺船尾町西5丁132-1,1050,20230128,1030,20
松屋,静岡県,松屋 浜松高竜店,静岡県浜松市中区寺島町1024,1100,20230128,1050,50
松屋,静岡県,松屋 浜松高林店,静岡県浜松市中区高林4-14-22,1100,20230128,1050,50
松屋,東京都,松屋 富士見台店,東京都練馬区貫井3-1-8,1200,20230128,1100,100
松屋,大阪府,松屋 布施店,大阪府東大阪市足代新町2-18,1060,20230128,1030,30
松屋,大阪府,松屋 布施南店/松のや 布施南店,大阪府東大阪市寿町3-10-19,1060,20230128,1030,30
松屋,東京都,松屋 浮間舟渡駅前店,東京都北区浮間4-32-20 松岡ビル,1200,20230128,1100,100
松屋,東京都,松屋 武蔵関店,東京都練馬区関町北2-27-13 下田ビル1F,1150,20230128,1100,50
松屋,東京都,松屋 武蔵境店,東京都武蔵野市境1-2-3,1200,20230128,1100,100
松屋,東京都,松屋 武蔵小金井店,東京都小金井市本町1-18-8桜並SHビル,1200,20230128,1100,100
松屋,神奈川,松屋 武蔵新城店,神奈川県川崎市中原区上新城2-10-15 新城ロイヤルプラザ1F,1200,20230128,1150,50
松屋,神奈川,松屋 平間店,神奈川県川崎市中原区北谷町8,1200,20230128,1100,100
松屋,愛知県,松屋 平針店/松のや 平針店,愛知県名古屋市天白区平針3-117,1100,20230128,1050,50
松屋,東京都,松屋 保谷店,東京都西東京市東町3-14-27,1200,20230128,1080,120
松屋,神奈川,松屋 保土ヶ谷PA（下り線）店,神奈川県横浜市神奈川区羽沢町48,1250,20230128,1200,50
松屋,愛知県,松屋 豊橋つつじが丘店,愛知県豊橋市つつじが丘1-6-10,1050,20230128,1000,50
松屋,愛知県,松屋 豊橋藤沢町店,愛知県豊橋市藤沢町138番,1050,20230128,1000,50
松屋,愛知県,松屋 豊田十塚店,愛知県豊田市十塚町4-23-1,1120,20230128,1100,20
松屋,東京都,松屋 豊島園店,東京都練馬区練馬4-15-23 パークサイドハイツ,1200,20230128,1100,100
松屋,東京都,松屋 北赤羽店,東京都北区浮間3-1-38近藤ビル,1200,20230128,1100,100
松屋,岐阜県,松屋 北方町店/松のや 北方町店,岐阜県本巣郡北方町高屋伊勢田2-74-1,1100,20230128,1030,70
松屋,愛知県,松屋 野並店,愛知県名古屋市緑区鳴海町字杜若7-1,1100,20230128,1050,50
松屋,東京都,松屋 野方店,東京都中野区野方5-30-1 1・2F,1200,20230128,1100,100
松屋,神奈川,松屋 矢向店,神奈川県横浜市鶴見区矢向6-5-8,1200,20230128,1100,100
松屋,東京都,松屋 祐天寺店,東京都目黒区祐天寺2-2-7 青埜ビル1F,1250,20230128,1200,50
松屋,東京都,松屋 立会川店,東京都品川区東大井2-24-11 織戸ビル,1200,20230128,1100,100
松屋,埼玉県,松屋 蕨西口店,埼玉県蕨市中央1-23,1100,20230128,1000,100
