松屋,福島県,松屋 エイトタウン本宮店,福島県本宮市荒井字久保田132-8-5   ,1000,20221008,920,80
松屋,栃木県,松屋 宇都宮簗瀬町店,栃木県宇都宮市簗瀬町1984-6,1050,20221008,1000,50
松屋,東京都,松屋 喜多見店,東京都世田谷区喜多見9-1-7 栄屋ビル,1200,20221008,1100,100
松屋,東京都,松屋 久米川店,東京都東村山市栄町1-5-2,1100,20221008,1072,28
松屋,東京都,松屋 駒込店,東京都豊島区駒込1-38-3 小宮山駒込ビル1.2F,1100,20221008,1072,28
松屋,福島県,松屋 郡山コスモス通店,福島県郡山市堤3-180,1000,20221008,920,80
松屋,栃木県,松屋 御幸本町店,栃木県宇都宮市御幸本町4732-7,1050,20221008,1000,50
松屋,広島県,松屋 広島矢野店,広島県広島市安芸区矢野西1-2-5,1000,20221008,980,20
松屋,東京都,松屋 狛江店,東京都狛江市東和泉1丁目18-8,1200,20221008,1100,100
松屋,東京都,松屋 小平小川店,東京都小平市小川東町5-2-5,1100,20221008,1072,28
松屋,東京都,松屋 小平店,東京都小平市美園町1-3-9,1100,20221008,1072,28
松屋,東京都,松屋 清瀬店/松のや 清瀬店,東京都清瀬市松山1-9-4,1100,20221008,1072,28
松屋,東京都,松屋 清瀬野塩店,東京都清瀬市野塩4-224-1,1100,20221008,1072,28
松屋,東京都,松屋 西巣鴨店,東京都豊島区西巣鴨3-25-11 メトロエステート西巣鴨110・111号,1100,20221008,1072,28
松屋,東京都,松屋 鷹の台店,東京都小平市たかの台44-8長谷川ビル,1100,20221008,1072,28
松屋,東京都,松屋 東村山店,東京都東村山市本町2-3-77 吉崎ビル1F,1100,20221008,1072,28
松屋,東京都,松屋 東大和市駅前店,東京都東大和市南街5-93-13ビル・エール1階,1100,20221008,1072,28
松屋,東京都,松屋 東大和清水店,東京都東大和市清水5-1095-7,1100,20221008,1072,28
松屋,東京都,松屋 梅ヶ丘店,東京都世田谷区梅丘1-33-9,1200,20221008,1100,100
松屋,福島県,松屋 白河店,福島県西白河郡西郷村字豊作東1,980,20221008,920,60
松屋,東京都,松屋 板橋店,東京都板橋区板橋1-50-1,1100,20221008,1072,28
松屋,東京都,松屋 板橋本町店,東京都板橋区本町36-1 バロール本町1F,1100,20221008,1072,28
松屋,東京都,松屋 府中本町店/マイカリー食堂 府中本町店,東京都府中市本町1-29-1,1100,20221008,1080,20
松屋,東京都,松屋 武蔵村山店,東京都武蔵村山市学園3-37-2,1100,20221008,1072,28
松屋,東京都,松屋 蓮根店,東京都板橋区蓮根2-31-3,1100,20221008,1072,28
すき家,岩手県,すき家 106号宮古店,岩手県宮古市長町1-5-17,950,20221008,900,50
すき家,宮崎県,すき家 10号宮崎大橋店,宮崎県宮崎市大橋2-30,950,20221008,920,30
すき家,茨城県,すき家 124号波崎店,茨城県神栖市波崎8370-1,1050,20221008,1000,50
すき家,埼玉県,すき家 125号加須諏訪店,埼玉県加須市諏訪1-15-1,1030,20221008,1000,30
すき家,茨城県,すき家 125号八千代町店,茨城県結城郡八千代町菅谷604-1,1000,20221008,980,20
すき家,千葉県,すき家 128号鴨川店,千葉県鴨川市広場字汐入765-1,1030,20221008,980,50
すき家,北海道,すき家 12号滝川東町店,北海道滝川市東町2-42-7,960,20221008,920,40
すき家,神奈川,すき家 134号横須賀長坂店,神奈川県横須賀市長坂2-11-2,1120,20221008,1090,30
すき家,滋賀県,すき家 161号安曇川店,滋賀県高島市安曇川町青柳1199-1,1050,20221008,1000,50
すき家,大阪府,すき家 163号門真殿島店,大阪府門真市殿島町7-13,1050,20221008,1020,30
すき家,大阪府,すき家 170号羽曳野西浦店,大阪府羽曳野市西浦3-2-1,1050,20221008,1000,50
すき家,大阪府,すき家 170号熊取店,大阪府泉南郡熊取町紺屋2-5-5,1050,20221008,1000,50
すき家,大阪府,すき家 170号寝屋川高宮店,大阪府寝屋川市高宮1-10-27,1050,20221008,1020,30
すき家,京都府,すき家 171号向日店,京都府向日市鶏冠井町清水7-1,1050,20221008,1020,30
すき家,大阪府,すき家 171号箕面今宮店,大阪府箕面市今宮2-3-1,1050,20221008,1020,30
すき家,大阪府,すき家 171号箕面牧落店,大阪府箕面市牧落3-20-30,1050,20221008,1020,30
すき家,兵庫県,すき家 175号平野芝崎店,兵庫県神戸市西区平野町芝崎255-1,1000,20221008,980,20
すき家,大分県,すき家 197号大分庄境店,大分県大分市庄境4-15,950,20221008,920,30
すき家,福岡県,すき家 199号若松東二島店,福岡県北九州市若松区東二島3-2-45,950,20221008,920,30
すき家,滋賀県,すき家 1国湖南石部店,滋賀県湖南市石部口1-10-5,1050,20221008,1000,50
すき家,大阪府,すき家 1国城東関目店,大阪府大阪市城東区関目5-3-3,1050,20221008,1020,30
すき家,滋賀県,すき家 1国水口店,滋賀県甲賀市水口町北泉2-2,1050,20221008,1000,50
すき家,大阪府,すき家 1国枚方北中振店,大阪府枚方市北中振4-10-5,1050,20221008,1020,30
すき家,福岡県,すき家 200号直方店,福岡県直方市大字頓野字縄手下3891-11,950,20221008,900,50
すき家,福岡県,すき家 200号飯塚嘉穂店,福岡県飯塚市小正298-2,950,20221008,920,30
すき家,福岡県,すき家 202号糸島前原店,福岡県糸島市前原東1-6-13,930,20221008,900,30
すき家,佐賀県,すき家 202号唐津鏡店,佐賀県唐津市鏡4664-1,920,20221008,900,20
すき家,福岡県,すき家 202号福岡周船寺店,福岡県福岡市西区周船寺1-13-8,930,20221008,920,10
すき家,長崎県,すき家 204号佐世保田原店,長崎県佐世保市田原町17-23,920,20221008,900,20
すき家,長崎県,すき家 207号時津店,長崎県西彼杵郡時津町浜田郷627-1,920,20221008,900,20
すき家,熊本県,すき家 208号荒尾原万田店,熊本県荒尾市原万田字八反田618-3,950,20221008,920,30
すき家,福岡県,すき家 208号柳川店,福岡県柳川市三橋町柳河827-4,950,20221008,920,30
すき家,福岡県,すき家 209号筑後店,福岡県筑後市山ノ井346-3,950,20221008,920,30
すき家,福岡県,すき家 210号うきは店,福岡県うきは市吉井町清瀬515-2,950,20221008,900,50
すき家,福岡県,すき家 211号八幡西店,福岡県北九州市八幡西区上の原3-1-6,950,20221008,920,30
すき家,大分県,すき家 217号臼杵店,大分県臼杵市市浜1128-1,920,20221008,880,40
すき家,鹿児島,すき家 220号志布志店,鹿児島県志布志市志布志町安楽123-21,950,20221008,920,30
すき家,宮崎県,すき家 221号小林店,宮崎県小林市堤3013-1,950,20221008,920,30
すき家,宮崎県,すき家 222号日南店,宮崎県日南市中央通1-11-23,950,20221008,920,30
すき家,北海道,すき家 231号留萌店,北海道留萌市旭町2-1-1,960,20221008,950,10
すき家,和歌山,すき家 24号高野口名古曽店,和歌山県橋本市高野口町名古曽948-1,950,20221008,920,30
すき家,兵庫県,すき家 250号赤穂駅前店,兵庫県赤穂市加里屋69-11,1030,20221008,1000,30
すき家,大阪府,すき家 25号八尾永畑店,大阪府八尾市永畑町1-2-58,1050,20221008,1020,30
すき家,大阪府,すき家 25号平野加美西店,大阪府大阪市平野区加美西1-6-16,1050,20221008,1020,30
すき家,福岡県,すき家 263号福岡野芥店,福岡県福岡市早良区野芥4-45-5,950,20221008,920,30
すき家,大阪府,すき家 26号岸和田下池田店,大阪府岸和田市下池田町1-2-3,1050,20221008,1020,30
すき家,大阪府,すき家 26号高石店,大阪府高石市西取石7-11-1,1050,20221008,1020,30
すき家,大阪府,すき家 26号堺山本店,大阪府堺市堺区山本町3-78,1050,20221008,1030,20
すき家,大阪府,すき家 26号西住之江店,大阪府大阪市住之江区西住之江1-9-21,1050,20221008,1030,20
すき家,大阪府,すき家 26号泉佐野鶴原店,大阪府泉佐野市鶴原1855-3,1050,20221008,1000,50
すき家,大阪府,すき家 26号泉大津店,大阪府泉大津市北豊中町2-17-24,1050,20221008,1000,50
すき家,岩手県,すき家 282号八幡平店,岩手県八幡平市大更第18地割88-12,880,20221008,850,30
すき家,福島県,すき家 288号田村店,福島県田村市船引町船引字舘柄前89-1,950,20221008,900,50
すき家,千葉県,すき家 297号大多喜店,千葉県夷隅郡大多喜町船子311-3,1030,20221008,980,50
すき家,兵庫県,すき家 2国西宮北今津店,兵庫県西宮市津門稲荷町5-8,1030,20221008,1000,30
すき家,兵庫県,すき家 2国尼崎杭瀬店,兵庫県尼崎市杭瀬北新町3-2-18,1060,20221008,1030,30
すき家,大阪府,すき家 307号枚方津田西店,大阪府枚方市津田西町1-2-1,1050,20221008,1020,30
すき家,大阪府,すき家 309号堺黒山店,大阪府堺市美原区黒山168-1,1050,20221008,1030,20
すき家,大阪府,すき家 310号堺大野芝店,大阪府堺市中区大野芝町209-1,1050,20221008,1030,20
すき家,大阪府,すき家 310号大阪狭山店,大阪府大阪狭山市東茱萸木1-691-1,1050,20221008,1000,50
すき家,熊本県,すき家 325号菊池店,熊本県菊池市隈府字北原597-2,920,20221008,900,20
すき家,佐賀県,すき家 34号小城三日月店,佐賀県小城市三日月町金田1101-1,950,20221008,920,30
すき家,長崎県,すき家 34号長崎矢上町店,長崎県長崎市矢上町52-2,920,20221008,900,20
すき家,佐賀県,すき家 34号鳥栖店,佐賀県鳥栖市萱方町177-1,950,20221008,920,30
すき家,長崎県,すき家 35号佐世保大和店,長崎県佐世保市大和町749-1,920,20221008,900,20
すき家,北海道,すき家 36号清田里塚店,北海道札幌市清田区里塚一条3-2-10,1000,20221008,960,40
すき家,福岡県,すき家 389号大牟田店,福岡県大牟田市大正町3-4-3,950,20221008,920,30
すき家,北海道,すき家 39号網走新町店,北海道網走市新町2-3-5,1000,20221008,950,50
すき家,熊本県,すき家 3号宇土店,熊本県宇土市水町62-7,950,20221008,900,50
すき家,福岡県,すき家 3号黒崎店,福岡県北九州市八幡西区熊西2-1-29,950,20221008,920,30
すき家,鹿児島,すき家 3号薩摩川内店,鹿児島県薩摩川内市御陵下町字住連木14-18,950,20221008,920,30
すき家,福岡県,すき家 3号小倉北到津店,福岡県北九州市小倉北区上到津2-3-151F,950,20221008,920,30
すき家,福岡県,すき家 3号八女店,福岡県八女市本村字荷稲559-1,950,20221008,920,30
すき家,福岡県,すき家 3号門司黄金町店,福岡県北九州市門司区黄金町3-22,950,20221008,920,30
すき家,北海道,すき家 40号名寄店,北海道名寄市西四条南10-56-1,960,20221008,920,40
すき家,和歌山,すき家 42号海南店,和歌山県海南市船尾264-1,980,20221008,950,30
すき家,和歌山,すき家 42号有田店,和歌山県有田市宮崎町34-1,1000,20221008,950,50
すき家,福岡県,すき家 495号古賀花見店,福岡県古賀市花見東1-15-13,950,20221008,920,30
すき家,長崎県,すき家 499号長崎江川町店,長崎県長崎市柳田町28-1,920,20221008,900,20
すき家,福島県,すき家 49号郡山IC店,福島県郡山市富田町池ノ上36-1,960,20221008,910,50
すき家,岩手県,すき家 4号奥州水沢店,岩手県奥州市水沢区太日通り1-4-13,980,20221008,960,20
すき家,岩手県,すき家 4号金ヶ崎店,岩手県胆沢郡金ヶ崎町三ケ尻荒巻159-1,980,20221008,930,50
すき家,福島県,すき家 4号郡山日和田店,福島県郡山市日和田町字原12-110,960,20221008,910,50
すき家,宮城県,すき家 4号柴田店,宮城県柴田郡柴田町西船迫1-1-55,930,20221008,910,20
すき家,埼玉県,すき家 4号杉戸堤根店,埼玉県北葛飾郡杉戸町堤根4024-1,1050,20221008,1000,50
すき家,岩手県,すき家 4号盛岡上田店,岩手県盛岡市上田4-20-47,900,20221008,880,20
すき家,岩手県,すき家 4号滝沢店,岩手県滝沢市巣子109-2,880,20221008,850,30
すき家,福島県,すき家 4号矢吹店,福島県西白河郡矢吹町新町205-1,950,20221008,900,50
すき家,福岡県,すき家 500号小郡店,福岡県小郡市小郡字江下1483-4,950,20221008,920,30
すき家,大分県,すき家 500号別府石垣店,大分県別府市石垣西10-3-30,950,20221008,920,30
すき家,北海道,すき家 5号小樽朝里店,北海道小樽市新光2-1-4,980,20221008,940,40
すき家,京都府,すき家 9号亀岡篠町店,京都府亀岡市篠町野条上又13-1,1000,20221008,990,10
すき家,京都府,すき家 9号亀岡千代川店,京都府亀岡市千代川町高野林西ノ畑15-5,1000,20221008,990,10
すき家,京都府,すき家 9号福知山店,京都府福知山市駅南町3-139,1050,20221008,1000,50
すき家,兵庫県,すき家 JR西宮駅北口店,兵庫県西宮市西福町2-23イサダビル1F,1030,20221008,1000,30
すき家,兵庫県,すき家 JR尼崎駅北口店,兵庫県尼崎市潮江1-3-43,1060,20221008,1030,30
すき家,大阪府,すき家 なんば楽座店,大阪府大阪市中央区難波4-3-19,1120,20221008,1100,20
すき家,大阪府,すき家 はびきの伊賀店,大阪府羽曳野市伊賀4-5-6,1050,20221008,1020,30
すき家,長崎県,すき家 みらい長崎ココウォーク店,長崎県長崎市茂里町1-55みらい長崎ココウォーク3F,900,20221008,850,50
すき家,青森県,すき家 むつ中央店,青森県むつ市中央2-9-1,1000,20221008,920,80
すき家,宮城県,すき家 イオンタウン佐沼店,宮城県登米市南方町新島前46-1,950,20221008,900,50
すき家,北海道,すき家 イオンモール旭川西店,北海道旭川市緑町23-2161-3,960,20221008,950,10
すき家,大阪府,すき家 イオンモール茨木店,大阪府茨木市松ヶ本町8-30-3イオン茨木店1F,1050,20221008,1020,30
すき家,埼玉県,すき家 イオンモール浦和美園店,埼玉県さいたま市緑区美園5-50-1イオンモール浦和美園3Fフードコート,1080,20221008,1050,30
すき家,茨城県,すき家 イオンモール下妻店,茨城県下妻市堀篭972-1,1000,20221008,980,20
すき家,千葉県,すき家 イオンモール津田沼店,千葉県習志野市津田沼1-23-1フ-ドコ-ト1F,1030,20221008,1000,30
すき家,千葉県,すき家 イオンモール柏店,千葉県柏市豊町2-5-25イオンモール柏2F,1020,20221008,1000,20
すき家,北海道,すき家 イオンモール発寒店,北海道札幌市西区発寒八条12-1-1,980,20221008,930,50
すき家,千葉県,すき家 イオン海浜幕張店,千葉県千葉市美浜区ひび野1-3イオン幕張,1050,20221008,1000,50
すき家,宮城県,すき家 フォレオせんだい宮の杜店,宮城県仙台市宮城野区東仙台4-14-3,950,20221008,930,20
すき家,大阪府,すき家 阿倍野店,大阪府大阪市阿倍野区阿倍野筋2-4-49アベニュ-ホ-ル1F,1050,20221008,1030,20
すき家,茨城県,すき家 稲敷江戸崎店,茨城県稲敷市江戸崎甲2141-3,1020,20221008,980,40
すき家,大阪府,すき家 茨木IC店,大阪府茨木市郡4-11-36,1050,20221008,1020,30
すき家,大阪府,すき家 茨木中穂積店,大阪府茨木市中穂積2-10-8,1050,20221008,1020,30
すき家,京都府,すき家 宇治東IC店,京都府宇治市菟道西隼上り1-26,1000,20221008,960,40
すき家,神奈川,すき家 横須賀衣笠店,神奈川県横須賀市衣笠町43-17,1120,20221008,1090,30
すき家,神奈川,すき家 横浜アリーナ前店,神奈川県横浜市港北区新横浜3-17-20ヒューマンハイム新横浜,1200,20221008,1150,50
すき家,埼玉県,すき家 加須南大桑店,埼玉県加須市南大桑2877-1,1030,20221008,1000,30
すき家,大阪府,すき家 貝塚北町店,大阪府貝塚市北町17-15,1050,20221008,1000,50
すき家,大阪府,すき家 蒲生四丁目店,大阪府大阪市城東区蒲生4-21-8,1050,20221008,1020,30
すき家,大阪府,すき家 関目店,大阪府大阪市城東区成育2-13-15アイビーマンション1F,1050,20221008,1020,30
すき家,千葉県,すき家 館山店,千葉県館山市安布里190-2,1030,20221008,1000,30
すき家,大阪府,すき家 岸和田磯上店,大阪府岸和田市磯上町4-23-25,1050,20221008,1020,30
すき家,大阪府,すき家 岸和田和泉IC北店,大阪府岸和田市田治米町343-1,1050,20221008,1020,30
すき家,埼玉県,すき家 岩槻駅前店,埼玉県さいたま市岩槻区本町1-3-3吉田ビル1F,1050,20221008,1000,50
すき家,埼玉県,すき家 岩槻城北東店,埼玉県さいたま市岩槻区上野1-20-5,1050,20221008,1000,50
すき家,埼玉県,すき家 久喜栗原店,埼玉県久喜市栗原2-2-5,1050,20221008,1000,50
すき家,福岡県,すき家 久留米国分店,福岡県久留米市国分町字御供田1604-7,950,20221008,920,30
すき家,宮崎県,すき家 宮崎東大淀店,宮崎県宮崎市東大淀2-3-41,950,20221008,920,30
すき家,大阪府,すき家 京阪枚方市駅前店,大阪府枚方市岡本町3-4N´sSquare1F,1050,20221008,1020,30
すき家,京都府,すき家 京田辺興戸店,京都府京田辺市興戸犬伏32-1,1000,20221008,980,20
すき家,京都府,すき家 京都太秦店,京都府京都市右京区常盤東ノ町6-3,1000,20221008,980,20
すき家,大阪府,すき家 玉造駅前店,大阪府大阪市中央区玉造1-5-8大倉ビル,1050,20221008,1030,20
すき家,兵庫県,すき家 玉津IC南店,兵庫県神戸市西区小山3-13-13,1000,20221008,980,20
すき家,大阪府,すき家 近畿大学店,大阪府東大阪市新上小阪5-86近畿大学Eキャンパス構内,1050,20221008,1020,30
すき家,滋賀県,すき家 栗東大宝店,滋賀県栗東市霊仙寺3-8-32,1050,20221008,1000,50
すき家,福島県,すき家 郡山富久山店,福島県郡山市富久山町久保田字太郎殿前2-12,960,20221008,950,10
すき家,福島県,すき家 郡山鳴神店,福島県郡山市鳴神3-238,960,20221008,910,50
すき家,千葉県,すき家 五香駅前店,千葉県松戸市常盤平5-11-12,1020,20221008,1000,20
すき家,大阪府,すき家 交野星田北店,大阪府交野市星田北3-37-4,1050,20221008,1020,30
すき家,埼玉県,すき家 幸手店,埼玉県幸手市中2-12-35,1050,20221008,1000,50
すき家,広島県,すき家 広大前店,広島県東広島市西条下見5-1-7,950,20221008,930,20
すき家,大阪府,すき家 江戸堀店,大阪府大阪市西区江戸堀1-24-15タツト・肥後橋ビル1F,1100,20221008,1050,50
すき家,神奈川,すき家 港北箕輪町店,神奈川県横浜市港北区箕輪町2-5-5,1180,20221008,1140,40
すき家,大阪府,すき家 香里園駅前店,大阪府寝屋川市香里南之町20-23,1050,20221008,1020,30
すき家,大阪府,すき家 高槻下田部店,大阪府高槻市下田部町1-3-28,1050,20221008,1020,30
すき家,大阪府,すき家 高槻古曽部店,大阪府高槻市古曽部町2-21-32,1050,20221008,1020,30
すき家,大阪府,すき家 此花四貫島店,大阪府大阪市此花区四貫島2-4-5,1070,20221008,1050,20
すき家,栃木県,すき家 佐野大橋店,栃木県佐野市大橋町3239-1,1050,20221008,1010,40
すき家,栃木県,すき家 佐野鐙塚店,栃木県佐野市鐙塚町177-1,1050,20221008,1010,40
すき家,大阪府,すき家 阪急茨木市駅前店,大阪府茨木市双葉町8-1奥村ビル1F,1050,20221008,1020,30
すき家,兵庫県,すき家 阪急園田駅前店,兵庫県尼崎市東園田町9-17-16メゾン・ドゥ・ファミリー1F,1060,20221008,1000,60
すき家,大阪府,すき家 阪急庄内南店,大阪府豊中市庄内西町5-1-3,1060,20221008,1030,30
すき家,大阪府,すき家 阪急淡路西口店,大阪府大阪市東淀川区淡路4-11-15井上ビル1F,1060,20221008,1030,30
すき家,大阪府,すき家 阪神野田駅前店,大阪府大阪市福島区海老江1-1-17野田アプラ105,1120,20221008,1090,30
すき家,大阪府,すき家 堺IC店,大阪府堺市南区小代457-1,1050,20221008,1030,20
すき家,大阪府,すき家 堺筋恵美須町店,大阪府大阪市浪速区日本橋5-13-18フォレシティ日本橋V1F,1070,20221008,1050,20
すき家,大阪府,すき家 堺筋本町店,大阪府大阪市中央区本町1-7-1三星本町ビル1F,1120,20221008,1100,20
すき家,大阪府,すき家 堺高須店,大阪府堺市堺区高須町2-1-16,1050,20221008,1030,20
すき家,大阪府,すき家 堺黒土店,大阪府堺市北区黒土町2355-1,1050,20221008,1030,20
すき家,大阪府,すき家 堺津久野店,大阪府堺市西区下田町26-23,1050,20221008,1030,20
すき家,大阪府,すき家 堺片蔵店,大阪府堺市南区片蔵1333-1,1050,20221008,1020,30
すき家,大阪府,すき家 桜川駅前店,大阪府大阪市浪速区幸町2-8-8常盤機械ビル1F,1050,20221008,1030,20
すき家,北海道,すき家 札幌桑園店,北海道札幌市中央区北十一条西20丁目1-10,1000,20221008,960,40
すき家,北海道,すき家 札幌山鼻店,北海道札幌市中央区南十三条西15-3-6,1000,20221008,960,40
すき家,北海道,すき家 札幌新道発寒店,北海道札幌市西区発寒12条1-2-30,1000,20221008,960,40
すき家,北海道,すき家 札幌屯田店,北海道札幌市北区屯田六条4-4-20,1000,20221008,960,40
すき家,北海道,すき家 札幌美香保店,北海道札幌市東区北二十条東8-3-5,1000,20221008,960,40
すき家,北海道,すき家 札幌北33条店,北海道札幌市北区北三十三条西4-1-12,1000,20221008,960,40
すき家,北海道,すき家 札幌北郷店,北海道札幌市白石区北郷三条8-1-1,1000,20221008,960,40
すき家,北海道,すき家 札幌北野店,北海道札幌市清田区北野七条3-5-5,1000,20221008,960,40
すき家,大阪府,すき家 三国本町店,大阪府大阪市淀川区三国本町2-13-14,1060,20221008,1030,30
すき家,青森県,すき家 三沢緑町店,青森県三沢市緑町3-8-15,1000,20221008,970,30
すき家,大阪府,すき家 寺田町駅前店,大阪府大阪市阿倍野区天王寺町北2-1-5,1050,20221008,1030,20
すき家,神奈川,すき家 鹿島田駅前店,神奈川県川崎市幸区鹿島田1丁目18-6KSビル1F,1180,20221008,1140,40
すき家,山形県,すき家 酒田若竹店,山形県酒田市若竹町2-3-5,980,20221008,960,20
すき家,福岡県,すき家 宗像赤間店,福岡県宗像市赤間駅前2-2-19,920,20221008,900,20
すき家,大阪府,すき家 住吉遠里小野店,大阪府大阪市住吉区遠里小野2-10-30,1050,20221008,1030,20
すき家,大阪府,すき家 住吉長居公園通店,大阪府大阪市住吉区長居東1-31,1050,20221008,1030,20
すき家,大阪府,すき家 住之江大和川通店,大阪府大阪市住之江区新北島1-9-5,1050,20221008,1030,20
すき家,大阪府,すき家 十三駅西口店,大阪府大阪市淀川区十三本町1-7-1カネイシビル,1060,20221008,1050,10
すき家,福岡県,すき家 春日白水店,福岡県春日市白水ヶ丘4-61,950,20221008,920,30
すき家,北海道,すき家 小樽有幌店,北海道小樽市有幌町2-14,980,20221008,940,40
すき家,大阪府,すき家 松原阿保店,大阪府松原市阿保6-871-1,1050,20221008,1030,20
すき家,大阪府,すき家 松原南新町店,大阪府松原市南新町4-107-17,1050,20221008,1030,20
すき家,大阪府,すき家 上六店,大阪府大阪市天王寺区上本町6-9-20,1050,20221008,1030,20
すき家,神奈川,すき家 新横浜店,神奈川県横浜市港北区新横浜2-6-17,1200,20221008,1150,50
すき家,埼玉県,すき家 新座駅前店,埼玉県新座市野火止5-3-11,1030,20221008,1000,30
すき家,千葉県,すき家 新習志野店,千葉県習志野市茜浜2-1-12,1050,20221008,1000,50
すき家,千葉県,すき家 新松戸店,千葉県松戸市新松戸3-271神谷第一ビル,1050,20221008,1000,50
すき家,大阪府,すき家 新大阪西宮原店,大阪府大阪市淀川区西宮原1-8-41新大阪南愛ビル1階,1060,20221008,1050,10
すき家,北海道,すき家 深川店,北海道深川市三条18-25,960,20221008,920,40
すき家,兵庫県,すき家 神戸鹿の子台店,兵庫県神戸市北区鹿の子台北町8-4-2,1030,20221008,1000,30
すき家,大阪府,すき家 吹田五月が丘店,大阪府吹田市五月が丘東13-19,1050,20221008,1020,30
すき家,茨城県,すき家 水海道店,茨城県常総市新井木町字江畑102-3,1000,20221008,980,20
すき家,大阪府,すき家 菅原店,大阪府大阪市東淀川区菅原7-5-31,1060,20221008,1030,30
すき家,大阪府,すき家 生野巽東店,大阪府大阪市生野区巽東3-13-10,1050,20221008,1030,20
すき家,兵庫県,すき家 西宮今津巽店,兵庫県西宮市今津巽町4-37,1030,20221008,1000,30
すき家,兵庫県,すき家 西宮北IC店,兵庫県西宮市山口町下山口3-5-23,1030,20221008,1000,30
すき家,大阪府,すき家 西九条駅前店,大阪府大阪市此花区西九条4-3-39村本ビル1F,1070,20221008,1050,20
すき家,京都府,すき家 西大路駅南店,京都府京都市南区唐橋西平垣町1-7,1000,20221008,990,10
すき家,福岡県,すき家 西鉄久留米駅前店,福岡県久留米市東町1-5,950,20221008,920,30
すき家,宮崎県,すき家 西都右松店,宮崎県西都市右松3-33,920,20221008,880,40
すき家,大阪府,すき家 西本町店,大阪府大阪市西区西本町1-7-14日宝信濃橋センター,1120,20221008,1090,30
すき家,大阪府,すき家 西淀川大和田店,大阪府大阪市西淀川区大和田2-1-17,1050,20221008,1030,20
すき家,兵庫県,すき家 西脇野村店,兵庫県西脇市野村町1795-192,1050,20221008,1000,50
すき家,北海道,すき家 石狩花川店,北海道石狩市花川南6条1-11-50,1000,20221008,950,50
すき家,大阪府,すき家 摂津鳥飼中店,大阪府摂津市鳥飼中2-2-50,1050,20221008,1020,30
