松屋,神奈川,ステーキ屋松 新杉田店,神奈川県横浜市磯子区新杉田町3-1ステート新杉田103,1200,20250830
松屋,愛知県,松屋 サテライト安城店,愛知県安城市住吉町荒曽根30-8,1100,20250830
松屋,東京都,松屋 シティタワー品川店,東京都港区港南4-2-20 シティタワー品川1階F区画,1300,20250830
松屋,愛知県,松屋 安城錦町店,愛知県安城市錦町8-5,1200,20250830
松屋,茨城県,松屋 茨城那珂店/松のや 茨城那珂店,茨城県那珂市竹ノ内2丁目30-2（未確定）,1100,20250830
松屋,京都府,松屋 宇治小倉店/松のや 宇治小倉店,京都府宇治市宇治小倉町久保15番地（地番）,1200,20250830
松屋,東京都,松屋 羽村店,東京都羽村市五ノ神4-15-11 シティープラザはむら1F,1200,20250830
松屋,愛知県,松屋 岡崎北店,愛知県岡崎市鴨田町字広元196,1150,20250830
松屋,富山県,松屋 滑川店/松のや 滑川店,富山県滑川市上小泉字大道2187-1、小泉字舘2163-1(未確定),1200,20250830
松屋,愛知県,松屋 蒲郡店/松のや 蒲郡店,愛知県蒲郡市旭町432（地番）,1200,20250830
松屋,山形県,松屋 寒河江店/松のや 寒河江店,山形県寒河江市寒河江赤田62-1,1180,20250830
松屋,東京都,松屋 京王八王子店,東京都八王子市東町1-1-20第6岩下ビル1F,1250,20250830
松屋,大阪府,松屋 京阪京橋店,大阪府大阪市都島区東野田町2-4-14,1200,20250830
松屋,大阪府,松屋 九条店/松のや 九条店,大阪府大阪市西区九条1-14-26,1200,20250830
松屋,熊本県,松屋 熊本光の森店/松のや 熊本光の森店,熊本県菊池郡菊陽町光の森2丁目7-2、7-3、7-4、7-5,1100,20250830
松屋,福岡県,松屋 穴生店/松のや 穴生店,福岡県北九州市八幡西区穴生2-8-7,1100,20250830
松屋,東京都,松屋 国立店/マイカリー食堂 国立店,東京都国立市中1-8-5,1250,20250830
松屋,愛媛県,松屋 今治喜田村店/松のや 今治喜田村店,愛媛県今治市喜田村2丁目388-3他（地番）,1100,20250830
松屋,千葉県,松屋 佐倉白銀店/松のや 佐倉白銀店,千葉県佐倉市白銀1-3-10(未確定),1200,20250830
松屋,北海道,松屋 札幌美しが丘店/松のや 札幌美しが丘店,北海道札幌市清田区美しが丘4条5丁目3-5,1150,20250830
松屋,東京都,松屋 雑色店/松のや 雑色店,東京都大田区仲六郷2-28-2,1200,20250830
松屋,鹿児島,松屋 鹿屋寿店/松のや 鹿屋寿店,鹿児島県鹿屋市寿2丁目14-39,1100,20250830
松屋,富山県,松屋 射水店/松のや 射水店,富山県射水市中太閣山1丁目1-1(未確定),1200,20250830
松屋,大阪府,松屋 住道店,大阪府大東市浜町9-10 住道駅前ビル,1180,20250830
松屋,東京都,松屋 渋谷宮益坂上店/松のや 渋谷宮益坂上店,東京都渋谷区渋谷1丁目8番（以下未定）,1500,20250830
松屋,福岡県,松屋 小倉駅前店,福岡県北九州市小倉北区京町2-5-13,1100,20250830
松屋,福岡県,松屋 小倉片野店,福岡県北九州市小倉北区片野4-20-12,1100,20250830
松屋,東京都,松屋 昭島松原町店,東京都昭島市松原町1-6-13 AGスクウェアビル1F,1200,20250830
松屋,新潟県,松屋 上越高田店/松のや 上越高田店,新潟県上越市土橋第2地区区画整理事業地内,1100,20250830
松屋,新潟県,松屋 新潟見附店/松のや 新潟見附店,新潟県見附市上新田町字下野沖514-1,1100,20250830
松屋,新潟県,松屋 新潟大学前店/松のや 新潟大学前店,新潟県新潟市西区五十嵐一の町6703-6,1100,20250830
松屋,大阪府,松屋 深江橋店,大阪府大阪市東成区深江北2-9-24 コルタ深江橋,1180,20250830
松屋,東京都,松屋 西八王子店,東京都八王子市台町4-47-11,1250,20250830
松屋,東京都,松屋 青梅河辺町店/松のや 青梅河辺町店,東京都青梅市河辺町8-1-2,1200,20250830
松屋,東京都,松屋 青梅新町店,東京都青梅市新町9-2020,1200,20250830
松屋,静岡県,松屋 静岡呉服町店/松のや 静岡呉服町店,静岡県静岡市葵区呉服町1-6-4,1170,20250830
松屋,宮城県,松屋 仙台一番町店/松のや 仙台一番町店/マイカリー食堂 仙台一番町店,宮城県仙台市青葉区一番町3丁目,1150,20250830
松屋,神奈川,松屋 川崎銀座街店,神奈川県川崎市川崎区砂子1-1-7,1300,20250830
松屋,神奈川,松屋 川崎砂子店/マイカリー食堂 川崎砂子店,神奈川県川崎市川崎区砂子2-6-19,1300,20250830
松屋,神奈川,松屋 川崎西口店,神奈川県川崎市幸区大宮町5-1,1300,20250830
松屋,東京都,松屋 大森町店,東京都大田区大森西3-20-14,1300,20250830
松屋,東京都,松屋 大鳥居店,東京都大田区萩中3-6-5,1300,20250830
松屋,大阪府,松屋 大東御供田店,大阪府大東市御供田3-7-41,1180,20250830
松屋,大分県,松屋 大分猪野店/松のや 大分猪野店,大分県大分市大字猪野1391-4，1395-1，1398-3（地番）,1050,20250830
松屋,大阪府,松屋 谷町九丁目店,大阪府大阪市天王寺区生玉前町1-21,1180,20250830
松屋,愛知県,松屋 知多店/松のや 知多店,愛知県知多市にしの台4-1-11,1200,20250830
松屋,大阪府,松屋 中崎町店,大阪府大阪市北区中崎1-6-15 中崎1丁目くさかビル1・2F,1200,20250830
松屋,新潟県,松屋 長岡堺東町店,新潟県長岡市堺東町7,1100,20250830
松屋,神奈川,松屋 鶴見店,神奈川県横浜市鶴見区豊岡町2-2 フーガ2,1300,20250830
松屋,神奈川,松屋 鶴見東口店/マイカリー食堂 鶴見東口店,神奈川県横浜市鶴見区鶴見中央1-3-3,1300,20250830
松屋,大阪府,松屋 天満橋店,大阪府大阪市中央区谷町2-8-1大手前M2ビル,1180,20250830
松屋,大阪府,松屋 都島毛馬店,大阪府大阪市都島区毛馬町1-7-13,1150,20250830
松屋,山形県,松屋 東根店/松のや 東根店,山形県東根市蟹沢1862-2、1862-3（地番）,1180,20250830
松屋,大阪府,松屋 東大阪七軒家店/松のや 東大阪七軒家店,大阪府東大阪市七軒家31-他（地番）,1190,20250830
松屋,大阪府,松屋 東大阪川田店/松のや 東大阪川田店,大阪府東大阪市川田1-15-8,1190,20250830
松屋,愛媛県,松屋 東予丹原店/松のや 東予丹原店,愛媛県西条市周布762-1他（地番）,1100,20250830
松屋,徳島県,松屋 徳島松茂広島ランプ店/松のや 徳島松茂広島ランプ店,徳島県板野郡松茂町広島字宮ノ前4番地1（地番）,1100,20250830
松屋,大阪府,松屋 南森町駅前店,大阪府大阪市北区天神橋2丁目北1-3,1200,20250830
松屋,大分県,松屋 南大分店/松のや 南大分店,大分県大分市畑中1-5-3,1050,20250830
松屋,東京都,松屋 日野神明店,東京都日野市神明2-1-1,1250,20250830
松屋,東京都,松屋 日野店,東京都日野市大坂上1-30-24,1200,20250830
松屋,大阪府,松屋 忍ヶ丘駅前店/松のや 忍ヶ丘駅前店,大阪府四條畷市岡山東1丁目-2-15,1150,20250830
松屋,東京都,松屋 梅屋敷店,東京都大田区蒲田2-4-5 スカイドムス,1300,20250830
松屋,新潟県,松屋 柏崎店,新潟県柏崎市東柳田23-3,1100,20250830
松屋,東京都,松屋 八王子店,東京都八王子市旭町7-1 豊栄ビル,1250,20250830
松屋,千葉県,松屋 八千代店/松のや 八千代店,千葉県八千代市大和田新田1034,1200,20250830
松屋,愛知県,松屋 半田店/マイカリー食堂 半田店,愛知県半田市宮本町6-216-7,1200,20250830
松屋,静岡県,松屋 浜松高林店,静岡県浜松市中央区高林4-14-22,1150,20250830
松屋,千葉県,松屋 武石店/松のや 武石店,千葉県千葉市花見川区武石町1丁目130-1128-1（地番）(未確定),1200,20250830
松屋,神奈川,松屋 武蔵小杉南口店/松のや 武蔵小杉南口店,神奈川県川崎市中原区小杉町3-257-4 第2山協ビル,1300,20250830
松屋,東京都,松屋 武蔵村山店,東京都武蔵村山市学園3-37-2,1200,20250830
松屋,東京都,松屋 福生志茂店,東京都福生市志茂36-4,1200,20250830
松屋,東京都,松屋 福生店,東京都福生市東町3-10 栄和ビル1F,1200,20250830
松屋,神奈川,松屋 平間店,神奈川県川崎市中原区北谷町8番地7,1300,20250830
松屋,東京都,松屋 平和島店,東京都大田区大森北6-13-10 島田ビル,1300,20250830
松屋,大阪府,松屋 放出店,大阪府大阪市鶴見区今津南1-7-29,1180,20250830
松屋,愛知県,松屋 豊橋つつじが丘店,愛知県豊橋市つつじが丘1-6-10,1160,20250830
松屋,愛知県,松屋 豊橋藤沢町店,愛知県豊橋市藤沢町138番,1160,20250830
松屋,愛知県,松屋 豊川店/松のや 豊川店,愛知県豊川市牧野町1丁目24・25・26・31（地番）,1150,20250830
松屋,愛知県,松屋 豊田十塚店,愛知県豊田市十塚町4-23-1,1200,20250830
松屋,東京都,松屋 豊田店,東京都日野市多摩平1-2-1,1200,20250830
松屋,愛知県,松屋 豊田東新町店,愛知県豊田市東新町5-20-1,1150,20250830
松屋,愛知県,松屋 豊明店/松のや 豊明店,愛知県豊明市西川町島原8-7,1200,20250830
松屋,福岡県,松屋 北九州高須東店/松のや 北九州高須東店,福岡県北九州市若松区高須東4-2-17,1100,20250830
松屋,東京都,松屋 北野店,東京都八王子市北野町546-2 横溝ビル,1200,20250830
松屋,大阪府,松屋 野崎店/松のや 野崎店,大阪府大東市明美津の辺町21-40,1150,20250830
松屋,東京都,松屋 立川錦町店/マイカリー食堂 立川錦町店,東京都立川市錦町2-1-3 ,1300,20250830
松屋,東京都,松屋 立川柴崎町店/松のや 立川柴崎町店,東京都立川市柴崎町6-10-8,1250,20250830
松屋,東京都,松屋 立川店/マイカリー食堂 立川店,東京都立川市曙町2-12-15 立川金水ビル1F,1300,20250830
松屋,東京都,松屋 立川北口店,東京都立川市曙町2丁目3番地3,1300,20250830
松屋,東京都,松屋 糀谷店/松のや 糀谷店,東京都大田区西糀谷4-14-12,1300,20250830
松屋,神奈川,松軒中華食堂 溝の口店,神奈川県川崎市高津区溝の口1-18-7 澤木ビル1F,1625,20250830
すき家,千葉県,すき家 128号いすみ店,千葉県いすみ市若山字西伊能台16-1、17-1、17-2、27-1、27-2 ,1150,20250830
すき家,佐賀県,すき家 34号佐賀高木瀬店,佐賀県佐賀市高木瀬町大字東高木字六本杉240番3 ,1050,20250830
すき家,北海道,すき家 38号幕別店,北海道中川郡幕別町札内暁町4番1 ,1200,20250830
すき家,北海道,すき家 5号七飯店,北海道亀田郡七飯町大川二丁目67番1、67番2 ,1200,20250830
すき家,岐阜県,すき家 岐阜菊水店,岐阜県岐阜市菊水町1丁目1-1 ,1130,20250830
すき家,北海道,すき家 札幌環状通北郷店,北海道札幌市白石区北郷3条2丁目2-5 ,1150,20250830
すき家,岡山県,すき家 倉敷田ノ上店,岡山県倉敷市田ノ上939-1,1100,20250830
すき家,北海道,すき家 帯広西5条店,北海道帯広市西五条南二十四丁目2、4、6、8-1 ,1200,20250830
