松屋,東京都,松屋　南千住店,東京都荒川区南千住7-1-1アクレスティ南千住M2-201,1000,1100,100
松屋,大阪府,松屋　南津守店,大阪府大阪市西成区南津守6-6-46,910,936,26
松屋,神奈川,松屋　南林間店,神奈川県大和市南林間1-8-1,980,983,3
松屋,東京都,松屋　日暮里店,東京都荒川区西日暮里2-25-1-307,1000,1100,100
松屋,東京都,松屋　日野三沢店,東京都日野市三沢1-19-2,980,985,5
松屋,東京都,松屋　入谷店,東京都台東区北上野2-31-6スプリーム・北上野1F,1000,1100,100
松屋,兵庫県,松屋　播磨町店,兵庫県加古郡播磨町南大中3-3-28,844,880,36
松屋,千葉県,松屋　八街店,千葉県八街市八街ほ15街区1,900,950,50
松屋,大阪府,松屋　八尾店,大阪府八尾市志紀町南3-190,910,936,26
松屋,大阪府,松屋　八尾本町店,大阪府八尾市本町2-8-19,910,936,26
松屋,東京都,松屋　板橋区役所前店,東京都板橋区板橋2-61-11ホシカメビル1F,1000,1050,50
松屋,東京都,松屋　板橋本町店,東京都板橋区本町36-1バロール本町1F,1000,1050,50
松屋,兵庫県,松屋　姫路リオス店,兵庫県姫路市東郷町1454-3,844,880,36
松屋,東京都,松屋　氷川台店,東京都練馬区氷川台3-39-9,970,1000,30
松屋,大阪府,松屋　瓢箪山駅前店,大阪府東大阪市本町15-15,910,936,26
松屋,大阪府,松屋　浜寺店,大阪府堺市西区浜寺船尾町西5-132-1,910,936,26
松屋,大阪府,松屋　布施店,大阪府東大阪市足代新町2-18,910,936,26
松屋,大阪府,松屋　布施南店,大阪府東大阪市寿町3-10-19,910,936,26
松屋,東京都,松屋　福生志茂店,東京都福生市志茂36-4,980,1000,20
松屋,東京都,松屋　福生店,東京都福生市東町3-10栄和ビル1F,980,1000,20
松屋,神奈川,松屋　淵野辺店,神奈川県相模原市中央区鹿沼台2-18-6,980,983,3
松屋,神奈川,松屋　淵野辺北口店,神奈川県相模原市中央区淵野辺3-19-9,980,983,3
松屋,東京都,松屋　分倍河原店,東京都府中市片町2-22-1山ニビル,980,985,5
松屋,神奈川,松屋　平塚北金目店,神奈川県平塚市北金目2-4-33,956,983,27
松屋,東京都,松屋　保谷店,東京都西東京市東町3-14-26マイティビル1F,980,1000,20
松屋,大阪府,松屋　放出店,大阪府大阪市鶴見区今津南1-7-29,910,936,26
松屋,大阪府,松屋　豊中上津島店,大阪府豊中市上津島3-11-25,920,960,40
松屋,東京都,松屋　北赤羽店,東京都北区浮間3-1-38近藤ビル,960,1000,40
松屋,東京都,松屋　北野店,東京都八王子市北野町546-2横溝ビル,980,985,5
松屋,神奈川,松屋　麻溝台店,神奈川県相模原市南区麻溝台1-5-6,980,983,3
松屋,大阪府,松屋　箕面店,大阪府箕面市半町3-14-20,910,960,50
松屋,愛知県,松屋　名駅西店,愛知県名古屋市中村区亀島2-12-1,900,1000,100
松屋,大阪府,松屋　門真店,大阪府門真市下島町30-13,920,960,40
松屋,愛知県,松屋　野並店,愛知県名古屋市緑区鳴海町字杜若7-1,950,1000,50
松屋,三重県,松屋　鈴鹿中央通店,三重県鈴鹿市算所2-2-7,950,1000,50
松屋,東京都,松屋　蓮根店,東京都板橋区蓮根2丁目31-3萩原ビル,960,1000,40
松屋,大阪府,松屋　和泉店,大阪府和泉市富秋町3-2-36,910,936,26
松屋,神奈川,松乃家　橋本店,神奈川県相模原市緑区橋本6-2-1,960,1000,40
松屋,大阪府,松乃家　石橋店,大阪府池田市石橋1-3-10MKビル1F,920,950,30
松屋,大阪府,松乃家　瓢箪山店,大阪府東大阪市若草町5-2,920,950,30
