すき家,宮崎県,すき家 10号宮崎大橋店,宮崎県宮崎市大橋2-30,860,900,40
すき家,宮崎県,すき家 10号宮崎島之内店,宮崎県宮崎市大字島之内997-1,860,900,40
すき家,千葉県,すき家 16号袖ヶ浦神納店,千葉県袖ヶ浦市神納1154-1,980,1030,50
すき家,徳島県,すき家 192号吉野川店,徳島県吉野川市鴨島町上下島字宮内87-8,880,900,20
すき家,三重県,すき家 1国亀山店,三重県亀山市井田川町51-1,930,960,30
すき家,長崎県,すき家 204号佐世保田原店,長崎県佐世保市田原町17-23,880,900,20
すき家,岐阜県,すき家 21号岐阜各務原IC店,岐阜県各務原市那加緑町1-24-1,950,1000,50
すき家,宮崎県,すき家 269号宮崎清武店,宮崎県宮崎市清武町正手3-17-1,860,900,40
すき家,鹿児島,すき家 270号南さつま店,鹿児島県南さつま市加世田本町13-5,850,900,50
すき家,熊本県,すき家 325号菊池店,熊本県菊池市隈府字北原597-2,850,880,30
すき家,長崎県,すき家 34号大村店,長崎県大村市桜馬場2-370-1,850,900,50
すき家,長崎県,すき家 35号佐世保大和店,長崎県佐世保市大和町749-1,880,900,20
すき家,愛媛県,すき家 378号八幡浜店,愛媛県八幡浜市産業通13-12,900,950,50
すき家,愛媛県,すき家 56号宇和島宮下店,愛媛県宇和島市宮下字太田甲191-1,900,950,50
すき家,愛媛県,すき家 56号大洲松ヶ花店,愛媛県大洲市新谷乙543-1,900,950,50
すき家,岐阜県,すき家 アクアウォーク大垣店,岐阜県大垣市林町6-80-21,900,950,50
すき家,宮崎県,すき家 宮崎東大淀店,宮崎県宮崎市東大淀2-3-41,860,900,40
すき家,千葉県,すき家 市原白金店,千葉県市原市白金町1-58-2,980,1000,20
すき家,徳島県,すき家 美馬脇町店,徳島県美馬市脇町大字猪尻字東分63-1,880,900,20
すき家,愛知県,すき家 名東猪子石店,愛知県名古屋市名東区猪子石1-106,950,1000,50
