松屋,東京都,松屋 ときわ台店,東京都板橋区常盤台1-2-5,1200,20230107,1100,100
松屋,東京都,松屋 下赤塚店,東京都板橋区赤塚1-7-2,1200,20230107,1100,100
松屋,東京都,松屋 下板橋店,東京都豊島区池袋本町3-25-13,1200,20230107,1100,100
松屋,東京都,松屋 紀尾井町店,東京都千代田区麹町3-5-17,1300,20230107,1200,100
松屋,東京都,松屋 恵比寿西店,東京都渋谷区恵比寿西1-10-8,1310,20230107,1200,110
松屋,東京都,松屋 三宿店,東京都世田谷区池尻3-30-10,1250,20230107,1200,50
松屋,東京都,松屋 四谷2丁目店,東京都新宿区四谷2-9,1250,20230107,1200,50
松屋,東京都,松屋 四谷三丁目店,東京都新宿区左門町2-5,1250,20230107,1200,50
松屋,東京都,松屋 市ヶ谷店,東京都千代田区九段北4-2-15,1300,20230107,1200,100
松屋,東京都,松屋 上板橋店,東京都板橋区常盤台4-33-13,1200,20230107,1100,100
松屋,東京都,松屋 代々木店,東京都渋谷区代々木1-34-4,1300,20230107,1200,100
松屋,東京都,松屋 大山店,東京都板橋区大山東町58-2,1200,20230107,1100,100
松屋,東京都,松屋 池尻大橋店,東京都目黒区東山3-1-15 SD池尻大橋ビル,1250,20230107,1200,50
松屋,東京都,松屋 中板橋店,東京都板橋区中板橋21-2,1200,20230107,1100,100
松屋,東京都,松屋 東武練馬店,東京都板橋区徳丸3-1-26,1200,20230107,1100,100
松屋,東京都,松屋 目黒東口店,東京都品川区上大崎2-15-18 目黒東豊ビル,1310,20230107,1200,110
すき家,山形県,すき家 112号寒河江店,山形県寒河江市高田129-1,950,20230107,900,50
すき家,山形県,すき家 13号新庄店,山形県新庄市大字鳥越496-16,960,20230107,930,30
すき家,愛知県,すき家 155号稲沢一色店,愛知県稲沢市一色下方町285-3,1050,20230107,1030,20
すき家,愛知県,すき家 155号津島店,愛知県津島市申塚町2-143-1,1050,20230107,1030,20
すき家,岐阜県,すき家 19号中津川IC店,岐阜県中津川市千旦林204-2,1050,20230107,1000,50
すき家,滋賀県,すき家 1国水口店,滋賀県甲賀市水口町北泉2-2,1080,20230107,1050,30
すき家,滋賀県,すき家 1国草津大路店,滋賀県草津市大路3-138,～&nbsp,20230107,990,-990
すき家,滋賀県,すき家 1国大津瀬田店,滋賀県大津市大江4-5-6,1030,20230107,990,40
すき家,岐阜県,すき家 21号岐阜各務原IC店,岐阜県各務原市那加緑町1-24-1,1030,20230107,1000,30
すき家,熊本県,すき家 266号宇城松橋店,熊本県宇城市松橋町曲野133-4,930,20230107,900,30
すき家,岐阜県,すき家 303号大野店,岐阜県揖斐郡大野町大字中之元字下姥田928-4,1080,20230107,1030,50
すき家,北海道,すき家 36号苫小牧明野店,北海道苫小牧市明野新町2-1-4,1000,20230107,960,40
すき家,北海道,すき家 39号北見三輪店,北海道北見市東三輪2-831-4,1000,20230107,950,50
すき家,北海道,すき家 39号北見大町店,北海道北見市大町21-1,980,20230107,950,30
すき家,熊本県,すき家 3号宇土店,熊本県宇土市水町62-7,1000,20230107,950,50
すき家,北海道,すき家 40号稚内大黒店,北海道稚内市大黒2-6-24,1100,20230107,1000,100
すき家,滋賀県,すき家 421号八日市店,滋賀県東近江市東沖野1-4-3,1050,20230107,1000,50
すき家,酒田市,すき家 7号酒田こあら店,酒田市こあら2丁目1-1,980,20230107,960,20
すき家,滋賀県,すき家 8号彦根野口店,滋賀県彦根市野口町277-2,～&nbsp,20230107,950,-950
すき家,北海道,すき家 イオンモール旭川西店,北海道旭川市緑町23-2161-3,1000,20230107,960,40
すき家,愛知県,すき家 愛知学院大学前店,愛知県長久手市長配2-601,1050,20230107,1030,20
すき家,北海道,すき家 旭川永山店,北海道旭川市永山六条5-77-54,1000,20230107,960,40
すき家,北海道,すき家 旭川神居店,北海道旭川市神居2条1-1-17,1000,20230107,960,40
すき家,北海道,すき家 旭川豊岡店,北海道旭川市豊岡十四条6-8-15,1000,20230107,960,40
すき家,愛知県,すき家 一宮駅前店,愛知県一宮市栄3-7-1石照ビル1F,1080,20230107,1050,30
すき家,愛知県,すき家 一宮中島通店,愛知県一宮市中島通1-32-2,1050,20230107,1030,20
すき家,愛知県,すき家 一宮妙興寺店,愛知県一宮市宮地2-13-4,1050,20230107,1030,20
すき家,愛知県,すき家 稲沢小池店,愛知県稲沢市小池3-10-25,1050,20230107,1030,20
すき家,京都府,すき家 宇治東IC店,京都府宇治市菟道西隼上り1-26,1050,20230107,1000,50
すき家,滋賀県,すき家 近江八幡店,滋賀県近江八幡市白鳥町117-4,1030,20230107,1000,30
すき家,滋賀県,すき家 栗東大宝店,滋賀県栗東市霊仙寺3-8-32,1080,20230107,1050,30
すき家,愛知県,すき家 瀬戸店,愛知県瀬戸市高根町1-68,1050,20230107,1030,20
すき家,京都府,すき家 西大路駅南店,京都府京都市南区唐橋西平垣町1-7,1050,20230107,1000,50
すき家,宮城県,すき家 仙台広瀬通一番町店,宮城県仙台市青葉区一番町4-3-1菅原酒店ビル1F,980,20230107,930,50
すき家,宮城県,すき家 仙台定禅寺通店,宮城県仙台市青葉区一番町4-11-1-101,980,20230107,930,50
すき家,滋賀県,すき家 長浜IC店,滋賀県長浜市山階町496-2,1080,20230107,1050,30
すき家,横浜市,すき家 鶴見総合高校前店,横浜市鶴見区栄町通1-10-15盛田ビル1F,1240,20230107,1140,100
すき家,山形県,すき家 天童東芳賀店,山形県天童市東芳賀3-2-15,980,20230107,900,80
すき家,滋賀県,すき家 東近江能登川店,滋賀県東近江市垣見町523-1,1000,20230107,950,50
すき家,滋賀県,すき家 南草津店,滋賀県草津市野路6-8-22,1030,20230107,990,40
すき家,愛知県,すき家 尾西篭屋店,愛知県一宮市篭屋1-2-22,1080,20230107,1030,50
すき家,愛知県,すき家 木曽川店,愛知県一宮市木曽川町黒田字中沼北ノ切5-2,1080,20230107,1030,50
