吉野家,宮崎県,吉野家 10号線延岡店,宮崎県延岡市別府町3723‐1,1000,20240302,950,50
吉野家,宮崎県,吉野家 10号線都城店,宮崎県都城市平江町5‐6,1000,20240302,950,50
吉野家,福岡県,吉野家 10号線片野店,福岡県北九州市小倉北区片野2丁目21‐30,1050,20240302,1000,50
吉野家,香川県,吉野家 11号線国分寺店,香川県高松市国分寺町新居1354‐3,1100,20240302,980,120
吉野家,愛媛県,吉野家 11号線松山久米店,愛媛県松山市北久米町973‐5,1000,20240302,950,50
吉野家,埼玉県,吉野家 122号線石神店,埼玉県川口市石神685‐1,1150,20240302,1100,50
吉野家,埼玉県,吉野家 122号線川口店,埼玉県川口市朝日1丁目8‐6,1150,20240302,1100,50
吉野家,神奈川,吉野家 129号線上溝店,神奈川県相模原市中央区上溝2380‐6,1200,20240302,1120,80
吉野家,静岡県,吉野家 136号線伊豆長岡店,静岡県伊豆の国市南條211‐4,1050,20240302,1000,50
吉野家,埼玉県,吉野家 140号線花園インター店,埼玉県深谷市小前田476‐3,1200,20240302,1150,50
吉野家,長野県,吉野家 141号線佐久平店,長野県佐久市佐久平駅南19‐1,1100,20240302,1000,100
吉野家,愛知県,吉野家 155号線新舞子店,愛知県知多市新舞子大口206‐7,1100,20240302,1050,50
吉野家,岐阜県,吉野家 156号線芥見店,岐阜県岐阜市芥見長山2丁目118‐1,1100,20240302,1000,100
吉野家,奈良県,吉野家 163号線生駒店,奈良県生駒市北田原町2476‐18,1020,20240302,1000,20
吉野家,三重県,吉野家 165号線名張店,三重県名張市夏見坊垣3222‐2,1050,20240302,1000,50
吉野家,奈良県,吉野家 168号線香芝店,奈良県香芝市上中745‐1,1020,20240302,1000,20
吉野家,奈良県,吉野家 168号線東生駒店,奈良県生駒市辻町249‐1,1020,20240302,1000,20
吉野家,奈良県,吉野家 169号線桜井店,奈良県桜井市川合263‐1,1020,20240302,1000,20
吉野家,千葉県,吉野家 16号線若柴店,千葉県柏市若柴5‐10,1200,20240302,1150,50
吉野家,東京都,吉野家 16号線昭島緑町店,東京都昭島市緑町3丁目5‐14,1200,20240302,1150,50
吉野家,埼玉県,吉野家 16号線東大宮店,埼玉県さいたま市見沼区深作3丁目4‐9,1150,20240302,1100,50
吉野家,東京都,吉野家 16号線八王子宇津木店,東京都八王子市宇津木町709,1200,20240302,1150,50
吉野家,東京都,吉野家 16号線八王子北野店,東京都八王子市北野町574‐1,1200,20240302,1150,50
吉野家,大阪府,吉野家 170号線河内長野店,大阪府河内長野市上原西町10‐7,1100,20240302,1080,20
吉野家,大阪府,吉野家 170号線尺度店,大阪府羽曳野市尺度190‐1,1100,20240302,1080,20
吉野家,大阪府,吉野家 170号線東大阪布市店,大阪府東大阪市布市町4丁目332‐1,1130,20240302,1080,50
吉野家,大阪府,吉野家 170号線藤井寺店,大阪府藤井寺市野中2丁目1‐1,1110,20240302,1080,30
吉野家,大阪府,吉野家 170号線八尾店,大阪府八尾市大竹1丁目62,1100,20240302,1080,20
吉野家,大阪府,吉野家 170号線野崎店,大阪府大東市南津の辺町21‐38,1130,20240302,1080,50
吉野家,大阪府,吉野家 171号線茨木インター店,大阪府茨木市郡4丁目18‐35,1130,20240302,1100,30
吉野家,京都府,吉野家 171号線久世店,京都府京都市南区久世殿城町433,1100,20240302,1050,50
吉野家,大阪府,吉野家 171号線高槻市役所前店,大阪府高槻市城西町4‐46,1130,20240302,1100,30
吉野家,京都府,吉野家 171号線大山崎店,京都府乙訓郡大山崎町大山崎鏡田45‐30,1100,20240302,1050,50
吉野家,大阪府,吉野家 171号線箕面店,大阪府箕面市萱野4丁目2‐17,1150,20240302,1100,50
吉野家,兵庫県,吉野家 173号線川西多田店,兵庫県川西市平野2丁目5‐6,1060,20240302,1030,30
吉野家,兵庫県,吉野家 175号線玉津店,兵庫県神戸市西区平野町福中219‐1,1080,20240302,1050,30
吉野家,兵庫県,吉野家 176号線三田店,兵庫県三田市三輪4丁目6‐6,1080,20240302,1030,50
吉野家,兵庫県,吉野家 176号線宝塚店,兵庫県宝塚市安倉北2丁目19‐2,1080,20240302,1030,50
吉野家,兵庫県,吉野家 178号線豊岡店,兵庫県豊岡市下陰535‐1,1080,20240302,1030,50
吉野家,埼玉県,吉野家 17号線浦和常盤店,埼玉県さいたま市浦和区常盤6丁目2‐15,1250,20240302,1200,50
吉野家,埼玉県,吉野家 17号線宮原店,埼玉県さいたま市北区宮原町1丁目503‐1,1200,20240302,1150,50
吉野家,埼玉県,吉野家 17号線熊谷佐谷田店,埼玉県熊谷市佐谷田88‐1,1150,20240302,1100,50
吉野家,埼玉県,吉野家 17号線鴻巣店,埼玉県鴻巣市宮地1丁目8‐49,1150,20240302,1100,50
吉野家,埼玉県,吉野家 17号線上尾店,埼玉県上尾市久保77‐1,1150,20240302,1100,50
吉野家,埼玉県,吉野家 17号線深谷店,埼玉県深谷市国済寺503‐3,1150,20240302,1100,50
吉野家,埼玉県,吉野家 17号線与野店,埼玉県さいたま市中央区円阿弥6丁目3‐1,1200,20240302,1150,50
吉野家,埼玉県,吉野家 17号線与野本町店,埼玉県さいたま市中央区本町西4丁目15‐12,1200,20240302,1150,50
吉野家,長野県,吉野家 18号線上田国分店,長野県上田市国分1丁目962‐1,1100,20240302,1000,100
吉野家,香川県,吉野家 193号線高松仏生山店,香川県高松市仏生山町甲1319‐1,1050,20240302,950,100
吉野家,愛媛県,吉野家 196号線今治店,愛媛県今治市中寺242‐4,1200,20240302,1000,200
吉野家,岐阜県,吉野家 19号線恵那店,岐阜県恵那市長島町正家2丁目7‐2,1100,20240302,1050,50
吉野家,愛知県,吉野家 19号線春日井西店,愛知県春日井市浅山町1311‐4,1100,20240302,1050,50
吉野家,愛知県,吉野家 1号線御油店,愛知県豊川市御油町八面横40,1100,20240302,1050,50
吉野家,愛知県,吉野家 1号線知立店,愛知県知立市中町花山51‐1,1100,20240302,1050,50
吉野家,静岡県,吉野家 1号線浜松石原町店,静岡県浜松市中央区石原町693,1050,20240302,1000,50
吉野家,三重県,吉野家 1号線富洲原店,三重県三重郡川越町豊田318‐1,1100,20240302,1050,50
吉野家,愛知県,吉野家 1号線弥富店,愛知県弥富市鯏浦町中六130‐1,1100,20240302,1050,50
吉野家,福岡県,吉野家 200号線飯塚店,福岡県飯塚市小正40‐3,1050,20240302,950,100
吉野家,福岡県,吉野家 202号線BP原店,福岡県福岡市早良区原4丁目25‐15,1000,20240302,980,20
吉野家,大分県,吉野家 213号線中津店,大分県中津市中殿町3丁目26‐8,1000,20240302,950,50
吉野家,岐阜県,吉野家 21号線垂井店,岐阜県不破郡垂井町綾戸東103‐1,1050,20240302,1000,50
吉野家,三重県,吉野家 23号線伊勢店,三重県伊勢市御薗町長屋2127,1100,20240302,1050,50
吉野家,愛知県,吉野家 23号線花田町店,愛知県豊橋市花田町荒木24‐1,1100,20240302,1050,50
吉野家,三重県,吉野家 23号線白子店,三重県鈴鹿市白子駅前6‐39,1050,20240302,1000,50
吉野家,愛知県,吉野家 247号線半田店,愛知県半田市星崎町3丁目22‐4,1150,20240302,1050,100
吉野家,奈良県,吉野家 24号線葛城店,奈良県葛城市忍海488‐1,1020,20240302,1000,20
吉野家,京都府,吉野家 24号線竹田久保町店,京都府京都市伏見区竹田久保町68,1150,20240302,1050,100
吉野家,兵庫県,吉野家 250号線西明石店,兵庫県明石市西明石西町1丁目10‐12,1080,20240302,1050,30
吉野家,兵庫県,吉野家 250号線播磨町店,兵庫県加古郡播磨町北古田1丁目19‐2,1080,20240302,1050,30
吉野家,埼玉県,吉野家 254号線新座店,埼玉県新座市野火止1丁目7‐20,1150,20240302,1100,50
吉野家,三重県,吉野家 258号線桑名店,三重県桑名市江場676‐1,1100,20240302,1050,50
吉野家,岐阜県,吉野家 258号線大垣店,岐阜県大垣市築捨町4‐10‐1,1100,20240302,1000,100
吉野家,奈良県,吉野家 25号線天理店,奈良県天理市田井庄町498‐1,1020,20240302,1000,20
吉野家,奈良県,吉野家 25号線斑鳩店,奈良県生駒郡斑鳩町幸前2丁目309‐3,1020,20240302,1000,20
吉野家,大阪府,吉野家 26号線貝塚店,大阪府貝塚市石才229‐1,1100,20240302,1080,20
吉野家,大阪府,吉野家 26号線岸和田八阪店,大阪府岸和田市八阪町1丁目7‐13,1100,20240302,1080,20
吉野家,大阪府,吉野家 26号線堺浜寺店,大阪府堺市西区浜寺船尾町東1丁112,1100,20240302,1080,20
吉野家,大阪府,吉野家 26号線泉佐野店,大阪府泉佐野市高松東2丁目6529,1100,20240302,1080,20
吉野家,大阪府,吉野家 26号線泉大津店,大阪府泉大津市北豊中町3丁目1‐3,1110,20240302,1080,30
吉野家,兵庫県,吉野家 28号線洲本店,兵庫県南あわじ市山添81‐1,1050,20240302,1001,49
吉野家,山口県,吉野家 2号線下関長府店,山口県下関市長府才川1丁目42‐41,1000,20240302,980,20
吉野家,兵庫県,吉野家 2号線加古川平野店,兵庫県加古川市加古川町平野482,1100,20240302,1050,50
吉野家,兵庫県,吉野家 2号線姫路市川橋店,兵庫県姫路市花田町一本松437‐3,1050,20240302,1030,20
吉野家,広島県,吉野家 2号線福山久松通り店,広島県福山市延広町4‐15,1050,20240302,1000,50
吉野家,兵庫県,吉野家 2号線明石硯町店,兵庫県明石市硯町3丁目427‐1,1080,20240302,1050,30
吉野家,大阪府,吉野家 308号線吉田店,大阪府東大阪市角田1丁目5‐50,1130,20240302,1100,30
吉野家,大阪府,吉野家 309号線三宅店,大阪府松原市三宅中1丁目269‐2,1100,20240302,1080,20
吉野家,大阪府,吉野家 309号線美原店,大阪府堺市美原区太井81‐1,1100,20240302,1080,20
吉野家,沖縄県,吉野家 329号線南風原店,沖縄県島尻郡南風原町兼城516‐1,950,20240302,920,30
吉野家,沖縄県,吉野家 330号線宜野湾店,沖縄県宜野湾市我如古1丁目54‐23,950,20240302,920,30
吉野家,沖縄県,吉野家 330号線壺川店,沖縄県那覇市壺川2丁目1‐6,1000,20240302,950,50
吉野家,沖縄県,吉野家 331号線糸満店,沖縄県糸満市潮平772‐1,950,20240302,920,30
吉野家,福岡県,吉野家 385号線那珂川店,福岡県那珂川市片縄東1丁目20‐3,1000,20240302,950,50
吉野家,熊本県,吉野家 3号線近見店,熊本県熊本市南区近見2丁目1‐5,980,20240302,950,30
吉野家,福岡県,吉野家 3号線宗像店,福岡県宗像市光岡300‐1,1000,20240302,950,50
吉野家,福岡県,吉野家 3号線箱崎店,福岡県福岡市東区箱崎2丁目42‐6,1050,20240302,1000,50
吉野家,岐阜県,吉野家 41号線高山店,岐阜県高山市上岡本町3丁目78,1150,20240302,1050,100
吉野家,愛知県,吉野家 41号線小牧店,愛知県小牧市小木東1丁目140,1100,20240302,1050,50
吉野家,富山県,吉野家 41号線富山城南公園前店,富山県富山市花園町3丁目8‐10,1100,20240302,1000,100
吉野家,富山県,吉野家 41号線富山田中町店,富山県富山市田中町5丁目4‐13,1100,20240302,1050,50
吉野家,愛知県,吉野家 41号線豊場南店,愛知県名古屋市北区丸新町3‐1,1100,20240302,1050,50
吉野家,岡山県,吉野家 430号線水島店,岡山県倉敷市東塚1丁目311‐1,1000,20240302,950,50
吉野家,愛媛県,吉野家 437号線三津浜店,愛媛県松山市祓川1丁目2‐10,1000,20240302,950,50
吉野家,埼玉県,吉野家 463号線南与野店,埼玉県さいたま市中央区鈴谷2丁目603‐2,1200,20240302,1100,100
吉野家,埼玉県,吉野家 4号線越谷店,埼玉県越谷市谷中町1丁目134‐1,1150,20240302,1100,50
吉野家,岡山県,吉野家 53号線国体町店,岡山県岡山市北区南方5丁目1‐2,1000,20240302,950,50
吉野家,鳥取県,吉野家 53号線鳥取吉成店,鳥取県鳥取市吉成779‐2,1000,20240302,950,50
吉野家,沖縄県,吉野家 58号線牧港店,沖縄県浦添市牧港5丁目5‐7,950,20240302,920,30
吉野家,石川県,吉野家 8号線福久町店,石川県金沢市福久町ホ15‐1,1100,20240302,1050,50
吉野家,滋賀県,吉野家 8号線野洲店,滋賀県野洲市小篠原481‐1,1050,20240302,1000,50
吉野家,京都府,吉野家 9号線亀岡千代川店,京都府亀岡市千代川町高野林西田7‐27,1100,20240302,1050,50
吉野家,島根県,吉野家 9号線松江店,島根県松江市西津田2丁目6‐23,1050,20240302,1000,50
吉野家,京都府,吉野家 9号線洛西中山店,京都府京都市西京区大枝中山町1‐124,1100,20240302,1050,50
吉野家,大阪府,吉野家 JR茨木駅前店,大阪府茨木市西駅前町5‐36,1130,20240302,1100,30
吉野家,大阪府,吉野家 JR京橋駅ホーム店,大阪府大阪市城東区新喜多1丁目2‐31,1150,20240302,1100,50
吉野家,大阪府,吉野家 JR玉造駅店,大阪府大阪市天王寺区玉造元町1‐40,1180,20240302,1150,30
吉野家,静岡県,吉野家 JR清水駅店,静岡県静岡市清水区真砂町1‐1,1050,20240302,1000,50
吉野家,大阪府,吉野家 JR西九条駅店,大阪府大阪市此花区西九条3丁目16,1150,20240302,1100,50
吉野家,静岡県,吉野家 JR静岡駅店,静岡県静岡市葵区黒金町47,1100,20240302,1050,50
吉野家,東京都,吉野家 JR拝島駅店,東京都昭島市松原町4丁目14‐4,1200,20240302,1150,50
吉野家,千葉県,吉野家 TXGA流山おおたかの森店,千葉県流山市おおたかの森北一丁目1番地の1,1200,20240302,1150,50
吉野家,沖縄県,吉野家 うるま志林川店,沖縄県うるま市高江洲1079‐1,950,20240302,920,30
吉野家,東京都,吉野家 お台場デックス店,東京都港区台場1丁目6‐1,1350,20240302,1300,50
吉野家,東京都,吉野家 お茶の水店,東京都千代田区神田駿河台2丁目4‐14,1350,20240302,1300,50
吉野家,大阪府,吉野家 ぐみの木店,大阪府大阪狭山市ぐみの木6丁目921‐1,1100,20240302,1080,20
吉野家,埼玉県,吉野家 さいたま東大宮店,埼玉県さいたま市見沼区東大宮3丁目3‐12,1150,20240302,1100,50
吉野家,埼玉県,吉野家 せんげん台駅西口店,埼玉県越谷市千間台西1丁目67,1150,20240302,1100,50
吉野家,大阪府,吉野家 なんばCITY南館店,大阪府大阪市中央区難波5丁目1‐60,1200,20240302,1150,50
吉野家,沖縄県,吉野家 ひめゆり通り店,沖縄県那覇市壺屋2‐6‐5,950,20240302,920,30
吉野家,埼玉県,吉野家 イオンモール川口前川店,埼玉県川口市前川1丁目1‐11,1200,20240302,1150,50
吉野家,神奈川,吉野家 イオン相模原店,神奈川県相模原市南区古淵2丁目10‐1,1200,20240302,1120,80
吉野家,沖縄県,吉野家 イオン北谷店,沖縄県中頭郡北谷町美浜8‐3,950,20240302,920,30
吉野家,大阪府,吉野家 エコールいずみ店,大阪府和泉市いぶき野5丁目1‐14,1100,20240302,1080,20
吉野家,大阪府,吉野家 ザビエル公園店,大阪府堺市堺区戎之町東1‐1,1100,20240302,1080,20
吉野家,大阪府,吉野家 ドーチカ店,大阪府大阪市北区堂島1丁目,1170,20240302,1140,30
吉野家,沖縄県,吉野家 パイプライン浦添店,沖縄県浦添市屋富祖1丁目1‐2,950,20240302,920,30
吉野家,千葉県,吉野家 パビリオン成田店,千葉県成田市ウイング土屋80,1250,20240302,1200,50
吉野家,大阪府,吉野家 ビエラ岸辺健都店,大阪府吹田市岸部新町5‐45,1150,20240302,1100,50
吉野家,大阪府,吉野家 ビエラ高槻南店,大阪府高槻市紺屋町1‐3,1130,20240302,1100,30
吉野家,兵庫県,吉野家 フェニックスプラザ摩耶店,兵庫県神戸市灘区味泥町6‐1,1080,20240302,1001,79
吉野家,兵庫県,吉野家 フレンテ西宮店,兵庫県西宮市池田町11‐1,1080,20240302,1001,79
吉野家,兵庫県,吉野家 プリコ六甲道店,兵庫県神戸市灘区永手町4‐1‐1,1080,20240302,1001,79
吉野家,山口県,吉野家 リピエ下関店,山口県下関市竹崎町4丁目3‐3,1000,20240302,980,20
吉野家,大阪府,吉野家 ヴィアあべのウォーク店,大阪府大阪市阿倍野区阿倍野筋1丁目6‐1,1200,20240302,1150,50
吉野家,東京都,吉野家 阿佐ヶ谷店,東京都杉並区成田東5丁目42‐10,1250,20240302,1200,50
吉野家,大阪府,吉野家 阿波座店,大阪府大阪市西区阿波座1丁目13‐11,1150,20240302,1100,50
吉野家,愛媛県,吉野家 伊予松前店,愛媛県伊予郡松前町北黒田240‐1,1100,20240302,950,150
吉野家,愛知県,吉野家 一宮妙興寺店,愛知県一宮市妙興寺1丁目2‐10,1100,20240302,1050,50
吉野家,東京都,吉野家 一橋学園店,東京都小平市学園東町1-5-7（豊正ビル1F）,1500,20240302,1450,50
吉野家,愛知県,吉野家 稲沢下津店,愛知県稲沢市下津下町西1丁目62‐1,1100,20240302,1050,50
吉野家,愛知県,吉野家 稲沢市役所前店,愛知県稲沢市船橋町花ノ木1191‐1,1100,20240302,1050,50
吉野家,大阪府,吉野家 茨田店,大阪府大阪市鶴見区浜3丁目7‐107,1130,20240302,1100,30
吉野家,大阪府,吉野家 茨木真砂店,大阪府茨木市真砂1丁目2‐4,1130,20240302,1100,30
吉野家,大阪府,吉野家 羽曳野店,大阪府羽曳野市向野3丁目74‐1,1100,20240302,1080,20
吉野家,埼玉県,吉野家 浦和駅東口店,埼玉県さいたま市浦和区東仲町1‐22,1250,20240302,1200,50
吉野家,埼玉県,吉野家 浦和仲町店,埼玉県さいたま市浦和区仲町2丁目3‐22,1250,20240302,1200,50
吉野家,東京都,吉野家 曳舟店,東京都墨田区京島1丁目1‐1‐101,1300,20240302,1250,50
吉野家,愛知県,吉野家 栄生店,愛知県名古屋市西区栄生1丁目32‐16,1150,20240302,1100,50
吉野家,埼玉県,吉野家 越谷駅高架下店,埼玉県越谷市弥生町4‐11,1150,20240302,1100,50
吉野家,愛知県,吉野家 塩釜口店,愛知県名古屋市天白区塩釜口1丁目832,1100,20240302,1050,50
吉野家,東京都,吉野家 押上店,東京都墨田区押上1丁目19‐1,1300,20240302,1250,50
吉野家,大阪府,吉野家 横堤店,大阪府大阪市鶴見区横堤3丁目6‐44,1130,20240302,1100,30
吉野家,東京都,吉野家 王子神谷店,東京都北区王子5丁目10‐1,1300,20240302,1200,100
吉野家,東京都,吉野家 王子東店,東京都北区王子1丁目6‐7,1300,20240302,1200,100
吉野家,奈良県,吉野家 王寺駅前店,奈良県北葛城郡王寺町久度2丁目3538‐1,1020,20240302,1000,20
吉野家,愛知県,吉野家 岡崎南店,愛知県岡崎市若松東1丁目3‐5,1100,20240302,1050,50
吉野家,愛知県,吉野家 岡崎北店,愛知県岡崎市井ノ口新町1‐3,1100,20240302,1050,50
吉野家,岡山県,吉野家 岡山裁判所前店,岡山県岡山市北区富田町1丁目4‐8,1000,20240302,950,50
吉野家,岡山県,吉野家 岡山新保店,岡山県岡山市南区新保1614‐1,1100,20240302,1000,100
吉野家,岡山県,吉野家 岡山桃太郎通り店,岡山県岡山市北区本町2‐9,1100,20240302,1000,100
吉野家,岡山県,吉野家 岡山平井店,岡山県岡山市中区平井4丁目24‐32,1000,20240302,950,50
吉野家,沖縄県,吉野家 沖縄南インター店,沖縄県沖縄市上地4丁目20‐7,950,20240302,920,30
吉野家,東京都,吉野家 荻窪北口店,東京都杉並区上荻1丁目15‐2,1250,20240302,1200,50
吉野家,山口県,吉野家 下関幡生店,山口県下関市生野町2丁目28‐4,1000,20240302,980,20
吉野家,東京都,吉野家 下高井戸駅店,東京都世田谷区松原3丁目29‐17,1250,20240302,1200,50
吉野家,埼玉県,吉野家 下笹目店,埼玉県戸田市笹目6丁目21‐4,1150,20240302,1100,50
吉野家,東京都,吉野家 下石神井千川通り店,東京都練馬区下石神井2丁目3‐1,1500,20240302,1400,100
吉野家,東京都,吉野家 下北沢駅東口店,東京都世田谷区北沢2丁目25‐16,1300,20240302,1250,50
吉野家,兵庫県,吉野家 加古川駅北口店,兵庫県加古川市加古川町篠原町30‐10,1080,20240302,1001,79
吉野家,奈良県,吉野家 河合町店,奈良県北葛城郡河合町池部2丁目4‐17,1020,20240302,1000,20
吉野家,大阪府,吉野家 河内小阪駅前店,大阪府東大阪市小阪本町1丁目3‐2,1100,20240302,1080,20
吉野家,静岡県,吉野家 掛川店,静岡県掛川市城西2丁目13‐5,1100,20240302,1050,50
吉野家,奈良県,吉野家 橿原木原町店,奈良県橿原市木原町223‐1,1020,20240302,1000,20
吉野家,東京都,吉野家 環状7号線豊玉南店,東京都練馬区豊玉南2丁目16‐15,1300,20240302,1200,100
吉野家,愛媛県,吉野家 環状線和泉店,愛媛県松山市土居田町94‐1,1000,20240302,950,50
吉野家,大阪府,吉野家 関目店,大阪府大阪市城東区成育5丁目22‐11,1150,20240302,1100,50
吉野家,愛知県,吉野家 丸田町店,愛知県名古屋市中区栄5丁目25‐28,1250,20240302,1200,50
吉野家,大阪府,吉野家 岸和田和泉インター店,大阪府岸和田市三田町400‐21,1100,20240302,1080,20
吉野家,愛知県,吉野家 岩倉店,愛知県岩倉市大地新町3丁目10‐1,1100,20240302,1050,50
吉野家,岐阜県,吉野家 岐阜羽島店,岐阜県羽島市竹鼻町丸の内1丁目1,1050,20240302,1000,50
吉野家,東京都,吉野家 菊川駅前店,東京都墨田区菊川2丁目6‐13,1300,20240302,1250,50
吉野家,東京都,吉野家 吉祥寺北店,東京都武蔵野市吉祥寺本町1丁目8‐3,1300,20240302,1250,50
吉野家,愛知県,吉野家 久屋大通錦店,愛知県名古屋市中区錦3丁目6‐15,1150,20240302,1100,50
吉野家,宮崎県,吉野家 宮崎瀬頭店,宮崎県宮崎市瀬頭2丁目1‐4,1000,20240302,950,50
吉野家,宮崎県,吉野家 宮崎南店,宮崎県宮崎市中村西3丁目3‐61,1000,20240302,950,50
吉野家,富山県,吉野家 魚津店,富山県魚津市上村木848‐2,1150,20240302,1050,100
吉野家,東京都,吉野家 京王多摩センター店,東京都多摩市落合1丁目10‐1,1200,20240302,1150,50
吉野家,神奈川,吉野家 京急川崎店,神奈川県川崎市川崎区砂子1丁目1‐8,1250,20240302,1200,50
吉野家,京都府,吉野家 京都九条店,京都府京都市南区西九条東島町61,1100,20240302,1070,30
吉野家,京都府,吉野家 京都八条口店,京都府京都市南区西九条北ノ内町41番4,1150,20240302,1100,50
吉野家,大阪府,吉野家 玉出店,大阪府大阪市住之江区粉浜西1丁目1‐23,1100,20240302,1080,20
吉野家,三重県,吉野家 近鉄四日市店,三重県四日市市安島1丁目1‐20,1100,20240302,1050,50
吉野家,大阪府,吉野家 近鉄八尾駅前店,大阪府八尾市光町2丁目180‐1,1120,20240302,1080,40
吉野家,石川県,吉野家 金沢もりの里店,石川県金沢市もりの里1丁目60,1050,20240302,1000,50
吉野家,石川県,吉野家 金沢三馬店,石川県金沢市三馬3‐345,1050,20240302,1000,50
吉野家,石川県,吉野家 金沢新神田店,石川県金沢市新神田2丁目13‐10,1050,20240302,1000,50
吉野家,石川県,吉野家 金沢畝田店,石川県金沢市畝田西1丁目103,1050,20240302,1000,50
吉野家,大阪府,吉野家 九条店,大阪府大阪市西区千代崎2丁目10‐1,1150,20240302,1100,50
吉野家,東京都,吉野家 駒込駅東口店,東京都北区中里1丁目‐6‐4,1250,20240302,1200,50
吉野家,埼玉県,吉野家 熊谷駅北口店,埼玉県熊谷市筑波2丁目112,1150,20240302,1100,50
吉野家,熊本県,吉野家 熊本健軍店,熊本県熊本市東区東野2丁目1‐3,980,20240302,950,30
吉野家,熊本県,吉野家 熊本東バイパス店,熊本県熊本市東区上南部2丁目1‐108,980,20240302,950,30
吉野家,香川県,吉野家 栗林店,香川県高松市東ハゼ町12‐4,1050,20240302,950,100
吉野家,岐阜県,吉野家 郡上八幡店,岐阜県郡上市八幡町城南町221‐1,1100,20240302,1000,100
吉野家,東京都,吉野家 恵比寿駅前店,東京都渋谷区恵比寿西1丁目9‐6,1400,20240302,1300,100
吉野家,東京都,吉野家 恵比寿駅東口店,東京都渋谷区恵比寿1‐13‐9,1400,20240302,1300,100
吉野家,大阪府,吉野家 恵美須町店,大阪府大阪市浪速区日本橋5丁目13‐9,1200,20240302,1100,100
吉野家,埼玉県,吉野家 見沼南中野店,埼玉県さいたま市見沼区南中野461‐1,1150,20240302,1100,50
吉野家,東京都,吉野家 原宿竹下口店,東京都渋谷区神宮前1丁目17‐1,1400,20240302,1300,100
吉野家,千葉県,吉野家 原木中山駅店,千葉県船橋市本中山7‐7‐1,1150,20240302,1100,50
吉野家,愛知県,吉野家 古出来町店,愛知県名古屋市千種区北千種1丁目1‐1,1150,20240302,1100,50
吉野家,埼玉県,吉野家 戸田喜沢店,埼玉県戸田市喜沢1丁目23‐1,1150,20240302,1100,50
吉野家,埼玉県,吉野家 戸田新曽店,埼玉県戸田市新曽2097,1150,20240302,1100,50
吉野家,埼玉県,吉野家 戸田店,埼玉県戸田市下戸田2丁目11‐4,1150,20240302,1100,50
吉野家,滋賀県,吉野家 湖南夏見店,滋賀県湖南市夏見425‐1,1050,20240302,1000,50
吉野家,東京都,吉野家 虎ノ門店,東京都港区虎ノ門1丁目1‐21,1350,20240302,1300,50
吉野家,東京都,吉野家 五日市街道並木町店,東京都国分寺市並木町2丁目23‐7,1250,20240302,1150,100
吉野家,東京都,吉野家 五反田駅前店,東京都品川区東五反田1丁目13‐7,1350,20240302,1300,50
吉野家,大阪府,吉野家 御堂筋難波店,大阪府大阪市中央区道頓堀2丁目1‐1,1300,20240302,1200,100
