松屋,大阪府,松のや 千船店,大阪府大阪市西淀川区佃2-230-1（仮称）千船阪神ビル,1200,20240525,1100,100
松屋,大阪府,松のや 谷町四丁目店,大阪府大阪市中央区谷町2-3-4 サンシャイン大手前ビル1F西,1200,20240525,1150,50
松屋,大阪府,松のや 南森町店/マイカリー食堂 南森町店,大阪府大阪市北区天神橋2-5-18 南森町センタービル,1200,20240525,1150,50
松屋,大阪府,松のや 姫島店,大阪府大阪市西淀川区姫里1-26-18,1200,20240525,1100,100
松屋,東京都,松軒中華食堂 千歳烏山店,東京都世田谷区南烏山6-4-1 烏山かどやビル1F,1300,20240525,1200,100
すき家,新潟県,すき家 7号村上店,新潟県村上市村上20-1、22-9、仲間町605-3・7・8・9・10・11・15-17、607-1・2,1000,20240525,,1000
すき家,神奈川,すき家 鶴見中央店,神奈川県横浜市鶴見区鶴見中央4-32-16,1250,20240525,,1250
すき家,神奈川,すき家 日ノ出町駅前店,神奈川県横浜市中区日ノ出町1-51日ノ出町サクアス1階,1200,20240525,,1200
