吉野家,長崎県,吉野家 35号線佐世保大塔店,長崎県佐世保市大塔町18－11,750,800,50
吉野家,熊本県,吉野家 熊本光の森店,熊本県菊池郡菊陽町光の森6丁目2,800,900,100
吉野家,長崎県,吉野家 佐世保下京店,長崎県佐世保市下京町1－1,750,800,50
吉野家,大阪府,吉野家 大阪京橋店,大阪府大阪市都島区東野田町5－2－28,900,950,50
吉野家,東京都,吉野家 大山駅前店,東京都板橋区大山町4－6,1000,1200,200
吉野家,熊本県,吉野家 浜線八王寺店,熊本県熊本市中央区八王寺町839,850,900,50
すき家,茨城県,すき家 118号常陸大宮泉店,茨城県常陸大宮市泉字中村田462-6,900,930,30
すき家,栃木県,すき家 119号宇都宮一条店,栃木県宇都宮市一条3-1-8,930,1000,70
すき家,埼玉県,すき家 122号騎西店,埼玉県加須市騎西字高道460-1,930,1000,70
すき家,埼玉県,すき家 125号加須諏訪店,埼玉県加須市諏訪1-15-1,930,1000,70
すき家,埼玉県,すき家 125号久喜栗橋店,埼玉県久喜市栗橋1301-3,950,980,30
すき家,茨城県,すき家 125号八千代町店,茨城県結城郡八千代町大字菅谷604-1,910,950,40
すき家,北海道,すき家 12号岩見沢店,北海道岩見沢市九条西10-1-39,850,900,50
すき家,北海道,すき家 12号江別野幌店,北海道江別市野幌町48-4,830,860,30
すき家,埼玉県,すき家 140号秩父野坂店,埼玉県秩父市野坂町2-1-21,900,1000,100
すき家,愛知県,すき家 153号日進赤池店,愛知県日進市浅田町笹原8-11,950,1000,50
すき家,愛知県,すき家 155号常滑大鳥店,愛知県常滑市大鳥町5-22,950,1000,50
すき家,愛知県,すき家 155号知多新舞子店,愛知県知多市旭南2-48-1,950,1000,50
すき家,大阪府,すき家 163号門真殿島店,大阪府門真市殿島町7-13,920,1000,80
すき家,三重県,すき家 165号名張蔵持店,三重県名張市蔵持町原出778-1,900,980,80
すき家,埼玉県,すき家 16号入間二本木店,埼玉県入間市二本木941-1,980,1000,20
すき家,大阪府,すき家 170号羽曳野西浦店,大阪府羽曳野市西浦3-2-1,920,930,10
すき家,大阪府,すき家 170号熊取店,大阪府泉南郡熊取町紺屋2-5-5,900,930,30
すき家,大阪府,すき家 170号寝屋川高宮店,大阪府寝屋川市高宮1-10-27,900,960,60
すき家,埼玉県,すき家 17号さいたま辻店,埼玉県さいたま市南区辻3-2-28,980,1020,40
すき家,埼玉県,すき家 17号上里店,埼玉県児玉郡上里町大字神保原町2211-2,920,1000,80
すき家,埼玉県,すき家 17号深谷西店,埼玉県深谷市大字萱場116-1,930,1000,70
すき家,埼玉県,すき家 17号本庄店,埼玉県本庄市本庄4-7-11,920,1000,80
すき家,群馬県,すき家 18号安中原市店,群馬県安中市原市612-3,900,1000,100
すき家,長野県,すき家 18号小諸店,長野県小諸市諸1-5-11,900,920,20
すき家,岐阜県,すき家 19号多治見音羽店,岐阜県多治見市音羽町4-1,950,1000,50
すき家,岐阜県,すき家 19号中津川IC店,岐阜県中津川市千旦林204-2,950,1000,50
すき家,愛知県,すき家 1国刈谷店,愛知県刈谷市今川町西高山7-1,950,1000,50
すき家,静岡県,すき家 1国静岡馬渕店,静岡県静岡市駿河区馬渕1-17-38,950,980,30
すき家,愛知県,すき家 1国豊橋下地店,愛知県豊橋市下地町字宮腰11-9,920,980,60
すき家,愛知県,すき家 1国豊橋岩屋店,愛知県豊橋市岩屋町字岩屋下47-11,920,980,60
すき家,愛知県,すき家 1国豊川御油店,愛知県豊川市御油町池田53-4,920,980,60
すき家,大阪府,すき家 1国枚方北中振店,大阪府枚方市北中振4-10-5,900,960,60
すき家,愛知県,すき家 1国緑区境松店,愛知県名古屋市緑区境松1-327-1,950,1000,50
すき家,佐賀県,すき家 202号唐津鏡店,佐賀県唐津市鏡4664-1,850,900,50
すき家,長崎県,すき家 204号佐世保田原店,長崎県佐世保市田原町17-23,820,850,30
すき家,大分県,すき家 212号日田店,大分県日田市南元町20-7,850,900,50
すき家,北海道,すき家 235号静内店,北海道日高郡新ひだか町静内末広町2-1-20,870,900,30
すき家,愛知県,すき家 23号豊橋花田店,愛知県豊橋市花田町字荒木37-1,920,980,60
すき家,茨城県,すき家 245号日立久慈店,茨城県日立市久慈町4-6-6,900,950,50
すき家,神奈川,すき家 246号秦野渋沢店,神奈川県秦野市並木町188-1,980,1000,20
すき家,愛知県,すき家 247号半田店,愛知県半田市昭和町3-20,950,1000,50
すき家,愛知県,すき家 247号美浜店,愛知県知多郡美浜町新浦戸1-11-4,950,1000,50
すき家,愛知県,すき家 248号幸田大草店,愛知県額田郡幸田町大字大草字検行132-2,920,1000,80
すき家,奈良県,すき家 24号五條今井店,奈良県五條市今井1-11-57,870,900,30
すき家,兵庫県,すき家 250号赤穂駅前店,兵庫県赤穂市加里屋69-11,950,970,20
すき家,埼玉県,すき家 254号本庄児玉店,埼玉県本庄市児玉町吉田林字千日堂397-3,920,1000,80
すき家,愛知県,すき家 259号田原店,愛知県田原市大字谷熊字備後42-1,920,980,60
すき家,奈良県,すき家 25号斑鳩法隆寺店,奈良県生駒郡斑鳩町法隆寺東2-1-22,870,900,30
すき家,佐賀県,すき家 263号佐賀大和IC店,佐賀県佐賀市大和町尼寺3386-1,850,900,50
すき家,熊本県,すき家 266号宇城松橋店,熊本県宇城市松橋町曲野133-4,860,900,40
すき家,大阪府,すき家 26号岸和田下池田店,大阪府岸和田市下池田町1-2-3,900,930,30
すき家,大阪府,すき家 26号高石店,大阪府高石市西取石7-11-1,900,950,50
すき家,大阪府,すき家 26号泉佐野鶴原店,大阪府泉佐野市鶴原1855-3,900,930,30
すき家,大阪府,すき家 26号泉大津店,大阪府泉大津市北豊中町2-17-24,900,930,30
すき家,千葉県,すき家 296号佐倉井野店,千葉県佐倉市井野1572-2,950,980,30
すき家,埼玉県,すき家 299号入間野田店,埼玉県入間市野田1571-2,950,1000,50
すき家,広島県,すき家 2国福山南本庄店,広島県福山市南本庄2-7-4,900,930,30
すき家,兵庫県,すき家 2国明石天文町店,兵庫県明石市天文町1-8-6,930,950,20
すき家,大阪府,すき家 307号枚方津田西店,大阪府枚方市津田西町1-2-1,900,960,60
すき家,大阪府,すき家 309号堺黒山店,大阪府堺市美原区黒山168-1,920,930,10
すき家,大阪府,すき家 310号堺大野芝店,大阪府堺市中区大野芝町209-1,900,950,50
すき家,大阪府,すき家 310号大阪狭山店,大阪府大阪狭山市東茱萸木1-691-1,900,930,30
すき家,熊本県,すき家 324号天草店,熊本県天草市小松原町7-12,780,800,20
すき家,沖縄県,すき家 329号西原店,沖縄県中頭郡西原町字我謝786-2,800,850,50
すき家,沖縄県,すき家 329号那覇古波蔵店,沖縄県那覇市古波蔵3-14-2,800,900,100
すき家,沖縄県,すき家 329号那覇上間店,沖縄県那覇市字上間276-1,800,900,100
すき家,沖縄県,すき家 329号北中城店,沖縄県中頭郡北中城村字渡口456-3,800,850,50
すき家,沖縄県,すき家 330号浦添内間店,沖縄県浦添市内間2-6-9&nbsp;2F,800,850,50
すき家,沖縄県,すき家 331号糸満店,沖縄県糸満市字潮平603-1,800,850,50
すき家,沖縄県,すき家 331号南城店,沖縄県南城市佐敷字津波古1356-2,800,850,50
すき家,茨城県,すき家 349号那珂店,茨城県那珂市竹ノ内4-11-8,900,950,50
すき家,佐賀県,すき家 34号吉野ヶ里店,佐賀県神埼郡吉野ヶ里町田手1678-16,830,850,20
すき家,佐賀県,すき家 34号小城三日月店,佐賀県小城市三日月町金田字久本1101-1,850,900,50
すき家,長崎県,すき家 34号大村店,長崎県大村市桜馬場2-370-1,800,850,50
すき家,長崎県,すき家 34号東長崎店,長崎県長崎市矢上町52-2,820,850,30
すき家,佐賀県,すき家 34号武雄店,佐賀県武雄市武雄町大字昭和795-1,820,850,30
すき家,長崎県,すき家 35号佐世保大和店,長崎県佐世保市大和町749-1,820,850,30
すき家,三重県,すき家 365号四日市野田店,三重県四日市市野田2-2-34,930,980,50
すき家,熊本県,すき家 387号合志店,熊本県合志市御代志1736-4,850,900,50
すき家,北海道,すき家 39号網走新町店,北海道網走市新町2-3-5,880,900,20
すき家,熊本県,すき家 3号宇土店,熊本県宇土市水町68-1,860,900,40
すき家,埼玉県,すき家 407号熊谷弥藤吾店,埼玉県熊谷市弥藤吾字新田1519-2,930,1000,70
すき家,神奈川,すき家 412号厚木林店,神奈川県厚木市林4-12-34,980,1000,20
すき家,愛知県,すき家 419号高浜店,愛知県高浜市湯山町2-5-1,950,1000,50
すき家,岐阜県,すき家 41号下呂店,岐阜県下呂市萩原町上呂字堂前1624-1,900,1000,100
すき家,岐阜県,すき家 41号高山店,岐阜県高山市下岡本町3014-5,900,1000,100
すき家,愛知県,すき家 41号大口店,愛知県丹羽郡大口町中小口3-72-1,930,950,20
すき家,埼玉県,すき家 463号入間東店,埼玉県入間市東町6-1-24,970,1000,30
すき家,神奈川,すき家 467号藤沢長後店,神奈川県藤沢市長後754-1,980,1000,20
すき家,広島県,すき家 486号福山駅家店,広島県福山市駅家町万能倉288-1,900,930,30
すき家,栃木県,すき家 4号宇都宮今泉店,栃木県宇都宮市今泉町2533-1,930,1000,70
すき家,福島県,すき家 4号郡山安積店,福島県郡山市安積3-43,870,900,30
すき家,宮城県,すき家 4号仙台郡山店,宮城県仙台市太白区郡山字出丸1-1,870,900,30
すき家,岩手県,すき家 4号滝沢店,岩手県滝沢市巣子109-2,820,850,30
すき家,福島県,すき家 4号本宮店,福島県本宮市本宮字南ノ内34-7,870,900,30
すき家,沖縄県,すき家 507号八重瀬店,沖縄県島尻郡八重瀬町字伊覇46-4,800,850,50
すき家,群馬県,すき家 50号伊勢崎赤堀店,群馬県伊勢崎市赤堀今井町1-557-1,920,960,40
すき家,栃木県,すき家 50号岩舟静店,栃木県下都賀郡岩舟町大字静2167-1,910,1000,90
すき家,群馬県,すき家 50号桐生広沢店,群馬県桐生市広沢町三丁目字反町4023-2,900,1000,100
すき家,茨城県,すき家 50号筑西蓮沼店,茨城県筑西市蓮沼1534-1,900,950,50
すき家,茨城県,すき家 51号水戸大洗IC店,茨城県水戸市大串町965-3,900,930,30
すき家,熊本県,すき家 57号大津店,熊本県菊池郡大津町大字大津1302-1,850,900,50
すき家,長崎県,すき家 57号諫早小川町店,長崎県諫早市小川町53-1,820,850,30
すき家,沖縄県,すき家 58号宜野湾大謝名店,沖縄県宜野湾市字大謝名西原70-2,800,850,50
すき家,沖縄県,すき家 58号読谷店,沖縄県中頭郡読谷村伊良皆661-1,800,900,100
すき家,沖縄県,すき家 58号北谷店,沖縄県中頭郡北谷町北谷2-12-6第5松栄ビル1F,850,900,50
すき家,沖縄県,すき家 58号名護東江店,沖縄県名護市東江5-6517-1,800,900,100
すき家,茨城県,すき家 6号ひたちなか田彦店,茨城県ひたちなか市大字田彦1569-1,900,950,50
すき家,千葉県,すき家 6号松戸きよしヶ丘店,千葉県松戸市小金きよしヶ丘4-11-6,930,960,30
すき家,茨城県,すき家 6号水戸住吉店,茨城県水戸市住吉町47-1,900,930,30
すき家,秋田県,すき家 7号大館店,秋田県大館市根下戸新町9-25,850,880,30
すき家,神奈川,すき家 bono相模大野店,神奈川県相模原市南区相模大野3-3-2-203&nbsp;bono相模大野,950,1000,50
すき家,埼玉県,すき家 ｲｵﾝﾀｳﾝ上里店,埼玉県児玉郡上里町金久保蓮山359-1,920,1000,80
すき家,兵庫県,すき家 ｲｵﾝﾀｳﾝ太子店,兵庫県揖保郡太子町東出262-1,930,950,20
すき家,茨城県,すき家 ｲｵﾝﾓｰﾙ下妻店,茨城県下妻市堀篭972-1,930,950,20
すき家,岩手県,すき家 ｲｵﾝﾓｰﾙ盛岡南店,岩手県盛岡市本宮7-1-1,860,900,40
すき家,群馬県,すき家 ｲｵﾝﾓｰﾙ太田店,群馬県太田市石原町81イオンモ-ル太田2F,930,1000,70
すき家,兵庫県,すき家 ｲｵﾝﾓｰﾙ猪名川店,兵庫県川辺郡猪名川町白金2-1,900,950,50
すき家,千葉県,すき家 ｲｵﾝ千葉NT店,千葉県印西市中央北3-2,950,1080,130
すき家,沖縄県,すき家 ｲｵﾝ那覇店,沖縄県那覇市金城5-10-2イオン那覇1F,800,850,50
すき家,神奈川,すき家 ｾﾝﾀｰ北店,神奈川県横浜市都筑区牛久保東1-32-1,1050,1080,30
すき家,神奈川,すき家 ｿﾆｰ厚木ﾃｸﾉﾛｼﾞｰｾﾝﾀｰ店,神奈川県厚木市旭町4-14-1,930,980,50
すき家,千葉県,すき家 ﾓﾘｼｱ津田沼店,千葉県習志野市谷津1-16-1モリシア津田沼1F,930,1030,100
すき家,神奈川,すき家 １国茅ヶ崎十間坂店,神奈川県茅ヶ崎市十間坂3-2-2,1000,1050,50
すき家,沖縄県,すき家 うるま石川店,沖縄県県うるま市石川2-11-1,800,850,50
すき家,沖縄県,すき家 うるま前原店,沖縄県うるま市字前原169-4-3,800,850,50
すき家,栃木県,すき家 おもちゃのまち店,栃木県下都賀郡壬生町大字壬生丁210-3,900,950,50
すき家,埼玉県,すき家 さいたま宿店,埼玉県さいたま市桜区宿135-1,980,1100,120
すき家,埼玉県,すき家 さいたま西堀店,埼玉県さいたま市桜区西堀8-4,980,1100,120
すき家,埼玉県,すき家 さいたま太田窪店,埼玉県さいたま市緑区太田窪3-17-25,980,1100,120
すき家,埼玉県,すき家 さいたま本郷町店,埼玉県さいたま市北区本郷町689-1,950,1100,150
すき家,埼玉県,すき家 さいたま与野本町店,埼玉県さいたま市中央区鈴谷9-10-4,980,1100,120
すき家,埼玉県,すき家 さいたま領家店,埼玉県さいたま市浦和区領家4-14-5,980,1100,120
すき家,大阪府,すき家 はびきの伊賀店,大阪府羽曳野市伊賀4-5-6,920,930,10
すき家,茨城県,すき家 ひたちなか店,茨城県ひたちなか市中根3319-6,900,950,50
すき家,長崎県,すき家 みらい長崎ｺｺｳｫｰｸ店,長崎県長崎市茂里町1-55みらい長崎ココウォーク3F,820,850,30
すき家,島根県,すき家 ゆめﾀｳﾝ出雲店,島根県出雲市大塚町650-1,900,950,50
すき家,神奈川,すき家 アクロスプラザ湯河原店,神奈川県足柄下郡湯河原町中央1-1617-54,980,1000,20
すき家,大阪府,すき家 イオンモール茨木店,大阪府茨木市松ヶ本町8-30-3イオン茨木店1F,900,960,60
すき家,埼玉県,すき家 イオンモール浦和美園店,埼玉県さいたま市緑区美園5-50-1ｲｵﾝﾓｰﾙ浦和美園3Fﾌｰﾄﾞｺｰﾄ,1000,1050,50
すき家,千葉県,すき家 イオンモール八千代緑が丘店,千葉県八千代市緑が丘2-1-3,950,1050,100
すき家,埼玉県,すき家 イオンモール北戸田店,埼玉県戸田市美女木東1-3-1,980,1020,40
すき家,神奈川,すき家 イオン金沢八景店,神奈川県横浜市金沢区泥亀1-27-1ｲｵﾝ金沢八景地下1Fﾌｰﾄﾞｺｰﾄ内,950,1050,100
すき家,神奈川,すき家 イオン秦野店,神奈川県秦野市入船町12-1,980,1000,20
すき家,東京都,すき家 イオン東雲店,東京都江東区東雲1-9-10&nbsp;イオン東雲店2Fフードコート内,1100,1150,50
すき家,沖縄県,すき家 イオン北谷店,沖縄県中頭郡北谷町宇美浜8-3&nbsp;イオン北谷店2F,800,850,50
すき家,神奈川,すき家 ノクティプラザ店,神奈川県川崎市高津区溝口1-4-1&nbsp;ノクティプラザ2&nbsp;1Fフードコート内,1000,1050,50
すき家,愛知県,すき家 安城桜井店,愛知県安城市桜井町山ノ寺61-3,950,1000,50
すき家,愛知県,すき家 安城篠目店,愛知県安城市篠目町竜田87-7,950,1000,50
すき家,愛知県,すき家 安城中央店,愛知県安城市城南町1-2-1,950,1000,50
すき家,愛知県,すき家 安城緑町店,愛知県安城市緑町1-17-8,950,1000,50
すき家,群馬県,すき家 安中店,群馬県安中市中宿1丁目字石合891-1,900,1000,100
すき家,群馬県,すき家 伊勢崎ﾌｫﾘｵ店,群馬県伊勢崎市安堀町207-1,920,1000,80
すき家,群馬県,すき家 伊勢崎除ヶ町店,群馬県伊勢崎市除ヶ町324-1,920,1000,80
すき家,群馬県,すき家 伊勢崎上諏訪店,群馬県伊勢崎市上諏訪町1523-14,920,960,40
すき家,群馬県,すき家 伊勢崎連取店,群馬県伊勢崎市連取町1804-2,920,1000,80
すき家,三重県,すき家 伊勢上地店,三重県伊勢市上地町3112-3,950,980,30
すき家,愛知県,すき家 一宮駅前店,愛知県一宮市栄3-7-1石照ビル1F,920,1000,80
すき家,愛知県,すき家 一宮中島通店,愛知県一宮市中島通1-32-2,920,1000,80
すき家,愛知県,すき家 一宮妙興寺店,愛知県一宮市宮地2-13-4,920,1000,80
すき家,大阪府,すき家 茨木IC店,大阪府茨木市郡4-11-36,900,960,60
すき家,大阪府,すき家 茨木中穂積店,大阪府茨木市中穂積2-10-8,900,960,60
すき家,千葉県,すき家 印西BP店,千葉県印西市竹袋623-1,950,1050,100
すき家,千葉県,すき家 印西西の原店,千葉県印西市草深字天王前1048-7,1000,1050,50
すき家,栃木県,すき家 宇都宮西店,栃木県宇都宮市鶴田町2-39-42,950,1000,50
すき家,栃木県,すき家 宇都宮東店,栃木県宇都宮市宿郷3-21-30,930,1000,70
すき家,栃木県,すき家 宇都宮平松店,栃木県宇都宮市平松本町1223-1の一部､1223-2の一部,930,1000,70
すき家,岐阜県,すき家 羽島竹鼻店,岐阜県羽島市竹鼻町丸の内4-70,900,950,50
すき家,埼玉県,すき家 浦和桜田店,埼玉県さいたま市桜区桜田3-1-16,980,1100,120
すき家,神奈川,すき家 横浜笠間店,神奈川県横浜市栄区笠間5-33-26,1000,1050,50
すき家,神奈川,すき家 横浜上郷店,神奈川県横浜市栄区上郷町199-1,950,1000,50
すき家,神奈川,すき家 横浜日野中央店,神奈川県横浜市港南区日野中央2-42-1,1000,1050,50
すき家,埼玉県,すき家 桶川店,埼玉県桶川市末広2-2-8&nbsp;平澤ビル1F,950,1000,50
すき家,埼玉県,すき家 下羽生店,埼玉県羽生市大字下羽生字岸町921-2,930,1000,70
すき家,神奈川,すき家 下永谷店,神奈川県横浜市港南区下永谷5-1-15,1050,1080,30
すき家,埼玉県,すき家 加須南大桑店,埼玉県加須市南大桑2877-1,930,1000,70
すき家,兵庫県,すき家 加西北条店,兵庫県加西市北条町横尾294-1,930,950,20
すき家,岐阜県,すき家 可児下恵土店,岐阜県可児市下恵土字広瀬5890-1-1,900,950,50
すき家,大阪府,すき家 貝塚北町店,大阪府貝塚市北町17-15,900,930,30
すき家,茨城県,すき家 笠間店,茨城県笠間市笠間487-1,900,970,70
すき家,茨城県,すき家 笠間友部店,茨城県笠間市旭町427-2,900,970,70
すき家,群馬県,すき家 笠懸阿左美店,群馬県みどり市笠懸町阿左美630-2,900,1000,100
すき家,愛知県,すき家 蒲郡栄町店,愛知県蒲郡市栄町9-41,920,980,60
すき家,愛知県,すき家 蒲郡三谷北通店,愛知県蒲郡市三谷北通2-122,920,980,60
すき家,大阪府,すき家 蒲生四丁目店,大阪府大阪市城東区蒲生4-21-8,930,950,20
すき家,神奈川,すき家 鴨居駅北口店,神奈川県横浜市緑区鴨居1-15-13&nbsp;鴨居駅前SOHP-M&amp;Iビル1F,950,1000,50
すき家,愛知県,すき家 刈谷店,愛知県刈谷市一ツ木町4-1-8,950,1000,50
すき家,愛知県,すき家 刈谷東陽店,愛知県刈谷市東陽町2-24,950,1000,50
すき家,神奈川,すき家 寒川宮山店,神奈川県高座郡寒川町宮山3460-1,980,1000,20
すき家,神奈川,すき家 環状4号泉区和泉店,神奈川県横浜市泉区和泉町494-5,1000,1050,50
すき家,大阪府,すき家 関目店,大阪府大阪市城東区成育2-13-15&nbsp;アイビーマンション1F,930,950,20
すき家,岐阜県,すき家 関雄飛ヶ丘店,岐阜県関市雄飛ヶ丘39-1,900,950,50
すき家,千葉県,すき家 館山店,千葉県館山市安布里字青木田190-2,980,1000,20
すき家,大阪府,すき家 岸和田磯上店,大阪府岸和田市磯上町4-23-25,900,930,30
すき家,大阪府,すき家 岸和田和泉IC北店,大阪府岸和田市田治米町343-1,900,930,30
すき家,埼玉県,すき家 岩槻駅前店,埼玉県さいたま市岩槻区本町1-3-3吉田ビル1F,930,950,20
すき家,埼玉県,すき家 岩槻城北東店,埼玉県さいたま市岩槻区上野1-20-5,930,950,20
すき家,埼玉県,すき家 岩槻店,埼玉県さいたま市岩槻区城町2-10-59,930,950,20
すき家,岐阜県,すき家 岐阜南鶉店,岐阜県岐阜市南鶉5-18-1,920,950,30
すき家,岐阜県,すき家 岐阜入舟店,岐阜県岐阜市入舟町4-19,900,950,50
すき家,岐阜県,すき家 岐阜本荘店,岐阜県岐阜市鹿島町6-3-2,900,950,50
すき家,沖縄県,すき家 宜野湾我如古店,沖縄県宜野湾市我如古4-7-3,800,850,50
すき家,埼玉県,すき家 久喜栗原店,埼玉県久喜市栗原2-2-5,950,980,30
すき家,埼玉県,すき家 宮原駅東口店,埼玉県さいたま市北区宮原町3-321杉ビル･2&nbsp;1F,950,1100,150
すき家,神奈川,すき家 京王稲田堤駅前店,神奈川県川崎市多摩区菅3-1-1,980,1000,20
すき家,大阪府,すき家 京阪枚方市駅前店,大阪府枚方市岡本町3-4N´s&nbsp;Square1F,900,960,60
すき家,埼玉県,すき家 狭山広瀬店,埼玉県狭山市広瀬2-35-12,950,1000,50
すき家,東京都,すき家 玉川学園駅前店,東京都町田市玉川学園7-5-2,950,1000,50
すき家,群馬県,すき家 桐生新宿店,群馬県桐生市新宿3-2-14,900,1000,100
すき家,群馬県,すき家 桐生相生店,群馬県桐生市相生町2-489-1,900,1000,100
すき家,埼玉県,すき家 熊谷BP店,埼玉県熊谷市大字上之字宮の前4004-1,930,1000,70
すき家,埼玉県,すき家 熊谷西店,埼玉県熊谷市新島261-2,930,1000,70
すき家,埼玉県,すき家 熊谷籠原店,埼玉県熊谷市大字拾六間763-1,930,1000,70
すき家,熊本県,すき家 熊本秋津店,熊本県熊本市東区沼山津3-1-11,870,920,50
すき家,千葉県,すき家 君津店,千葉県君津市外箕輪3-17-21,980,1000,20
すき家,群馬県,すき家 群馬吉井町店,群馬県高崎市吉井町池46-4,900,960,60
すき家,愛知県,すき家 犬山五郎丸店,愛知県犬山市五郎丸東3-7-1,920,950,30
すき家,茨城県,すき家 古河坂間店,茨城県古河市坂間253-178,910,1000,90
すき家,栃木県,すき家 戸祭店,栃木県宇都宮市戸祭町3001-1,930,1000,70
すき家,神奈川,すき家 戸塚駅西口店,神奈川県横浜市戸塚区戸塚町4080-1&nbsp;LEON-K&nbsp;1F,1000,1050,50
すき家,埼玉県,すき家 戸田駅前店,埼玉県戸田市大字新曽668-2,980,1050,70
すき家,大阪府,すき家 交野星田北店,大阪府交野市星田北3-37-4,900,960,60
すき家,神奈川,すき家 厚木長谷店,神奈川県厚木市長谷篭堰642-3,980,1000,20
すき家,埼玉県,すき家 幸手店,埼玉県幸手市中2-12-35,950,980,30
すき家,広島県,すき家 広島観音店,広島県広島市西区南観音6-14-18,980,1100,120
すき家,広島県,すき家 広島商工ｾﾝﾀｰ店,広島県広島市西区商工センター8-2-49,900,1100,200
すき家,神奈川,すき家 江田駅前店,神奈川県横浜市青葉区荏田町2364-1,1000,1020,20
すき家,愛知県,すき家 江南大間店,愛知県江南市大間町新町159-1,900,950,50
すき家,神奈川,すき家 港南台店,神奈川県横浜市港南区港南台4-3-1ビ-バ-ビﾙ1F,950,1000,50
すき家,神奈川,すき家 港北箕輪町店,神奈川県横浜市港北区箕輪町2-5-5,1050,1080,30
すき家,山梨県,すき家 甲府西店,山梨県甲斐市富竹新田1279-1,900,960,60
すき家,神奈川,すき家 綱島駅西口店,神奈川県横浜市港北区綱島西1-10-10第5吉田ビル1F,1050,1080,30
すき家,埼玉県,すき家 行田向町店,埼玉県行田市向町17-11,930,1000,70
すき家,千葉県,すき家 行徳北店,千葉県市川市富浜3-2-24,1000,1050,50
すき家,奈良県,すき家 香芝IC店,奈良県香芝市上中69-3,870,900,30
すき家,大阪府,すき家 香里園駅前店,大阪府寝屋川市香里南之町20-23,900,960,60
すき家,群馬県,すき家 高崎IC店,群馬県高崎市島野町大岩996-1,930,1000,70
すき家,群馬県,すき家 高崎東店,群馬県高崎市上中居町190-1,930,1000,70
すき家,群馬県,すき家 高崎棟高店,群馬県高崎市棟高町1868-113,930,1000,70
すき家,群馬県,すき家 高崎緑町店,群馬県高崎市緑町1-29-9,930,1000,70
すき家,大阪府,すき家 高槻下田部店,大阪府高槻市下田部町1-3-28,900,960,60
すき家,大阪府,すき家 高槻古曽部店,大阪府高槻市古曽部町2-21-32,900,960,60
すき家,大阪府,すき家 高槻西店,大阪府高槻市大畑町26-17,900,960,60
すき家,東京都,すき家 高輪三丁目店,東京都港区高輪3-25-23&nbsp;京急第2ビル1F,1170,1300,130
すき家,埼玉県,すき家 鴻巣鎌塚店,埼玉県鴻巣市鎌塚1775-6,930,1000,70
すき家,埼玉県,すき家 鴻巣店,埼玉県鴻巣市天神1-7-6,960,1000,40
すき家,東京都,すき家 国分寺本多店,東京都国分寺市本多2-16-1,950,1000,50
すき家,佐賀県,すき家 佐賀南店,佐賀県佐賀市本庄町袋305-2,850,900,50
すき家,千葉県,すき家 佐倉石川店,千葉県佐倉市石川535-6,980,1000,20
