松屋,京都府,松のや 椥辻店,京都府京都市山科区椥辻東潰34-2,NA,950,950
すき家,埼玉県,すき家 17号ＢＰ戸田美女木店,埼玉県戸田市美女木7-1-1,NA,980,980
すき家,兵庫県,すき家 312号和田山ＩＣ店,兵庫県朝来市和田山町枚田592-1,NA,1000,1000
すき家,岡山県,すき家 53号岡山ＩＣ店,岡山県岡山市北区津島京町1-3-18,NA,900,900
すき家,兵庫県,すき家 ＪＲ尼崎駅北口店,兵庫県尼崎市潮江1-3-43,NA,1000,1000
すき家,長崎県,すき家 みらい長崎ココウォーク店,長崎県長崎市茂里町1-55みらい長崎ｺｺｳｫｰｸ3F,NA,850,850
すき家,佐賀県,すき家 ゆめタウン佐賀店,佐賀県佐賀市兵庫北5-14-1ゆめﾀｳﾝ佐賀２F,NA,900,900
すき家,島根県,すき家 ゆめタウン出雲店,島根県出雲市大塚町650-1,NA,950,950
すき家,長野県,すき家 アリオ上田店,長野県上田市天神3-5-1ｱﾘｵ上田ﾌｰﾄﾞｺｰﾄ2F,NA,960,960
すき家,宮城県,すき家 イオンタウン佐沼店,宮城県登米市南方町新島前46-1,NA,860,860
すき家,埼玉県,すき家 イオンタウン上里店,埼玉県児玉郡上里町金久保蓮山359-1,NA,1000,1000
すき家,兵庫県,すき家 イオンタウン太子店,兵庫県揖保郡太子町東出262-1,NA,950,950
すき家,北海道,すき家 イオンモール旭川西店,北海道旭川市緑町23-2161-3,NA,850,850
すき家,香川県,すき家 イオンモール綾川店,香川県綾歌郡綾川町萱原822-1ｲｵﾝ綾川ｼｮｯﾋﾟﾝｸﾞセンター3F,NA,950,950
すき家,茨城県,すき家 イオンモール下妻店,茨城県下妻市堀篭972-1,NA,950,950
すき家,香川県,すき家 イオンモール高松店,香川県高松市香西本町1-1ｲｵﾝﾓｰﾙ高松3Fﾌ-ﾄﾞｺ-ﾄﾄﾞﾝﾅ,NA,900,900
すき家,秋田県,すき家 イオンモール秋田店,秋田県秋田市御所野地蔵田1-1-1,NA,900,900
すき家,新潟県,すき家 イオンモール新潟南店,新潟県新潟市江南区下早通柳田1-1-1,NA,900,900
すき家,岩手県,すき家 イオンモール盛岡南店,岩手県盛岡市本宮7-1-1,NA,900,900
すき家,群馬県,すき家 イオンモール太田店,群馬県太田市石原町81ｲｵﾝﾓ-ﾙ太田2F,NA,1000,1000
すき家,兵庫県,すき家 イオンモール猪名川店,兵庫県川辺郡猪名川町白金2-1,NA,950,950
すき家,岡山県,すき家 イオンモール津山店,岡山県津山市河辺1000-1,NA,900,900
すき家,千葉県,すき家 イオンモール津田沼店,千葉県習志野市津田沼1-23-1ﾌ-ﾄﾞｺ-ﾄ1F,NA,980,980
すき家,鳥取県,すき家 イオンモール日吉津店,鳥取県西伯郡日吉津村日吉津1160-1,NA,900,900
すき家,北海道,すき家 イオンモール発寒店,北海道札幌市西区発寒八条12-1-1,NA,820,820
すき家,静岡県,すき家 イオンモール浜松市野店,静岡県浜松市東区天王町字諏訪1981-3ｲｵﾝﾓｰﾙ浜松市野ｼｮｯﾋﾟﾝｸﾞｾﾝﾀｰ2F,NA,1300,1300
すき家,静岡県,すき家 イオンモール浜松志都呂店,静岡県浜松市西区志都呂2-37-1ｲｵﾝﾓ-ﾙ浜松志都呂3Ｆ,NA,980,980
すき家,千葉県,すき家 イオン千葉NT店,千葉県印西市中央北3-2,NA,1080,1080
すき家,沖縄県,すき家 イオン那覇店,沖縄県那覇市金城5-10-2ｲｵﾝ那覇1F,NA,850,850
すき家,東京都,すき家 イオン品川シーサイド店,東京都品川区東品川4-12-5ｲｵﾝ品川ｼｰｻｲﾄﾞ地下1Fﾌｰﾄﾞｺｰﾄ内,NA,1200,1200
すき家,福島県,すき家 イオン福島店,福島県福島市南矢野目西荒田50-17,NA,900,900
すき家,千葉県,すき家 イオン幕張店,千葉県千葉市美浜区ひび野1-3ｲｵﾝ幕張,NA,1000,1000
すき家,東京都,すき家 イトーヨーカドー国領店,東京都調布市国領町8-2-64ｲﾄ-ﾖ-ｶﾄﾞ-国領店1F,NA,1000,1000
すき家,東京都,すき家 ウィラ大井店,東京都品川区勝島1-6-16,NA,1200,1200
すき家,東京都,すき家 クロスガーデン多摩店,東京都多摩市落合2-33,NA,1000,1000
すき家,福島県,すき家 ザ・モール郡山店,福島県郡山市長者1-1-56,NA,870,870
すき家,群馬県,すき家 ジョイフル本田新田店,群馬県太田市新田市野井町592-13新田ｼｮｯﾋﾟﾝｸﾞｾﾝﾀｰﾆｺ･ﾓｰﾙ,NA,900,900
すき家,千葉県,すき家 ニッケコルトンプラザ店,千葉県市川市鬼高1-1-1,NA,1000,1000
すき家,宮城県,すき家 フォレオせんだい宮の杜店,宮城県仙台市宮城野区東仙台4-14-3,NA,900,900
すき家,滋賀県,すき家 フォレオ大津一里山店,滋賀県大津市一里山7-1-1,NA,930,930
すき家,東京都,すき家 フレスポ若葉台店,東京都稲城市若葉台2-1-1,NA,1000,1000
すき家,埼玉県,すき家 モラージュ菖蒲店,埼玉県久喜市菖蒲町菖蒲6005-1,NA,1200,1200
すき家,千葉県,すき家 モリシア津田沼店,千葉県習志野市谷津1-16-1ﾓﾘｼｱ津田沼1F,NA,1030,1030
すき家,東京都,すき家 モリタウン昭島店,東京都昭島市田中町562-1,NA,1000,1000
すき家,千葉県,すき家 ユニモちはら台店,千葉県市原市ちはら台西3-4ｼｮｯﾋﾟﾝｸﾞﾓ-ﾙﾕﾆﾓちはら台2Ｆ,NA,980,980
すき家,和歌山,すき家 ラウンドワン和歌山店,和歌山県和歌山市小雑賀739-3,NA,900,900
すき家,東京都,すき家 ワンザ有明店,東京都江東区有明3-6-11TFTﾋﾞﾙ東館2F,NA,1300,1300
すき家,大阪府,すき家 茨木ＩＣ店,大阪府茨木市郡4-11-36,NA,960,960
すき家,栃木県,すき家 宇都宮インターパーク店,栃木県宇都宮市ｲﾝﾀｰﾊﾟｰｸ6-5-2,NA,950,950
すき家,栃木県,すき家 宇都宮テクノポリス店,栃木県宇都宮市ゆいの杜5-8-9,NA,1000,1000
すき家,東京都,すき家 下丸子ガス橋通り店,東京都大田区下丸子3-28-7,NA,1100,1100
すき家,兵庫県,すき家 玉津ＩＣ南店,兵庫県神戸市西区小山3-13-13,NA,950,950
すき家,広島県,すき家 広島商工センター店,広島県広島市西区商工ｾﾝﾀｰ8-2-49,NA,1100,1100
すき家,山梨県,すき家 甲府アルプス通り店,山梨県中巨摩郡昭和町西条2707-1,NA,960,960
すき家,北海道,すき家 札幌ポールタウン店,北海道札幌市中央区南三条西3-10さっぽろ地下街ﾎﾟｰﾙﾀｳﾝ,NA,900,900
すき家,千葉県,すき家 四街道ＩＣ店,千葉県四街道市栗山812-6,NA,1000,1000
すき家,東京都,すき家 新宿ＮＳビル店,東京都新宿区西新宿2-4-1新宿NSﾋﾞﾙ1F,NA,1300,1300
すき家,静岡県,すき家 裾野二ツ屋店,静岡県裾野市二ツ屋155-1,NA,1000,1000
すき家,宮城県,すき家 仙台クリスロード店,宮城県仙台市青葉区中央2-2-29,NA,900,900
すき家,東京都,すき家 足立一ツ家店,東京都足立区一ツ家1-15-6,NA,980,980
すき家,東京都,すき家 竹ノ塚西店,東京都足立区栗原4-9-6荒堀ﾋﾞﾙ1F,NA,980,980
すき家,東京都,すき家 竹ノ塚店,東京都足立区西保木間1-17-20,NA,980,980
すき家,福岡県,すき家 博多ＢＰ店,福岡県福岡市東区原田3-9-22,NA,900,900
すき家,福島県,すき家 福島西ＢＰ店,福島県福島市東中央3-47-2,NA,900,900
すき家,兵庫県,すき家 明石大久保ＩＣ店,兵庫県明石市大久保町大窪字大澤2700-1,NA,950,950
