吉野家,千葉県,吉野家 浦安駅前店,千葉県浦安市北栄1丁目17‐16,1300,20230617,1150,150
吉野家,鹿児島,吉野家 鹿児島住吉店,鹿児島県鹿児島市住吉町10‐16,1000,20230617,950,50
吉野家,埼玉県,吉野家 和光笹目通り店,埼玉県和光市丸山台3丁目10‐6,1400,20230617,1200,200
松屋,広島県,松屋 奥屋PA（上り線）店,広島県東広島市志和町奥屋字春日山365,1000,20230617,950,50
松屋,愛知県,松屋 刈谷日高店,愛知県刈谷市日高町4丁目611,1200,20230617,1100,100
松屋,愛知県,松屋 三河安城店,愛知県安城市緑町2-9-2,1200,20230617,1100,100
松屋,広島県,松屋 東広島西条店,広島県東広島市西条町寺家4828-1,1000,20230617,980,20
松屋,愛知県,松屋 豊田十塚店,愛知県豊田市十塚町4-23-1,1200,20230617,1120,80
松屋,愛知県,松屋 豊田東新町店,愛知県豊田市東新町5-20-1,1100,20230617,1040,60
