吉野家,千葉県,吉野家 126号線東金堀上店,千葉県東金市堀上256,1150,20240413,1100,50
吉野家,千葉県,吉野家 128号線茂原高師店,千葉県茂原市高師1678‐11,1150,20240413,1100,50
吉野家,東京都,吉野家 14号線西小松川店,東京都江戸川区西小松川町37‐5,1250,20240413,1200,50
吉野家,千葉県,吉野家 14号線登戸店,千葉県千葉市中央区登戸2丁目3‐8,1200,20240413,1150,50
吉野家,愛知県,吉野家 153号線和合店,愛知県愛知郡東郷町和合牛廻間166‐1,1150,20240413,1100,50
吉野家,千葉県,吉野家 16号線五井店,千葉県市原市白金町4丁目8,1150,20240413,1100,50
吉野家,千葉県,吉野家 16号線八千代村上店,千葉県八千代市村上1608‐1,1150,20240413,1100,50
吉野家,千葉県,吉野家 16号線野田店,千葉県野田市船形2850‐1,1150,20240413,1100,50
吉野家,大分県,吉野家 197号線大分萩原店,大分県大分市牧2丁目1-7,1000,20240413,950,50
吉野家,千葉県,吉野家 296号線富里店,千葉県富里市七栄127‐7,1200,20240413,1150,50
吉野家,千葉県,吉野家 カインズホーム市原店,千葉県市原市更級3丁目1‐1,1150,20240413,1100,50
吉野家,千葉県,吉野家 カインズホーム木更津店,千葉県木更津市金田東3丁目1‐3,1150,20240413,1100,50
吉野家,千葉県,吉野家 プレナ幕張店,千葉県千葉市美浜区ひび野2丁目4,1300,20240413,1250,50
吉野家,千葉県,吉野家 ペリエ千葉店,千葉県千葉市中央区新千葉1丁目1‐1,1200,20240413,1150,50
吉野家,千葉県,吉野家 稲毛駅東口店,千葉県千葉市稲毛区小仲台2丁目7‐13,1200,20240413,1150,50
吉野家,千葉県,吉野家 鎌ヶ谷店,千葉県鎌ケ谷市道野辺本町1丁目2‐3,1150,20240413,1100,50
吉野家,京都府,吉野家 京都競馬場店,京都府京都市伏見区葭島渡場町32京都競馬場内1F,1020,20240413,1010,10
吉野家,千葉県,吉野家 古市場店,千葉県千葉市緑区古市場町624‐1,1150,20240413,1100,50
吉野家,東京都,吉野家 江戸川区役所前店,東京都江戸川区中央1丁目12‐8,1250,20240413,1200,50
吉野家,千葉県,吉野家 佐倉寺崎店,千葉県佐倉市寺崎北4丁目1‐5,1150,20240413,1100,50
吉野家,千葉県,吉野家 市川駅前店,千葉県市川市市川1丁目8‐2,1250,20240413,1200,50
吉野家,鹿児島,吉野家 鹿児島伊敷店,鹿児島県鹿児島市伊敷1-3-15,1000,20240413,950,50
吉野家,千葉県,吉野家 勝田台駅店,千葉県八千代市勝田台1-8-1 勝田台駅構内,1150,20240413,1100,50
吉野家,東京都,吉野家 小岩駅南口店,東京都江戸川区南小岩7丁目25‐1,1250,20240413,1200,50
吉野家,東京都,吉野家 小岩北口店,東京都江戸川区西小岩3丁目‐31‐10,1250,20240413,1200,50
吉野家,千葉県,吉野家 松戸八ヶ崎店,千葉県松戸市八ヶ崎13010,1150,20240413,1100,50
吉野家,東京都,吉野家 新小岩駅前店,東京都葛飾区新小岩1丁目43‐3,1250,20240413,1200,50
吉野家,東京都,吉野家 瑞江駅前店,東京都江戸川区東瑞江1丁目27‐4,1250,20240413,1200,50
吉野家,東京都,吉野家 西大島店,東京都江東区大島1丁目30‐9,1350,20240413,1300,50
吉野家,千葉県,吉野家 千葉さつきが丘店,千葉県千葉市花見川区犢橋町1102‐3,1150,20240413,1100,50
吉野家,千葉県,吉野家 千葉モノレール天台駅前店,千葉県千葉市稲毛区轟町5丁目5‐24,1200,20240413,1150,50
吉野家,東京都,吉野家 千葉街道南小岩店,東京都江戸川区南小岩8丁目2‐20,1250,20240413,1200,50
吉野家,千葉県,吉野家 千葉中央店,千葉県千葉市中央区富士見2丁目22‐15,1200,20240413,1150,50
吉野家,千葉県,吉野家 千葉末広街道店,千葉県千葉市中央区末広3丁目17‐1,1150,20240413,1100,50
吉野家,大阪府,吉野家 大日店,大阪府守口市大日町3丁目1‐13,1150,20240413,1130,20
吉野家,千葉県,吉野家 都営線本八幡店,千葉県市川市八幡2丁目16‐14,1250,20240413,1200,50
吉野家,千葉県,吉野家 都町店,千葉県千葉市中央区都町2丁目2‐5,1150,20240413,1100,50
吉野家,千葉県,吉野家 東我孫子店,千葉県我孫子市東我孫子2‐36‐25,1150,20240413,1100,50
吉野家,東京都,吉野家 東新小岩店,東京都葛飾区東新小岩3丁目13‐3,1250,20240413,1200,50
吉野家,千葉県,吉野家 八千代台西口店,千葉県八千代市八千代台西1丁目10,1150,20240413,1100,50
吉野家,千葉県,吉野家 八千代緑が丘店,千葉県八千代市緑が丘西1丁目13‐2,1150,20240413,1100,50
吉野家,東京都,吉野家 平井店,東京都江戸川区平井5丁目15‐7,1250,20240413,1200,50
吉野家,千葉県,吉野家 木更津駅前店,千葉県木更津市富士見1丁目1‐1,1150,20240413,1100,50
吉野家,千葉県,吉野家 木更津太田店,千葉県木更津市太田1‐3‐8,1150,20240413,1100,50
松屋,埼玉県,松屋 三郷戸ヶ崎店/松のや 三郷戸ヶ崎店,埼玉県三郷市戸ヶ崎3丁目586（地番）,1100,20240413,1050,50
