松屋,三重県,松のや 四日市芝田店/マイカリー食堂 四日市芝田店,三重県四日市市芝田1-11-3,1200,20240706,1100,100
すき家,茨城県,すき家 125号下妻店,茨城県下妻市下妻戊111-1,1100,20240706,1000,100
すき家,埼玉県,すき家 125号久喜栗橋店,埼玉県久喜市栗橋1301-3,1150,20240706,1080,70
すき家,神奈川,すき家 1国横浜久保店,神奈川県横浜市西区久保町1-32,1200,20240706,1140,60
すき家,神奈川,すき家 1国茅ヶ崎十間坂店,神奈川県茅ヶ崎市十間坂3-2-2,1150,20240706,1130,20
すき家,神奈川,すき家 1国鶴見下末吉店,神奈川県横浜市鶴見区下末吉4-4-18コーポ鶴石1F,1250,20240706,1200,50
すき家,神奈川,すき家 1国藤沢辻堂店,神奈川県藤沢市辻堂神台2-8-17,1200,20240706,1150,50
すき家,兵庫県,すき家 28号南あわじ店,兵庫県南あわじ市市福永字大道ノ上695-4の一部、695-1,1350,20240706,,1350
すき家,栃木県,すき家 294号真岡東光寺店,栃木県真岡市東光寺1-25-10,1080,20240706,1030,50
すき家,栃木県,すき家 294号那須烏山店,栃木県那須烏山市城東21-1,1150,20240706,1050,100
すき家,神奈川,すき家 467号藤沢長後店,神奈川県藤沢市長後754-1,1160,20240706,1130,30
すき家,栃木県,すき家 50号岩舟静店,栃木県栃木市岩舟町静2167-1,1120,20240706,1050,70
すき家,栃木県,すき家 50号足利福富店,栃木県足利市福富町1107-1,1070,20240706,1050,20
すき家,新潟県,すき家 7号村上店,新潟県村上市村上字牛沢22-1,1200,20240706,1000,200
すき家,神奈川,すき家 こどもの国店,神奈川県横浜市青葉区奈良5-4-13,1200,20240706,1140,60
すき家,埼玉県,すき家 さいたま与野本町店,埼玉県さいたま市中央区鈴谷9-10-4,1200,20240706,1100,100
すき家,埼玉県,すき家 さいたま領家店,埼玉県さいたま市浦和区領家4-14-5,1150,20240706,1100,50
すき家,神奈川,すき家 アクロスプラザ東神奈川店,神奈川県横浜市神奈川区西寺尾1-16-15,1250,20240706,1200,50
すき家,神奈川,すき家 ノクティプラザ店,神奈川県川崎市高津区溝口1-4-1ノクティプラザ21Fフードコート内,1280,20240706,1250,30
すき家,埼玉県,すき家 モラージュ菖蒲店,埼玉県久喜市菖蒲町菖蒲6005-1,1250,20240706,1220,30
すき家,神奈川,すき家 伊勢原桜台店,神奈川県伊勢原市桜台2-13-14,1130,20240706,1120,10
すき家,神奈川,すき家 横浜笠間店,神奈川県横浜市栄区笠間5-33-26,1200,20240706,1180,20
すき家,神奈川,すき家 横浜南幸二丁目店,神奈川県横浜市西区南幸2-9-16第8浅川ビル1F,1300,20240706,1200,100
すき家,神奈川,すき家 横浜日野中央店,神奈川県横浜市港南区日野中央2-42-1,1230,20240706,1160,70
すき家,神奈川,すき家 横浜平沼店,神奈川県横浜市西区平沼1-4-28横浜藤和ビル1F,1250,20240706,1140,110
すき家,神奈川,すき家 横浜北幸店,神奈川県横浜市西区北幸2-10-50北幸山田ビル1F,1300,20240706,1200,100
すき家,神奈川,すき家 下永谷店,神奈川県横浜市港南区下永谷5-1-15,1300,20240706,1250,50
すき家,神奈川,すき家 環状4号泉区和泉店,神奈川県横浜市泉区下和泉1-4-3,1160,20240706,1150,10
すき家,茨城県,すき家 境町上小橋店,茨城県猿島郡境町上小橋98-2,1120,20240706,1050,70
すき家,神奈川,すき家 戸塚駅西口店,神奈川県横浜市戸塚区戸塚町4080-1LEON-K1F,1200,20240706,1140,60
すき家,神奈川,すき家 戸塚上倉田店,神奈川県横浜市戸塚区上倉田町1465-1,1200,20240706,1160,40
すき家,神奈川,すき家 戸部駅前店,神奈川県横浜市西区戸部本町50-25ヴィラにしむら1F,1250,20240706,1140,110
すき家,神奈川,すき家 江田駅前店,神奈川県横浜市青葉区荏田町2364-1,1200,20240706,1140,60
すき家,栃木県,すき家 黒磯住吉店,栃木県那須塩原市住吉町77-12,1050,20240706,1000,50
すき家,栃木県,すき家 佐野大橋店,栃木県佐野市大橋町3239-1,1100,20240706,1050,50
すき家,栃木県,すき家 佐野鐙塚店,栃木県佐野市鐙塚町177-1,1100,20240706,1050,50
すき家,埼玉県,すき家 三郷上彦名店,埼玉県三郷市上彦名231-1,1150,20240706,1100,50
すき家,埼玉県,すき家 三郷中央駅前店,埼玉県三郷市中央3-48-5,1150,20240706,1100,50
すき家,千葉県,すき家 市原松ヶ島店,千葉県市原市松ヶ島2-18-1,1100,20240706,1080,20
すき家,神奈川,すき家 尻手駅前店,神奈川県川崎市幸区南幸町3-109-1,1250,20240706,1200,50
すき家,栃木県,すき家 真岡上高間木店,栃木県真岡市上高間木3-10-8,1100,20240706,1030,70
すき家,神奈川,すき家 秦野室川橋店,神奈川県秦野市曽屋5788-5,1130,20240706,1120,10
すき家,千葉県,すき家 成田取香店,千葉県成田市取香529-1,1350,20240706,1280,70
すき家,千葉県,すき家 成田東店,千葉県成田市寺台28-1,1250,20240706,1200,50
すき家,神奈川,すき家 川崎今井店,神奈川県川崎市中原区今井西町1-56,1280,20240706,1250,30
すき家,神奈川,すき家 川崎新川通り店,神奈川県川崎市川崎区渡田1-17-5石田ビル1F,1250,20240706,1220,30
すき家,栃木県,すき家 足利芳町店,栃木県足利市芳町57-1,1070,20240706,1050,20
すき家,栃木県,すき家 足利葉鹿店,栃木県足利市葉鹿町1-29-3,1070,20240706,1030,40
すき家,埼玉県,すき家 大宮桜木町店,埼玉県さいたま市大宮区桜木町2-362シンメイ桜木ビル1F,1200,20240706,1100,100
すき家,神奈川,すき家 大船駅前店,神奈川県鎌倉市大船1-5-9イトービル1F,1200,20240706,1160,40
すき家,神奈川,すき家 大和りんかんモール店,神奈川県大和市中央林間7丁目6-1,1250,20240706,1160,90
すき家,神奈川,すき家 中山駅南口店,神奈川県横浜市緑区台村町278-4石渡フラワーセンタービル1F,1200,20240706,1140,60
すき家,神奈川,すき家 中山店,神奈川県横浜市緑区中山6-9-12,1200,20240706,1140,60
すき家,神奈川,すき家 長津田みなみ台店,神奈川県横浜市緑区長津田みなみ台1-38-6,1200,20240706,1140,60
すき家,神奈川,すき家 辻堂店,神奈川県藤沢市辻堂東海岸1-2-1,1180,20240706,1160,20
すき家,神奈川,すき家 鶴屋町店,神奈川県横浜市神奈川区鶴屋町2-11-6,1300,20240706,1200,100
すき家,神奈川,すき家 鶴見市場駅前店,神奈川県横浜市鶴見区市場大和町8-8戸川ビル1F,1250,20240706,1200,50
すき家,神奈川,すき家 鶴見中央店,神奈川県横浜市鶴見区鶴見中央4-32-16,1350,20240706,1250,100
すき家,神奈川,すき家 鶴見豊岡町店,神奈川県横浜市鶴見区豊岡町40-20,1200,20240706,1160,40
すき家,神奈川,すき家 都筑ふれあいの丘店,神奈川県横浜市都筑区荏田南1-1,1300,20240706,1250,50
すき家,神奈川,すき家 東海大前店,神奈川県秦野市南矢名3-12-3,1130,20240706,1120,10
すき家,神奈川,すき家 藤が丘駅前店,神奈川県横浜市青葉区藤が丘2-5-1,1200,20240706,1140,60
すき家,栃木県,すき家 栃木BP箱森店,栃木県栃木市箱森町41-5,1100,20240706,1030,70
すき家,栃木県,すき家 栃木駅北店,栃木県栃木市境町10-4,1050,20240706,1000,50
すき家,神奈川,すき家 本牧店,神奈川県横浜市中区本牧町2-364,1200,20240706,1160,40
すき家,神奈川,すき家 立場店,神奈川県横浜市泉区中田西1-1-41,1180,20240706,1130,50
