吉野家,宮崎県,吉野家 10号線延岡店,宮崎県延岡市別府町3723‐1,1325,20240601,1000,325
吉野家,埼玉県,吉野家 122号線石神店,埼玉県川口市石神685‐1,1463,20240601,1150,313
吉野家,埼玉県,吉野家 122号線川口店,埼玉県川口市朝日1丁目8‐6,1463,20240601,1150,313
吉野家,埼玉県,吉野家 125号線栗橋店,埼玉県久喜市栗橋東5丁目10‐14,1463,20240601,1150,313
吉野家,埼玉県,吉野家 125号線行田桜町店,埼玉県行田市桜町1丁目23‐5,1575,20240601,1100,475
吉野家,神奈川,吉野家 134号線江ノ島店,神奈川県鎌倉市腰越3丁目4‐3,1525,20240601,1150,375
吉野家,静岡県,吉野家 136号線伊豆長岡店,静岡県伊豆の国市南條211‐4,1388,20240601,1050,338
吉野家,静岡県,吉野家 136号線函南店,静岡県田方郡函南町塚本142‐1,1150,20240601,1100,50
吉野家,静岡県,吉野家 139号富士伝法店,静岡県富士市伝法2379‐1,1150,20240601,1100,50
吉野家,埼玉県,吉野家 140号線花園インター店,埼玉県深谷市小前田476‐3,1600,20240601,1200,400
吉野家,東京都,吉野家 14号線西小松川店,東京都江戸川区西小松川町37‐5,1763,20240601,1250,513
吉野家,千葉県,吉野家 14号線幕張店,千葉県千葉市花見川区幕張町1丁目7780‐1,1600,20240601,1200,400
吉野家,愛知県,吉野家 155号線常滑店,愛知県常滑市虹の丘7丁目98,1200,20240601,1100,100
吉野家,愛知県,吉野家 155号線新舞子店,愛知県知多市新舞子大口206‐7,1450,20240601,1100,350
吉野家,神奈川,吉野家 16号線磯子丸山店,神奈川県横浜市磯子区丸山2丁目1‐3,1525,20240601,1200,325
吉野家,神奈川,吉野家 16号線金沢文庫店,神奈川県横浜市金沢区谷津町151,1538,20240601,1150,388
吉野家,千葉県,吉野家 16号線五井店,千葉県市原市白金町4丁目8,1463,20240601,1150,313
吉野家,神奈川,吉野家 16号線上鶴間店,神奈川県相模原市南区上鶴間本町9丁目2‐40,1575,20240601,1200,375
吉野家,神奈川,吉野家 16号線西谷店,神奈川県横浜市保土ケ谷区西谷町1097‐1,1500,20240601,1150,350
吉野家,埼玉県,吉野家 16号線東大宮店,埼玉県さいたま市見沼区深作3丁目4‐9,1438,20240601,1150,288
吉野家,埼玉県,吉野家 16号線入間扇町屋店,埼玉県入間市扇町屋5丁目4‐18,1375,20240601,1100,275
吉野家,大阪府,吉野家 170号線野崎店,大阪府大東市南津の辺町21‐38,1413,20240601,1130,283
吉野家,埼玉県,吉野家 17号線上尾店,埼玉県上尾市久保77‐1,1538,20240601,1150,388
吉野家,群馬県,吉野家 17号線前橋関根町店,群馬県前橋市関根町2丁目9‐45,1350,20240601,1020,330
吉野家,埼玉県,吉野家 17号線与野本町店,埼玉県さいたま市中央区本町西4丁目15‐12,1500,20240601,1200,300
吉野家,滋賀県,吉野家 1号線甲賀水口店,滋賀県甲賀市水口町名坂818,1375,20240601,1100,275
吉野家,愛知県,吉野家 1号線十番町店,愛知県名古屋市中川区十番町2丁目9,1450,20240601,1100,350
吉野家,静岡県,吉野家 1号線西沢田店,静岡県沼津市西沢田279‐1,1450,20240601,1100,350
吉野家,神奈川,吉野家 1号線川崎遠藤町店,神奈川県川崎市幸区戸手2丁目‐1,1625,20240601,1200,425
吉野家,大阪府,吉野家 1号線枚方店,大阪府枚方市宮之阪4丁目28‐39,1375,20240601,1100,275
吉野家,佐賀県,吉野家 208号線佐賀大学前店,佐賀県佐賀市本庄町大字本庄字五本杉577‐1,1250,20240601,1000,250
吉野家,岐阜県,吉野家 21号線鵜沼店,岐阜県各務原市鵜沼西町1丁目648,1325,20240601,1000,325
吉野家,岐阜県,吉野家 21号線各務原店,岐阜県各務原市鵜沼三ツ池町2丁目151,1325,20240601,1000,325
吉野家,岐阜県,吉野家 21号線大垣北店,岐阜県大垣市八島町83,1325,20240601,1000,325
吉野家,北海道,吉野家 231号線篠路店,北海道札幌市北区篠路2条1丁目2‐8,1363,20240601,1030,333
吉野家,三重県,吉野家 23号線伊勢店,三重県伊勢市御薗町長屋2127,1450,20240601,1100,350
吉野家,神奈川,吉野家 246号線荏田店,神奈川県横浜市青葉区荏田町420‐3,1625,20240601,1200,425
吉野家,神奈川,吉野家 246号線厚木妻田店,神奈川県厚木市妻田東3丁目1‐1,1587,20240601,1120,467
吉野家,神奈川,吉野家 246号線座間店,神奈川県座間市西栗原2丁目7‐8,1487,20240601,1120,367
吉野家,神奈川,吉野家 246号線秦野店,神奈川県秦野市曽屋1336,1413,20240601,1130,283
吉野家,奈良県,吉野家 25号線斑鳩店,奈良県生駒郡斑鳩町幸前2丁目309‐3,1275,20240601,1020,255
吉野家,大阪府,吉野家 26号線岸和田八阪店,大阪府岸和田市八阪町1丁目7‐13,1475,20240601,1100,375
吉野家,福井県,吉野家 27号線敦賀店,福井県敦賀市古田刈12‐1‐1,1450,20240601,1100,350
吉野家,茨城県,吉野家 294号線下館店,茨城県筑西市西谷貝330,1388,20240601,1050,338
吉野家,千葉県,吉野家 296号線富里店,千葉県富里市七栄127‐7,1600,20240601,1200,400
吉野家,大阪府,吉野家 309号線三宅店,大阪府松原市三宅中1丁目269‐2,1375,20240601,1100,275
吉野家,高知県,吉野家 32号線高知高須東店,高知県高知市高須東町1‐3,1300,20240601,980,320
吉野家,沖縄県,吉野家 330号線壺川店,沖縄県那覇市壺川2丁目1‐6,1325,20240601,1000,325
吉野家,神奈川,吉野家 412号線厚木林店,神奈川県厚木市林4丁目20‐30,1587,20240601,1120,467
吉野家,富山県,吉野家 41号線富山田中町店,富山県富山市田中町5丁目4‐13,1450,20240601,1100,350
吉野家,埼玉県,吉野家 463号線南与野店,埼玉県さいたま市中央区鈴谷2丁目603‐2,1500,20240601,1200,300
吉野家,福島県,吉野家 4号線伊達店,福島県伊達市坂ノ上8‐1,1263,20240601,950,313
吉野家,埼玉県,吉野家 4号線越谷店,埼玉県越谷市谷中町1丁目134‐1,1525,20240601,1150,375
吉野家,埼玉県,吉野家 4号線春日部緑町店,埼玉県春日部市緑町6丁目15‐3,1463,20240601,1100,363
吉野家,埼玉県,吉野家 4号線杉戸高野台店,埼玉県幸手市上高野2070‐1,1463,20240601,1100,363
吉野家,宮城県,吉野家 4号線白石店,宮城県白石市福岡蔵本西町78,1263,20240601,950,313
吉野家,群馬県,吉野家 50号線BP太田店,群馬県太田市丸山町1277,1325,20240601,1000,325
吉野家,岡山県,吉野家 53号線国体町店,岡山県岡山市北区南方5丁目1‐2,1325,20240601,1000,325
吉野家,茨城県,吉野家 6号線石岡店,茨城県石岡市石岡3918‐2,1325,20240601,1000,325
吉野家,滋賀県,吉野家 8号線栗東店,滋賀県栗東市出庭542,1375,20240601,1100,275
吉野家,滋賀県,吉野家 8号線彦根店,滋賀県彦根市東沼波町138‐1,1313,20240601,1050,263
吉野家,石川県,吉野家 8号線福久町店,石川県金沢市福久町ホ15‐1,1450,20240601,1100,350
吉野家,京都府,吉野家 9号線亀岡千代川店,京都府亀岡市千代川町高野林西田7‐27,1375,20240601,1100,275
吉野家,新潟県,吉野家 CoCoLo新潟店,新潟県新潟市中央区花園一丁目1番1号,1250,20240601,1000,250
吉野家,大阪府,吉野家 JR西九条駅店,大阪府大阪市此花区西九条3丁目16,1438,20240601,1150,288
吉野家,大阪府,吉野家 お初天神店,大阪府大阪市北区曾根崎2丁目5‐20,1500,20240601,1200,300
吉野家,東京都,吉野家 お台場デックス店,東京都港区台場1丁目6‐1,1988,20240601,1350,638
吉野家,埼玉県,吉野家 さいたま東大宮店,埼玉県さいたま市見沼区東大宮3丁目3‐12,1638,20240601,1150,488
吉野家,茨城県,吉野家 つくば大境店,茨城県つくば市西大橋593‐10,1325,20240601,1000,325
吉野家,大阪府,吉野家 なんばCITY南館店,大阪府大阪市中央区難波5丁目1‐60,1600,20240601,1200,400
吉野家,栃木県,吉野家 アクロスプラザ足利店,栃木県足利市田中町95‐1,1325,20240601,1000,325
吉野家,岐阜県,吉野家 アスティ岐阜駅店,岐阜県岐阜市橋本町1丁目10‐1,1450,20240601,1100,350
吉野家,北海道,吉野家 イオン札幌桑園店,北海道札幌市中央区北8条西14丁目28 イオン札幌桑園1階フードコート,1363,20240601,1030,333
吉野家,千葉県,吉野家 カインズホーム千葉NT店,千葉県印西市泉野1丁目144‐6,1500,20240601,1200,300
吉野家,神奈川,吉野家 センター南駅店,神奈川県横浜市都筑区茅ヶ崎中央1‐1,1750,20240601,1300,450
吉野家,大阪府,吉野家 ヴィアあべのウォーク店,大阪府大阪市阿倍野区阿倍野筋1丁目6‐1,1700,20240601,1200,500
吉野家,神奈川,吉野家 綾瀬市役所南通り店,神奈川県綾瀬市深谷中4丁目6‐14,1462,20240601,1150,312
吉野家,神奈川,吉野家 伊勢佐木町店,神奈川県横浜市中区伊勢佐木町4丁目109,1562,20240601,1200,362
吉野家,大阪府,吉野家 茨田店,大阪府大阪市鶴見区浜3丁目7‐107,1413,20240601,1130,283
吉野家,栃木県,吉野家 宇都宮細谷町店,栃木県宇都宮市細谷町326,1400,20240601,1060,340
吉野家,栃木県,吉野家 宇都宮城東店,栃木県宇都宮市城東1丁目10‐26,1400,20240601,1060,340
吉野家,栃木県,吉野家 宇都宮南店,栃木県宇都宮市西川田町936‐6,1400,20240601,1060,340
吉野家,東京都,吉野家 羽田空港第1ターミナルビル店,東京都大田区羽田空港3丁目3‐2,1688,20240601,1350,338
吉野家,東京都,吉野家 羽田空港第二ターミナルビル店,東京都大田区羽田空港3丁目4,1688,20240601,1350,338
吉野家,東京都,吉野家 曳舟店,東京都墨田区京島1丁目1‐1‐101,1625,20240601,1300,325
吉野家,埼玉県,吉野家 越谷駅高架下店,埼玉県越谷市弥生町4‐11,1538,20240601,1150,388
吉野家,神奈川,吉野家 横浜ジョイナス店,神奈川県横浜市西区南幸1‐5‐1,1750,20240601,1400,350
吉野家,神奈川,吉野家 横浜駅西口店,神奈川県横浜市西区南幸2丁目7‐15,1625,20240601,1300,325
吉野家,神奈川,吉野家 横浜駅東口店,神奈川県横浜市西区高島2‐14‐13,1625,20240601,1300,325
吉野家,岡山県,吉野家 岡山桃太郎通り店,岡山県岡山市北区本町2‐9,1450,20240601,1100,350
吉野家,東京都,吉野家 下高井戸駅店,東京都世田谷区松原3丁目29‐17,1563,20240601,1250,313
吉野家,埼玉県,吉野家 下笹目店,埼玉県戸田市笹目6丁目21‐4,1500,20240601,1150,350
吉野家,神奈川,吉野家 下鶴間店,神奈川県大和市鶴間1丁目27‐8,1500,20240601,1200,300
吉野家,神奈川,吉野家 茅ヶ崎円蔵店,神奈川県茅ヶ崎市円蔵1丁目24‐10,1400,20240601,1120,280
吉野家,神奈川,吉野家 環状2号線下永谷店,神奈川県横浜市港南区下永谷6丁目10‐20,1525,20240601,1150,375
吉野家,神奈川,吉野家 環状4号線下瀬谷店,神奈川県横浜市瀬谷区下瀬谷2丁目18‐17,1500,20240601,1150,350
吉野家,神奈川,吉野家 環状4号線霧が丘店,神奈川県横浜市緑区霧が丘2丁目2‐3,1625,20240601,1200,425
吉野家,東京都,吉野家 環状七号線鹿浜店,東京都足立区鹿浜3丁目2‐20,1500,20240601,1200,300
吉野家,神奈川,吉野家 関内店,神奈川県横浜市中区真砂町3丁目32,1500,20240601,1200,300
吉野家,大阪府,吉野家 関目店,大阪府大阪市城東区成育5丁目22‐11,1438,20240601,1150,288
吉野家,岐阜県,吉野家 岐阜羽島店,岐阜県羽島市竹鼻町丸の内1丁目1,1388,20240601,1050,338
吉野家,岐阜県,吉野家 岐阜長森店,岐阜県岐阜市石長町5丁目16‐1,1325,20240601,1000,325
吉野家,東京都,吉野家 亀戸駅前店,東京都江東区亀戸2丁目20‐7,1625,20240601,1300,325
吉野家,東京都,吉野家 菊川駅前店,東京都墨田区菊川2丁目6‐13,1825,20240601,1300,525
吉野家,埼玉県,吉野家 久喜店,埼玉県久喜市久喜本785‐1,1463,20240601,1150,313
吉野家,茨城県,吉野家 牛久南店,茨城県牛久市南6丁目4‐5,1325,20240601,1000,325
吉野家,三重県,吉野家 近鉄四日市店,三重県四日市市安島1丁目1‐20,1450,20240601,1100,350
吉野家,大阪府,吉野家 近鉄八尾駅前店,大阪府八尾市光町2丁目180‐1,1600,20240601,1120,480
吉野家,岐阜県,吉野家 郡上八幡店,岐阜県郡上市八幡町城南町221‐1,1450,20240601,1100,350
吉野家,大阪府,吉野家 恵美須町店,大阪府大阪市浪速区日本橋5丁目13‐9,1600,20240601,1200,400
吉野家,神奈川,吉野家 元住吉駅前店,神奈川県川崎市中原区木月2丁目3‐1,1562,20240601,1200,362
吉野家,東京都,吉野家 原宿竹下口店,東京都渋谷区神宮前1丁目17‐1,1750,20240601,1400,350
吉野家,愛知県,吉野家 古出来町店,愛知県名古屋市千種区北千種1丁目1‐1,1513,20240601,1150,363
吉野家,埼玉県,吉野家 戸田喜沢店,埼玉県戸田市喜沢1丁目23‐1,1463,20240601,1150,313
吉野家,埼玉県,吉野家 戸田新曽店,埼玉県戸田市新曽2097,1463,20240601,1150,313
吉野家,埼玉県,吉野家 戸田店,埼玉県戸田市下戸田2丁目11‐4,1463,20240601,1150,313
吉野家,東京都,吉野家 虎ノ門店,東京都港区虎ノ門1丁目1‐21,1688,20240601,1350,338
吉野家,東京都,吉野家 五日市街道並木町店,東京都国分寺市並木町2丁目23‐7,1588,20240601,1250,338
吉野家,東京都,吉野家 五反田駅前店,東京都品川区東五反田1丁目13‐7,1888,20240601,1350,538
吉野家,神奈川,吉野家 厚木街道東希望が丘店,神奈川県横浜市旭区東希望が丘42,1538,20240601,1150,388
吉野家,広島県,吉野家 広島吉島店,広島県広島市中区吉島西2丁目17‐28‐3,1450,20240601,1100,350
吉野家,神奈川,吉野家 港南台店,神奈川県横浜市港南区港南台2丁目24‐1,1587,20240601,1200,387
吉野家,神奈川,吉野家 港北ニュータウン店,神奈川県横浜市都筑区茅ヶ崎南2丁目11‐10,1613,20240601,1200,413
吉野家,神奈川,吉野家 溝の口店,神奈川県川崎市高津区溝口1丁目11‐23,1675,20240601,1300,375
吉野家,東京都,吉野家 甲州街道府中白糸台店,東京都府中市若松町1丁目25‐6,1563,20240601,1250,313
吉野家,茨城県,吉野家 荒川沖店,茨城県稲敷郡阿見町住吉2丁目24‐6,1325,20240601,1000,325
吉野家,千葉県,吉野家 行徳新浜店,千葉県市川市新浜1丁目2‐17,1713,20240601,1250,463
吉野家,香川県,吉野家 高松瓦町店,香川県高松市南新町8‐1,1500,20240601,1150,350
吉野家,愛知県,吉野家 国際センター店,愛知県名古屋市中村区那古野1丁目46‐12,1513,20240601,1150,363
吉野家,新潟県,吉野家 佐渡佐和田店,新潟県佐渡市長木767‐1,1275,20240601,960,315
吉野家,大阪府,吉野家 阪急茨木市駅前店,大阪府茨木市別院町3‐1,1413,20240601,1130,283
吉野家,大阪府,吉野家 堺石津川店,大阪府堺市西区浜寺石津町西2丁322‐1,1600,20240601,1120,480
吉野家,東京都,吉野家 笹塚京王クラウン街店,東京都渋谷区笹塚1‐55‐16,1625,20240601,1300,325
吉野家,北海道,吉野家 札幌狸小路店,北海道札幌市中央区南3条西4丁目12‐1,1450,20240601,1100,350
吉野家,北海道,吉野家 札幌伏古店,北海道札幌市東区伏古11条4丁目1‐5,1363,20240601,1030,333
吉野家,埼玉県,吉野家 三郷上彦名店,埼玉県三郷市上彦名417‐1,1463,20240601,1150,313
吉野家,広島県,吉野家 山陽道沼田PA下り店,広島県広島市安佐南区伴東町136‐1,1325,20240601,1000,325
吉野家,埼玉県,吉野家 産業道路さいたま上木崎店,埼玉県さいたま市浦和区上木崎4丁目12‐12,1500,20240601,1150,350
吉野家,神奈川,吉野家 子母口店,神奈川県川崎市高津区子母口521‐2,1575,20240601,1200,375
吉野家,千葉県,吉野家 市川駅前店,千葉県市川市市川1丁目8‐2,1763,20240601,1250,513
吉野家,千葉県,吉野家 市川鬼高店,千葉県市川市鬼高3丁目14‐11,1700,20240601,1200,500
吉野家,愛知県,吉野家 市役所通り蒲郡店,愛知県蒲郡市竹谷町松本22‐1,1450,20240601,1100,350
吉野家,東京都,吉野家 篠崎駅前店,東京都江戸川区篠崎町7丁目27‐1,1613,20240601,1250,363
吉野家,愛知県,吉野家 守山松川橋店,愛知県名古屋市守山区白沢町1,1450,20240601,1100,350
吉野家,大阪府,吉野家 十三店,大阪府大阪市淀川区十三本町1丁目8‐17,1438,20240601,1150,288
吉野家,埼玉県,吉野家 所沢駅前店,埼玉県所沢市日吉町11‐20,1538,20240601,1150,388
吉野家,新潟県,吉野家 女池上山店,新潟県新潟市中央区女池上山2丁目17‐6,1325,20240601,1000,325
吉野家,東京都,吉野家 小岩駅南口店,東京都江戸川区南小岩7丁目25‐1,1763,20240601,1250,513
吉野家,愛知県,吉野家 小牧岩崎店,愛知県小牧市岩崎5丁目195,1450,20240601,1100,350
吉野家,千葉県,吉野家 松戸みのり台店,千葉県松戸市稔台8丁目1‐6,1600,20240601,1200,400
吉野家,愛知県,吉野家 上社店,愛知県名古屋市名東区上社2丁目241,1513,20240601,1150,363
吉野家,神奈川,吉野家 上大岡店,神奈川県横浜市港南区上大岡西1丁目10‐9,1525,20240601,1200,325
吉野家,神奈川,吉野家 尻手店,神奈川県横浜市鶴見区尻手2丁目ー5ー1,1562,20240601,1200,362
吉野家,神奈川,吉野家 新横浜駅北口店,神奈川県横浜市港北区篠原町2937,1725,20240601,1300,425
吉野家,東京都,吉野家 新青梅街道島忠小平店,東京都東久留米市前沢5丁目33‐17,1588,20240601,1250,338
吉野家,東京都,吉野家 新富町店,東京都中央区新富1丁目17‐6,1925,20240601,1300,625
吉野家,愛知県,吉野家 甚目寺店,愛知県あま市下萱津五反田57,1513,20240601,1150,363
吉野家,神奈川,吉野家 瀬谷駅前店,神奈川県横浜市瀬谷区中央1‐4,1563,20240601,1150,413
吉野家,静岡県,吉野家 清水大坪店,静岡県静岡市清水区大坪1丁目9‐11,1388,20240601,1050,338
吉野家,東京都,吉野家 聖蹟桜ヶ丘店,東京都多摩市関戸2丁目41‐1,1500,20240601,1200,300
吉野家,東京都,吉野家 西葛西駅1番街店,東京都江戸川区西葛西6丁目14‐2,1687,20240601,1300,387
吉野家,東京都,吉野家 西大島店,東京都江東区大島1丁目30‐9,1888,20240601,1350,538
吉野家,大阪府,吉野家 西田辺店,大阪府大阪市阿倍野区西田辺町1丁目17‐1,1375,20240601,1100,275
吉野家,東京都,吉野家 西日暮里店,東京都荒川区西日暮里5丁目14‐11,1725,20240601,1300,425
吉野家,静岡県,吉野家 静岡SBS通り店,静岡県静岡市駿河区中田4丁目7‐21,1388,20240601,1050,338
吉野家,東京都,吉野家 赤坂三丁目店,東京都港区赤坂3丁目12‐11,1988,20240601,1350,638
吉野家,大阪府,吉野家 摂津鳥飼店,大阪府摂津市鳥飼上4丁目1‐38,1413,20240601,1130,283
吉野家,宮城県,吉野家 仙台駅西口店,宮城県仙台市青葉区中央1丁目7‐1,1263,20240601,950,313
吉野家,宮城県,吉野家 仙台岡田店,宮城県仙台市宮城野区岡田北高屋敷30‐1,1300,20240601,980,320
吉野家,宮城県,吉野家 仙台高砂店,宮城県仙台市宮城野区福室4丁目18‐22,1163,20240601,930,233
吉野家,宮城県,吉野家 仙台藤松店,宮城県仙台市青葉区藤松2丁目10,1300,20240601,930,370
吉野家,愛知県,吉野家 千音寺店,愛知県名古屋市中川区吉津1丁目1808,1513,20240601,1150,363
吉野家,大阪府,吉野家 千日前店,大阪府大阪市中央区難波千日前12‐41,1600,20240601,1200,400
吉野家,埼玉県,吉野家 川口芝店,埼玉県川口市芝3丁目19‐4,1550,20240601,1200,350
吉野家,埼玉県,吉野家 川口柳崎店,埼玉県川口市柳崎3丁目9‐2,1463,20240601,1150,313
吉野家,神奈川,吉野家 川崎西口店,神奈川県川崎市幸区中幸町4丁目51,1563,20240601,1250,313
吉野家,神奈川,吉野家 川崎追分店,神奈川県川崎市川崎区追分町2‐2,1563,20240601,1250,313
吉野家,神奈川,吉野家 川崎平店,神奈川県川崎市宮前区平2丁目‐4‐15,1625,20240601,1200,425
吉野家,福島県,吉野家 相馬店,福島県相馬市塚ノ町1丁目14‐7,1325,20240601,1000,325
吉野家,岡山県,吉野家 総社店,岡山県総社市中央5丁目10‐102,1450,20240601,1100,350
吉野家,埼玉県,吉野家 草加新栄店,埼玉県草加市新栄1丁目57‐10,1463,20240601,1150,313
吉野家,愛知県,吉野家 打越店,愛知県名古屋市千種区星ヶ丘2丁目80,1513,20240601,1150,363
吉野家,埼玉県,吉野家 大宮店,埼玉県さいたま市大宮区仲町1丁目97,1663,20240601,1250,413
吉野家,神奈川,吉野家 大船笠間口店,神奈川県鎌倉市大船1丁目6‐5,1500,20240601,1150,350
吉野家,栃木県,吉野家 大田原美原店,栃木県大田原市美原1丁目7‐25,1363,20240601,1030,333
吉野家,福岡県,吉野家 築港本町店,福岡県福岡市博多区神屋町9‐14,1575,20240601,1200,375
吉野家,大阪府,吉野家 中環松原丹南店,大阪府松原市丹南4丁目1‐4,1375,20240601,1100,275
吉野家,神奈川,吉野家 中原街道上白根店,神奈川県横浜市旭区上白根町729‐7,1625,20240601,1200,425
吉野家,東京都,吉野家 中野北口店,東京都中野区中野5丁目66‐3,1625,20240601,1300,325
吉野家,東京都,吉野家 町田根岸店,東京都町田市根岸町1019‐8,1625,20240601,1200,425
吉野家,東京都,吉野家 町田小川店,東京都町田市小川3丁目2‐1,1500,20240601,1200,300
吉野家,東京都,吉野家 調布駅前店,東京都調布市布田1丁目37‐16,1563,20240601,1250,313
吉野家,神奈川,吉野家 長津田店,神奈川県横浜市緑区長津田6丁目11‐24,1500,20240601,1200,300
吉野家,愛知県,吉野家 津島金柳店,愛知県津島市金柳町観音堂20,1450,20240601,1100,350
吉野家,神奈川,吉野家 鶴見駅西口店,神奈川県横浜市鶴見区豊岡町14‐28,1625,20240601,1200,425
吉野家,愛知県,吉野家 伝馬町店,愛知県名古屋市熱田区神宮2丁目6‐12,1450,20240601,1100,350
吉野家,東京都,吉野家 田町駅芝浦店,東京都港区芝浦3丁目15‐7,1988,20240601,1350,638
吉野家,東京都,吉野家 都立大学駅前店,東京都目黒区平町1丁目27‐2,1625,20240601,1300,325
吉野家,茨城県,吉野家 土浦真鍋店,茨城県土浦市真鍋2丁目1‐28,1325,20240601,1000,325
吉野家,埼玉県,吉野家 東浦和店,埼玉県さいたま市緑区東浦和8丁目1‐13,1538,20240601,1150,388
吉野家,東京都,吉野家 東久留米下里店,東京都東久留米市下里1丁目10‐4,1588,20240601,1250,338
吉野家,東京都,吉野家 東小金井駅前店,東京都小金井市梶野町5丁目2‐37,1563,20240601,1250,313
吉野家,埼玉県,吉野家 東松山新郷店,埼玉県東松山市新郷189‐2,1425,20240601,1100,325
吉野家,静岡県,吉野家 藤枝小石川店,静岡県藤枝市小石川町1丁目6‐19,1388,20240601,1050,338
吉野家,神奈川,吉野家 藤沢駅北口店,神奈川県藤沢市420‐3,1562,20240601,1200,362
吉野家,神奈川,吉野家 藤沢石川店,神奈川県藤沢市石川1丁目1‐18,1462,20240601,1150,312
吉野家,神奈川,吉野家 藤沢南口店,神奈川県藤沢市南藤沢20‐5,1524,20240601,1200,324
吉野家,山口県,吉野家 徳山駅前店,山口県周南市有楽町2,1450,20240601,1100,350
吉野家,奈良県,吉野家 奈良広陵町店,奈良県北葛城郡広陵町大塚905‐1,1475,20240601,1020,455
吉野家,埼玉県,吉野家 南越谷店,埼玉県越谷市南越谷1丁目23‐1,1538,20240601,1150,388
吉野家,神奈川,吉野家 日吉駅前店,神奈川県横浜市港北区日吉本町1丁目22‐10,1625,20240601,1200,425
吉野家,埼玉県,吉野家 八潮店,埼玉県八潮市上馬場476‐1,1525,20240601,1100,425
吉野家,大阪府,吉野家 八尾高安店,大阪府八尾市高安町北7丁目178‐6,1475,20240601,1100,375
吉野家,静岡県,吉野家 磐田二之宮店,静岡県磐田市二之宮東13‐3,1388,20240601,1050,338
吉野家,愛知県,吉野家 美合PA下り店,愛知県岡崎市市場町御成箇3‐41,1575,20240601,1200,375
吉野家,東京都,吉野家 品川駅港南口店,東京都港区港南2丁目2‐15,1950,20240601,1400,550
吉野家,静岡県,吉野家 浜松ディーラー通り店,静岡県浜松市中央区和田町779‐1,1450,20240601,1050,400
吉野家,静岡県,吉野家 浜松駅店,静岡県浜松市中央区砂山町322‐4,1450,20240601,1100,350
吉野家,静岡県,吉野家 浜松志都呂店,静岡県浜松市中央区志都呂1丁目32‐10,1450,20240601,1050,400
吉野家,静岡県,吉野家 浜松若林店,静岡県浜松市中央区若林町2744‐4,1450,20240601,1050,400
吉野家,東京都,吉野家 浜松町店,東京都港区浜松町2丁目7‐1,1888,20240601,1350,538
吉野家,富山県,吉野家 富山駅前店,富山県富山市桜町1‐4‐17,1388,20240601,1050,338
吉野家,富山県,吉野家 富山豊田町店,富山県富山市豊田町2‐123‐1,1450,20240601,1100,350
吉野家,東京都,吉野家 武蔵小金井駅前店,東京都小金井市本町2丁目5‐2,1563,20240601,1250,313
吉野家,東京都,吉野家 武蔵村山店,東京都武蔵村山市中原3丁目1‐2,1525,20240601,1200,325
吉野家,愛知県,吉野家 伏見通錦店,愛知県名古屋市中区錦2丁目9‐23,1638,20240601,1250,388
