すき家,徳島県,すき家 11号徳島川内店,徳島県徳島市川内町平石古田36-2,850,900,50
すき家,静岡県,すき家 135号下田店,静岡県下田市柿崎字間戸浜6-22,950,1000,50
すき家,静岡県,すき家 139号富士田島店,静岡県富士市田島142-1,920,950,30
すき家,山梨県,すき家 141号韮崎店,山梨県韮崎市藤井町北下條字枇杷塚1398-2,900,950,50
すき家,長野県,すき家 143号上田原店,長野県上田市大字上田原437-12,900,960,60
すき家,静岡県,すき家 150号牧之原店,静岡県牧之原市静波2161-1,920,950,30
すき家,長野県,すき家 152号茅野店,長野県茅野市本町東5291-1,900,950,50
すき家,長野県,すき家 153号伊那店,長野県伊那市大字伊那282-1,900,950,50
すき家,富山県,すき家 156号砺波店,富山県砺波市新又135-1,920,950,30
すき家,福井県,すき家 157号大野店,福井県大野市中挾2字足リ原8-19,900,950,50
すき家,富山県,すき家 160号氷見店,富山県氷見市窪851-1,920,950,30
すき家,大阪府,すき家 170号羽曳野西浦店,大阪府羽曳野市西浦3-2-1,883,920,37
すき家,山口県,すき家 188号光浅江店,山口県光市浅江1-11-7,900,950,50
すき家,長野県,すき家 18号上田材木店,長野県上田市材木町1-9-16,900,960,60
すき家,長野県,すき家 18号上田大屋店,長野県上田市大屋347-8,900,960,60
すき家,長野県,すき家 18号千曲店,長野県千曲市大字粟佐1379-1,880,960,80
すき家,徳島県,すき家 192号徳島国府店,徳島県徳島市国府町観音寺字大溝122-1,850,900,50
すき家,長野県,すき家 19号塩尻広丘店,長野県塩尻市広丘野村1503-1,900,950,50
すき家,長野県,すき家 19号松本村井店,長野県松本市村井町北2-8-45,920,950,30
すき家,長野県,すき家 19号長野中御所店,長野県長野市中御所4-3-4,910,960,50
すき家,静岡県,すき家 1国沼津共栄店,静岡県沼津市共栄町19-4,920,950,30
すき家,静岡県,すき家 1国清水渋川店,静岡県静岡市清水区渋川477-4,920,950,30
すき家,静岡県,すき家 1国静岡馬渕店,静岡県静岡市駿河区馬渕1-17-38,920,950,30
すき家,静岡県,すき家 1国島田店,静岡県島田市中河町8992-2,930,1000,70
すき家,静岡県,すき家 1国藤枝水守店,静岡県藤枝市水守370-10,920,950,30
すき家,静岡県,すき家 1国磐田一言店,静岡県磐田市一言2626-1,920,950,30
すき家,静岡県,すき家 1国浜松卸本町店,静岡県浜松市南区卸本町103-1,950,980,30
すき家,静岡県,すき家 1国富士鮫島店,静岡県富士市鮫島360-1,920,950,30
すき家,福岡県,すき家 202号糸島前原店,福岡県糸島市前原東1-6-13,800,850,50
すき家,福岡県,すき家 202号福岡周船寺店,福岡県福岡市西区周船寺1-13-8,800,850,50
すき家,福岡県,すき家 263号福岡野芥店,福岡県福岡市早良区野芥4-45-5,800,850,50
すき家,福井県,すき家 27号小浜店,福井県小浜市遠敷24-26-1,950,1000,50
すき家,兵庫県,すき家 29号宍粟店,兵庫県宍粟市山崎町今宿字中筋98-14,880,950,70
すき家,兵庫県,すき家 2国姫路市川橋店,兵庫県姫路市市川橋通1-9,930,950,20
すき家,大阪府,すき家 309号堺黒山店,大阪府堺市美原区黒山168-1,900,920,20
すき家,兵庫県,すき家 312号姫路砥堀店,兵庫県姫路市砥堀350-2,930,950,20
すき家,富山県,すき家 359号婦中店,富山県富山市婦中町下轡田444-1,950,980,30
すき家,静岡県,すき家 414号沼津三枚橋店,静岡県沼津市三枚橋町10-1,920,1000,80
すき家,石川県,すき家 415号羽咋店,石川県羽咋市石野町イ54-1,950,1000,50
すき家,富山県,すき家 41号大沢野店,富山県富山市上大久保1052-1,950,980,30
すき家,愛知県,すき家 41号豊山店,愛知県西春日井郡豊山町青山字江川73-1,950,960,10
すき家,岡山県,すき家 430号倉敷児島店,岡山県倉敷市児島小川町3682-5,880,900,20
すき家,岡山県,すき家 430号倉敷水島店,岡山県倉敷市東塚1-16-29,880,930,50
すき家,青森県,すき家 45号八戸類家店,青森県八戸市類家5-11-5,800,850,50
すき家,富山県,すき家 472号射水店,富山県射水市下条新1482-1,920,950,30
すき家,静岡県,すき家 52号清水興津店,静岡県静岡市清水区興津中町字金山下1371-1,920,950,30
すき家,富山県,すき家 8号滑川店,富山県滑川市柳原253-1,950,980,30
すき家,石川県,すき家 8号金沢福久店,石川県金沢市福久東1-37,900,950,50
すき家,富山県,すき家 8号高岡北島店,富山県高岡市北島婦計459-2,920,950,30
すき家,福井県,すき家 8号坂井丸岡店,福井県坂井市丸岡町朝陽2-102-1,900,950,50
すき家,新潟県,すき家 8号上越下荒浜店,新潟県上越市大字下荒浜字大谷内横田346-1,900,920,20
すき家,長野県,すき家 ｱﾘｵ上田店,長野県上田市天神3-5-1アリオ上田フードコート2F,900,960,60
すき家,秋田県,すき家 ｲｵﾝﾓｰﾙ秋田店,秋田県秋田市御所野地蔵田1-1-1,860,900,40
すき家,静岡県,すき家 ｲｵﾝﾓｰﾙ浜松市野店,静岡県浜松市東区天王町字諏訪1981-3イオンモール&nbsp;浜松市野ショッピングセンター2F,950,1050,100
すき家,静岡県,すき家 ｲｵﾝﾓｰﾙ浜松志都呂店,静岡県浜松市西区志都呂2-37-1イオンモ-ル浜松志都呂3F,950,980,30
すき家,大阪府,すき家 はびきの伊賀店,大阪府羽曳野市伊賀4-5-6,900,920,20
すき家,青森県,すき家 むつ中央店,青森県むつ市中央2-9-1,820,900,80
すき家,愛知県,すき家 愛知学院大学前店,愛知県長久手市長配2-601,920,950,30
すき家,千葉県,すき家 浦安駅前店,千葉県浦安市猫実4-18-26&nbsp;浦安サンライズビル1F,980,1010,30
すき家,福井県,すき家 越前押田店,福井県越前市押田2-1-1,880,950,70
すき家,長野県,すき家 塩尻志学館高校前店,長野県塩尻市広丘高出1486-230,900,950,50
すき家,東京都,すき家 葛飾南水元店,東京都葛飾区南水元2-30-5,980,1060,80
すき家,富山県,すき家 魚津本江店,富山県魚津市本江字雲雀作2555-1,950,980,30
すき家,石川県,すき家 金沢駅西店,石川県金沢市駅西本町6-3-7,900,950,50
すき家,石川県,すき家 金沢高柳店,石川県金沢市高柳町3-9-1,900,950,50
すき家,石川県,すき家 金沢寺地店,石川県金沢市寺地1-32-28,900,950,50
すき家,石川県,すき家 金沢畝田店,石川県金沢市畝田中3-561,900,950,50
すき家,石川県,すき家 金沢増泉店,石川県金沢市増泉4-3-2,900,950,50
すき家,石川県,すき家 金沢大桑店,石川県金沢市大桑第三土地区画整理事業施工地内16-2街区8,900,950,50
すき家,静岡県,すき家 御殿場店,静岡県御殿場市萩原809-2,1030,1200,170
すき家,富山県,すき家 高岡熊野店,富山県高岡市熊野町5-30,920,950,30
すき家,富山県,すき家 高岡中曽根店,富山県高岡市中曽根290-3,920,950,30
すき家,富山県,すき家 高岡南店,富山県高岡市駅南5-5-5,920,950,30
すき家,高知県,すき家 高知中万々店,高知県高知市中万々字目賀計27-1,780,830,50
すき家,青森県,すき家 三沢緑町店,青森県三沢市緑町3-8-15,820,850,30
すき家,静岡県,すき家 三島徳倉店,静岡県三島市徳倉910-2,930,1000,70
すき家,兵庫県,すき家 三木志染店,兵庫県三木市志染町広野1-263-1,950,1000,50
すき家,兵庫県,すき家 三木本町店,兵庫県三木市本町1-6-30,950,1000,50
すき家,愛知県,すき家 守山店,愛知県名古屋市守山区瀬古東2-1104,920,980,60
すき家,青森県,すき家 十和田元町店,青森県十和田市元町東1-2-19,820,850,30
すき家,愛知県,すき家 春日井高蔵寺店,愛知県春日井市高蔵寺町北1-197,900,950,50
すき家,福岡県,すき家 春日白水店,福岡県春日市白水ヶ丘4-61,800,850,50
すき家,新潟県,すき家 小千谷店,新潟県小千谷市千谷川4-10-3,900,920,20
すき家,愛知県,すき家 小牧春日寺店,愛知県小牧市春日寺2-329,920,980,60
すき家,大阪府,すき家 松原阿保店,大阪府松原市阿保6-871-1,900,920,20
すき家,大阪府,すき家 松原南新町店,大阪府松原市南新町4-107-17,900,920,20
すき家,長野県,すき家 松本出川店,長野県松本市出川3-6-10,920,950,30
すき家,長野県,すき家 松本中央店,長野県松本市高宮東1-25,920,950,30
すき家,静岡県,すき家 沼津原町中店,静岡県沼津市原町中3-13-10,920,950,30
すき家,静岡県,すき家 沼津小諏訪店,静岡県沼津市小諏訪574-8,920,950,30
すき家,静岡県,すき家 焼津小川店,静岡県焼津市東小川8-11-12,930,950,20
すき家,静岡県,すき家 焼津店,静岡県焼津市八楠3-19-1,930,950,20
すき家,新潟県,すき家 上越高土店,新潟県上越市高土町1-1-4,900,920,20
すき家,長野県,すき家 上田店,長野県上田市大字秋和字立石344-4,900,960,60
すき家,北海道,すき家 深川店,北海道深川市三条18-25,800,850,50
すき家,長野県,すき家 須坂墨坂店,長野県須坂市墨坂4-2-20,900,960,60
すき家,静岡県,すき家 裾野二ﾂ屋店,静岡県裾野市二ツ屋155-1,970,1000,30
すき家,愛知県,すき家 瀬戸店,愛知県瀬戸市高根町1-68,920,950,30
すき家,静岡県,すき家 清水IC店,静岡県静岡市清水区八坂東2-16-21,920,950,30
すき家,静岡県,すき家 清水鳥坂店,静岡県静岡市清水区鳥坂字山鼻1231-1,920,950,30
すき家,東京都,すき家 西五反田一丁目店,東京都品川区西五反田1-24-4&nbsp;タキゲンビル1F,1100,1200,100
すき家,兵庫県,すき家 西脇野村店,兵庫県西脇市野村町1795-192,950,1000,50
すき家,静岡県,すき家 静岡IC店,静岡県静岡市駿河区中野新田字橋下57-93,920,1000,80
すき家,静岡県,すき家 静岡下川原店,静岡県静岡市駿河区下川原3-34-7,920,1000,80
すき家,静岡県,すき家 静岡国吉田店,静岡県静岡市駿河区国吉田4-2-20,920,1000,80
すき家,静岡県,すき家 静岡松富店,静岡県静岡市葵区松富2-1-51,920,1000,80
すき家,静岡県,すき家 静岡八幡店,静岡県静岡市駿河区八幡2-14-16,920,950,30
すき家,岡山県,すき家 倉敷下庄店,岡山県倉敷市下庄619-5,880,900,20
すき家,兵庫県,すき家 相生垣内店,兵庫県相生市垣内町1310-7,900,950,50
すき家,東京都,すき家 足立六木店,東京都足立区六木2-7-8,980,1060,80
すき家,福岡県,すき家 太宰府向佐野店,福岡県太宰府市向佐野3-3-35,820,850,30
すき家,福岡県,すき家 筑紫野永岡店,福岡県筑紫野市大字永岡169-1,820,850,30
すき家,愛知県,すき家 中村烏森店,愛知県名古屋市中村区烏森町6-195,960,1000,40
すき家,静岡県,すき家 長泉下土狩店,静岡県駿東郡長泉町下土狩429-1-1,930,950,20
すき家,長野県,すき家 長野SBC通り店,長野県長野市上松1-16-41,910,960,50
すき家,長野県,すき家 長野中央店,長野県長野市鶴賀(七瀬南部)320-1,910,960,50
すき家,東京都,すき家 東五反田店,東京都品川区東五反田3-20-17佐藤ビル1F,1100,1200,100
すき家,静岡県,すき家 藤枝田沼店,静岡県藤枝市田沼4-7-10,920,950,30
すき家,徳島県,すき家 徳島住吉店,徳島県徳島市住吉4-41,850,900,50
すき家,徳島県,すき家 徳島大原店,徳島県徳島市大原町千代ケ丸山5-1,850,900,50
すき家,福井県,すき家 敦賀木崎店,福井県敦賀市木崎19号白丸14-1,950,1000,50
すき家,福岡県,すき家 博多駅前四丁目店,福岡県福岡市博多区博多駅前4-3-22産恵ビル1F,880,900,20
すき家,新潟県,すき家 柏崎店,新潟県柏崎市穂波町8-17,900,960,60
すき家,青森県,すき家 八戸南店,青森県八戸市根城3-4-5,800,850,50
すき家,青森県,すき家 八戸北店,青森県八戸市城下4-14-14,800,850,50
すき家,長野県,すき家 飯田店,長野県飯田市座光寺4705-1,910,950,40
すき家,静岡県,すき家 磐田二之宮店,静岡県磐田市二之宮332-1,920,950,30
すき家,兵庫県,すき家 姫路継店,兵庫県姫路市継205-1,930,950,20
すき家,兵庫県,すき家 姫路広畑店,兵庫県姫路市広畑区吾妻町3-21,930,950,20
すき家,兵庫県,すき家 姫路中地店,兵庫県姫路市飾磨区構2-112,930,950,20
すき家,兵庫県,すき家 姫路南条店,兵庫県姫路市南条字宅地191-1,930,950,20
すき家,静岡県,すき家 浜松駅南口店,静岡県浜松市中区砂山町324-8第一伊藤ビル1F,950,980,30
すき家,静岡県,すき家 浜松三方原店,静岡県浜松市北区三方原町795-5,950,980,30
すき家,静岡県,すき家 浜松志都呂店,静岡県浜松市西区志都呂町2-20-24,950,980,30
すき家,静岡県,すき家 浜松住吉店,静岡県浜松市中区住吉3-11-20,950,980,30
すき家,静岡県,すき家 浜松神立店,静岡県浜松市東区神立町136-15,950,980,30
すき家,静岡県,すき家 浜松西IC店,静岡県浜松市西区湖東町東名南5926-2,950,980,30
すき家,静岡県,すき家 浜松鍛冶町店,静岡県浜松市中区鍛冶町320-19有楽ビル1F,950,980,30
すき家,静岡県,すき家 浜松頭陀寺店,静岡県浜松市南区頭陀寺町332-19,950,980,30
すき家,静岡県,すき家 浜北美薗店,静岡県浜松市浜北区西美薗2519-2,950,980,30
すき家,富山県,すき家 富山掛尾店,富山県富山市掛尾町401-3,950,980,30
すき家,富山県,すき家 富山五福店,富山県富山市五福字中割2325-3,950,980,30
すき家,富山県,すき家 富山呉羽店,富山県富山市本郷東部9-1,950,980,30
すき家,富山県,すき家 富山新屋店,富山県富山市飯野8-5,950,980,30
すき家,富山県,すき家 富山中川原店,富山県富山市秋吉182-1,950,980,30
すき家,富山県,すき家 富山豊田店,富山県富山市豊田2-70-4,950,980,30
すき家,静岡県,すき家 富士厚原店,静岡県富士市厚原99-5,920,950,30
すき家,静岡県,すき家 富士今泉店,静岡県富士市今泉1-70-4,920,1000,80
すき家,福井県,すき家 福井日光店,福井県福井市日光2-27-13,880,950,70
すき家,福岡県,すき家 福岡渡辺通五丁目店,福岡県福岡市中央区渡辺通5-2-27,880,900,20
すき家,福岡県,すき家 福岡博多駅南店,福岡県福岡市博多区博多駅南5-22-16,880,900,20
すき家,福岡県,すき家 福岡舞鶴店,福岡県福岡市中央区舞鶴1-2-12,880,900,20
すき家,福岡県,すき家 福岡片江店,福岡県福岡市城南区片江1-24-22,800,850,50
すき家,福岡県,すき家 福岡和白店,福岡県福岡市東区和白1-1-21,800,850,50
すき家,兵庫県,すき家 福崎店,兵庫県神崎郡福崎町南田原字ハツグロ2970-1,930,950,20
すき家,神奈川,すき家 平塚上平塚店,神奈川県平塚市上平塚1-54,980,1000,20
すき家,神奈川,すき家 平塚店,神奈川県平塚市平塚1-9-26,950,1000,50
すき家,神奈川,すき家 平塚豊田店,神奈川県平塚市豊田本郷1740-1,980,1000,20
すき家,山口県,すき家 防府新田店,山口県防府市大字新田573-1,900,950,50
すき家,山口県,すき家 防府天神店,山口県防府市天神2-3-36,900,950,50
すき家,長野県,すき家 箕輪BP店,長野県上伊那郡箕輪町中箕輪11338-1,920,950,30
すき家,愛知県,すき家 名古屋栄生店,愛知県名古屋市西区栄生1-34-17,960,1000,40
すき家,東京都,すき家 目黒駅東口店,東京都品川区上大崎2-15-21,1100,1200,100
すき家,石川県,すき家 野々市新庄店,石川県野々市市新庄3-253,900,950,50
すき家,富山県,すき家 立山利田店,富山県中新川郡立山町利田629-1,950,980,30
すき家,兵庫県,すき家 龍野店,兵庫県たつの市龍野町富永383-1,900,950,50
