すき家,大阪府,すき家 26号岸和田下池田店,大阪府岸和田市下池田町1-2-3,1100,20230930,1050,50
すき家,大阪府,すき家 26号高石店,大阪府高石市西取石7-11-1,1100,20230930,1050,50
すき家,大阪府,すき家 26号堺山本店,大阪府堺市堺区山本町3-78,1100,20230930,1050,50
すき家,大阪府,すき家 26号西住之江店,大阪府大阪市住之江区西住之江1-9-21,1100,20230930,1050,50
すき家,大阪府,すき家 26号泉佐野鶴原店,大阪府泉佐野市鶴原1855-3,1100,20230930,1050,50
すき家,大阪府,すき家 26号泉大津店,大阪府泉大津市北豊中町2-17-24,1100,20230930,1050,50
すき家,岩手県,すき家 283号遠野店,岩手県遠野市早瀬町4-7-36,970,20230930,950,20
すき家,福島県,すき家 288号田村店,福島県田村市船引町船引字舘柄前89-1,980,20230930,950,30
すき家,長野県,すき家 292号中野店,長野県中野市一本木319-3,1030,20230930,1000,30
すき家,石川県,すき家 305号小松今江店,石川県小松市今江町3-700,1050,20230930,1030,20
すき家,大阪府,すき家 307号枚方津田西店,大阪府枚方市津田西町1-2-1,1100,20230930,1050,50
すき家,大阪府,すき家 309号堺黒山店,大阪府堺市美原区黒山168-1,1100,20230930,1050,50
すき家,大阪府,すき家 310号堺大野芝店,大阪府堺市中区大野芝町209-1,1100,20230930,1050,50
すき家,大阪府,すき家 310号大阪狭山店,大阪府大阪狭山市東茱萸木1-691-1,1100,20230930,1050,50
すき家,群馬県,すき家 354号邑楽店,群馬県邑楽郡邑楽町狸塚字高原357-1,1050,20230930,1000,50
すき家,北海道,すき家 36号清田里塚店,北海道札幌市清田区里塚一条3-2-10,1020,20230930,1000,20
すき家,北海道,すき家 36号苫小牧日吉店,北海道苫小牧市日吉町1-1-5,1020,20230930,960,60
すき家,北海道,すき家 36号苫小牧明野店,北海道苫小牧市明野新町2-1-4,1020,20230930,1000,20
すき家,秋田県,すき家 398号湯沢沖鶴店,秋田県湯沢市沖鶴234-1,950,20230930,900,50
すき家,北海道,すき家 39号北見三輪店,北海道北見市東三輪2-831-4,1020,20230930,1000,20
すき家,北海道,すき家 39号北見大町店,北海道北見市大町21-1,1000,20230930,980,20
すき家,北海道,すき家 39号網走新町店,北海道網走市新町2-3-5,1050,20230930,1000,50
すき家,新潟県,すき家 403号加茂店,新潟県加茂市番田5-20,1000,20230930,950,50
すき家,北海道,すき家 40号稚内大黒店,北海道稚内市大黒2-6-24,1300,20230930,1150,150
すき家,北海道,すき家 40号名寄店,北海道名寄市西四条南10-56-1,1000,20230930,960,40
すき家,神奈川,すき家 412号厚木中荻野店,神奈川県厚木市中荻野580-1,1120,20230930,1090,30
すき家,神奈川,すき家 412号厚木林店,神奈川県厚木市林4-12-34,1130,20230930,1090,40
すき家,神奈川,すき家 413号津久井三ケ木店,神奈川県相模原市緑区三ケ木405-1,1130,20230930,1090,40
すき家,静岡県,すき家 414号沼津三枚橋店,静岡県沼津市三枚橋町10-1,1080,20230930,1030,50
すき家,富山県,すき家 41号大沢野店,富山県富山市上大久保1052-1,1080,20230930,1030,50
すき家,和歌山,すき家 42号新宮神倉店,和歌山県新宮市神倉3-1291-1,1100,20230930,1050,50
すき家,北海道,すき家 44号根室店,北海道根室市西浜町8-92-1,1020,20230930,1000,20
すき家,青森県,すき家 45号おいらせ店,青森県上北郡おいらせ町菜飯52-4,980,20230930,950,30
すき家,青森県,すき家 45号八戸城下店,青森県八戸市城下4-14-14,950,20230930,920,30
すき家,青森県,すき家 45号八戸類家店,青森県八戸市類家5-11-5,940,20230930,920,20
すき家,栃木県,すき家 461号大田原美原店,栃木県大田原市美原1-1-6,1000,20230930,980,20
すき家,神奈川,すき家 467号藤沢長後店,神奈川県藤沢市長後754-1,1130,20230930,1100,30
すき家,宮城県,すき家 48号仙台折立店,宮城県仙台市青葉区折立1-21-20,1000,20230930,980,20
すき家,新潟県,すき家 49号阿賀野水原店,新潟県阿賀野市庄ヶ宮679-1,1000,20230930,950,50
すき家,埼玉県,すき家 4号越谷大間野店,埼玉県越谷市大間野町2-207-4,1100,20230930,1050,50
すき家,宮城県,すき家 4号柴田店,宮城県柴田郡柴田町西船迫1-1-55,980,20230930,950,30
すき家,埼玉県,すき家 4号春日部備後店,埼玉県春日部市備後東5-11-17,1100,20230930,1050,50
すき家,埼玉県,すき家 4号杉戸堤根店,埼玉県北葛飾郡杉戸町堤根4024-1,1100,20230930,1050,50
すき家,宮城県,すき家 4号仙台郡山店,宮城県仙台市太白区郡山字出丸1-1,1000,20230930,980,20
すき家,宮城県,すき家 4号仙台泉ヶ丘店,宮城県仙台市泉区泉ヶ丘3-13-24,1000,20230930,950,50
すき家,岩手県,すき家 4号二戸店,岩手県二戸市米沢字下村6-1,960,20230930,900,60
すき家,栃木県,すき家 4号矢板店,栃木県矢板市中691-1,1000,20230930,980,20
すき家,茨城県,すき家 51号水戸大洗IC店,茨城県水戸市大串町965-3,1050,20230930,1000,50
すき家,山梨県,すき家 52号甲府宝店,山梨県甲府市宝2-25-8,1030,20230930,1000,30
すき家,北海道,すき家 5号函館亀田店,北海道函館市亀田町17-11,1000,20230930,980,20
すき家,茨城県,すき家 6号水戸住吉店,茨城県水戸市住吉町47-1,1050,20230930,1000,50
すき家,青森県,すき家 7号弘前高崎店,青森県弘前市大字高崎字広田115-2,950,20230930,920,30
すき家,山形県,すき家 7号酒田こあら店,山形県酒田市こあら二丁目1-1,1100,20230930,1080,20
すき家,秋田県,すき家 7号秋田土崎店,秋田県秋田市土崎港相染町字大谷地36-4,960,20230930,930,30
すき家,新潟県,すき家 7号新発田中曽根店,新潟県新発田市中曽根町3-10-12,1000,20230930,950,50
すき家,新潟県,すき家 7号胎内店,新潟県胎内市大川町15-33,1000,20230930,950,50
すき家,秋田県,すき家 7号大館店,秋田県大館市根下戸新町9-25,970,20230930,950,20
すき家,石川県,すき家 8号加賀加茂店,石川県加賀市加茂町チ65-1,1050,20230930,1030,20
すき家,富山県,すき家 8号高岡北島店,富山県高岡市北島婦計459-2,1080,20230930,1050,30
すき家,新潟県,すき家 8号糸魚川寺島店,新潟県糸魚川市寺島3-2-34,1030,20230930,1000,30
すき家,新潟県,すき家 8号上越下荒浜店,新潟県上越市大字下荒浜字大谷内横田346-1,1030,20230930,1000,30
すき家,兵庫県,すき家 JR神戸駅北店,兵庫県神戸市中央区多聞通2-4-4神戸ブックローンビル東館1F,1050,20230930,1030,20
すき家,大阪府,すき家 なんば楽座店,大阪府大阪市中央区難波4-3-19,1180,20230930,1120,60
すき家,大阪府,すき家 なんば千日前店,大阪府大阪市中央区難波千日前11-20遊企画ビル1階,1200,20230930,1120,80
すき家,大阪府,すき家 はびきの伊賀店,大阪府羽曳野市伊賀4-5-6,1100,20230930,1050,50
すき家,神奈川,すき家 アクロスプラザ湯河原店,神奈川県足柄下郡湯河原町中央1-1617-54,1180,20230930,1090,90
すき家,茨城県,すき家 イーアスつくば店,茨城県つくば市研究学園5-19イーアスつくばショッピングセンター3F,1050,20230930,1000,50
すき家,北海道,すき家 イオンモール旭川西店,北海道旭川市緑町23-2161-3,1020,20230930,1000,20
すき家,大阪府,すき家 イオンモール茨木店,大阪府茨木市松ヶ本町8-30-3イオン茨木店1F,1100,20230930,1050,50
すき家,新潟県,すき家 イオンモール新潟南店,新潟県新潟市江南区下早通柳田1-1-1,1030,20230930,1000,30
すき家,北海道,すき家 イオンモール発寒店,北海道札幌市西区発寒八条12-1-1,1000,20230930,980,20
すき家,埼玉県,すき家 イオンモール北戸田店,埼玉県戸田市美女木東1-3-1,1080,20230930,1020,60
すき家,神奈川,すき家 イオン金沢八景店,神奈川県横浜市金沢区泥亀1-27-1イオン金沢八景地下1Fフードコート内,1150,20230930,1090,60
すき家,埼玉県,すき家 イトーヨーカドー三郷店,埼玉県三郷市ピアラシティ1-1-1イトーヨーカドー三郷1F,1100,20230930,1050,50
すき家,福島県,すき家 ザ・モール郡山店,福島県郡山市長者1-1-56,980,20230930,900,80
すき家,宮城県,すき家 フォレオせんだい宮の杜店,宮城県仙台市宮城野区東仙台4-14-3,1000,20230930,950,50
すき家,山梨県,すき家 フォレストモール富士川店,山梨県南巨摩郡富士川町青柳町973-1,1050,20230930,1000,50
すき家,大阪府,すき家 阿倍野店,大阪府大阪市阿倍野区阿倍野筋2-4-49アベニュ-ホ-ル1F,1120,20230930,1050,70
すき家,北海道,すき家 旭川永山店,北海道旭川市永山六条5-77-54,1020,20230930,1000,20
すき家,北海道,すき家 旭川神居店,北海道旭川市神居2条1-1-17,1020,20230930,1000,20
すき家,北海道,すき家 旭川豊岡店,北海道旭川市豊岡十四条6-8-15,1020,20230930,1000,20
すき家,広島県,すき家 安芸熊野店,広島県安芸郡熊野町平谷三丁目1番15-1。15-2、15-6、16-2、7-1、7-4,1130,20230930,,1130
すき家,神奈川,すき家 伊勢原桜台店,神奈川県伊勢原市桜台2-13-14,1120,20230930,1090,30
すき家,兵庫県,すき家 伊丹瑞穂店,兵庫県伊丹市瑞穂町2-21,1050,20230930,1030,20
すき家,兵庫県,すき家 伊丹野間店,兵庫県伊丹市南野北5-3-28,1050,20230930,1030,20
すき家,静岡県,すき家 伊東桜木店,静岡県伊東市桜木町1-3-18,1080,20230930,1030,50
すき家,大阪府,すき家 茨木IC店,大阪府茨木市郡4-11-36,1100,20230930,1050,50
すき家,大阪府,すき家 茨木中穂積店,大阪府茨木市中穂積2-10-8,1100,20230930,1050,50
すき家,石川県,すき家 羽咋石野町店,石川県羽咋市石野町イ54-1,1080,20230930,1000,80
すき家,長野県,すき家 塩尻志学館高校前店,長野県塩尻市広丘高出1486-230,1050,20230930,1000,50
すき家,秋田県,すき家 横手IC店,秋田県横手市安田向田173-3,960,20230930,930,30
すき家,神奈川,すき家 横須賀中央店,神奈川県横須賀市若松町1-4味ビル1F,1150,20230930,1090,60
すき家,神奈川,すき家 横須賀野比店,神奈川県横須賀市野比1-4-25,1130,20230930,1090,40
すき家,神奈川,すき家 海老名河原口店,神奈川県海老名市河原口5-4-28,1180,20230930,1150,30
すき家,神奈川,すき家 開成店,神奈川県足柄上郡開成町吉田島783-1,1150,20230930,1090,60
すき家,大阪府,すき家 貝塚北町店,大阪府貝塚市北町17-15,1100,20230930,1050,50
すき家,茨城県,すき家 笠間友部店,茨城県笠間市旭町427-2,1050,20230930,1000,50
すき家,富山県,すき家 滑川柳原店,富山県滑川市柳原59-14,1080,20230930,1030,50
すき家,大阪府,すき家 蒲生四丁目店,大阪府大阪市城東区蒲生4-21-8,1100,20230930,1050,50
すき家,神奈川,すき家 釜利谷店,神奈川県横浜市金沢区釜利谷東4-53-11,1130,20230930,1090,40
すき家,神奈川,すき家 寒川宮山店,神奈川県高座郡寒川町宮山3460-1,1112,20230930,1090,22
すき家,神奈川,すき家 寒川田端店,神奈川県高座郡寒川町田端1445-1,1112,20230930,1090,22
すき家,神奈川,すき家 環状4号泉区和泉店,神奈川県横浜市泉区下和泉1-4-3,1150,20230930,1100,50
すき家,大阪府,すき家 関目店,大阪府大阪市城東区成育2-13-15アイビーマンション1F,1100,20230930,1050,50
すき家,大阪府,すき家 岸和田磯上店,大阪府岸和田市磯上町4-23-25,1100,20230930,1050,50
すき家,大阪府,すき家 岸和田和泉IC北店,大阪府岸和田市田治米町343-1,1100,20230930,1050,50
すき家,埼玉県,すき家 岩槻駅前店,埼玉県さいたま市岩槻区本町1-3-3吉田ビル1F,1100,20230930,1050,50
すき家,埼玉県,すき家 岩槻城北東店,埼玉県さいたま市岩槻区上野1-20-5,1100,20230930,1050,50
すき家,新潟県,すき家 亀田店,新潟県新潟市江南区早苗2-248-1,1000,20230930,950,50
すき家,埼玉県,すき家 吉川栄店,埼玉県吉川市栄834-1,1080,20230930,1050,30
すき家,宮崎県,すき家 宮崎新別府店,宮崎県宮崎市新別府町山宮986-6,1000,20230930,980,20
すき家,神奈川,すき家 京急久里浜駅前店,神奈川県横須賀市久里浜4-5-4,1130,20230930,1090,40
すき家,大阪府,すき家 京阪枚方市駅前店,大阪府枚方市岡本町3-4N´sSquare1F,1100,20230930,1050,50
すき家,大阪府,すき家 玉造駅前店,大阪府大阪市中央区玉造1-5-8大倉ビル,1120,20230930,1050,70
すき家,大阪府,すき家 近畿大学店,大阪府東大阪市新上小阪5-86近畿大学Eキャンパス構内,1100,20230930,1050,50
すき家,神奈川,すき家 戸塚南店,神奈川県横浜市戸塚区東俣野町1029-1,1150,20230930,1100,50
すき家,新潟県,すき家 五泉東本町店,新潟県五泉市東本町2-78-1,980,20230930,950,30
すき家,大阪府,すき家 交野星田北店,大阪府交野市星田北3-37-4,1100,20230930,1050,50
すき家,青森県,すき家 弘前青山店,青森県弘前市大字青山5-28-1,930,20230930,900,30
すき家,青森県,すき家 弘前中央店,青森県弘前市大字大町3-1-4,930,20230930,900,30
すき家,青森県,すき家 弘前中野店,青森県弘前市中野2-1-6,920,20230930,900,20
すき家,大阪府,すき家 江戸堀店,大阪府大阪市西区江戸堀1-24-15タツト・肥後橋ビル1F,1200,20230930,1180,20
すき家,山梨県,すき家 甲州塩山店,山梨県甲州市塩山下於曽1559-1,1030,20230930,1000,30
すき家,山梨県,すき家 甲斐島上条店,山梨県甲斐市島上条207-1,1030,20230930,1000,30
すき家,山梨県,すき家 甲府アルプス通り店,山梨県中巨摩郡昭和町西条2707-1,1050,20230930,1000,50
すき家,山梨県,すき家 甲府国玉店,山梨県甲府市国玉町975-1,1030,20230930,1000,30
すき家,大阪府,すき家 香里園駅前店,大阪府寝屋川市香里南之町20-23,1100,20230930,1050,50
すき家,大阪府,すき家 高槻下田部店,大阪府高槻市下田部町1-3-28,1100,20230930,1050,50
すき家,大阪府,すき家 高槻古曽部店,大阪府高槻市古曽部町2-21-32,1100,20230930,1050,50
すき家,栃木県,すき家 黒磯住吉店,栃木県那須塩原市住吉町77-12,1000,20230930,980,20
すき家,大阪府,すき家 此花四貫島店,大阪府大阪市此花区四貫島2-4-5,1120,20230930,1070,50
すき家,大阪府,すき家 阪急茨木市駅前店,大阪府茨木市双葉町8-1奥村ビル1F,1100,20230930,1050,50
すき家,兵庫県,すき家 阪急園田駅前店,兵庫県尼崎市東園田町9-17-16メゾン・ドゥ・ファミリー1F,1080,20230930,1060,20
すき家,大阪府,すき家 阪急庄内南店,大阪府豊中市庄内西町5-1-3,1080,20230930,1060,20
すき家,大阪府,すき家 阪急淡路西口店,大阪府大阪市東淀川区淡路4-11-15井上ビル1F,1120,20230930,1100,20
すき家,大阪府,すき家 阪神野田駅前店,大阪府大阪市福島区海老江1-1-17野田アプラ105,1200,20230930,1120,80
すき家,大阪府,すき家 堺IC店,大阪府堺市南区小代457-1,1100,20230930,1050,50
すき家,大阪府,すき家 堺筋本町店,大阪府大阪市中央区本町1-7-1三星本町ビル1F,1200,20230930,1120,80
すき家,大阪府,すき家 堺高須店,大阪府堺市堺区高須町2-1-16,1100,20230930,1050,50
すき家,大阪府,すき家 堺黒土店,大阪府堺市北区黒土町2355-1,1100,20230930,1050,50
すき家,大阪府,すき家 堺津久野店,大阪府堺市西区下田町26-23,1100,20230930,1050,50
すき家,大阪府,すき家 堺片蔵店,大阪府堺市南区片蔵1333-1,1100,20230930,1050,50
すき家,大阪府,すき家 桜川駅前店,大阪府大阪市浪速区幸町2-8-8常盤機械ビル1F,1120,20230930,1050,70
すき家,北海道,すき家 札幌ポールタウン店,北海道札幌市中央区南三条西3-10さっぽろ地下街ポールタウン,1020,20230930,1000,20
すき家,北海道,すき家 札幌駅前通北一条店,北海道札幌市中央区北1条西3-2-5北尾ビル1F,1020,20230930,1000,20
すき家,北海道,すき家 札幌桑園店,北海道札幌市中央区北十一条西20丁目1-10,1020,20230930,1000,20
すき家,北海道,すき家 札幌山鼻店,北海道札幌市中央区南十三条西15-3-6,1020,20230930,1000,20
すき家,北海道,すき家 札幌新道発寒店,北海道札幌市西区発寒12条1-2-30,1020,20230930,1000,20
すき家,北海道,すき家 札幌石山通南一条店,北海道札幌市中央区南1条西11-327-27ジュピタープレイス1F,1020,20230930,1000,20
すき家,北海道,すき家 札幌屯田店,北海道札幌市北区屯田六条4-4-20,1020,20230930,1000,20
すき家,北海道,すき家 札幌美香保店,北海道札幌市東区北二十条東8-3-5,1020,20230930,1000,20
すき家,北海道,すき家 札幌北33条店,北海道札幌市北区北三十三条西4-1-12,1020,20230930,1000,20
すき家,北海道,すき家 札幌北郷店,北海道札幌市白石区北郷三条8-1-1,1020,20230930,1000,20
すき家,北海道,すき家 札幌北野店,北海道札幌市清田区北野七条3-5-5,1020,20230930,1000,20
すき家,兵庫県,すき家 三宮駅東店,兵庫県神戸市中央区雲井通6-1-15サンシティビル103,1080,20230930,1060,20
すき家,兵庫県,すき家 三宮店,兵庫県神戸市中央区北長狭通1-20-2,1080,20230930,1060,20
すき家,大阪府,すき家 三国本町店,大阪府大阪市淀川区三国本町2-13-14,1100,20230930,1060,40
すき家,静岡県,すき家 三島徳倉店,静岡県三島市徳倉910-2,1080,20230930,1030,50
すき家,大阪府,すき家 四ツ橋駅前店,大阪府大阪市西区北堀江1-7-12四ツ橋北堀江ビル1F,1150,20230930,1090,60
すき家,大阪府,すき家 寺田町駅前店,大阪府大阪市阿倍野区天王寺町北2-1-5,1120,20230930,1050,70
すき家,山形県,すき家 酒田若竹店,山形県酒田市若竹町2-3-5,1100,20230930,1080,20
すき家,秋田県,すき家 秋田泉店,秋田県秋田市泉中央1-3-11,960,20230930,930,30
すき家,大阪府,すき家 住吉遠里小野店,大阪府大阪市住吉区遠里小野2-10-30,1100,20230930,1050,50
すき家,大阪府,すき家 住吉長居公園通店,大阪府大阪市住吉区長居東1-31,1120,20230930,1050,70
すき家,大阪府,すき家 住之江大和川通店,大阪府大阪市住之江区新北島1-9-5,1120,20230930,1050,70
すき家,大阪府,すき家 十三駅西口店,大阪府大阪市淀川区十三本町1-7-1カネイシビル,1120,20230930,1100,20
すき家,青森県,すき家 十和田元町店,青森県十和田市元町東1-2-19,940,20230930,920,20
すき家,埼玉県,すき家 春日部ユリノキ通り店,埼玉県春日部市大沼4-19,1100,20230930,1050,50
すき家,埼玉県,すき家 春日部増田新田店,埼玉県春日部市増田新田93-1,1100,20230930,1050,50
すき家,神奈川,すき家 小田原駅東口店,神奈川県小田原市栄町1-14-1実正堂ビル1F,1150,20230930,1090,60
すき家,神奈川,すき家 小田原扇町店,神奈川県小田原市扇町2-5-9,1150,20230930,1090,60
すき家,神奈川,すき家 小田原早川店,神奈川県小田原市早川3-19-6,1180,20230930,1110,70
すき家,大阪府,すき家 松原阿保店,大阪府松原市阿保6-871-1,1100,20230930,1050,50
すき家,大阪府,すき家 松原南新町店,大阪府松原市南新町4-107-17,1100,20230930,1050,50
すき家,長野県,すき家 松本出川店,長野県松本市出川3-6-10,1050,20230930,1030,20
すき家,静岡県,すき家 沼津小諏訪店,静岡県沼津市小諏訪574-8,1080,20230930,1030,50
すき家,群馬県,すき家 沼田IC店,群馬県沼田市下久屋町1043-1,1080,20230930,1000,80
すき家,神奈川,すき家 湘南LT店,神奈川県藤沢市大庭5434-9,1150,20230930,1100,50
すき家,新潟県,すき家 上越高土店,新潟県上越市高土町1-1-4,1030,20230930,1000,30
すき家,新潟県,すき家 上越春日山店,新潟県上越市大豆1-9-27,1030,20230930,1000,30
すき家,埼玉県,すき家 上尾駅西口店,埼玉県上尾市谷津2-1-41,1100,20230930,1050,50
すき家,埼玉県,すき家 上尾平塚店,埼玉県上尾市平塚1696-1,1100,20230930,1050,50
すき家,埼玉県,すき家 上尾平方店,埼玉県上尾市平方領領家三ッ塚4-1,1100,20230930,1050,50
すき家,大阪府,すき家 上六店,大阪府大阪市天王寺区上本町6-9-20,1120,20230930,1050,70
すき家,神奈川,すき家 城山向原店,神奈川県相模原市緑区向原3-1-4,1150,20230930,1090,60
すき家,新潟県,すき家 新井店,新潟県妙高市大字猪野山55-16,1030,20230930,1000,30
すき家,埼玉県,すき家 新越谷駅東口店,埼玉県越谷市南越谷1-17-11新越谷プラザビル1F,1100,20230930,1050,50
すき家,新潟県,すき家 新潟巻店,新潟県新潟市西蒲区巻甲4438-4,1000,20230930,950,50
すき家,新潟県,すき家 新潟近江店,新潟県新潟市中央区上近江2-1-18,1030,20230930,1000,30
すき家,新潟県,すき家 新潟大学前店,新潟県新潟市西区五十嵐一の町6711-1,980,20230930,950,30
すき家,大阪府,すき家 新大阪西宮原店,大阪府大阪市淀川区西宮原1-8-41新大阪南愛ビル1階,1120,20230930,1060,60
すき家,北海道,すき家 深川店,北海道深川市三条18-25,1000,20230930,960,40
すき家,兵庫県,すき家 神戸キャンパススクエア店,兵庫県神戸市西区学園西町1-4,1050,20230930,1030,20
すき家,神奈川,すき家 秦野室川橋店,神奈川県秦野市曽屋5788-5,1120,20230930,1090,30
すき家,兵庫県,すき家 須磨車店,兵庫県神戸市須磨区車字奥中ノ尾767-1,1060,20230930,1030,30
すき家,大阪府,すき家 吹田五月が丘店,大阪府吹田市五月が丘東13-19,1100,20230930,1050,50
すき家,兵庫県,すき家 垂水塩屋北店,兵庫県神戸市垂水区朝谷町20-7,1060,20230930,1030,30
すき家,兵庫県,すき家 垂水多聞店,兵庫県神戸市垂水区本多聞1-22-30,1050,20230930,1030,20
すき家,兵庫県,すき家 垂水名谷店,兵庫県神戸市垂水区名谷町字横尾1818-1,1040,20230930,1030,10
すき家,茨城県,すき家 水戸河和田店,茨城県水戸市河和田1丁目1704番14-13,1020,20230930,1000,20
すき家,茨城県,すき家 水戸末広町店,茨城県水戸市末広町2-3-7,1020,20230930,980,40
すき家,茨城県,すき家 水戸柳町店,茨城県水戸市柳町1-1-8,1050,20230930,1000,50
すき家,静岡県,すき家 清水IC店,静岡県静岡市清水区八坂東2-16-21,1080,20230930,1000,80
すき家,大阪府,すき家 生野巽東店,大阪府大阪市生野区巽東3-13-10,1120,20230930,1050,70
すき家,大阪府,すき家 西九条駅前店,大阪府大阪市此花区西九条4-3-39村本ビル1F,1120,20230930,1070,50
すき家,栃木県,すき家 西那須野店,栃木県那須塩原市睦104-31,1000,20230930,980,20
すき家,大阪府,すき家 西本町店,大阪府大阪市西区西本町1-7-14日宝信濃橋センター,1200,20230930,1120,80
すき家,青森県,すき家 青森西店,青森県青森市篠田2-19-26,950,20230930,930,20
すき家,青森県,すき家 青森問屋町店,青森県青森市第二問屋町1-2-1,950,20230930,930,20
すき家,青森県,すき家 青森浪打店,青森県青森市浪打2-11-20,950,20230930,930,20
すき家,静岡県,すき家 静岡安西店,静岡県静岡市葵区安西1-2-18,1080,20230930,1050,30
すき家,北海道,すき家 石狩花川店,北海道石狩市花川南6条1-11-50,1020,20230930,1000,20
すき家,大阪府,すき家 摂津鳥飼中店,大阪府摂津市鳥飼中2-2-50,1100,20230930,1050,50
すき家,大阪府,すき家 摂津南別府店,大阪府摂津市南別府町3-19,1100,20230930,1050,50
すき家,大阪府,すき家 摂津富田店,大阪府高槻市大畑町26-17,1100,20230930,1050,50
すき家,宮城県,すき家 仙台岩切店,宮城県仙台市宮城野区岩切字青津目8-1,1000,20230930,980,20
すき家,宮城県,すき家 仙台広瀬通一番町店,宮城県仙台市青葉区一番町4-3-1菅原酒店ビル1F,1000,20230930,980,20
すき家,宮城県,すき家 仙台松森店,宮城県仙台市泉区松森字陣ヶ原5-1,1000,20230930,980,20
すき家,宮城県,すき家 仙台水の森店,宮城県仙台市青葉区水の森3-31-1,1000,20230930,950,50
すき家,宮城県,すき家 仙台泉中央店,宮城県仙台市泉区泉中央1-1-4,1000,20230930,950,50
すき家,宮城県,すき家 仙台定禅寺通店,宮城県仙台市青葉区一番町4-11-1-101,1000,20230930,980,20
すき家,兵庫県,すき家 川西火打店,兵庫県川西市火打2-9-23,1050,20230930,1030,20
すき家,大阪府,すき家 泉大津松之浜店,大阪府泉大津市松之浜町2-1-12,1100,20230930,1050,50
すき家,大阪府,すき家 泉南中小路店,大阪府泉南市中小路2-383,1100,20230930,1050,50
すき家,大阪府,すき家 船場中央店,大阪府大阪市中央区南本町3-2-6,1200,20230930,1120,80
すき家,神奈川,すき家 相模原共和店,神奈川県相模原市中央区共和3-6-17,1130,20230930,1090,40
すき家,神奈川,すき家 相模原小町通店,神奈川県相模原市中央区小町通2-4-12,1150,20230930,1090,60
すき家,神奈川,すき家 相模原田名店,神奈川県相模原市中央区田名4679-10,1120,20230930,1090,30
すき家,神奈川,すき家 相模原緑が丘店,神奈川県相模原市中央区緑が丘1-46-28,1180,20230930,1090,90
