すき家,栃木県,すき家 佐野大橋店,栃木県佐野市大橋町3239-1,910,960,50
すき家,栃木県,すき家 佐野鐙塚店,栃木県佐野市鐙塚町177-1,910,960,50
すき家,大阪府,すき家 阪急茨木市駅前店,大阪府茨木市双葉町8-1&nbsp;奥村ビル1F,900,960,60
すき家,大阪府,すき家 堺IC店,大阪府堺市南区小代457-1,900,970,70
すき家,大阪府,すき家 堺津久野店,大阪府堺市西区下田町26-23,900,950,50
すき家,大阪府,すき家 堺片蔵店,大阪府堺市南区片蔵1333-1,900,930,30
すき家,北海道,すき家 札幌桑園店,北海道札幌市中央区北十一条西20丁目1-10,850,900,50
すき家,北海道,すき家 札幌屯田店,北海道札幌市北区屯田六条4-4-20,800,850,50
すき家,北海道,すき家 札幌美香保店,北海道札幌市東区北二十条東8-3-5,850,900,50
すき家,北海道,すき家 札幌北33条店,北海道札幌市北区北三十三条西4-1-12,850,900,50
すき家,北海道,すき家 札幌北郷店,北海道札幌市白石区北郷三条8-1-1,810,860,50
すき家,青森県,すき家 三沢緑町店,青森県三沢市緑町3-8-15,850,900,50
すき家,茨城県,すき家 三和町店,茨城県古河市上片田字新田前843-1,900,950,50
すき家,千葉県,すき家 四街道IC店,千葉県四街道市栗山812-6,980,1000,20
すき家,千葉県,すき家 四街道鹿放ヶ丘店,千葉県四街道市鹿放ヶ丘459-1,980,1000,20
すき家,三重県,すき家 四日市塩浜店,三重県四日市市塩浜本町1-9-5,930,950,20
すき家,三重県,すき家 四日市泊店,三重県四日市市泊町2-34,930,950,20
すき家,千葉県,すき家 市原松ヶ島店,千葉県市原市松ヶ島2-18-1,980,1000,20
すき家,埼玉県,すき家 指扇店,埼玉県さいたま市西区大字土屋字上谷510-2,950,1100,150
すき家,千葉県,すき家 芝山店,千葉県船橋市芝山2-9-1,950,1000,50
すき家,青森県,すき家 十和田元町店,青森県十和田市元町東1-2-19,850,900,50
すき家,群馬県,すき家 渋川有馬店,群馬県渋川市有馬186-1,900,1000,100
すき家,島根県,すき家 出雲高岡店,島根県出雲市高岡町540-1,900,950,50
すき家,島根県,すき家 出雲市駅南店,島根県出雲市駅南町2-5-1,900,950,50
すき家,埼玉県,すき家 所沢東店,埼玉県所沢市下安松1576-1,960,1000,40
すき家,栃木県,すき家 小山西城南店,栃木県小山市西城南4-19-7,900,950,50
すき家,栃木県,すき家 小山店,栃木県小山市城東6-8-14,900,950,50
すき家,神奈川,すき家 小田原駅東口店,神奈川県小田原市栄町1-14-1実正堂ビル1F,1000,1020,20
すき家,神奈川,すき家 小田原扇町店,神奈川県小田原市扇町2-5-9,1000,1020,20
すき家,東京都,すき家 小平上水本町店,東京都小平市上水本町4-12-7,950,1000,50
すき家,大阪府,すき家 松原阿保店,大阪府松原市阿保6-871-1,920,930,10
すき家,大阪府,すき家 松原南新町店,大阪府松原市南新町4-107-17,920,930,10
すき家,千葉県,すき家 松戸中央店,千葉県松戸市南花島2-32-9,930,960,30
すき家,群馬県,すき家 沼田IC店,群馬県沼田市下久屋町1043-1,900,1000,100
すき家,神奈川,すき家 湘南LT店,神奈川県藤沢市大庭5434-9,980,1000,20
すき家,神奈川,すき家 上大岡ｶﾐｵ店,神奈川県横浜市港南区上大岡西1-15-1CAMIO&nbsp;1F,1050,1080,30
すき家,埼玉県,すき家 上尾駅西口店,埼玉県上尾市谷津2-1-41,950,1000,50
すき家,埼玉県,すき家 新越谷駅東口店,埼玉県越谷市南越谷1-17-11&nbsp;新越谷プラザビル1F,980,1030,50
すき家,群馬県,すき家 新田市野井店,群馬県太田市新田市野井町771-1,900,1000,100
すき家,東京都,すき家 新木場駅南店,東京都江東区新木場1-4-7,1100,1200,100
すき家,神奈川,すき家 秦野室川橋店,神奈川県秦野市曽屋5788-5,980,1000,20
すき家,茨城県,すき家 水戸IC店,茨城県水戸市大塚町1531-1,900,930,30
すき家,茨城県,すき家 水戸駅南口店,茨城県水戸市宮町1-7-44COMBOX310-302号室,900,930,30
すき家,茨城県,すき家 水戸末広町店,茨城県水戸市末広町2-3-7,900,930,30
すき家,茨城県,すき家 水戸柳町店,茨城県水戸市柳町1-1-8,900,930,30
すき家,愛知県,すき家 瑞穂弥富通店,愛知県名古屋市瑞穂区弥富通5-31,950,1000,50
すき家,千葉県,すき家 成田取香店,千葉県成田市取香529-1,1050,1100,50
すき家,神奈川,すき家 生田駅南口店,神奈川県川崎市多摩区生田7-2-11,980,1000,20
すき家,大阪府,すき家 生野巽東店,大阪府大阪市生野区巽東3-13-10,930,950,20
すき家,千葉県,すき家 西船橋店,千葉県船橋市山野町10-1,1000,1050,50
すき家,青森県,すき家 青森西店,青森県青森市篠田2-19-26,850,900,50
すき家,青森県,すき家 青森東店,青森県青森市浪打2-11-20,850,900,50
すき家,青森県,すき家 青森南店,青森県青森市第二問屋町1-2-1,850,900,50
すき家,東京都,すき家 青梅河辺店,東京都青梅市河辺町5-25-1,950,980,30
すき家,静岡県,すき家 静岡八幡店,静岡県静岡市駿河区八幡2-14-16,950,980,30
すき家,神奈川,すき家 川崎西生田店,神奈川県川崎市多摩区西生田2-7-23,980,1000,20
すき家,大阪府,すき家 泉大津松之浜店,大阪府泉大津市松之浜町2-1-12,900,930,30
すき家,大阪府,すき家 泉南中小路店,大阪府泉南市中小路2-383,900,950,50
すき家,千葉県,すき家 船橋駅南口店,千葉県船橋市本町1-7-6ドリーム船橋ビル1F,1000,1100,100
すき家,千葉県,すき家 船橋習志野店,千葉県船橋市習志野5-5-1,950,1000,50
すき家,千葉県,すき家 船橋南店,千葉県船橋市浜町1-41-10&nbsp;第3土井ビル1F,980,1050,70
すき家,群馬県,すき家 前橋下小出店,群馬県前橋市下小出町1-8-13,920,1000,80
すき家,群馬県,すき家 前橋中央店,群馬県前橋市大渡町1-1-1,920,1000,80
すき家,群馬県,すき家 前橋南店,群馬県前橋市南町2-46-6,920,1000,80
すき家,群馬県,すき家 前橋堀越店,群馬県前橋市堀越町366-1,900,950,50
すき家,神奈川,すき家 相模大野駅南口店,神奈川県相模原市南区相模大野8-2-6&nbsp;第一島ビル1F,950,1000,50
すき家,茨城県,すき家 総和十間道路店,茨城県古河市上辺見鹿養大道北531-2,910,1000,90
すき家,栃木県,すき家 足利店,栃木県足利市福富町1107-1,900,960,60
すき家,栃木県,すき家 足利南大町店,栃木県足利市南大町321-2,930,960,30
すき家,栃木県,すき家 足利葉鹿店,栃木県足利市葉鹿町1-29-3,900,960,60
すき家,群馬県,すき家 太田中央店,群馬県太田市下浜田町1369-1,930,960,30
すき家,群馬県,すき家 太田店,群馬県太田市南矢島町928-1,900,960,60
すき家,群馬県,すき家 太田内ヶ島店,群馬県太田市内ヶ島町1492-5,930,960,30
すき家,埼玉県,すき家 大宮桜木町店,埼玉県さいたま市大宮区桜木町2-362シンメイ桜木ビル1F,960,1100,140
すき家,埼玉県,すき家 大宮店,埼玉県さいたま市西区清河寺字須場1232-5,950,1100,150
すき家,東京都,すき家 大森駅西口店,東京都大田区山王2-4-4,1100,1200,100
すき家,神奈川,すき家 大船駅前店,神奈川県鎌倉市大船1-5-9イトービル1F,1000,1050,50
すき家,大阪府,すき家 大池橋店,大阪府大阪市生野区中川西3-10-15,900,950,50
すき家,東京都,すき家 大田南六郷店,東京都大田区南六郷2-34-7,1100,1200,100
すき家,愛知県,すき家 大府長草店,愛知県大府市柊山町3-389,950,1000,50
すき家,愛知県,すき家 知多つつじが丘店,愛知県知多市つつじが丘1-19-11,950,1000,50
すき家,神奈川,すき家 地下鉄弘明寺駅前店,神奈川県横浜市南区大岡2-3-1,1050,1080,30
すき家,大阪府,すき家 中環大日店,大阪府門真市向島3-35ベア-ズA棟,920,1000,80
すき家,福岡県,すき家 朝倉甘木店,福岡県朝倉市一木626-1,870,900,30
すき家,神奈川,すき家 朝比奈店,神奈川県横浜市金沢区六浦4-11-34&nbsp;サングレイスビル101,950,1000,50
すき家,東京都,すき家 町田金井店,東京都町田市金井町1603-1,950,1000,50
すき家,東京都,すき家 町田高ヶ坂店,東京都町田市高ヶ坂469-1,950,1000,50
すき家,東京都,すき家 町田小山店,東京都町田市小山町959-1,950,1000,50
すき家,東京都,すき家 町田能ヶ谷店,東京都町田市能ヶ谷町7-12-11,950,1000,50
すき家,東京都,すき家 町田木曽店,東京都町田市木曽東1-13-34,950,1000,50
すき家,鳥取県,すき家 鳥取安長店,鳥取県鳥取市安長字上赤田167-1,850,900,50
すき家,神奈川,すき家 辻堂店,神奈川県藤沢市辻堂東海岸1-2-1,1000,1050,50
すき家,神奈川,すき家 鶴見市場駅前店,神奈川県横浜市鶴見区市場大和町8-8&nbsp;戸川ビル1F,1050,1100,50
すき家,神奈川,すき家 都筑ふれあいの丘店,神奈川県横浜市都筑区荏田南1-1,1050,1080,30
すき家,神奈川,すき家 都筑東山田店,神奈川県横浜市都筑区東山田3-18-5,1050,1080,30
すき家,東京都,すき家 東雲晴海通り店,東京都江東区東雲1-6-17,1100,1150,50
すき家,愛知県,すき家 東海加木屋店,愛知県東海市加木屋町大清水77-1,950,1000,50
すき家,神奈川,すき家 東海大前店,神奈川県秦野市南矢名3-12-3,980,1000,20
すき家,愛知県,すき家 東海大池公園店,愛知県東海市富貴ノ台6-129,950,1000,50
すき家,茨城県,すき家 東海店,茨城県那珂郡東海村村松1151-6,900,950,50
すき家,東京都,すき家 東京高等裁判所内店,東京都千代田区霞が関1-1-4号B1F,1120,1300,180
すき家,愛知県,すき家 東郷三ツ池店,愛知県愛知郡東郷町三ツ池2-3-5,950,1000,50
すき家,広島県,すき家 東広島御薗宇店,広島県東広島市西条町大字御薗宇字下上戸648-1,880,900,20
すき家,広島県,すき家 東広島八本松店,広島県東広島市八本松東2-10-8,880,900,20
すき家,埼玉県,すき家 東大宮駅前店,埼玉県さいたま市見沼区東大宮5-1-2東大宮東口扶桑ビル1F,950,1100,150
すき家,埼玉県,すき家 東武蒲生駅前店,埼玉県越谷市蒲生寿町16-18,980,1000,20
すき家,大阪府,すき家 東淀川大桐店,大阪府大阪市東淀川区大桐1-7-8,920,980,60
すき家,神奈川,すき家 藤が丘駅前店,神奈川県横浜市青葉区藤が丘2-5-1,1000,1020,20
すき家,大阪府,すき家 藤井寺駅前店,大阪府藤井寺市岡2-8-46アコ-ルアン1F,900,930,30
すき家,群馬県,すき家 藤岡IC店,群馬県藤岡市中栗須14-6,930,1000,70
すき家,神奈川,すき家 藤沢湘南台店,神奈川県藤沢市湘南台4-14-4,980,1000,20
すき家,栃木県,すき家 栃木店,栃木県栃木市箱森町41-5,900,950,50
すき家,奈良県,すき家 奈良七条店,奈良県奈良市七条町164-1,850,900,50
すき家,奈良県,すき家 奈良富雄店,奈良県奈良市三碓7-1-23,870,900,30
すき家,沖縄県,すき家 那覇曙店,沖縄県那覇市曙2-23-1,850,900,50
すき家,沖縄県,すき家 那覇真嘉比店,沖縄県那覇市真嘉比3-15-16,850,900,50
すき家,大阪府,すき家 内環状守口太子橋店,大阪府守口市緑町3-12,920,980,60
すき家,神奈川,すき家 二宮店,神奈川県中郡二宮町二宮1352-4,980,1000,20
すき家,福島県,すき家 二本松店,福島県二本松市松岡265-10,870,900,30
すき家,東京都,すき家 日の出IC店,東京都西多摩郡日の出町大字平井15-16,980,1000,20
すき家,埼玉県,すき家 日高鹿山店,埼玉県日高市大字鹿山字明婦247-5,920,1000,80
すき家,千葉県,すき家 柏松葉町店,千葉県柏市松葉町7-36-1,980,1000,20
すき家,千葉県,すき家 柏増尾台店,千葉県柏市増尾台4-13-4,960,1050,90
すき家,東京都,すき家 八王子小宮店,東京都八王子市小宮町924-1,970,1000,30
すき家,熊本県,すき家 八代新地町店,熊本県八代市新地町10-2,860,900,40
すき家,愛知県,すき家 半田州の崎店,愛知県半田市州の崎町2-182&nbsp;,950,1000,50
すき家,愛知県,すき家 尾西篭屋店,愛知県一宮市篭屋1-2-22,920,1000,80
すき家,岐阜県,すき家 美濃加茂山手店,岐阜県美濃加茂市山手町2-20,900,1000,100
すき家,群馬県,すき家 富岡BP店,群馬県富岡市七日市297-2,930,1000,70
すき家,大阪府,すき家 富田林小金台店,大阪府富田林市小金台1-3-10,900,930,30
すき家,大阪府,すき家 富田林川面店,大阪府富田林市川面町2-4-16,900,930,30
すき家,東京都,すき家 府中栄店,東京都府中市栄町2-22-1,950,1000,50
すき家,東京都,すき家 府中本宿店,東京都府中市本宿町4-29-1,950,1000,50
すき家,愛知県,すき家 扶桑柏森店,愛知県丹羽郡扶桑町大字柏森字西屋敷156-1,930,950,20
すき家,愛知県,すき家 武豊IC店,愛知県知多郡武豊町字嶋田58-200,950,1000,50
すき家,福岡県,すき家 福岡西店,福岡県福岡市西区拾六町1-25-8,850,900,50
すき家,広島県,すき家 福山多治米店,広島県福山市多治米町5-28-13,900,930,30
すき家,東京都,すき家 福生店,東京都福生市加美平1-19-7,950,980,30
すき家,奈良県,すき家 宝来店,奈良県奈良市菅原町556-1,850,900,50
すき家,愛知県,すき家 豊橋運動公園前店,愛知県豊橋市豊岡町143-1,920,980,60
すき家,愛知県,すき家 豊橋浜道店,愛知県豊橋市浜道町字浜道96-5,920,980,60
すき家,沖縄県,すき家 豊見城名嘉地店,沖縄県豊見城市名嘉地277-2,800,850,50
すき家,神奈川,すき家 北新横浜店,神奈川県横浜市港北区北新横浜1-4-8,1000,1050,50
すき家,沖縄県,すき家 北谷国体道路店,沖縄県中頭郡北谷町上勢頭544-6,850,900,50
すき家,埼玉県,すき家 北本荒井店,埼玉県北本市荒井2-413-1,950,1000,50
すき家,千葉県,すき家 本八幡駅南口店,千葉県市川市南八幡4-6-2&nbsp;高橋ビル1F,980,1050,70
すき家,大阪府,すき家 枚方山之上店,大阪府枚方市山之上北町1-8,900,960,60
すき家,大阪府,すき家 枚方渚内野店,大阪府枚方市渚内野4-25-1,900,960,60
すき家,大阪府,すき家 枚方招提北店,大阪府枚方市招提北町1-2241-1,900,960,60
すき家,大阪府,すき家 枚方中宮東之町店,大阪府枚方市中宮東之町22-13,900,960,60
すき家,兵庫県,すき家 明石駅前店,兵庫県明石市東仲ノ町11-29石ビル1F,930,950,20
すき家,埼玉県,すき家 毛呂山小田谷店,埼玉県入間郡毛呂山町大字小田谷220-1,960,1000,40
すき家,愛知県,すき家 木曽川店,愛知県一宮市木曽川町黒田字中沼北ノ切5-2,920,1000,80
すき家,大阪府,すき家 門真下馬伏店,大阪府門真市下馬伏町26-6,920,1000,80
すき家,大阪府,すき家 門真中央店,大阪府門真市大池町16-25,920,1000,80
すき家,埼玉県,すき家 嵐山店,埼玉県比企郡嵐山町大字千手堂37-2,930,1000,70
すき家,神奈川,すき家 立場店,神奈川県横浜市泉区中田西1-1-41,1000,1050,50
すき家,千葉県,すき家 流山店,千葉県流山市南流山7-1-10,930,1000,70
すき家,愛知県,すき家 緑区平手北店,愛知県名古屋市緑区平手北1-920,950,1000,50
すき家,愛知県,すき家 緑区鳴海店,愛知県名古屋市緑区浦里3-317,950,1000,50
すき家,大阪府,すき家 和泉はつが野店,大阪府和泉市はつが野1-1-13,900,950,50
