吉野家,大分県,吉野家 10号線別府店,大分県別府市汐見町7‐36,1050,20230930,1000,50
吉野家,福島県,吉野家 118号線会津若松南店,福島県会津若松市西栄町5‐21,950,20230930,900,50
吉野家,栃木県,吉野家 121号線鹿沼店,栃木県鹿沼市茂呂1059‐6,1050,20230930,1030,20
吉野家,神奈川,吉野家 134号線江ノ島店,神奈川県鎌倉市腰越3丁目4‐3,1150,20230930,1130,20
吉野家,静岡県,吉野家 136号線函南店,静岡県田方郡函南町塚本142‐1,1100,20230930,1000,100
吉野家,静岡県,吉野家 139号富士伝法店,静岡県富士市伝法2379‐1,1100,20230930,1000,100
吉野家,福島県,吉野家 13号線福島北中央店,福島県福島市北中央1丁目1‐1,970,20230930,950,20
吉野家,愛知県,吉野家 153号線和合店,愛知県愛知郡東郷町和合牛廻間166‐1,1050,20230930,1000,50
吉野家,愛知県,吉野家 155号線刈谷店,愛知県刈谷市新富町3‐411,1050,20230930,1000,50
吉野家,大阪府,吉野家 170号線野崎店,大阪府大東市南津の辺町21‐38,1080,20230930,1050,30
吉野家,大阪府,吉野家 171号線茨木インター店,大阪府茨木市郡4丁目18‐35,1100,20230930,1060,40
吉野家,大阪府,吉野家 171号線高槻市役所前店,大阪府高槻市城西町4‐46,1100,20230930,1060,40
吉野家,埼玉県,吉野家 17号線浦和常盤店,埼玉県さいたま市浦和区常盤6丁目2‐15,1200,20230930,1100,100
吉野家,大分県,吉野家 197号線大分萩原店,大分県大分市牧二丁目240番地,950,20230930,900,50
吉野家,愛知県,吉野家 1号線安城店,愛知県安城市東栄町三丁目816番地6,1050,20230930,1000,50
吉野家,愛知県,吉野家 1号線岡崎東店,愛知県岡崎市大平町杉本7‐1,1050,20230930,1000,50
吉野家,滋賀県,吉野家 1号線甲賀水口店,滋賀県甲賀市水口町名坂818,1100,20230930,1000,100
吉野家,京都府,吉野家 1号線山科店,京都府京都市山科区大塚森町11‐3,1050,20230930,1000,50
吉野家,愛知県,吉野家 1号線豊明店,愛知県豊明市前後町ほら貝1389‐1,1050,20230930,1000,50
吉野家,大阪府,吉野家 1号線枚方店,大阪府枚方市宮之阪4丁目28‐39,1100,20230930,1050,50
吉野家,福岡県,吉野家 202号線今宿店,福岡県福岡市西区横浜3丁目34‐2,980,20230930,950,30
吉野家,大分県,吉野家 213号線中津店,大分県中津市中殿町3丁目26‐8,950,20230930,900,50
吉野家,鹿児島,吉野家 225号線鹿児島宇宿店,鹿児島県鹿児島市新栄町1‐24,1000,20230930,950,50
吉野家,愛知県,吉野家 247号線名和店,愛知県東海市名和町三番割中31‐6,1050,20230930,1000,50
吉野家,兵庫県,吉野家 28号線洲本店,兵庫県南あわじ市山添81‐1,1001,20230930,1000,1
吉野家,沖縄県,吉野家 329号線南風原店,沖縄県島尻郡南風原町兼城516‐1,920,20230930,880,40
吉野家,沖縄県,吉野家 329号線与那原店,沖縄県島尻郡与那原町与那原1043,950,20230930,880,70
吉野家,沖縄県,吉野家 330号線宜野湾店,沖縄県宜野湾市我如古1丁目54‐23,920,20230930,880,40
吉野家,沖縄県,吉野家 331号線糸満店,沖縄県糸満市潮平772‐1,920,20230930,900,20
吉野家,群馬県,吉野家 354号線館林店,群馬県館林市富士原町943‐1,980,20230930,960,20
吉野家,福岡県,吉野家 3号線黒崎西店,福岡県北九州市八幡西区萩原1丁目2‐33,950,20230930,930,20
吉野家,福岡県,吉野家 3号線宗像店,福岡県宗像市光岡300‐1,950,20230930,930,20
吉野家,群馬県,吉野家 407号線太田店,群馬県太田市飯塚町1439‐1,1000,20230930,960,40
吉野家,神奈川,吉野家 467号線六会店,神奈川県藤沢市亀井野2丁目4‐5,1150,20230930,1130,20
吉野家,福島県,吉野家 49号線会津若松店,福島県会津若松市一箕町大字亀賀郷之原174‐1,950,20230930,900,50
吉野家,福島県,吉野家 49号線郡山安積店,福島県郡山市安積町日出山2丁目154‐1,970,20230930,930,40
吉野家,福島県,吉野家 49号線郡山桑野店,福島県郡山市桑野町4‐47‐1,970,20230930,930,40
吉野家,栃木県,吉野家 4号線小山本郷店,栃木県小山市本郷町1丁目3‐20,1050,20230930,1000,50
吉野家,宮城県,吉野家 4号線松森店,宮城県仙台市泉区松森斉兵衛2‐8,970,20230930,950,20
吉野家,岩手県,吉野家 4号線北上常盤台店,岩手県北上市常盤台4丁目10‐44,1050,20230930,950,100
吉野家,福島県,吉野家 4号線本宮店,福島県本宮市本宮栄田68‐1,950,20230930,930,20
吉野家,栃木県,吉野家 4号線矢板店,栃木県矢板市中930‐1,1000,20230930,960,40
吉野家,群馬県,吉野家 50号線BP太田店,群馬県太田市丸山町1277,1000,20230930,950,50
吉野家,沖縄県,吉野家 58号線那覇新都心店,沖縄県那覇市天久2丁目6‐3,1000,20230930,950,50
吉野家,沖縄県,吉野家 58号線牧港店,沖縄県浦添市牧港5丁目5‐7,920,20230930,900,20
吉野家,茨城県,吉野家 6号線常陸多賀店,茨城県日立市桜川町2丁目2‐3,980,20230930,950,30
吉野家,茨城県,吉野家 6号線石岡店,茨城県石岡市石岡3918‐2,1000,20230930,950,50
吉野家,茨城県,吉野家 6号線日立神峰店,茨城県日立市神峰町1丁目8‐15,980,20230930,950,30
吉野家,新潟県,吉野家 8号線黒埼店,新潟県新潟市西区山田662,1000,20230930,980,20
吉野家,新潟県,吉野家 8号線長岡寺島店,新潟県長岡市寺島町307‐1,1000,20230930,980,20
吉野家,京都府,吉野家 9号線洛西中山店,京都府京都市西京区大枝中山町1‐124,1050,20230930,1000,50
吉野家,福島県,吉野家 いわき湯本店,福島県いわき市常磐下船尾町古内289‐8,1030,20230930,1000,30
吉野家,福島県,吉野家 いわき平谷川瀬店,福島県いわき市平谷川瀬2丁目12‐1,1030,20230930,1000,30
吉野家,沖縄県,吉野家 うるま志林川店,沖縄県うるま市高江洲1079‐1,920,20230930,900,20
吉野家,沖縄県,吉野家 ひめゆり通り店,沖縄県那覇市壺屋2‐6‐5,920,20230930,900,20
吉野家,栃木県,吉野家 カインズ宇都宮テクノ店,栃木県宇都宮市ゆいの杜5丁目26‐5,1050,20230930,1030,20
吉野家,大阪府,吉野家 キッチンカー（関西）,大阪府大阪市北区梅田1丁目1‐3,1080,20230930,1030,50
吉野家,大阪府,吉野家 ドーチカ店,大阪府大阪市北区堂島1丁目,1140,20230930,1100,40
吉野家,沖縄県,吉野家 パイプライン浦添店,沖縄県浦添市屋富祖1丁目1‐2,920,20230930,880,40
吉野家,兵庫県,吉野家 フェニックスプラザ摩耶店,兵庫県神戸市灘区味泥町6‐1,1001,20230930,1000,1
吉野家,新潟県,吉野家 フレスポ新発田店,新潟県新発田市富塚町3丁目281‐1,980,20230930,960,20
吉野家,兵庫県,吉野家 フレンテ西宮店,兵庫県西宮市池田町11‐1,1001,20230930,1000,1
吉野家,兵庫県,吉野家 プリコ六甲道店,兵庫県神戸市灘区永手町4‐1‐1,1001,20230930,1000,1
吉野家,大阪府,吉野家 阿波座店,大阪府大阪市西区阿波座1丁目13‐11,1100,20230930,1050,50
吉野家,京都府,吉野家 宇治槙島店,京都府宇治市槙島町一の坪39,1050,20230930,1000,50
吉野家,栃木県,吉野家 宇都宮宮の内店,栃木県宇都宮市宮の内3丁目177‐1,1050,20230930,1030,20
吉野家,栃木県,吉野家 宇都宮今泉店,栃木県宇都宮市中今泉5丁目37‐4,1030,20230930,1000,30
吉野家,栃木県,吉野家 宇都宮細谷町店,栃木県宇都宮市細谷町326,1060,20230930,1040,20
吉野家,栃木県,吉野家 宇都宮城東店,栃木県宇都宮市城東1丁目10‐26,1060,20230930,1040,20
吉野家,栃木県,吉野家 宇都宮南店,栃木県宇都宮市西川田町936‐6,1060,20230930,1040,20
吉野家,埼玉県,吉野家 浦和仲町店,埼玉県さいたま市浦和区仲町2丁目3‐22,1200,20230930,1100,100
吉野家,新潟県,吉野家 燕三条店,新潟県三条市上須頃323,1000,20230930,980,20
吉野家,大阪府,吉野家 横堤店,大阪府大阪市鶴見区横堤3丁目6‐44,1100,20230930,1030,70
吉野家,神奈川,吉野家 横浜ジョイナス店,神奈川県横浜市西区南幸1‐5‐1,1300,20230930,1200,100
吉野家,神奈川,吉野家 横浜駅西口店,神奈川県横浜市西区南幸2丁目7‐15,1250,20230930,1200,50
吉野家,神奈川,吉野家 横浜駅東口店,神奈川県横浜市西区高島2‐14‐13,1250,20230930,1200,50
吉野家,沖縄県,吉野家 沖縄南インター店,沖縄県沖縄市上地4丁目20‐7,920,20230930,900,20
吉野家,兵庫県,吉野家 加古川駅北口店,兵庫県加古川市加古川町篠原町30‐10,1001,20230930,1000,1
吉野家,京都府,吉野家 外環状線醍醐店,京都府京都市伏見区醍醐大構町15‐5,1100,20230930,1050,50
吉野家,茨城県,吉野家 笠間友部店,茨城県笠間市東平3丁目1‐14,1000,20230930,950,50
吉野家,京都府,吉野家 京都競馬場店,京都府京都市伏見区葭島渡場町32京都競馬場内1F,1010,20230930,1000,10
吉野家,京都府,吉野家 京都百万遍店,京都府京都市左京区田中門前町28‐14,1050,20230930,1000,50
吉野家,福島県,吉野家 郡山さくら通り店,福島県郡山市虎丸町9‐15,970,20230930,930,40
吉野家,高知県,吉野家 高知インター店,高知県高知市高そね14‐6,1050,20230930,950,100
吉野家,大阪府,吉野家 高槻若松町店,大阪府高槻市若松町3‐6,1100,20230930,1060,40
吉野家,大阪府,吉野家 鴻池新田店,大阪府東大阪市中鴻池町2丁目1‐7,1080,20230930,1050,30
吉野家,兵庫県,吉野家 今津駅前店,兵庫県西宮市今津水波町2‐27 ミューズビル1F,1001,20230930,1000,1
吉野家,新潟県,吉野家 佐渡佐和田店,新潟県佐渡市長木767‐1,960,20230930,930,30
吉野家,栃木県,吉野家 佐野高萩町店,栃木県佐野市高萩町463‐1,980,20230930,960,20
吉野家,栃木県,吉野家 佐野大橋店,栃木県佐野市大橋町2065‐5,980,20230930,960,20
吉野家,京都府,吉野家 阪急西院店,京都府京都市右京区西院高山寺町12‐1,1050,20230930,1000,50
吉野家,大阪府,吉野家 阪急淡路駅東口店,大阪府大阪市東淀川区淡路4‐17‐11,1100,20230930,1050,50
吉野家,大阪府,吉野家 桜橋店,大阪府大阪市北区曽根崎新地2丁目1‐21,1140,20230930,1100,40
吉野家,鹿児島,吉野家 鹿児島伊敷店,鹿児島県鹿児島市伊敷1-3-15,950,20230930,930,20
吉野家,大阪府,吉野家 守口駅前店,大阪府守口市京阪本通2丁目15‐13,1100,20230930,1030,70
吉野家,福岡県,吉野家 春日宝町店,福岡県春日市宝町4丁目24‐6,950,20230930,930,20
吉野家,新潟県,吉野家 女池上山店,新潟県新潟市中央区女池上山2丁目17‐6,1000,20230930,980,20
吉野家,京都府,吉野家 松井山手店,京都府八幡市美濃山出口38‐1,1070,20230930,1050,20
吉野家,大阪府,吉野家 城北公園前店,大阪府大阪市旭区生江三丁目16‐34,1070,20230930,1030,40
吉野家,大阪府,吉野家 寝屋川市駅前店,大阪府寝屋川市早子町23‐2,1100,20230930,1050,50
吉野家,大阪府,吉野家 寝屋川昭栄町店,大阪府寝屋川市昭栄町16‐8,1100,20230930,1050,50
吉野家,大阪府,吉野家 寝屋川仁和寺店,大阪府寝屋川市仁和寺町12‐15,1100,20230930,1030,70
吉野家,新潟県,吉野家 新潟海老ケ瀬IC店,新潟県新潟市東区大形本町5丁目16‐6,1000,20230930,980,20
吉野家,新潟県,吉野家 新潟競馬場店,新潟県新潟市北区笹山3490,1000,20230930,980,20
吉野家,新潟県,吉野家 新潟本町通店,新潟県新潟市中央区本町通6番町1140‐1,1020,20230930,1000,20
吉野家,兵庫県,吉野家 新神戸駅前店,兵庫県神戸市中央区生田町1丁目1‐22,1001,20230930,1000,1
吉野家,兵庫県,吉野家 新長田店,兵庫県神戸市長田区大橋町4丁目3‐5,1001,20230930,1000,1
吉野家,兵庫県,吉野家 垂水駅東口店,兵庫県神戸市垂水区神田町1‐20,1001,20230930,1000,1
吉野家,茨城県,吉野家 水戸駅店,茨城県水戸市宮町1丁目1‐1,1030,20230930,1000,30
吉野家,兵庫県,吉野家 西宮久保店,兵庫県西宮市久保町11,1001,20230930,1000,1
吉野家,愛知県,吉野家 西尾店,愛知県西尾市下町神明下59,1100,20230930,1000,100
吉野家,神奈川,吉野家 相模大野駅前店,神奈川県相模原市南区相模大野3丁目10‐8,1150,20230930,1120,30
吉野家,大阪府,吉野家 大阪駅前第3ビル店,大阪府大阪市北区梅田1丁目1‐3,1140,20230930,1100,40
吉野家,大阪府,吉野家 大阪京橋店,大阪府大阪市都島区東野田町5丁目2‐28,1100,20230930,1030,70
吉野家,滋賀県,吉野家 大津膳所店,滋賀県大津市におの浜3丁目1‐57,1050,20230930,1000,50
吉野家,栃木県,吉野家 大田原美原店,栃木県大田原市美原1丁目7‐25,1030,20230930,1000,30
吉野家,大分県,吉野家 大分竹町店,大分県大分市中央町1丁目5‐1,1000,20230930,950,50
吉野家,大分県,吉野家 大分府内大橋店,大分県大分市畑中1丁目2番29号,1000,20230930,950,50
吉野家,大阪府,吉野家 大和田駅前店,大阪府門真市野里町1‐32,1080,20230930,1030,50
吉野家,東京都,吉野家 池袋メトロポリタン通り店,東京都豊島区西池袋1丁目4‐7,1300,20230930,1250,50
吉野家,東京都,吉野家 池袋北口店,東京都豊島区西池袋1丁目24‐1,1300,20230930,1250,50
吉野家,新潟県,吉野家 長岡リップス川崎店,新潟県長岡市川崎町1374‐5,1000,20230930,980,20
吉野家,埼玉県,吉野家 東京工場,埼玉県加須市新利根2丁目5‐2,1050,20230930,1000,50
吉野家,広島県,吉野家 東広島西条店,広島県東広島市西条土与丸5丁目3‐22,1050,20230930,950,100
吉野家,兵庫県,吉野家 東灘御影店,兵庫県神戸市東灘区御影中町2丁目2‐14,1001,20230930,1000,1
吉野家,神奈川,吉野家 東林間店,神奈川県相模原市南区上鶴間7‐6‐6 中島ビル1階,1220,20230930,1200,20
吉野家,沖縄県,吉野家 那覇東バイパス国場店,沖縄県那覇市字国場333‐1,950,20230930,900,50
吉野家,福岡県,吉野家 南バイパス太宰府店,福岡県太宰府市梅香苑1丁目1‐41,950,20230930,930,20
吉野家,東京都,吉野家 南池袋店,東京都豊島区南池袋2丁目26‐4,1300,20230930,1250,50
吉野家,福島県,吉野家 二本松安達店,福島県二本松市油井字福岡440,950,20230930,900,50
吉野家,茨城県,吉野家 日立川尻店,茨城県日立市川尻町4丁目29‐23,980,20230930,950,30
吉野家,福岡県,吉野家 八幡下上津役店,福岡県北九州市八幡西区下上津役4丁目24‐1,950,20230930,930,20
吉野家,京都府,吉野家 八幡久保田店,京都府八幡市八幡久保田35‐23,1070,20230930,1050,20
吉野家,福岡県,吉野家 八幡折尾店,福岡県北九州市八幡西区丸尾町6‐9,950,20230930,930,20
吉野家,埼玉県,吉野家 鳩ヶ谷店,埼玉県川口市三ツ和2-12-1,1130,20230930,1050,80
吉野家,大阪府,吉野家 肥後橋店,大阪府大阪市西区京町堀1丁目7‐4,1100,20230930,1050,50
吉野家,京都府,吉野家 伏見南店,京都府京都市伏見区横大路下三栖辻堂町38‐1,1070,20230930,1050,20
吉野家,福島県,吉野家 福島競馬場店,福島県福島市松浪町9-23福島競馬場内FF108,930,20230930,900,30
吉野家,沖縄県,吉野家 泡瀬ベイストリート店,沖縄県沖縄市泡瀬4丁目20‐11,920,20230930,900,20
吉野家,愛知県,吉野家 豊田インター通り店,愛知県豊田市深田町1丁目74‐1,1050,20230930,1000,50
吉野家,静岡県,吉野家 本市場店,静岡県富士市本市場424‐2,1100,20230930,1000,100
吉野家,大阪府,吉野家 枚方渚内野店,大阪府枚方市渚内野1丁目2‐5,1100,20230930,1050,50
吉野家,大阪府,吉野家 野里店,大阪府大阪市西淀川区花川2丁目21‐13,1070,20230930,1030,40
吉野家,大阪府,吉野家 淀川通塚本店,大阪府大阪市淀川区塚本2丁目13‐20,1070,20230930,1050,20
吉野家,大阪府,吉野家ホールディングス物流倉庫,大阪府門真市北島東町1-7,1250,20230930,1050,200
松屋,東京都,松のや 三鷹店,東京都武蔵野市中町1-14-5 1F,1300,20230930,1250,50
松屋,茨城県,松のや 神栖店,茨城県神栖市大野原3-11-2,1150,20230930,1100,50
松屋,埼玉県,松のや 草加店,埼玉県草加市氷川町2121-3,1150,20230930,1100,50
松屋,埼玉県,松のや 朝霞台店,埼玉県朝霞市浜崎1-3-10AX-1ビル,1150,20230930,1100,50
松屋,埼玉県,松のや 南浦和店/マイカリー食堂 南浦和店,埼玉県さいたま市南区南浦和2-36-11 カトレアビル,1200,20230930,1150,50
松屋,千葉県,松のや 茂原店,千葉県茂原市高師台3-1-4,1150,20230930,1100,50
松屋,群馬県,松屋 伊勢崎宮子町店/松のや 伊勢崎宮子町店,群馬県伊勢崎市宮子町3426-1,1100,20230930,1050,50
松屋,群馬県,松屋 伊勢崎上泉町店,群馬県伊勢崎市上泉町175番4,1100,20230930,1050,50
松屋,茨城県,松屋 茨城東海店/松のや 茨城東海店,茨城県那珂郡東海村東海1-817-4,1100,20230930,1000,100
松屋,栃木県,松屋 宇都宮オリオン通店,栃木県宇都宮市曲師町5-8 多喜屋ビル,1050,20230930,1000,50
松屋,栃木県,松屋 宇都宮簗瀬町店,栃木県宇都宮市簗瀬町1984-6,1050,20230930,1000,50
松屋,静岡県,松屋 掛川SC(下り線)店,静岡県掛川市倉真5968-4,1000,20230930,984,16
松屋,大阪府,松屋 関大前店,大阪府吹田市千里山東1-14-5 吉本マンション1F,1080,20230930,1064,16
松屋,群馬県,松屋 館林店,群馬県館林市松原3丁目16番5,1100,20230930,1050,50
松屋,栃木県,松屋 御幸本町店/松のや 御幸本町店,栃木県宇都宮市御幸本町4732-7,1050,20230930,1000,50
松屋,群馬県,松屋 高崎駅前店,群馬県高崎市八島町17-10,1100,20230930,1050,50
松屋,群馬県,松屋 高崎下之城店,群馬県高崎市下之城町177-4,1100,20230930,1050,50
松屋,群馬県,松屋 高崎南大類店/松のや 高崎南大類店,群馬県高崎市大類町915-1,1100,20230930,1050,50
松屋,群馬県,松屋 高崎問屋町店,群馬県高崎市問屋町1-10-4,1100,20230930,1050,50
松屋,大阪府,松屋 今里店,大阪府大阪市東成区大今里西3-5-1 イル・ソーレ今里駅前,1100,20230930,1064,36
松屋,栃木県,松屋 佐野店/松のや 佐野店,栃木県佐野市浅沼町558-3,1050,20230930,1000,50
松屋,茨城県,松屋 常陸太田店/松のや 常陸太田店,茨城県常陸太田市東部土地区画整理事業1街区1画地,1200,20230930,1000,200
松屋,静岡県,松屋 神立店,静岡県浜松市東区神立町118-2,1150,20230930,1100,50
松屋,群馬県,松屋 前橋元総社町店,群馬県前橋市元総社町90-1,1100,20230930,1050,50
松屋,群馬県,松屋 前橋三河町店,群馬県前橋市三河町2-16-16,1100,20230930,1050,50
松屋,群馬県,松屋 前橋上小出町店,群馬県前橋市上小出町2-41-7,1100,20230930,1050,50
松屋,群馬県,松屋 太田飯塚町店,群馬県太田市飯塚町1443,1100,20230930,1050,50
松屋,大阪府,松屋 谷町九丁目店,大阪府大阪市天王寺区生玉前町1-21,1100,20230930,1064,36
松屋,大阪府,松屋 鶴橋店,大阪府大阪市天王寺区下味原町3-13 鶴橋下味原ビル1F,1100,20230930,1064,36
松屋,埼玉県,松屋フーズ 嵐山工場,埼玉県比企郡嵐山町花見台4-3,1040,20230930,1000,40
すき家,秋田県,すき家 105号大仙北長野店,秋田県大仙市北長野字道ノ下117-1,950,20230930,900,50
すき家,長野県,すき家 117号飯山店,長野県飯山市静間2085-1,1030,20230930,1000,30
すき家,茨城県,すき家 118号常陸大宮泉店,茨城県常陸大宮市泉字中村田462-6,1050,20230930,1000,50
すき家,神奈川,すき家 129号厚木山際店,神奈川県厚木市山際281-1,1150,20230930,1090,60
すき家,神奈川,すき家 129号平塚四之宮店,神奈川県平塚市東真土2-5-53,1150,20230930,1090,60
すき家,北海道,すき家 12号岩見沢店,北海道岩見沢市九条西10-1-39,1000,20230930,960,40
すき家,北海道,すき家 12号江別野幌店,北海道江別市野幌町48-4,1000,20230930,960,40
すき家,北海道,すき家 12号滝川東町店,北海道滝川市東町2-42-7,1020,20230930,1000,20
すき家,北海道,すき家 12号美唄店,北海道美唄市大通東一条南6丁目1-1,1000,20230930,960,40
すき家,神奈川,すき家 134号横須賀池田店,神奈川県横須賀市池田町5-14-12,1130,20230930,1090,40
すき家,静岡県,すき家 135号下田店,静岡県下田市柿崎字間戸浜6-22,1200,20230930,1100,100
すき家,静岡県,すき家 136号伊豆の国大仁店,静岡県伊豆の国市吉田363-4,1080,20230930,1030,50
すき家,静岡県,すき家 136号三島店,静岡県三島市安久146-3,1050,20230930,1030,20
すき家,山梨県,すき家 139号都留桂店,山梨県都留市桂町876-1,1000,20230930,950,50
すき家,山形県,すき家 13号尾花沢店,山形県尾花沢市大字尾花沢下新田1731-2,950,20230930,930,20
すき家,長野県,すき家 152号茅野店,長野県茅野市本町東5291-1,1030,20230930,1000,30
すき家,長野県,すき家 153号伊那店,長野県伊那市山寺282-1,1050,20230930,1000,50
すき家,長野県,すき家 153号飯田IC店,長野県飯田市上殿岡576-1,1080,20230930,1030,50
すき家,石川県,すき家 159号かほく店,石川県かほく市内日角6-1-1,1050,20230930,1000,50
すき家,大阪府,すき家 163号門真殿島店,大阪府門真市殿島町7-13,1100,20230930,1050,50
すき家,神奈川,すき家 16号横須賀安浦店,神奈川県横須賀市安浦町3-24-3,1130,20230930,1120,10
すき家,埼玉県,すき家 16号見沼深作店,埼玉県さいたま市見沼区深作2-29-14,1100,20230930,1050,50
すき家,埼玉県,すき家 16号上尾瓦葺店,埼玉県上尾市瓦葺708-1,1100,20230930,1050,50
すき家,神奈川,すき家 16号相模原橋本店,神奈川県相模原市緑区橋本2-22-18,1120,20230930,1090,30
すき家,大阪府,すき家 170号羽曳野西浦店,大阪府羽曳野市西浦3-2-1,1100,20230930,1050,50
すき家,大阪府,すき家 170号熊取店,大阪府泉南郡熊取町紺屋2-5-5,1100,20230930,1050,50
すき家,大阪府,すき家 170号寝屋川高宮店,大阪府寝屋川市高宮1-10-27,1100,20230930,1050,50
すき家,大阪府,すき家 171号箕面今宮店,大阪府箕面市今宮2-3-1,1100,20230930,1050,50
すき家,大阪府,すき家 171号箕面牧落店,大阪府箕面市牧落3-20-30,1100,20230930,1050,50
すき家,新潟県,すき家 17号魚沼店,新潟県魚沼市井口新田277-1,1030,20230930,960,70
すき家,群馬県,すき家 17号沼田店,群馬県沼田市硯田町590-5,1080,20230930,1000,80
すき家,埼玉県,すき家 17号本庄店,埼玉県本庄市本庄4-7-11,1080,20230930,1050,30
すき家,長野県,すき家 19号塩尻広丘店,長野県塩尻市広丘野村1503-1,1050,20230930,1000,50
すき家,長野県,すき家 19号松本高宮店,長野県松本市高宮東1-25,1050,20230930,1030,20
すき家,長野県,すき家 19号松本村井店,長野県松本市村井町北2-8-45,1050,20230930,1030,20
すき家,神奈川,すき家 1国茅ヶ崎十間坂店,神奈川県茅ヶ崎市十間坂3-2-2,1130,20230930,1100,30
すき家,静岡県,すき家 1国三島谷田店,静岡県三島市谷田60-1,1080,20230930,1030,50
すき家,大阪府,すき家 1国城東関目店,大阪府大阪市城東区関目5-3-3,1100,20230930,1050,50
すき家,神奈川,すき家 1国藤沢辻堂店,神奈川県藤沢市辻堂神台2-8-17,1150,20230930,1100,50
すき家,大阪府,すき家 1国枚方北中振店,大阪府枚方市北中振4-10-5,1100,20230930,1050,50
すき家,福岡県,すき家 202号福岡周船寺店,福岡県福岡市西区周船寺1-13-8,950,20230930,930,20
すき家,山梨県,すき家 20号甲斐竜王店,山梨県甲斐市富竹新田1279-1,1050,20230930,1000,50
すき家,山梨県,すき家 20号甲府向町店,山梨県甲府市向町729-1,1030,20230930,1000,30
すき家,山梨県,すき家 20号笛吹一宮店,山梨県笛吹市一宮町東原25-1,1030,20230930,1000,30
すき家,北海道,すき家 228号北斗七重浜店,北海道北斗市七重浜7-2-1,1000,20230930,980,20
すき家,北海道,すき家 231号留萌店,北海道留萌市旭町2-1-1,1000,20230930,960,40
すき家,北海道,すき家 235号静内店,北海道日高郡新ひだか町静内末広町2-1-20,1040,20230930,1000,40
すき家,北海道,すき家 238号紋別店,北海道紋別市落石町4-13-13,1200,20230930,1130,70
すき家,神奈川,すき家 246号伊勢原白根店,神奈川県伊勢原市白根95-1,1130,20230930,1090,40
すき家,神奈川,すき家 246号秦野渋沢店,神奈川県秦野市並木町188-1,1130,20230930,1090,40
すき家,埼玉県,すき家 254号本庄児玉店,埼玉県本庄市児玉町吉田林397-3,1080,20230930,1050,30
すき家,神奈川,すき家 255号小田原成田店,神奈川県小田原市成田408-1,1180,20230930,1110,70
すき家,神奈川,すき家 255号大井松田店,神奈川県足柄上郡大井町金子1627-1,1180,20230930,1110,70
すき家,大阪府,すき家 25号八尾永畑店,大阪府八尾市永畑町1-2-58,1100,20230930,1050,50
すき家,大阪府,すき家 25号平野加美西店,大阪府大阪市平野区加美西1-6-16,1100,20230930,1050,50
すき家,福岡県,すき家 263号福岡野芥店,福岡県福岡市早良区野芥4-45-5,980,20230930,950,30
