松屋,大阪府,松のや 摂津富田店/マイカリー食堂 摂津富田店,大阪府高槻市富田町1-8-21,1040,20230916,1340,-300
松屋,宮城県,松屋 tekute長町店/マイカリー食堂 tekute長町店,宮城県仙台市太白区長町5丁目1-30 tekuteながまち,1050,20230916,1150,-100
松屋,茨城県,松屋 かすみがうら店,茨城県かすみがうら市上稲吉1943-32,1000,20230916,1040,-40
松屋,茨城県,松屋 ひたちなか店,茨城県ひたちなか市市毛字原坪894-36,1000,20230916,1050,-50
松屋,岩手県,松屋 アクロスプラザ盛岡店/松のや アクロスプラザ盛岡店,岩手県盛岡市津志田南1丁目1番6号,1050,20230916,1100,-50
松屋,福島県,松屋 エイトタウン本宮店/松のや エイトタウン本宮店,福島県本宮市荒井字久保田132-8-5,950,20230916,1000,-50
松屋,群馬県,松屋 伊勢崎宮子町店/松のや 伊勢崎宮子町店,群馬県伊勢崎市宮子町3426-1,1050,20230916,1080,-30
松屋,群馬県,松屋 伊勢崎上泉町店,群馬県伊勢崎市上泉町175番4,1050,20230916,1080,-30
松屋,岩手県,松屋 一関店/松のや 一関店,岩手県一関市山目大槻109-6,1000,20230916,1050,-50
松屋,千葉県,松屋 稲毛店,千葉県千葉市稲毛区小仲台2-5-15 第8若菜ビル 1.2F,1100,20230916,1150,-50
松屋,茨城県,松屋 茨城東海店/松のや 茨城東海店,茨城県那珂郡東海村東海1-817-4,1000,20230916,1100,-100
松屋,栃木県,松屋 宇都宮簗瀬町店,栃木県宇都宮市簗瀬町1984-6,1000,20230916,1200,-200
松屋,埼玉県,松屋 越谷下間久里店,埼玉県越谷市下間久里980-1,1050,20230916,1100,-50
松屋,埼玉県,松屋 越谷蒲生店/松のや 越谷蒲生店,埼玉県越谷市蒲生南町15-4,1050,20230916,1100,-50
松屋,埼玉県,松屋 越谷店/松のや 越谷店,埼玉県越谷市弥生町17-1,1050,20230916,1100,-50
松屋,長野県,松屋 塩尻店/松のや 塩尻店,長野県塩尻市大門泉町13-8,1050,20230916,1100,-50
松屋,千葉県,松屋 我孫子若松店,千葉県我孫子市若松140-1,1100,20230916,1120,-20
松屋,神奈川,松屋 海老名店,神奈川県海老名市中央2-1-5 パインビル1F,1150,20230916,1200,-50
松屋,千葉県,松屋 鎌ヶ谷店,千葉県鎌ケ谷市東初富4-2-83,1050,20230916,1120,-70
松屋,群馬県,松屋 館林店,群馬県館林市松原3丁目16番5,1050,20230916,1200,-150
松屋,東京都,松屋 京王八王子店,東京都八王子市東町1-1-20第6岩下ビル1F,1150,20230916,1200,-50
松屋,福島県,松屋 郡山コスモス通店,福島県郡山市堤3-180,930,20230916,1000,-70
松屋,千葉県,松屋 穴川オーツーパーク店,千葉県千葉市稲毛区園生町380-1,1050,20230916,1150,-100
松屋,栃木県,松屋 御幸本町店/松のや 御幸本町店,栃木県宇都宮市御幸本町4732-7,1000,20230916,1050,-50
松屋,山梨県,松屋 甲府荒川店,山梨県甲府市荒川1-8-32,1050,20230916,1100,-50
松屋,山梨県,松屋 甲府国母店/松のや 甲府国母店,山梨県甲府市大里町358-1,1050,20230916,1100,-50
松屋,埼玉県,松屋 三郷店,埼玉県三郷市三郷2-1-4 ふじプラザビル,1050,20230916,1100,-50
松屋,山梨県,松屋 山梨昭和店,山梨県中巨摩郡昭和町飯喰字村西1131,1050,20230916,1100,-50
松屋,山梨県,松屋 山梨竜王店,山梨県甲斐市西八幡2234-1,1050,20230916,1100,-50
松屋,山形県,松屋 酒田店/松のや 酒田店,山形県酒田市北新橋1-20-1,1050,20230916,1150,-100
松屋,東京都,松屋 住吉店/松のや 住吉店,東京都江東区住吉2丁目6-7,1150,20230916,1350,-200
松屋,埼玉県,松屋 春日部豊町店/松のや 春日部豊町店,埼玉県春日部市豊町1-27-2,1100,20230916,1150,-50
松屋,千葉県,松屋 初石店,千葉県流山市西初石3-100-19 森田ビル1F,1100,20230916,1120,-20
松屋,千葉県,松屋 松戸松飛台店,千葉県松戸市松飛台259-5,1050,20230916,1120,-70
松屋,長野県,松屋 松本駅前店,長野県松本市中央1-2-23 山平ビル,1050,20230916,1100,-50
松屋,長野県,松屋 松本高宮店,長野県松本市高宮中2-5,1050,20230916,1100,-50
松屋,茨城県,松屋 常陸太田店/松のや 常陸太田店,茨城県常陸太田市東部土地区画整理事業1街区1画地,1000,20230916,1080,-80
松屋,千葉県,松屋 新検見川店,千葉県千葉市花見川区南花園2-1-6 朝日ビル新検見川 1F,1100,20230916,1150,-50
松屋,千葉県,松屋 新柏店/松のや 新柏店,千葉県柏市新柏4-12-7,1100,20230916,1120,-20
松屋,茨城県,松屋 神栖店,茨城県神栖市大野原2-22-1,1050,20230916,1100,-50
松屋,長野県,松屋 諏訪店,長野県諏訪市大字四賀字赤沼1825-1,1050,20230916,1100,-50
松屋,福島県,松屋 須賀川店/松のや 須賀川店,福島県須賀川市陣場町41,1000,20230916,1030,-30
松屋,茨城県,松屋 水戸バイパス店,茨城県水戸市元吉田町1435-7,1000,20230916,1100,-100
松屋,茨城県,松屋 水戸河和田店/松のや 水戸河和田店,茨城県水戸市河和田2-177-5、2-1782（一部）（地番）,1000,20230916,1100,-100
松屋,茨城県,松屋 水戸東原店/松のや 水戸東原店,茨城県水戸市東原1‐3‐17,1000,20230916,1100,-100
松屋,岩手県,松屋 盛岡アイーナ店,岩手県盛岡市盛岡駅西通1-7-1 いわて県民情報交流センター,950,20230916,1000,-50
松屋,岩手県,松屋 盛岡駅前通店,岩手県盛岡市盛岡駅前通9-9,950,20230916,1000,-50
松屋,岩手県,松屋 盛岡大通店,岩手県盛岡市大通1-7-5,950,20230916,1000,-50
松屋,埼玉県,松屋 西所沢店/松のや 西所沢店,埼玉県所沢市上新井5-15-15,1100,20230916,1150,-50
松屋,千葉県,松屋 西千葉店,千葉県千葉市中央区春日2-19-9 西千葉西口ビル,1100,20230916,1150,-50
松屋,東京都,松屋 西八王子店,東京都八王子市台町4-47-11 飯田ビル1F,1150,20230916,1200,-50
松屋,山梨県,松屋 石和店,山梨県笛吹市石和町広瀬1374,1050,20230916,1100,-50
松屋,千葉県,松屋 千葉我孫子店,千葉県我孫子市本町2-3-2 プラザビル1F,1100,20230916,1120,-20
松屋,千葉県,松屋 千葉幸町店,千葉県千葉市美浜区幸町2-21-30,1100,20230916,1150,-50
松屋,千葉県,松屋 千葉店,千葉県千葉市中央区富士見2-5-16,1100,20230916,1200,-100
松屋,千葉県,松屋 蘇我店,千葉県千葉市中央区今井2-1-1,1100,20230916,1150,-50
松屋,埼玉県,松屋 草加松江店/マイカリー食堂 草加松江店,埼玉県草加市松江6丁目12-27,1050,20230916,1100,-50
松屋,埼玉県,松屋 草加店/松のや 草加店,埼玉県草加市北谷町1-2-14,1100,20230916,1200,-100
松屋,群馬県,松屋 太田飯塚町店,群馬県太田市飯塚町1443,1050,20230916,1200,-150
松屋,埼玉県,松屋 大宮吉野町店,埼玉県さいたま市北区吉野町1-2-3,1100,20230916,1150,-50
松屋,埼玉県,松屋 大宮東口店,埼玉県さいたま市大宮区宮町1-5,1200,20230916,1250,-50
松屋,埼玉県,松屋 大宮奈良町店/松のや 大宮奈良町店,埼玉県さいたま市北区奈良町51-4,1100,20230916,1150,-50
松屋,茨城県,松屋 土浦真鍋店,茨城県土浦市真鍋1-12-9,1000,20230916,1040,-40
松屋,千葉県,松屋 東千葉店,千葉県千葉市中央区祐光2-15-5,1100,20230916,1150,-50
松屋,埼玉県,松屋 南越谷店,埼玉県越谷市南越谷1-19-8 吉澤第一ビル1F,1050,20230916,1100,-50
松屋,千葉県,松屋 南柏店,千葉県柏市南柏1-2-4 エコロジースクエア南柏,1100,20230916,1120,-20
松屋,山梨県,松屋 韮崎店,山梨県韮崎市若宮2-12-20 ライフガーデンにらさき,1050,20230916,1100,-50
松屋,千葉県,松屋 柏中央町店,千葉県柏市中央町2番8号 柏大黒ビル,1100,20230916,1120,-20
松屋,東京都,松屋 八王子店,東京都八王子市旭町7-1 豊栄ビル,1150,20230916,1200,-50
松屋,青森県,松屋 八戸城下店/松のや 八戸城下店,青森県八戸市城下4-15-16,1000,20230916,1100,-100
松屋,千葉県,松屋 八千代台西口店,千葉県八千代市八千代台北1-11,1050,20230916,1100,-50
松屋,千葉県,松屋 北習志野店,千葉県船橋市習志野台2-6-1 小林ビル,1050,20230916,1100,-50
松屋,千葉県,松屋 北小金店,千葉県松戸市小金きよしヶ丘3-20-5,1100,20230916,1120,-20
松屋,千葉県,松屋 幕張インター店/松のや 幕張インター店/マイカリー食堂 幕張インター店,千葉県習志野市鷺沼5-6-5,1100,20230916,1200,-100
松屋,千葉県,松屋 幕張本郷1丁目店,千葉県千葉市花見川区幕張本郷1-3-11 一松ビル,1100,20230916,1150,-50
松屋,千葉県,松屋 末広街道店,千葉県千葉市中央区末広2-3-4,1100,20230916,1150,-50
松屋,長野県,松屋 箕輪町店,長野県上伊那郡箕輪町三日町947-1,1050,20230916,1100,-50
松屋,東京都,松屋 立川錦町店/マイカリー食堂 立川錦町店,東京都立川市錦町2-1-3 ,1250,20230916,1300,-50
松屋,東京都,松屋 立川柴崎町店/松のや 立川柴崎町店,東京都立川市柴崎町6-10-8,1250,20230916,1300,-50
松屋,東京都,松屋 立川店/マイカリー食堂 立川店,東京都立川市曙町2-12-15 立川金水ビル1F,1250,20230916,1300,-50
松屋,埼玉県,松屋 和光市駅前店,埼玉県和光市本町3-2 ステイパルビル,1100,20230916,1200,-100
松屋,埼玉県,松屋 和光白子店/松のや 和光白子店,埼玉県和光市白子1-7-12,1100,20230916,1200,-100
すき家,青森県,すき家 つがる柏店,青森県つがる市柏稲盛幾世121-1,980,20230916,1080,-100
