松屋,東京都,松屋 久我山店,東京都杉並区久我山2-28-1,1200,20250517
松屋,福岡県,松屋 穴生店,福岡県北九州市八幡西区穴生2-8-7,1000,20250517
松屋,福岡県,松屋 小倉駅前店,福岡県北九州市小倉北区京町2-5-13,1100,20250517
松屋,福岡県,松屋 小倉片野店,福岡県北九州市小倉北区片野4-20-12,1100,20250517
松屋,神奈川,松屋 小田急相模原西口店,神奈川県相模原市南区相模台2-4-6,1200,20250517
松屋,大分県,松屋 大分駅前店,大分県大分市中央町1-1-24,1050,20250517
松屋,大分県,松屋 大分大在店/松のや 大分大在店,大分県大分市角子南2-1-17,1050,20250517
松屋,大分県,松屋 中津店/松のや 中津店,大分県中津市大字上宮永339-2,1050,20250517
松屋,静岡県,松屋 浜松高林店,静岡県浜松市中央区高林4-14-22,1150,20250517
松屋,福岡県,松屋 北九州高須東店/松のや 北九州高須東店,福岡県北九州市若松区高須東4-2-17,1000,20250517
松屋,静岡県,松屋食堂 牧之原（上り線）店,静岡県牧之原市静谷字ウベ沢原2559番地6,1150,20250517
すき家,東京都,すき家 二子玉川駅前店,東京都世田谷区玉川2-22-13,1250,20250517
