松屋,埼玉県,すし松 エキアプレミエ和光市駅店,埼玉県和光市本町4-7,1400,20231216,1200,200
松屋,神奈川,ステーキ屋松 新杉田店,神奈川県横浜市磯子区新杉田町3-1ステート新杉田103,1400,20231216,1200,200
松屋,広島県,松のや 紙屋町店,広島県広島市中区紙屋町2-2-26 山本ビル,1100,20231216,1050,50
松屋,広島県,松屋 KOKO HOTEL広島駅前店,広島県広島市南区京橋町10-3,1100,20231216,1050,50
松屋,広島県,松屋 広島胡町店,広島県広島市中区胡町1-20永井興産胡町ビル1階,1100,20231216,1050,50
松屋,広島県,松屋 広島紙屋町店,広島県広島市中区大手町1-4-5 アロハビル1階,1100,20231216,1050,50
松屋,広島県,松屋 広島千田店,広島県広島市中区東千田町2-3-23,1100,20231216,1050,50
松屋,栃木県,松屋 小山店/松のや 小山店,栃木県小山市駅南町6-28-22,1250,20231216,1050,200
松屋,埼玉県,松屋 草加西口店,埼玉県草加市氷川町2125-4 ウシヤマビル,1250,20231216,1050,200
松屋,埼玉県,松屋 南越谷店,埼玉県越谷市南越谷1-19-8 吉澤第一ビル1F,1250,20231216,1050,200
松屋,広島県,松屋 廿日市店,広島県廿日市市串戸1-12-5,1100,20231216,1050,50
すき家,静岡県,すき家 135号伊東吉田店,静岡県伊東市吉田346-1,1130,20231216,1050,80
すき家,静岡県,すき家 136号三島店,静岡県三島市安久146-3,1120,20231216,1050,70
すき家,新潟県,すき家 17号魚沼店,新潟県魚沼市井口新田277-1,1050,20231216,1030,20
すき家,新潟県,すき家 17号六日町IC東店,新潟県南魚沼市美佐島516-4,1100,20231216,1080,20
すき家,長野県,すき家 19号塩尻広丘店,長野県塩尻市広丘野村1503-1,1100,20231216,1050,50
すき家,長野県,すき家 19号松本高宮店,長野県松本市高宮東1-25,1100,20231216,1050,50
すき家,長野県,すき家 19号松本村井店,長野県松本市村井町北2-8-45,1100,20231216,1050,50
すき家,静岡県,すき家 1国富士鮫島店,静岡県富士市鮫島360-1,1150,20231216,1050,100
すき家,山梨県,すき家 20号甲斐竜王店,山梨県甲斐市富竹新田1279-1,1070,20231216,1050,20
すき家,山梨県,すき家 20号甲府向町店,山梨県甲府市向町729-1,1070,20231216,1030,40
すき家,山梨県,すき家 20号笛吹一宮店,山梨県笛吹市一宮町東原25-1,1070,20231216,1030,40
すき家,新潟県,すき家 289号三条東裏館店,新潟県三条市東裏館3-1-7,1050,20231216,1000,50
すき家,山梨県,すき家 52号甲府宝店,山梨県甲府市宝2-25-8,1070,20231216,1030,40
すき家,福島県,すき家 いわき平店,福島県いわき市平谷川瀬1丁目5-7、5-14,1200,20231216,1030,170
すき家,山梨県,すき家 フォレストモール富士川店,山梨県南巨摩郡富士川町青柳町973-1,1070,20231216,1050,20
すき家,静岡県,すき家 伊東桜木店,静岡県伊東市桜木町1-3-18,1130,20231216,1080,50
すき家,新潟県,すき家 燕三条店,新潟県三条市下須頃字八枚田241-1,1050,20231216,1000,50
すき家,長野県,すき家 塩尻志学館高校前店,長野県塩尻市広丘高出1486-230,1100,20231216,1050,50
すき家,山梨県,すき家 甲斐島上条店,山梨県甲斐市島上条207-1,1070,20231216,1030,40
すき家,山梨県,すき家 甲府アルプス通り店,山梨県中巨摩郡昭和町西条2707-1,1100,20231216,1050,50
すき家,山梨県,すき家 甲府国玉店,山梨県甲府市国玉町975-1,1070,20231216,1030,40
すき家,新潟県,すき家 十日町店,新潟県十日町市上島601-1,1100,20231216,1080,20
すき家,長野県,すき家 松本出川店,長野県松本市出川3-6-10,1100,20231216,1050,50
すき家,新潟県,すき家 新潟笹口店,新潟県新潟市中央区南笹口2-1-60,1050,20231216,1000,50
すき家,静岡県,すき家 静岡安西店,静岡県静岡市葵区安西1-2-18,1100,20231216,1080,20
すき家,静岡県,すき家 静岡流通通り店,静岡県静岡市葵区千代田7-9-25,1150,20231216,1100,50
すき家,山梨県,すき家 富士吉田赤富士通り店,山梨県富士吉田市上吉田東2丁目1-50,1200,20231216,1100,100
すき家,静岡県,すき家 富士今泉店,静岡県富士市今泉1-70-4,1200,20231216,1050,150
