すき家,東京都,すき家 高島平駅前店,東京都板橋区高島平8-11-11SDビル,1250,20240302,1200,50
すき家,茨城県,すき家 高萩店,茨城県高萩市東本町3-22-2,1050,20240302,1020,30
すき家,東京都,すき家 高幡不動駅店,東京都日野市高幡116-10京王高幡SC1階A106号区画,1150,20240302,1130,20
すき家,東京都,すき家 豪徳寺駅前店,東京都世田谷区豪徳寺1-25-7ニ-ナロ-ジナビル,1300,20240302,1250,50
すき家,東京都,すき家 国分寺本多店,東京都国分寺市本多2-16-1,1150,20240302,1130,20
すき家,東京都,すき家 桜上水駅前店,東京都世田谷区桜上水4-10-16間瀬ビル1F,1250,20240302,1200,50
すき家,東京都,すき家 桜新町駅前店,東京都世田谷区桜新町1-12-13第5吉田ビル1F,1300,20240302,1250,50
すき家,東京都,すき家 桜新道南大井店,東京都品川区南大井3-7-20,1300,20240302,1250,50
すき家,茨城県,すき家 桜土浦IC店,茨城県つくば市下広岡字向山1055-321,1050,20240302,1000,50
すき家,東京都,すき家 笹塚店,東京都渋谷区笹塚2-19-2TSK笹塚ビル,1250,20240302,1200,50
すき家,東京都,すき家 三河島駅前店,東京都荒川区東日暮里6-1-1アトラスブランズタワー三河島1F,1250,20240302,1200,50
すき家,東京都,すき家 三軒茶屋二丁目店,東京都世田谷区三軒茶屋2-11-24サンタワ-ズA101,1350,20240302,1300,50
すき家,東京都,すき家 三軒茶屋北店,東京都世田谷区太子堂2-24-6ドミ-三軒茶屋1F,1350,20240302,1300,50
すき家,広島県,すき家 三原店,広島県三原市皆実町3-1-1,1050,20240302,1000,50
すき家,東京都,すき家 三鷹井口店,東京都三鷹市井口2-13-42,1250,20240302,1200,50
すき家,東京都,すき家 三鷹駅南口店,東京都三鷹市下連雀3-23-12ア-ジェントビル,1230,20240302,1200,30
すき家,東京都,すき家 三鷹牟礼店,東京都三鷹市牟礼4-8-7,1230,20240302,1200,30
すき家,東京都,すき家 三田店,東京都港区芝5-25-9,1380,20240302,1350,30
すき家,山形県,すき家 山形城西店,山形県山形市城西町4-19-19,1000,20240302,980,20
すき家,山形県,すき家 山形大野目店,山形県山形市大野目4-2-24,1000,20240302,980,20
すき家,東京都,すき家 柴又街道小岩店,東京都江戸川区東小岩6-3-5,1210,20240302,1160,50
すき家,東京都,すき家 芝浦四丁目店,東京都港区芝浦4-9-18グランドパレス田町1F,1380,20240302,1350,30
すき家,東京都,すき家 芝四丁目店,東京都港区芝4-7-1西山ビル1F,1380,20240302,1350,30
すき家,茨城県,すき家 取手中央タウン店,茨城県取手市西1-31-29,1050,20240302,1000,50
すき家,東京都,すき家 秋葉原駅岩本町店,東京都千代田区岩本町3-3-5秋葉原SHビル1F,1300,20240302,1250,50
すき家,東京都,すき家 住吉新大橋通店,東京都江東区住吉2-2-7住吉Sビル1F,1250,20240302,1200,50
すき家,群馬県,すき家 渋川有馬店,群馬県渋川市有馬186-1,1100,20240302,1050,50
すき家,東京都,すき家 渋谷円山町店,東京都渋谷区円山町28-4大場ビル1F,1400,20240302,1350,50
すき家,東京都,すき家 渋谷桜丘店,東京都渋谷区桜丘町15-19,1380,20240302,1350,30
すき家,東京都,すき家 渋谷南平台店,東京都渋谷区南平台町1-10いちご南平台ビル1F,1400,20240302,1350,50
すき家,東京都,すき家 渋谷二丁目店,東京都渋谷区渋谷2-12-13八千代ビル1F,1400,20240302,1350,50
すき家,東京都,すき家 曙橋店,東京都新宿区住吉町8-25,1250,20240302,1200,50
すき家,東京都,すき家 勝どき三丁目店,東京都中央区勝どき3-7-6,1300,20240302,1250,50
すき家,東京都,すき家 小金井中町店,東京都小金井市中町2-8-2,1200,20240302,1150,50
すき家,東京都,すき家 小平中島町店,東京都小平市中島町22-19,1180,20240302,1150,30
すき家,東京都,すき家 小平鈴木店,東京都小平市鈴木町1-215-3,1180,20240302,1150,30
すき家,東京都,すき家 昭島駅南店,東京都昭島市昭和町5-14-17,1150,20240302,1130,20
すき家,愛媛県,すき家 松山はなみずき通り店,愛媛県松山市古川北2-172-1,1000,20240302,950,50
すき家,愛媛県,すき家 松山空港通店,愛媛県松山市空港通4-7-8,1000,20240302,950,50
すき家,愛媛県,すき家 松山枝松店,愛媛県松山市枝松1-9-16,1000,20240302,950,50
すき家,愛媛県,すき家 松山大街道店,愛媛県松山市大街道2-5-6だるまやビル1F,1000,20240302,950,50
すき家,愛媛県,すき家 松山南江戸店,愛媛県松山市南江戸2-7-6,1000,20240302,950,50
すき家,愛媛県,すき家 松山問屋町店,愛媛県松山市問屋町4-17,1000,20240302,950,50
すき家,群馬県,すき家 沼田IC店,群馬県沼田市下久屋町1043-1,1120,20240302,1080,40
すき家,東京都,すき家 上石神井駅前店,東京都練馬区上石神井1-13-17,1250,20240302,1200,50
すき家,東京都,すき家 上池袋二丁目店,東京都豊島区上池袋2-40-10ニューキャッスル上池袋1F,1300,20240302,1250,50
すき家,東京都,すき家 上池台三丁目店,東京都大田区上池台3-13-3,1300,20240302,1250,50
すき家,東京都,すき家 新橋三丁目店,東京都港区新橋3-10-9ホテル新橋三番館1F,1330,20240302,1280,50
すき家,東京都,すき家 新御徒町店,東京都台東区東上野1-1-1,1300,20240302,1250,50
すき家,東京都,すき家 新高円寺東店,東京都杉並区梅里1-7-17,1250,20240302,1200,50
すき家,東京都,すき家 新高島平駅南店,東京都板橋区高島平4-23-17アルテ-ル藤久,1250,20240302,1200,50
すき家,東京都,すき家 新宿NSビル店,東京都新宿区西新宿2-4-1新宿NSビル1F,1350,20240302,1320,30
すき家,東京都,すき家 新宿御苑前駅店,東京都新宿区新宿1-19-7新花ビル1F,1330,20240302,1300,30
すき家,東京都,すき家 新宿南店,東京都新宿区新宿3-32-2,1350,20240302,1320,30
すき家,東京都,すき家 新宿二丁目店,東京都新宿区新宿2-15-15新宿ヤマトビル1F,1330,20240302,1300,30
すき家,東京都,すき家 新宿六丁目店,東京都新宿区新宿6-28-10,1330,20240302,1300,30
すき家,東京都,すき家 新小岩店,東京都葛飾区西新小岩1-9-7,1210,20240302,1160,50
すき家,東京都,すき家 新青梅街道花小金井店,東京都小平市花小金井3-21-14,1180,20240302,1150,30
すき家,東京都,すき家 新青梅街道東村山店,東京都東村山市富士見町3-2-1,1180,20240302,1150,30
すき家,群馬県,すき家 新田市野井店,群馬県太田市新田市野井町771-1,1060,20240302,1010,50
すき家,東京都,すき家 新木場駅南店,東京都江東区新木場1-4-7,1350,20240302,1280,70
すき家,東京都,すき家 森下店,東京都江東区森下2-18-8,1300,20240302,1250,50
すき家,東京都,すき家 神宮前三丁目店,東京都渋谷区神宮前3-23-3トリニティビル1F,1380,20240302,1350,30
すき家,東京都,すき家 神保町駅前店,東京都千代田区神田神保町1-14KDX神保町ビル1F,1350,20240302,1250,100
すき家,茨城県,すき家 水戸駅南口店,茨城県水戸市宮町1-7-44COMBOX310-302号室,1030,20240302,1000,30
すき家,東京都,すき家 水道橋駅東口店,東京都千代田区神田三崎町1-4-26,1300,20240302,1250,50
すき家,東京都,すき家 瑞江店,東京都江戸川区瑞江2-1-23田所ビル1F,1210,20240302,1160,50
すき家,東京都,すき家 世田谷赤堤通り店,東京都世田谷区桜上水2-1-8,1250,20240302,1200,50
すき家,東京都,すき家 成城学園駅前店,東京都世田谷区成城2-35-12,1300,20240302,1250,50
すき家,東京都,すき家 成増店,東京都板橋区成増2-18-7吉田屋第一ビル1F,1250,20240302,1200,50
すき家,東京都,すき家 晴海二丁目店,東京都中央区晴海2-5-24晴海センタービル1F,1300,20240302,1250,50
すき家,東京都,すき家 西永福店,東京都杉並区永福3-56-30,1200,20240302,1150,50
すき家,東京都,すき家 西葛西一丁目店,東京都江戸川区西葛西1-15-9スカイビル,1250,20240302,1200,50
すき家,東京都,すき家 西葛西駅前店,東京都江戸川区西葛西6-8-11葛西産業ビル,1250,20240302,1200,50
すき家,東京都,すき家 西五反田一丁目店,東京都品川区西五反田1-24-4タキゲンビル1F,1350,20240302,1300,50
すき家,東京都,すき家 西五反田七丁目店,東京都品川区西五反田7-13-5DK五反田ビル,1350,20240302,1300,50
すき家,東京都,すき家 西国分寺駅前店,東京都国分寺市西恋ヶ窪2-5-1積丹ビル1F,1180,20240302,1150,30
すき家,東京都,すき家 西新宿五丁目駅前店,東京都新宿区西新宿4-3-12渡辺西新宿ビル1F,1350,20240302,1300,50
すき家,東京都,すき家 西新宿小滝橋通り店,東京都新宿区西新宿7-10-16千徳ビル,1350,20240302,1300,50
すき家,埼玉県,すき家 西川口駅前店,埼玉県川口市西川口1-5-3福原ビル,1130,20240302,1080,50
すき家,東京都,すき家 西台駅西店,東京都板橋区高島平1-75-15高桐マンション1F,1250,20240302,1200,50
すき家,宮崎県,すき家 西都右松店,宮崎県西都市右松3-33,970,20240302,950,20
すき家,東京都,すき家 西日暮里一丁目店,東京都荒川区西日暮里1-1-1パレスいしかわ1F,1250,20240302,1200,50
すき家,東京都,すき家 青梅河辺店,東京都青梅市河辺町5-25-1,1150,20240302,1130,20
すき家,東京都,すき家 青梅新町店,東京都青梅市新町7-6-10,1150,20240302,1130,20
すき家,東京都,すき家 赤羽南口店,東京都北区赤羽1-1-24,1250,20240302,1200,50
すき家,東京都,すき家 赤坂六丁目店,東京都港区赤坂6-3-1アスモビル,1380,20240302,1320,60
すき家,大阪府,すき家 摂津鳥飼中店,大阪府摂津市鳥飼中2-2-50,1150,20240302,1100,50
すき家,大阪府,すき家 摂津南別府店,大阪府摂津市南別府町3-19,1120,20240302,1100,20
すき家,東京都,すき家 仙川店,東京都調布市仙川町1-11-13大平ビル1F,1200,20240302,1180,20
すき家,東京都,すき家 千歳船橋駅前店,東京都世田谷区船橋1-9-24千歳船橋振興組合会館1F,1250,20240302,1200,50
すき家,東京都,すき家 千川駅前店,東京都豊島区要町3-10-10,1250,20240302,1200,50
すき家,埼玉県,すき家 川口駅東口店,埼玉県川口市栄町3-9-13K21ビル1F,1130,20240302,1080,50
すき家,埼玉県,すき家 川口芝店,埼玉県川口市芝宮根町7-2,1130,20240302,1100,30
すき家,神奈川,すき家 川崎下麻生店,神奈川県川崎市麻生区下麻生3-46-6,1230,20240302,1200,30
すき家,神奈川,すき家 川崎今井店,神奈川県川崎市中原区今井西町1-56,1250,20240302,1200,50
すき家,神奈川,すき家 川崎潮見台店,神奈川県川崎市宮前区潮見台10-2,1200,20240302,1140,60
すき家,神奈川,すき家 川崎木月店,神奈川県川崎市中原区木月3-53-7,1220,20240302,1140,80
すき家,東京都,すき家 浅草橋駅前店,東京都台東区柳橋1-23-3田中ビル1F,1300,20240302,1250,50
すき家,東京都,すき家 浅草六区店,東京都台東区浅草2-9-14木村ビル1F,1300,20240302,1250,50
すき家,東京都,すき家 船堀駅前店,東京都江戸川区船堀3-5-7船堀駅前トキビル1F,1210,20240302,1160,50
すき家,群馬県,すき家 前橋下小出店,群馬県前橋市下小出町1-8-13,1100,20240302,1050,50
すき家,群馬県,すき家 前橋大渡町店,群馬県前橋市大渡町1-1-1,1100,20240302,1050,50
すき家,群馬県,すき家 前橋南店,群馬県前橋市南町2-46-6,1100,20240302,1050,50
すき家,群馬県,すき家 前橋堀越店,群馬県前橋市堀越町366-1,1100,20240302,1050,50
すき家,群馬県,すき家 前橋野中町店,群馬県前橋市野中町50-1,1100,20240302,1050,50
すき家,鳥取県,すき家 倉吉伊木店,鳥取県倉吉市伊木241-18,1020,20240302,1000,20
すき家,東京都,すき家 蔵前駅前店,東京都台東区蔵前2-6-6,1300,20240302,1250,50
すき家,東京都,すき家 足立一ツ家店,東京都足立区一ツ家1-15-6,1220,20240302,1160,60
すき家,東京都,すき家 足立栗原店,東京都足立区栗原4-9-6荒堀ビル1F,1220,20240302,1160,60
すき家,東京都,すき家 足立鹿浜店,東京都足立区鹿浜2-34-17,1210,20240302,1160,50
すき家,東京都,すき家 足立西綾瀬店,東京都足立区西綾瀬3-11-13,1220,20240302,1160,60
すき家,東京都,すき家 足立扇店,東京都足立区扇2-26-42,1210,20240302,1160,50
すき家,東京都,すき家 足立入谷店,東京都足立区入谷7-1-7フーファイゼンハウス1F,1210,20240302,1160,50
すき家,東京都,すき家 足立六木店,東京都足立区六木2-7-8,1220,20240302,1160,60
すき家,東京都,すき家 多摩乞田店,東京都多摩市乞田791-1,1160,20240302,1140,20
すき家,群馬県,すき家 太田内ヶ島店,群馬県太田市内ヶ島町1492-5,1110,20240302,1050,60
すき家,群馬県,すき家 太田南矢島店,群馬県太田市南矢島町928-1,1100,20240302,1050,50
すき家,東京都,すき家 代々木一丁目店,東京都渋谷区代々木1-37-6,1350,20240302,1300,50
すき家,東京都,すき家 台東下谷店,東京都台東区下谷3-19-8,1250,20240302,1200,50
すき家,東京都,すき家 大井町一丁目店,東京都品川区大井1-16-2ブリリア大井町ラヴィアンタワ-1F,1300,20240302,1250,50
すき家,東京都,すき家 大久保二丁目店,東京都新宿区大久保2-6-18,1300,20240302,1250,50
すき家,東京都,すき家 大久保百人町店,東京都新宿区百人町1-16-14マキバビル1F,1300,20240302,1250,50
すき家,東京都,すき家 大山東町店,東京都板橋区大山東町22-8,1250,20240302,1200,50
すき家,東京都,すき家 大森ベルポート店,東京都品川区南大井6-26-3大森ベルポートD館1F,1300,20240302,1250,50
すき家,東京都,すき家 大森駅西口店,東京都大田区山王2-4-4,1300,20240302,1250,50
すき家,東京都,すき家 大森町駅前店,東京都大田区大森西3-25-7エストジュール大森町1F、2F,1300,20240302,1250,50
すき家,東京都,すき家 大森北三丁目店,東京都大田区大森北3-1-13,1300,20240302,1250,50
すき家,東京都,すき家 大鳥居店,東京都大田区西糀谷3-21-2,1300,20240302,1250,50
すき家,東京都,すき家 大田久が原店,東京都大田区久が原5-3-6,1300,20240302,1250,50
すき家,東京都,すき家 大田東邦医大通店,東京都大田区大森西1-8-17,1300,20240302,1250,50
すき家,東京都,すき家 大田南六郷店,東京都大田区南六郷2-34-7,1300,20240302,1250,50
すき家,大分県,すき家 大分明野店,大分県大分市明野東2-32-26,1000,20240302,950,50
すき家,東京都,すき家 第一京浜鮫洲店,東京都品川区東大井4-7-11,1300,20240302,1250,50
すき家,東京都,すき家 池上通り中央店,東京都大田区中央7-3-1カバヤビル1F,1300,20240302,1250,50
すき家,東京都,すき家 池袋サンシャイン前店,東京都豊島区東池袋4-25-9タイムズステーション池袋,1300,20240302,1250,50
すき家,東京都,すき家 池袋西店,東京都豊島区西池袋2-39-11,1280,20240302,1250,30
すき家,東京都,すき家 築地四丁目店,東京都中央区築地4-12-2シグネットビル1F,1300,20240302,1250,50
すき家,東京都,すき家 竹芝店,東京都港区海岸1-9-11,1380,20240302,1350,30
すき家,東京都,すき家 中葛西店,東京都江戸川区中葛西6-1-10メゾンド佐久間Ⅱ,1250,20240302,1200,50
すき家,大阪府,すき家 中環大日店,大阪府門真市向島3-35ベア-ズA棟,1150,20240302,1100,50
すき家,北海道,すき家 中標津店,北海道標津郡中標津町東6条南11-1-2,1080,20240302,1020,60
すき家,東京都,すき家 潮見店,東京都江東区潮見2-10-22,1300,20240302,1250,50
すき家,東京都,すき家 町田高ヶ坂店,東京都町田市高ヶ坂6-4-1,1160,20240302,1140,20
すき家,東京都,すき家 町田小山店,東京都町田市小山町959-1,1150,20240302,1130,20
すき家,東京都,すき家 町田能ヶ谷店,東京都町田市能ヶ谷町7-12-11,1160,20240302,1140,20
すき家,東京都,すき家 調布入間店,東京都調布市入間町2-4-1,1200,20240302,1180,20
すき家,京都府,すき家 長岡天神駅前店,京都府長岡京市天神1-1-2マルオカビル1F,1080,20240302,1050,30
すき家,東京都,すき家 長原駅東店,東京都大田区上池台1-44-1ライオンズマンション102,1300,20240302,1250,50
すき家,神奈川,すき家 鶴見市場駅前店,神奈川県横浜市鶴見区市場大和町8-8戸川ビル1F,1200,20240302,1180,20
すき家,茨城県,すき家 土浦荒川沖店,茨城県土浦市荒川沖東2-17-10,1030,20240302,1000,30
すき家,茨城県,すき家 土浦店,茨城県土浦市東崎町11-3,1050,20240302,1000,50
すき家,東京都,すき家 東雲晴海通り店,東京都江東区東雲1-6-17,1300,20240302,1250,50
すき家,茨城県,すき家 東海店,茨城県那珂郡東海村村松1151-6,1050,20240302,1020,30
すき家,東京都,すき家 東久留米下里店,東京都東久留米市下里2-6-7,1180,20240302,1150,30
すき家,東京都,すき家 東京駅京橋店,東京都中央区京橋1-1-9レオ八重洲ビル,1350,20240302,1300,50
すき家,広島県,すき家 東広島御薗宇店,広島県東広島市西条町御薗宇下上戸6487-1,1050,20240302,1000,50
すき家,広島県,すき家 東広島八本松店,広島県東広島市八本松東2-10-8,1050,20240302,1000,50
すき家,東京都,すき家 東高円寺駅前店,東京都杉並区高円寺南1-7-1陽輪台高円寺1F,1250,20240302,1200,50
すき家,東京都,すき家 東十条三丁目店,東京都北区東十条3-15-12シティハイツ東十条103,1250,20240302,1200,50
すき家,東京都,すき家 東村山秋津店,東京都東村山市秋津町3-47-3,1180,20240302,1150,30
すき家,東京都,すき家 東池袋五丁目店,東京都豊島区東池袋5-7-7金誠堂ビル1F,1300,20240302,1250,50
すき家,東京都,すき家 東池袋店,東京都豊島区東池袋1-31-1バロックコート101号室,1300,20240302,1250,50
すき家,東京都,すき家 等々力駅前店,東京都世田谷区等々力3-5-6,1250,20240302,1200,50
すき家,群馬県,すき家 藤岡IC店,群馬県藤岡市中栗須14-6,1100,20240302,1050,50
すき家,徳島県,すき家 徳島住吉店,徳島県徳島市住吉4-41,1000,20240302,950,50
すき家,徳島県,すき家 徳島大原店,徳島県徳島市大原町千代ケ丸山5-1,1000,20240302,950,50
すき家,沖縄県,すき家 那覇曙店,沖縄県那覇市曙2-23-1,1000,20240302,950,50
すき家,東京都,すき家 南葛西店,東京都江戸川区南葛西2-2-2第2サクマビル1F,1250,20240302,1200,50
すき家,高知県,すき家 南国BP店,高知県南国市明見字大政所960-1,1000,20240302,950,50
すき家,東京都,すき家 南砂店,東京都江東区南砂5-14-6サーハンビル,1250,20240302,1200,50
すき家,東京都,すき家 二子玉川駅前店,東京都世田谷区玉川2-22-13,1250,20240302,1200,50
すき家,福島県,すき家 二本松店,福島県二本松市松岡265-10,980,20240302,950,30
すき家,東京都,すき家 日の出IC店,東京都西多摩郡日の出町平井15-16,1200,20240302,1150,50
すき家,東京都,すき家 日本橋小伝馬町店,東京都中央区日本橋小伝馬町15-18EDGE小伝馬町ビル1F,1300,20240302,1250,50
すき家,東京都,すき家 日野大坂上店,東京都日野市大坂上1-29-2-1,1150,20240302,1130,20
すき家,東京都,すき家 日野南平店,東京都日野市南平4-40-1,1150,20240302,1130,20
すき家,東京都,すき家 梅屋敷駅東店,東京都大田区東蒲田1-1-1プラムパーク嶋田1F,1300,20240302,1250,50
すき家,東京都,すき家 幡ヶ谷駅前店,東京都渋谷区幡ヶ谷1-33-1シャト-フタバ1F,1250,20240302,1200,50
すき家,東京都,すき家 八王子みなみ野駅前店,東京都八王子市みなみ野1-3-1,1150,20240302,1130,20
すき家,東京都,すき家 八王子小宮店,東京都八王子市小宮町924-1,1150,20240302,1130,20
すき家,東京都,すき家 八王子東町店,東京都八王子市東町5-5,1150,20240302,1130,20
すき家,東京都,すき家 八王子楢原店,東京都八王子市楢原町397-5,1150,20240302,1130,20
すき家,東京都,すき家 八王子南店,東京都八王子市越野25-34,1150,20240302,1130,20
すき家,東京都,すき家 八王子平岡店,東京都八王子市平岡町25-2,1150,20240302,1130,20
すき家,東京都,すき家 八王子椚田店,東京都八王子市椚田町580-2メゾンくぬぎだ1F,1150,20240302,1130,20
すき家,東京都,すき家 八丁堀四丁目店,東京都中央区八丁堀4-8-2いちご桜橋ビル1F,1330,20240302,1280,50
すき家,埼玉県,すき家 八潮西袋店,埼玉県八潮市西袋1030-1,1100,20240302,1080,20
すき家,京都府,すき家 八幡店,京都府八幡市八幡五反田39-4,1080,20240302,1050,30
すき家,埼玉県,すき家 鳩ヶ谷里店,埼玉県川口市里466-1,1100,20240302,1080,20
すき家,東京都,すき家 飛田給店,東京都調布市飛田給1-23-38荒井ビル,1200,20240302,1180,20
すき家,東京都,すき家 氷川台駅前店,東京都練馬区氷川台3-40-15氷川ガ-デンハウス1F,1250,20240302,1200,50
すき家,東京都,すき家 品川シーサイド店,東京都品川区東品川4-12-4品川シーサイドパークタワー1階,1400,20240302,1350,50
すき家,東京都,すき家 品川東店,東京都港区港南2-2-3Mビル1F,1380,20240302,1350,30
すき家,東京都,すき家 不動前駅西店,東京都品川区西五反田4-29-14オザワSANTビル1F,1300,20240302,1250,50
すき家,東京都,すき家 府中けやき並木通り店,東京都府中市宮西町2-21F,1200,20240302,1150,50
すき家,東京都,すき家 府中栄店,東京都府中市栄町2-22-1,1200,20240302,1150,50
すき家,東京都,すき家 府中浅間店,東京都府中市浅間町4-19-1,1200,20240302,1150,50
すき家,東京都,すき家 府中本宿店,東京都府中市本宿町4-29-1,1200,20240302,1150,50
すき家,東京都,すき家 武蔵境北口店,東京都武蔵野市境2-3-26,1180,20240302,1130,50
すき家,東京都,すき家 武蔵小金井南口店,東京都小金井市本町6-14-45O.Sビル1F,1200,20240302,1130,70
すき家,東京都,すき家 武蔵小金井北口店,東京都小金井市本町5-18-5第55東京ビル,1200,20240302,1130,70
すき家,東京都,すき家 武蔵小山店,東京都品川区小山3-25-13,1300,20240302,1250,50
すき家,東京都,すき家 福生店,東京都福生市加美平1-19-7,1150,20240302,1130,20
すき家,東京都,すき家 文京白山店,東京都文京区向丘1-10-4,1250,20240302,1200,50
すき家,神奈川,すき家 保土ヶ谷今井店,神奈川県横浜市保土ヶ谷区今井町600-1,1230,20240302,1180,50
すき家,東京都,すき家 豊洲四丁目店,東京都江東区豊洲4-8-14,1300,20240302,1250,50
すき家,東京都,すき家 豊田駅前店,東京都日野市多摩平1-2-26シンデレラビル1F,1150,20240302,1130,20
すき家,福岡県,すき家 北九州空港通り店,福岡県京都郡苅田町大字苅田3787-11,1050,20240302,1000,50
すき家,東京都,すき家 北新宿一丁目店,東京都新宿区北新宿1-12-12サンエスビル1F,1300,20240302,1270,30
すき家,東京都,すき家 北赤羽駅浮間口店,東京都北区浮間3-28-9,1250,20240302,1200,50
すき家,東京都,すき家 北千住西口店,東京都足立区千住3-1-10,1210,20240302,1160,50
すき家,東京都,すき家 末広町店,東京都千代田区外神田6-15-14,1300,20240302,1250,50
すき家,東京都,すき家 木場店,東京都江東区木場5-11-19達摩堂ビル1F,1300,20240302,1250,50
すき家,東京都,すき家 目黒三丁目店,東京都目黒区目黒3-9-3目黒パークスクエア102号室,1300,20240302,1250,50
すき家,東京都,すき家 目白通り高野台店,東京都練馬区高野台2-5-15,1250,20240302,1200,50
すき家,大阪府,すき家 門真下馬伏店,大阪府門真市下馬伏町26-6,1150,20240302,1100,50
すき家,大阪府,すき家 門真中央店,大阪府門真市大池町16-25,1120,20240302,1100,20
すき家,徳島県,すき家 藍住笠木店,徳島県板野郡藍住町笠木字中野71-2,1000,20240302,980,20
すき家,東京都,すき家 立会川店,東京都品川区南大井1-6-10加藤ビル1F,1300,20240302,1250,50
すき家,東京都,すき家 溜池山王店,東京都港区赤坂1-5-2外堀通ビル1F,1350,20240302,1320,30
すき家,東京都,すき家 練馬関町南店,東京都練馬区関町南1-11-2,1250,20240302,1200,50
すき家,東京都,すき家 練馬南大泉店,東京都練馬区南大泉1-17-17,1250,20240302,1200,50
すき家,東京都,すき家 蓮根駅西店,東京都板橋区蓮根2-29-6蓮根ビル1F,1250,20240302,1200,50
すき家,東京都,すき家 六本木五丁目店,東京都港区六本木5-9-22第2千陽ビル1F,1380,20240302,1320,60
すき家,大阪府,すき家 和泉はつが野店,大阪府和泉市はつが野1-1-13,1120,20240302,1100,20
すき家,東京都,すき家 糀谷店,東京都大田区南蒲田3-3-1こうじや駅前ビル1F,1300,20240302,1250,50
すき家,東京都,すき家 鶯谷店,東京都台東区根岸1-6-10,1300,20240302,1250,50
