松屋,東京都,松屋　ひばりが丘店,東京都西東京市ひばりが丘北3-3-14,1020,1050,30
松屋,東京都,松屋　下北沢店,東京都世田谷区北沢2-19-13松本ビル1F,1150,1250,100
松屋,兵庫県,松屋　加古川平岡町店,兵庫県加古川市平岡町一色370-1,900,950,50
松屋,兵庫県,松屋　加古川野口町店,兵庫県加古川市野口町坂元坂之下36-1,900,930,30
松屋,東京都,松屋　久米川店,東京都東村山市栄町1-5-2,1020,1050,30
松屋,神奈川,松屋　向ヶ丘遊園店,神奈川県川崎市多摩区登戸2737-4タカノビル1F・2F,1050,1100,50
松屋,東京都,松屋　高井戸店,東京都杉並区高井戸西1-29-3,1020,1100,80
松屋,静岡県,松屋　三島店,静岡県三島市玉川243-1,950,1000,50
松屋,東京都,松屋　小平小川店,東京都小平市小川東町5-2-5,1020,1050,30
松屋,東京都,松屋　小平店,東京都小平市美園町1-3-9,1020,1050,30
松屋,静岡県,松屋　沼津店,静岡県沼津市筒井町9-7,950,1000,50
松屋,静岡県,松屋　沼津南店,静岡県沼津市上香貫字三園町1372番地,950,1000,50
松屋,東京都,松屋　新高円寺店,東京都杉並区高円寺南2-20-2新高円寺駅前ビル1F2F,1020,1100,80
松屋,東京都,松屋　深大寺3丁目店,東京都三鷹市深大寺3-8-7,1020,1100,80
松屋,東京都,松屋　清瀬店,東京都清瀬市松山1-11-17,1020,1050,30
松屋,東京都,松屋　清瀬野塩店,東京都清瀬市野塩4-224-1,1020,1050,30
松屋,神奈川,松屋　生田店,神奈川県川崎市多摩区生田7-8-9,1050,1100,50
松屋,東京都,松屋　千歳烏山店,東京都世田谷区南烏山4-12-4スギウラビル1F,1100,1200,100
松屋,埼玉県,松屋　大宮東口店,埼玉県さいたま市大宮区宮町1-5,1050,1100,50
松屋,東京都,松屋　大泉学園南口店,東京都練馬区東大泉5-41-14エクラン大泉1F,1040,1050,10
松屋,東京都,松屋　鷹の台店,東京都小平市たかの台44-8長谷川ビル,1020,1050,30
松屋,東京都,松屋　調布駅前店,東京都調布市布田1-40-10アルソス調布駅前北口ビル,1100,1200,100
松屋,東京都,松屋　東久留米下里店,東京都東久留米市下里3-24-12,1020,1050,30
松屋,東京都,松屋　東久留米店,東京都東久留米市東本町1-8たちばなやビル,1020,1050,30
松屋,東京都,松屋　東高円寺店,東京都杉並区高円寺南1-6-5サマリヤマンション1F,1020,1100,80
松屋,東京都,松屋　東村山店,東京都東村山市本町2-3-77吉崎ビル1F,1020,1050,30
松屋,東京都,松屋　東大和市駅前店,東京都東大和市南街5-93-13ビル・エール1階,1020,1050,30
松屋,東京都,松屋　東大和清水店,東京都東大和市清水5-1095-7,1020,1050,30
松屋,兵庫県,松屋　播磨町店,兵庫県加古郡播磨町南大中3-3-28,900,930,30
松屋,東京都,松屋　武蔵村山店,東京都武蔵村山市学園3-37-2,1020,1050,30
松屋,東京都,松屋　保谷店,東京都西東京市東町3-14-26マイティビル1F,1020,1050,30
