松屋,富山県,松のや グリーンモール山室店,富山県富山市中市10-4,1100,20240720
松屋,兵庫県,松屋 JR尼崎店,兵庫県尼崎市長洲本通1-4-2 レジュールアッシュ尼崎駅前,1100,20240720
松屋,岩手県,松屋 アクロスプラザ盛岡店/松のや アクロスプラザ盛岡店,岩手県盛岡市津志田南1丁目1番6号,1050,20240720
松屋,京都府,松屋 ホテルユニゾ京都烏丸御池店,京都府京都市中京区堺町通押小路下る扇屋町661番,1050,20240720
松屋,兵庫県,松屋 伊丹店,兵庫県伊丹市南町3-1-3,1050,20240720
松屋,岩手県,松屋 一関店/松のや 一関店,岩手県一関市山目大槻6-109(地番),1000,20240720
松屋,茨城県,松屋 茨城東海店/松のや 茨城東海店,茨城県那珂郡東海村東海1-2-50,1000,20240720
松屋,栃木県,松屋 宇都宮オリオン通店,栃木県宇都宮市曲師町5-8 多喜屋ビル,1050,20240720
松屋,栃木県,松屋 宇都宮簗瀬町店,栃木県宇都宮市簗瀬町1984-6,1050,20240720
松屋,大阪府,松屋 岡町店,大阪府豊中市中桜塚1-1-1ティオ阪急岡町1階,1064,20240720
松屋,京都府,松屋 河原町店,京都府京都市中京区河原町通蛸薬師上る奈良屋町305番地,1150,20240720
松屋,秋田県,松屋 花輪SA（下り線）店,秋田県鹿角市花輪字火付け附森65-3,930,20240720
松屋,秋田県,松屋 花輪SA（上り線）店,秋田県鹿角市花輪張渡11-24,930,20240720
松屋,千葉県,松屋 我孫子若松店,千葉県我孫子市若松140-1,1100,20240720
松屋,大阪府,松屋 関大前店,大阪府吹田市千里山東1-14-5 吉本マンション1F,1080,20240720
松屋,大阪府,松屋 喜連瓜破店,大阪府大阪市平野区喜連2-5-47 村瀬ビル1F,1100,20240720
松屋,京都府,松屋 亀岡店,京都府亀岡市下矢田町2-35-5,1008,20240720
松屋,京都府,松屋 吉祥院店/松のや 吉祥院店,京都府京都市南区吉祥院西ノ茶屋町63番,1100,20240720
松屋,茨城県,松屋 牛久店,茨城県牛久市田宮町41-1,1050,20240720
松屋,京都府,松屋 京都三条店,京都府京都市中京区三条通河原町東入中島町97,1150,20240720
松屋,京都府,松屋 京都西院店,京都府京都市右京区西院高山寺町12-7,1010,20240720
松屋,石川県,松屋 金沢工大前店,石川県野々市市扇が丘8-8,1100,20240720
松屋,石川県,松屋 金沢示野店,石川県金沢市戸板西1-55,1100,20240720
松屋,石川県,松屋 金沢昌永町店,石川県金沢市昌永町18-5,1100,20240720
松屋,石川県,松屋 金沢神谷内店,石川県金沢市神谷内町二22-1,1100,20240720
松屋,石川県,松屋 金沢増泉店,石川県金沢市神田2-2-25,1100,20240720
松屋,京都府,松屋 桂店,京都府京都市西京区樫原盆山16-1,1100,20240720
松屋,栃木県,松屋 御幸本町店/松のや 御幸本町店,栃木県宇都宮市御幸本町4732-7,1050,20240720
松屋,大阪府,松屋 高槻市駅前店,大阪府高槻市城北町2-2-7,1100,20240720
松屋,大阪府,松屋 高槻南口店,大阪府高槻市高槻町9-22 吉廣第二ビル 1.2F,1100,20240720
松屋,東京都,松屋 高田馬場2丁目店,東京都新宿区高田馬場2-1-2,1300,20240720
松屋,東京都,松屋 高田馬場4丁目店,東京都新宿区高田馬場4-11-8 木村屋ビル1F,1300,20240720
松屋,東京都,松屋 高田馬場店,東京都新宿区高田馬場3-1-2,1300,20240720
松屋,富山県,松屋 黒部店/松のや 黒部店,富山県黒部市荻生1651番3,1200,20240720
松屋,兵庫県,松屋 今津店,兵庫県西宮市今津曙町1-1エキーマ今津1F,1100,20240720
松屋,兵庫県,松屋 阪神西宮店,兵庫県西宮市田中町2-3,1100,20240720
松屋,京都府,松屋 四条烏丸店,京都府京都市下京区烏丸通仏光寺下る大政所町677番地,1150,20240720
松屋,京都府,松屋 四条大宮駅前店,京都府京都市下京区四条通大宮東入立中町492,1010,20240720
松屋,東京都,松屋 四谷2丁目店,東京都新宿区四谷2-9 NK第7ビル,1250,20240720
松屋,東京都,松屋 市ヶ谷店,東京都千代田区九段北4-2-15,1300,20240720
松屋,福岡県,松屋 周船寺店/松のや 周船寺店,福岡県福岡市西区周船寺3-11-10,1000,20240720
松屋,千葉県,松屋 初石店,千葉県流山市西初石3-100-19,1150,20240720
松屋,千葉県,松屋 松戸古ヶ崎店/松のや 松戸古ヶ崎店,千葉県松戸市古ヶ崎1丁目3056,1200,20240720
松屋,新潟県,松屋 上越藤野店/松のや 上越藤野店,新潟県上越市藤野新田1259,1050,20240720
松屋,大阪府,松屋 上新庄店,大阪府大阪市東淀川区瑞光1-11-29 新高ビル1階,1100,20240720
松屋,神奈川,松屋 新横浜店,神奈川県横浜市港北区新横浜2-3-5,1563,20240720
松屋,新潟県,松屋 新潟豊栄店,新潟県新潟市北区かぶとやま2-2-58,1000,20240720
松屋,千葉県,松屋 新鎌ヶ谷店,千葉県鎌ケ谷市新鎌ヶ谷1-13-3,1100,20240720
松屋,大阪府,松屋 吹田店/松のや 吹田店,大阪府吹田市昭和町1259-8.18（地番）,1100,20240720
松屋,大阪府,松屋 石橋駅前店,大阪府池田市石橋1-10-27,1100,20240720
松屋,千葉県,松屋 千葉我孫子店,千葉県我孫子市本町2-3-2,1100,20240720
松屋,大阪府,松屋 千里丘店/松のや 千里丘店,大阪府摂津市千里丘5-11-3,1100,20240720
松屋,兵庫県,松屋 川西能勢口店/マイカリー食堂 川西能勢口店,兵庫県川西市栄町10-5パルティ川西101号,1100,20240720
松屋,大阪府,松屋 曽根店,大阪府豊中市曽根東町2-12-14,1064,20240720
松屋,東京都,松屋 早稲田店,東京都新宿区馬場下町62-18,1250,20240720
松屋,大阪府,松屋 大阪茨木店,大阪府茨木市春日1-4-1,1100,20240720
松屋,新潟県,松屋 長岡堺東町店,新潟県長岡市堺東町7,1000,20240720
松屋,京都府,松屋 東寺店,京都府京都市南区西九条開ヶ町101-2,1180,20240720
松屋,大阪府,松屋 東住吉中野店,大阪府大阪市東住吉区中野4-3-22,1100,20240720
松屋,大阪府,松屋 東住吉湯里店,大阪府大阪市東住吉区湯里5-20-6,1100,20240720
松屋,大阪府,松屋 東淀川菅原店,大阪府大阪市東淀川区菅原2-7-9,1100,20240720
松屋,大阪府,松屋 南茨木店,大阪府茨木市沢良宜西1-2-20,1100,20240720
松屋,兵庫県,松屋 尼崎アマドゥ店,兵庫県尼崎市道意町7-1,1100,20240720
松屋,兵庫県,松屋 尼崎潮江店,兵庫県尼崎市潮江1-27-15,1100,20240720
松屋,兵庫県,松屋 尼崎武庫の里店/松のや 尼崎武庫の里店,兵庫県尼崎市武庫の里1-11-1,1050,20240720
松屋,新潟県,松屋 柏崎店,新潟県柏崎市東柳田23-3,1050,20240720
松屋,青森県,松屋 八戸城下店/松のや 八戸城下店,青森県八戸市城下4-15-16,1000,20240720
松屋,京都府,松屋 百万遍店,京都府京都市左京区吉田泉殿町1-87番地,1060,20240720
松屋,富山県,松屋 富山下赤江店,富山県富山市下赤江町1-1-69,1100,20240720
松屋,富山県,松屋 富山掛尾店,富山県富山市掛尾町259,1100,20240720
松屋,富山県,松屋 富山田中町店,富山県富山市田中町4-18-43,1100,20240720
松屋,富山県,松屋 富山婦中店,富山県富山市婦中町下轡田428-4,1100,20240720
松屋,大阪府,松屋 富田店,大阪府高槻市富田町1-6-3,1100,20240720
松屋,兵庫県,松屋 武庫川店/マイカリー食堂 武庫川店,兵庫県尼崎市稲葉荘1-14-5,1050,20240720
松屋,兵庫県,松屋 宝塚安倉店,兵庫県宝塚市安倉南2-2-21,1050,20240720
松屋,大阪府,松屋 豊中熊野町店/マイカリー食堂 豊中熊野町店,大阪府豊中市熊野町1-1-8,1064,20240720
松屋,大阪府,松屋 豊中上津島店,大阪府豊中市上津島3-11-25,1064,20240720
松屋,福島県,松屋 本内店,福島県福島市本内字松川畑2-2,930,20240720
松屋,大阪府,松屋 箕面店/マイカリー食堂 箕面店,大阪府箕面市半町3-14-20,1100,20240720
松屋,京都府,松屋 立命館大前店,京都府京都市北区平野宮西町117-3,1100,20240720
