吉野家,兵庫県,吉野家 フェニックスプラザ摩耶店,兵庫県神戸市灘区味泥町6‐1,1150,20250621
吉野家,埼玉県,吉野家 岩槻南辻店,埼玉県さいたま市岩槻区南辻133,1200,20250621
吉野家,石川県,吉野家 金沢百番街店,石川県金沢市木ノ新保1‐1金沢百番街内,1200,20250621
松屋,富山県,松のや グリーンモール山室店,富山県富山市中市10-4,1100,20250621
松屋,神奈川,松屋 あざみ野店,神奈川県横浜市青葉区あざみ野1-11-1あざみ野センタービル1F,1200,20250621
松屋,福井県,松屋 越前千福店/マイカリー食堂 越前千福店,福井県越前市千福町29,1050,20250621
松屋,石川県,松屋 金沢工大前店,石川県野々市市扇が丘8-8,1100,20250621
松屋,神奈川,松屋 元住吉店,神奈川県川崎市中原区木月3丁目6番18号,1220,20250621
松屋,神奈川,松屋 溝の口南口店,神奈川県川崎市高津区久本1-4-10 TKBビル,1300,20250621
松屋,神奈川,松屋 高津店,神奈川県川崎市高津区二子5-2-1,1300,20250621
松屋,神奈川,松屋 鹿島田店,神奈川県川崎市幸区下平間135,1200,20250621
松屋,和歌山,松屋 小雑賀店,和歌山県和歌山市小雑賀573-9,1000,20250621
松屋,神奈川,松屋 大倉山店/マイカリー食堂 大倉山店,神奈川県横浜市港北区大倉山3-1-28,1180,20250621
松屋,神奈川,松屋 百合ヶ丘店/松のや 百合ヶ丘店,神奈川県川崎市麻生区百合丘1-1-4,1200,20250621
松屋,富山県,松屋 富山掛尾店,富山県富山市掛尾町259,1100,20250621
松屋,富山県,松屋 富山田中町店,富山県富山市田中町4-18-43,1100,20250621
松屋,富山県,松屋 富山婦中店,富山県富山市婦中町下轡田428-4,1100,20250621
松屋,神奈川,松屋 武蔵小杉店/マイカリー食堂 武蔵小杉店,神奈川県川崎市中原区新丸子町922,1250,20250621
松屋,神奈川,松屋 武蔵新城店,神奈川県川崎市中原区上新城2-10-15,1250,20250621
松屋,福井県,松屋 福井御幸店,福井県福井市御幸4-20-8,1100,20250621
松屋,福井県,松屋 福井若杉店/マイカリー食堂 福井若杉店,福井県福井市若杉4丁目715,1050,20250621
松屋,福井県,松屋 福井大和田店,福井県福井市大和田2-1304,1100,20250621
松屋,神奈川,松屋 矢向店,神奈川県横浜市鶴見区矢向6-5-8,1200,20250621
すき家,茨城県,すき家 6号日立金沢店,茨城県日立市城南町2-10-1 ,1100,20250621
すき家,愛知県,すき家 木曽川店,愛知県一宮市木曽川町黒田字中沼北ノ切5-2,1120,20250621
