すき家,大阪府,すき家 摂津南別府店,大阪府摂津市南別府町3-19,1050,20221008,1020,30
すき家,大阪府,すき家 摂津富田店,大阪府高槻市大畑町26-17,1050,20221008,1020,30
すき家,宮城県,すき家 仙台福室店,宮城県仙台市宮城野区福室字小原1-2,980,20221008,930,50
すき家,兵庫県,すき家 川西火打店,兵庫県川西市火打2-9-23,1030,20221008,1000,30
すき家,大阪府,すき家 泉大津松之浜店,大阪府泉大津市松之浜町2-1-12,1050,20221008,1020,30
すき家,大阪府,すき家 泉南中小路店,大阪府泉南市中小路2-383,1050,20221008,1000,50
すき家,大阪府,すき家 船場中央店,大阪府大阪市中央区南本町3-2-6,1120,20221008,1090,30
すき家,大阪府,すき家 曽根崎東店,大阪府大阪市北区太融寺町5-8ダイヤモンドレジャ-ビル本館1F,1130,20221008,1050,80
すき家,福岡県,すき家 太宰府向佐野店,福岡県太宰府市向佐野3-3-35,950,20221008,900,50
すき家,千葉県,すき家 大原店,千葉県いすみ市大原9539-1,1030,20221008,980,50
すき家,大阪府,すき家 大国町駅前店,大阪府大阪市浪速区敷津東3-11-10AKI難波ビル1F,1050,20221008,1030,20
すき家,大阪府,すき家 大阪港駅前店,大阪府大阪市港区築港3-6-13,1070,20221008,1050,20
すき家,大阪府,すき家 大阪鶴見今津北店,大阪府大阪市鶴見区今津北4-4-3,1050,20221008,1020,30
すき家,大阪府,すき家 大正駅南店,大阪府大阪市大正区三軒家東4-6-12,1050,20221008,1030,20
すき家,大阪府,すき家 大正泉尾店,大阪府大阪市大正区泉尾5-1-4,1050,20221008,1030,20
すき家,大阪府,すき家 大池橋店,大阪府大阪市生野区中川西3-10-10,1050,20221008,1030,20
すき家,大阪府,すき家 谷町三丁目店,大阪府大阪市中央区谷町3-5-5アイドュビル1F,1120,20221008,1090,30
すき家,兵庫県,すき家 丹南篠山口IC店,兵庫県丹波篠山市網掛字十ノ坪403-1,1050,20221008,1000,50
すき家,福岡県,すき家 筑紫野永岡店,福岡県筑紫野市大字永岡169-1,950,20221008,900,50
すき家,大阪府,すき家 茶屋町店,大阪府大阪市北区茶屋町1-52コモド梅田ビル1F,1130,20221008,1050,80
すき家,大阪府,すき家 中環大日店,大阪府門真市向島3-35ベア-ズA棟,1050,20221008,1020,30
すき家,大阪府,すき家 中百舌鳥店,大阪府堺市北区中百舌鳥町4-557-1,1050,20221008,1030,20
すき家,福岡県,すき家 朝倉甘木店,福岡県朝倉市一木626-1,950,20221008,920,30
すき家,千葉県,すき家 銚子店,千葉県銚子市長塚町1-465-1,1050,20221008,1000,50
すき家,京都府,すき家 長岡天神駅前店,京都府長岡京市天神1-1-2マルオカビル1F,1050,20221008,1020,30
すき家,大阪府,すき家 長吉出戸店,大阪府大阪市平野区長吉出戸5-3-62,1050,20221008,1020,30
すき家,大阪府,すき家 長居店,大阪府大阪市住吉区長居東4-21-2泉第2ハイツ,1050,20221008,1030,20
すき家,長崎県,すき家 長崎大学前店,長崎県長崎市家野町1-5,900,20221008,880,20
すき家,滋賀県,すき家 長浜IC店,滋賀県長浜市山階町496-2,1050,20221008,1000,50
すき家,大阪府,すき家 長堀橋駅南店,大阪府大阪市中央区島之内1-21-19協和島之内ビル1F,1120,20221008,1090,30
すき家,山形県,すき家 鶴岡西新斎店,山形県鶴岡市西新斎町7-9,1000,20221008,930,70
すき家,山形県,すき家 鶴岡道形店,山形県鶴岡市道形字二ツ屋61-2,1000,20221008,930,70
すき家,大阪府,すき家 天下茶屋駅前店,大阪府大阪市西成区岸里1-1-79とれび天下茶屋,1050,20221008,1030,20
すき家,大阪府,すき家 天神橋二丁目店,大阪府大阪市北区天神橋2-4-14盛岡ビル1F,1060,20221008,1050,10
すき家,大阪府,すき家 都島IC店,大阪府大阪市都島区高倉町3-14-27,1060,20221008,1050,10
すき家,大阪府,すき家 都島本通店,大阪府大阪市都島区都島本通3-20-1,1060,20221008,1050,10
すき家,兵庫県,すき家 東園田店,兵庫県尼崎市東園田町4-63-1,1060,20221008,1040,20
すき家,山形県,すき家 東根店,山形県東根市中央南2-8-20,980,20221008,930,50
すき家,大阪府,すき家 東住吉杭全店,大阪府大阪市東住吉区杭全5-13-7,1050,20221008,1030,20
すき家,大阪府,すき家 東大阪加納店,大阪府東大阪市加納8-24-7,1050,20221008,1020,30
すき家,大阪府,すき家 東大阪高井田店,大阪府東大阪市高井田本通7-1-30,1050,20221008,1020,30
すき家,大阪府,すき家 東大阪菱屋西店,大阪府東大阪市菱屋西6-9-15,1050,20221008,1020,30
すき家,大阪府,すき家 東大阪菱屋東店,大阪府東大阪市菱屋東2-3-29,1050,20221008,1020,30
すき家,京都府,すき家 東舞鶴白鳥店,京都府舞鶴市字森小字ムシウ218-1,1050,20221008,1000,50
すき家,大阪府,すき家 東淀川大桐店,大阪府大阪市東淀川区大桐1-7-8,1060,20221008,1030,30
すき家,大阪府,すき家 道頓堀一丁目店,大阪府大阪市中央区道頓堀1-1-11K-24ビル1F,1120,20221008,1090,30
すき家,奈良県,すき家 奈良七条店,奈良県奈良市七条町164-1,950,20221008,930,20
すき家,大阪府,すき家 内環状守口太子橋店,大阪府守口市緑町3-12,1060,20221008,1050,10
すき家,大阪府,すき家 内環状新深江店,大阪府大阪市東成区深江南2-12-22,1050,20221008,1020,30
すき家,大阪府,すき家 南港ATC店,大阪府大阪市住之江区南港北2-1-10O&#x27;s215区画,1120,20221008,1100,20
すき家,大阪府,すき家 南港通り北加賀屋店,大阪府大阪市住之江区北加賀屋2-11-8北加賀屋千島ビル,1050,20221008,1030,20
すき家,大阪府,すき家 南船場店,大阪府大阪市中央区南船場2-2-10,1120,20221008,1100,20
すき家,大阪府,すき家 南堀江店,大阪府大阪市西区南堀江2-1-1EG堀江ビル1F,1120,20221008,1090,30
すき家,大阪府,すき家 難波元町店,大阪府大阪市浪速区難波中3-6-12ナンバグランドビル,1070,20221008,1030,40
すき家,埼玉県,すき家 日高鹿山店,埼玉県日高市鹿山247-5,1030,20221008,1000,30
すき家,千葉県,すき家 馬込沢駅前店,千葉県船橋市藤原7-2-2Lｕｚ船橋1F,1030,20221008,1000,30
すき家,大阪府,すき家 梅田東店,大阪府大阪市北区堂山町15-15,1130,20221008,1050,80
すき家,大阪府,すき家 柏原片山店,大阪府柏原市片山町14-1,1050,20221008,1020,30
すき家,埼玉県,すき家 白岡岡泉店,埼玉県白岡市太田新井1187-4,1050,20221008,1000,50
すき家,北海道,すき家 函館漁火通店,北海道函館市広野町3-3,960,20221008,920,40
すき家,福岡県,すき家 八幡東枝光店,福岡県北九州市八幡東区枝光1-5,950,20221008,920,30
すき家,大阪府,すき家 八尾山賀店,大阪府八尾市山賀町1-37,1050,20221008,1020,30
すき家,大阪府,すき家 八尾青山店,大阪府八尾市青山町4-2-38,1050,20221008,1020,30
すき家,大阪府,すき家 八尾南木の本店,大阪府八尾市南木の本4-101-1,1050,20221008,1020,30
すき家,兵庫県,すき家 姫路南条店,兵庫県姫路市南条191-1,1030,20221008,1000,30
すき家,兵庫県,すき家 氷上町店,兵庫県丹波市氷上町稲継68-6,1050,20221008,1000,50
すき家,大阪府,すき家 富田林小金台店,大阪府富田林市小金台1-3-10,1050,20221008,1020,30
すき家,大阪府,すき家 富田林川面店,大阪府富田林市川面町2-4-16,1050,20221008,1020,30
すき家,福岡県,すき家 福岡拾六町店,福岡県福岡市西区拾六町1-25-8,950,20221008,920,30
すき家,福岡県,すき家 福岡片江店,福岡県福岡市城南区片江1-24-22,950,20221008,920,30
すき家,福岡県,すき家 福岡和白店,福岡県福岡市東区和白1-1-21,950,20221008,920,30
すき家,京都府,すき家 福知山東野パーク店,京都府福知山市字土小字東野1117-594,1050,20221008,1000,50
すき家,大阪府,すき家 平野町一丁目店,大阪府大阪市中央区平野町1-8-11ルート北浜ビル1F,1120,20221008,1090,30
すき家,大阪府,すき家 弁天町みなと通店,大阪府大阪市港区磯路1-1-7灘浜ビル,1050,20221008,1030,20
すき家,兵庫県,すき家 宝塚安倉店,兵庫県宝塚市安倉西4-608,1030,20221008,1000,30
すき家,兵庫県,すき家 宝塚小林店,兵庫県宝塚市小林5-9-100,1030,20221008,1000,30
すき家,兵庫県,すき家 宝塚中筋店,兵庫県宝塚市中筋6-13-22,1030,20221008,1000,30
すき家,大阪府,すき家 豊中熊野町店,大阪府豊中市熊野町1-7-15,1060,20221008,1030,30
すき家,大阪府,すき家 豊中曽根店,大阪府豊中市曽根南町3-19-24,1060,20221008,1030,30
すき家,大阪府,すき家 豊中浜店,大阪府豊中市浜4-3-7-2,1060,20221008,1030,30
すき家,茨城県,すき家 鉾田店,茨城県鉾田市塔ヶ崎1017-1,1020,20221008,980,40
すき家,神奈川,すき家 北新横浜店,神奈川県横浜市港北区北新横浜1-4-8,1200,20221008,1150,50
すき家,埼玉県,すき家 北本荒井店,埼玉県北本市荒井2-413-1,1030,20221008,1000,30
すき家,埼玉県,すき家 本川越クレアモール店,埼玉県川越市新富町1-19-4本川越ASビル1F,1030,20221008,1010,20
すき家,大阪府,すき家 枚方山之上店,大阪府枚方市山之上北町1-8,1050,20221008,1020,30
すき家,大阪府,すき家 枚方渚内野店,大阪府枚方市渚内野4-25-1,1050,20221008,1020,30
すき家,大阪府,すき家 枚方招提北店,大阪府枚方市招提北町1-2241-1,1050,20221008,1020,30
すき家,大阪府,すき家 枚方中宮東之町店,大阪府枚方市中宮東之町22-13,1050,20221008,1020,30
すき家,千葉県,すき家 幕張本郷店,千葉県千葉市花見川区幕張本郷6-24-10鈴木本郷ビル1F,1030,20221008,1010,20
すき家,埼玉県,すき家 毛呂山小田谷店,埼玉県入間郡毛呂山町大字小田谷220-1,1030,20221008,1000,30
すき家,大阪府,すき家 門真下馬伏店,大阪府門真市下馬伏町26-6,1050,20221008,1020,30
すき家,大阪府,すき家 門真中央店,大阪府門真市大池町16-25,1050,20221008,1020,30
すき家,大阪府,すき家 淀川加島店,大阪府大阪市淀川区加島2-3-4,1050,20221008,1030,20
すき家,大阪府,すき家 淀川通塚本店,大阪府大阪市淀川区塚本2-14-19,1060,20221008,1030,30
すき家,大阪府,すき家 立売堀二丁目店,大阪府大阪市西区立売堀2-4-6DGビルなにわ筋1F,1120,20221008,1090,30
すき家,茨城県,すき家 竜ヶ崎NT店,茨城県龍ケ崎市久保台1-1-1,980,20221008,950,30
すき家,茨城県,すき家 竜ヶ崎馴柴店,茨城県龍ヶ崎市馴柴町718-1,980,20221008,950,30
すき家,大阪府,すき家 和泉はつが野店,大阪府和泉市はつが野1-1-13,1050,20221008,1000,50
