吉野家,大阪府,吉野家 171号線茨木インター店,大阪府茨木市郡4丁目18‐35,1000,20220604
吉野家,大阪府,吉野家 171号線高槻市役所前店,大阪府高槻市城西町4‐46,1000,20220604
吉野家,兵庫県,吉野家 171号線西宮若山町店,兵庫県西宮市若山町11‐12,980,20220604
吉野家,京都府,吉野家 1号線京都南インター店,京都府京都市南区上鳥羽麻ノ本15‐1,1000,20220604
吉野家,和歌山,吉野家 24号線岩出店,和歌山県岩出市西野20‐6,950,20220604
吉野家,和歌山,吉野家 24号線橋本高野口店,和歌山県橋本市高野口町伏原933‐1,950,20220604
吉野家,兵庫県,吉野家 250号線加古川備後店,兵庫県加古川市加古川町南備後13‐1,950,20220604
吉野家,大阪府,吉野家 26号線貝塚店,大阪府貝塚市石才229‐1,1000,20220604
吉野家,大阪府,吉野家 26号線岸和田八阪店,大阪府岸和田市八阪町1丁目7‐13,1000,20220604
吉野家,大阪府,吉野家 26号線堺浜寺店,大阪府堺市西区浜寺船尾町東1丁112,1000,20220604
吉野家,大阪府,吉野家 26号線泉佐野店,大阪府泉佐野市高松東2丁目6529,1000,20220604
吉野家,大阪府,吉野家 26号線泉大津店,大阪府泉大津市北豊中町3丁目1‐3,1000,20220604
吉野家,兵庫県,吉野家 2号線姫路市川橋店,兵庫県姫路市花田町一本松437‐3,950,20220604
吉野家,兵庫県,吉野家 2号線明石大久保店,兵庫県明石市大久保町駅前1丁目17‐17,950,20220604
吉野家,和歌山,吉野家 42号線和歌山紀三井寺店,和歌山県和歌山市紀三井寺541‐1,950,20220604
吉野家,滋賀県,吉野家 湖南夏見店,滋賀県湖南市夏見425‐1,950,20220604
吉野家,大阪府,吉野家 阪南鳥取店,大阪府阪南市黒田705‐1,1000,20220604
吉野家,大阪府,吉野家 堺インター店,大阪府堺市中区平井775‐1,1000,20220604
吉野家,大阪府,吉野家 堺石津川店,大阪府堺市西区浜寺石津町西2丁322‐1,1000,20220604
吉野家,兵庫県,吉野家 三宮駅東店,兵庫県神戸市中央区旭通5丁目3‐15,1000,20220604
吉野家,大阪府,吉野家 守口駅前店,大阪府守口市京阪本通2丁目15‐13,1000,20220604
吉野家,大阪府,吉野家 上新庄駅前店,大阪府大阪市東淀川区上新庄2丁目24‐24,1000,20220604
吉野家,兵庫県,吉野家 新神戸駅前店,兵庫県神戸市中央区生田町1丁目1‐22,1000,20220604
吉野家,兵庫県,吉野家 西宮山口町店,兵庫県西宮市山口町名来2丁目19,980,20220604
吉野家,滋賀県,吉野家 大津堅田店,滋賀県大津市本堅田5丁目22‐9,950,20220604
吉野家,奈良県,吉野家 大和高田東室店,奈良県大和高田市曽大根1丁目1‐5,930,20220604
吉野家,兵庫県,吉野家 滝野社インター店,兵庫県加東市北野647‐1,1000,20220604
吉野家,大阪府,吉野家 中環松原丹南店,大阪府松原市丹南4丁目1‐4,1000,20220604
吉野家,大阪府,吉野家 中環東大阪若江店,大阪府東大阪市若江南町3丁目8‐53,1000,20220604
吉野家,大阪府,吉野家 都島駅前店,大阪府大阪市都島区善源寺町1丁目5‐53,1050,20220604
吉野家,大阪府,吉野家 東三国駅前店,大阪府大阪市淀川区東三国4丁目3‐12,1000,20220604
吉野家,大阪府,吉野家 東大阪八戸ノ里店,大阪府東大阪市御厨南2丁目4‐3,1000,20220604
吉野家,兵庫県,吉野家 東灘御影店,兵庫県神戸市東灘区御影中町2丁目2‐14,1000,20220604
吉野家,兵庫県,吉野家 尼崎尾浜店,兵庫県尼崎市尾浜町1丁目29‐1,1000,20220604
吉野家,滋賀県,吉野家 八日市インター店,滋賀県東近江市妙法寺町708,950,20220604
吉野家,兵庫県,吉野家 姫路今宿店,兵庫県姫路市東今宿3‐1225‐1,950,20220604
吉野家,兵庫県,吉野家 姫路中地店,兵庫県姫路市飾磨区構4‐94,950,20220604
吉野家,兵庫県,吉野家 姫路保城店,兵庫県姫路市保城943‐1,950,20220604
吉野家,大阪府,吉野家 福島駅前店,大阪府大阪市福島区福島5丁目14‐12,1100,20220604
吉野家,大阪府,吉野家 豊中市役所前店,大阪府豊中市中桜塚3丁目10‐30,1000,20220604
吉野家,大阪府,吉野家 豊中庄内店,大阪府豊中市庄内栄町4丁目21‐36,1000,20220604
吉野家,和歌山,吉野家 和歌山宮街道店,和歌山県和歌山市太田564‐3,950,20220604
吉野家,和歌山,吉野家 和歌山向店,和歌山県和歌山市向203‐1,950,20220604
すき家,静岡県,すき家 136号伊豆の国大仁店,静岡県伊豆の国市吉田363-4,1130,20220604
