吉野家,広島県,吉野家 福山新涯店,広島県福山市新涯町5丁目34‐14,1388,20240601,1050,338
吉野家,東京都,吉野家 福生店,東京都福生市福生799‐5,1550,20240601,1200,350
吉野家,神奈川,吉野家 平塚駅前店,神奈川県平塚市紅谷町2‐1,1487,20240601,1120,367
吉野家,神奈川,吉野家 平塚大神店,神奈川県平塚市大神8丁目2番1号,1500,20240601,1200,300
吉野家,東京都,吉野家 方南町店,東京都杉並区方南2丁目21‐5,1500,20240601,1200,300
吉野家,東京都,吉野家 豊洲市場店,東京都江東区豊洲6丁目5‐1,1625,20240601,1300,325
吉野家,東京都,吉野家 豊洲店,東京都江東区豊洲4丁目1‐1,1750,20240601,1400,350
吉野家,千葉県,吉野家 北小金店,千葉県松戸市根木内26,1438,20240601,1150,288
吉野家,神奈川,吉野家 本厚木店,神奈川県厚木市中町2丁目1‐22,1438,20240601,1150,288
吉野家,静岡県,吉野家 本市場店,静岡県富士市本市場424‐2,1150,20240601,1100,50
吉野家,岐阜県,吉野家 名岐岐南町店,岐阜県羽島郡岐南町伏屋6丁目179,1450,20240601,1100,350
吉野家,愛知県,吉野家 名四宝神町店,愛知県名古屋市港区神宮寺1丁目511,1450,20240601,1100,350
吉野家,愛知県,吉野家 名鉄名古屋駅店,愛知県名古屋市中村区名駅1丁目2‐1,1513,20240601,1150,363
吉野家,東京都,吉野家 目黒駅前店,東京都品川区上大崎2丁目27‐2,1750,20240601,1400,350
吉野家,石川県,吉野家 野々市店,石川県野々市市粟田6丁目386,1388,20240601,1050,338
吉野家,秋田県,吉野家 由利本荘店,秋田県由利本荘市一番堰155‐1,960,20240601,900,60
吉野家,神奈川,吉野家 立場店,神奈川県横浜市泉区中田北1丁目26‐6,1525,20240601,1150,375
吉野家,埼玉県,吉野家 蓮田店,埼玉県蓮田市西新宿1丁目7,1438,20240601,1150,288
吉野家,愛知県,吉野家 杁中店,愛知県名古屋市昭和区隼人町6‐19,1400,20240601,1100,300
すき家,香川県,すき家 11号東かがわ店,香川県東かがわ市白鳥字田高田131-1,1050,20240601,1020,30
すき家,徳島県,すき家 11号徳島川内店,徳島県徳島市川内町平石古田36-2,1020,20240601,1000,20
すき家,静岡県,すき家 136号伊豆の国大仁店,静岡県伊豆の国市吉田363-4,1120,20240601,1080,40
すき家,山梨県,すき家 139号都留桂店,山梨県都留市桂町876-1,1050,20240601,1000,50
すき家,長野県,すき家 141号佐久跡部店,長野県佐久市跡部46-4,1050,20240601,1000,50
すき家,長野県,すき家 141号佐久平店,長野県佐久市大字長土呂260-1,1100,20240601,1000,100
すき家,長野県,すき家 143号上田原店,長野県上田市上田原437-12,1100,20240601,1000,100
すき家,長野県,すき家 152号茅野店,長野県茅野市本町東5291-1,1080,20240601,1030,50
すき家,長野県,すき家 153号伊那店,長野県伊那市山寺282-1,1080,20240601,1050,30
すき家,愛知県,すき家 153号天白植田西店,愛知県名古屋市天白区植田西3-902,1150,20240601,1080,70
すき家,愛知県,すき家 153号日進赤池店,愛知県日進市浅田町笹原8-11,1150,20240601,1080,70
すき家,長野県,すき家 153号飯田IC店,長野県飯田市上殿岡576-1,1150,20240601,1080,70
すき家,長野県,すき家 153号飯田座光寺店,長野県飯田市座光寺4705-1,1080,20240601,1030,50
すき家,神奈川,すき家 16号横須賀安浦店,神奈川県横須賀市安浦町3-24-3,1200,20240601,1150,50
すき家,広島県,すき家 183号広島可部店,広島県広島市安佐北区可部7-1-26,1020,20240601,980,40
すき家,長野県,すき家 18号小諸店,長野県小諸市諸1-5-11,1100,20240601,1000,100
すき家,長野県,すき家 18号上田材木店,長野県上田市材木町1-9-16,1100,20240601,1000,100
すき家,長野県,すき家 18号上田秋和店,長野県上田市秋和立石344-4?,1100,20240601,1000,100
すき家,長野県,すき家 18号上田大屋店,長野県上田市大屋347-8,1100,20240601,1000,100
すき家,徳島県,すき家 192号吉野川店,徳島県吉野川市鴨島町上下島字宮内87-8,1020,20240601,1000,20
すき家,岐阜県,すき家 19号瑞浪店,岐阜県瑞浪市穂並1-64,1100,20240601,1080,20
すき家,岐阜県,すき家 19号多治見音羽店,岐阜県多治見市音羽町4-1,1130,20240601,1080,50
すき家,岐阜県,すき家 19号中津川IC店,岐阜県中津川市千旦林204-2,1120,20240601,1100,20
すき家,岐阜県,すき家 19号土岐店,岐阜県土岐市泉仲森町1-17,1100,20240601,1080,20
すき家,静岡県,すき家 1国三島谷田店,静岡県三島市谷田60-1,1130,20240601,1080,50
すき家,徳島県,すき家 28号鳴門大津店,徳島県鳴門市大津町吉永四番越471-1,1020,20240601,1000,20
すき家,岡山県,すき家 2国岡山早島店,岡山県都窪郡早島町早島3444-1,1050,20240601,1000,50
すき家,山口県,すき家 2国下関長府店,山口県下関市長府松小田本町24-6,1050,20240601,980,70
すき家,岡山県,すき家 2国笠岡店,岡山県笠岡市三番町2-30,1050,20240601,1000,50
すき家,山口県,すき家 2国岩国室の木店,山口県岩国市室の木町1-8-38,1050,20240601,1000,50
すき家,広島県,すき家 2国大竹西栄店,広島県大竹市西栄1-7-13,1050,20240601,1000,50
すき家,岡山県,すき家 313号真庭店,岡山県真庭市惣146-1,1100,20240601,1020,80
すき家,沖縄県,すき家 331号糸満店,沖縄県糸満市潮平603-1,1000,20240601,980,20
すき家,佐賀県,すき家 34号鳥栖店,佐賀県鳥栖市萱方町177-1,1000,20240601,970,30
すき家,福岡県,すき家 3号門司黄金町店,福岡県北九州市門司区黄金町3-22,1000,20240601,950,50
すき家,神奈川,すき家 412号厚木林店,神奈川県厚木市林4-12-34,1180,20240601,1130,50
すき家,岡山県,すき家 430号倉敷児島店,岡山県倉敷市児島小川町3682-5,1000,20240601,950,50
すき家,岡山県,すき家 430号倉敷水島店,岡山県倉敷市東塚1-16-29,1050,20240601,1000,50
すき家,千葉県,すき家 464号千葉NT白井店,千葉県白井市根447-2,1150,20240601,1080,70
すき家,福岡県,すき家 500号小郡店,福岡県小郡市小郡字江下1483-4,1000,20240601,980,20
すき家,徳島県,すき家 55号徳島沖浜店,徳島県徳島市山城西4-1,1020,20240601,1000,20
すき家,高知県,すき家 56号土佐高岡店,高知県土佐市高岡町字野田南ノ丁乙3369-1,1050,20240601,980,70
すき家,新潟県,すき家 8号糸魚川寺島店,新潟県糸魚川市寺島3-2-34,1100,20240601,1030,70
すき家,沖縄県,すき家 うるま石川店,沖縄県うるま市石川2-11-1,1000,20240601,960,40
すき家,茨城県,すき家 つくば上横場店,茨城県つくば市上横場2289-3,1100,20240601,1050,50
すき家,茨城県,すき家 つくば天久保店,茨城県つくば市天久保4-6-5,1050,20240601,1000,50
すき家,長野県,すき家 アリオ上田店,長野県上田市天神3-5-1アリオ上田フードコート2F,1050,20240601,1000,50
すき家,香川県,すき家 イオンモール綾川店,香川県綾歌郡綾川町萱原822-1イオン綾川ショッピングセンター3F,1150,20240601,1050,100
すき家,岡山県,すき家 イオンモール津山店,岡山県津山市河辺1000-1,1050,20240601,980,70
すき家,千葉県,すき家 イオンモール柏店,千葉県柏市豊町2-5-25イオンモール柏2F,1120,20240601,1050,70
すき家,沖縄県,すき家 イオン那覇店,沖縄県那覇市金城5-10-2イオン那覇1F,970,20240601,950,20
すき家,神奈川,すき家 ビアレ横浜並木店,神奈川県横浜市金沢区並木2-13-7,1180,20240601,1130,50
すき家,静岡県,すき家 ベイドリーム清水店,静岡県静岡市清水区駒越北町8-3,1120,20240601,1080,40
すき家,千葉県,すき家 モリシア津田沼店,千葉県習志野市谷津1-16-1モリシア津田沼1F,1150,20240601,1050,100
すき家,千葉県,すき家 ライフガーデン新浦安店,千葉県浦安市富岡3-2-1,1200,20240601,1100,100
すき家,石川県,すき家 羽咋石野町店,石川県羽咋市石野町イ54-1,1150,20240601,1080,70
すき家,千葉県,すき家 浦安駅前店,千葉県浦安市猫実4-18-26浦安サンライズビル1F,1250,20240601,1110,140
すき家,千葉県,すき家 浦安堀江店,千葉県浦安市堀江6-4-29メゾン浦安1F,1250,20240601,1100,150
すき家,神奈川,すき家 横須賀衣笠店,神奈川県横須賀市衣笠町43-17,1200,20240601,1130,70
すき家,神奈川,すき家 横須賀中央店,神奈川県横須賀市若松町1-4味ビル1F,1200,20240601,1180,20
すき家,神奈川,すき家 横浜橋店,神奈川県横浜市南区万世町1-19,1200,20240601,1140,60
すき家,長野県,すき家 岡谷若宮店,長野県岡谷市若宮2-5-2,1100,20240601,1000,100
すき家,山口県,すき家 下関赤間店,山口県下関市赤間町3-35,1020,20240601,980,40
すき家,山口県,すき家 下関稗田西町店,山口県下関市稗田西町10-13,1000,20240601,980,20
すき家,千葉県,すき家 鎌ヶ谷初富店,千葉県鎌ヶ谷市新鎌ヶ谷2-1-14,1100,20240601,1050,50
すき家,香川県,すき家 丸亀田村店,香川県丸亀市田村町字平池795-2,1050,20240601,1020,30
すき家,香川県,すき家 丸亀土器店,香川県丸亀市土器町東8-11,1050,20240601,1000,50
すき家,沖縄県,すき家 宜野湾我如古店,沖縄県宜野湾市我如古4-7-3,1000,20240601,960,40
すき家,神奈川,すき家 吉野町店,神奈川県横浜市南区吉野町5-22-17朝日ヶ丘ニュ-スカイマンション1F,1200,20240601,1140,60
すき家,千葉県,すき家 京成船橋駅前店,千葉県船橋市本町一丁目9-9パークタワー船橋1階104号,1200,20240601,1150,50
すき家,千葉県,すき家 京成大久保駅前店,千葉県習志野市大久保1-21-14琴富ビル1F,1100,20240601,1050,50
すき家,千葉県,すき家 京成津田沼駅北店,千葉県習志野市津田沼3-9-3,1100,20240601,1050,50
すき家,岡山県,すき家 玉野宇野店,岡山県玉野市宇野1-20-25,1050,20240601,980,70
すき家,熊本県,すき家 熊本秋津店,熊本県熊本市東区沼山津3-1-11,980,20240601,950,30
すき家,千葉県,すき家 五香駅前店,千葉県松戸市常盤平5-11-12,1100,20240601,1050,50
すき家,静岡県,すき家 御殿場店,静岡県御殿場市萩原809-2,1300,20240601,1250,50
すき家,神奈川,すき家 厚木長谷店,神奈川県厚木市長谷642-3,1180,20240601,1140,40
すき家,千葉県,すき家 行徳北店,千葉県市川市富浜3-2-24,1250,20240601,1150,100
すき家,香川県,すき家 高松寿町店,香川県高松市寿町1-4-3高松中央通りビル1F,1100,20240601,1050,50
すき家,香川県,すき家 高松中央IC店,香川県高松市木太町9区550-1,1100,20240601,1050,50
すき家,広島県,すき家 三原店,広島県三原市皆実町3-1-1,1100,20240601,1050,50
すき家,神奈川,すき家 蒔田店,神奈川県横浜市南区宮元町2-31村串ビル1F,1200,20240601,1140,60
すき家,石川県,すき家 七尾藤橋店,石川県七尾市藤橋町戌12-1,1200,20240601,1100,100
すき家,愛知県,すき家 守山店,愛知県名古屋市守山区瀬古東2-1104,1170,20240601,1120,50
すき家,山口県,すき家 周南久米店,山口県周南市大字久米1142-1,1100,20240601,1000,100
すき家,山口県,すき家 周南新南陽店,山口県周南市古川町5-15,1050,20240601,1000,50
すき家,秋田県,すき家 秋田桜店,秋田県秋田市桜1-12-11,960,20240601,930,30
すき家,千葉県,すき家 松戸秋山店,千葉県松戸市秋山1-8-8,1120,20240601,1080,40
すき家,静岡県,すき家 焼津小川店,静岡県焼津市東小川8-11-12,1100,20240601,1050,50
すき家,新潟県,すき家 上越高土店,新潟県上越市高土町1-1-4,1100,20240601,1030,70
すき家,神奈川,すき家 上大岡カミオ店,神奈川県横浜市港南区上大岡西1-15-1CAMIO1F,1200,20240601,1140,60
すき家,茨城県,すき家 水戸駅南口店,茨城県水戸市宮町1-7-44COMBOX310-302号室,1050,20240601,1030,20
すき家,茨城県,すき家 水戸河和田店,茨城県水戸市河和田1丁目1704番14-13,1050,20240601,1020,30
すき家,茨城県,すき家 水戸末広町店,茨城県水戸市末広町2-3-7,1050,20240601,1020,30
すき家,愛知県,すき家 瑞穂弥富通店,愛知県名古屋市瑞穂区弥富通5-31,1150,20240601,1100,50
すき家,千葉県,すき家 西船橋店,千葉県船橋市山野町10-1,1200,20240601,1100,100
すき家,千葉県,すき家 船橋古作店,千葉県船橋市古作2-1-1,1200,20240601,1080,120
すき家,千葉県,すき家 船橋市場店,千葉県船橋市市場5-1-19,1150,20240601,1080,70
すき家,千葉県,すき家 船橋南店,千葉県船橋市浜町1-41-10第3土井ビル1F,1200,20240601,1100,100
すき家,岡山県,すき家 倉敷宮前店,岡山県倉敷市宮前357-2,1050,20240601,1000,50
すき家,岡山県,すき家 倉敷田ノ上店,岡山県倉敷市田ノ上939-1,1100,20240601,1050,50
すき家,岡山県,すき家 倉敷連島店,岡山県倉敷市連島2-9-18,1050,20240601,1000,50
すき家,広島県,すき家 段原店,広島県広島市南区段原3-3-32シャルマン・S,1100,20240601,1030,70
すき家,神奈川,すき家 地下鉄弘明寺駅前店,神奈川県横浜市南区大岡2-3-1,1200,20240601,1140,60
すき家,鳥取県,すき家 鳥取安長店,鳥取県鳥取市安長167-1,1020,20240601,950,70
すき家,鳥取県,すき家 鳥取南吉方店,鳥取県鳥取市南吉方2-25,1020,20240601,950,70
すき家,岡山県,すき家 津山小田中店,岡山県津山市小田中1309-10,1050,20240601,1020,30
すき家,香川県,すき家 津田の松原SA下り店,香川県さぬき市津田町鶴羽939-1,1000,20240601,950,50
すき家,香川県,すき家 津田の松原SA上り店,香川県さぬき市津田町鶴羽935-5,1000,20240601,950,50
すき家,静岡県,すき家 藤枝田沼店,静岡県藤枝市田沼4-7-10,1100,20240601,1050,50
すき家,徳島県,すき家 徳島住吉店,徳島県徳島市住吉4-41,1020,20240601,1000,20
すき家,徳島県,すき家 徳島大原店,徳島県徳島市大原町千代ケ丸山5-1,1020,20240601,1000,20
すき家,山口県,すき家 南岩国店,山口県岩国市尾津町2-20-33,1050,20240601,1000,50
すき家,千葉県,すき家 南流山店,千葉県流山市南流山7-1-10,1100,20240601,1080,20
すき家,静岡県,すき家 富士厚原店,静岡県富士市厚原99-5,1100,20240601,1050,50
すき家,静岡県,すき家 富士柚木店,静岡県富士市柚木310-1,1100,20240601,1050,50
すき家,福岡県,すき家 福岡空港店,福岡県糟屋郡志免町別府北1-3-18,1050,20240601,1000,50
すき家,鳥取県,すき家 米子中央店,鳥取県米子市西福原1-1-45,1050,20240601,1020,30
すき家,山口県,すき家 防府新田店,山口県防府市大字新田573-1,1050,20240601,1000,50
すき家,山口県,すき家 防府天神店,山口県防府市天神2-3-36,1050,20240601,1000,50
すき家,千葉県,すき家 本八幡駅南口店,千葉県市川市南八幡4-6-2高橋ビル1F,1200,20240601,1100,100
すき家,千葉県,すき家 幕張店,千葉県千葉市花見川区幕張町5-417-207,1150,20240601,1100,50
すき家,長野県,すき家 箕輪BP店,長野県上伊那郡箕輪町中箕輪11338-1,1080,20240601,1030,50
すき家,石川県,すき家 野々市新庄店,石川県野々市市新庄3-253,1150,20240601,1030,120
すき家,徳島県,すき家 藍住笠木店,徳島県板野郡藍住町笠木字中野71-2,1020,20240601,1000,20
すき家,愛知県,すき家 緑区平手北店,愛知県名古屋市緑区平手北1-920,1150,20240601,1100,50
すき家,愛知県,すき家 緑区鳴海店,愛知県名古屋市緑区浦里3-317,1150,20240601,1100,50
