吉野家 廿日市店,広島県廿日市市宮内1丁目1-5,1000
吉野家 日吉駅前店,神奈川県横浜市港北区日吉本町1丁目22-10,1100
吉野家 日本橋室町店,東京都中央区日本橋室町1-11-5,1100
吉野家 日立川尻店,茨城県日立市川尻町4丁目29-23,950
吉野家 入谷店,東京都台東区入谷1丁目6-6,1100
吉野家 馬喰町店,東京都中央区日本橋馬喰町1丁目5-7,1100
吉野家 梅島駅前店,東京都足立区梅田8丁目2-14,1100
吉野家 博多バスターミナル店,福岡県福岡市博多区博多駅中央街2-1,950
吉野家 博多祇園店,福岡県福岡市博多区祇園町6-45,900
吉野家 柏西口店,千葉県柏市旭町1丁目4-18,1000
吉野家 柏東口店,千葉県柏市柏1丁目5-19,1000
吉野家 粕屋仲原店,福岡県糟屋郡粕屋町仲原2536-4,900
吉野家 函館神山店,北海道函館市神山2丁目205-17,950
吉野家 八王子南口店,東京都八王子市子安町1丁目3-11,1080
吉野家 八戸の里店,大阪府東大阪市御厨南2丁目4-3,1000
吉野家 八戸石堂店,青森県八戸市石堂2丁目21-8,870
吉野家 八重洲地下街店,東京都中央区八重洲2丁目1,1200
吉野家 八千代台西口店,千葉県八千代市八千代台西1丁目10,1000
吉野家 八千代緑が丘店,千葉県八千代市緑ガ丘西1丁目13-2,1000
吉野家 八代店,熊本県八代市松江町２４１‐１,1000
吉野家 八潮店,埼玉県八潮市上馬場476-1,1000
吉野家 八日市店,滋賀県東近江市妙法寺町708,950
吉野家 八幡久保田店,京都府八幡市八幡久保田35-23,970
吉野家 八幡折尾店,福岡県北九州市八幡西区丸尾町6-9,900
吉野家 八尾高安店,大阪府八尾市高安町北7丁目178-6,1000
吉野家 飯田インター店,長野県飯田市育良町3-1-14,1000
吉野家 飯田大門町店,長野県飯田市大門町85-1,1000
吉野家 飯能駅前店,埼玉県飯能市仲町11-21,990
吉野家 磐田二之宮店,静岡県磐田市二之宮東13-3,950
吉野家 肥後橋店,大阪府大阪市西区京町堀1丁目7-4,1000
吉野家 尾久橋通り皿沼店,東京都足立区皿沼3丁目32-1,1100
吉野家 尾久橋通り舎人店,東京都足立区舎人2丁目19-2,1100
吉野家 尾西店,愛知県一宮市三条道東45-1,1000
吉野家 尾張旭印場店,愛知県尾張旭市白鳳町2丁目32,980
吉野家 尾張旭三郷店,愛知県尾張旭市井田町1丁目85,980
吉野家 尾張一宮ＰＡ上り店,愛知県一宮市丹陽町三ツ井東金浦2709,980
吉野家 尾頭橋店,愛知県名古屋市中川区尾頭橋1丁目8-9,1000
吉野家 美合ＰＡ下り店,愛知県岡崎市市場町御成箇3-41,980
吉野家 美濃加茂店,岐阜県美濃加茂市山手町3丁目126,1000
吉野家 姫路大津店,兵庫県姫路市大津区恵美酒町2丁目56-1,950
吉野家 姫路南店,兵庫県姫路市飾磨区構4-94,950
吉野家 姫路北店,兵庫県姫路市保城943-1,950
吉野家 品川駅港南口店,東京都港区港南2丁目2-15,1300
吉野家 浜街道宇多津店,香川県綾歌郡宇多津町浜二番丁20-17,900
吉野家 浜松ディーラー通り店,静岡県浜松市東区和田町779-1,1000
吉野家 浜松駅店,静岡県浜松市中区砂山町322-4,1000
吉野家 浜松志都呂店,静岡県浜松市西区志都呂1丁目32-10,1000
吉野家 浜松若林店,静岡県浜松市南区若林町2744-4,1000
吉野家 浜松西インター店,静岡県浜松市西区湖東町3053,950
吉野家 浜松町店,東京都港区浜松町2丁目7-1,1200
吉野家 浜線八王寺店,熊本県熊本市中央区八王寺町31-13,950
吉野家 浜町店,東京都中央区日本橋浜町1丁目2-4,1100
吉野家 富山駅前店,富山県富山市桜町1-4-17,1000
吉野家 富山呉羽店,富山県富山市呉羽町7275-2,1000
吉野家 富山豊田町店,富山県富山市豊田町2-123-1,1000
吉野家 富山本郷新店,富山県富山市本郷新14-5,1000
吉野家 富士宮店,静岡県富士宮市淀師1111-2,1000
吉野家 布施駅前店,大阪府東大阪市長堂1-1,1000
吉野家 府中中河原店,東京都府中市住吉町1丁目20-1,1050
吉野家 武生店,福井県越前市新保町30-50-2,1000
吉野家 武蔵浦和駅前店,埼玉県さいたま市南区別所7丁目7-34,1050
吉野家 武蔵小金井駅前店,東京都小金井市本町2丁目5-2,1100
吉野家 武蔵小山店,東京都品川区小山3丁目21-14,1150
吉野家 武蔵小杉店,神奈川県川崎市中原区新丸子東2丁目924-8,1100
吉野家 武蔵小杉南口店,神奈川県川崎市中原区小杉町3丁目441-26,1100
吉野家 武蔵村山店,東京都武蔵村山市中原3丁目1-2,1100
吉野家 伏見通錦店,愛知県名古屋市中区錦2丁目9-23,1100
吉野家 伏見南店,京都府京都市伏見区横大路下三栖辻堂町38-1,950
吉野家 福井花堂店,福井県福井市花堂北2丁目1212,1000
吉野家 福井大手店,福井県福井市大手1丁目2-18,1000
吉野家 福井二の宮店,福井県福井市幾代2丁目1501,1000
吉野家 福岡空港国内ＴＢ店,福岡県福岡市博多区大字下臼井778-1,950
吉野家 福岡原田店,福岡県福岡市東区原田3丁目3-26,900
吉野家 福山手城町店,広島県福山市手城町4丁目7-10,930
吉野家 福山新涯店,広島県福山市新涯町5丁目34-14,930
吉野家 福生店,東京都福生市福生799-5,1080
吉野家 福島競馬場店,福島県福島市松浪町9-23福島競馬場内FF108,900
吉野家 福島店,大阪府大阪市福島区福島5丁目14-12,1050
吉野家 平井店,東京都江戸川区平井5丁目15-7,1100
吉野家 平手店,愛知県名古屋市緑区平手南1丁目201,960
吉野家 平針店,愛知県名古屋市天白区平針5丁目102,960
吉野家 平塚駅前店,神奈川県平塚市紅谷町2-1,1050
吉野家 平塚天沼店,神奈川県平塚市天沼1-42,1050
吉野家 平野店,大阪府大阪市平野区平野元町7-13,1000
吉野家 平和島店,東京都大田区大森北3丁目39-14,1150
吉野家 米子市役所前店,鳥取県米子市加茂町1丁目100,900
吉野家 宝塚高松町店,兵庫県宝塚市高司5丁目1-8,950
吉野家 方南町店,東京都杉並区方南2丁目21-5,1150
吉野家 泡瀬ベイストリート店,沖縄県沖縄市泡瀬4丁目20-11,850
吉野家 豊橋平川店,愛知県豊橋市平川町34-1,1000
吉野家 豊洲市場店,東京都江東区豊洲6丁目5-1,1100
吉野家 豊洲店,東京都江東区豊洲4丁目1-1,1200
吉野家 北綾瀬店,東京都足立区谷中2-7-5,1100
吉野家 北浦和西口店,埼玉県さいたま市浦和区北浦和4丁目2-3,1050
吉野家 北越谷駅前店,埼玉県越谷市北越谷4丁目2-9,1000
吉野家 北花田店,大阪府堺市北区北花田町3丁32-6,1000
吉野家 北小金店,千葉県松戸市根木内26,1000
吉野家 北千住本町商店街店,東京都足立区千住2丁目31,1150
吉野家 北巽店,大阪府大阪市生野区巽北3丁目15-24,1000
吉野家 北名古屋店,愛知県北名古屋市井瀬木郷前9-1,980
吉野家 本厚木店,神奈川県厚木市中町2丁目1-22,1050
吉野家 枚方渚内野店,大阪府枚方市渚内野1丁目2-5,1000
吉野家 枚方東香里店,大阪府枚方市東香里南町52-30,1000
吉野家 霧島店,鹿児島県霧島市国分野口町4-26,900
吉野家 名駅サンロード店,愛知県名古屋市中村区名駅4丁目7-25,1000
吉野家 名駅西店,愛知県名古屋市中村区椿町1-3,1000
吉野家 名駅太閤通口店,愛知県名古屋市中村区椿町7-4,1050
吉野家 名岐一宮店,愛知県一宮市富士3丁目3-6,1000
吉野家 名岐岐南町店,岐阜県羽島郡岐南町伏屋6丁目179,1000
吉野家 名護バイパス店,沖縄県名護市大北5丁目22-23,900
吉野家 名四四日市店,三重県四日市市北納屋町1-21,1000
吉野家 名四長島店,三重県桑名市長島町福吉516,1000
吉野家 名四飛島店,愛知県海部郡飛島村竹之郷2丁目2-18,1000
吉野家 名四宝神町店,愛知県名古屋市港区神宮寺1丁目511,1000
吉野家 名四要町店,愛知県名古屋市南区丹後通4丁目6-1,1000
吉野家 名神豊中庄内店,大阪府豊中市庄内栄町4丁目21-36,1000
吉野家 名鉄堀田駅前店,愛知県名古屋市瑞穂区塩入町4-15,1000
吉野家 名鉄名古屋駅店,愛知県名古屋市中村区名駅1丁目2-1,1000
吉野家 明石魚住町店,兵庫県明石市魚住町清水2360-5,950
吉野家 明大前店,東京都世田谷区松原1丁目38-4,1150
吉野家 木更津駅前店,千葉県木更津市富士見1丁目1-1,1000
吉野家 目黒駅前店,東京都品川区上大崎2丁目27-2,1300
吉野家 門前仲町店,東京都江東区富岡1丁目10-8,1200
吉野家 野々市店,石川県野々市市粟田6丁目386,950
吉野家 野里店,大阪府大阪市西淀川区花川2丁目21-13,1000
吉野家 柳生店,宮城県名取市田高神明186-1,900
吉野家 有楽町２丁目店,東京都千代田区有楽町2丁目8-3,1100
吉野家 有楽町店,東京都千代田区有楽町2丁目9-18,1300
吉野家 有明セントラルタワー店,東京都江東区有明3丁目7-18,1100
吉野家 淀川通塚本店,大阪府大阪市淀川区塚本2丁目13-20,1000
吉野家 藍住町店,徳島県板野郡藍住町東中富北傍示28-1,900
吉野家 利府店,宮城県宮城郡利府町神谷沢館ノ内73-1,900
吉野家 立花駅前店,兵庫県尼崎市立花町1丁目3-1,950
吉野家 立花店,東京都墨田区立花5丁目2-1,1100
吉野家 立場店,神奈川県横浜市泉区中田北1丁目26-6,1050
吉野家 立川北口大通り店,東京都立川市曙町2丁目12-2,1100
吉野家 流山店,千葉県流山市加4-1643,1000
吉野家 龍野店,兵庫県たつの市龍野町富永796-1,950
吉野家 緑一丁目店,大阪府大阪市鶴見区緑1丁目19-2,1000
吉野家 臨海岸和田店,大阪府岸和田市下野町3丁目10-39,1000
吉野家 臨海石津川店,大阪府堺市西区浜寺石津町西2丁322-1,1000
吉野家 臨海二色の浜店,大阪府貝塚市澤877-1,1000
吉野家 臨海緑町店,大阪府堺市堺区緑町1丁14-1,1000
吉野家 鈴鹿西条店,三重県鈴鹿市西条9丁目4,950
吉野家 練馬店,東京都練馬区練馬1丁目5-4,1100
吉野家 蓮田店,埼玉県蓮田市西新宿1丁目7,1000
吉野家 連島店,岡山県倉敷市連島3丁目8-35,950
吉野家 和歌山築地橋店,和歌山県和歌山市舟津町1丁目10,930
吉野家 和歌山東店,和歌山県和歌山市太田564-3,900
吉野家 和光笹目通り店,埼玉県和光市丸山台3丁目10-6,1050
吉野家 蕨駅前店,埼玉県蕨市塚越1丁目4-1,1050
吉野家 屏風山ＰＡ上り店,岐阜県瑞浪市土岐町3282-5,1000
吉野家 杁中店,愛知県名古屋市昭和区隼人町6-19,960
吉野家 獨協大学前西口店,埼玉県草加市松原1丁目1,1050
鶏千 イオン北谷店,沖縄県中頭郡北谷町美浜８‐３,850
