吉野家 ＦＣＲ２４６愛甲石田店,神奈川県伊勢原市石田597‐3,1050
吉野家 ＦＣ環状通美園店,北海道札幌市豊平区美園4条6丁目3-10,940
吉野家 ＦＣ玉名パーキングエリア店,熊本県玉名郡南関町大字下坂下字四反田1559‐3,880
吉野家 ＦＣ熊本駅店,熊本県熊本市西区春日3‐15‐1熊本駅構内,900
吉野家 ＦＣ甲府駅前店,山梨県甲府市丸の内1丁目2番13号,950
吉野家 ＦＣ鹿児島伊敷店,鹿児島県鹿児島市伊敷1-3-15,900
吉野家 ＦＣ鹿児島住吉店,鹿児島県鹿児島市住吉町10‐16,950
吉野家 ＦＣ宿河原店,神奈川県川崎市多摩区長尾5‐19,1050
吉野家 ＦＣ新梅田食道街店,大阪府大阪市北区角田町9‐17,1200
吉野家 ＦＣ西尾店,愛知県西尾市下町神明下59,1000
吉野家 ＦＣ青梅新町店,東京都青梅市新町5‐3‐14,1050
吉野家 ＦＣ千歳店,北海道千歳市北栄2丁目1345番29,940
吉野家 ＦＣ相模原駅前店,神奈川県相模原市中央区相模原3丁目1‐13,1050
吉野家 ＦＣ相模原二本松店,神奈川県相模原市緑区二本松3丁目31番,1050
吉野家 ＦＣ大通西１０丁目店,北海道札幌市中央区大通西10丁目4‐173,940
吉野家 ＦＣ大日店,大阪府守口市大日町3丁目1‐13,1000
吉野家 ＦＣ大分竹町店,大分県大分市中央町1丁目5‐1,950
吉野家 ＦＣ大分府内大橋店,大分県大分市畑中１丁目２番２９号,950
吉野家 ＦＣ竹ノ塚駅前店,東京都足立区竹之塚6‐5‐3,1050
吉野家 ＦＣ長崎駅前店,長崎県長崎市大黒町9‐31アンガスビル1F,900
吉野家 ＦＣ長崎滑石店,長崎県長崎市滑石2‐1‐40,850
吉野家 ＦＣ苫小牧新開町店,北海道苫小牧市新開町２‐２‐２,940
吉野家 ＦＣ南郷通６丁目店,北海道札幌市白石区南郷通6丁目北42‐2,940
吉野家 ＦＣ南池袋店,東京都豊島区南池袋2丁目26-4,1150
吉野家 ＦＣ尼宝線労災病院前店,兵庫県尼崎市稲葉元町3丁目21,950
吉野家 ＦＣ博多デイトスアネックス店,福岡県福岡市博多区博多駅中央街1番1号JR九州築紫口ビル1階,950
吉野家 ＦＣ八王子大和田店,東京都八王子市大和田5‐3‐3,1050
吉野家 ＦＣ鳩ヶ谷店,埼玉県川口市三ツ和2-12-1,1050
吉野家 ＦＣ豊田インター通り店,愛知県豊田市深田町1丁目74‐1,1000
吉野家 ＦＣ本市場店,静岡県富士市本市場４２４‐２,1000
吉野家 ＦＣ羊ヶ丘通清田店,北海道札幌市清田区清田2条3丁目3,940
吉野家 ＪＲ茨木駅前店,大阪府茨木市西駅前町5-36,1000
吉野家 ＪＲ京橋駅ホーム店,大阪府大阪市城東区新喜多1丁目2-31,1000
吉野家 ＪＲ古河駅店,茨城県古河市本町1-1-15,1000
吉野家 ＪＲ神戸駅店,兵庫県神戸市中央区相生町3丁目1,1200
吉野家 ＪＲ神田駅店,東京都千代田区鍛冶町2丁目13-26,1100
吉野家 ＪＲ清水駅店,静岡県静岡市清水区真砂町1-1,950
吉野家 ＪＲ西九条駅店,大阪府大阪市此花区西九条1丁目32-16,1000
吉野家 ＪＲ静岡駅店,静岡県静岡市葵区黒金町47,1000
吉野家 ＪＲ塚本駅店,大阪府大阪市淀川区塚本2丁目28-2,1000
吉野家 ＪＲ拝島駅店,東京都昭島市松原町4丁目14-4,1080
吉野家 ＪＲ姫路駅店,兵庫県姫路市駅前町188,1000
吉野家 ＪＲ兵庫駅店,兵庫県神戸市兵庫区駅南通5丁目3-7,1000
吉野家 ＪＲ明石駅店,兵庫県明石市大明石町1丁目1-23,1000
吉野家 ＴＸ守谷駅店,茨城県守谷市中央3丁目2,1000
吉野家 ＴＸ流山おおたかの森店,千葉県流山市西初石6-182-3,1000
吉野家 いわき平谷川瀬店,福島県いわき市平谷川瀬2丁目12-1,1000
吉野家 うるま志林川店,沖縄県うるま市高江洲1079-1,850
吉野家 お初天神店,大阪府大阪市北区曾根崎2丁目5-20,1050
吉野家 お台場デックス店,東京都港区台場1丁目6-1,1100
吉野家 お茶の水店,東京都千代田区神田駿河台2丁目4-14,1150
吉野家 ぐみの木店,大阪府大阪狭山市グミノ木6丁目921-1,1000
吉野家 こてはし台店,千葉県千葉市花見川区大日町1363,1030
吉野家 さいたま東大宮店,埼玉県さいたま市見沼区東大宮3丁目3-12,1000
吉野家 せんげん台駅西口店,埼玉県越谷市千間台西1丁目67,1000
吉野家 つくばみらい店,茨城県つくばみらい市小絹726-2,1000
吉野家 つくば台町店,茨城県つくば市台町2丁目3-14,950
吉野家 つくば大境店,茨城県つくば市西大橋593-10,950
吉野家 つくば天久保店,茨城県つくば市天久保2-15-1,950
吉野家 なんばＣＩＴＹ南館店,大阪府大阪市中央区難波5丁目1-60,1100
吉野家 ひたちなか西光地店,茨城県ひたちなか市西光地3丁目1-1,900
吉野家 ひたちなか店,茨城県ひたちなか市中根3169-2,950
吉野家 ひめゆり通り店,沖縄県那覇市壺屋2-6-5,850
吉野家 みどり大間々店,群馬県みどり市大間々町大間々382-1,950
吉野家 アクロスプラザ足利店,栃木県足利市田中町95-1,1000
吉野家 アスティ岐阜駅店,岐阜県岐阜市橋本町1丁目10-1,950
吉野家 イオンタウン宮古南店,沖縄県宮古島市平良松原631,900
吉野家 イオンモール広島府中店,広島県安芸郡府中町大須2丁目1-1,950
吉野家 イオンモール川口前川店,埼玉県川口市前川1丁目1-11,1050
吉野家 イオン相模原店,神奈川県相模原市南区古淵2丁目10-1,1050
吉野家 エキア北千住店,東京都足立区千住旭町42-1,1150
吉野家 エコールいずみ店,大阪府和泉市イブキ野5丁目1-14,1000
吉野家 カインズホーム市原店,千葉県市原市更級3丁目1-1,1030
吉野家 カインズホーム千葉ＮＴ店,千葉県印西市泉野1丁目144-6,1100
吉野家 カインズホーム木更津店,千葉県木更津市金田東3丁目1-3,1030
吉野家 カインズ宇都宮テクノ店,栃木県宇都宮市ユイノ杜5丁目26-5,1000
吉野家 カインズ羽生店,埼玉県羽生市小松457-1,1000
吉野家 カインズ結城店,茨城県結城市結城9784-3,980
吉野家 コーナン市川原木店,千葉県市川市原木2526-6,1100
吉野家 コロワ甲子園店,兵庫県西宮市甲子園高潮町3-3,950
吉野家 ザビエル公園店,大阪府堺市堺区戎之町東1-1,1000
吉野家 ダイバーシティ東京プラザ店,東京都江東区青海1丁目1-10,1100
吉野家 ドーチカ店,大阪府大阪市北区堂島1丁目,1050
吉野家 パイプライン浦添店,沖縄県浦添市屋富祖1丁目1-2,850
吉野家 パビリオン成田店,千葉県成田市ウイング土屋80,1100
吉野家 ビエラ岸辺健都店,大阪府吹田市岸部新町5-45,1000
吉野家 ビエラ高槻南店,大阪府高槻市紺屋町1-3,1000
吉野家 フェニックスプラザ摩耶店,兵庫県神戸市灘区味泥町6-1,950
吉野家 フレスポ新発田店,新潟県新発田市富塚町3丁目281-1,930
吉野家 フレンテ西宮店,兵庫県西宮市池田町11-1,970
吉野家 プリコ三宮店,兵庫県神戸市中央区加納町4丁目1-1,1000
吉野家 プレナ幕張店,千葉県千葉市美浜区ヒビ野2丁目4,1000
吉野家 ペリエ千葉店,千葉県千葉市中央区新千葉1丁目1-1,1050
吉野家 モレラ東戸塚西口店,神奈川県横浜市戸塚区川上町91-1,1050
吉野家 ヴィアあべのウォーク店,大阪府大阪市阿倍野区阿倍野筋1丁目6-1,1000
吉野家 阿佐ヶ谷店,東京都杉並区成田東5丁目42-10,1100
吉野家 阿波座店,大阪府大阪市西区阿波座1丁目13-11,1000
吉野家 旭川４条通店,北海道旭川市4条通2丁目924-2,940
吉野家 旭川永山店,北海道旭川市永山3条8丁目1-5,940
吉野家 旭川豊岡店,北海道旭川市豊岡1条4丁目340-43,940
吉野家 綾瀬駅東口店,東京都足立区綾瀬3丁目1-1-15,1100
吉野家 綾瀬店,神奈川県綾瀬市深谷中4丁目6-14,1050
吉野家 伊賀上野店,三重県伊賀市小田町251番地,1000
吉野家 伊勢佐木町店,神奈川県横浜市中区伊勢佐木町4丁目109,1100
吉野家 伊予松前店,愛媛県伊予郡松前町北黒田240-1,900
吉野家 一宮妙興寺店,愛知県一宮市妙興寺1丁目2-10,980
吉野家 稲沢下津店,愛知県稲沢市下津下町西1丁目62-1,980
吉野家 稲沢市役所前店,愛知県稲沢市船橋町花ノ木1191-1,1000
吉野家 稲毛駅東口店,千葉県千葉市稲毛区小仲台2丁目7-13,1000
吉野家 茨田店,大阪府大阪市鶴見区浜3丁目7-107,1000
吉野家 茨木真砂店,大阪府茨木市真砂1丁目2-4,1000
吉野家 宇治槙島店,京都府宇治市槙島町一ノ坪39,950
吉野家 宇都宮宮の内店,栃木県宇都宮市宮ノ内3丁目177-1,1000
吉野家 宇都宮競輪場通り店,栃木県宇都宮市上大曽町361-1,1000
吉野家 宇都宮今泉店,栃木県宇都宮市中今泉5丁目37-4,980
吉野家 宇都宮細谷町店,栃木県宇都宮市細谷町326,1000
吉野家 宇都宮城東店,栃木県宇都宮市城東1丁目10-26,1000
吉野家 宇都宮南店,栃木県宇都宮市西川田町936-6,1000
吉野家 烏丸五条店,京都府京都市下京区高砂町381-1,1000
吉野家 羽曳野店,大阪府羽曳野市向野3丁目74-1,1000
吉野家 羽田空港第１ターミナルビル店,東京都大田区羽田空港3丁目3-2,1150
吉野家 浦安駅前店,千葉県浦安市北栄1丁目17-16,1100
吉野家 浦和仲町店,埼玉県さいたま市浦和区仲町2丁目3-22,1050
吉野家 曳舟店,東京都墨田区京島1丁目1-1-101,1100
吉野家 栄生店,愛知県名古屋市西区栄生1丁目32-16,1000
吉野家 永田町一丁目店,東京都千代田区永田町一丁目7番1号本館西側付属家内,1200
吉野家 越谷駅高架下店,埼玉県越谷市弥生町4-11,1000
吉野家 円町店,京都府京都市中京区西ノ京円町6-1,950
吉野家 燕三条店,新潟県三条市上須頃323,950
吉野家 塩釜口店,愛知県名古屋市天白区塩釜口1丁目832,960
吉野家 塩尻店,長野県塩尻市広丘高出1783-1,960
吉野家 押上店,東京都墨田区押上1丁目19-1,1100
吉野家 横須賀三春町店,神奈川県横須賀市三春町4丁目28-1,1050
吉野家 横堤店,大阪府大阪市鶴見区横堤3丁目6-44,1000
吉野家 横浜ジョイナス店,神奈川県横浜市西区南幸1-5-1,1300
吉野家 横浜駅西口店,神奈川県横浜市西区南幸2丁目7-15,1100
吉野家 横浜駅東口店,神奈川県横浜市西区高島2-14-13,1100
吉野家 王子神谷店,東京都北区王子5丁目10-1,1050
吉野家 王子東店,東京都北区王子1丁目6-7,1050
吉野家 王寺駅前店,奈良県北葛城郡王寺町久度2丁目3538-1,880
吉野家 岡崎南店,愛知県岡崎市若松東1丁目3-5,960
吉野家 岡崎北店,愛知県岡崎市井ノ口新町1-3,960
吉野家 岡山裁判所前店,岡山県岡山市北区富田町1丁目4-8,950
吉野家 岡山松浜店,岡山県岡山市南区松浜町15-28,900
吉野家 岡山新保店,岡山県岡山市南区新保1614-1,900
吉野家 岡山大安寺店,岡山県岡山市北区大安寺南町1丁目6-1,900
吉野家 岡山桃太郎通り店,岡山県岡山市北区本町2-9,950
吉野家 岡山平井店,岡山県岡山市中区平井4丁目24-32,900
吉野家 沖縄南インター店,沖縄県沖縄市上地4丁目20-7,850
吉野家 沖浜南店,徳島県徳島市八万町大野178-3,900
吉野家 荻窪北口店,東京都杉並区上荻1丁目15-2,1100
吉野家 桶川北店,埼玉県桶川市北2丁目1538-4,1000
吉野家 下関幡生店,山口県下関市生野町2丁目28-4,900
吉野家 下高井戸駅店,東京都世田谷区松原3丁目29-17,1150
吉野家 下笹目店,埼玉県戸田市笹目6丁目21-4,1050
吉野家 下石神井千川通り店,東京都練馬区下石神井2丁目3-1,1100
吉野家 下鶴間店,神奈川県大和市鶴間1丁目27-8,1050
吉野家 下北沢駅東口店,東京都世田谷区北沢2丁目25-16,1150
吉野家 加古川駅北口店,兵庫県加古川市加古川町篠原町30-10,950
吉野家 河合町店,奈良県北葛城郡河合町池部2丁目4-17,930
吉野家 河内小阪駅前店,大阪府東大阪市小阪本町1丁目3-2,1000
吉野家 霞が関３号館店,東京都千代田区霞ガ関2-1-3中央合同庁舎第3号館地下1階食堂区画,1200
吉野家 霞が関コモンゲート店,東京都千代田区霞ガ関3-2-1,1200
吉野家 外環状線醍醐店,京都府京都市伏見区醍醐大構町15-5,950
吉野家 外環和光北インター通り店,埼玉県朝霞市台久田257-1,1050
吉野家 掛川ＰＡ上り店,静岡県掛川市倉真藪ノ上7507-1-1,1100
吉野家 掛川店,静岡県掛川市城西2丁目13-5,1050
吉野家 笠間友部店,茨城県笠間市東平3丁目1-14,950
吉野家 橿原木原町店,奈良県橿原市木原町223-1,900
吉野家 葛西駅前店,東京都江戸川区中葛西5丁目43-1,1100
吉野家 蒲田駅前店,東京都大田区西蒲田7丁目5-12,1150
吉野家 蒲田東口店,東京都大田区蒲田5丁目24-3,1150
吉野家 鎌ヶ谷店,千葉県鎌ケ谷市道野辺本町1丁目2-3,1000
吉野家 茅ヶ崎駅南口店,神奈川県茅ヶ崎市幸町2-10,1050
吉野家 茅ヶ崎円蔵店,神奈川県茅ヶ崎市円蔵1丁目24-10,1050
吉野家 茅場町店,東京都中央区日本橋茅場町1丁目4-6,1150
吉野家 寒川一之宮店,神奈川県高座郡寒川町一之宮2丁目12-15,1050
吉野家 環状２号線下永谷店,神奈川県横浜市港南区下永谷6丁目10-20,1050
吉野家 環状４号線下瀬谷店,神奈川県横浜市瀬谷区下瀬谷2丁目18-17,1100
吉野家 環状４号線霧が丘店,神奈川県横浜市緑区霧ガ丘2丁目2-3,1100
吉野家 環状７号線豊玉南店,東京都練馬区豊玉南2丁目16-15,1100
吉野家 環状七号線鹿浜店,東京都足立区鹿浜3丁目2-20,1100
吉野家 環状線和泉店,愛媛県松山市土居田町94-1,900
吉野家 環状通東店,北海道札幌市東区北15条東17丁目1,940
吉野家 関内店,神奈川県横浜市中区真砂町3丁目32,1100
吉野家 関目店,大阪府大阪市城東区成育5丁目22-11,1000
吉野家 丸田町店,愛知県名古屋市中区栄5丁目25-28,1100
吉野家 岸和田和泉インター店,大阪府岸和田市三田町400-21,1000
吉野家 岩倉店,愛知県岩倉市大地新町3丁目10-1,980
吉野家 岐阜羽島店,岐阜県羽島市竹鼻町丸ノ内1丁目1,1000
吉野家 岐阜市橋店,岐阜県岐阜市市橋2丁目8-2,950
吉野家 岐阜則武店,岐阜県岐阜市則武中2丁目35-7,1000
吉野家 岐阜長森店,岐阜県岐阜市石長町5丁目16-1,950
吉野家 岐阜六条店,岐阜県岐阜市六条江東3丁目5-1,950
吉野家 気仙沼店,宮城県気仙沼市田中前2丁目1-5,1000
吉野家 亀戸駅前店,東京都江東区亀戸2丁目20-7,1100
吉野家 亀山店,三重県亀山市東御幸町穴淵224-2,950
吉野家 菊川駅前店,東京都墨田区菊川2丁目6-13,1200
吉野家 吉祥寺北店,東京都武蔵野市吉祥寺本町1丁目8-3,1100
吉野家 吉野家 北新宿百人町店,東京都新宿区百人町1丁目24-4,1150
吉野家 久屋大通錦店,愛知県名古屋市中区錦3丁目6-15,1050
吉野家 久喜店,埼玉県久喜市久喜本785-1,1050
吉野家 久留米市役所前店,福岡県久留米市中央町23-2,900
吉野家 久留米上津店,福岡県久留米市上津町1417-14,900
吉野家 宮崎祇園店,宮崎県宮崎市霧島4丁目44-1,900
吉野家 宮崎瀬頭店,宮崎県宮崎市瀬頭2丁目1-4,900
吉野家 宮崎南店,宮崎県宮崎市中村西3丁目3-61,900
吉野家 宮城佐沼店,宮城県登米市迫町佐沼萩洗2丁目1-3,900
吉野家 牛久南店,茨城県牛久市南6丁目4-5,950
吉野家 魚津店,富山県魚津市上村木848-2,1000
吉野家 京王多摩センター店,東京都多摩市落合1丁目10-1,1100
吉野家 京橋店,東京都中央区京橋3丁目6-21,1150
吉野家 京阪枚方市駅店,大阪府枚方市岡東町19-14,1000
吉野家 京成高砂駅前店,東京都葛飾区高砂5丁目29-11,1150
吉野家 京成船橋店,千葉県船橋市本町1丁目5-1,1100
吉野家 京都駅八条口店,京都府京都市南区西九条北ノ内町41-4,1000
吉野家 京都九条店,京都府京都市南区西九条東島町61,950
吉野家 京都百万遍店,京都府京都市左京区田中門前町28-14,970
吉野家 京都洛北店,京都府京都市左京区下鴨本町12-3,970
吉野家 狭山台店,埼玉県狭山市狭山台1丁目2-5,990
吉野家 玉江橋線塚口店,兵庫県尼崎市塚口本町3丁目380-9,950
吉野家 玉出店,大阪府大阪市住之江区粉浜西1丁目1-23,1000
吉野家 玉村上飯島店,群馬県佐波郡玉村町上飯島269-1,1000
吉野家 錦糸町南口店,東京都墨田区江東橋3丁目14-13,1100
吉野家 錦糸町北口店,東京都墨田区錦糸2丁目4-10,1100
吉野家 近江八幡店,滋賀県近江八幡市鷹飼町1478,950
吉野家 近鉄四日市店,三重県四日市市安島1丁目1-20,950
吉野家 近鉄八尾駅前店,大阪府八尾市光町2丁目180-1,1000
吉野家 金沢もりの里店,石川県金沢市モリノ里1丁目60,950
吉野家 金沢三馬店,石川県金沢市三馬3-345,950
吉野家 金沢新神田店,石川県金沢市新神田2丁目13-10,1000
吉野家 金沢畝田店,石川県金沢市畝田西1丁目103,1000
吉野家 金町北口店,東京都葛飾区東金町1丁目22-11,1100
吉野家 銀座３丁目店,東京都中央区銀座3丁目5-5,1100
吉野家 九条店,大阪府大阪市西区千代崎2丁目10-1,1000
吉野家 釧路鳥取大通店,北海道釧路市鳥取大通7丁目6-1,950
吉野家 熊谷駅北口店,埼玉県熊谷市筑波2丁目112,1000
吉野家 熊本下通店,熊本県熊本市中央区下通1丁目3-1,950
吉野家 熊本健軍店,熊本県熊本市東区東野2丁目1-3,930
吉野家 熊本光の森店,熊本県菊池郡菊陽町光ノ森6丁目2-2,950
吉野家 熊本東バイパス店,熊本県熊本市東区上南部2丁目1-108,930
吉野家 熊本日赤通り店,熊本県熊本市中央区帯山6丁目3-32,930
吉野家 栗林店,香川県高松市東ハゼ町12-4,900
吉野家 郡山さくら通り店,福島県郡山市虎丸町9-15,900
吉野家 郡上八幡店,岐阜県郡上市八幡町城南町221-1,1000
吉野家 恵比寿駅前店,東京都渋谷区恵比寿西1丁目9-6,1200
吉野家 恵比寿駅東口店,東京都渋谷区恵比寿1-13-9,1200
吉野家 恵美須町店,大阪府大阪市浪速区日本橋5丁目13-9,1000
吉野家 犬山店,愛知県犬山市犬山東古券316-1,960
吉野家 見沼南中野店,埼玉県さいたま市見沼区南中野461-1,1050
吉野家 元住吉駅前店,神奈川県川崎市中原区木月2丁目3-1,1100
吉野家 原宿竹下口店,東京都渋谷区神宮前1丁目17-1,1150
吉野家 古市場店,千葉県千葉市緑区古市場町624-1,1030
吉野家 古出来町店,愛知県名古屋市千種区北千種1丁目1-1,1000
吉野家 戸塚駅西口店,神奈川県横浜市戸塚区戸塚町16-1B204,1050
吉野家 戸田喜沢店,埼玉県戸田市喜沢1丁目23-1,1050
吉野家 戸田新曽店,埼玉県戸田市新曽2097,1050
吉野家 戸田店,埼玉県戸田市下戸田2丁目11-4,1050
吉野家 虎ノ門店,東京都港区虎ノ門1丁目1-21,1200
吉野家 五合橋線尾浜店,兵庫県尼崎市尾浜町1丁目29-1,950
吉野家 五日市街道並木町店,東京都国分寺市並木町2丁目23-7,1100
吉野家 五反田駅前店,東京都品川区東五反田1丁目13-7,1150
吉野家 御徒町駅前店,東京都台東区上野4丁目2-1,1100
吉野家 御堂筋難波店,大阪府大阪市中央区道頓堀2丁目1-1,1100
吉野家 護国寺店,東京都文京区音羽2丁目2-2,1100
吉野家 厚木街道東希望が丘店,神奈川県横浜市旭区東希望ガ丘42,1100
吉野家 厚木関口店,神奈川県厚木市関口236ー5,1050
吉野家 向ヶ丘駅前店,神奈川県川崎市多摩区登戸2737-5,1100
吉野家 広島吉島店,広島県広島市中区吉島西2丁目17-28-3,1000
吉野家 広島本通店,広島県広島市中区本通8-2,1000
吉野家 弘前中央通り店,青森県弘前市北瓦ヶ町7-1,850
吉野家 江古田南口店,東京都練馬区豊玉上1丁目10-10,1100
吉野家 江戸川区役所前店,東京都江戸川区中央1丁目12-8,1100
吉野家 江坂駅東店,大阪府吹田市江坂町1丁目22-12,1000
吉野家 江南店,愛知県江南市高屋町西里5-2,1050
吉野家 港町店,福岡県福岡市中央区港2丁目7-7,950
吉野家 港南台店,神奈川県横浜市港南区港南台2丁目24-1,1050
吉野家 港北ニュータウン店,神奈川県横浜市都筑区茅ガ崎南2丁目11-10,1100
吉野家 溝の口店,神奈川県川崎市高津区溝口1丁目11-23,1100
吉野家 甲州街道府中白糸台店,東京都府中市若松町1丁目25-6,1100
吉野家 甲府バイパス向町店,山梨県甲府市向町517‐1,950
吉野家 甲府バイパス竜王店,山梨県甲斐市富竹新田1280,950
吉野家 綱島駅東口店,神奈川県横浜市港北区綱島西1丁目1-32,1100
吉野家 荒川沖店,茨城県稲敷郡阿見町住吉2丁目24-6,950
吉野家 行幸道路相武台店,神奈川県座間市相武台1丁目24-1,1050
吉野家 行徳新浜店,千葉県市川市新浜1丁目2-17,1100
吉野家 行徳相之川店,千葉県市川市相之川2丁目6-4,1300
吉野家 高円寺駅前店,東京都杉並区高円寺北2丁目4-7,1100
吉野家 高岡上北島店,富山県高岡市上北島40-1,1000
吉野家 高岡宝町店,富山県高岡市宝町2-18,1000
吉野家 高崎環状線上豊岡店,群馬県高崎市上豊岡町833-1,950
吉野家 高崎上大類町店,群馬県高崎市上大類町1018-1,1000
吉野家 高崎飯塚町店,群馬県高崎市飯塚町475-1,1000
吉野家 高松屋島店,香川県高松市新田町甲69番地5,900
吉野家 高松瓦町店,香川県高松市南新町8-1,950
吉野家 高松中央インター店,香川県高松市木太町581-4,900
吉野家 高知インター店,高知県高知市高ソネ14-6,900
吉野家 高槻若松町店,大阪府高槻市若松町3-6,1000
吉野家 高槻店,大阪府高槻市城西町4-46,1000
吉野家 高田馬場駅前店,東京都新宿区高田馬場1丁目26-12,1150
吉野家 高島平大門店,東京都板橋区高島平3丁目3-2,1100
吉野家 高浜沢渡町店,愛知県高浜市沢渡町5丁目5-10,1000
吉野家 鴻池新田店,大阪府東大阪市中鴻池町2丁目1-7,1000
吉野家 国際センター店,愛知県名古屋市中村区那古野1丁目46-12,1000
吉野家 国分寺北口店,東京都国分寺市本町2丁目10-5,1100
吉野家 国立府中インター店,東京都国立市谷保620-1,1050
吉野家 今里店,大阪府大阪市東成区大今里西1丁目30-10,1000
吉野家 根津店,東京都文京区根津2丁目18-12,1100
吉野家 佐賀環状東通り店,佐賀県佐賀市巨勢町大字牛島一本松415‐4,900
吉野家 佐世保下京店,長崎県佐世保市下京町1‐1,900
吉野家 佐倉ユーカリが丘店,千葉県佐倉市上座1205-1,1000
吉野家 佐倉寺崎店,千葉県佐倉市寺崎北4丁目1-5,1000
吉野家 佐渡佐和田店,新潟県佐渡市長木767-1,900
吉野家 佐波川ＳＡ下り店,山口県防府市佐野452-2,900
吉野家 佐波川ＳＡ上り店,山口県防府市佐野1431,900
吉野家 佐野高萩町店,栃木県佐野市高萩町463-1,960
吉野家 佐野大橋店,栃木県佐野市大橋町2065-5,960
吉野家 坂戸鎌倉店,埼玉県坂戸市鎌倉町1-1,1000
吉野家 坂出店,香川県坂出市元町3丁目5-2,900
吉野家 阪急茨木市駅前店,大阪府茨木市別院町3-1,1000
吉野家 阪急上新庄店,大阪府大阪市東淀川区上新庄2丁目24-24,1000
吉野家 阪急西院店,京都府京都市右京区西院高山寺町12-1,1000
吉野家 堺東駅前店,大阪府堺市堺区中瓦町2丁目3-26,1000
吉野家 桜橋店,大阪府大阪市北区曽根崎新地2丁目1-21,1050
吉野家 笹塚京王クラウン街店,東京都渋谷区笹塚1-55-16,1150
吉野家 札幌エスタ店,北海道札幌市中央区北5条西2丁目1,940
吉野家 札幌駅ＡＰＩＡ店,北海道札幌市中央区北5条西4丁目,940
吉野家 札幌西町店,北海道札幌市西区西町南11丁目1-38,940
吉野家 札幌狸小路店,北海道札幌市中央区南3条西4丁目12-1,960
吉野家 札幌伏古店,北海道札幌市東区伏古11条4丁目1-5,940
吉野家 札幌麻生店,北海道札幌市北区北40条西5丁目331-1,940
吉野家 三ノ輪店,東京都台東区根岸5丁目18-15,1100
吉野家 三宮駅南店,兵庫県神戸市中央区旭通5丁目3-15,1000
吉野家 三郷上彦名店,埼玉県三郷市上彦名417-1,1050
吉野家 三郷中央店,埼玉県三郷市中央5丁目45-6,1050
吉野家 三軒茶屋店,東京都世田谷区太子堂2丁目16-8,1200
吉野家 三蔵通伏見店,愛知県名古屋市中区栄1-12-6,1100
吉野家 三鷹駅南口店,東京都三鷹市下連雀3丁目27-9,1100
吉野家 三沢松園町店,青森県三沢市松園町3丁目1-32,920
吉野家 山形西バイパス店,山形県山形市西田2丁目24-1,900
吉野家 山口防府店,山口県防府市八王子1丁目19-12,950
吉野家 山陽小野田店,山口県山陽小野田市日ノ出2丁目8-5,900
吉野家 山陽道沼田ＰＡ下り店,広島県広島市安佐南区伴東町136-1,950
