吉野家 産業道路さいたま上木崎店,埼玉県さいたま市浦和区上木崎4丁目12-12,1050
吉野家 四ッ谷駅前店,東京都新宿区四谷1丁目8-14,1200
吉野家 四軒家店,愛知県名古屋市守山区白山2丁目808,980
吉野家 四条東洞院店,京都府京都市下京区立売西町59-2,1000
吉野家 子母口店,神奈川県川崎市高津区子母口521-2,1100
吉野家 市ヶ谷駅前店,東京都千代田区五番町3-3,1100
吉野家 市川駅前店,千葉県市川市市川1丁目8-2,1100
吉野家 市川鬼高店,千葉県市川市鬼高3丁目14-11,1030
吉野家 市大病院前店,愛知県名古屋市瑞穂区瑞穂通1丁目2,1000
吉野家 市谷本村町１Ｆ店,東京都新宿区市谷本村町5番-1号,1200
吉野家 市役所通り蒲郡店,愛知県蒲郡市竹谷町松本22-1,1000
吉野家 志木南口店,埼玉県新座市東北2丁目38-1,1000
吉野家 寺田町駅前店,大阪府大阪市天王寺区大道4丁目10-9,1000
吉野家 自由が丘店,東京都目黒区自由ガ丘1丁目10-4,1200
吉野家 鹿屋店,鹿児島県鹿屋市寿2丁目8-7,900
吉野家 篠ノ井バイパス店,長野県長野市合戦場3丁目38,960
吉野家 篠崎駅前店,東京都江戸川区篠崎町7丁目27-1,1100
吉野家 芝大門店,東京都港区芝大門2丁目1-2,1100
吉野家 芝田町店,大阪府大阪市北区芝田町2丁目1-21,1100
吉野家 守口店,大阪府守口市京阪本通2丁目15-13,1000
吉野家 守山松川橋店,愛知県名古屋市守山区白沢町1,980
吉野家 守山店,愛知県名古屋市守山区大谷町1-43,980
吉野家 守谷美園店,茨城県守谷市美園4丁目1-6,1000
吉野家 手稲前田店,北海道札幌市手稲区前田5条6丁目3-18,940
吉野家 秋田駅ビルトピコ店,秋田県秋田市中通7丁目1-2,900
吉野家 秋田広面店,秋田県秋田市広面樋ノ沖82-2,900
吉野家 秋葉原中央通り店,東京都千代田区外神田1丁目11-8,1150
吉野家 秋葉原店,東京都千代田区神田松永町10-1,1150
吉野家 習志野台店,千葉県船橋市習志野1丁目9-23,1000
吉野家 習志野藤崎店,千葉県習志野市藤崎4丁目3-15,1000
吉野家 住之江公園店,大阪府大阪市住之江区南加賀屋2丁目8-26,1000
吉野家 十三店,大阪府大阪市淀川区十三本町1丁目8-17,1000
吉野家 十二所前線姫路西店,兵庫県姫路市東今宿3-1225-1,950
吉野家 渋川インター店,群馬県渋川市半田2479-1,1000
吉野家 渋谷１０９前店,東京都渋谷区道玄坂2丁目5-7,1200
吉野家 春吉店,福岡県福岡市中央区春吉3丁目21-21,900
吉野家 春日井出川町店,愛知県春日井市出川町8丁目10-6,1000
吉野家 春日井店,愛知県春日井市鳥居松町1丁目15-297,1000
吉野家 春日宝町店,福岡県春日市宝町4丁目24-6,900
吉野家 初台店,東京都渋谷区代々木4丁目32-3,1200
吉野家 所沢駅前店,埼玉県所沢市日吉町11-20,1000
吉野家 女池上山店,新潟県新潟市中央区女池上山2丁目17-6,950
吉野家 小割通店,愛知県名古屋市港区小割通3丁目1,1000
吉野家 小岩駅南口店,東京都江戸川区南小岩7丁目25-1,1100
吉野家 小岩北口店,東京都江戸川区西小岩3丁目-31-10,1100
吉野家 小金井店,東京都小金井市前原町4丁目13-7,1100
吉野家 小松店,石川県小松市今江町4丁目157,1000
吉野家 小川町店,東京都千代田区神田小川町2丁目2,1100
吉野家 小倉京町店,福岡県北九州市小倉北区京町2丁目6-18,900
吉野家 小倉中井店,福岡県北九州市小倉北区中井2丁目7-21,900
吉野家 小伝馬町店,東京都中央区日本橋堀留町1丁目11-10,1150
吉野家 小田急海老名駅店,神奈川県海老名市メグミ町1-1,1100
吉野家 小田急新百合ヶ丘駅店,神奈川県川崎市麻生区万福寺1-18-1,1100
吉野家 小田急大和駅前店,神奈川県大和市中央1丁目1-26,1100
吉野家 小田急町田駅南口店,東京都町田市原町田6丁目11-7,1100
吉野家 小田急登戸駅店,神奈川県川崎市多摩区登戸3437-2,1100
吉野家 小田原駅前店,神奈川県小田原市栄町1丁目14-3,1050
吉野家 小牧岩崎店,愛知県小牧市岩崎5丁目195,980
吉野家 庄内緑地公園店,愛知県名古屋市西区南川町15,1000
吉野家 松井山手店,京都府八幡市美濃山出口38-1,1000
吉野家 松戸みのり台店,千葉県松戸市稔台8丁目1-6,1000
吉野家 松戸古ヶ崎店,千葉県松戸市古ケ崎4丁目3522-2,1000
吉野家 松戸西口店,千葉県松戸市本町20-2,1000
吉野家 松戸東口店,千葉県松戸市松戸1230-1,1000
吉野家 松江学園通り店,島根県松江市学園1丁目17-20,900
吉野家 松阪久保町店,三重県松阪市久保町1843-46,1000
吉野家 松阪朝日町店,三重県松阪市朝日町一区10-15,1000
吉野家 松山枝松店,愛媛県松山市枝松1丁目9-8,900
吉野家 松山竹原店,愛媛県松山市竹原2丁目1-39,900
吉野家 湘南新道辻堂店,神奈川県藤沢市辻堂太平台2丁目1-14,1050
吉野家 上越高田店,新潟県上越市木田3丁目5-17,950
吉野家 上社店,愛知県名古屋市名東区上社2丁目241,1000
吉野家 上前津店,愛知県名古屋市中区大須4丁目11-44,1000
吉野家 上大岡店,神奈川県横浜市港南区上大岡西1丁目10-9,1100
吉野家 上尾駅前店,埼玉県上尾市谷津2丁目1-50-1,1000
吉野家 上北沢店,東京都世田谷区上北沢5丁目2-4,1150
吉野家 上本町店,大阪府大阪市天王寺区上本町6丁目6-23,1000
吉野家 上末吉店,神奈川県横浜市鶴見区上末吉5丁目4-18,1100
吉野家 上野駅前店,東京都台東区上野7丁目3-2,1100
吉野家 城北公園前店,大阪府大阪市旭区生江三丁目16-34,1000
吉野家 尻手店,神奈川県横浜市鶴見区尻手2丁目ー5ー1,1100
吉野家 寝屋川市駅前店,大阪府寝屋川市早子町23-2,1000
吉野家 寝屋川昭栄町店,大阪府寝屋川市昭栄町16-8,1000
吉野家 寝屋川仁和寺店,大阪府寝屋川市仁和寺町12-15,1000
吉野家 新４号線上三川店,栃木県河内郡上三川町シラサギ1丁目6-8,1000
吉野家 新横浜駅北口店,神奈川県横浜市港北区篠原町2937,1100
吉野家 新開地店,兵庫県神戸市兵庫区新開地2丁目1-9,1000
吉野家 新潟海老ケ瀬ＩＣ店,新潟県新潟市東区大形本町5丁目16-6,950
吉野家 新潟競馬場店,新潟県新潟市北区笹山3490,950
吉野家 新潟本町通店,新潟県新潟市中央区本町通6番町1140-1,1000
吉野家 新居浜神郷店,愛媛県新居浜市神郷1丁目41,1000
吉野家 新居浜店,愛媛県新居浜市松木町4-14,1000
吉野家 新京成八柱駅店,千葉県松戸市日暮1丁目1-2,1000
吉野家 新橋烏森口店,東京都港区新橋3丁目16-3,1200
吉野家 新橋東店,東京都港区新橋2丁目18-5,1100
吉野家 新琴似４番通店,北海道札幌市北区新琴似八条17丁目765-3,940
吉野家 新宿センタービル店,東京都新宿区西新宿1丁目25-1,1200
吉野家 新宿一丁目店,東京都新宿区新宿1丁目33-10,1200
吉野家 新宿京王モール店,東京都新宿区西新宿1丁目1,1200
吉野家 新宿四丁目店,東京都新宿区新宿4丁目3-22,1200
吉野家 新宿南口店,東京都渋谷区代々木2丁目8-5,1200
吉野家 新所沢店,埼玉県所沢市ケヤキ台1丁目13-6,1000
吉野家 新小岩駅前店,東京都葛飾区新小岩1丁目43-3,1100
吉野家 新神戸店,兵庫県神戸市中央区生田町1丁目1-22,950
吉野家 新青梅街道島忠小平店,東京都東久留米市前沢5丁目33-17,1050
吉野家 新青梅街道東大和店,東京都東大和市蔵敷3丁目889-1,1100
吉野家 新大久保駅前店,東京都新宿区百人町2丁目4-1,1200
吉野家 新大橋通り八丁堀店,東京都中央区八丁堀1丁目11-5,1150
吉野家 新長田店,兵庫県神戸市長田区大橋町4丁目3-5,950
吉野家 新百合ヶ丘津久井道店,神奈川県川崎市麻生区片平1丁目7-5,1100
吉野家 新富町店,東京都中央区新富1丁目17-6,1150
吉野家 新木場駅前店,東京都江東区新木場1丁目1-1,1200
吉野家 神戸伊川谷店,兵庫県神戸市西区伊川谷町潤和1155-1,950
吉野家 神戸元町店,兵庫県神戸市中央区元町通1丁目11-13,1000
吉野家 神戸名谷インター店,兵庫県神戸市垂水区名谷町997-4,950
吉野家 神谷町店,東京都港区虎ノ門5丁目11-15,1100
吉野家 神保町店,東京都千代田区神田神保町2丁目7-7,1100
吉野家 人形町店,東京都中央区日本橋人形町2丁目3-2,1150
吉野家 甚目寺店,愛知県あま市下萱津五反田57,1000
吉野家 諏訪インター店,長野県茅野市宮川1345-1,1000
吉野家 須磨パティオ店,兵庫県神戸市須磨区中落合2丁目2-1,950
吉野家 吹田山田店,大阪府吹田市山田西2丁目7-14,1000
吉野家 垂水駅東口店,兵庫県神戸市垂水区神田町1-20,950
吉野家 水戸駅店,茨城県水戸市宮町1丁目1-1,950
吉野家 水戸笠原店,茨城県水戸市笠原町1194-2,950
吉野家 水戸城南店,茨城県水戸市城南3丁目7-9,950
吉野家 水道橋三崎町店,東京都千代田区神田三崎町2丁目1-1,1100
吉野家 瑞江駅前店,東京都江戸川区東瑞江1丁目27-4,1100
吉野家 瑞穂店,岐阜県瑞穂市馬場小城町1丁目23,950
吉野家 瀬谷駅前店,神奈川県横浜市瀬谷区中央1-4,1100
吉野家 成田国際空港第２本館店,千葉県成田市古込1-1,1200
吉野家 晴海トリトンスクエア店,東京都中央区晴海1丁目8-16,1100
吉野家 清水大坪店,静岡県静岡市清水区大坪1丁目9-11,950
吉野家 盛岡月が丘店,岩手県盛岡市月ガ丘2丁目8-5,900
吉野家 聖蹟桜ヶ丘店,東京都多摩市関戸2丁目41-1,1050
吉野家 西荻窪駅前店,東京都杉並区西荻北3丁目19-3,1100
吉野家 西葛西駅１番街店,東京都江戸川区西葛西6丁目14-2,1100
吉野家 西宮北ＩＣ店,兵庫県西宮市山口町名来2丁目19,950
吉野家 西京極七条店,京都府京都市右京区西京極佃田町17,950
吉野家 西条店,愛媛県西条市朔日市282-1,1000
吉野家 西新宿８丁目店,東京都新宿区西新宿8丁目4-1,1200
吉野家 西船橋店,千葉県船橋市西船4丁目21-17,1000
吉野家 西大須店,愛知県名古屋市中区大須2丁目27-40,1000
吉野家 西大島店,東京都江東区大島1丁目30-9,1150
吉野家 西中島南方駅前店,大阪府大阪市淀川区西中島3丁目20-9,1000
吉野家 西田辺店,大阪府大阪市阿倍野区西田辺町1丁目17-1,1000
吉野家 西日暮里店,東京都荒川区西日暮里5丁目14-11,1100
吉野家 西八王子駅北口店,東京都八王子市千人町2丁目20-2,1080
吉野家 青山一丁目店,東京都港区北青山1丁目3-3,1100
吉野家 青森駅前店,青森県青森市新町1丁目1-12,870
吉野家 青葉成合店,神奈川県横浜市青葉区タチバナ台1-20-24,1100
吉野家 静岡ＳＢＳ通り店,静岡県静岡市駿河区中田4丁目7-21,1000
吉野家 静岡インター通り店,静岡県静岡市駿河区西中原1丁目949-1,1000
吉野家 静岡呉服町通り店,静岡県静岡市葵区紺屋町6-12,950
吉野家 静岡瀬名川店,静岡県静岡市葵区瀬名川2丁目4-10,950
吉野家 石巻バイパス店,宮城県石巻市南中里4丁目7-19,950
吉野家 石巻大街道店,宮城県石巻市大街道西1丁目2-10,950
吉野家 赤羽東口店,東京都北区赤羽1丁目10-2,1100
吉野家 赤坂見附店,東京都港区赤坂3丁目21-15,1100
吉野家 赤坂三丁目店,東京都港区赤坂3丁目12-11,1100
吉野家 赤塚パーキングエリア店,愛知県豊川市市田町北山7-20,1000
吉野家 摂津鳥飼店,大阪府摂津市鳥飼上4丁目1-38,1000
吉野家 摂津別府店,大阪府摂津市東別府3丁目6-12,1000
吉野家 雪が谷大塚駅前店,東京都大田区南雪谷2丁目17-14,1150
吉野家 仙台イービーンズ店,宮城県仙台市青葉区中央4丁目1-1,900
吉野家 仙台駅西口店,宮城県仙台市青葉区中央1丁目7-1,900
吉野家 仙台駅東口店,宮城県仙台市宮城野区榴岡2丁目1-20,900
吉野家 仙台岡田店,宮城県仙台市宮城野区岡田北高屋敷30-1,900
吉野家 仙台加茂店,宮城県仙台市泉区加茂2丁目1-1,900
吉野家 仙台河原町店,宮城県仙台市若林区河原町1丁目1-27,900
吉野家 仙台宮千代店,宮城県仙台市宮城野区宮千代2丁目2-8,900
吉野家 仙台高砂店,宮城県仙台市宮城野区福室4丁目18-22,900
吉野家 仙台中山店,宮城県仙台市泉区南中山1丁目41-1,900
吉野家 仙台長町南店,宮城県仙台市太白区長町8丁目21-6,900
吉野家 仙台藤松店,宮城県仙台市青葉区藤松2丁目10,900
吉野家 仙台北目町通店,宮城県仙台市青葉区中央4丁目9-13,900
吉野家 千音寺店,愛知県名古屋市中川区吉津1丁目1808,1000
吉野家 千種駅前店,愛知県名古屋市千種区今池1丁目1-1,1000
吉野家 千早東店,福岡県福岡市東区若宮5丁目25-19,900
吉野家 千日前店,大阪府大阪市中央区難波千日前12-41,1100
吉野家 千葉さつきが丘店,千葉県千葉市花見川区犢橋町1102-3,1000
吉野家 千葉モノレール天台駅前店,千葉県千葉市稲毛区轟町5丁目5-24,1030
吉野家 千葉街道南小岩店,東京都江戸川区南小岩8丁目2-20,1100
吉野家 千葉中央店,千葉県千葉市中央区富士見2丁目22-15,1050
吉野家 千葉末広街道店,千葉県千葉市中央区末広3丁目17-1,1030
吉野家 川越街道成増店,東京都板橋区成増1丁目28-14,1100
吉野家 川越栗橋線菖蒲町店,埼玉県久喜市菖蒲町下栢間915-1,1050
吉野家 川越的場店,埼玉県川越市的場801-1,1000
吉野家 川越北環状線上寺山店,埼玉県川越市上寺山東田397-7,1050
吉野家 川口駅東口店,埼玉県川口市川口1丁目1-1,1050
吉野家 川口芝店,埼玉県川口市芝3丁目19-4,1050
吉野家 川口上青木店,埼玉県川口市上青木1丁目5-6,1050
吉野家 川口柳崎店,埼玉県川口市柳崎3丁目9-2,1050
吉野家 川崎駅前店,神奈川県川崎市川崎区駅前本町2-1,1150
吉野家 川崎街道矢野口店,東京都稲城市矢野口868,1100
吉野家 川崎西口店,神奈川県川崎市幸区中幸町4丁目51,1100
吉野家 川崎追分店,神奈川県川崎市川崎区追分町2-2,1150
吉野家 川崎店,神奈川県川崎市川崎区砂子1丁目1-8,1150
吉野家 川崎富士見店,神奈川県川崎市川崎区富士見1丁目7-15,1150
吉野家 川崎平店,神奈川県川崎市宮前区平2丁目-4-15,1100
吉野家 川西店,兵庫県川西市下加茂1丁目472‐1,950
吉野家 泉北２号線堺ＩＣ店,大阪府堺市中区平井775-1,1000
吉野家 浅草駅前店,東京都台東区花川戸1丁目5-2,1100
吉野家 浅草中央店,東京都台東区浅草2丁目10-13,1100
吉野家 浅草通り稲荷町店,東京都台東区東上野3丁目33-8,1100
吉野家 船橋市場町店,千葉県船橋市市場2丁目2-28,1030
吉野家 船橋二和東店,千葉県船橋市二和東6丁目2-3,1030
吉野家 船場中央店,大阪府大阪市中央区南本町2丁目6-8,1050
吉野家 前橋小相木店,群馬県前橋市小相木町279-1,1000
吉野家 祖師ケ谷大蔵駅前店,東京都世田谷区砧6丁目39-6,1100
吉野家 倉敷市役所前店,岡山県倉敷市白楽町418-5,950
吉野家 早良街道西新店,福岡県福岡市早良区曙1丁目13-25,900
吉野家 巣鴨南口店,東京都豊島区巣鴨1丁目12-3,1100
吉野家 相模原緑が丘店,神奈川県相模原市中央区緑が丘１‐１２‐１８,1050
吉野家 相模大野駅前店,神奈川県相模原市南区相模大野3丁目10-8,1050
吉野家 総社店,岡山県総社市中央5丁目10-102,950
吉野家 草加新栄店,埼玉県草加市新栄1丁目57-10,1050
吉野家 草加新田店,埼玉県草加市旭町1丁目4-36,1050
吉野家 蔵前橋通鳥越店,東京都台東区台東1丁目38-7,1100
吉野家 足柄サービスエリア下り店,静岡県駿東郡小山町桑木603-18,1200
吉野家 足立保木間店,東京都足立区保木間1丁目27-1,1100
吉野家 多賀ＳＡ下り店,滋賀県犬上郡多賀町敏満寺西66-31,1200
吉野家 太子堂店,大阪府八尾市南太子堂2丁目1-59,1000
吉野家 太平通店,愛知県名古屋市中川区太平通1丁目13,1000
吉野家 打越店,愛知県名古屋市千種区星ヶ丘2丁目80,960
吉野家 袋井店,静岡県袋井市川井杉ノ木990-5,1000
吉野家 大安寺店,奈良県奈良市南京終町3丁目1530-12,900
吉野家 大井松田店,神奈川県足柄上郡大井町金子1842,1050
吉野家 大井町西口店,東京都品川区大井1丁目1-16,1150
吉野家 大街道店,愛媛県松山市大街道2丁目6-2,900
吉野家 大館清水店,秋田県大館市清水2丁目1-1,870
吉野家 大久保バイパス城陽店,京都府城陽市寺田塚本205,1000
吉野家 大宮西口店,埼玉県さいたま市大宮区桜木町1丁目1-11,1050
吉野家 大宮通り芝辻町店,奈良県奈良市芝辻町1丁目3-23,880
吉野家 大宮店,埼玉県さいたま市大宮区仲町1丁目97,1050
吉野家 大宮東口店,埼玉県さいたま市大宮区大門町1丁目17-1,1050
吉野家 大橋店,福岡県福岡市南区大橋1丁目19-22,900
吉野家 大国町店,大阪府大阪市浪速区敷津東2丁目5-11,1000
吉野家 大阪駅前第３ビル店,大阪府大阪市北区梅田1丁目1-3,1050
吉野家 大阪京橋店,大阪府大阪市都島区東野田町5丁目2-28,1000
吉野家 大阪空港前店,大阪府豊中市蛍池西町2丁目141-6,1000
吉野家 大山駅前店,東京都板橋区大山町4-6,1100
吉野家 大手前店,大阪府大阪市中央区谷町2丁目7-6,1050
吉野家 大森店,東京都大田区大森北1丁目7-6,1150
吉野家 大正店,大阪府大阪市大正区三軒家東1丁目19-9,1000
吉野家 大泉学園北口店,東京都練馬区東大泉1丁目29-7,1100
吉野家 大泉中央店,群馬県邑楽郡大泉町中央2丁目1436,950
吉野家 大船笠間口店,神奈川県鎌倉市大船1丁目6-5,1050
吉野家 大池橋店,大阪府大阪市生野区中川西3丁目9-1,1200
吉野家 大池通り長丘店,福岡県福岡市南区長丘5丁目15-1,900
吉野家 大津膳所店,滋賀県大津市ニオノ浜3丁目1-57,970
吉野家 大津通栄店,愛知県名古屋市中区栄3丁目27-7,1100
吉野家 大塚店,東京都豊島区南大塚2丁目46-3,1100
吉野家 大田原美原店,栃木県大田原市美原1丁目7-25,900
吉野家 大野城店,福岡県大野城市瓦田4丁目12-40,900
吉野家 大和郡山店,奈良県大和郡山市柳町80-1,900
吉野家 大和田駅前店,大阪府門真市野里町1-32,1000
吉野家 第２環状線笹原店,愛知県名古屋市天白区福池2丁目419,1000
吉野家 第二阪和貝塚店,大阪府貝塚市石才229-1,1000
吉野家 第二阪和岸和田八阪店,大阪府岸和田市八阪町1丁目7-13,1000
吉野家 第二阪和泉佐野店,大阪府泉佐野市高松東2丁目6529,1000
吉野家 第二阪和泉大津店,大阪府泉大津市北豊中町3丁目1-3,1000
吉野家 第二阪和浜寺店,大阪府堺市西区浜寺船尾町東1丁112,1000
吉野家 淡路町店,東京都千代田区神田須田町1丁目10-1,1100
吉野家 池袋北口店,東京都豊島区西池袋1丁目24-1,1150
吉野家 築港本町店,福岡県福岡市博多区神屋町9-14,950
吉野家 中央環状松原店,大阪府松原市丹南4丁目1-4,1000
吉野家 中央環状線久宝寺店,大阪府東大阪市大蓮東4丁目197‐1,1000
吉野家 中央環状線巨摩橋店,大阪府東大阪市若江南町3丁目8-53,1000
吉野家 中央大通深江橋店,大阪府大阪市東成区東今里2丁目2-6,1050
吉野家 中環学園町店,大阪府摂津市学園町1丁目7-44,1000
吉野家 中京競馬場店,愛知県豊明市間米町敷田1225,1000
吉野家 中原街道上白根店,神奈川県横浜市旭区上白根町729-7,1100
吉野家 中山競馬場前店,千葉県市川市若宮3丁目48-3,1000
吉野家 中村公園店,愛知県名古屋市中村区太閤通9丁目15-2,1000
吉野家 中百舌鳥店,大阪府堺市北区百舌鳥梅町2丁3-3,1000
吉野家 中目黒駅前店,東京都目黒区上目黒3丁目3-5,1200
吉野家 中野北口店,東京都中野区中野5丁目66-3,1100
吉野家 朝霞台駅南口店,埼玉県朝霞市東弁財1丁目4-17,1000
吉野家 朝潮橋店,大阪府大阪市港区八幡屋1丁目1-15,1000
吉野家 町田駅前店,東京都町田市原町田4丁目1-8,1100
吉野家 町田街道小山町店,東京都町田市小山町3647-1,1050
吉野家 町田根岸店,東京都町田市根岸町1019-8,1050
吉野家 町田小川店,東京都町田市小川3丁目2-1,1050
吉野家 調布駅前店,東京都調布市布田1丁目37-16,1100
吉野家 長岡リップス川崎店,新潟県長岡市川崎町1374-5,950
吉野家 長久手南店,愛知県長久手市市ガ洞3丁目1802,960
吉野家 長居公園通り店,大阪府大阪市東住吉区照ヶ丘矢田1‐23‐1,1000
吉野家 長居店,大阪府大阪市住吉区長居東4丁目2-3,1000
吉野家 長泉店,静岡県駿東郡長泉町納米里199-1,1000
吉野家 長田五番町店,兵庫県神戸市長田区五番町6丁目5-1,950
吉野家 長浜店,滋賀県長浜市八幡東町13-1,950
吉野家 長堀店,大阪府大阪市中央区島之内1丁目18-5,1050
吉野家 長野中御所店,長野県長野市中御所4丁目8-15,960
吉野家 津駅チャム店,三重県津市羽所町1191-1,910
吉野家 津島金柳店,愛知県津島市金柳町観音堂20,1000
吉野家 鶴橋駅前店,大阪府大阪市東成区東小橋3丁目16-2,1000
吉野家 鶴見駅西口店,神奈川県横浜市鶴見区豊岡町14-28,1100
吉野家 鶴瀬駅前店,埼玉県富士見市鶴瀬東1丁目11-16,1000
吉野家 天下茶屋店,大阪府大阪市西成区岸里1丁目2-9,1000
吉野家 天神サザン通り店,福岡県福岡市中央区天神2丁目6-32,950
吉野家 天神橋六丁目店,大阪府大阪市北区天神橋6丁目6-19,1000
吉野家 天川大島店,群馬県前橋市天川大島町1丁目33-4,950
吉野家 伝馬町店,愛知県名古屋市熱田区神宮2丁目6-12,960
吉野家 田原町店,東京都台東区西浅草1丁目7-20,1100
吉野家 田端店,東京都北区田端新町2丁目8-8,1050
吉野家 田町駅芝浦店,東京都港区芝浦3丁目15-7,1100
吉野家 都営線本八幡店,千葉県市川市八幡2丁目16-14,1100
吉野家 都町店,千葉県千葉市中央区都町2丁目2-5,1050
吉野家 都島店,大阪府大阪市都島区善源寺町1丁目5-53,1000
吉野家 都立大学駅前店,東京都目黒区平町1丁目27-2,1150
吉野家 土浦真鍋店,茨城県土浦市真鍋2丁目1-28,950
吉野家 土佐バイパス店,高知県高知市鴨部3丁目24-25,900
吉野家 島田店,静岡県島田市中河町8964-1,1000
吉野家 東浦和店,埼玉県さいたま市緑区東浦和8丁目1-13,1050
吉野家 東岡山店,岡山県岡山市中区神下104-1,900
吉野家 東我孫子店,千葉県我孫子市東我孫子2-36-25,1000
吉野家 東久留米下里店,東京都東久留米市下里1丁目10-4,1050
吉野家 東急中央林間駅店,神奈川県大和市中央林間4丁目6-3,1100
吉野家 東京工科大学店,東京都八王子市片倉町1404-1,1080
吉野家 東京工場,埼玉県加須市新利根2丁目5‐2,960
吉野家 東銀座店,東京都中央区銀座3丁目11-11,1100
吉野家 東光寺店,福岡県福岡市博多区東光寺町1丁目5-2,900
吉野家 東広島西条店,広島県東広島市西条土与丸5丁目3-22,930
吉野家 東合川店,福岡県久留米市東合川2丁目3-21,900
吉野家 東三国店,大阪府大阪市淀川区東三国4丁目3-12,1000
吉野家 東小金井駅前店,東京都小金井市梶野町5丁目2-37,1100
吉野家 東松山新郷店,埼玉県東松山市新郷189-2,1000
吉野家 東新小岩店,東京都葛飾区東新小岩3丁目13-3,1100
吉野家 東中野駅前店,東京都中野区東中野4丁目5-14,1100
吉野家 東陽町店,東京都江東区東陽4丁目1-18,1100
吉野家 藤枝小石川店,静岡県藤枝市小石川町1丁目6-19,1000
吉野家 藤沢駅北口店,神奈川県藤沢市420-3,1050
吉野家 藤沢石川店,神奈川県藤沢市石川1丁目1-18,1050
吉野家 藤沢南口店,神奈川県藤沢市南藤沢20-5,1050
吉野家 徳山駅前店,山口県周南市有楽町2,950
吉野家 栃木大町店,栃木県栃木市大町18-12,1000
吉野家 奈良広陵町店,奈良県北葛城郡広陵町大塚905-1,900
吉野家 那の川店,福岡県福岡市中央区白金2丁目11-16,900
吉野家 那覇空港際内ＴＢ店,沖縄県那覇市鏡水150,900
吉野家 那覇東バイパス国場店,沖縄県那覇市字国場333-1,850
吉野家 内環状線江坂店,大阪府吹田市穂波町6‐20,1000
吉野家 南アルプス桃園店,山梨県南アルプス市桃園1454-6,950
吉野家 南バイパス太宰府店,福岡県太宰府市梅香苑1丁目1-41,900
吉野家 南越谷店,埼玉県越谷市南越谷1丁目23-1,1000
吉野家 南港通り平野店,大阪府大阪市平野区平野西1丁目1-4,1000
吉野家 二本松安達店,福島県二本松市油井字福岡440,900
吉野家 尼崎昭和通店,兵庫県尼崎市昭和通8丁目270-1,980
吉野家 尼宝線池尻店,兵庫県伊丹市池尻2‐1,950
