松屋　三木店,兵庫県三木市別所町小林734-76,1150
松屋　参宮橋店,東京都渋谷区代々木4-6-2 宍戸ビル1F,1226
松屋　山科店,京都府京都市山科区安朱中小路町3-2,1200
松屋　山形深町店/松のや　山形深町店,山形県山形市深町1-2-28,1150
松屋　山陽小野田店/松のや　山陽小野田店,山口県山陽小野田市中央一丁目3番46号,1100
松屋　山梨昭和店,山梨県中巨摩郡昭和町飯喰字村西1131,1250
松屋　山梨竜王店,山梨県甲斐市西八幡2234-1,1250
松屋　四国中央店/松のや　四国中央店,愛媛県四国中央市中曽根町5010-2,1100
松屋　四条烏丸店,京都府京都市下京区烏丸通仏光寺下る大政所町677番地,1160
松屋　四条河原町店,京都府京都市中京区河原町通蛸薬師上る奈良屋町305番地,1160
松屋　四条大宮駅前店,京都府京都市下京区四条通大宮東入立中町492,1160
松屋　四谷2丁目店,東京都新宿区四谷2-9　NK第7ビル,1250
松屋　四谷三丁目店,東京都新宿区左門町2-5,1250
松屋　四日市日永店,三重県四日市市日永4-1-10,1180
松屋　四日市堀木店,三重県四日市市堀木1-3-20,1180
松屋　市が尾店/松のや　市が尾店,神奈川県横浜市青葉区市ヶ尾町1062-3,1300
松屋　市ヶ谷店,東京都千代田区九段北4-2-15,1280
松屋　市原白金通店,千葉県市原市白金町1-17,1200
松屋　市川店,千葉県市川市市川1-6-11,1250
松屋　志村坂上店,東京都板橋区小豆沢3-6-3 糠賀第二ビル1F,1250
松屋　志木店,埼玉県新座市東北2-37-12 磯川ビル1F,1200
松屋　志木東口店,埼玉県志木市本町5-25-12,1200
松屋　糸島店,福岡県糸島市神在西2丁目22番30号,1057
松屋　自由ヶ丘店,東京都目黒区自由が丘1-12-3 第二元太ビル1F,1300
松屋　鹿屋寿店/松のや　鹿屋寿店,鹿児島県鹿屋市寿２丁目14-39,1100
松屋　鹿児島新栄店/松のや　鹿児島新栄店/マイカリー食堂　鹿児島新栄店,鹿児島県鹿児島市新栄町4-23,1130
松屋　鹿島田店,神奈川県川崎市幸区下平間135,1300
松屋　七塚原SA（下り線）店,広島県庄原市山内町560-4,1100
松屋　七塚原SA（上り線）店,広島県庄原市山内町560-1,1100
松屋　篠原橋通店/マイカリー食堂　篠原橋通店,愛知県名古屋市中川区篠原橋通2-22,1200
松屋　篠崎店,東京都江戸川区篠崎町7-21-13,1250
松屋　芝一丁目店/松のや　芝一丁目店,東京都港区芝1-4-9,1350
松屋　芝大門店,東京都港区芝大門2-1-1 第2境野ビル,1350
松屋　射水太閤山店/松のや　射水太閤山店,富山県射水市中太閣山1丁目1-1(未確定),1200
松屋　若江岩田店,大阪府東大阪市岩田町3-11-5,1200
松屋　取手店/松のや　取手店,茨城県取手市取手3-1-2,1150
松屋　守口佐太中町店/松のや　守口佐太中町店,大阪府守口市佐太中町6-55-36,1190
松屋　守口市駅前店,大阪府守口市桜町9-8,1190
松屋　手稲前田店/松のや　手稲前田店,北海道札幌市手稲区前田5条13-3-35,1150
松屋　酒々井PA(下り線)店,千葉県印旛郡酒々井町大字墨字花之作1419-1,1300
松屋　酒田店/松のや　酒田店,山形県酒田市北新橋1-20-1,1200
松屋　周船寺店/松のや　周船寺店,福岡県福岡市西区周船寺3-11-10,1100
松屋　周南店,山口県周南市新宿通5-6-23,1100
松屋　秋田広面店/松のや　秋田広面店,秋田県秋田市広面字樋ノ沖100他(未確定),1100
松屋　秋葉原店,東京都千代田区神田松永町1番地,1350
松屋　住吉店/松のや　住吉店,東京都江東区住吉2丁目6-7,1300
松屋　住之江公園店,大阪府大阪市住之江区新北島1-1-7 ビックドックプラザ1F,1200
松屋　十三西口店,大阪府大阪市淀川区十三本町1-4-1,1200
松屋　十三東口店,大阪府大阪市淀川区十三東2-8-15,1200
松屋　十条西口店,東京都北区上十条2丁目２７番１号　Ｊ＆ＭＡＬＬ　1階,1300
松屋　渋谷センター街店,東京都渋谷区宇田川町26-9,1500
松屋　渋谷宮益坂店/松のや　渋谷宮益坂店,東京都渋谷区渋谷１丁目８番（以下未定）,1500
松屋　渋谷桜丘店/松のや　渋谷桜丘店,東京都渋谷区桜丘町1番4号　渋谷サクラステージSHIBUYAサイド（A-M-107）,1500
松屋　渋谷清水橋店,東京都渋谷区本町3-39-3,1250
松屋　渋谷道玄坂上店,東京都渋谷区道玄坂1-18-8,1500
松屋　出雲大塚店/松のや　出雲大塚店/マイカリー食堂　出雲大塚店,島根県出雲市大塚町742,1100
松屋　春日PA（下り線）店,宮城県宮城郡利府町春日字二ツ石39-8,1150
松屋　春日PA（上り線）店,宮城県宮城郡利府町春日字筆沢5-3,1150
松屋　春日井店/松のや　春日井店,愛知県春日井市鳥居松町4-14,1200
松屋　春日井南下原町店,愛知県春日井市西山町3-20-3,1150
松屋　春日店,東京都文京区小石川2-23-14　小石川ハイム,1300
松屋　春日部店,埼玉県春日部市中央1-2-6 M6ビル 1F,1200
松屋　春日部豊町店/松のや　春日部豊町店,埼玉県春日部市豊町1-27-2,1250
松屋　春木店,大阪府岸和田市春木若松町18-31,1200
松屋　初石店,千葉県流山市西初石3-100-19,1200
松屋　所沢若狭店,埼玉県所沢市若狭4-2453-1,1200
松屋　所沢上安松店,埼玉県所沢市大字上安松822-44,1200
松屋　所沢北原店/マイカリー食堂　所沢北原店,埼玉県所沢市北原町1403-9,1200
松屋　曙橋店,東京都新宿区住吉町1-17 ジェントリー市ヶ谷1F,1250
松屋　勝どき店,東京都中央区勝どき2-14-1,1300
松屋　小岩店,東京都江戸川区西小岩1-21-20,1300
松屋　小金井関野町店,東京都小金井市関野町1丁目3-5,1226
松屋　小山店/松のや　小山店/マイカリー食堂　小山店,栃木県小山市駅南町6-28-22,1200
松屋　小松川店,東京都江戸川区小松川3-90,1250
松屋　小松日の出町店/松のや　小松日の出町店,石川県小松市日の出4-95-1,1200
松屋　小倉駅前店,福岡県北九州市小倉北区京町2-5-13,1100
松屋　小倉片野店,福岡県北九州市小倉北区片野4-20-12,1100
松屋　小田急永山店,東京都多摩市永山1-18-2,1250
松屋　小田急相模原店,神奈川県相模原市南区松が枝町24-6,1250
松屋　小田原酒匂店,神奈川県小田原市西酒匂1-9-3,1250
松屋　小田原店,神奈川県小田原市栄町2-8-33 岩下第1ビル,1250
松屋　小平小川店,東京都小平市小川東町5-2-5,1250
松屋　小牧店,愛知県小牧市小木東1-146,1150
松屋　昭島松原町店,東京都昭島市松原町1-6-13　AGスクウェアビル1F,1250
松屋　松戸古ヶ崎店/松のや　松戸古ヶ崎店,千葉県松戸市古ヶ崎1丁目3056,1200
松屋　松戸五香店/松のや　松戸五香店,千葉県松戸市常盤平5-26-6,1250
松屋　松戸七畝割店,千葉県松戸市松戸2303-16,1200
松屋　松戸松飛台店,千葉県松戸市松飛台259-5,1200
松屋　松戸店,千葉県松戸市本町1-18 第37東京ビル,1200
松屋　松阪大黒田店/松のや　松阪大黒田店,三重県松阪市大黒田町719-4,1150
松屋　松山萱町店,愛媛県松山市萱町6-53-1,1050
松屋　松山市駅前店/松のや　松山市駅前店,愛媛県松山市湊町5-5-1（住居表示）,1050
松屋　松山枝松店,愛媛県松山市枝松5-7-14,1050
松屋　松山石井店,愛媛県松山市東石井4-11-8,1050
松屋　松山大街道店,愛媛県松山市大街道2-3-6,1050
松屋　松本駅前店,長野県松本市中央1-2-23 山平ビル,1200
松屋　松本高宮店,長野県松本市高宮中2-5,1200
松屋　沼袋店,東京都中野区沼袋3-4-18,1226
松屋　沼津店/松のや　沼津店,静岡県沼津市筒井町9-7,1170
松屋　沼津東椎路店/松のや　沼津東椎路店,静岡県沼津市東椎路515番1、516番(未確定),1150
松屋　沼津南店,静岡県沼津市上香貫字三園町1372番地,1150
松屋　湘南台店,神奈川県藤沢市湘南台2-5-9,1250
松屋　焼津インター店/松のや　焼津インター店,静岡県焼津市八楠一丁目28-6,1200
松屋　上溝店/松のや　上溝店,神奈川県相模原市中央区上溝3-16-1,1250
松屋　上山店,山形県上山市仙石字梅ノ木774-1,1150
松屋　上新庄店,大阪府大阪市東淀川区瑞光1-11-29 新高ビル1階,1190
松屋　上石神井店,東京都練馬区上石神井2-25-5 栄ﾋﾞﾙ 1F,1226
松屋　上前津店,愛知県名古屋市中区大須4-11-9,1200
松屋　上大岡駅前店,神奈川県横浜市港南区上大岡西1-16-15,1300
松屋　上鶴間店,神奈川県相模原市南区上鶴間本町5丁目1番2号,1250
松屋　上田秋和店,長野県上田市秋和492-5,1100
松屋　上板橋店,東京都板橋区常盤台4-33-13,1250
松屋　上飯田店,愛知県名古屋市北区上飯田通1-13,1150
松屋　上尾東口店,埼玉県上尾市宮本町3-16,1200
松屋　上尾緑丘店/松のや　上尾緑丘店,埼玉県上尾市緑丘3-3-7,1200
松屋　上福岡店,埼玉県ふじみ野市上福岡1-2-36,1200
松屋　上野浅草口店,東京都台東区上野7-2-1,1350
松屋　上野店,東京都台東区上野4-9-5,1350
松屋　常陸太田店/松のや　常陸太田店,茨城県常陸太田市塙町字鯉沼4552,1150
松屋　新井薬師前店/マイカリー食堂　新井薬師前店,東京都中野区上高田3-40-10,1226
松屋　新栄店,愛知県名古屋市中区葵1-20-19 芝電ビル1F,1200
松屋　新横浜店,神奈川県横浜市港北区新横浜2-3-5,1300
松屋　新潟駅前店,新潟県新潟市中央区東大通1-6-1,1100
松屋　新潟見附店/松のや　新潟見附店,新潟県見附市上新田町字下野沖514-1,1150
松屋　新潟大形店/松のや　新潟大形店,新潟県新潟市東区豊1-13-53,1100
松屋　新潟米山店,新潟県新潟市中央区米山5-14-5,1100
松屋　新潟豊栄店,新潟県新潟市北区かぶとやま2-2-58,1100
松屋　新潟万代シテイ店/松のや　新潟万代シテイ店,新潟県新潟市中央区万代1-1-22,1100
松屋　新鎌ヶ谷店,千葉県鎌ケ谷市新鎌ヶ谷1-13-3,1200
松屋　新丸子店,神奈川県川崎市中原区新丸子742-3,1300
松屋　新居浜店/松のや　新居浜店,愛媛県新居浜市外山町14-48,1100
松屋　新橋3丁目店,東京都港区新橋3-16-1,1330
松屋　新琴似店/松のや　新琴似店,北海道札幌市北区新琴似6条1-1-1,1150
松屋　新検見川店,千葉県千葉市花見川区南花園2-1-6　朝日ビル新検見川　1F,1250
松屋　新高円寺店,東京都杉並区高円寺南2-20-2,1250
松屋　新高岡店/松のや　新高岡店,富山県高岡市京田634-1,1100
松屋　新座馬場店,埼玉県新座市馬場1-4-13,1230
松屋　新山口駅前店/松のや　新山口駅前店,山口県山口市小郡黄金町13-13(未確定),1100
松屋　新宿3丁目店,東京都新宿区新宿3-11-11　ダイアン新宿ビル,1270
松屋　新宿西口店,東京都新宿区西新宿1-13-3,1250
松屋　新宿大ガード店,東京都新宿区西新宿1-2-1,1280
松屋　新宿南口店,東京都新宿区新宿3-36-15,1250
松屋　新宿二丁目店,東京都新宿区新宿2-7-3,1250
松屋　新宿靖国通り店,東京都新宿区歌舞伎町1-6-3,1280
松屋　新所沢東口店,埼玉県所沢市松葉町10-15,1200
松屋　新小岩北口店,東京都葛飾区西新小岩1-9-1,1300
松屋　新松戸西口店,千葉県松戸市新松戸2-21-103,1200
松屋　新杉田店,神奈川県横浜市磯子区新杉田町3-1,1280
松屋　新大阪東口店,大阪府大阪市東淀川区東中島1-20-9　新大阪池永ビル,1250
松屋　新大塚店,東京都豊島区東池袋5-52-16,1250
松屋　新中野鍋屋横丁店/マイカリー食堂　新中野鍋屋横丁店,東京都中野区本町4-30-22,1250
松屋　新柏店/松のや　新柏店,千葉県柏市新柏4-12-7,1200
松屋　新発田店/松のや　新発田店,新潟県新発田市小舟町1-7-6,1100
松屋　新木場店,東京都江東区新木場1-6-1,1350
松屋　森下店,東京都江東区森下2-17-1,1300
松屋　森孝店/松のや　森孝店,愛知県名古屋市守山区森孝4-507,1200
松屋　深大寺3丁目店,東京都三鷹市深大寺3-8-7,1250
松屋　深大寺店,東京都調布市深大寺北町4-30-3,1250
松屋　深谷市役所前店,埼玉県深谷市深谷町4-45,1200
松屋　神楽坂店,東京都新宿区神楽坂2-9,1250
松屋　神戸伊川谷店/マイカリー食堂　神戸伊川谷店,兵庫県神戸市西区伊川谷町有瀬1304,1150
松屋　神戸玉津店/松のや　神戸玉津店,兵庫県神戸市西区枝吉5丁目147番,1150
松屋　神戸元町西口店,兵庫県神戸市中央区元町通2-8-14　オルタンシアビル1F,1150
松屋　神戸元町東口店,兵庫県神戸市中央区北長狭通4丁目1-12　鯉川ビル,1150
松屋　神戸三田駅前町店,兵庫県三田市駅前町19-10,1150
松屋　神戸新開地店/松のや　神戸新開地店,兵庫県神戸市兵庫区新開地4-6-26,1180
松屋　神戸新在家店,兵庫県神戸市灘区浜田町3-5-8　アーバンヴィレッジ六甲南,1180
松屋　神戸有野店/松のや　神戸有野店,兵庫県神戸市北区有野中町2-9-1,1180
松屋　神松寺店,福岡県福岡市城南区神松寺1-22-45,1057
松屋　神栖店,茨城県神栖市大野原2-22-1,1200
松屋　神田小川町店,東京都千代田区神田小川町2-1-15 1.2F,1350
松屋　神田西口店,東京都千代田区内神田2-12-5　翔和No.8神田ビル1F,1350
松屋　神田南口店,東京都千代田区鍛冶町2-1-2　神田南口鋭光ビル,1350
松屋　神立店/松のや　神立店,静岡県浜松市中央区神立町118-2,1200
松屋　秦野店,神奈川県秦野市大秦町1-4 鈴よしビル1F,1250
松屋　針中野店,大阪府大阪市東住吉区駒川5-16-3 1.2F,1200
松屋　人形町店,東京都中央区日本橋人形町1-18-8,1300
松屋　諏訪店,長野県諏訪市大字四賀字赤沼1825-1,1200
松屋　須賀川店/松のや　須賀川店,福島県須賀川市陣場町41,1180
松屋　逗子店,神奈川県逗子市逗子2-6-29,1300
松屋　吹上店,埼玉県鴻巣市鎌塚3-10-12,1200
松屋　垂井店/松のや　垂井店,岐阜県不破郡垂井町綾戸字不破ノ初５０２番地１番,1150
松屋　垂水店,兵庫県神戸市垂水区神田町3番18号ラ･メール垂水1F,1150
松屋　水戸バイパス店,茨城県水戸市元吉田町1435-7,1150
松屋　水戸河和田店/松のや　水戸河和田店,茨城県水戸市河和田二丁目1777番地の5,1150
松屋　水戸東原店/松のや　水戸東原店,茨城県水戸市東原1‐3‐17,1150
松屋　水天宮店,東京都中央区日本橋蛎殻町1-29-4,1300
松屋　水道橋店,東京都千代田区神田三崎町3-7-13,1300
松屋　瑞江店,東京都江戸川区瑞江2-3-11,1250
松屋　瀬戸店,愛知県瀬戸市共栄通6-4,1150
松屋　瀬谷店/マイカリー食堂　瀬谷店,神奈川県横浜市瀬谷区中央1-6　第5白鳳ビル1F,1250
松屋　成城学園前店/マイカリー食堂　成城学園前店,東京都世田谷区成城2-39-2,1250
松屋　成田空港第3ターミナル店,千葉県成田市取香148-1,1300
松屋　成田店/マイカリー食堂　成田店,千葉県成田市不動ヶ岡2148-6,1200
松屋　清瀬野塩店/マイカリー食堂　清瀬野塩店,東京都清瀬市野塩4-224-1,1250
松屋　生田店,神奈川県川崎市多摩区生田7-8-9,1225
松屋　盛岡みたけ店/松のや　盛岡みたけ店,岩手県盛岡市みたけ3丁目19番38号,1040
松屋　盛岡アイーナ店,岩手県盛岡市盛岡駅西通1-7-1　いわて県民情報交流センター,1040
松屋　盛岡駅前通店,岩手県盛岡市盛岡駅前通9-9,1040
松屋　盛岡大通店,岩手県盛岡市大通1-7-5,1040
松屋　聖蹟桜ヶ丘店/松のや　聖蹟桜ヶ丘店,東京都多摩市関戸2-40-2 興進ビル,1250
松屋　西荻窪店,東京都杉並区西荻南3-11-8,1300
松屋　西葛西店,東京都江戸川区西葛西3-17-7,1300
松屋　西蒲田店,東京都大田区西蒲田8-24-8,1300
松屋　西五反田店,東京都品川区西五反田1-11-9 司ビル,1350
松屋　西所沢店/松のや　西所沢店,埼玉県所沢市上新井5-15-15,1200
松屋　西小山店,東京都品川区小山6-5-1,1300
松屋　西新井店,東京都足立区西新井栄町2-3-2,1300
松屋　西新宿3丁目店,東京都新宿区西新宿3-7-21　陽輪台西新宿林屋ビル,1250
松屋　西新宿8丁目店,東京都新宿区西新宿8-12-1　ダイヤモンドビル1F,1250
松屋　西新宿タワー60店/マイカリー食堂　西新宿タワー60店,東京都新宿区西新宿5-5-1　ザ・パークハウス西新宿60　A103号室,1250
松屋　西新宿店,東京都新宿区西新宿5-10-14,1250
松屋　西新店/マイカリー食堂　西新店,福岡県福岡市早良区西新5丁目1-2,1100
松屋　西千葉店,千葉県千葉市中央区春日2-19-9　西千葉西口ビル,1250
松屋　西川口西口店,埼玉県川口市西川口1-23-18,1200
松屋　西川口店,埼玉県川口市並木2-1-6 1F,1200
松屋　西船橋店,千葉県船橋市西船4-25-3,1200
松屋　西巣鴨店,東京都豊島区西巣鴨3-25-11　メトロエステート西巣鴨110・111号,1250
松屋　西大井店,東京都品川区西大井1-4-20コア･スターレ西大井ショｯピングセンター,1300
松屋　西中島店,大阪府大阪市淀川区西中島6-7-3,1200
松屋　西町店,北海道札幌市西区西町北4-1-8,1150
松屋　西日暮里店,東京都荒川区西日暮里5-24-5,1300
松屋　西八王子店,東京都八王子市台町4-47-11,1250
松屋　西尾店/松のや　西尾店,愛知県西尾市上町泡原2,1200
松屋　西武柳沢店,東京都西東京市柳沢6-1-2タイエイビル102,1226
松屋　青森観光通り店/松のや　青森観光通り店,青森県青森市浦町奥野622,1040
松屋　青砥店,東京都葛飾区青戸3-37-19,1250
松屋　青梅河辺町店/松のや　青梅河辺町店,東京都青梅市河辺町8-1-2,1250
松屋　青梅今寺店/松のや　青梅今寺店,東京都青梅市今寺3-441-5,1260
松屋　青梅新町店,東京都青梅市新町9-2020,1250
松屋　青物横丁店,東京都品川区東品川3-23-18 アツミビル,1300
松屋　青柳町店,愛知県名古屋市千種区青柳町6丁目21-1,1200
松屋　青葉台駅前店,神奈川県横浜市青葉区青葉台2-9-16,1300
松屋　静岡呉服町店/松のや　静岡呉服町店,静岡県静岡市葵区呉服町1-6-4,1200
松屋　静岡七ツ新屋店,静岡県静岡市清水区七ツ新屋328-1,1150
松屋　静岡池田店/松のや　静岡池田店,静岡県静岡市駿河区池田404-1,1200
松屋　静岡八幡店,静岡県静岡市駿河区八幡2丁目3-17,1150
松屋　石巻恵み野店/松のや　石巻恵み野店,宮城県石巻市恵み野5-1-1,1150
松屋　石橋駅前店,大阪府池田市石橋1-10-27,1200
松屋　石神井公園店,東京都練馬区石神井町3-21-2,1250
松屋　石神井台店/松のや　石神井台店,東京都練馬区石神井台6丁目7-2,1250
松屋　石和店,山梨県笛吹市石和町広瀬1374,1200
松屋　赤羽西口店,東京都北区赤羽西1-38-2,1300
松屋　赤羽店,東京都北区赤羽2-1-19 十一会ビル,1300
松屋　赤羽東口店,東京都北区赤羽1-2-6,1300
松屋　赤坂店,東京都港区赤坂5-4-6 赤坂三辻ビル1F,1380
松屋　仙川店,東京都調布市仙川町1-11-16 ハラダビル,1230
松屋　仙台一番町店/松のや 仙台一番町店,宮城県仙台市青葉区一番町3-10-17 慶和ビル1F,1150
松屋　仙台五橋店,宮城県仙台市若林区清水小路5-6　エステート五ツ橋,1150
松屋　仙台鹿島店,宮城県仙台市泉区市名坂字鹿島11,1150
松屋　仙台扇町店,宮城県仙台市宮城野区扇町5-5-1,1150
松屋　仙台大和町店,宮城県仙台市若林区大和町3-2-11,1150
松屋　仙台中央店,宮城県仙台市青葉区中央3-6-3 1F,1150
松屋　仙台中野栄店/松のや　仙台中野栄店,宮城県仙台市宮城野区中野字只屋敷45-1,1150
松屋　仙台定禅寺通り店,宮城県仙台市青葉区国分町3-3-5 リスズビル1F,1150
松屋　仙台東口店/松のや　仙台東口店,宮城県仙台市宮城野区榴岡２丁目１‐２５　ＢｉＶｉ仙台駅東口1階,1150
松屋　仙台南町通り店,宮城県仙台市青葉区一番町2-7-7,1150
松屋　仙台八乙女店,宮城県仙台市泉区上谷刈1-1-5,1150
松屋　千歳烏山店/マイカリー食堂　千歳烏山店,東京都世田谷区南烏山4-12-4,1250
松屋　千歳船橋店/マイカリー食堂　千歳船橋店,東京都世田谷区船橋1-1-9,1250
松屋　千歳店/松のや　千歳店,北海道千歳市住吉4丁目14番4号,1150
松屋　千石店,東京都文京区千石4-46-14,1300
松屋　千駄木店,東京都文京区千駄木2-33-8,1300
松屋　千日前店,大阪府大阪市中央区難波3-3-4,1250
松屋　千葉我孫子店,千葉県我孫子市本町2-3-2,1200
松屋　千葉古市場店/松のや　千葉古市場店,千葉県千葉市緑区古市場町620-1,1200
松屋　千葉幸町店,千葉県千葉市美浜区幸町2-21-30,1250
松屋　千葉店,千葉県千葉市中央区富士見2-5-16,1250
松屋　千里丘店/松のや　千里丘店,大阪府摂津市千里丘5-11-3,1200
松屋　千林大宮店,大阪府大阪市旭区森小路2-6-1,1190
松屋　川越インター店,埼玉県川越市広栄町6-6,1200
松屋　川越城下町店,埼玉県川越市城下町7-8,1200
松屋　川越西口店,埼玉県川越市脇田本町1-7 川越駅西口ビル,1200
松屋　川口栄町店,埼玉県川口市栄町3-14-1,1200
松屋　川口駅前店,埼玉県川口市川口1-1-1,1200
松屋　川口上青木店,埼玉県川口市上青木2-47-1,1200
松屋　川口並木店,埼玉県川口市並木4-6-20,1200
松屋　川崎京町店/松のや　川崎京町店,神奈川県川崎市川崎区京町1-18-15,1300
松屋　川崎銀座街店,神奈川県川崎市川崎区砂子1-1-7,1300
松屋　川崎砂子店/マイカリー食堂　川崎砂子店,神奈川県川崎市川崎区砂子2-6-19,1300
松屋　川崎西口店,神奈川県川崎市幸区大宮町5-1,1300
松屋　川崎大師店/松のや　川崎大師店,神奈川県川崎市川崎区大師駅前1-6-6　T&#039;sgarden川崎大師2,1300
松屋　川崎枡形店,神奈川県川崎市多摩区枡形1-5-9,1250
松屋　川西能勢口店/マイカリー食堂　川西能勢口店,兵庫県川西市栄町10-5パルティ川西101号,1180
松屋　川島店/松のや　川島店,埼玉県比企郡川島町大字上伊草1214-1,1200
松屋　泉大津店/松のや　泉大津店,大阪府泉大津市虫取町1-4-31,1200
松屋　浅草橋店,東京都台東区柳橋1-13-4,1350
松屋　浅草橋南店/マイカリー食堂　浅草橋南店,東京都中央区日本橋馬喰町2-6-14,1350
松屋　浅草吾妻橋店,東京都台東区雷門2-19-13,1350
松屋　浅草国際通店,東京都台東区浅草2-11-7,1350
松屋　船橋芝山店/松のや　船橋芝山店,千葉県船橋市飯山満町1-1402-2,1250
松屋　船橋南口店,千葉県船橋市本町1-3-1　フェイスビル1F-0108,1300
松屋　船橋北口店,千葉県船橋市本町6-6-4　北口スクエアビル　,1250
松屋　船堀店,東京都江戸川区船堀1-4-16,1300
松屋　前橋元総社町店,群馬県前橋市元総社町90-1,1200
松屋　前橋三河町店,群馬県前橋市三河町2-16-16,1200
松屋　前橋上小出町店,群馬県前橋市上小出町2-41-7,1200
松屋　曽根店,大阪府豊中市曽根東町2-12-14,1200
松屋　祖師谷大蔵３丁目店,東京都世田谷区祖師谷3-32-14,1250
松屋　蘇我店,千葉県千葉市中央区今井2-1-1,1200
松屋　倉敷玉島店/松のや　倉敷玉島店,岡山県倉敷市玉島1丁目1394-2,1100
松屋　倉敷水島店,岡山県倉敷市中畝6丁目6-21,1100
松屋　早稲田店,東京都新宿区馬場下町62-18,1250
松屋　巣鴨店/マイカリー食堂　巣鴨店,東京都豊島区巣鴨2丁目5-2,1300
松屋　相模原ラクーン店/松のや　相模原ラクーン店,神奈川県相模原市中央区小山1-1-10,1250
松屋　相模原相原店/松のや　相模原相原店,神奈川県相模原市緑区相原5-13-４,1250
松屋　相模原中央店,神奈川県相模原市中央区中央1-10-15,1250
松屋　相模大野店,神奈川県相模原市南区相模大野3-2-1,1250
松屋　総社店/松のや　総社店,岡山県総社市総社2-22-41,1100
松屋　草加松江店/マイカリー食堂　草加松江店,埼玉県草加市松江6丁目12-27,1200
松屋　草加清門町店,埼玉県草加市清門1丁目423-1,1200
松屋　草加西口店,埼玉県草加市氷川町2125-4　ウシヤマビル,1200
松屋　草加店/松のや　草加店,埼玉県草加市北谷町1-2-14,1200
松屋　草加東口店,埼玉県草加市高砂2-18-9,1200
松屋　草津駅西口店/松のや　草津駅西口店,滋賀県草津市西大路町1-28　 KENTPLAZA　1階,1150
松屋　足利店/松のや　足利店,栃木県足利市朝倉町2-22-7,1200
松屋　足立江北店,東京都足立区江北3丁目35番12号,1250
