cafe terrasse verte（カフェ・テラス・ヴェルト）,東京都武蔵野市中町1-14-5　2F,1226
すし松 本厚木店,神奈川県厚木市中町2-1-18,1250
すし松　エキアプレミエ和光市駅店,埼玉県和光市本町4-7,1200
すし松　ヤオコー川口ＳＫＩＰシティ店,埼玉県川口市上青木4-13-78　ヤオコー川口SKIPシティ店2F,1300
すし松　綾瀬店,東京都足立区綾瀬3-2-8シティプレイス綾瀬１階,1250
すし松　王子店,東京都北区王子1-13-17,1300
すし松　蒲田1号店,東京都大田区蒲田5丁目16番9号　第一カワタビル1F,1300
すし松　吉祥寺南店,東京都武蔵野市吉祥寺南町1-8-4,1300
すし松　江坂店,大阪府吹田市豊津町15-30　東明マンション江坂2,1200
すし松　三芳PA(上り線)店,埼玉県入間郡三芳町大字上冨2204,1300
すし松　松戸五香店,千葉県松戸市常盤平5-26-6,1200
すし松　聖蹟桜ヶ丘店,東京都多摩市関戸2-40-2興進ビル,1250
すし松　西荻窪店,東京都杉並区西荻北3-20-1,1400
すし松　青物横丁店,東京都品川区南品川2-17-22,1300
すし松　石神井公園店,東京都練馬区石神井町3‐21‐2,1250
すし松　川口店,埼玉県川口市栄町3-5-12,1300
すし松　大宮店,埼玉県さいたま市大宮区宮町1-50-2,1300
すし松　東新宿店,東京都新宿区新宿7-27-6　COERU東新宿２階,1400
すし松　本八幡南口店,千葉県市川市南八幡4-6-9アロー本八幡ビル22番館,1200
すし松　枚方市駅前店,大阪府枚方市新町1-1-8Hirakata Woven2Ｆ,1200
すし松　練馬店,東京都練馬区豊玉北5-18-11,1300
ステーキ屋松　下北沢店,東京都世田谷区北沢2-14-2,1300
ステーキ屋松　吉祥寺店,東京都武蔵野市吉祥寺本町2-14-28,1300
ステーキ屋松　国分寺店,東京都国分寺市南町3-18-17,1300
ステーキ屋松　新杉田店,神奈川県横浜市磯子区新杉田町3-1ステート新杉田103,1300
ステーキ屋松　本郷三丁目店,東京都文京区本郷4-37-15,1300
ステーキ屋松　明大前店,東京都世田谷区松原1-36-7,1300
ステーキ定食松牛　三鷹店,東京都武蔵野市中町1-1-8,1300
ステーキ定食松牛　上大岡店,神奈川県横浜市港南区上大岡西2-1-19 須藤ビル1F,1300
ステーキ定食松牛　八王子店,東京都八王子市東町6-1,1300
トゥックントゥックン　羽村店,東京都羽村市五ノ神1-2-12,1240
マイカリー食堂　高田馬場店,東京都新宿区高田馬場1-26-12,1300
マイカリー食堂　三鷹店,東京都武蔵野市中町1-6-7,1250
マイカリー食堂　上野店,東京都台東区上野7-4-7,1320
マイカリー食堂　板橋本町店,東京都板橋区大和町18-10,1250
ラーメン　松太郎　新宿小滝橋通り店,東京都新宿区西新宿7-7-28　第一山本ビル1階,1300
株式会社トレンジエクスプレス,埼玉県比企郡川島町かわじま1丁目10番,1300
松のや 千船店,大阪府大阪市西淀川区佃3丁目1番11号アバリーナ千船1階,1200
松のや 谷町二丁目店,大阪府大阪市中央区谷町2-3-4 サンシャイン大手前ビル１Ｆ西,1200
松のや　JR尼崎店,兵庫県尼崎市長洲本通1-4-2　レジュールアッシュ尼崎駅前,1150
松のや　すすきの店,北海道札幌市中央区南4条西3-1-1,1200
松のや　だいどう豊里店/マイカリー食堂　だいどう豊里店,大阪府大阪市東淀川区豊里7-10-18　ナインライブテナントビル,1180
松のや　つくば東大通り店,茨城県つくば市天久保4-6-8,1150
松のや　なんさん通り店,大阪府大阪市中央区難波千日前8-12ショッププランナー国際東ビル,1350
松のや　ひばりが丘店/マイカリー食堂　ひばりが丘店,東京都西東京市ひばりが丘北4-1-32,1250
松のや　ふじみ野店/マイカリー食堂　ふじみ野店,埼玉県富士見市ふじみ野西1-20-2 第7マツモトビル106,1200
松のや　グリーンモール山室店,富山県富山市中市10-4,1100
松のや　フォーポイント フレックス by シェラトン 横浜駅西店,神奈川県横浜市西区南幸2-17-6,1300
松のや　ル・シーニュ府中店/マイカリー食堂　ル・シーニュ府中店,東京都府中市宮町1-100　ル・シーニュ1-19,1300
松のや　阿佐ヶ谷南店,東京都杉並区阿佐谷南1-36-11,1300
松のや　綾瀬店,東京都足立区綾瀬4-7-1,1250
松のや　安城店/マイカリー食堂　安城店,愛知県安城市大山町１丁目２番3,1200
松のや　伊勢佐木町店/マイカリー食堂　伊勢佐木町店,神奈川県横浜市中区伊勢佐木町2-76-3,1230
松のや　伊川谷店,兵庫県神戸市西区伊川谷町潤和1142-3,1150
松のや　浦安駅前店,千葉県浦安市当代島1-1-22,1250
松のや　岡山厚生町店,岡山県岡山市北区厚生町2-12-15,1100
松のや　下永谷店,神奈川県横浜市港南区下永谷5-3-10,1230
松のや　下赤塚店,東京都板橋区赤塚新町1-24-1,1250
松のや　花園町店,大阪府大阪市西成区鶴見橋1-3-24,1200
松のや　貝塚店,大阪府貝塚市小瀬1-28-13,1180
松のや　掛川PA(下り線)店,静岡県掛川市倉真5968-4,1300
松のや　茅ヶ崎店/マイカリー食堂　茅ヶ崎店,神奈川県茅ヶ崎市新栄町1-6 湘南ISビル,1230
松のや　萱島店/マイカリー食堂　萱島店,大阪府寝屋川市萱島本町19-11,1200
松のや　関大前店/マイカリー食堂　関大前店,大阪府吹田市千里山東1-7-13カンゾービル１Ｆ,1180
松のや　岩塚本通店/マイカリー食堂　岩塚本通店,愛知県名古屋市中村区岩塚本通3-12,1200
松のや　喜多見店,東京都世田谷区喜多見8-15-29,1250
松のや　岐阜茜部店,岐阜県岐阜市茜部菱野1丁目1番,1100
松のや　菊名店,神奈川県横浜市港北区菊名4-2-3,1250
松のや　魚住店,兵庫県明石市魚住町清水28番3,1150
松のや　京王八王子店/マイカリー食堂　京王八王子店,東京都八王子市明神町4-6-3,1250
松のや　京都南インター店,京都府京都市伏見区中島秋ノ山町121,1170
松のや　橋本店/マイカリー食堂　橋本店,神奈川県相模原市緑区橋本6丁目2‐1,1230
松のや　錦糸町店,東京都墨田区江東橋3-9-15,1300
松のや　金岡店,大阪府堺市北区金岡町192-1　Pモール,1180
松のや　桂川店,京都府京都市南区久世上久世町524-1,1170
松のや　権現湖PA(下り線)店,兵庫県加古川市志方町野尻769-14,1200
松のや　元町店/マイカリー食堂　元町店,兵庫県神戸市中央区三宮町3-9-15,1200
松のや　戸塚店,神奈川県横浜市戸塚区戸塚町104,1230
松のや　向日町店,京都府向日市上植野町南淀井4,1200
松のや　江戸川橋店/マイカリー食堂　江戸川橋店,東京都文京区関口1-10-11　朝日江戸川橋マンション105号,1350
松のや　江坂店/マイカリー食堂　江坂店,大阪府吹田市豊津町15-4,1250
松のや　行徳店/マイカリー食堂　行徳店,千葉県市川市行徳駅前2-3 ポニー行徳商業ビル,1200
松のや　香里園店/マイカリー食堂　香里園店,大阪府寝屋川市香里南之町30-14,1200
松のや　高円寺店,東京都杉並区高円寺北3-22-16 2F,1300
松のや　高松瓦町店,香川県高松市南新町5-5,1100
松のや　高松今里店,香川県高松市今里町2丁目30-14,1100
松のや　高槻千代田町店,大阪府高槻市千代田町4-5,1200
松のや　麹町店/マイカリー食堂　麹町店,東京都千代田区麹町4-1-5,1300
松のや　今津店/マイカリー食堂　今津店,兵庫県西宮市津門呉羽町1-34,1150
松のや　今福鶴見店,大阪府大阪市鶴見区鶴見4-1-31,1200
松のや　阪神西宮店/マイカリー食堂　阪神西宮店,兵庫県西宮市田中町2-24,1150
松のや　阪東橋店/マイカリー食堂　阪東橋店,神奈川県横浜市南区高根町3-17-28　マークス横濱阪東橋,1230
松のや　堺東店/マイカリー食堂　堺東店,大阪府堺市堺区中瓦町2-3-12　きくやビル1階,1200
松のや　鷺沼店/マイカリー食堂　鷺沼店,神奈川県川崎市宮前区鷺沼3-1-23　鷺沼片桐ビル1階,1230
松のや　札幌駅前通店/マイカリー食堂　札幌駅前通店,北海道札幌市中央区北1条西3-3-11　桂和北1条ビル,1200
松のや　三宮東店,兵庫県神戸市中央区旭通5-1-2,1200
松のや　三鷹店,東京都武蔵野市中町1-14-5,1330
松のや　三田ウッディタウン店,兵庫県三田市けやき台1-5 けやきプラザ内,1150
松のや　四天王寺前夕陽ケ丘店,大阪府大阪市天王寺区四天王寺1-7-11,1200
松のや　四日市芝田店/マイカリー食堂　四日市芝田店,三重県四日市市芝田1-11-3,1200
松のや　市川店/マイカリー食堂　市川店,千葉県市川市市川1-4-16,1200
松のや　志染店,兵庫県三木市志染町広野1丁目74,1140
松のや　志村坂上店/マイカリー食堂　志村坂上店,東京都板橋区志村1-14-12,1250
松のや　紙屋町店,広島県広島市中区紙屋町2-2-26　山本ビル,1200
松のや　鹿児島宇宿店,鹿児島県鹿児島市宇宿2丁目24-16,1130
松のや　十三店,大阪府大阪市淀川区十三本町1-5-8,1300
松のや　春日店/マイカリー食堂　春日店,東京都文京区本郷4-17-8,1350
松のや　勝どき店,東京都中央区勝どき4-11-10,1230
松のや　小阪店,大阪府東大阪市御厨栄町2-17-9,1200
松のや　少路店,大阪府豊中市少路1-2-1,1180
松のや　松井山手店,京都府京田辺市山手西2-1-1,1170
松のや　松原店,大阪府松原市上田8-14-13,1180
松のや　松戸新田店,千葉県松戸市松戸新田289-6,1200
松のや　松戸店,千葉県松戸市本町4-4 GK松戸ビル,1150
松のや　沼袋店/マイカリー食堂　沼袋店,東京都中野区沼袋3-27-6　リバティハイツ高橋,1250
松のや　湘南台店/マイカリー食堂　湘南台店,神奈川県藤沢市湘南台1-13-1,1250
松のや　上大岡西店/マイカリー食堂　上大岡西店,神奈川県横浜市港南区上大岡西2-1-19,1230
松のや　上板橋店,東京都板橋区常盤台4-32-6,1250
松のや　上牧店,奈良県北葛城郡上牧町大字上牧3344番1,1051
松のや　新橋店,東京都港区新橋2-2-5　丸山ビル1F,1300
松のや　新秋津店,東京都東村山市秋津町5-13-7,1250
松のや　新大阪東口店/マイカリー食堂　新大阪東口店,大阪府大阪市東淀川区東中島1-20-3,1250
松のや　新長田店,兵庫県神戸市長田区大橋町4-4-9,1150
松のや　深江橋店,大阪府大阪市城東区諏訪4-3-1　ロイヤル・プラザ1F,1200
松のや　神栖店,茨城県神栖市大野原3-11-2,1150
松のや　杉田店/マイカリー食堂　杉田店,神奈川県横浜市磯子区杉田1-12-28　魚七フードビル,1230
松のや　瀬戸店,愛知県瀬戸市西原町2-88,1200
松のや　清須店/マイカリー食堂　清須店,愛知県清須市西枇杷島町恵比須8-2,1200
松のや　西荻窪店/マイカリー食堂　西荻窪店,東京都杉並区西荻南3-8-8,1300
松のや　西宮西田町店,兵庫県西宮市西田町1-29,1150
松のや　西新宿店,東京都新宿区西新宿7-1-7,1350
松のや　西神南店,兵庫県神戸市西区井吹台西町1-1-2,1140
松のや　西川口店/マイカリー食堂　西川口店,埼玉県川口市西川口1-22-20　西川口ビル1F,1150
松のや　西船橋店,千葉県船橋市西船4-23-8,1200
松のや　西巣鴨店,東京都豊島区西巣鴨3-25-11　メトロエステート201号,1250
松のや　西東京新町店/マイカリー食堂　西東京新町店　,東京都西東京市新町4-6-7,1250
松のや　西鈴蘭台店,兵庫県神戸市北区鳴子2-1-5,1150
松のや　青物横丁店/マイカリー食堂　青物横丁店,東京都品川区南品川2-17-18　SGビル1階,1250
松のや　静岡北脇新田店/マイカリー食堂　静岡北脇新田店,静岡県静岡市清水区北脇新田610-7,1100
松のや　石橋店,大阪府池田市石橋1-3-10　MKビル1F,1180
松のや　石神井公園店,東京都練馬区下石神井2-8-16,1250
松のや　赤羽店,東京都北区赤羽1-17-1,1250
松のや　赤坂店/マイカリー食堂　赤坂店,東京都港区赤坂6-4-22　赤坂三沖ﾋﾞﾙ,1310
松のや　摂津富田店/マイカリー食堂　摂津富田店,大阪府高槻市富田町1-8-21,1200
松のや　仙川店/マイカリー食堂　仙川店,東京都調布市仙川1-16-4,1250
松のや　仙台中央店,宮城県仙台市青葉区中央3-6-3 2F,1150
松のや　千歳烏山店,東京都世田谷区南烏山5-16-21,1300
松のや　千歳船橋店,東京都世田谷区船橋1-1-2,1250
松のや　千川店,東京都豊島区要町3-11-1,1300
松のや　千鳥橋店/マイカリー食堂　千鳥橋店,大阪府大阪市此花区四貫島1-1-2　千鳥橋駅南館,1200
松のや　千葉店/マイカリー食堂　千葉店,千葉県千葉市中央区富士見2-24-1,1250
松のや　千葉都町店/マイカリー食堂　千葉都町店,千葉県千葉市中央区都町4-6-1,1180
松のや　川越西口店/マイカリー食堂　川越西口店,埼玉県川越市脇田本町6-8,1200
松のや　川口店,埼玉県川口市川口1-1-1,1200
松のや　川崎銀座街店,神奈川県川崎市川崎区砂子1-1-3,1250
松のや　川西能勢口店/マイカリー食堂　川西能勢口店,兵庫県川西市栄町21-25　ストーク田口1F,1150
松のや　相武台前店,神奈川県座間市相武台1-35-5,1230
松のや　相模原店/マイカリー食堂　相模原店,神奈川県相模原市中央区相模原2-2-19　エイコーマンション1F,1230
松のや　相模原陽光台店,神奈川県相模原市中央区陽光台5-5-2,1230
松のや　相模大野店,神奈川県相模原市南区相模大野3-2-1　BONO相模大野ノースモール202,1230
松のや　草加店,埼玉県草加市氷川町2121-3,1200
松のや　草津木川町店/マイカリー食堂　草津木川町店,滋賀県草津市木川町75-5,1150
松のや　大垣島里店/マイカリー食堂　大垣島里店,岐阜県大垣市島里2丁目1番,1200
松のや　大宮店,埼玉県さいたま市大宮区宮町1-50-2 いとや宮町ビル2F,1250
松のや　大阪駅前第３ビル店,大阪府大阪市北区梅田1-1-3 大阪駅前第3ビル地下1F　B70･71号,1300
松のや　大和高田店,奈良県大和高田市曽大根122-7,1051
松のや　大和店/マイカリー食堂　大和店,神奈川県大和市中央4-1-2近藤ビル,1250
松のや　池田店,大阪府池田市城南1-9-16,1180
松のや　中延店,東京都品川区中延4-6-17　エクセレント2 1F,1300
松のや　中野坂上店,東京都中野区中央2-2-2,1300
松のや　中野新橋店,東京都中野区弥生町2-28-9　ホワイトペースビル,1250
松のや　中野店,東京都中野区中野5-68-9 岸田ビル,1300
松のや　朝霞台店/マイカリー食堂　朝霞台店,埼玉県朝霞市浜崎1-3-10AX-1ビル,1200
松のや　町田店,東京都町田市原町田4-4-14,1230
松のや　調布南店,東京都調布市布田4-18-1ハラビル　１Ｆ４区画,1250
松のや　長岡天神店,京都府長岡京市天神1-30-1,1150
松のや　長久手店,愛知県長久手市作田1-1107,1200
松のや　長良町店,愛知県名古屋市中川区長良町3-32,1200
松のや　津田沼南口店/マイカリー食堂　津田沼南口店,千葉県習志野市谷津7-9-16 京葉ビル2,1250
松のや　鶴見東口店,神奈川県横浜市鶴見区鶴見中央1-3-3,1250
松のや　天王町店,神奈川県横浜市保土ケ谷区天王町2-47-6,1230
松のや　田無店,東京都西東京市田無町4-2-12,1250
松のや　東新宿店,東京都新宿区大久保1-3-14　ワールドビジネスセンター,1350
松のや　藤阪店,大阪府枚方市津田北町1-3189-2,1200
松のや　堂島店,大阪府大阪市北区堂島2-1-34,1200
松のや　徳島南昭和町店,徳島県徳島市南昭和町2-34-1,1100
松のや　奈良駅前店,奈良県奈良市大宮町1-1-10　梢ビル,1100
松のや　南浦和店/マイカリー食堂　南浦和店,埼玉県さいたま市南区南浦和2-36-11　カトレアビル,1200
松のや　南越谷店/マイカリー食堂　南越谷店,埼玉県越谷市南越谷1-19-2,1200
松のや　南行徳店,千葉県市川市相之川4-8-2,1200
松のや　南森町店/マイカリー食堂　南森町店,大阪府大阪市北区天神橋2-5-18　南森町センタービル,1300
松のや　尼崎店,兵庫県尼崎市神田中通2-18-9,1300
松のや　梅田店,大阪府大阪市北区角田町6-3,1300
松のや　半田店,愛知県半田市青山1-4-9,1200
松のや　板橋区役所前店,東京都板橋区板橋2-61-10　藤畑第一ビル,1250
松のや　板橋店/マイカリー食堂　千鳥橋店,東京都北区滝野川7-9-10　マインエントピア,1250
松のや　板宿店,兵庫県神戸市須磨区平田町2-2-2　板宿稲岡ビル,1150
松のや　姫島店,大阪府大阪市西淀川区姫里1-26-18,1200
松のや　姫路野里店,兵庫県姫路市城東町180,1150
松のや　瓢箪山店,大阪府東大阪市若草町5-2,1200
松のや　富士インター店,静岡県富士市伝法3104-1,1100
松のや　浮間舟渡店/マイカリー食堂　浮間舟渡店,東京都板橋区舟渡1-12-12,1250
松のや　武庫之荘店,兵庫県尼崎市南武庫之荘1-14-1,1150
松のや　武蔵境店,東京都武蔵野市境2-2-18　MHビル,1230
松のや　武蔵小金井店,東京都小金井市本町5-18-5　太平ビル1Ｆ,1250
松のや　武蔵新城店,神奈川県川崎市中原区新城5-1-3　フクシマビル,1230
松のや　武蔵新田店,東京都大田区矢口1-16-24,1250
松のや　服部店,大阪府豊中市服部西町5-18-2,1250
松のや　平井店/マイカリー食堂　平井店,東京都江戸川区平井5-15-8　平井駅前ビルE棟,1250
松のや　平塚店/マイカリー食堂　平塚店,神奈川県平塚市紅谷町5-14,1230
松のや　方南町店,東京都杉並区方南2-18-10,1250
松のや　豊洲ＩＨＩビル店,東京都江東区豊洲3-1-1,1230
松のや　豊田店/マイカリー食堂　豊田店,東京都日野市多摩平1-2-18,1250
松のや　北浦和店,埼玉県さいたま市浦和区北浦和4-3-8 USビル1F,1200
松のや　北小金店,千葉県松戸市小金8,1200
松のや　堀田店/マイカリー食堂　堀田店,愛知県名古屋市瑞穂区明前町11-6,1200
松のや　本厚木店/マイカリー食堂　本厚木店,神奈川県厚木市中町2-5-3　厚木ヤングヒルビル,1250
松のや　本蓮沼店,東京都板橋区蓮沼町22-5,1250
松のや　幕張本郷店/マイカリー食堂　幕張本郷店,千葉県千葉市花見川区幕張本郷1-3-7,1200
松のや　名駅西口店,愛知県名古屋市中村区則武1-6-3　ベルヴュオフィス名古屋1F,1250
松のや　名谷店/マイカリー食堂　名谷店,兵庫県神戸市垂水区名谷町字猿倉83-1,1150
松のや　明石店,兵庫県明石市大明石町1-6-1　パピオスあかし,1150
松のや　茂原店,千葉県茂原市高師台3-1-4,1180
松のや　野方店/マイカリー食堂　野方店,東京都中野区野方5-25-4,1250
松のや　野毛店/マイカリー食堂　野毛店,神奈川県横浜市中区野毛町3-160-4,1230
松のや　用賀店,東京都世田谷区用賀2-38-15　田縁ビル,1300
松のや　練馬店,東京都練馬区豊玉北5-19-12,1300
松のや　和歌山太田店/マイカリー食堂　和歌山太田店,和歌山県和歌山市太田4-5-1,1100
松のや　蕨西口店/マイカリー食堂　蕨西口店,埼玉県蕨市中央1-23-1,1200
松のや　蕨店,埼玉県蕨市塚越1-4-18,1200
松のや　椥辻店,京都府京都市山科区椥辻東潰34-2,1170
松屋 音更店/松のや 音更店,北海道河東郡音更町木野大通西8-1-3-A,1200
松屋 上越高田店/松のや 上越高田店,新潟県上越市土橋2600,1150
松屋　16号柏店/松のや　16号柏店,千葉県柏市大井568-1,1250
松屋　JR高槻南口店,大阪府高槻市高槻町9-22 吉廣第二ビル 1.2F,1190
松屋　JR尼崎店,兵庫県尼崎市長洲本通1-4-2　レジュールアッシュ尼崎駅前,1180
松屋　KOKO HOTEL広島駅前店,広島県広島市南区京橋町10-3,1200
松屋　tekute長町店/マイカリー食堂　tekute長町店,宮城県仙台市太白区長町5丁目1-30　tekuteながまち,1150
松屋　８号長浜店/松のや　８号長浜店,滋賀県長浜市小堀町402-1,1180
松屋　あざみ野店,神奈川県横浜市青葉区あざみ野1-11-1あざみ野センタービル1F,1300
松屋　あびこ店/松のや　あびこ店,大阪府大阪市住吉区苅田5-19-17 メトロアビコ1F,1250
松屋　うるま石川店/松のや　うるま石川店,沖縄県うるま市石川白浜1-4-12,1100
松屋　うるま赤道店/マイカリー食堂　うるま赤道店,沖縄県うるま市赤道256-4,1100
松屋　お花茶屋店,東京都葛飾区お花茶屋1-19-16,1250
松屋　かすみがうら店,茨城県かすみがうら市上稲吉1943-32,1150
松屋　さいたま見沼店/松のや　さいたま見沼店,埼玉県さいたま市見沼区新堤94-1,1200
松屋　さがみ野店,神奈川県海老名市東柏ヶ谷2-30-24,1250
松屋　すすきの店,北海道札幌市中央区南4条西3-1-1,1200
松屋　そよら古川橋駅前店/松のや　そよら古川橋駅前店,大阪府門真市末広町41-2　イオンそよら古川橋１Ｆ,1190
松屋　そよら長原駅前店/松のや　そよら長原駅前店,大阪府大阪市平野区長吉長原東2-2-35 そよら長原駅前102区画,1200
松屋　たつの店,兵庫県たつの市龍野町堂本369-3,1150
松屋　つくば研究学園店/松のや　つくば研究学園店,茨城県つくば市研究学園１丁目3-6,1200
松屋　つくば西大通り店/マイカリー食堂　つくば西大通り店,茨城県つくば市春日4-1-5,1150
松屋　つくば東大通店,茨城県つくば市妻木1768-1,1150
松屋　ときわ台店,東京都板橋区常盤台1-2-5,1250
松屋　なんさん通り店,大阪府大阪市中央区難波千日前14-14,1250
松屋　ひたちなか店,茨城県ひたちなか市市毛字原坪894-36,1150
松屋　ひばりが丘店,東京都西東京市ひばりが丘北3-3-14,1250
松屋　ふじみ野駅前店,埼玉県富士見市ふじみ野西1-20-2,1200
松屋　ふじみ野店,埼玉県ふじみ野市ふじみ野1-9-21,1200
松屋　みずほ台店,埼玉県富士見市西みずほ台1-20-8,1200
松屋　みよし店/松のや　みよし店,愛知県みよし市三好町上265,1200
松屋　アクロスプラザ盛岡店/松のや　アクロスプラザ盛岡店,岩手県盛岡市津志田南一丁目1番6号アクロスプラザ盛岡,1040
松屋　エイトタウン本宮店/松のや　エイトタウン本宮店,福島県本宮市荒井字久保田132-8-5,1150
松屋　エル枚方店/松のや　エル枚方店,大阪府枚方市岡東町19-20　エル枚方食遊館１Ｆ,1190
松屋　サテライト安城店,愛知県安城市住吉町荒曽根30-8,1150
松屋　サテライト東中野2丁目店/松のや　サテライト東中野2丁目店,東京都中野区東中野2-2-3,1226
松屋　シティタワー品川店,東京都港区港南4-2-20　シティタワー品川１階Ｆ区画,1300
松屋　フェニックスガーデンうきのじょう店/松のや　フェニックスガーデンうきのじょう店,宮崎県宮崎市柳丸町150,1100
松屋　フォーポイント フレックス by シェラトン 神戸三宮店,兵庫県神戸市中央区布引町2-1-9　フォーポイント フレックス by シェラトン 神戸三宮1F,1180
松屋　阿見店/松のや　阿見店,茨城県稲敷郡阿見町荒川本郷2033-177,1150
松屋　阿佐ヶ谷店,東京都杉並区阿佐ヶ谷北2-1-10,1300
松屋　阿倍野店,大阪府大阪市阿倍野区阿倍野筋2-4-49,1250
松屋　姶良加治木店/松のや　姶良加治木店,鹿児島県姶良市加治木町木田2041-2,1100
松屋　旭川四条店/松のや　旭川四条店,北海道旭川市４条通18丁目547,1150
松屋　旭川大町店/松のや　旭川大町店,北海道旭川市大町一条3丁目9-29,1150
松屋　旭店,千葉県旭市二1131-1,1200
松屋　綾瀬寺尾西店/松のや　綾瀬寺尾西店,神奈川県綾瀬市寺尾西2丁目6-9,1280
松屋　綾瀬店/マイカリー食堂　綾瀬店,東京都足立区綾瀬3-2-8,1250
松屋　安城錦町店,愛知県安城市錦町8-5,1200
松屋　鞍手ＰＡ（下り線）店,福岡県鞍手郡鞍手町中山1308,1100
松屋　伊吹ＰＡ（上り線）店,滋賀県米原市柏原3231,1150
松屋　伊勢原店,神奈川県伊勢原市桜台1-2-30 三協ビル,1250
松屋　伊勢佐木町2丁目店,神奈川県横浜市中区伊勢佐木町2-76-2　キヨビル1F,1300
松屋　伊勢崎宮子町店/松のや　伊勢崎宮子町店,群馬県伊勢崎市宮子町3426-1,1200
松屋　伊勢崎宮前町店/松のや　伊勢崎宮前町店,群馬県伊勢崎市宮前町15,1200
松屋　伊勢崎上泉町店,群馬県伊勢崎市上泉町175番4,1200
松屋　伊丹店,兵庫県伊丹市南町3-1-3,1180
