松屋　足立保塚店,東京都足立区保塚町12-21,1250
松屋　足立六町店/松のや　足立六町店,東京都足立区六町1-8-14,1250
松屋　袖ヶ浦店,千葉県袖ケ浦市福王台3-12-4,1200
松屋　多摩ニュータウン店,東京都八王子市松木33-3,1250
松屋　多摩愛宕店/松のや　多摩愛宕店,東京都多摩市愛宕4-7-3,1250
松屋　太田下田島店/松のや　太田下田島店,群馬県太田市下田島1087-1，1088，1082-3，宝泉南部土地区画整理事業　106街区(未確定),1200
松屋　太田丸山店,群馬県太田市丸山町1380(未確定),1200
松屋　太田飯塚町店,群馬県太田市飯塚町1443,1150
松屋　帯広白樺通り店/松のや　帯広白樺通り店,北海道帯広市西8条南10-2-5,1200
松屋　袋井店/松のや　袋井店,静岡県袋井市川井字丁田1277番3、1277番10、1279番2、1280番、1281番、1282盤1(未確定),1200
松屋　代々木上原店,東京都渋谷区西原3-7-6 大又建設ビル,1250
松屋　代々木店,東京都渋谷区代々木1-34-4,1250
松屋　代々木八幡店,東京都渋谷区富ヶ谷1-52-2 ニューアメリカンビル1F,1300
松屋　大井町店,東京都品川区東大井5-6-8,1300
松屋　大岡山店,東京都大田区北千束1-40-1 石井ビル1F,1300
松屋　大垣店,岐阜県大垣市禾森町5-190,1100
松屋　大久保2丁目店,東京都新宿区大久保2-5-1,1250
松屋　大久保店,東京都新宿区百人町1-18-11,1250
松屋　大宮吉野町店,埼玉県さいたま市北区吉野町1-2-3,1200
松屋　大宮桜木町店/松のや　大宮桜木町店,埼玉県さいたま市大宮区桜木町2-472-3,1200
松屋　大宮深作店,埼玉県さいたま市見沼区深作3-27-3,1200
松屋　大宮大成町店,埼玉県さいたま市大宮区大成町3-517,1200
松屋　大宮東口店,埼玉県さいたま市大宮区宮町1-5,1200
松屋　大宮奈良町店/松のや　大宮奈良町店,埼玉県さいたま市北区奈良町51-4,1200
松屋　大宮南中丸店/松のや　大宮南中丸店,埼玉県さいたま市見沼区大字南中丸519-4,1200
松屋　大口店,神奈川県横浜市神奈川区大口通58-3,1300
松屋　大国町店,大阪府大阪市浪速区敷津東1-9-16,1250
松屋　大阪本町店,大阪府大阪市中央区南本町3-3-8,1250
松屋　大山店,東京都板橋区大山東町58-2,1250
松屋　大森町店,東京都大田区大森西3-20-14,1300
松屋　大森店,東京都大田区山王2-2-11,1300
松屋　大森北口店,東京都品川区南大井6-24-1,1300
松屋　大正千島店/松のや　大正千島店,大阪府大阪市大正区千島3‐4‐7,1250
松屋　大泉学園町店,東京都練馬区大泉学園町7-15-20,1250
松屋　大泉学園店,東京都練馬区東大泉1-37-3,1250
松屋　大泉学園南口店,東京都練馬区東大泉5-41-14,1250
松屋　大船駅前店,神奈川県鎌倉市大船1-12-23,1250
松屋　大船店,神奈川県鎌倉市大船1-25-23,1250
松屋　大曽根北店,愛知県名古屋市北区山田町4-72,1150
松屋　大倉山店/マイカリー食堂　大倉山店,神奈川県横浜市港北区大倉山3-1-28,1300
松屋　大村店/松のや　大村店,長崎県大村市今津町649-1,1100
松屋　大鳥居店,東京都大田区萩中3-6-5,1300
松屋　大津通錦店,愛知県名古屋市中区錦3-7-10,1220
松屋　大津店,滋賀県大津市別保3-2-55,1150
松屋　大塚店,東京都豊島区北大塚2-11-1,1250
松屋　大島店,東京都江東区大島6-9-16,1350
松屋　大府店/松のや　大府店,愛知県大府市一屋町5-3,1200
松屋　大分駅前店,大分県大分市中央町1-1-24,1050
松屋　大分大在店/松のや　大分大在店,大分県大分市角子南2-1-17,1050
松屋　大分猪野店/松のや　大分猪野店,大分県大分市大字猪野1398-3,1050
松屋　大牟田店,福岡県大牟田市船津町459-2,1100
松屋　大名1丁目店,福岡県福岡市中央区大名1-1-10　大名TCビル,1100
松屋　大野城横峰店/松のや　大野城横峰店,福岡県大野城市横峰2-3-9,1100
松屋　大和渋谷店,神奈川県大和市渋谷5-4-1,1250
松屋　大和店,神奈川県大和市大和南1-3-4,1250
松屋　知多店/松のや　知多店,愛知県知多市にしの台4-1-11,1200
松屋　池上3丁目店,東京都大田区池上3-3-1,1300
松屋　池上店,東京都大田区池上6-2-17,1300
松屋　池尻大橋店,東京都目黒区東山3-1-15,1300
松屋　池袋アゼリア通り店,東京都豊島区西池袋5-2-10,1300
松屋　池袋トキワ通店,東京都豊島区西池袋1丁目40番4号 川松ビル,1300
松屋　竹ノ塚店,東京都足立区竹の塚6-9-2,1250
松屋　筑後店/松のや　筑後店,福岡県筑後市山ノ井356-1,1100
松屋　中の島店/松のや　中の島店,北海道札幌市豊平区中の島2条6-1-6,1150
松屋　中延店,東京都品川区中延4-5-3 智勇第一ビル1F,1300
松屋　中河原店,東京都府中市住吉町2-2-2,1250
松屋　中山店,神奈川県横浜市緑区寺山町87-7,1250
松屋　中洲店,福岡県福岡市博多区中洲5-1-7 SPOONビル1階,1100
松屋　中村橋店,東京都練馬区貫井2-2-5,1250
松屋　中津店/松のや　中津店,大分県中津市大字上宮永339-2,1050
松屋　中板橋店,東京都板橋区中板橋21-2,1250
松屋　中目黒青葉台２丁目店,東京都目黒区青葉台2丁目21-9,1300
松屋　中目黒店,東京都目黒区上目黒3-3-1　中津川ビル1・2F,1300
松屋　中野駅前店,東京都中野区中野5-65-5　豊島興業ビル1F,1250
松屋　中野坂上店,東京都中野区中央2-1-2,1226
松屋　中野新橋店,東京都中野区弥生町2-23-3,1250
松屋　中野通り店,東京都中野区中野5-68-9,1300
松屋　中野島店/マイカリー食堂　中野島店,神奈川県川崎市多摩区中野島1-9-2,1250
松屋　中野南口店,東京都中野区中野2-29-8,1300
松屋　中野富士見町店,東京都中野区弥生町5-27-7,1250
松屋　朝霞泉水店/松のや　朝霞泉水店,埼玉県朝霞市泉水1-7-9,1230
松屋　朝霞台店,埼玉県朝霞市浜崎1-3-10 AX-1ビル1F,1230
松屋　朝霞店,埼玉県朝霞市本町2-4-18,1230
松屋　朝霞東口店,埼玉県朝霞市仲町2-2-43　大日屋ビル,1230
松屋　朝霞膝折店,埼玉県朝霞市膝折町2-10-14,1230
松屋　朝倉甘木店/松のや　朝倉甘木店,福岡県朝倉市甘木370-1,1100
松屋　町屋店,東京都荒川区町屋1-2-10,1300
松屋　町田中町店,東京都町田市中町2-16-6,1300
松屋　町田店,東京都町田市原町田4-4-15,1300
松屋　調布駅前店,東京都調布市布田1-40-10 アルソス調布駅前北口ビル,1250
松屋　調布柴崎店/松のや　調布柴崎店,東京都調布市柴崎1-47-3,1300
松屋　長岡堺東町店,新潟県長岡市堺東町7,1170
松屋　長岡店/松のや　長岡店,新潟県長岡市新組町2281-1,1150
松屋　長久手店,愛知県長久手市武蔵塚702,1150
松屋　長居店,大阪府大阪市住吉区長居3-14-8,1200
松屋　長後店,神奈川県藤沢市下土棚509-10,1250
松屋　長瀬店,大阪府東大阪市菱屋西1-17-14,1200
松屋　長津田店/松のや　長津田店,神奈川県横浜市緑区長津田4-2-20　１Ｆ,1300
松屋　長野ＳＢＣ通り店/松のや　長野ＳＢＣ通り店,長野県長野市吉田二丁目24-3,1200
松屋　長野篠ノ井店/松のや　長野篠ノ井店,長野県長野市篠ノ井御幣川637-1,1200
松屋　長野鶴賀七瀬店/マイカリー食堂　長野鶴賀七瀬店,長野県長野市大字鶴賀578-1,1200
松屋　長野柳原店,長野県長野市大字小島86-1,1200
松屋　鳥飼店,大阪府摂津市鳥飼本町3-16-59,1190
松屋　直方ＰＡ（上り線）店,福岡県直方市植木1414-6,1100
松屋　津山店/松のや　津山店,岡山県津山市小田中1443-1,1100
松屋　津田沼店,千葉県習志野市津田沼1-10-41　十番街ビル1F,1250
松屋　津田沼南口店,千葉県習志野市谷津7-9-16　京葉ビル2,1250
松屋　津南店/松のや　津南店,三重県津市高茶屋小森町字丸田283-2,1180
松屋　椎名町店,東京都豊島区長崎1-2-4 バイオレットインA室,1250
松屋　追浜店,神奈川県横須賀市追浜町3-13-13,1250
松屋　鶴ヶ島店,埼玉県川越市鯨井新田1-18,1200
松屋　鶴岡店/松のや　鶴岡店,山形県鶴岡市西新斎町9-10,1200
松屋　鶴間店,神奈川県大和市西鶴間1-2-9　TSURUMA017,1250
松屋　鶴橋店,大阪府大阪市天王寺区下味原町3-13 鶴橋下味原ビル1F,1250
松屋　鶴見店,神奈川県横浜市鶴見区豊岡町2-2 フーガ2,1300
松屋　鶴見東口店/マイカリー食堂　鶴見東口店,神奈川県横浜市鶴見区鶴見中央1-3-3,1300
松屋　鶴瀬店,埼玉県富士見市鶴馬2605-1,1200
松屋　帝京大学前店,東京都八王子市大塚131-8,1250
松屋　天王町店,神奈川県横浜市保土ケ谷区天王町2-47-7,1250
松屋　天神店,福岡県福岡市中央区天神3-3-1 木下ビル,1100
松屋　天満橋店,大阪府大阪市中央区谷町2-8-1大手前M2ビル,1200
松屋　天理店/マイカリー食堂　天理店,奈良県天理市守目堂町106-2,1150
松屋　田無駅前店,東京都西東京市田無町4-2-12 A2ビル1階,1226
松屋　都城店/松のや　都城店,宮崎県都城市平江町14号1番,1100
松屋　都筑インター店,神奈川県横浜市都筑区早渕3-37-14,1300
松屋　都筑池辺町店/松のや　都筑池辺町店,神奈川県横浜市都筑区池辺町3569,1300
松屋　都立家政店,東京都中野区鷺宮3-6-1　岡田ビル,1226
松屋　都立大学店,東京都目黒区平町1-27-5,1300
松屋　土浦真鍋店,茨城県土浦市真鍋1-12-9,1150
松屋　島田店/松のや　島田店,静岡県島田市若松町2713番地5,1150
松屋　東鎌ヶ谷店/松のや　東鎌ヶ谷店,千葉県鎌ケ谷市東鎌ヶ谷2-20-6,1200
松屋　東久留米店/マイカリー食堂　東久留米店,東京都東久留米市東本町1-8,1250
松屋　東郷PA（下り線）店,愛知県日進市米野木町南山978-13,1200
松屋　東郷PA（上り線）店,愛知県日進市米野木町南山978-12,1200
松屋　東金店/松のや　東金店,千葉県東金市東岩崎25-7,1200
松屋　東戸塚西口店,神奈川県横浜市戸塚区川上町90-1,1250
松屋　東戸塚東口店,神奈川県横浜市戸塚区品濃町538-7,1250
松屋　東五反田店,東京都品川区東五反田2-4-1 東五反田レンガビル1F,1350
松屋　東御店,長野県東御市加沢1406-51,1100
松屋　東広島西条店,広島県東広島市西条町寺家4828-1,1200
松屋　東高円寺店,東京都杉並区高円寺南1-6-5,1250
松屋　東根店/松のや　東根店,山形県東根市蟹沢1862-2,1180
松屋　東寺店,京都府京都市南区西九条開ヶ町101-2,1180
松屋　東住吉中野店,大阪府大阪市東住吉区中野4-3-22,1200
松屋　東住吉湯里店,大阪府大阪市東住吉区湯里5-20-6,1200
松屋　東十条店/松のや　東十条店,東京都北区東十条4-4-24 宮田ビル1F,1300
松屋　東小金井店,東京都小金井市東町4-42-19,1226
松屋　東松山上野本店/松のや　東松山上野本店,埼玉県東松山市上野本1174-2,1200
松屋　東松山店,埼玉県東松山市箭弓町1-12-8,1200
松屋　東新宿店,東京都新宿区歌舞伎町2-2-21,1250
松屋　東神奈川店,神奈川県横浜市神奈川区西神奈川1-20-4 加賀ビル,1300
松屋　東千葉店,千葉県千葉市中央区祐光2-15-5,1200
松屋　東船橋店,千葉県船橋市東船橋5-15-11,1250
松屋　東大井町店,東京都品川区東大井5-21-5,1300
松屋　東大宮駅前店/マイカリー食堂　東大宮駅前店,埼玉県さいたま市見沼区東大宮5-38-5,1200
松屋　東大宮店,埼玉県さいたま市見沼区東大宮5-10-5,1200
松屋　東池袋グリーン大通店,東京都豊島区東池袋1-25-17,1300
松屋　東中野店,東京都中野区東中野3-1-19,1226
松屋　東長崎駅前店,東京都豊島区南長崎5-25-12,1250
松屋　東武霞ヶ関店,埼玉県川越市霞ヶ関東1-2-22,1200
松屋　東武練馬店,東京都板橋区徳丸3-1-26,1250
松屋　東伏見店,東京都西東京市東伏見2-4-6高橋イーストビル,1226
松屋　東予丹原店/松のや　東予丹原店,愛媛県西条市周布762番地1,1100
松屋　東陽町店,東京都江東区東陽4-2-5,1350
松屋　東淀川菅原店,大阪府大阪市東淀川区菅原2-7-9,1190
松屋　藤が丘店,愛知県名古屋市名東区藤が丘164番地,1150
松屋　藤井寺駅前店,大阪府藤井寺市岡2-7-18,1200
松屋　藤岡店/松のや　藤岡店,群馬県藤岡市上大塚317-1,1200
松屋　藤枝築地店/松のや　藤枝築地店,静岡県藤枝市築地１丁目713番8、714番1，714番7(未確定),1200
松屋　藤沢石川店/松のや　藤沢石川店,神奈川県藤沢市石川6-19-7,1250
松屋　藤沢南口店,神奈川県藤沢市南藤沢2-10 ワカバビル1F,1250
松屋　藤沢北口店,神奈川県藤沢市藤沢462番地 吉塚ビル1F,1250
松屋　徳島鮎喰店,徳島県徳島市鮎喰町1-33-1,1100
松屋　徳島駅前店,徳島県徳島市寺島本町西1-59,1100
松屋　徳島松茂広島ランプ店/松のや　徳島松茂広島ランプ店,徳島県板野郡松茂町広島字宮ノ前4番地1（地番）,1150
松屋　徳島常三島店,徳島県徳島市北常三島町2-52-1,1100
松屋　徳島南矢三店/松のや　徳島南矢三店,徳島県徳島市南矢三町3-4-47,1100
松屋　栃木インター店/松のや　栃木インター店,栃木県栃木市箱森町38-63,1200
松屋　苫小牧店/松のや　苫小牧店,北海道苫小牧市清水町1丁目4番11号,1150
松屋　敦賀店/松のや　敦賀店,福井県敦賀市中央町1丁目13-1,1150
松屋　奈良駅前店,奈良県奈良市三条本町3番8号,1150
松屋　奈良押熊店/松のや　奈良押熊店,奈良県奈良市押熊町1445-1,1150
松屋　奈良三条大路店/松のや　奈良三条大路店,奈良県奈良市三条大路3-2-21,1150
松屋　那珂川店/松のや　那珂川店,福岡県那珂川市片縄北6-17-8,1057
松屋　那覇古島店/松のや　那覇古島店,沖縄県那覇市銘苅1丁目1番8号、9号（地番）(未確定),1100
松屋　那覇小禄店/松のや　那覇小禄店,沖縄県那覇市田原1丁目3番地1,1100
松屋　那覇新都心店/マイカリー食堂　那覇新都心店,沖縄県那覇市おもろまち4-2-8,1100
松屋　南茨木店,大阪府茨木市沢良宜西1-2-20,1190
松屋　南浦和店,埼玉県さいたま市南区南浦和2-36-16,1200
松屋　南越谷店,埼玉県越谷市南越谷1-19-8　吉澤第一ビル1F,1200
松屋　南海難波店,大阪府大阪市中央区難波4-4-6 1F.2F,1250
松屋　南郷通店,北海道札幌市白石区南郷通9丁目南5-10,1200
松屋　南国店/松のや　南国店,高知県南国市明見817-1,1050
松屋　南砂町店,東京都江東区南砂7-4-6,1350
松屋　南千住店,東京都荒川区南千住7-1-1,1300
松屋　南草津店,滋賀県草津市東矢倉2-6-4,1150
松屋　南大沢店,東京都八王子市南大沢2丁目29番地,1250
松屋　南大分店/松のや　南大分店,大分県大分市畑中1-5-3,1050
松屋　南池袋店,東京都豊島区南池袋1-18-23,1300
松屋　南津守店,大阪府大阪市西成区南津守6-6-46,1200
松屋　南柏店/松のや　南柏店,千葉県柏市南柏1-2-4,1200
松屋　南彦根店/松のや　南彦根店,滋賀県彦根市戸賀町176番1,1100
松屋　南風原店/松のや　南風原店,沖縄県島尻郡南風原町兼城208番、208番1、207番2(未確定),1100
松屋　南林間店,神奈川県大和市南林間1-8-1,1250
松屋　二又瀬店,福岡県福岡市東区二又瀬15-10,1100
松屋　尼崎アマドゥ店,兵庫県尼崎市道意町7-1,1180
松屋　尼崎潮江店,兵庫県尼崎市潮江1-27-15,1180
松屋　尼崎武庫の里店/松のや　尼崎武庫の里店,兵庫県尼崎市武庫の里1-11-1,1180
松屋　廿日市店,広島県廿日市市串戸1-12-5,1200
松屋　日吉店,神奈川県横浜市港北区日吉本町1-20-2,1300
松屋　日田店/松のや　日田店,大分県日田市大字十二町岸高586番4,1150
松屋　日暮里店,東京都荒川区西日暮里2-25-1-307,1300
松屋　日本橋店,大阪府大阪市中央区日本橋1-3-2日本橋コウジィアパートメント,1250
松屋　日本坂ＰＡ（上り線）店,静岡県焼津市石脇上96-1,1150
松屋　日本平PA（下り線）店,静岡県静岡市駿河区国吉田字西原坪,1150
松屋　日野三沢店,東京都日野市三沢1-19-2,1250
松屋　日野神明店,東京都日野市神明2-1-1,1250
松屋　日野店,東京都日野市大坂上1-30-24,1250
松屋　日立桜川町店,茨城県日立市桜川町2-4-12,1150
松屋　日立鹿島町店/松のや　日立鹿島町店,茨城県日立市鹿島町2-16-15,1150
松屋　入間市駅前店/松のや　入間市駅前店,埼玉県入間市豊岡1-2-30 横田スクウエアービル1階,1200
松屋　入間店/松のや　入間店,埼玉県入間市宮寺3186-9,1200
松屋　入間東藤沢店/松のや　入間東藤沢店,埼玉県入間市東藤沢4-2-17,1200
松屋　入場店/松のや　入場店,愛知県名古屋市港区入場1-1303-1,1250
松屋　入谷店,東京都台東区北上野2-31-6,1300
松屋　韮崎店,山梨県韮崎市若宮2-12-20 ライフガーデンにらさき,1150
松屋　納屋橋店/松のや　納屋橋店,愛知県名古屋市中村区名駅南1-3-14,1200
松屋　播磨町店,兵庫県加古郡播磨町南大中3-3-28,1150
松屋　馬橋店,千葉県松戸市馬橋117-1田口ビル,1200
松屋　馬喰町店,東京都中央区日本橋馬喰町1-5-11,1300
松屋　梅ヶ丘店,東京都世田谷区梅丘1-33-9,1250
松屋　梅屋敷店,東京都大田区蒲田2-4-5　スカイドムス,1300
松屋　梅田角田町店,大阪府大阪市北区角田町6-5,1250
松屋　梅田神山町店,大阪府大阪市北区神山町8-22　梅電ビル,1250
松屋　買物公園通店,北海道旭川市2条通8丁目左1号,1150
松屋　博多駅前通り店/マイカリー食堂　博多駅前通り店,福岡県福岡市博多区博多駅前3丁目30-29　タイセイ第2ビル,1100
松屋　博多駅南店/マイカリー食堂　博多駅南店,福岡県福岡市博多区博多駅南1-3-10,1100
松屋　柏崎店,新潟県柏崎市東柳田23-3,1150
松屋　柏松葉町店/松のや　柏松葉町店,千葉県柏市松葉町7丁目36番4,1200
松屋　柏青葉台店/松のや　柏青葉台店,千葉県柏市青葉台1丁目27-13,1200
松屋　柏中央町店,千葉県柏市中央町2番8号,1250
松屋　柏豊四季店/松のや　柏豊四季店,千葉県流山市野々下3-755-2，5(未確定),1250
松屋　白河店,福島県西白河郡西郷村字豊作東1,1180
松屋　白楽店,神奈川県横浜市神奈川区白楽118,1300
松屋　白山店,東京都文京区向丘1-9-23,1250
松屋　白鳥PA（下り線）店,兵庫県姫路市打越字南西1346,1180
松屋　函館亀田店/松のや　函館亀田店,北海道函館市亀田町18-19,1200
松屋　幡ヶ谷店,東京都渋谷区幡ヶ谷2-7-1,1250
松屋　八王子山田店/松のや　八王子山田店,東京都八王子市小比企町435番地9,1250
松屋　八王子店,東京都八王子市旭町7-1 豊栄ﾋﾞﾙ,1250
松屋　八街店/松のや　八街店,千葉県八街市中央16番地7,1200
松屋　八戸田向店/松のや　八戸田向店,青森県八戸市田向1-8-8、9（住居表示）(未確定),1050
松屋　八千代台西口店,千葉県八千代市八千代台北1-11,1250
松屋　八千代台東口店,千葉県八千代市八千代台東1-2-16　第7扇ビル,1250
松屋　八千代店/松のや　八千代店,千葉県八千代市大和田新田1034,1250
松屋　八日市店/松のや　八日市店,滋賀県東近江市八日市東本町11-6,1150
松屋　八幡山店,東京都杉並区上高井戸1-8-22 D.S八幡山 1F,1250
松屋　八尾南太子堂店/松のや　八尾南太子堂店,大阪府八尾市南太子堂6-2-61,1230
松屋　八尾本町店,大阪府八尾市本町2-8-19,1200
松屋　半田店/マイカリー食堂　半田店,愛知県半田市宮本町6-216-7,1200
松屋　反町店,神奈川県横浜市神奈川区松本町1-1-9,1300
松屋　板橋区役所前店,東京都板橋区板橋2-61-11 ホシカメビル1F,1250
松屋　板橋店,東京都板橋区板橋1-50-1,1250
松屋　板橋本町店,東京都板橋区本町36-1 バロール本町1F,1250
松屋　飯塚片島店/松のや　飯塚片島店,福岡県飯塚市片島2丁目1-2,1100
松屋　飯田橋駅前店,東京都千代田区飯田橋4丁目9-10,1250
松屋　飯田橋東口店,東京都新宿区下宮比町1-1,1250
松屋　飯能双柳店,埼玉県飯能市双柳757-4,1200
松屋　磐田岩井店/松のや　磐田岩井店,静岡県磐田市岩井字大久保3444番1,1200
松屋　肥後橋店,大阪府大阪市西区江戸堀1-2-14　肥後橋官報ビル,1250
松屋　尾山台店,東京都世田谷区尾山台3-22-5 谷岸ビル,1300
松屋　彦根店,滋賀県彦根市東沼波町125-1,1080
松屋　姫路駅南大路通店,兵庫県姫路市安田3-119,1180
松屋　姫路花田店,兵庫県姫路市花田町１本松93番2　他,1150
松屋　姫路飾磨店,兵庫県姫路市飾磨区今在家1066,1150
松屋　姫路大手前通店,兵庫県姫路市駅前町338,1180
松屋　百合ヶ丘店,神奈川県川崎市麻生区百合丘1-1-4,1225
松屋　百万遍店,京都府京都市左京区吉田泉殿町1-87番地,1160
松屋　氷川台店,東京都練馬区氷川台3-39-9,1250
松屋　瓢箪山駅前店,大阪府東大阪市本町15-15,1200
松屋　浜寺店,大阪府堺市西区浜寺船尾町西5丁132-1,1200
松屋　浜松高塚店/松のや　浜松高塚店,静岡県浜松市中央区高塚町4530番、4533番1、4533番2、4520番1(未確定),1200
松屋　浜松高竜店,静岡県浜松市中央区寺島町1024,1200
松屋　浜松高林店,静岡県浜松市中央区高林4-14-22,1200
松屋　浜松初生町店/松のや　浜松初生町店,静岡県浜松市中央区初生町798,1200
松屋　不動前店,東京都品川区西五反田4-30-12 福井ビル,1300
松屋　富山下赤江店,富山県富山市下赤江町1-1-69,1100
松屋　富山掛尾店/松のや　富山掛尾店,富山県富山市掛尾町259,1100
松屋　富山田中町店/松のや　富山田中町店,富山県富山市田中町4-18-43,1100
松屋　富山婦中店/松のや　富山婦中店,富山県富山市婦中町下轡田428-4,1100
松屋　富士ラウンドワン店,静岡県富士市八代町4-23,1200
松屋　富士吉田店,山梨県富士吉田市上吉田4203-3,1300
松屋　富士宮店,静岡県富士宮市中原町312,1160
松屋　富士見台店,東京都練馬区貫井3-1-8,1250
松屋　富田店,大阪府高槻市富田町1-6-3,1190
松屋　富田林店/松のや　富田林店,大阪府富田林市若松町2-3-18,1200
松屋　布施寿町店/松のや　布施寿町店,大阪府東大阪市寿町3-10-19,1230
松屋　布田店,東京都調布市布田2-47-2,1230
松屋　府中店,東京都府中市宮西町2-1-8,1300
松屋　府中本町店/マイカリー食堂　府中本町店,東京都府中市本町1-29-1,1300
松屋　浮間舟渡駅前店,東京都北区浮間4-32-20,1300
松屋　武庫川店/マイカリー食堂　武庫川店,兵庫県尼崎市稲葉荘1-14-5,1180
松屋　武石店/松のや 武石店,千葉県千葉市花見川区武石町１丁目130-1128-1（地番）(未確定),1250
松屋　武蔵浦和店/松のや　武蔵浦和店,埼玉県さいたま市南区沼影1-10-1,1200
松屋　武蔵関店,東京都練馬区関町北2-27-13 下田ﾋﾞﾙ1F,1226
松屋　武蔵境店,東京都武蔵野市境1-2-3,1226
松屋　武蔵境南口店/松のや　武蔵境南口店,東京都武蔵野市境南町2-10-6　メゾン・ドゥ・ソレイユ1-1号室,1250
松屋　武蔵小金井店,東京都小金井市本町1-18-8,1226
松屋　武蔵小山店,東京都品川区小山3-25-15,1300
松屋　武蔵小杉南口店/松のや　武蔵小杉南口店,神奈川県川崎市中原区小杉町3‐257‐4　小杉第二山協ビル1階,1300
松屋　武蔵小杉北口店/マイカリー食堂　武蔵小杉北口店,神奈川県川崎市中原区新丸子町922,1300
松屋　武蔵新城店,神奈川県川崎市中原区上新城2-10-15,1300
松屋　武蔵新田店,東京都大田区矢口1-7-15イセモトビル,1300
松屋　武蔵村山店,東京都武蔵村山市学園3-37-2,1250
松屋　武蔵中原店/松のや　武蔵中原店/マイカリー食堂　武蔵中原店,神奈川県川崎市中原区上小田中6-21-9,1300
松屋　福井御幸店,福井県福井市御幸4-20-8,1150
松屋　福井若杉店/マイカリー食堂　福井若杉店,福井県福井市若杉4丁目715,1150
松屋　福井大和田店,福井県福井市大和田2-1304,1150
松屋　福岡箱崎店/マイカリー食堂　福岡箱崎店,福岡県福岡市東区東浜1-2-26,1100
松屋　福山花園店,広島県福山市花園町2-5-34,1150
松屋　福山東店/松のや　福山東店,広島県福山市東深津町3-23-8,1200
松屋　福生志茂店,東京都福生市志茂36-4,1250
松屋　福生店,東京都福生市東町3-10　栄和ビル1F,1250
