松屋　伊予西条店/松のや　伊予西条店,愛媛県西条市大町686番地3,1100
松屋　井土ヶ谷店,神奈川県横浜市南区井土ヶ谷中町161,1250
松屋　磯子店,神奈川県横浜市磯子区森1-7-3 磯子センターハイツ104,1250
松屋　一関店/松のや　一関店,岩手県一関市山目大槻109-6,1040
松屋　一宮店/松のや　一宮店,愛知県一宮市赤見1-2-4,1200
松屋　稲城矢野口店/松のや　稲城矢野口店,東京都稲城市矢野口517-2,1250
松屋　稲沢店/松のや　稲沢店,愛知県稲沢市正明寺二丁目16番2,1200
松屋　稲田堤店/マイカリー食堂　稲田堤店,神奈川県川崎市多摩区菅2-1-1,1250
松屋　稲毛海岸店/松のや　稲毛海岸店,千葉県千葉市美浜区高洲1-22-11ニューよろずやビル１Ｆ,1250
松屋　稲毛店,千葉県千葉市稲毛区小仲台2-5-15,1250
松屋　茨城東海店/松のや　茨城東海店,茨城県那珂郡東海村東海1-2-50,1150
松屋　茨城那珂店/松のや 茨城那珂店,茨城県那珂市竹ノ内2丁目30-2（未確定）,1150
松屋　宇治小倉店/松のや　宇治小倉店,京都府宇治市宇治小倉町久保15番地（地番）,1200
松屋　宇都宮オリオン通店,栃木県宇都宮市曲師町5-8 多喜屋ビル,1200
松屋　宇都宮細谷町店/松のや　宇都宮細谷町店,栃木県宇都宮市細谷町324-10,1200
松屋　宇都宮平松店/松のや　宇都宮平松店,栃木県宇都宮市平松2-22-26,1200
松屋　宇都宮簗瀬町店,栃木県宇都宮市簗瀬町1984-6,1200
松屋　宇部店,山口県宇部市島1-1-2,1100
松屋　羽村店,東京都羽村市五ノ神4-15-11　シティープラザはむら1F,1250
松屋　羽田イノベーションシティ店/松のや　羽田イノベーションシティ店,東京都大田区羽田空港1丁目1番4号ｲﾉﾍﾞｰｼｮﾝｼﾃｨ2F区画（B2-3）(未確定),1350
松屋　鵜の木店/松のや　鵜の木店,東京都大田区鵜の木2-2-5（住居表示）,1300
松屋　浦和所沢バイパス店,埼玉県富士見市水谷東1-1-2,1230
松屋　浦和太田窪店,埼玉県さいたま市南区大字太田窪2840-2,1200
松屋　浦和仲町店/松のや　浦和仲町店,埼玉県さいたま市浦和区仲町1-2-9,1200
松屋　浦和町谷店/松のや　浦和町谷店,埼玉県さいたま市桜区町谷2-1-1,1200
松屋　浦和田島通店,埼玉県さいたま市南区四谷3-7-6,1200
松屋　栄三丁目店,愛知県名古屋市中区栄3-13-11,1200
松屋　越前千福店/松のや　越前千福店,福井県越前市千福町29,1150
松屋　越谷下間久里店/松のや　越谷下間久里店,埼玉県越谷市下間久里980-1,1200
松屋　越谷蒲生店/マイカリー食堂　越谷蒲生店,埼玉県越谷市蒲生南町15-4,1200
松屋　越谷大道店/松のや　越谷大道店,埼玉県越谷市大字大道５７４,1200
松屋　越谷店/松のや　越谷店,埼玉県越谷市弥生町17-1,1200
松屋　延岡店/松のや　延岡店,宮崎県延岡市出北5丁目18-2,1100
松屋　塩尻吉田店/松のや　塩尻吉田店,長野県塩尻市広丘吉田字道東1087-1,1200
松屋　塩尻店/松のや　塩尻店,長野県塩尻市大門泉町13-8,1200
松屋　奥屋PA（上り線）店,広島県東広島市志和町奥屋字春日山365,1150
松屋　押上店,東京都墨田区押上1-11-3,1300
松屋　横手店/松のや　横手店,秋田県横手市安田越廻31-1(未確定),1100
松屋　横須賀中央店/松のや　横須賀中央店,神奈川県横須賀市大滝町2-23,1300
松屋　横浜西口店,神奈川県横浜市西区北幸1-1-2,1350
松屋　王子1丁目店,東京都北区王子1-6-11　都築ビル102号,1300
松屋　王子神谷店/松のや　王子神谷店/マイカリー食堂　王子神谷店,東京都北区王子5-10-3　王子ハイツ1F,1300
松屋　王子店,東京都北区王子1-13-16 エイムビル1F,1300
松屋　鴬谷店,東京都台東区根岸1-6-6,1300
松屋　岡崎北店,愛知県岡崎市鴨田町字広元196,1200
松屋　岡山駅西口店,岡山県岡山市北区駅元町22-13 西口駅前ビル,1100
松屋　岡山駅前店,岡山県岡山市北区本町3-3,1100
松屋　岡山下中野店/マイカリー食堂　岡山下中野店,岡山県岡山市北区下中野343-101,1100
松屋　岡山十日市店,岡山県岡山市北区十日市西町5-28,1100
松屋　岡町店,大阪府豊中市中桜塚1-1-1ティオ阪急岡町１階,1200
松屋　沖縄知花店/松のや　沖縄知花店,沖縄県沖縄市知花5-16-20,1100
松屋　荻窪西口店,東京都杉並区上荻1-16-3,1300
松屋　桶川西口店/松のや　桶川西口店/マイカリー食堂　桶川西口店,埼玉県桶川市若宮1-2-8,1200
松屋　桶川店,埼玉県桶川市坂田1632-1,1200
松屋　下関稗田店,山口県下関市稗田中町9-31,1100
松屋　下高井戸店,東京都世田谷区赤堤4-48-10雪華堂ﾋﾞﾙ1F,1250
松屋　下石神井店/マイカリー食堂　下石神井店,東京都練馬区下石神井4-1-7,1226
松屋　下赤塚店/マイカリー食堂　下赤塚店,東京都板橋区赤塚2-1-14 入山プラザ1階,1250
松屋　下総中山店/松のや　下総中山店,千葉県船橋市本中山2-17-35,1200
松屋　下板橋店,東京都豊島区池袋本町3-25-13,1250
松屋　下北沢店,東京都世田谷区北沢2-19-13 松本ビル1F,1250
松屋　加古川平岡町店/マイカリー食堂　加古川平岡町店,兵庫県加古川市平岡町一色370-1,1180
松屋　加古川野口町店,兵庫県加古川市野口町坂元45-1,1150
松屋　河内山本店,大阪府八尾市山本町1-7-1　西田ビル1・4F,1200
松屋　花園町店,大阪府大阪市西成区鶴見橋1-3-5 ピュアファースト花園1F,1250
松屋　花小金井駅前店,東京都小平市花小金井1-8-6大沢ビル(ビックアロービル),1226
松屋　花輪SA（下り線）店,秋田県鹿角市花輪字火付け附森65-3,1050
松屋　花輪SA（上り線）店,秋田県鹿角市花輪張渡11-24,1050
松屋　我孫子若松店,千葉県我孫子市若松140-1,1200
松屋　海南店,和歌山県海南市船尾213-17,1100
松屋　海老名河原口店/松のや　海老名河原口店,神奈川県海老名市河原口4-7-3,1280
松屋　海老名店,神奈川県海老名市中央2-1-5,1250
松屋　蟹江店/松のや　蟹江店,愛知県海部郡蟹江町錦2-162　メナー錦1階,1200
松屋　外環八尾店/マイカリー食堂　外環八尾店,大阪府八尾市志紀町南3-190-1,1200
松屋　各務原店/松のや　各務原店,岐阜県各務原市那加不動丘2-96,1150
松屋　学芸大学店,東京都目黒区鷹番3-8-7,1300
松屋　掛川PA(下り線)店,静岡県掛川市倉真5968-4,1300
松屋　掛川SC(下り線)店,静岡県掛川市倉真5968-4,1097
松屋　笠寺店/松のや　笠寺店,愛知県名古屋市南区千竈通7-8-1,1200
松屋　橿原新賀店/松のや　橿原新賀店,奈良県橿原市新賀町141-2,1150
松屋　梶が谷店/マイカリー食堂　梶が谷店,神奈川県川崎市高津区末長1-8-20,1300
松屋　滑川店/松のや　滑川店,富山県滑川市上小泉字館2163-1,1200
松屋　葛西長島陸橋店/マイカリー食堂　葛西長島陸橋店,東京都江戸川区東葛西5-3-3　Ground　Tree,1300
松屋　蒲郡店/松のや　蒲郡店,愛知県蒲郡市旭町15-1,1200
松屋　蒲田西口店/マイカリー食堂　蒲田西口店,東京都大田区西蒲田7-1-11,1300
松屋　蒲田東口店,東京都大田区蒲田5-25-2 コーポ橋本1F,1300
松屋　鎌ヶ谷店,千葉県鎌ケ谷市東初富4-2-83,1200
松屋　鴨居店,神奈川県横浜市緑区鴨居1-8-10,1250
松屋　茅ケ崎赤松町店/松のや　茅ケ崎赤松町店,神奈川県茅ヶ崎市赤松町1-5,1250
松屋　茅ヶ崎店,神奈川県茅ヶ崎市新栄町8-8 コジマビル1F,1250
松屋　茅場町店/松のや　茅場町店,東京都中央区日本橋茅場町2-8-4全国中小企業会館１Ｆ,1350
松屋　萱島店,大阪府門真市上島町46-7,1190
松屋　刈谷日高店,愛知県刈谷市日高町4丁目611,1210
松屋　苅田店/松のや　苅田店,福岡県京都郡苅田町幸町4-4,1100
松屋　寒河江店/松のや　寒河江店,山形県寒河江市寒河江赤田62-1,1180
松屋　寒川倉見店/松のや　寒川倉見店,神奈川県高座郡寒川町倉見849-3,1250
松屋　干隈店/松のや　干隈店/松のや　干隈店/松のや　干隈店,福岡県福岡市早良区干隈3-29-6,1057
松屋　関大前店,大阪府吹田市千里山東1-14-5 吉本マンション1F,1200
松屋　館林店/松のや　館林店,群馬県館林市松原3丁目16番5,1200
松屋　丸亀中府店/松のや　丸亀中府店/マイカリー食堂　丸亀中府店,香川県丸亀市中府町1-6-22,1100
松屋　丸亀柞原店,香川県丸亀市柞原町409-1,1100
松屋　岸里店,大阪府大阪市西成区潮路1-10-1　林　岸里駅前ビル,1250
松屋　岸和田西之内店/松のや　岸和田西之内店,大阪府岸和田市西之内町4-24,1200
松屋　岸和田店,大阪府岸和田市土生町2-7-17,1200
松屋　岩出店/マイカリー食堂　岩出店,和歌山県岩出市岡田4-1,1100
松屋　岩本町店/松のや　岩本町店,東京都千代田区※詳細はお問い合わせください。,1350
松屋　喜多見店,東京都世田谷区喜多見9-1-7　栄屋ビル,1250
松屋　喜連瓜破店,大阪府大阪市平野区喜連2-5-47 村瀬ビル1F,1200
松屋　岐阜茜部店,岐阜県岐阜市茜部本郷3-159-3,1100
松屋　岐阜則武店/松のや　岐阜則武店,岐阜県岐阜市則武西2-19-16,1100
松屋　岐阜東栄町店/松のや　岐阜東栄町店,岐阜県岐阜市東栄町5丁目4,1150
松屋　旗の台店,東京都品川区旗の台2-7-6,1300
松屋　紀ノ川大橋店,和歌山県和歌山市湊1820-99,1100
松屋　紀尾井町店,東京都千代田区麹町3-5-17,1280
松屋　亀岡店,京都府亀岡市下矢田町2-35-5,1200
松屋　亀戸店,東京都江東区亀戸2-20-4,1300
松屋　亀戸南店,東京都江東区亀戸6-59-10 サンシャレード亀戸1F,1300
松屋　亀田インター店,新潟県新潟市中央区姥ケ山63-1,1150
松屋　亀島店/松のや　亀島店,愛知県名古屋市中村区則武本通1-36　マシュービル1F,1200
松屋　亀有店,東京都葛飾区亀有3-25-1,1250
松屋　亀有南口店,東京都葛飾区亀有3-30-12,1250
松屋　菊名店,神奈川県横浜市港北区菊名4-2-6,1300
松屋　吉祥院店/松のや　吉祥院店,京都府京都市南区吉祥院西ノ茶屋町63番,1160
松屋　吉祥寺サンロード店,東京都武蔵野市吉祥寺本町1-15-4,1300
松屋　吉祥寺南口店,東京都武蔵野市吉祥寺南町1-5-5,1300
松屋　吉川店,埼玉県吉川市木売1-4-11,1200
松屋　吉塚店,福岡県福岡市博多区吉塚本町13-30,1100
松屋　久我山店,東京都杉並区久我山2-28-1,1230
松屋　久米川店/松のや　久米川店,東京都東村山市栄町1-5-2,1250
松屋　久留米国分バイパス店/松のや　久留米国分バイパス店,福岡県久留米市国分町936-6,1100
松屋　久留米新合川店/松のや　久留米新合川店,福岡県久留米市新合川1-5-40,1100
松屋　久留米通町店,福岡県久留米市通町1-16,1100
松屋　宮崎錦本町店/松のや　宮崎錦本町店,宮崎県宮崎市錦本町3-45,1100
松屋　宮崎台店/松のや　宮崎台店,神奈川県川崎市宮前区宮崎2-8-8　COMODO宮崎台,1300
松屋　宮崎門川店/松のや　宮崎門川店,宮崎県東臼杵郡門川町中須5-6-2,1100
松屋　牛久店,茨城県牛久市田宮町41-1,1150
松屋　牛田店,東京都足立区千住曙町3-1,1250
松屋　京王つつじヶ丘店,東京都調布市東つつじヶ丘1-2-5,1230
松屋　京王八王子店,東京都八王子市東町1-1-20第6岩下ビル1F,1250
松屋　京急久里浜店,神奈川県横須賀市久里浜4-5-2　久里浜ロマンビル,1250
松屋　京成臼井店/松のや　京成臼井店,千葉県佐倉市王子台3-30-4　臼井ＶＩＭ１Ｆ,1200
松屋　京成高砂店,東京都葛飾区高砂2-38-5,1250
松屋　京成小岩店/マイカリー食堂　京成小岩店,東京都江戸川区北小岩6-12-1,1250
松屋　京成大久保店/松のや　京成大久保店,千葉県習志野市大久保1-21-12　ニューTKビル　1F,1250
松屋　京成立石店,東京都葛飾区立石1-19-6,1250
松屋　京都久御山店,京都府久世郡久御山町野村村東87-1,1200
松屋　京都西院店,京都府京都市右京区西院高山寺町12-7,1160
松屋　京葉市川PA（下り線）店/松のや　京葉市川PA（下り線）店,千葉県市川市田尻1-5-1　京葉市川PA下り線内2階,1200
松屋　橋本店,神奈川県相模原市緑区橋本6-2-1,1250
松屋　狭山根岸店,埼玉県狭山市根岸1-8-34,1200
松屋　狭山市駅前店,埼玉県狭山市入間川1-3-2,1200
松屋　狭山店,埼玉県狭山市下奥富1366-2,1200
松屋　玉川学園前店,東京都町田市玉川学園2-11-21第17通南ビル,1250
松屋　錦糸町南店,東京都墨田区江東橋3-8-10 井野ビル1F,1300
松屋　錦糸町北口店,東京都墨田区錦糸2-4-10　S川上ビル,1300
松屋　琴似店,北海道札幌市西区琴似一条2-6-8,1150
松屋　近江八幡店/松のや　近江八幡店,滋賀県近江八幡市鷹飼町北４丁目1-3,1100
松屋　近大前店,大阪府東大阪市小若江4-13-11 1F・2F,1200
松屋　近鉄八尾駅前店/松のや　近鉄八尾駅前店,大阪府八尾市北本町2-15-32梅村ビル1階,1200
松屋　金山店,愛知県名古屋市中区金山4-1-1,1200
松屋　金沢工大前店/松のや　金沢工大前店,石川県野々市市扇が丘8-8,1200
松屋　金沢示野店/松のや　金沢示野店,石川県金沢市戸板西1-55,1200
松屋　金沢昌永町店,石川県金沢市昌永町18-5,1200
松屋　金沢神谷内店,石川県金沢市神谷内町二22-1,1200
松屋　金沢増泉店/松のや　金沢増泉店,石川県金沢市神田2-2-25,1200
松屋　金沢八景店/マイカリー食堂　金沢八景店,神奈川県横浜市金沢区瀬戸16-38,1300
松屋　金町店,東京都葛飾区東金町1-45-2,1250
松屋　九条店/松のや　九条店,大阪府大阪市西区九条1-14-26,1250
松屋　九品仏店/松のや　九品仏店,東京都世田谷区奥沢6-25-8,1300
松屋　駒込店,東京都豊島区駒込1-38-3 小宮山駒込ビル1.2F,1250
松屋　駒沢店,東京都世田谷区駒沢1-5-15,1300
松屋　熊谷バイパス店/松のや　熊谷バイパス店,埼玉県熊谷市大字肥塚1408-3,1200
松屋　熊本光の森店/松のや　熊本光の森店,熊本県菊池郡菊陽町光の森2-7-4,1150
松屋　熊本桜木店/松のや　熊本桜木店,熊本県熊本市東区桜木4-2-63,1150
松屋　熊本新市街店/松のや　熊本新市街店,熊本県熊本市中央区新市街9-4　熊本第一ファームビル1F,1150
松屋　熊本長嶺南店/松のや　熊本長嶺南店,熊本県熊本市東区長嶺南一丁目7番20号,1150
松屋　栗東市役所前店/松のや　栗東市役所前店,滋賀県栗東市安養寺1-7-2,1150
松屋　栗東霊仙寺店/松のや　栗東霊仙寺店,滋賀県栗東市霊仙寺5-5-17,1150
松屋　桑名店,三重県桑名市中央町3-64-1,1180
松屋　群馬吉岡店/松のや　群馬吉岡店,群馬県北群馬郡吉岡町大字大久保1436-1(未確定),1200
松屋　郡山コスモス通店,福島県郡山市堤3-180,1150
松屋　郡山駅前店,福島県郡山市駅前2-3-9,1150
松屋　郡山芳賀店,福島県郡山市芳賀3-1-23,1150
松屋　恵庭店/松のや　恵庭店,北海道恵庭市大町一丁目1番13号,1150
松屋　恵比寿西店,東京都渋谷区恵比寿西1-10-8,1400
松屋　恵美須町店,大阪府大阪市浪速区恵美須西2-1-32,1200
松屋　桂店,京都府京都市西京区樫原盆山16-1,1200
松屋　経堂店,東京都世田谷区経堂1-12-11,1226
松屋　穴生店/松のや　穴生店,福岡県北九州市八幡西区穴生2-8-7,1100
松屋　穴川オーツーパーク店/松のや　穴川オーツーパーク店,千葉県千葉市稲毛区園生町380-1,1250
松屋　権現湖PA(上り線)店,兵庫県加古川市平荘町中山1001-26,1200
松屋　犬山店/松のや　犬山店,愛知県犬山市大字犬山字東古券334-1(未確定),1200
松屋　元住吉店,神奈川県川崎市中原区木月3丁目6番18号,1300
松屋　古川店/松のや　古川店,宮城県大崎市古川中島町2-63,1150
松屋　古淵店,神奈川県相模原市南区古淵1-7-1,1250
松屋　戸越銀座店,東京都品川区平塚1-8-2 山こしビル1F,1300
松屋　戸塚店,神奈川県横浜市戸塚区戸塚町16-16,1300
松屋　戸田駅前店,埼玉県戸田市大字新曽字柳原329-1,1200
松屋　五井店,千葉県市原市五井中央西1-14-22 潤間五井ビル,1200
松屋　五個荘店,滋賀県東近江市五個荘簗瀬町上川原5-2,1100
松屋　五反野店/マイカリー食堂　五反野店,東京都足立区足立4-29-8,1250
松屋　御影店,兵庫県神戸市東灘区御影中町1-6-6　シティーホームズ御影,1180
松屋　御幸本町店/松のや　御幸本町店,栃木県宇都宮市御幸本町4732-7,1200
松屋　御崎店,大阪府大阪市住之江区御崎7-15-21,1200
松屋　御殿場店,静岡県御殿場市川島田939-1,1300
松屋　厚木戸田店,神奈川県厚木市戸田540-1,1250
松屋　厚木店,神奈川県厚木市田村町7-20,1250
松屋　向ヶ丘遊園店,神奈川県川崎市多摩区登戸2737-4 タカノビル1F・2F,1225
松屋　向原店,東京都豊島区東池袋4-41-27,1300
松屋　広島胡町店,広島県広島市中区胡町1-20永井興産胡町ビル1階,1200
松屋　広島三原店/松のや　広島三原店,広島県三原市皆実1-25-17,1200
松屋　広島紙屋町店,広島県広島市中区大手町1-4-5 アロハビル1階,1200
松屋　広島西原店/松のや　広島西原店,広島県広島市安佐南区西原9-14-1,1200
松屋　広島千田店,広島県広島市中区東千田町2-3-23,1200
松屋　広島八木店/松のや　広島八木店,広島県広島市安佐南区八木5-2331-1(未確定),1200
松屋　広島矢野店/松のや　広島矢野店,広島県広島市安芸区矢野西1-2-5,1200
松屋　弘前高田店/松のや　弘前高田店,青森県弘前市大字高田1-3-1,1040
松屋　江古田店,東京都練馬区栄町34-1,1250
松屋　江戸川橋店,東京都文京区関口1-47-12 江戸川橋ビル1F,1250
松屋　江戸川店,東京都江戸川区江戸川6-8-49,1250
松屋　江坂駅前店,大阪府吹田市豊津町14-31由谷エムワイビル,1200
松屋　江南店,愛知県江南市高屋町西町112,1200
松屋　江別店/松のや　江別店,北海道江別市高砂町13-1,1150
松屋　港南台店,神奈川県横浜市港南区港南台4-1-1,1250
松屋　溝の口店/松のや　溝の口店,神奈川県川崎市高津区溝口1-19-10 岡本ビル1階,1300
松屋　溝の口南口店,神奈川県川崎市高津区久本1-4-10　TKBビル,1300
松屋　甲賀水口店/松のや　甲賀水口店,滋賀県甲賀市水口町日電1-55,1100
松屋　甲府荒川店,山梨県甲府市荒川1-8-32,1200
松屋　甲府国母店/松のや　甲府国母店,山梨県甲府市大里町358-1,1250
松屋　綱島店,神奈川県横浜市港北区綱島西1-1-3,1300
松屋　行橋中央店/松のや　行橋中央店,福岡県行橋市中央1-13-26,1100
松屋　行徳店,千葉県市川市行徳駅前2-3,1250
松屋　行徳南店,千葉県市川市行徳駅前2-8-6,1250
松屋　香里園駅前店,大阪府寝屋川市香里南之町20-20,1190
松屋　高井戸店,東京都杉並区高井戸西1-29-3,1230
松屋　高円寺店,東京都杉並区高円寺北3-22-16,1300
松屋　高坂店,埼玉県東松山市元宿1-11-2,1200
松屋　高崎駅前店/松のや　高崎駅前店,群馬県高崎市八島町17-10,1200
松屋　高崎下之城店,群馬県高崎市下之城町177-4,1200
松屋　高崎南大類店/松のや　高崎南大類店,群馬県高崎市南大類町915-1,1200
松屋　高崎問屋町店,群馬県高崎市問屋町1-10-4,1200
松屋　高松松島店/松のや　高松松島店,香川県高松市松島町3-19-8,1100
松屋　高松兵庫町店,香川県高松市兵庫町1番地20,1100
松屋　高松木太店,香川県高松市木太町3838-1,1100
松屋　高石店/松のや　高石店,大阪府高石市西取石8丁目1番14号,1200
松屋　高知朝倉店/松のや　高知朝倉店/マイカリー食堂　高知朝倉店,高知県高知市朝倉東町50-3,1050
松屋　高知南御座店/松のや　高知南御座店,高知県高知市南御座12-7,1050
松屋　高津店,神奈川県川崎市高津区二子5-2-1,1300
松屋　高田馬場2丁目店,東京都新宿区高田馬場2-1-2,1300
松屋　高島平駅前店,東京都板橋区高島平8-3-3,1250
松屋　高島平店,東京都板橋区高島平2-1-4,1250
松屋　国分寺西元町店,東京都国分寺市西元町2-9-25,1226
松屋　国分寺南口店/マイカリー食堂　国分寺南口店,東京都国分寺市南町3-16-6,1250
松屋　国分寺北口店,東京都国分寺市本町2-2-1,1250
松屋　国立店/マイカリー食堂　国立店,東京都国立市中1-8-5,1250
松屋　国領店,東京都調布市国領町4-8-1,1230
松屋　黒部店/松のや　黒部店,富山県黒部市荻生1651番3,1200
松屋　狛江店/松のや　狛江店,東京都狛江市東和泉1-20-1,1250
松屋　今治喜田村店/松のや　今治喜田村店,愛媛県今治市喜田村2-5-28,1100
松屋　今治片山店/松のや　今治片山店,愛媛県今治市片山3丁目1番34号,1100
松屋　今池店/松のや　今池店,愛知県名古屋市千種区今池5-23-14 コザキ今池ビル1F,1200
松屋　今津店,兵庫県西宮市今津曙町1-1エキーマ今津1F,1180
松屋　今里店,大阪府大阪市東成区大今里西3-5-1　イル・ソーレ今里駅前,1250
松屋　佐賀大財店/松のや　佐賀大財店,佐賀県佐賀市大財3-10-26,1100
松屋　佐久店/松のや　佐久店,長野県佐久市岩村田北1-13-7,1250
松屋　佐原店,千葉県香取市北1-13-10,1200
松屋　佐倉白銀店/松のや　佐倉白銀店,千葉県佐倉市白銀1-3-10(未確定),1200
松屋　佐野店/松のや　佐野店,栃木県佐野市浅沼町558-3,1200
松屋　座間立野台店,神奈川県座間市立野台2-20-3,1250
松屋　坂戸にっさい店/松のや　坂戸にっさい店,埼玉県坂戸市にっさい花みず木2-9-1,1200
松屋　坂戸店,埼玉県坂戸市南町34-5,1200
松屋　阪急高槻市駅前店,大阪府高槻市城北町2-2-7,1190
松屋　阪急南方駅前店/マイカリー食堂　阪急南方駅前店,大阪府大阪市淀川区西中島3-17-2,1200
松屋　阪神西宮店,兵庫県西宮市田中町2-3,1180
松屋　阪神尼崎店,兵庫県尼崎市神田中通2-17,1200
松屋　堺山本店/松のや　堺山本店,大阪府堺市堺区山本町二丁59番,1200
松屋　堺大野芝店/松のや　堺大野芝店,大阪府堺市中区大野芝137-1,1200
松屋　堺東銀座街店,大阪府堺市堺区中瓦町2-2-9,1200
松屋　堺美原店/松のや　堺美原店,大阪府堺市美原区黒山1001,1200
松屋　鷺宮店,東京都中野区鷺ノ宮3-18-3 エレガンス鷺ノ宮1Ｆ,1226
松屋　鷺沼店,神奈川県川崎市宮前区鷺沼1-11-6　鷺沼第一ビル,1300
松屋　桜橋店,大阪府大阪市北区曽根崎新地2丁目2-13,1250
松屋　桜上水店,東京都杉並区下高井戸1-22-6,1250
松屋　桜新町店,東京都世田谷区桜新町1-12-9,1300
松屋　桜川店/松のや　桜川店,大阪府大阪市浪速区桜川3-1-24　丸ニビル,1250
松屋　桜台店,東京都練馬区桜台1-4-67,1250
松屋　桜美林学園店/松のや　桜美林学園店,東京都町田市根岸町1010-6,1250
松屋　笹塚2丁目店,東京都渋谷区笹塚2-41-17　滝沢ビル1F,1250
松屋　札幌駅前通店,北海道札幌市中央区北1条西3丁目3番地 敷島北一条ビル,1200
松屋　札幌美しが丘店/松のや　札幌美しが丘店,北海道札幌市清田区美しが丘4条5-3-3,1150
松屋　札幌北野店/松のや　札幌北野店,北海道札幌市清田区北野７条5-12-30,1150
松屋　雑色店/松のや　雑色店,東京都大田区仲六郷2-28-2,1300
松屋　三ノ輪店,東京都台東区三ノ輪2-14-10,1300
松屋　三河安城店,愛知県安城市緑町2-9-2,1200
松屋　三郷下彦川戸店/松のや　三郷下彦川戸店,埼玉県三郷市下彦川戸762-1,1250
松屋　三郷戸ヶ崎店/松のや　三郷戸ヶ崎店,埼玉県三郷市戸ヶ崎3丁目586,1200
松屋　三郷店,埼玉県三郷市三郷2-1-4 ふじプラザビル,1200
松屋　三軒茶屋店,東京都世田谷区三軒茶屋1-32-15,1300
松屋　三国店,大阪府大阪市淀川区三国本町3-30-13,1200
松屋　三重川越町店/松のや　三重川越町店/マイカリー食堂　三重川越町店,三重県三重郡川越町豊田491-7,1200
松屋　三宿店,東京都世田谷区池尻3-30-10,1300
松屋　三条木屋町店,京都府京都市中京区三条通河原町東入中島町97,1160
松屋　三鷹店,東京都武蔵野市中町1-14-5,1300
松屋　三鷹南口店,東京都三鷹市下連雀3-34-22 ,1300
松屋　三島店,静岡県三島市玉川243-1,1170
