大泉学園南口店,松屋　大泉学園南口店,東京都練馬区東大泉5-41-14エクラン大泉1F
大船駅前店,松屋　大船駅前店,神奈川県鎌倉市大船1-12-23
大船店,松屋　大船店,神奈川県鎌倉市大船1-25-23
大曽根北店,松屋　Ｒ大曽根北店,愛知県名古屋市北区山田町4-72
大倉山店,松屋　大倉山店,神奈川県横浜市港北区大倉山3-1-28
大鳥居店,松屋　大鳥居店,東京都大田区萩中3-6-5
大津通錦店,松屋　大津通錦店,愛知県名古屋市中区錦3-7-10
大津店,松屋　Ｒ大津店,滋賀県大津市別保3-2-55
大塚店,松屋　大塚店,東京都豊島区北大塚2-11-1
大島店,松屋　大島店,東京都江東区大島6-9-16佐々木ビル
大東御供田店,松屋　Ｒ大東御供田店,大阪府大東市御供田3-7-41
大牟田店,松屋　Ｒ大牟田店,福岡県大牟田市船津町459-2
大名1丁目店,松屋　大名1丁目店,福岡県福岡市中央区大名1-1-10大名ＴＣビル
大野城店,松屋　Ｒ大野城店,福岡県大野城市大字瓦田5-11-25
大和高田店,松屋　Ｒ大和高田店,奈良県大和高田市曽大根122-7
大和渋谷店,松屋　Ｒ大和渋谷店,神奈川県大和市渋谷5丁目4-1
大和店,松屋　大和店,神奈川県大和市大和南1-3-4登喜和ビル1F
大和田店,松屋　大和田店,大阪府門真市野里町1-23
鷹の台店,松屋　鷹の台店,東京都小平市たかの台44-8長谷川ビル
谷町九丁目店,松屋　谷町九丁目店,大阪府大阪市天王寺区生玉前町1-21
池上３丁目店,松屋　池上３丁目店,東京都大田区池上3丁目3-1
池上店,松屋　池上店,東京都大田区池上6-2-17
池尻大橋店,松屋　池尻大橋店,東京都目黒区東山3-1-15ＳＤ池尻大橋ビル
池袋アゼリア通り店,松屋　池袋アゼリア通り店,東京都豊島区西池袋5-2-10太公望ＫＭビル
池袋サンシャイン通り店,松屋　池袋サンシャイン通り店,東京都豊島区東池袋1-29-4成田ビル1.2F
池袋トキワ通店,松屋　池袋トキワ通店,東京都豊島区西池袋1丁目40番4号川松ビル
池袋西口店,松屋　池袋西口店,東京都豊島区西池袋1-20-6広瀬ビル1.2F
池袋東口駅前店,松屋　池袋東口駅前店,東京都豊島区南池袋1-27-9
池袋東通り店,松屋　池袋東通り店,東京都豊島区南池袋2-13-10東海キャッスル小林1Ｆ
中の島店,松屋　Ｒ中の島店,北海道札幌市豊平区中の島二条6丁目1-6
中井店,松屋　中井店,東京都新宿区上落合2-20-3
中延店,松屋　中延店,東京都品川区中延4-5-3智勇第一ビル1F
中山店,松屋　中山店,神奈川県横浜市緑区寺山町87-7
中洲店,松屋　中洲店,福岡県福岡市博多区中洲5-1-7SPOONビル1階
中村橋店,松屋　中村橋店,東京都練馬区貫井2-2-5ムツワビル1.2F
中島新町店,松屋　Ｒ中島新町店,愛知県名古屋市中川区中島新町4-105
中板橋店,松屋　中板橋店,東京都板橋区中板橋21-2中板堂ビル
中目黒店,松屋　中目黒店,東京都目黒区上目黒3-3-1中津川ビル1・２F
中野坂上店,松屋　中野坂上店,東京都中野区中央2-1-2中野坂上吉田ビル1F
中野新橋店,松屋　中野新橋店,東京都中野区弥生町2-23-3松屋ビル1F
中野通り店,松屋　中野通り店,東京都中野区中野5-68-9松鶴堂ビル
中野南口店,松屋　中野南口店,東京都中野区中野2-29-8NTビル1F
中野富士見町店,松屋　中野富士見町店,東京都中野区弥生町5-27-7プレミール富士見1F
仲御徒町店,松屋　仲御徒町店,東京都台東区台東3-41-4仲御徒町ビル1.2F
朝霞台店,松屋　朝霞台店,埼玉県朝霞市浜崎1-3-10AX－1ビル1F
朝霞店,松屋　朝霞店,埼玉県朝霞市本町2-4-18バモスビル1F
朝霞東口店,松屋　朝霞東口店,埼玉県朝霞市仲町2-2-43大日屋ビル
朝霞膝折店,松屋　Ｒ朝霞膝折店,埼玉県朝霞市膝折町2丁目10-14
町屋店,松屋　町屋店,東京都荒川区町屋1-2-101、2F
町田中町店,松屋　Ｒ町田中町店,東京都町田市中町2-16-6
町田店,松屋　町田店,東京都町田市原町田4-4-15
町田東口店,松屋　町田東口店,東京都町田市原町田6-15-16コマヤビル
調布駅前店,松屋　調布駅前店,東京都調布市布田1-40-10アルソス調布駅前北口ビル
長岡堺東町店,松屋　Ｒ長岡堺東町店,新潟県長岡市堺東町7
長久手店,松屋　Ｒ長久手店,愛知県愛知郡長久手町武蔵塚702
長居店,松屋　Ｒ長居店,大阪府大阪市住吉区長居3-14-8
長後店,松屋　長後店,神奈川県藤沢市下土棚509-10
長瀬店,松屋　長瀬店,大阪府東大阪市菱屋西1-17-14
長野若里店,松屋　Ｒ長野若里店,長野県長野市大字稲葉上千田沖312-2
長野鶴賀七瀬店,松屋　Ｒ長野鶴賀七瀬店,長野県長野市鶴賀(大字)七瀬578-1
長野柳原店,松屋　Ｒ長野柳原店,長野県長野市大字小島86-1
長良町店,松屋　Ｒ長良町店,愛知県名古屋市中川区長良町3-32
鳥飼店,松屋　Ｒ鳥飼店,大阪府摂津市鳥飼本町3-16-59
津田沼店,松屋　津田沼店,千葉県習志野市津田沼1-10-41十番街ビル1F
津田沼南口店,松屋　津田沼南口店,千葉県習志野市谷津7-9-16京葉ビル２
津南店,松屋　Ｒ津南店,三重県津市高茶屋小森町字丸田283-2
椎名町店,松屋　椎名町店,東京都豊島区長崎1-2-4バイオレットインＡ室
追浜店,松屋　追浜店,神奈川県横須賀市追浜町3-13-13
通天閣店,松屋　通天閣店,大阪府大阪市浪速区恵美須西2-1-32
鶴ヶ島店,松屋　鶴ヶ島店,埼玉県川越市鯨井新田1-18細田ビル
鶴ヶ峰店,松屋　鶴ヶ峰店,神奈川県横浜市旭区鶴ｹ峰1-12-3
鶴間店,松屋　鶴間店,神奈川県大和市西鶴間1-2-9
鶴橋店,松屋　鶴橋店,大阪府大阪市天王寺区下味原町3-13鶴橋下味原ビル1F
鶴見店,松屋　鶴見店,神奈川県横浜市鶴見区豊岡町2-2フーガ2
鶴見東口店,松屋　鶴見東口店,神奈川県横浜市鶴見区鶴見中央1-3-3
鶴瀬店,松屋　鶴瀬店,埼玉県富士見市鶴馬2605-1
鶴川店,松屋　鶴川店,東京都町田市能ｹ谷町5002-9applestudio1F
帝京大学前店,松屋　Ｒ帝京大学前店,東京都八王子市大塚131-8
天王町店,松屋　天王町店,神奈川県横浜市保土ケ谷区天王町2-47-7日振ビル1Ｆ
天神橋六丁目店,松屋　天神橋六丁目店,大阪府大阪市北区本庄東1-6-22
天神店,松屋　天神店,福岡県福岡市中央区天神3-3-1木下ビル
天満橋店,松屋　天満橋店,大阪府大阪市中央区谷町2-8-1大手前M2ビル
天理PA店,松屋　Ｒ天理PA店,奈良県大和郡山市櫟枝町字三ﾉ坪195-1
田無駅前店,松屋　田無駅前店,東京都西東京市田無町4-2-12A2ビル1階
田無南口店,松屋　田無南口店,東京都西東京市南町5丁目5-3
都筑インター店,松屋　Ｒ都筑インター店,神奈川県横浜市都筑区早淵3-37-14
都立家政店,松屋　都立家政店,東京都中野区鷺宮3-6-1岡田ビル
都立大学店,松屋　都立大学店,東京都目黒区平町1-27-5
土浦真鍋店,松屋　Ｒ土浦真鍋店,茨城県土浦市真鍋1-12-9
東久留米下里店,松屋　Ｒ東久留米下里店,東京都東久留米市下里3-24-12
東久留米店,松屋　東久留米店,東京都東久留米市東本町1-8たちばなやビル
東久留米南町店,松屋　東久留米南町店,東京都東久留米市南町4-1-8
東戸塚西口店,松屋　東戸塚西口店,神奈川県横浜市戸塚区川上町アップル東戸塚ビル
東戸塚店,松屋　東戸塚店,神奈川県横浜市戸塚区品濃町538-9恩田ビル1､2F
東五反田店,松屋　東五反田店,東京都品川区東五反田2-4-1東五反田レンガビル1F
東御店,松屋　Ｒ東御店,長野県東御市加沢1406-51
東広島西条店,松屋　Ｒ東広島西条店,広島県東広島市西条町寺家4828-1
東高円寺店,松屋　東高円寺店,東京都杉並区高円寺南1-6-5サマリヤマンション1F
東寺店,松屋　Ｒ東寺店,京都府京都市南区西九条開ヶ町101-2
東住吉中野店,松屋　Ｒ東住吉中野店,大阪府大阪市東住吉区中野4-3-22
東住吉湯里店,松屋　Ｒ東住吉湯里店,大阪府大阪市東住吉区湯里5-20-6
東十条店,松屋　東十条店,東京都北区東十条4-4-24宮田ビル1F
東小金井店,松屋　東小金井店,東京都小金井市東町4-42-19
東松山上野本店,松屋　Ｒ東松山上野本店,埼玉県東松山市上野本1174-2
東松山店,松屋　東松山店,埼玉県東松山市箭弓町1-12-8大谷ビル
東新宿店,松屋　東新宿店,東京都新宿区歌舞伎町2-2-21ライオンズマンション歌舞伎町B102号室
東神奈川店,松屋　東神奈川店,神奈川県横浜市神奈川区西神奈川1-20-4加賀ビル
東千葉店,松屋　Ｒ東千葉店,千葉県千葉市中央区祐光2-15-5
東船橋店,松屋　Ｒ東船橋店,千葉県船橋市東船橋5-15-11
東村山店,松屋　東村山店,東京都東村山市本町2-3-77吉崎ビル1F
東大井町店,松屋　東大井町店,東京都品川区東大井5-21-5
東大宮駅前店,松屋　東大宮駅前店,埼玉県さいたま市見沼区東大宮5-38-5あずまビル1F
東大宮店,松屋　Ｒ東大宮店,埼玉県さいたま市見沼区東大宮5-10-5
東大阪川田店,松屋　Ｒ東大阪川田店,大阪府東大阪市川田1-15-8
東大和市駅前店,松屋　東大和市駅前店,東京都東大和市南街5-93-13ビル・エール1階
東大和清水店,松屋　Ｒ東大和清水店,東京都東大和市清水5-1095-7
東池袋グリーン大通店,松屋　東池袋グリーン大通店,東京都豊島区東池袋1丁目25-17
東池袋店,松屋　東池袋店,東京都豊島区東池袋1-40-2近代ＢＬＤ.8号館1階
東中野店,松屋　東中野店,東京都中野区東中野3-1-19
東長崎店,松屋　東長崎店,東京都豊島区南長崎5-16-8平和ビル１F
東比恵店,松屋　Ｒ東比恵店,福岡県福岡市博多区東比恵1-4-5
東武霞ヶ関店,松屋　東武霞ヶ関店,埼玉県川越市霞ヶ関東1-2-22
東武練馬店,松屋　東武練馬店,東京都板橋区徳丸3-1-26大川ビル1F
東伏見店,松屋　東伏見店,東京都西東京市東伏見2-4-6高橋イーストビル
東陽町店,松屋　東陽町店,東京都江東区東陽4-2-5
東淀川菅原店,松屋　Ｒ東淀川菅原店,大阪府大阪市東淀川区菅原2-7-9
藤沢石川店,松屋　Ｒ藤沢石川店,神奈川県藤沢市石川2-1-1セレーノ湘南1F
藤沢南口店,松屋　藤沢南口店,神奈川県藤沢市南藤沢2-10ワカバビル1F
藤沢北口店,松屋　藤沢北口店,神奈川県藤沢市藤沢462番地吉塚ビル1Ｆ
徳島常三島店,松屋　Ｒ徳島常三島店,徳島県徳島市北常三島町2-52-1
奈良駅前店,松屋　Ｒ奈良駅前店,奈良県奈良市三条本町3番8号
奈良三条大路店,松屋　Ｒ奈良三条大路店,奈良県奈良市三条大路3-2-21
南茨木店,松屋　南茨木店,大阪府茨木市沢良宜西1-2-20
南浦和店,松屋　南浦和店,埼玉県さいたま市南区南浦和2-36-16田中ビル
南越谷店,松屋　南越谷店,埼玉県越谷市南越谷1-19-8吉澤第一ビル1F
南海難波店,松屋　南海難波店,大阪府大阪市中央区難波4-4-6 1F､2F
南郷通店,松屋　Ｒ南郷通店,北海道札幌市白石区南郷通9丁目南5-10
南行徳店,松屋　南行徳店,千葉県市川市相之川4-17-2メトロセンター南行徳
南砂町店,松屋　南砂町店,東京都江東区南砂7-4-6
南森町駅前店,松屋　南森町駅前店,大阪府大阪市北区天神橋2丁目北1-3
南青山店,松屋　南青山店,東京都港区南青山2-22-1
南千住店,松屋　南千住店,東京都荒川区南千住7-1-1アクレスティ南千住Ｍ2-201
南大沢店,松屋　南大沢店,東京都八王子市南大沢2丁目29番地
南巽店,松屋　南巽店,大阪府大阪市生野区巽中4-18-13
南池袋店,松屋　南池袋店,東京都豊島区南池袋1-18-23ルックハイツ池袋B棟
南津守店,松屋　Ｒ南津守店,大阪府大阪市西成区南津守6-6-46
南柏店,松屋　南柏店,千葉県柏市南柏1-2-4エコロジースクエア南柏
南方店,松屋　南方店,大阪府大阪市淀川区西中島3-17-2
南林間店,松屋　南林間店,神奈川県大和市南林間1-8-1
難波千日前店,松屋　難波千日前店,大阪府大阪市中央区難波千日前14-14
二俣川店,松屋　二俣川店,神奈川県横浜市旭区二俣川1-45-18東新ビル
二又瀬店,松屋　Ｒ二又瀬店,福岡県福岡市東区二又瀬15-10
尼崎アマドゥ店,松屋　Ｒ尼崎アマドゥ店,兵庫県尼崎市道意町7-1
尼崎潮江店,松屋　尼崎潮江店,兵庫県尼崎市潮江1-27-15
尼崎店,松屋　尼崎店,兵庫県尼崎市神田中通2-17
廿日市店,松屋　廿日市店,広島県廿日市市串戸1-4856-1
日吉店,松屋　日吉店,神奈川県横浜市港北区日吉本町1-20-2ティーエムビル1F
日暮里店,松屋　日暮里店,東京都荒川区西日暮里2-25-1-307
日本橋店,松屋　日本橋店,大阪府大阪市中央区日本橋1-3-2日本橋コウジィアパートメント
日野三沢店,松屋　Ｒ日野三沢店,東京都日野市三沢1-19-2
日野神明店,松屋　Ｒ日野神明店,東京都日野市神明2-1-1
日野店,松屋　日野店,東京都日野市大坂上1-30-24
日立桜川町店,松屋　Ｒ日立桜川町店,茨城県日立市桜川町2-4-12
入間店,松屋　Ｒ入間店,埼玉県入間市宮寺3186-9
入間東藤沢店,松屋　Ｒ入間東藤沢店,埼玉県入間市東藤沢4-2-17
入谷店,松屋　入谷店,東京都台東区北上野2-31-6スプリーム･北上野1Ｆ
韮崎店,松屋　Ｒ韮崎店,山梨県韮崎市若宮2丁目12-20ライフガーデンにらさき
納屋橋店,松屋　納屋橋店,愛知県名古屋市中村区名駅南1-3-14石原ビル1F
播磨町店,松屋　Ｒ播磨町店,兵庫県加古郡播磨町南大中3-3-28
馬橋店,松屋　馬橋店,千葉県松戸市馬橋117-1田口ビル
馬喰町店,松屋　馬喰町店,東京都中央区日本橋馬喰町1-5-11ラスパイユビル1F
梅ヶ丘店,松屋　梅ヶ丘店,東京都世田谷区梅丘1-33-9
梅屋敷店,松屋　梅屋敷店,東京都大田区蒲田2-4-5スカイドムス
梅田角田町店,松屋　梅田角田町店,大阪府大阪市北区角田町6-5
梅田神山町店,松屋　梅田神山町店,大阪府大阪市北区神山町8-22梅電ビル
梅田店,松屋　梅田店,大阪府大阪市北区小松原町1-27エビスビル
買物公園通り店,松屋　買物公園通り店,北海道旭川市二条通8丁目左1号
博多駅前店,松屋　博多駅前店,福岡県福岡市博多区博多駅前3-30-29タイセイ第2ビル
柏崎店,松屋　Ｒ柏崎店,新潟県柏崎市東柳田23-3
柏中央町店,松屋　柏中央町店,千葉県柏市中央町2番8号柏大黒ビル
柏東口店,松屋　柏東口店,千葉県柏市柏1-5-14岩田ビル1.2F
白河店,松屋　Ｒ白河店,福島県西白河郡西郷村字豊作東1
白楽店,松屋　白楽店,神奈川県横浜市神奈川区白楽118
白山店,松屋　白山店,東京都文京区向丘1-9-23リーラ白山103
幡ヶ谷店,松屋　幡ヶ谷店,東京都渋谷区幡ヶ谷2-7-1
八王子店,松屋　八王子店,東京都八王子市旭町7-1豊栄ビル
八街店,松屋　Ｒ八街店,千葉県八街市八街ほ15街区1
八重洲店,松屋　八重洲店,東京都中央区八重洲1-6-5八重洲中央ビル1F
八千代台西口店,松屋　八千代台西口店,千葉県八千代市八千代台北1-11
八千代台東口店,松屋　八千代台東口店,千葉県八千代市八千代台東1-2-16
八幡黒崎店,松屋　Ｒ八幡黒崎店,福岡県北九州市八幡西区藤田1-2-13
八幡山店,松屋　八幡山店,東京都杉並区上高井戸1-8-22D.S八幡山1F
八尾店,松屋　Ｒ八尾店,大阪府八尾市志紀町南3-190
八尾本町店,松屋　Ｒ八尾本町店,大阪府八尾市本町2-8-19
半田店,松屋　Ｒ半田店,愛知県半田市宮本町6-216-7
反町店,松屋　反町店,神奈川県横浜市神奈川区松本町1-1-9ＭＫビル
板橋区役所前店,松屋　板橋区役所前店,東京都板橋区板橋2-61-11ホシカメビル1Ｆ
板橋桜川店,松屋　板橋桜川店,東京都板橋区桜川3-22-9ノイエルハイム桜川1Ｆ
板橋店,松屋　板橋店,東京都板橋区板橋1-50-1柏家ビル
板橋本町店,松屋　板橋本町店,東京都板橋区本町36-1バロール本町1F
板宿店,松屋　板宿店,兵庫県神戸市須磨区平田町2-2-2板宿稲岡ビル
飯田橋駅前店,松屋　飯田橋駅前店,東京都千代田区飯田橋4丁目9-10飯田橋第一ビル
飯能双柳店,松屋　Ｒ飯能双柳店,埼玉県飯能市双柳757-4
肥後橋店,松屋　肥後橋店,大阪府大阪市西区江戸堀江戸堀1-2-14肥後橋官報ビル
尾山台店,松屋　尾山台店,東京都世田谷区尾山台3-22-5岸谷ビル
尾張旭店,松屋　Ｒ尾張旭店,愛知県尾張旭市南原山町赤土324
彦根店,松屋　Ｒ彦根店,滋賀県彦根市東沼波町125-1
姫路リオス店,松屋　Ｒ姫路リオス店,兵庫県姫路市東郷町1454-3
姫路飾磨店,松屋　Ｒ姫路飾磨店,兵庫県姫路市飾磨区今在家1066
姫路店,松屋　姫路店,兵庫県姫路市駅前町352 1、2F
姫路南店,松屋　Ｒ姫路南店,兵庫県姫路市安田3-119
百万遍店,松屋　百万遍店,京都府京都市左京区吉田泉殿町1-87番地
氷川台店,松屋　氷川台店,東京都練馬区氷川台3-39-9
瓢箪山駅前店,松屋　瓢箪山駅前店,大阪府東大阪市本町15-15
浜寺店,松屋　Ｒ浜寺店,大阪府堺市西区浜寺船尾町西5-132-1
浜松高竜店,松屋　Ｒ浜松高竜店,静岡県浜松市中区寺島町字十王西244
浜田山店,松屋　浜田山店,東京都杉並区浜田山4-14-6
不動前店,松屋　不動前店,東京都品川区西五反田4-30-12福井ビル
富山下赤江店,松屋　Ｒ富山下赤江店,富山県富山市下赤江町1-1-69
富山掛尾店,松屋　Ｒ富山掛尾店,富山県富山市掛尾町259
富山田中町店,松屋　Ｒ富山田中町店,富山県富山市田中町4-18-43
富山婦中店,松屋　Ｒ富山婦中店,富山県富山市婦中町下轡田428-4
富士ラウンドワン店,松屋　Ｒ富士ラウンドワン店,静岡県富士市八代町4-23
富士吉田店,松屋　Ｒ富士吉田店,山梨県富士吉田市上吉田4203-3
富士宮店,松屋　Ｒ富士宮店,静岡県富士宮市中原町312
富士見台店,松屋　富士見台店,東京都練馬区貫井3-1-8
富田店,松屋　富田店,大阪府高槻市富田町1-6-3
布施店,松屋　布施店,大阪府東大阪市足代新町2-18
布施南店,松屋　Ｒ布施南店,大阪府東大阪市寿町3-10-19
布田店,松屋　布田店,東京都調布市布田2丁目47-2
浮間舟渡店,松屋　浮間舟渡店,東京都板橋区舟渡1-12
武庫川店,松屋　Ｒ武庫川店,兵庫県尼崎市稲葉荘1-14-5
武蔵浦和店,松屋　武蔵浦和店,埼玉県さいたま市南区沼影1-10-1ラムザタワー1Ｆ
武蔵関店,松屋　武蔵関店,東京都練馬区関町北2-27-13下田ビル１F
武蔵境店,松屋　武蔵境店,東京都武蔵野市境1-2-3
武蔵境南口店,松屋　武蔵境南口店,東京都武蔵野市境南町2-9-1ビジネスセンター山口ビル
武蔵小金井店,松屋　武蔵小金井店,東京都小金井市本町1-18-8桜並SHビル
武蔵小金井北口店,松屋　武蔵小金井北口店,東京都小金井市本町5-18-5太平ビル1Ｆ
武蔵小山店,松屋　武蔵小山店,東京都品川区小山3-25-15京屋商会貸店舗1F･2F
武蔵新城店,松屋　武蔵新城店,神奈川県川崎市中原区上新城2-10-15新城ロイヤルプラザ1F
武蔵新田店,松屋　武蔵新田店,東京都大田区矢口1-7-15イセモトビル
武蔵村山店,松屋　Ｒ武蔵村山店,東京都武蔵村山市学園3-37-2
福井御幸店,松屋　Ｒ福井御幸店,福井県福井市御幸4-20-8
福井大和田店,松屋　Ｒ福井大和田店,福井県福井市大和田町29字39
福山花園店,松屋　Ｒ福山花園店,広島県福山市花園町2-5-34
福山東店,松屋　Ｒ福山東店,広島県福山市東深津町3-23-8
福生志茂店,松屋　福生志茂店,東京都福生市志茂36-4
福生店,松屋　福生店,東京都福生市東町3-10栄和ビル1Ｆ
淵野辺店,松屋　Ｒ淵野辺店,神奈川県相模原市中央区鹿沼台2-18-6
淵野辺北口店,松屋　淵野辺北口店,神奈川県相模原市中央区淵野辺3-19-9
分倍河原店,松屋　分倍河原店,東京都府中市片町2-22-1山ニビル
平井店,松屋　平井店,東京都江戸川区平井4-11-3サンライズ･エンドウ２
平間店,松屋　平間店,神奈川県川崎市中原区北谷町8
平針駅前店,松屋　Ｒ平針駅前店,愛知県名古屋市天白区平針3-7-11
平塚店,松屋　平塚店,神奈川県平塚市紅谷町4-21F
平塚北金目店,松屋　Ｒ平塚北金目店,神奈川県平塚市北金目2-4-33
平和台店,松屋　平和台店,東京都練馬区早宮2-17-39ミリオンアネックス平和台
平和島店,松屋　平和島店,東京都大田区大森北6-13-10島田ビル
保谷店,松屋　保谷店,東京都西東京市東町3-14-26マイティビル1F
保土ヶ谷店,松屋　保土ヶ谷店,神奈川県横浜市保土ケ谷区岩井町4
宝塚旭町店,松屋　Ｒ宝塚旭町店,兵庫県宝塚市旭町3-20-5
宝塚安倉店,松屋　Ｒ宝塚安倉店,兵庫県宝塚市安倉南2丁目2-21
放出店,松屋　放出店,大阪府大阪市鶴見区今津南1-7-29
方南町店,松屋　方南町店,東京都杉並区方南2-18-10
豊橋つつじが丘店,松屋　Ｒ豊橋つつじが丘店,愛知県豊橋市つつじが丘1-6-10
豊橋藤沢町店,松屋　Ｒ豊橋藤沢町店,愛知県豊橋市藤沢町138番
豊山店,松屋　Ｒ豊山店,愛知県西春日井郡豊山町大字豊場字栄81
豊洲ＩＨＩビル店,松屋　豊洲ＩＨＩビル店,東京都江東区豊洲3-1-1豊洲IHIビル107区
豊中上津島店,松屋　Ｒ豊中上津島店,大阪府豊中市上津島3-11-25
豊田山之手店,松屋　Ｒ豊田山之手店,愛知県豊田市山之手6-70
豊田十塚店,松屋　Ｒ豊田十塚店,愛知県豊田市十塚町4-23-1
豊田店,松屋　豊田店,東京都日野市多摩平1-2-18第1ビル1F
豊田東新町店,松屋　Ｒ豊田東新町店,愛知県豊田市東新町5-20-1
豊島園店,松屋　豊島園店,東京都練馬区練馬4-15-23パークサイドハイツ
豊明店,松屋　Ｒ豊明店,愛知県豊明市西川町島原8-7
北２４条店,松屋　北２４条店,北海道札幌市北区北23条西4-2-41
北４４条店,松屋　Ｒ北４４条店,北海道札幌市東区北44条東1-1-30
北綾瀬店,松屋　Ｒ北綾瀬店,東京都足立区加平1-22-11
北浦和店,松屋　北浦和店,埼玉県さいたま市浦和区北浦和4-3-8USビル1F
北浦和東口店,松屋　北浦和東口店,埼玉県さいたま市浦和区北浦和3-2-8
北越谷店,松屋　北越谷店,埼玉県越谷市大沢3-4-26Ｆｉｎｅ北越谷
北習志野店,松屋　北習志野店,千葉県船橋市習志野台2-6-1小林ビル
北小金店,松屋　Ｒ北小金店,千葉県松戸市小金きよしヶ丘3-20-5
北松戸店,松屋　北松戸店,千葉県松戸市上本郷904-6堀ビル1F
北赤羽店,松屋　北赤羽店,東京都北区浮間3-1-38近藤ビル
北千住店,松屋　北千住店,東京都足立区千住2-61
北方町店,松屋　Ｒ北方町店,岐阜県本巣郡北方町高屋伊勢田2-74-1
北本店,松屋　Ｒ北本店,埼玉県北本市深井6-151
北野店,松屋　北野店,東京都八王子市北野町546-2横溝ビル
堀切菖蒲園店,松屋　堀切菖蒲園店,東京都葛飾区堀切4-10-2
堀川丸太町店,松屋　堀川丸太町店,京都府京都市中京区丸太町堀川東入丸太町15タスキービル
堀田店,松屋　Ｒ堀田店,愛知県名古屋市瑞穂区明前町11-6
本郷三丁目店,松屋　本郷三丁目店,東京都文京区本郷2-27-16大学三丁目ビル1F
本厚木店,松屋　本厚木店,神奈川県厚木市中町2-4-16トキワヤビル1F
本所吾妻橋店,松屋　本所吾妻橋店,東京都墨田区吾妻橋3-7-4ライオンズマンション吾妻橋
本川越店,松屋　本川越店,埼玉県川越市新富町2-33-1
本内店,松屋　Ｒ本内店,福島県福島市本内字松川畑2-2
本八幡店,松屋　本八幡店,千葉県市川市八幡2-5-6
本八幡南口店,松屋　本八幡南口店,千葉県市川市南八幡4-6-7
本蓮沼店,松屋　本蓮沼店,東京都板橋区泉町6番11号
麻溝台店,松屋　麻溝台店,神奈川県相模原市南区麻溝台1-5-6
麻生店,松屋　麻生店,北海道札幌市北区北40条西4-2-5
麻布台１丁目店,松屋　麻布台１丁目店,東京都港区麻布台1丁目9-10飯倉ＩＴビル
枚方店,松屋　枚方店,大阪府枚方市岡東町5-24
幕張本郷１丁目店,松屋　幕張本郷１丁目店,千葉県千葉市花見川区幕張本郷1-3-1
末広街道店,松屋　Ｒ末広街道店,千葉県千葉市中央区末広2-3-4
箕面店,松屋　Ｒ箕面店,大阪府箕面市半町3-14-20
