箕輪町店,松屋　Ｒ箕輪町店,長野県上伊那郡箕輪町三日町947-1
妙典店,松屋　妙典店,千葉県市川市妙典4-2-12マーヴ妙典
名駅西店,松屋　名駅西店,愛知県名古屋市中村区亀島2-12-1
名古屋競馬場前店,松屋　Ｒ名古屋競馬場前店,愛知県名古屋市港区川西通4-12
明大前店,松屋　明大前店,東京都世田谷区松原1-36-7明大前ビル2F
姪浜店,松屋　Ｒ姪浜店,福岡県福岡市西区内浜1-7-5ウエストコート姪浜内
茂原店,松屋　Ｒ茂原店,千葉県茂原市道表2-12
木更津店,松屋　Ｒ木更津店,千葉県木更津市太田4丁目15-5
目黒東口店,松屋　目黒東口店,東京都品川区上大崎2-15-18目黒東豊ビル
目白店,松屋　目白店,東京都豊島区目白3-5-13目白フジヤマビル1F
門真店,松屋　Ｒ門真店,大阪府門真市下島町30-13
門前仲町店,松屋　門前仲町店,東京都江東区門前仲町1-7-13
野火止店,松屋　Ｒ野火止店,埼玉県新座市野火止4-7-29
野並店,松屋　Ｒ野並店,愛知県名古屋市緑区鳴海町字杜若7-1
野方店,松屋　野方店,東京都中野区野方5-30-11 2F
矢向店,松屋　矢向店,神奈川県横浜市鶴見区鶴見区矢向6-5-8
祐天寺店,松屋　祐天寺店,東京都目黒区祐天寺2-2-7青埜ビル1F
与野駅前店,松屋　与野駅前店,埼玉県さいたま市浦和区上木崎1-4-2
与野店,松屋　Ｒ与野店,埼玉県さいたま市中央区上峰4-14-12
用賀店,松屋　用賀店,東京都世田谷区用賀2-38-14
踊場店,松屋　Ｒ踊場店,神奈川県横浜市泉区中田南1-2-12
淀屋橋店,松屋　淀屋橋店,大阪府大阪市中央区北浜3-2-25京阪淀屋橋ビル
落合店,松屋　落合店,東京都新宿区上落合3-9-1北村ビル
里塚店,松屋　Ｒ里塚店,北海道札幌市清田区里塚一条4-316-4
立会川店,松屋　立会川店,東京都品川区東大井2丁目24-11織戸ビル
立川錦町店,松屋　立川錦町店,東京都立川市錦町2-1-3立川電業ビル
立川柴崎町店,松屋　Ｒ立川柴崎町店,東京都立川市柴崎町6-10-8
立川曙橋店,松屋　立川曙橋店,東京都立川市曙町2-10-10緑川ビル1.2Ｆ
立川店,松屋　立川店,東京都立川市曙町2-12-15立川金水ビル1F
立川北口店,松屋　立川北口店,東京都立川市曙町2丁目3番地3
立命館大前店,松屋　Ｒ立命館大前店,京都府京都市北区平野宮西町117-3
両国店,松屋　両国店,東京都墨田区横網1-3-8
鈴鹿中央通店,松屋　Ｒ鈴鹿中央通店,三重県鈴鹿市算所2-2-7
鈴鹿店,松屋　Ｒ鈴鹿店,三重県鈴鹿市南玉垣町3006-1
練馬店,松屋　練馬店,東京都練馬区豊玉北5-18-11
蓮根店,松屋　蓮根店,東京都板橋区蓮根2丁目31-3萩原ビル
蓮田関山店,松屋　Ｒ蓮田関山店,埼玉県蓮田市関山2-7-7
蓮田店,松屋　蓮田店,埼玉県蓮田市東5-2-9NKB2ビル1F
六甲道店,松屋　六甲道店,兵庫県神戸市灘区備後町3丁目2-16タウンコート六甲
六地蔵店,松屋　Ｒ六地蔵店,京都府京都市伏見区桃山町西尾10番1
六本木４丁目店,松屋　六本木４丁目店,東京都港区六本木4-11-11
和歌山向店,松屋　Ｒ和歌山向店,和歌山県和歌山市向220-3
和光市駅前店,松屋　和光市駅前店,埼玉県和光市本町3-2ステイパルビル
和光白子店,松屋　Ｒ和光白子店,埼玉県和光市白子1-7-12
和泉店,松屋　Ｒ和泉店,大阪府和泉市富秋町3-2-36
蕨店,松屋　蕨店,埼玉県蕨市塚越1-4-4ラ.セーヌ1F
蕨北町店,松屋　Ｒ蕨北町店,埼玉県蕨市北町5-4-5
糀谷店,松屋　糀谷店,東京都大田区西糀谷4-14-12
茗荷谷店,松屋　茗荷谷店,東京都文京区小日向4-6-23パレスビル
