篠崎店,松屋　篠崎店,東京都江戸川区篠崎町7丁目21-13プロシード篠崎２
芝大門店,松屋　芝大門店,東京都港区芝大門2-1-1第2境野ビル
取手店,松屋　取手店,茨城県取手市取手3-1-2取手プラザ1Ｆ
守口市駅前店,松屋　守口市駅前店,大阪府守口市桜町9-8
手稲前田店,松屋　Ｒ手稲前田店,北海道札幌市手稲区前田5条13-3-35
酒々井ＰＡ店,松屋　Ｒ酒々井ＰＡ店,千葉県印旛郡酒々井町大字墨字花之作1419-1
周南店,松屋　Ｒ周南店,山口県周南市新宿通5-6-23
秋津店,松屋　秋津店,東京都東村山市秋津町5-7-8
秋葉原中央通り店,松屋　秋葉原中央通り店,東京都千代田区外神田1-10-9TY2ビル1～3F
秋葉原店,松屋　秋葉原店,東京都千代田区神田松永町1番地秋葉原ファーストビル1F
住道店,松屋　住道店,大阪府大東市浜町9-10住道駅前ビル
住之江公園店,松屋　住之江公園店,大阪府大阪市住之江区新北島1-1-7ビックドックプラザ1F
十三店,松屋　十三店,大阪府大阪市淀川区十三本町1-5-8十三センタービル１Ｆ
十三東口店,松屋　十三東口店,大阪府大阪市淀川区十三東2-8-15
渋谷センター街店,松屋　渋谷センター街店,東京都渋谷区宇田川町26-9メトロビル1F
渋谷宮益坂上店,松屋　渋谷宮益坂上店,東京都渋谷区渋谷1-8-3ＴＯＣ第1ビル
渋谷宮益坂店,松屋　渋谷宮益坂店,東京都渋谷区渋谷2-19-15
渋谷桜丘店,松屋　渋谷桜丘店,東京都渋谷区桜丘町2-1
渋谷清水橋店,松屋　渋谷清水橋店,東京都渋谷区本町3-39-3
渋谷道玄坂上店,松屋　渋谷道玄坂上店,東京都渋谷区道玄坂1-18-8渋谷道玄坂プラザ仁科屋ビル
渋谷並木橋店,松屋　渋谷並木橋店,東京都渋谷区渋谷3-15-4モノステップ
春日井店,松屋　Ｒ春日井店,愛知県春日井市鳥居松町4-14
春日井南下原町店,松屋　Ｒ春日井南下原町店,愛知県春日井市南下原町二又木8-1
春日店,松屋　春日店,東京都文京区小石川2丁目23-14小石川ハイム
春日部店,松屋　春日部店,埼玉県春日部市中央1-2-6M6ビル1F
春日部豊町店,松屋　Ｒ春日部豊町店,埼玉県春日部市豊町1-27-2
春木店,松屋　Ｒ春木店,大阪府岸和田市春木若松町18-31
初石店,松屋　初石店,千葉県流山市西初石3-100-19森田ビル1Ｆ
初台店,松屋　初台店,東京都渋谷区初台1-53-9
所沢若狭店,松屋　Ｒ所沢若狭店,埼玉県所沢市若狭4-2453-1
所沢上安松店,松屋　Ｒ所沢上安松店,埼玉県所沢市大字上安松822-44
所沢店,松屋　所沢店,埼玉県所沢市日吉町10-18
所沢北原店,松屋　Ｒ所沢北原店,埼玉県所沢市北原町1403-9
曙橋店,松屋　曙橋店,東京都新宿区住吉町1-17ジェントリー市ヶ谷1F
勝どき店,松屋　勝どき店,東京都中央区勝どき2-14-1
小岩店,松屋　小岩店,東京都江戸川区西小岩1丁目21-20第23東ビル
小岩南口店,松屋　小岩南口店,東京都江戸川区南小岩6-31-14都築ビル
小金井関野町店,松屋　Ｒ小金井関野町店,東京都小金井市関野町1丁目3-5
小雑賀店,松屋　Ｒ小雑賀店,和歌山県和歌山市小雑賀573-9
小山店,松屋　Ｒ小山店,栃木県小山市駅南町6-28-22
小松川店,松屋　Ｒ小松川店,東京都江戸川区小松川3-90
小倉駅前店,松屋　小倉駅前店,福岡県北九州市小倉北区京町2-5-13
小倉片野店,松屋　Ｒ小倉片野店,福岡県北九州市小倉北区片野4-20-12
小滝橋通り店,松屋　小滝橋通り店,東京都新宿区西新宿7-7-28第一山本ビル1F
小田急永山店,松屋　小田急永山店,東京都多摩市永山1-18-2小田急マルシェ永山
小田急相模原西口店,松屋　小田急相模原西口店,神奈川県相模原市南区相模台2-4-6Ｋ-フィネッサ
小田急相模原店,松屋　小田急相模原店,神奈川県相模原市南区松が枝町24-6
小田原酒匂店,松屋　Ｒ小田原酒匂店,神奈川県小田原市西酒匂1丁目9-3
小田原店,松屋　小田原店,神奈川県小田原市栄町2-8-33岩下第1ビル
小平小川店,松屋　Ｒ小平小川店,東京都小平市小川東町5-2-5
小平店,松屋　小平店,東京都小平市美園町1-3-9
小牧店,松屋　Ｒ小牧店,愛知県小牧市小木東1-146
庄内店,松屋　庄内店,大阪府豊中市庄内西町2-22-10幸栄ビル1F
昭島松原町店,松屋　Ｒ昭島松原町店,東京都昭島市松原町1-6-13AGスクウェアビル1F
松原団地店,松屋　松原団地店,埼玉県草加市栄町3-1-9
松戸七畝割店,松屋　Ｒ松戸七畝割店,千葉県松戸市松戸2303-16
松戸松飛台店,松屋　松戸松飛台店,千葉県松戸市松飛台259-5
松戸店,松屋　松戸店,千葉県松戸市本町1-18第37東京ビル
松山萱町店,松屋　Ｒ松山萱町店,愛媛県松山市萱町6丁目53-1
松山枝松店,松屋　Ｒ松山枝松店,愛媛県松山市枝松5丁目7-14
松山石井店,松屋　Ｒ松山石井店,愛媛県松山市東石井4-11-8
松山大街道店,松屋　松山大街道店,愛媛県松山市大街道2丁目3-6
松本駅前店,松屋　松本駅前店,長野県松本市中央1-2-23山平ビル
松本高宮店,松屋　Ｒ松本高宮店,長野県松本市高宮中2-5
沼袋店,松屋　沼袋店,東京都中野区沼袋3-4-18
沼津店,松屋　Ｒ沼津店,静岡県沼津市筒井町9-7
沼津南店,松屋　Ｒ沼津南店,静岡県沼津市上香貫字三園町1372番地
湘南台店,松屋　湘南台店,神奈川県藤沢市湘南台2-5-9
上越藤野店,松屋　Ｒ上越藤野店,新潟県上越市大字藤野新田字上長池245-1
上溝店,松屋　Ｒ上溝店,神奈川県相模原市中央区上溝3-16-1
上山店,松屋　Ｒ上山店,山形県上山市仙石字梅ﾉ木774-1
上新庄店,松屋　上新庄店,大阪府大阪市東淀川区瑞光1-11-29新高ビル1階
上石神井店,松屋　上石神井店,東京都練馬区上石神井2-25-5栄ビル1F
上前津店,松屋　上前津店,愛知県名古屋市中区大須4-11-9
上大岡店,松屋　上大岡店,神奈川県横浜市港南区上大岡西2-1-19須藤ビル1F
上鶴間店,松屋　Ｒ上鶴間店,神奈川県相模原市南区上鶴間本町5丁目1番2号
上田秋和店,松屋　Ｒ上田秋和店,長野県上田市秋和492-5
上板橋店,松屋　上板橋店,東京都板橋区常盤台4-33-13丸萩ビル１F
上飯田店,松屋　Ｒ上飯田店,愛知県名古屋市北区上飯田通1-13
上尾東口店,松屋　上尾東口店,埼玉県上尾市宮本町3-16グロアール上尾
上尾緑丘店,松屋　Ｒ上尾緑丘店,埼玉県上尾市緑丘3-3-7
上福岡店,松屋　上福岡店,埼玉県ふじみ野市上福岡1-2-36
上野浅草口店,松屋　上野浅草口店,東京都台東区上野7-2-2
上野店,松屋　上野店,東京都台東区上野4-9-5石井ビル1F.2F
城清水店,松屋　Ｒ城清水店,福島県郡山市南1-2
植田一本松店,松屋　Ｒ植田一本松店,愛知県名古屋市天白区一本松2-701
寝屋川店,松屋　Ｒ寝屋川店,大阪府寝屋川市高宮栄町10-2
心斎橋店,松屋　心斎橋店,大阪府大阪市中央区心斎橋筋1-10-1心斎橋タワービル1F
新栄店,松屋　新栄店,愛知県名古屋市中区葵1-20-19芝電ビル1F
新潟駅前店,松屋　新潟駅前店,新潟県新潟市中央区東大通1-6-1
新潟女池店,松屋　Ｒ新潟女池店,新潟県新潟市中央区女池5-7-10
新潟米山店,松屋　Ｒ新潟米山店,新潟県新潟市中央区米山5-14-5
新潟豊栄店,松屋　Ｒ新潟豊栄店,新潟県新潟市北区かぶとやま2丁目2-58
新潟万代シテイ店,松屋　新潟万代シテイ店,新潟県新潟市中央区万代1-1-22
新橋３丁目店,松屋　新橋３丁目店,東京都港区新橋3-16-1
新検見川店,松屋　新検見川店,千葉県千葉市花見川区南花園2-1-6朝日ビル新検見川1Ｆ
新高円寺店,松屋　新高円寺店,東京都杉並区高円寺南2-20-2新高円寺駅前ビル1F2F
新座馬場店,松屋　Ｒ新座馬場店,埼玉県新座市馬場1-4-13
新在家店,松屋　新在家店,兵庫県神戸市灘区浜田町3丁目5-8アーバンヴィレッジ六甲南
新宿1丁目店,松屋　新宿1丁目店,東京都新宿区新宿1丁目26-6新宿加藤ビルディング1F
新宿３丁目店,松屋　新宿３丁目店,東京都新宿区新宿3-11-11ダイアン新宿ビル
新宿歌舞伎町店,松屋　新宿歌舞伎町店,東京都新宿区歌舞伎町1-22-8小島屋歌舞伎町ビル1F
新宿西口店,松屋　新宿西口店,東京都新宿区西新宿1-13-3西新ビル1F
新宿大ガード店,松屋　新宿大ガード店,東京都新宿区西新宿1-2-1ファイブＫビル1階
新宿南口店,松屋　新宿南口店,東京都新宿区新宿3-36-15新宿内野ビル1F
新宿二丁目店,松屋　新宿二丁目店,東京都新宿区新宿2-7-3ヴェラハイツ新宿御苑１F
新宿靖国通り店,松屋　新宿靖国通り店,東京都新宿区歌舞伎町1-6-3石塚ビル1階
新所沢東口店,松屋　新所沢東口店,埼玉県所沢市松葉町10-15
新小岩店,松屋　新小岩店,東京都葛飾区新小岩1-46
新小岩北口店,松屋　新小岩北口店,東京都葛飾区西新小岩1-9-1
新松戸西口店,松屋　新松戸西口店,千葉県松戸市新松戸2-21-103
新杉田店,松屋　新杉田店,神奈川県横浜市磯子区新杉田町3-1ステイト新杉田
新大久保店,松屋　新大久保店,東京都新宿区百人町1丁目4-15竹見ビル
新大宮店,松屋　新大宮店,奈良県奈良市大宮町5-3-36
新大阪東口店,松屋　新大阪東口店,大阪府大阪市東淀川区東中島1-20-9新大阪池永ビル
新大塚店,松屋　新大塚店,東京都豊島区東池袋5-52-16池田ビル
新中野店,松屋　新中野店,東京都中野区本町4-30-26成瀬ビル1F
新木場店,松屋　新木場店,東京都江東区新木場1-6-1新木場メトロセンターB棟G-2号
森ノ宮店,松屋　森ノ宮店,大阪府大阪市中央区森ノ宮中央1-407-2
森下店,松屋　森下店,東京都江東区森下2-17-1勝山ビル1F・2F
森孝店,松屋　Ｒ森孝店,愛知県名古屋市守山区森孝4-507
深江橋店,松屋　Ｒ深江橋店,大阪府大阪市東成区深江北2-9-24コルタ深江橋
深川不動前店,松屋　深川不動前店,東京都江東区富岡1-6-3
深大寺3丁目店,松屋　Ｒ深大寺3丁目店,東京都三鷹市深大寺3-8-7
深大寺店,松屋　Ｒ深大寺店,東京都調布市深大寺北町4-30-3
深谷市役所前店,松屋　Ｒ深谷市役所前店,埼玉県深谷市深谷町4-45
神楽坂店,松屋　神楽坂店,東京都新宿区神楽坂2-9大川ビル1F
神戸伊川谷店,松屋　Ｒ神戸伊川谷店,兵庫県神戸市西区伊川谷町有瀬1304
神戸玉津店,松屋　Ｒ神戸玉津店,兵庫県神戸市西区枝吉5丁目147番
神戸元町店,松屋　神戸元町店,兵庫県神戸市中央区元町通2-8-14オルタンシアビル1F
神戸新開地店,松屋　神戸新開地店,兵庫県神戸市兵庫区新開地4-6-26
神栖店,松屋　Ｒ神栖店,茨城県神栖市大野原2-22-1
神田小川町店,松屋　神田小川町店,東京都千代田区神田小川町2-1-15 1､2F
神田須田町店,松屋　神田須田町店,東京都千代田区神田須田町1-12-9富士第1ビル1F
神田西口店,松屋　神田西口店,東京都千代田区内神田2-12-5黒川第1ビル1F
神田南口店,松屋　神田南口店,東京都千代田区鍛冶町2丁目1-2神田南口鋭光ビル
神保町店,松屋　神保町店,東京都千代田区西神田2-1-13桜井ビル1F
神立店,松屋　Ｒ神立店,静岡県浜松市東区神立町118-2
秦野店,松屋　秦野店,神奈川県秦野市大秦町1-4鈴よしビル1F
針中野店,松屋　針中野店,大阪府大阪市東住吉区駒川5-16-3 1､2F
人形町店,松屋　人形町店,東京都中央区日本橋人形町1-18-8第2篠原ビル
諏訪店,松屋　Ｒ諏訪店,長野県諏訪市大字四賀赤沼1825-1
逗子店,松屋　逗子店,神奈川県逗子市逗子2-6-29
吹上店,松屋　Ｒ吹上店,埼玉県鴻巣市鎌塚3-10-12
垂水店,松屋　垂水店,兵庫県神戸市垂水区神田町3番18号ラ･メール垂水1F
水戸バイパス店,松屋　Ｒ水戸バイパス店,茨城県水戸市元吉田町1435-7
水戸駅前店,松屋　水戸駅前店,茨城県水戸市三の丸1-1-14成晃ビル1F
水戸東原店,松屋　Ｒ水戸東原店,茨城県水戸市東原2-9-17
水道橋店,松屋　水道橋店,東京都千代田区三崎町3-7-13三大ビル
瑞江店,松屋　瑞江店,東京都江戸川区瑞江2-3-11
瀬戸店,松屋　Ｒ瀬戸店,愛知県瀬戸市共栄通6-4
成城学園前店,松屋　成城学園前店,東京都世田谷区成城2-39-2成城学園ビューハイツ1F
成増店,松屋　成増店,東京都板橋区成増2-17-23
成田店,松屋　Ｒ成田店,千葉県成田市不動ヶ岡刈分2148-6
清水南店,松屋　Ｒ清水南店,静岡県静岡市清水区駒越北町4番1号
清瀬店,松屋　清瀬店,東京都清瀬市松山1-11-17
清瀬野塩店,松屋　Ｒ清瀬野塩店,東京都清瀬市野塩4-224-1
生田店,松屋　生田店,神奈川県川崎市多摩区生田7-8-9
盛岡アイーナ店,松屋　盛岡アイーナ店,岩手県盛岡市盛岡駅西通1-7-1いわて県民情報交流センター
盛岡駅前通店,松屋　盛岡駅前通店,岩手県盛岡市盛岡駅前通9-9
盛岡大通店,松屋　盛岡大通店,岩手県盛岡市大通1-7-5
聖蹟桜ヶ丘店,松屋　聖蹟桜ヶ丘店,東京都多摩市関戸2-39-10
西ノ宮店,松屋　西ノ宮店,兵庫県西宮市池田町9-7太陽ビル1F103号
西荻窪店,松屋　西荻窪店,東京都杉並区西荻南3-11-8
西葛西店,松屋　西葛西店,東京都江戸川区西葛西3-17-7
西蒲田店,松屋　西蒲田店,東京都大田区西蒲田8丁目24-8
西五反田店,松屋　西五反田店,東京都品川区西五反田1-11-9司ビル
西所沢店,松屋　Ｒ西所沢店,埼玉県所沢市上新井5-15-15
西小山店,松屋　西小山店,東京都品川区小山6-5-1
西新井店,松屋　西新井店,東京都足立区西新井栄町2-3-2ヤオキビル1F･2F
西新宿３丁目店,松屋　西新宿３丁目店,東京都新宿区西新宿3-7-21陽輪台西新宿林屋ビル
西新宿８丁目店,松屋　西新宿８丁目店,東京都新宿区西新宿8-12-1ダイヤモンドビル1F
西新宿店,松屋　西新宿店,東京都新宿区西新宿5-10-14西新宿橋谷田ビル1階・Ｂ1階
西新店,松屋　西新店,福岡県福岡市早良区西新5丁目1-2
西千葉店,松屋　西千葉店,千葉県千葉市中央区春日2-19-9西千葉西口ビル
西川口西口店,松屋　西川口西口店,埼玉県川口市西川口1丁目23-18
西川口店,松屋　西川口店,埼玉県川口市並木2-1-61F
西船橋店,松屋　西船橋店,千葉県船橋市西船4-25-3
西船橋南店,松屋　Ｒ西船橋南店,千葉県船橋市本郷町666-3リバーサイド本郷
西巣鴨店,松屋　西巣鴨店,東京都豊島区西巣鴨3-25-11メトロエステート西巣鴨110・111号
西大井店,松屋　西大井店,東京都品川区西大井1-4-20コア･スターレ西大井SC
西中島店,松屋　西中島店,大阪府大阪市淀川区西中島6-7-3
西町店,松屋　Ｒ西町店,北海道札幌市西区西町北4-1-8
西日暮里店,松屋　西日暮里店,東京都荒川区西日暮里5丁目24-5
西八王子店,松屋　西八王子店,東京都八王子市台町4-47-11飯田ビル1F
青砥店,松屋　青砥店,東京都葛飾区青戸3-37-19
青梅河辺町店,松屋　青梅河辺町店,東京都青梅市河辺町8-1-2
青梅新町店,松屋　Ｒ青梅新町店,東京都青梅市新町9-2020
青物横丁店,松屋　青物横丁店,東京都品川区東品川3-23-18アツミビル
青柳町店,松屋　Ｒ青柳町店,愛知県名古屋市千種区青柳町6丁目21-1
青葉台店,松屋　青葉台店,神奈川県横浜市青葉区青葉台2-9-18青葉台ハイツ1F
静岡御幸町店,松屋　静岡御幸町店,静岡県静岡市葵区御幸町9-2-1
静岡七ツ新屋店,松屋　Ｒ静岡七ツ新屋店,静岡県静岡市清水区七ﾂ新屋328-1
静岡池田店,松屋　Ｒ静岡池田店,静岡県静岡市駿河区池田404-1
静岡八幡店,松屋　Ｒ静岡八幡店,静岡県静岡市駿河区八幡2丁目3-17
石橋駅前店,松屋　石橋駅前店,大阪府池田市石橋1-10-27
石神井公園店,松屋　石神井公園店,東京都練馬区石神井町3-24-10
石神井台店,松屋　Ｒ石神井台店,東京都練馬区石神井台6丁目7-2
石和店,松屋　Ｒ石和店,山梨県笛吹市石和町広瀬1374
赤羽西口店,松屋　赤羽西口店,東京都北区赤羽西1-38-2
赤羽店,松屋　赤羽店,東京都北区赤羽2-1-19十一会ビル
赤羽東口店,松屋　赤羽東口店,東京都北区赤羽1-2-6
赤坂６丁目店,松屋　赤坂６丁目店,東京都港区赤坂6丁目4-22
赤坂見附店,松屋　赤坂見附店,東京都港区赤坂3-21-8千古満ビル1F
赤坂店,松屋　赤坂店,東京都港区赤坂5-4-6赤坂三辻ビル1F
仙川店,松屋　仙川店,東京都調布市仙川町1-11-16ハラダビル
仙台クリスロード店,松屋　仙台クリスロード店,宮城県仙台市青葉区中央2-4-11水晶堂ビル
仙台五橋店,松屋　仙台五橋店,宮城県仙台市若林区清水小路5-6エステート五ツ橋
仙台広瀬通本町店,松屋　仙台広瀬通本町店,宮城県仙台市青葉区本町1-2-5第3志ら梅ビル
仙台鹿島店,松屋　Ｒ仙台鹿島店,宮城県仙台市泉区市名坂字鹿島11
仙台扇町店,松屋　Ｒ仙台扇町店,宮城県仙台市宮城野区扇町5-5-1
仙台大和町店,松屋　Ｒ仙台大和町店,宮城県仙台市若林区大和町3-2-11
仙台中央店,松屋　仙台中央店,宮城県仙台市青葉区中央3-6-3 1F
仙台中野栄店,松屋　Ｒ仙台中野栄店,宮城県仙台市宮城野区中野字只屋敷45-1
仙台定禅寺通り店,松屋　仙台定禅寺通り店,宮城県仙台市青葉区国分町3-3-5リスズビル1F
仙台南町通り店,松屋　仙台南町通り店,宮城県仙台市青葉区一番町2-7-7
仙台八乙女店,松屋　Ｒ仙台八乙女店,宮城県仙台市泉区上谷刈1-1-5
千歳烏山店,松屋　千歳烏山店,東京都世田谷区南烏山4-12-4スギウラビル1F
千歳船橋店,松屋　千歳船橋店,東京都世田谷区船橋1-1-5アジア堂ビル1F
千川店,松屋　千川店,東京都豊島区要町3-38-3長崎ビル1F
千駄木店,松屋　千駄木店,東京都文京区千駄木2-33-8
千日前店,松屋　千日前店,大阪府大阪市中央区難波3-3-4
千葉我孫子店,松屋　千葉我孫子店,千葉県我孫子市本町2-2-19プラザビル1F
千葉幸町店,松屋　Ｒ千葉幸町店,千葉県千葉市美浜区幸町2-21-30
千葉店,松屋　千葉店,千葉県千葉市中央区富士見2-5-16
千里丘店,松屋　Ｒ千里丘店,大阪府摂津市千里丘5-11-3
千林大宮店,松屋　千林大宮店,大阪府大阪市旭区森小路2-6-1
川越インター店,松屋　Ｒ川越インター店,埼玉県川越市広栄町6-6
川越城下町店,松屋　Ｒ川越城下町店,埼玉県川越市城下町7-8
川越西口店,松屋　川越西口店,埼玉県川越市脇田本町1-7川越駅西口ビル
川口栄町店,松屋　川口栄町店,埼玉県川口市栄町3丁目14-1
川口駅前店,松屋　川口駅前店,埼玉県川口市川口1-1-1CuPo･La専門店A105
川口上青木店,松屋　Ｒ川口上青木店,埼玉県川口市上青木2-47-1
川口並木店,松屋　Ｒ川口並木店,埼玉県川口市並木4-6-20
川崎京町店,松屋　Ｒ川崎京町店,神奈川県川崎市川崎区京町1-18-15
川崎銀座街店,松屋　川崎銀座街店,神奈川県川崎市川崎区砂子1-1-7川崎銀座共同ビル
川崎西口店,松屋　川崎西口店,神奈川県川崎市幸区大宮町5-1
川崎大師店,松屋　川崎大師店,神奈川県川崎市川崎区大師駅前1-16-20石川ビル
川崎店,松屋　川崎店,神奈川県川崎市川崎区小川町14-2栄安ビル
川崎枡形店,松屋　Ｒ川崎枡形店,神奈川県川崎市多摩区枡形1-5-9
川西能勢口店,松屋　川西能勢口店,兵庫県川西市栄町10-5パルティ川西101号
川島店,松屋　Ｒ川島店,埼玉県比企郡川島町大字上伊草1214-1
浅草橋店,松屋　浅草橋店,東京都台東区柳橋1-13-4村井ビル1.2F
浅草吾妻橋店,松屋　浅草吾妻橋店,東京都台東区雷門2-19-13
浅草国際通店,松屋　浅草国際通店,東京都台東区浅草2-11-7和田ビル
浅草店,松屋　浅草店,東京都台東区浅草1-12-8大山ビル
船橋南口店,松屋　船橋南口店,千葉県船橋市本町1-3-1フェイスビル1F-0108
船橋北口店,松屋　船橋北口店,千葉県船橋市本町6-6-4北口スクエアビル
船堀店,松屋　船堀店,東京都江戸川区船堀1-4-16SKビル船堀
前橋元総社町店,松屋　Ｒ前橋元総社町店,群馬県前橋市元総社町90-1
前橋三河町店,松屋　前橋三河町店,群馬県前橋市三河町2-16-16
前橋上小出町店,松屋　Ｒ前橋上小出町店,群馬県前橋市上小出町2-41-7
曽根店,松屋　Ｒ曽根店,大阪府豊中市曽根東町2-12-14
祖師谷大蔵３丁目店,松屋　祖師谷大蔵３丁目店,東京都世田谷区祖師谷3-32-14
蘇我店,松屋　Ｒ蘇我店,千葉県千葉市中央区今井2-1-1
早稲田店,松屋　早稲田店,東京都新宿区馬場下町62-18早稲田武蔵野ビル1F
巣鴨店,松屋　巣鴨店,東京都豊島区巣鴨2丁目5-2
相模原中央店,松屋　相模原中央店,神奈川県相模原市中央区中央1丁目10-15
相模原店,松屋　相模原店,神奈川県相模原市中央区相模原2-2-19エイコーマンション1F
相模大野店,松屋　相模大野店,神奈川県相模原市南区相模大野3-2-1ボーノ相模大野ノースモール1F
草加清門町店,松屋　Ｒ草加清門町店,埼玉県草加市清門町423-1
草加西口店,松屋　草加西口店,埼玉県草加市氷川町2125-4ウシヤマビル
草加店,松屋　Ｒ草加店,埼玉県草加市北谷町1-2-14
草津店,松屋　Ｒ草津店,滋賀県草津市草津3-14-33
足立江北店,松屋　Ｒ足立江北店,東京都足立区江北3丁目35番12号
足立保塚店,松屋　Ｒ足立保塚店,東京都足立区保塚町12-21
袖ヶ浦店,松屋　Ｒ袖ヶ浦店,千葉県袖ケ浦市福王台3-12-4
多治見店,松屋　Ｒ多治見店,岐阜県多治見市白山町4-50
多摩ニュータウン店,松屋　Ｒ多摩ニュータウン店,東京都八王子市松木33-3
多摩愛宕店,松屋　Ｒ多摩愛宕店,東京都多摩市愛宕4-7-3
太田飯塚町店,松屋　Ｒ太田飯塚町店,群馬県太田市飯塚町1443
代々木上原店,松屋　代々木上原店,東京都渋谷区西原3-7-6大又建設ビル
代々木店,松屋　代々木店,東京都渋谷区代々木1-34-4
代々木南店,松屋　代々木南店,東京都渋谷区千駄ヶ谷4丁目29-12北参道ダイヤモンドパレス103
代々木八幡店,松屋　代々木八幡店,東京都渋谷区富ヶ谷1-52-2ニューアメリカンビル1F
大井競馬場店,松屋　大井競馬場店,東京都品川区勝島2-1-2大井競馬場Lウイング2階
大井町店,松屋　大井町店,東京都品川区東大井5-6-8
大岡山店,松屋　大岡山店,東京都大田区北千束1-40-1石井ビル1F
大垣店,松屋　Ｒ大垣店,岐阜県大垣市禾森町5-190
大久保２丁目店,松屋　大久保２丁目店,東京都新宿区大久保2-5-1
大久保店,松屋　大久保店,東京都新宿区百人町1-18-11百人町秋山ビル1F
大宮吉野町店,松屋　Ｒ大宮吉野町店,埼玉県さいたま市北区吉野町1-2-3
大宮桜木町店,松屋　大宮桜木町店,埼玉県さいたま市大宮区桜木町2-472-3
大宮深作店,松屋　Ｒ大宮深作店,埼玉県さいたま市見沼区深作3-27-3
大宮大成町店,松屋　Ｒ大宮大成町店,埼玉県さいたま市大宮区大成町3-517
大宮仲町店,松屋　大宮仲町店,埼玉県さいたま市大宮区仲町1-71東京レジャービル1F
大宮東口店,松屋　大宮東口店,埼玉県さいたま市大宮区宮町1-5
大宮奈良町店,松屋　Ｒ大宮奈良町店,埼玉県さいたま市北区奈良町51-4
大宮南中丸店,松屋　Ｒ大宮南中丸店,埼玉県さいたま市見沼区大字南中丸字久保519-4
大国町店,松屋　大国町店,大阪府大阪市浪速区敷津東1-9-16
大阪茨木店,松屋　大阪茨木店,大阪府茨木市春日1-4-1
大阪本町店,松屋　大阪本町店,大阪府大阪市中央区南本町3-3-8
大阪野田店,松屋　大阪野田店,大阪府大阪市福島区吉野3-12-27
大山店,松屋　大山店,東京都板橋区大山東町58-2
大森町店,松屋　大森町店,東京都大田区大森西3-20-14
大森店,松屋　大森店,東京都大田区山王2-2-11
大森北口店,松屋　大森北口店,東京都品川区南大井6-24-1セブンスターマンション第五大森
大泉学園町店,松屋　大泉学園町店,東京都練馬区大泉学園町7-15-20
大泉学園店,松屋　大泉学園店,東京都練馬区東大泉1-37-3THE509TOWER1F
