あざみ野店,松屋　あざみ野店,神奈川県横浜市青葉区あざみ野1-11-1あざみ野センタービル1F
あびこ店,松屋　あびこ店,大阪府大阪市住吉区苅田5-19-17メトロアビコ1F
お花茶屋店,松屋　お花茶屋店,東京都葛飾区お花茶屋1-19-16飯田ビル
かすみがうら店,松屋　Ｒかすみがうら店,茨城県かすみがうら市上稲吉1943-32
さがみ野店,松屋　さがみ野店,神奈川県海老名市東柏ヶ谷2-30-24
すすきの店,松屋　すすきの店,北海道札幌市中央区南4条西3丁目第3グリーンビル
たつの店,松屋　Ｒたつの店,兵庫県たつの市龍野町堂本369-3
つくば西大通り店,松屋　Ｒつくば西大通り店,茨城県つくば市春日4-1-5
つくば大角豆店,松屋　Ｒつくば大角豆店,茨城県つくば市大角豆2012-930番地
つくば東大通店,松屋　Ｒつくば東大通店,茨城県つくば市妻木1768-1
ときわ台店,松屋　ときわ台店,東京都板橋区常盤台1-2-5町田ビル1F
ひたちなか店,松屋　Ｒひたちなか店,茨城県ひたちなか市市毛字原坪894-36
ひばりが丘店,松屋　ひばりが丘店,東京都西東京市ひばりが丘北3-3-14
ふじみ野駅前店,松屋　ふじみ野駅前店,埼玉県富士見市ふじみ野西1-20-2第7松本ビル1F
ふじみ野店,松屋　Ｒふじみ野店,埼玉県ふじみ野市ふじみ野1-9-21
みずほ台店,松屋　みずほ台店,埼玉県富士見市西みずほ台1-20-8
エイトタウン本宮店,松屋　Ｒエイトタウン本宮店,福島県本宮市荒井字久保田132-8-5
ビビット南船橋店,松屋　ビビット南船橋店,千葉県船橋市浜町2丁目2-7ビビット南船橋
阿佐ヶ谷店,松屋　阿佐ヶ谷店,東京都杉並区阿佐ヶ谷北2-1-10
阿倍野店,松屋　阿倍野店,大阪府大阪市阿倍野区阿倍野筋2-4-49
愛知学院前店,松屋　Ｒ愛知学院前店,愛知県日進市竹の山1-907
旭川永山店,松屋　Ｒ旭川永山店,北海道旭川市永山十条4丁目6-7
旭店,松屋　Ｒ旭店,千葉県旭市ニ1131-1
綾瀬小園店,松屋　Ｒ綾瀬小園店,神奈川県綾瀬市小園923-2
綾瀬店,松屋　綾瀬店,東京都足立区綾瀬3-2-8シティプレイス綾瀬１Ｆ
安城錦町店,松屋　Ｒ安城錦町店,愛知県安城市錦町8-5
伊勢原店,松屋　伊勢原店,神奈川県伊勢原市桜台1-2-30三協ビル
伊勢佐木町店,松屋　伊勢佐木町店,神奈川県横浜市中区伊勢佐木町2-76-3
伊勢崎宮子町店,松屋　Ｒ伊勢崎宮子町店,群馬県伊勢崎市宮子町3426-1
伊丹店,松屋　Ｒ伊丹店,兵庫県伊丹市南町3-1-3
井土ヶ谷店,松屋　井土ヶ谷店,神奈川県横浜市南区井土ｹ谷中町161
一宮店,松屋　Ｒ一宮店,愛知県一宮市赤見1-2-12
稲城矢野口店,松屋　Ｒ稲城矢野口店,東京都稲城市矢野口517-2
稲田堤店,松屋　稲田堤店,神奈川県川崎市多摩区菅2-1-1
稲毛店,松屋　稲毛店,千葉県千葉市稲毛区小仲台2-5-15第8若菜ビル1.2F
茨木ラウンドワン店,松屋　Ｒ茨木ラウンドワン店,大阪府茨木市南清水町3-5ラウンドワン茨木内
宇都宮オリオン通店,松屋　宇都宮オリオン通店,栃木県宇都宮市曲師町5-8多喜屋ビル
宇都宮簗瀬町店,松屋　Ｒ宇都宮簗瀬町店,栃木県宇都宮市簗瀬町1984-6
宇部店,松屋　Ｒ宇部店,山口県宇部市島1-1-2
羽村店,松屋　羽村店,東京都羽村市五ﾉ神4-15-11シティープラザはむら1Ｆ
浦安駅前店,松屋　浦安駅前店,千葉県浦安市当代島1-1-22
浦安店,松屋　浦安店,千葉県浦安市北栄1-15-5RECS浦安駅前
浦安富士見店,松屋　Ｒ浦安富士見店,千葉県浦安市富士見3-16-9
浦和所沢バイパス店,松屋　Ｒ浦和所沢バイパス店,埼玉県富士見市水谷東1-1-2
浦和太田窪店,松屋　Ｒ浦和太田窪店,埼玉県さいたま市南区大字太田窪2840-2
浦和町谷店,松屋　Ｒ浦和町谷店,埼玉県さいたま市桜区町谷2-1-1
浦和店,松屋　浦和店,埼玉県さいたま市浦和区高砂1-10-18
浦和田島通店,松屋　Ｒ浦和田島通店,埼玉県さいたま市南区四谷3-7-6
越谷駅前店,松屋　越谷駅前店,埼玉県越谷市弥生町3-24
越谷下間久里店,松屋　Ｒ越谷下間久里店,埼玉県越谷市下間久里980-1
越谷蒲生店,松屋　Ｒ越谷蒲生店,埼玉県越谷市蒲生南町15-4
塩尻店,松屋　Ｒ塩尻店,長野県塩尻市大門泉町13-8
押上店,松屋　押上店,東京都墨田区押上1丁目11-3押上滝ビル
横須賀中央駅前店,松屋　横須賀中央駅前店,神奈川県横須賀市若松町1-7-5
横須賀中央店,松屋　横須賀中央店,神奈川県横須賀市大滝町2-23三笠ビル
横浜西口店,松屋　横浜西口店,神奈川県横浜市西区北幸1-1-2INB横浜西口ビル１F
横浜店,松屋　横浜店,神奈川県横浜市西区南幸2丁目1-3相鉄ムービル
横浜南幸店,松屋　横浜南幸店,神奈川県横浜市西区南幸2-14-7横尾ビル1、2階
王子１丁目店,松屋　王子１丁目店,東京都北区王子1-6-11都築ビル102号
王子店,松屋　王子店,東京都北区王子1-13-16エイムビル1F
鴬谷店,松屋　鴬谷店,東京都台東区根岸1-6-6小宮山鴬谷ビル1F
岡崎南店,松屋　Ｒ岡崎南店,愛知県岡崎市柱曙3丁目10-7
岡崎北店,松屋　Ｒ岡崎北店,愛知県岡崎市鴨田町字広元196
岡山ジョイポリス店,松屋　岡山ジョイポリス店,岡山県岡山市北区下石井2-10-1岡山ジョイポリス1階・1-Ｂ区画
岡山駅西口店,松屋　岡山駅西口店,岡山県岡山市北区駅元町22-13西口駅前ビル
岡山駅前店,松屋　岡山駅前店,岡山県岡山市北区本町3-3
岡山十日市店,松屋　Ｒ岡山十日市店,岡山県岡山市北区十日市西町5-28
岡山商科大前店,松屋　Ｒ岡山商科大前店,岡山県岡山市北区津島西坂2-5-5
岡本店,松屋　岡本店,兵庫県神戸市東灘区岡本1-8-1
荻窪西口店,松屋　荻窪西口店,東京都杉並区上荻1-16-3
荻窪北口店,松屋　荻窪北口店,東京都杉並区上荻1-6-2
桶川店,松屋　Ｒ桶川店,埼玉県桶川市大字坂田1632-1
下関稗田店,松屋　Ｒ下関稗田店,山口県下関市稗田中町9-31
下高井戸店,松屋　下高井戸店,東京都世田谷区赤堤4-48-10雪華堂ビル1階
下石神井店,松屋　Ｒ下石神井店,東京都練馬区下石神井4-1-7ＭＳビル1F
下赤塚店,松屋　下赤塚店,東京都板橋区赤塚1-7-2
下総中山店,松屋　下総中山店,千葉県船橋市本中山2-15-10
下板橋店,松屋　下板橋店,東京都豊島区池袋本町3-25-13
下北沢店,松屋　下北沢店,東京都世田谷区北沢2-19-13松本ビル1F
加古川平岡町店,松屋　Ｒ加古川平岡町店,兵庫県加古川市平岡町一色370-1
加古川野口町店,松屋　R加古川野口町店,兵庫県加古川市野口町坂元坂之下36-1
河原町店,松屋　河原町店,京都府京都市中京区河原町通蛸薬師上る奈良屋町305番地
花園町店,松屋　花園町店,大阪府大阪市西成区鶴見橋1-3-5ビュアファースト花園1F
花小金井駅前店,松屋　花小金井駅前店,東京都小平市花小金井1-8-6大沢ビル(ビックアロービル)
我孫子若松店,松屋　Ｒ我孫子若松店,千葉県我孫子市若松140-1
海南店,松屋　Ｒ海南店,和歌山県海南市船尾213-17
海老名店,松屋　海老名店,神奈川県海老名市中央2-1-5パインビル1F
蟹江店,松屋　Ｒ蟹江店,愛知県海部郡蟹江町錦2-161メナー錦1階
学芸大学店,松屋　学芸大学店,東京都目黒区鷹番3-8-7
笠寺店,松屋　Ｒ笠寺店,愛知県名古屋市南区千竈通7丁目8-1
葛西長島陸橋店,松屋　葛西長島陸橋店,東京都江戸川区東葛西5丁目3-3桂ビル
蒲田店,松屋　蒲田店,東京都大田区西蒲田7-2-3第2醍醐ビル
蒲田東口店,松屋　蒲田東口店,東京都大田区蒲田5-25-2コーポ橋本1F
鎌ヶ谷店,松屋　Ｒ鎌ヶ谷店,千葉県鎌ケ谷市東初富4-2-83
鴨居店,松屋　鴨居店,神奈川県横浜市緑区鴨居1-8-10田畑ビル1Ｆ
鴨江店,松屋　Ｒ鴨江店,静岡県浜松市中区鴨江3-74-20
茅ヶ崎赤松町店,松屋　Ｒ茅ヶ崎赤松町店,神奈川県茅ヶ崎市赤松町1-5
茅ヶ崎店,松屋　茅ヶ崎店,神奈川県茅ヶ崎市新栄町8-8コジマビル1F
萱島店,松屋　萱島店,大阪府門真市上島町46-7
刈谷日高店,松屋　Ｒ刈谷日高店,愛知県刈谷市日高町4丁目611
寒川倉見店,松屋　Ｒ寒川倉見店,神奈川県高座郡寒川町倉見849-3
関西空港店,松屋　関西空港店,大阪府泉佐野市泉州空港北1番地エアロプラザ3F
関大前店,松屋　関大前店,大阪府吹田市千里山東1-14-5吉本マンション１Ｆ
関内仲通り店,松屋　関内仲通り店,神奈川県横浜市中区常盤町2-10常盤不動産ビル1F
館林店,松屋　Ｒ館林店,群馬県館林市松原3丁目16番5
丸亀柞原店,松屋　Ｒ丸亀柞原店,香川県丸亀市柞原町409-1
岸里店,松屋　岸里店,大阪府大阪市西成区潮路1-10-1林岸里駅前ビル
岸和田店,松屋　Ｒ岸和田店,大阪府岸和田市土生町2-7-17
岩出店,松屋　Ｒ岩出店,和歌山県岩出市岡田4-1
岩塚店,松屋　Ｒ岩塚店,愛知県名古屋市中村区畑江通9-45
喜多見店,松屋　喜多見店,東京都世田谷区喜多見9丁目1-7栄屋ビル
喜連瓜破店,松屋　喜連瓜破店,大阪府大阪市平野区喜連2-5-47村瀬ビル1F
岐阜茜部店,松屋　Ｒ岐阜茜部店,岐阜県岐阜市茜部本郷3-159-3
岐阜鏡島店,松屋　Ｒ岐阜鏡島店,岐阜県岐阜市鏡島2009-1
岐阜則武店,松屋　Ｒ岐阜則武店,岐阜県岐阜市則武西2丁目19-16
希望ヶ丘店,松屋　希望ヶ丘店,神奈川県横浜市旭区東希望が丘99-15
旗の台店,松屋　旗の台店,東京都品川区旗の台2-7-6
紀ノ川大橋店,松屋　Ｒ紀ノ川大橋店,和歌山県和歌山市湊1820-99
紀尾井町店,松屋　紀尾井町店,東京都千代田区麹町3-5-17晴花ビル
亀岡店,松屋　Ｒ亀岡店,京都府亀岡市下矢田町2-35-5
亀戸店,松屋　亀戸店,東京都江東区亀戸2-20-4
亀戸南店,松屋　亀戸南店,東京都江東区亀戸6-59-10サンシャレード亀戸1F
亀田インター店,松屋　Ｒ亀田インター店,新潟県新潟市中央区姥ｹ山63-1
亀島店,松屋　Ｒ亀島店,愛知県名古屋市中村区則武本通1-36マシュービル1F
亀有店,松屋　亀有店,東京都葛飾区亀有3-25-1
亀有南口店,松屋　亀有南口店,東京都葛飾区亀有3-30-12
菊名店,松屋　菊名店,神奈川県横浜市港北区菊名4-2-6
吉祥院店,松屋　Ｒ吉祥院店,京都府京都市南区吉祥院西ﾉ茶屋町63番
吉祥寺サンロード店,松屋　吉祥寺サンロード店,東京都武蔵野市吉祥寺本町1-15-4 1F･2F･3F
吉祥寺南口店,松屋　吉祥寺南口店,東京都武蔵野市吉祥寺南町1-5-5 1F
吉川店,松屋　吉川店,埼玉県吉川市木売1-4-11
吉塚店,松屋　吉塚店,福岡県福岡市博多区吉塚本町130-42フレスタよしづか
久我山店,松屋　久我山店,東京都杉並区久我山2-28-1矢崎ビル1･2F
久米川店,松屋　久米川店,東京都東村山市栄町1-5-2
久里浜店,松屋　久里浜店,神奈川県横須賀市久里浜4-6-18フジビル1F
久留米通町店,松屋　Ｒ久留米通町店,福岡県久留米市通町1-16
牛久店,松屋　Ｒ牛久店,茨城県牛久市田宮町41-1
牛田店,松屋　牛田店,東京都足立区千住曙町3-1
京王つつじヶ丘店,松屋　京王つつじヶ丘店,東京都調布市東つつじヶ丘1-2-5
京王八王子店,松屋　京王八王子店,東京都八王子市東町1-1-20第6岩下ビル1F
京橋南店,松屋　京橋南店,大阪府大阪市都島区片町2-4-8上室ビル
京阪京橋店,松屋　京阪京橋店,大阪府大阪市都島区東野田町2-4-14
京成高砂店,松屋　京成高砂店,東京都葛飾区高砂2-38-5
京成小岩店,松屋　京成小岩店,東京都江戸川区北小岩6-12-1白坂ビル
京成大久保店,松屋　京成大久保店,千葉県習志野市大久保1-21-12ニューTKビル1F
京成立石店,松屋　京成立石店,東京都葛飾区立石1-19-6あづまやビル
京都久御山店,松屋　Ｒ京都久御山店,京都府久世郡久御山町野村村東87-1
京都三条店,松屋　京都三条店,京都府京都市中京区三条通河原町東入中島町97
京都西院店,松屋　京都西院店,京都府京都市右京区西院高山寺町12-7
橋本店,松屋　橋本店,神奈川県相模原市緑区橋本6-2-1道栄ビル1F
狭山根岸店,松屋　Ｒ狭山根岸店,埼玉県狭山市根岸1-8-34
狭山市駅前店,松屋　狭山市駅前店,埼玉県狭山市入間川1-3-2スカイテラス1F
狭山店,松屋　Ｒ狭山店,埼玉県狭山市下奥富136-2
玉出店,松屋　玉出店,大阪府大阪市西成区玉出西2-4-8
玉川学園前店,松屋　玉川学園前店,東京都町田市玉川学園2-11-21第17通南ビル
錦３丁目店,松屋　錦３丁目店,愛知県名古屋市中区錦3-24-2鶴重ビル1F
錦糸町店,松屋　錦糸町店,東京都墨田区江東橋3-11-6野村ビル1F.B1F
錦糸町南店,松屋　錦糸町南店,東京都墨田区江東橋3-8-10井野ビル1F
錦糸町北口店,松屋　錦糸町北口店,東京都墨田区錦糸2-4-10Ｓ川上ビル
琴似店,松屋　琴似店,北海道札幌市西区琴似一条2-6-8
近大前店,松屋　近大前店,大阪府東大阪市小若江4-13-11 1F､2F
金山店,松屋　金山店,愛知県名古屋市中区金山4-1-1カーニープレイス名古屋金山B1F
金沢工大前店,松屋　Ｒ金沢工大前店,石川県石川郡野々市町扇が丘8-8
金沢示野店,松屋　Ｒ金沢示野店,石川県金沢市示野中町79街区1イオン金沢示野SC内
金沢昌永町店,松屋　Ｒ金沢昌永町店,石川県金沢市昌永町18-5
金沢増泉店,松屋　Ｒ金沢増泉店,石川県金沢市神田2-2-25
金町店,松屋　金町店,東京都葛飾区東金町1-45-2
九条店,松屋　九条店,大阪府大阪市西区九条1-14-26
九品仏店,松屋　九品仏店,東京都世田谷区奥沢6-25-8
駒込店,松屋　駒込店,東京都豊島区駒込1-38-3小宮山駒込ビル1.2F
駒沢店,松屋　駒沢店,東京都世田谷区駒沢1-5-15
熊谷バイパス店,松屋　Ｒ熊谷バイパス店,埼玉県熊谷市大字肥塚1408-3
熊谷店,松屋　熊谷店,埼玉県熊谷市筑波2-55大正堂駅前ビル1.2F
桑名店,松屋　Ｒ桑名店,三重県桑名市中央町3-64-1
郡山コスモス通り店,松屋　Ｒ郡山コスモス通り店,福島県郡山市堤3-180
郡山駅前店,松屋　郡山駅前店,福島県郡山市駅前2-3-9東京萬ビル
郡山芳賀店,松屋　Ｒ郡山芳賀店,福島県郡山市芳賀3-7-1
恵比寿西店,松屋　恵比寿西店,東京都渋谷区恵比寿西1丁目10-8
恵比寿店,松屋　恵比寿店,東京都渋谷区恵比寿1-13-9フォレストJビル1F
桂店,松屋　Ｒ桂店,京都府京都市西京区樫原盆山16-1
経堂店,松屋　経堂店,東京都世田谷区経堂1-12-11
穴生店,松屋　Ｒ穴生店,福岡県北九州市八幡西区穴生2-8-7
穴川オーツーパーク店,松屋　Ｒ穴川オーツーパーク店,千葉県千葉市稲毛区園生町380-1
元住吉店,松屋　元住吉店,神奈川県川崎市中原区木月3丁目6番18号モトスミコアビル1F
元町東口店,松屋　元町東口店,兵庫県神戸市中央区北長狭通4丁目1-12鯉川ビル
古淵店,松屋　古淵店,神奈川県相模原市南区古淵1-7-1
戸越銀座店,松屋　戸越銀座店,東京都品川区平塚1-8-2山こしビル1F
戸越公園店,松屋　戸越公園店,東京都品川区戸越5-18-7兼田ビル1・2F
戸塚店,松屋　戸塚店,神奈川県横浜市戸塚区戸塚町16-1616ビル
戸田駅前店,松屋　Ｒ戸田駅前店,埼玉県戸田市大字新曽字柳原329-1
五井店,松屋　五井店,千葉県市原市五井中央西1-14-22潤間五井ビル
五個荘店,松屋　Ｒ五個荘店,滋賀県東近江市五個荘簗瀬町上川原5-2
五反野店,松屋　五反野店,東京都足立区足立4-29-8重沢ビル1Ｆ
後楽園店,松屋　後楽園店,東京都文京区本郷1-20-5杉浦ビル
御影店,松屋　御影店,兵庫県神戸市東灘区御影中町1-6-6シティーホームズ御影
御幸本町店,松屋　Ｒ御幸本町店,栃木県宇都宮市御幸本町4732-7
御崎店,松屋　Ｒ御崎店,大阪府大阪市住之江区御崎7丁目15-21
御殿場店,松屋　Ｒ御殿場店,静岡県御殿場市川島田939-1
厚木戸田店,松屋　Ｒ厚木戸田店,神奈川県厚木市戸田540-1
厚木店,松屋　Ｒ厚木店,神奈川県厚木市田村町7-20
向ヶ丘遊園店,松屋　向ヶ丘遊園店,神奈川県川崎市多摩区登戸2737-4タカノビル1F・2F
向原店,松屋　向原店,東京都豊島区東池袋4丁目41-27
広小路本町店,松屋　広小路本町店,愛知県名古屋市中区栄2-4-7チサンマンション広小路1F
広島金座街店,松屋　広島金座街店,広島県広島市中区本通1-4サカタビルB1F
広島胡町店,松屋　広島胡町店,広島県広島市中区胡町1-20永井興産胡町ビル1階
広島紙屋町店,松屋　広島紙屋町店,広島県広島市中区大手町1-4-5アロハビル1階
広島千田店,松屋　Ｒ広島千田店,広島県広島市中区東千田町2丁目3-23
広島矢野店,松屋　Ｒ広島矢野店,広島県広島市安芸区矢野西1-2-5
江古田店,松屋　江古田店,東京都練馬区栄町34-1
江戸川橋店,松屋　江戸川橋店,東京都文京区関口1-47-12江戸川橋ビル1F
江戸川店,松屋　Ｒ江戸川店,東京都江戸川区江戸川6-8-49
江坂店,松屋　江坂店,大阪府吹田市豊津町15-4
江南店,松屋　Ｒ江南店,愛知県江南市高屋町西町112
港南台店,松屋　港南台店,神奈川県横浜市港南区港南台4-1-1
溝の口店,松屋　溝の口店,神奈川県川崎市高津区溝口1-18-7澤木ビル1F
溝の口南口店,松屋　溝の口南口店,神奈川県川崎市高津区久本1丁目4-10TKBビル
甲府荒川店,松屋　Ｒ甲府荒川店,山梨県甲府市荒川1-8-32
甲府国母店,松屋　Ｒ甲府国母店,山梨県甲府市大里町358-1
甲府飯田店,松屋　Ｒ甲府飯田店,山梨県甲府市下飯田3-8-28
綱島店,松屋　綱島店,神奈川県横浜市港北区綱島西1-1-3青柳ビル1F
行徳店,松屋　行徳店,千葉県市川市行徳駅前2-3ポニー内1F
行徳南店,松屋　行徳南店,千葉県市川市行徳駅前2丁目8-6
香里園店,松屋　香里園店,大阪府寝屋川市香里南之町30-14
高井戸店,松屋　高井戸店,東京都杉並区高井戸西1-29-3
高円寺店,松屋　高円寺店,東京都杉並区高円寺北3-22-16 1F
高坂店,松屋　高坂店,埼玉県東松山市元宿1-11-2松田ビル
高崎駅前店,松屋　高崎駅前店,群馬県高崎市八島町17-10
高崎下之城店,松屋　Ｒ高崎下之城店,群馬県高崎市下之城町177-4
高崎江木町店,松屋　Ｒ高崎江木町店,群馬県高崎市江木町601-1
高崎問屋町店,松屋　Ｒ高崎問屋町店,群馬県高崎市問屋町1-10-4
高松木太店,松屋　Ｒ高松木太店,香川県高松市木太町3838-1
高針店,松屋　Ｒ高針店,愛知県名古屋市名東区牧の原3-805
高津店,松屋　高津店,神奈川県川崎市高津区二子5-2-1
高槻市駅前店,松屋　高槻市駅前店,大阪府高槻市城北町2-2-7
高槻南口店,松屋　高槻南口店,大阪府高槻市高槻町9-22吉廣第二ビル1.2F
高田馬場１丁目店,松屋　高田馬場１丁目店,東京都新宿区高田馬場1-26-12高田馬場ビル
高田馬場２丁目店,松屋　高田馬場２丁目店,東京都新宿区高田馬場2-1-2
高田馬場４丁目店,松屋　高田馬場４丁目店,東京都新宿区高田馬場4-11-8木村屋ビル1F
高田馬場店,松屋　高田馬場店,東京都新宿区高田馬場3-1-2
高島平店,松屋　Ｒ高島平店,東京都板橋区高島平2-1-4
国分寺西元町店,松屋　Ｒ国分寺西元町店,東京都国分寺市西元町2丁目9-25
国分寺南口店,松屋　国分寺南口店,東京都国分寺市南町3-18-17
国立店,松屋　国立店,東京都国立市中1-8-2
国領店,松屋　国領店,東京都調布市国領町4-8-1
狛江店,松屋　狛江店,東京都狛江市東和泉1丁目18-8
今出川店,松屋　今出川店,京都府京都市上京区今出川通室町東入ル今出川町332番地
今池店,松屋　今池店,愛知県名古屋市千種区今池5-23-14コザキ今池ビル1F
今津店,松屋　今津店,兵庫県西宮市今津曙町1-1エキーマ今津1F
今里店,松屋　今里店,大阪府大阪市東成区大今里西3-5-1
佐久店,松屋　Ｒ佐久店,長野県佐久市岩村田北1丁目13-7
佐原店,松屋　Ｒ佐原店,千葉県香取市北1-13-10
佐野店,松屋　Ｒ佐野店,栃木県佐野市浅沼町558-3
座間立野台店,松屋　Ｒ座間立野台店,神奈川県座間市立野台2丁目20-3
坂戸店,松屋　Ｒ坂戸店,埼玉県坂戸市南町34-5
阪急園田店,松屋　阪急園田店,兵庫県尼崎市東園田町9-48-1園田阪急プラザ
阪神西宮店,松屋　阪神西宮店,兵庫県西宮市田中町2-3
堺東店,松屋　堺東店,大阪府堺市堺区中瓦町2-2-11第2富士ビル1F
鷺宮店,松屋　鷺宮店,東京都中野区鷺宮3-18-3エレガンス鷺ノ宮1Ｆ
鷺沼店,松屋　鷺沼店,神奈川県川崎市宮前区鷺沼1-11-6鷺沼第一ビル
桜橋店,松屋　桜橋店,大阪府大阪市北区曾根崎新地2-2-13
桜上水店,松屋　桜上水店,東京都杉並区下高井戸1-22-6
桜新町店,松屋　桜新町店,東京都世田谷区桜新町1-12-9
桜川店,松屋　桜川店,大阪府大阪市浪速区桜川3-1-24丸二ビル
桜台店,松屋　桜台店,東京都練馬区桜台1-4-67
桜美林学園店,松屋　Ｒ桜美林学園店,東京都町田市根岸町1010-6
桜木町店,松屋　桜木町店,神奈川県横浜市中区花咲町2-59白鳥ビル1F
笹塚２丁目店,松屋　笹塚２丁目店,東京都渋谷区笹塚2-41-17滝沢ビル1Ｆ
札幌駅前通店,松屋　札幌駅前通店,北海道札幌市中央区北1条西3丁目3番地
三ノ輪店,松屋　三ノ輪店,東京都台東区三ﾉ輪2-14-10
三河安城店,松屋　Ｒ三河安城店,愛知県安城市緑町2-9-2
三宮東店,松屋　三宮東店,兵庫県神戸市中央区雲井通5-2-18サンパルビル1F
三郷店,松屋　三郷店,埼玉県三郷市三郷2-1-4ふじプラザビル
三軒茶屋店,松屋　三軒茶屋店,東京都世田谷区三軒茶屋1-32-15ハイツ北岡1F
三国店,松屋　三国店,大阪府大阪市淀川区三国本町3-30-13
三宿店,松屋　三宿店,東京都世田谷区池尻3-30-10
三鷹店,松屋　三鷹店,東京都武蔵野市中町1-14-5 1F
三鷹南口店,松屋　三鷹南口店,東京都三鷹市下連雀3-34-22ライオンズプラザ三鷹駅前
三鷹北口店,松屋　三鷹北口店,東京都武蔵野市中町1-6-7
三田駅前町店,松屋　Ｒ三田駅前町店,兵庫県三田市駅前町19-10
三田店,松屋　三田店,東京都港区芝5-29-2三善ビル1Ｆ
三島店,松屋　Ｒ三島店,静岡県三島市玉川243-1
三木店,松屋　Ｒ三木店,兵庫県三木市別所町小林734-76
参宮橋店,松屋　参宮橋店,東京都渋谷区代々木4-6-2宍戸ビル1F
山形駅前店,松屋　山形駅前店,山形県山形市香澄町1-5-17第一大宝ビル
山形深町店,松屋　Ｒ山形深町店,山形県山形市深町1-2-28
山口店,松屋　Ｒ山口店,山口県山口市泉町9-37
山梨昭和店,松屋　Ｒ山梨昭和店,山梨県中巨摩郡昭和町飯喰字村西1131
山梨竜王店,松屋　Ｒ山梨竜王店,山梨県甲斐市西八幡2234-1
四ツ橋店,松屋　四ツ橋店,大阪府大阪市西区北堀江1-2-14
四条大宮駅前店,松屋　四条大宮駅前店,京都府京都市下京区四条通大宮東入立中町492
四谷２丁目店,松屋　四谷２丁目店,東京都新宿区四谷2-9ＮＫ第7ビル
四谷三丁目店,松屋　四谷三丁目店,東京都新宿区左門町2-5四谷三国ビル
四日市日永店,松屋　Ｒ四日市日永店,三重県四日市市日永4-1-10
四日市富田店,松屋　Ｒ四日市富田店,三重県四日市市松原町2-17
四日市堀木店,松屋　Ｒ四日市堀木店,三重県四日市市堀木1-3-20
市ヶ谷店,松屋　市ヶ谷店,東京都千代田区九段北4-2-15市ヶ谷プラザ1F
市原白金通店,松屋　Ｒ市原白金通店,千葉県市原市白金町1-17
市川店,松屋　市川店,千葉県市川市市川1-6-11
志村坂上店,松屋　志村坂上店,東京都板橋区小豆沢3-6-3糠賀第二ビル1F
志木店,松屋　志木店,埼玉県新座市東北2-37-12磯川ビル1F
志木東口店,松屋　志木東口店,埼玉県志木市本町5-25-12サウスウッドビル１F
氏家店,松屋　Ｒ氏家店,栃木県さくら市卯の里5丁目61-7
自由ヶ丘店,松屋　自由ヶ丘店,東京都目黒区自由が丘1-12-3第二元太ビル1F
鹿島田店,松屋　鹿島田店,神奈川県川崎市幸区下平間135
篠原橋通り店,松屋　Ｒ篠原橋通り店,愛知県名古屋市中川区篠原橋通2丁目22
