すき家 甲府アルプス通り店,山梨県中巨摩郡昭和町西条2707-1,1100
すき家 45号八戸類家店,青森県八戸市類家5-11-5,940
すき家 南国BP店,高知県南国市明見字大政所960-1,1000
すき家 岩槻駅前店,埼玉県さいたま市岩槻区本町1-3-3吉田ﾋﾞﾙ1F,1100
すき家 6号松戸きよしヶ丘店,千葉県松戸市小金きよしヶ丘4-11-6,1080
すき家 305号小松今江店,石川県小松市今江町3-700,1050
すき家 金沢寺地店,石川県金沢市寺地1-32-28,1050
すき家 463号さいたま大門店,埼玉県さいたま市緑区美園6-11-12,1130
すき家 五香駅前店,千葉県松戸市常盤平5-11-12,1100
すき家 朝霞駅東口店,埼玉県朝霞市仲町2-2-34工房朝霞ﾋﾞﾙ1F,1100
すき家 旭川神居店,北海道旭川市神居2条1-1-17,1020
すき家 岸和田磯上店,大阪府岸和田市磯上町4-23-25,1100
すき家 202号福岡周船寺店,福岡県福岡市西区周船寺1-13-8,950
すき家 沼津小諏訪店,静岡県沼津市小諏訪574-8,1080
すき家 芝四丁目店,東京都港区芝4-7-1西山ﾋﾞﾙ1F,1380
すき家 210号大分わさだ店,大分県大分市市85-1,1000
すき家 36号苫小牧明野店,北海道苫小牧市明野新町2-1-4,1020
すき家 青梅河辺店,東京都青梅市河辺町5-25-1,1150
すき家 西川口駅前店,埼玉県川口市西川口1-5-3福原ﾋﾞﾙ,1130
すき家 長泉下土狩店,静岡県駿東郡長泉町下土狩429-1-1,1080
すき家 39号北見三輪店,北海道北見市東三輪2-831-4,1100
すき家 2国広島楽々園店,広島県広島市佐伯区楽々園2-2-22,1050
すき家 横浜上郷店,神奈川県横浜市栄区上郷町199-1,1180
すき家 217号佐伯店,大分県佐伯市鶴岡町1-3-5,980
すき家 四国中央川之江店,愛媛県四国中央市川之江町314-1,1050
すき家 昭島駅南店,東京都昭島市昭和町5-14-17,1150
すき家 228号北斗七重浜店,北海道北斗市七重浜7-2-1,1000
すき家 7号胎内店,新潟県胎内市大川町15-33,1000
すき家 三木本町店,兵庫県三木市本町1-6-30,1100
すき家 野田つつみ野店,千葉県野田市つつみ野1-2-4,1150
すき家 アクアウォーク大垣店,岐阜県大垣市林町6-80-21,1050
すき家 イオンモール新潟南店,新潟県新潟市江南区下早通柳田1-1-1,1030
すき家 イオンタウン佐沼店,宮城県登米市南方町新島前46-1,950
すき家 高松上天神店,香川県高松市上天神町217-1,1050
すき家 羽咋石野町店,石川県羽咋市石野町ｲ54-1,1150
すき家 生田駅南口店,神奈川県川崎市多摩区生田7-2-11,1140
すき家 浜松頭陀寺店,静岡県浜松市中央区頭陀寺町332-19,1100
すき家 五反野店,東京都足立区足立3-34-5沼野ﾋﾞﾙ,1220
すき家 伊丹野間店,兵庫県伊丹市南野北5-3-28,1080
すき家 横須賀衣笠店,神奈川県横須賀市衣笠町43-17,1200
すき家 307号枚方津田西店,大阪府枚方市津田西町1-2-1,1100
すき家 稲沢小池店,愛知県稲沢市小池3-10-25,1100
すき家 旭川永山店,北海道旭川市永山六条5-77-54,1020
すき家 広島緑井店,広島県広島市安佐南区緑井2-28-23,1000
すき家 イオンモール津山店,岡山県津山市河辺1000-1,1050
すき家 三宮駅東店,兵庫県神戸市中央区雲井通6-1-15ｻﾝｼﾃｨﾋﾞﾙ103,1100
すき家 125号加須諏訪店,埼玉県加須市諏訪1-15-1,1080
すき家 江東区役所前店,東京都江東区東陽4-10-7,1280
すき家 新高島平駅南店,東京都板橋区高島平4-23-17ｱﾙﾃ-ﾙ藤久,1250
すき家 ユニモちはら台店,千葉県市原市ちはら台西3-4ｼｮｯﾋﾟﾝｸﾞﾓ-ﾙﾕﾆﾓちはら台2Ｆ,1100
すき家 横浜片倉店,神奈川県横浜市神奈川区片倉1-8-6,1180
すき家 165号名張蔵持店,三重県名張市蔵持町原出778-1,1030
すき家 福岡片江店,福岡県福岡市城南区片江1-24-22,950
すき家 丸亀田村店,香川県丸亀市田村町字平池795-2,1050
すき家 稲城矢野口店,東京都稲城市矢野口323-7,1200
すき家 飛田給店,東京都調布市飛田給1-23-38荒井ﾋﾞﾙ,1200
すき家 渋川有馬店,群馬県渋川市有馬186-1,1100
すき家 長崎大学前店,長崎県長崎市家野町1-5,950
すき家 茨木中穂積店,大阪府茨木市中穂積2-10-8,1100
すき家 川崎駅前大通り店,神奈川県川崎市川崎区砂子2-6-27横山ﾋﾞﾙ1F,1300
すき家 354号邑楽店,群馬県邑楽郡邑楽町狸塚字高原357-1,1050
すき家 京急久里浜駅前店,神奈川県横須賀市久里浜4-5-4,1130
すき家 豪徳寺駅前店,東京都世田谷区豪徳寺1-25-7ﾆ-ﾅﾛ-ｼﾞﾅﾋﾞﾙ,1300
すき家 泉大津松之浜店,大阪府泉大津市松之浜町2-1-12,1100
すき家 富士今泉店,静岡県富士市今泉1-70-4,1200
すき家 鹿児島東谷山店,鹿児島県鹿児島市東谷山2-52-22,970
すき家 中環大日店,大阪府門真市向島3-35ﾍﾞｱ-ｽﾞA棟,1150
すき家 国分寺本多店,東京都国分寺市本多2-16-1,1150
すき家 155号常滑大鳥店,愛知県常滑市虹の丘三丁目53-2,1200
すき家 新座野火止店,埼玉県新座市野火止3-15-19,1100
すき家 飯塚市役所前店,福岡県飯塚市新飯塚20-24,950
すき家 55号徳島沖浜店,徳島県徳島市山城西4-1,1020
すき家 4号宇都宮今泉店,栃木県宇都宮市今泉町2533-1,1050
すき家 明石駅前店,兵庫県明石市東仲ノ町11-29石ﾋﾞﾙ1F,1080
すき家 扶桑柏森店,愛知県丹羽郡扶桑町大字柏森字西屋敷156-1,1080
すき家 44号釧路木場店,北海道釧路郡釧路町木場1-3-3,1000
すき家 大久保二丁目店,東京都新宿区大久保2-6-18,1300
すき家 武蔵境北口店,東京都武蔵野市境2-3-26,1180
すき家 6号ひたちなか田彦店,茨城県ひたちなか市大字田彦1569-1,1050
すき家 むつ中央店,青森県むつ市中央2-9-1,1000
すき家 堺片蔵店,大阪府堺市南区片蔵1333-1,1100
すき家 57号諫早小川町店,長崎県諫早市小川町53-1,1000
すき家 11号高松屋島店,香川県高松市高松町3009-9,1000
すき家 藤沢湘南台店,神奈川県藤沢市湘南台4-14-4,1160
すき家 竜ヶ崎馴柴店,茨城県龍ケ崎市馴柴町718-1,1020
すき家 ザ・モール郡山店,福島県郡山市長者1-1-56,980
すき家 宮崎大島店,宮崎県宮崎市大島町松ノ木下292-1,980
すき家 富士吉田赤富士通り店,山梨県富士吉田市上吉田東2丁目1-50,1200
すき家 稲荷町駅前店,東京都台東区東上野5-1-4,1300
すき家 4号盛岡西見前店,岩手県盛岡市西見前18-35-9,950
すき家 越谷花田店,埼玉県越谷市花田2-33-1,1080
すき家 松山枝松店,愛媛県松山市枝松1-9-16,1000
すき家 佐野鐙塚店,栃木県佐野市鐙塚町177-1,1100
すき家 板宿店,兵庫県神戸市須磨区大黒町3-3-26山本ﾋﾞﾙ,1050
すき家 495号古賀花見店,福岡県古賀市花見東1-15-13,980
すき家 横浜北幸店,神奈川県横浜市西区北幸2-10-50北幸山田ﾋﾞﾙ1F,1300
すき家 船橋習志野店,千葉県船橋市習志野5-5-1,1080
すき家 盛岡青山店,岩手県盛岡市青山3-7-1,930
すき家 21号各務原鵜沼店,岐阜県各務原市鵜沼西町3-234,1050
すき家 高知IC店,高知県高知市杉井流9-15,1000
すき家 堺津久野店,大阪府堺市西区下田町26-23,1100
すき家 岐阜入舟店,岐阜県岐阜市入舟町4-19,1080
すき家 岡山新保店,岡山県岡山市南区新保395-1,1020
すき家 169号桜井三輪店,奈良県桜井市三輪114-4,1050
すき家 東武蒲生駅前店,埼玉県越谷市蒲生寿町16-18,1100
すき家 東舞鶴白鳥店,京都府舞鶴市字森小字ﾑｼｳ218-1,1120
すき家 阿南富岡店,徳島県阿南市富岡町10-1,1020
すき家 イオン福島店,福島県福島市南矢野目西荒田50-17,980
すき家 41号高山店,岐阜県高山市下岡本町3014-5,1100
すき家 仙台福室店,宮城県仙台市宮城野区福室字小原1-2,1000
すき家 ラウンドワン和歌山店,和歌山県和歌山市小雑賀739-3,1050
すき家 東大阪加納店,大阪府東大阪市加納8-24-7,1100
すき家 119号宇都宮一条店,栃木県宇都宮市一条3-1-8,1050
すき家 141号佐久跡部店,長野県佐久市跡部46-4,1050
すき家 49号郡山IC店,福島県郡山市富田町池ノ上36-1,960
すき家 松山南江戸店,愛媛県松山市南江戸2-7-6,1000
すき家 三鷹駅南口店,東京都三鷹市下連雀3-23-12ｱ-ｼﾞｪﾝﾄﾋﾞﾙ,1230
すき家 越前押田店,福井県越前市押田2-1-1,1050
すき家 イオンモール旭川西店,北海道旭川市緑町23-2161-3,1020
すき家 野々市新庄店,石川県野々市市新庄3-253,1150
すき家 26号泉佐野鶴原店,大阪府泉佐野市鶴原1855-3,1120
すき家 末広町店,東京都千代田区外神田6-15-14,1300
すき家 2国大竹西栄店,広島県大竹市西栄1-7-13,1050
すき家 長津田みなみ台店,神奈川県横浜市緑区長津田みなみ台1-38-6,1200
すき家 今治衣干店,愛媛県今治市衣干町1942-4,1020
すき家 桐生新宿店,群馬県桐生市新宿3-2-14,1070
すき家 126号東金南上宿店,千葉県東金市南上宿5-38-33,1080
すき家 11号観音寺植田店,香川県観音寺市植田町字東原3-1,1050
すき家 24号天理嘉幡店,奈良県天理市嘉幡町590-1,1050
すき家 浜松駅南口店,静岡県浜松市中央区砂山町324-8第一伊藤ﾋﾞﾙ1Ｆ,1100
すき家 八王子楢原店,東京都八王子市楢原町397-5,1150
すき家 長堀橋駅南店,大阪府大阪市中央区島之内1-21-19協和島之内ﾋﾞﾙ1Ｆ,1200
すき家 211号八幡西店,福岡県北九州市八幡西区上の原3-1-6,980
すき家 坂出横津店,香川県坂出市横津町3-2-15,1000
すき家 四日市塩浜店,三重県四日市市塩浜本町1-9-5,1100
すき家 134号横須賀長坂店,神奈川県横須賀市長坂2-11-2,1120
すき家 11号新居浜外山店,愛媛県新居浜市外山町甲18-28,1030
すき家 伏見石田店,京都府京都市伏見区石田西ノ坪1-9,1080
すき家 大山東町店,東京都板橋区大山東町22-8,1250
すき家 仙川店,東京都調布市仙川町1-11-13大平ﾋﾞﾙ1F,1200
すき家 8号坂井丸岡店,福井県坂井市丸岡町朝陽2-102-1,1050
すき家 新宿六丁目店,東京都新宿区新宿6-28-10,1330
すき家 松江菅田店,島根県松江市菅田町24-1,980
すき家 26号高石店,大阪府高石市西取石7-11-1,1120
すき家 430号倉敷児島店,岡山県倉敷市児島小川町3682-5,1000
すき家 上福岡駅前店,埼玉県ふじみ野市上福岡1-8-2森田ﾋﾞﾙ1F,1070
すき家 尻手駅前店,神奈川県川崎市幸区南幸町3-109-1,1250
すき家 福岡志免店,福岡県糟屋郡志免町志免東3-1-12,1000
すき家 海老名河原口店,神奈川県海老名市河原口5-4-28,1180
すき家 鈴蘭台鳴子店,兵庫県神戸市北区鳴子2-1-4,1050
すき家 駒岡店,神奈川県横浜市鶴見区駒岡1-27-4,1230
すき家 125号八千代町店,茨城県結城郡八千代町菅谷604-1,1050
すき家 7号大館店,秋田県大館市根下戸新町9-25,970
すき家 今治北日吉店,愛媛県今治市北日吉町3-5-53,1020
すき家 高松中央IC店,香川県高松市木太町9区550-1,1100
すき家 3号宇土店,熊本県宇土市水町62-7,1000
すき家 192号徳島国府店,徳島県徳島市国府町観音寺大溝122-1,1020
すき家 曙橋店,東京都新宿区住吉町8-25,1250
すき家 イオンモール八千代緑が丘店,千葉県八千代市緑が丘2-1-3,1050
すき家 豊橋広小路店,愛知県豊橋市広小路1-37,1100
すき家 松山問屋町店,愛媛県松山市問屋町4-17,1000
すき家 新潟笹口店,新潟県新潟市中央区南笹口2-1-60,1050
すき家 4号仙台泉ヶ丘店,宮城県仙台市泉区泉ヶ丘3-13-24,1000
すき家 熊本東ＢＰ店,熊本県熊本市東区下南部3-17-71,1000
すき家 東大阪高井田店,大阪府東大阪市高井田本通7-1-30,1100
すき家 153号伊那店,長野県伊那市山寺282-1,1080
すき家 38号帯広柏林台店,北海道帯広市西十七条南1-25-1,1100
すき家 7号新発田中曽根店,新潟県新発田市中曽根町3-10-12,1000
すき家 101号男鹿店,秋田県男鹿市船越字内子294-1881,950
すき家 鶴見豊岡町店,神奈川県横浜市鶴見区豊岡町40-20,1200
すき家 熊本四方寄店,熊本県熊本市北区四方寄町508-6,970
すき家 静岡国吉田店,静岡県静岡市駿河区国吉田4-2-20,1100
すき家 府中本宿店,東京都府中市本宿町4-29-1,1200
すき家 1国富士鮫島店,静岡県富士市鮫島360-1,1150
すき家 新居浜高木店,愛媛県新居浜市高木町2-11,1030
すき家 川越木野目店,埼玉県川越市木野目1560-1,1080
すき家 行田向町店,埼玉県行田市向町17-11,1070
すき家 石巻元倉店,宮城県石巻市元倉1-21-12,990
すき家 裾野二ツ屋店,静岡県裾野市二ツ屋155-1,1100
すき家 城陽久世店,京都府城陽市久世南垣内172-1,1050
すき家 アクロスプラザ湯河原店,神奈川県足柄下郡湯河原町中央1-1617-54,1180
すき家 250号赤穂駅前店,兵庫県赤穂市加里屋69-11,1100
すき家 新木場駅南店,東京都江東区新木場1-4-7,1350
すき家 48号仙台折立店,宮城県仙台市青葉区折立1-21-20,1000
すき家 金沢大桑店,石川県金沢市大桑3-41,1050
すき家 八千代高津店,千葉県八千代市高津東1-6-18,1080
すき家 イオンモール発寒店,北海道札幌市西区発寒八条12-1-1,1000
すき家 17号上里店,埼玉県児玉郡上里町神保原町2211-2,1080
すき家 焼津小川店,静岡県焼津市東小川8-11-12,1100
すき家 ハッピーロード大山店,東京都板橋区大山町24-10常陸ﾋﾞﾙ1F,1250
すき家 イオンモール盛岡南店,岩手県盛岡市本宮7-1-1,950
すき家 17号本庄店,埼玉県本庄市本庄4-7-11,1110
すき家 羽島竹鼻店,岐阜県羽島市竹鼻町丸の内4-70,1050
すき家 酒田若竹店,山形県酒田市若竹町2-3-5,1100
すき家 京田辺興戸店,京都府京田辺市興戸犬伏32-1,1050
すき家 伊勢崎除ヶ町店,群馬県伊勢崎市除ヶ町324-1,1050
すき家 岐阜南鶉店,岐阜県岐阜市南鶉5-18-1,1050
すき家 北千住西口店,東京都足立区千住3-1-10,1210
すき家 430号倉敷水島店,岡山県倉敷市東塚1-16-29,1050
すき家 三島徳倉店,静岡県三島市徳倉910-2,1080
すき家 桑名大仲新田店,三重県桑名市大仲新田屋敷319-119,1100
すき家 魚津本江店,富山県魚津市本江字雲雀作2555-1,1080
すき家 岐阜正木店,岐阜県岐阜市正木南2-1-38,1080
すき家 新座道場店,埼玉県新座市道場2-18-9ﾗｰｸｱﾍﾞﾆｭｰﾀｶﾞｲ1F,1100
すき家 2国福山南本庄店,広島県福山市南本庄2-7-4,1000
すき家 寒川田端店,神奈川県高座郡寒川町田端1445-1,1150
すき家 蔵前駅前店,東京都台東区蔵前2-6-6,1300
すき家 大垣上面店,岐阜県大垣市上面4-1-1,1080
すき家 関雄飛ヶ丘店,岐阜県関市雄飛ヶ丘39-1,1080
すき家 前橋下小出店,群馬県前橋市下小出町1-8-13,1100
すき家 ビアレ横浜並木店,神奈川県横浜市金沢区並木2-13-7,1180
すき家 京成津田沼駅北店,千葉県習志野市津田沼3-9-3,1100
すき家 鹿屋寿店,鹿児島県鹿屋市寿8-20-7,1050
すき家 上池台三丁目店,東京都大田区上池台3-13-3,1300
すき家 171号向日店,京都府向日市鶏冠井町清水7-1,1080
すき家 函館漁火通店,北海道函館市広野町3-3,1000
すき家 南陽警察署西店,山形県南陽市椚塚字山崎1684-1,980
すき家 安城緑町店,愛知県安城市緑町1-17-8,1100
すき家 大森北三丁目店,東京都大田区大森北3-1-13,1300
すき家 足利南大町店,栃木県足利市南大町321-2,1050
すき家 四日市芝田店,三重県四日市市芝田1-5-5,1100
すき家 春日白水店,福岡県春日市白水ヶ丘4-61,950
すき家 奈良七条店,奈良県奈良市七条町164-1,1050
すき家 綱島樽町店,神奈川県横浜市港北区樽町2-1-34,1230
すき家 8号高岡北島店,富山県高岡市北島婦計459-2,1080
すき家 2国明石魚住店,兵庫県明石市魚住町金ヶ崎324-1,1050
すき家 仙台水の森店,宮城県仙台市青葉区水の森3-31-1,1000
すき家 45号東松島矢本店,宮城県東松島市赤井字八反谷地80-7,1000
すき家 イオン千葉NT店,千葉県印西市中央北3-2,1100
すき家 上尾平方店,埼玉県上尾市平方領々家4-1,1100
すき家 西尾永吉店,愛知県西尾市永吉3-74,1100
すき家 197号大分庄境店,大分県大分市庄境4-15,950
すき家 118号常陸大宮泉店,茨城県常陸大宮市泉字中村田462-6,1050
すき家 八代新地町店,熊本県八代市新地町10-2,1000
すき家 枚方招提北店,大阪府枚方市招提北町1-2241-1,1100
すき家 宮前平店,神奈川県川崎市宮前区馬絹1-5-5ｿｱｰﾙｼｰﾉ1Ｆ,1140
すき家 久喜栗原店,埼玉県久喜市栗原2-2-5,1100
すき家 38号釧路鳥取店,北海道釧路市鳥取大通3-4-12,1000
すき家 1国亀山店,三重県亀山市井田川町51-1,1030
すき家 11号徳島川内店,徳島県徳島市川内町平石古田36-2,1020
すき家 10号姶良宮島店,鹿児島県姶良市西餠田522-2,1000
すき家 春日部増田新田店,埼玉県春日部市増田新田93-1,1100
すき家 栃木駅北店,栃木県栃木市境町10-4,1050
すき家 155号稲沢一色店,愛知県稲沢市一色下方町285-3,1100
すき家 1国清水渋川店,静岡県静岡市清水区渋川477-4,1080
すき家 八王子平岡店,東京都八王子市平岡町25-2,1150
すき家 27号小浜店,福井県小浜市遠敷24-26-1,1200
すき家 岡谷若宮店,長野県岡谷市若宮2-5-2,1100
すき家 富士柚木店,静岡県富士市柚木310-1,1100
すき家 環七西新井店,東京都足立区西新井本町2-2-25,1210
すき家 国分野口店,鹿児島県霧島市国分野口東6-16,1050
すき家 豊田美里店,愛知県豊田市美里4-9-7,1200
すき家 笠懸阿左美店,群馬県みどり市笠懸町阿左美630-2,1070
すき家 熊本秋津店,熊本県熊本市東区沼山津3-1-11,980
すき家 富田林川面店,大阪府富田林市川面町2-4-16,1100
すき家 成田江弁須店,千葉県成田市江弁須490-16,1200
すき家 299号入間野田店,埼玉県入間市野田1571-2,1080
すき家 263号佐賀大和IC店,佐賀県佐賀市大和町尼寺3386-1,970
すき家 17号六日町IC東店,新潟県南魚沼市美佐島516-4,1100
すき家 荏原町駅前店,東京都品川区中延5-3-10,1300
すき家 岡山西大寺店,岡山県岡山市東区松新町3-1,1000
すき家 359号婦中店,富山県富山市婦中町下轡田444-1,1080
すき家 菰野ミルクロード店,三重県三重郡菰野町宿野297-3,1100
すき家 鶴岡西新斎店,山形県鶴岡市西新斎町7-9,1100
すき家 西永福店,東京都杉並区永福3-56-30,1200
すき家 和歌山榎原店,和歌山県和歌山市榎原字西塩田215-1,1050
すき家 各務原蘇原店,岐阜県各務原市蘇原瑞穂町2-62-1,1080
すき家 福山多治米店,広島県福山市多治米町5-28-13,1000
すき家 1国草津大路店,滋賀県草津市大路3-138,1050
すき家 静岡下川原店,静岡県静岡市駿河区下川原3-34-7,1100
すき家 日野南平店,東京都日野市南平4-40-1,1150
すき家 広島温品店,広島県広島市東区温品5-9-3,1030
すき家 24号高野口名古曽店,和歌山県橋本市高野口町名古曽948-1,1050
すき家 坂戸にっさい店,埼玉県坂戸市にっさい花みず木3-19-3,1080
すき家 豊橋運動公園前店,愛知県豊橋市豊岡町143-1,1100
すき家 36号清田里塚店,北海道札幌市清田区里塚一条3-2-10,1020
すき家 加古川東神吉店,兵庫県加古川市東神吉町西井ﾉ口284-1,1080
すき家 伊勢上地店,三重県伊勢市上地町3112-3,1080
すき家 21号大垣中野店,岐阜県大垣市中野町78-2,1080
すき家 君津東坂田店,千葉県君津市東坂田2-3-13,1100
すき家 421号八日市店,滋賀県東近江市東沖野1-4-3,1050
すき家 北新横浜店,神奈川県横浜市港北区北新横浜1-4-8,1250
すき家 四日市泊店,三重県四日市市泊町2-34,1100
すき家 倉敷下庄店,岡山県倉敷市下庄619-5,1000
すき家 加西北条店,兵庫県加西市北条町横尾294-1,1080
すき家 5号小樽朝里店,北海道小樽市新光2-1-4,1000
すき家 472号射水店,富山県射水市下条新1482-1,1050
すき家 42号海南店,和歌山県海南市船尾264-1,1050
すき家 139号都留桂店,山梨県都留市桂町876-1,1050
すき家 365号四日市野田店,三重県四日市市野田2-2-34,1100
すき家 135号伊東吉田店,静岡県伊東市吉田346-1,1130
すき家 大和高田神楽店,奈良県大和高田市神楽280-2,1050
すき家 18号安中原市店,群馬県安中市原市612-3,1100
すき家 1国大津瀬田店,滋賀県大津市大江4-5-6,1050
すき家 190号宇部西割店,山口県宇部市大字妻崎開作871-2,970
すき家 本厚木一番街店,神奈川県厚木市中町2-12-1,1130
すき家 伊賀上野店,三重県伊賀市平野中川原484-1,1100
すき家 木曽川店,愛知県一宮市木曽川町黒田字中沼北ﾉ切5-2,1100
すき家 208号柳川店,福岡県柳川市三橋町柳河827-4,950
すき家 十日町店,新潟県十日町市上島601-1,1100
すき家 海老名上河内店,神奈川県海老名市上河内297-3,1150
すき家 藤枝田沼店,静岡県藤枝市田沼4-7-10,1100
すき家 水戸末広町店,茨城県水戸市末広町2-3-7,1050
すき家 三沢緑町店,青森県三沢市緑町3-8-15,1000
すき家 三国本町店,大阪府大阪市淀川区三国本町2-13-14,1120
すき家 天童東芳賀店,山形県天童市東芳賀3-2-15,1000
すき家 寒川宮山店,神奈川県高座郡寒川町宮山3460-1,1150
すき家 三木志染店,兵庫県三木市志染町広野1-263-1,1050
すき家 流山江戸川台店,千葉県流山市美原2-137-1,1070
すき家 神戸鹿の子台店,兵庫県神戸市北区鹿の子台北町8-4-2,1080
すき家 143号上田原店,長野県上田市上田原437-12,1100
すき家 玉造駅前店,大阪府大阪市中央区玉造1-5-8大倉ﾋﾞﾙ,1120
すき家 西脇野村店,兵庫県西脇市野村町1795-192,1080
すき家 郡山鳴神店,福島県郡山市鳴神3-238,960
すき家 北新宿一丁目店,東京都新宿区北新宿1-12-12ｻﾝｴｽﾋﾞﾙ1F,1300
すき家 112号寒河江店,山形県寒河江市高田129-1,1000
すき家 岡山福田店,岡山県岡山市南区福田229-1,1020
すき家 八幡店,京都府八幡市八幡五反田39-4,1080
すき家 34号鳥栖店,佐賀県鳥栖市萱方町177-1,1000
すき家 南草津店,滋賀県草津市野路6-8-22,1050
すき家 おもちゃのまち店,栃木県下都賀郡壬生町壬生丁210-3,1000
すき家 山口大内店,山口県山口市大内千坊五丁目3-2,1000
すき家 大津真野店,滋賀県大津市真野5-36-10,1000
すき家 一関山目店,岩手県一関市山目字寺前46-1,980
すき家 18号小諸店,長野県小諸市諸1-5-11,1100
すき家 宗像赤間店,福岡県宗像市赤間駅前2-2-19,980
すき家 可児下恵土店,岐阜県可児市下恵土字広瀬5890-1-1,1050
すき家 秦野室川橋店,神奈川県秦野市曽屋5788-5,1130
すき家 403号加茂店,新潟県加茂市番田5-20,1000
すき家 泉南中小路店,大阪府泉南市中小路2-383,1100
すき家 389号大牟田店,福岡県大牟田市大正町3-4-3,1000
すき家 厚木長谷店,神奈川県厚木市長谷642-3,1180
すき家 431号境港店,鳥取県境港市財ﾉ木町236-1,1000
すき家 長岡宮内店,新潟県長岡市宮内町字山伏3350-1,1000
すき家 さいたま宿店,埼玉県さいたま市桜区宿135-1,1100
すき家 秋田泉店,秋田県秋田市泉中央1-3-11,960
すき家 新大阪西宮原店,大阪府大阪市淀川区西宮原1-8-41新大阪南愛ﾋﾞﾙ1階,1120
すき家 北上常盤台店,岩手県北上市常盤台2-5-133,1030
すき家 伊勢原桜台店,神奈川県伊勢原市桜台2-13-14,1130
すき家 箕輪BP店,長野県上伊那郡箕輪町中箕輪11338-1,1080
すき家 環八羽田店,東京都大田区羽田4-3-3,1350
すき家 豊栄北陽店,新潟県新潟市北区北陽1-2480-5,980
すき家 169号天理勾田店,奈良県天理市勾田町82-1,1050
すき家 大泉中央店,群馬県邑楽郡大泉町中央1-7-20,1050
すき家 上尾平塚店,埼玉県上尾市平塚1696-1,1100
すき家 416号福井開発店,福井県福井市開発4-309,1050
すき家 鶴里駅南店,愛知県名古屋市南区鶴里町1-61,1100
すき家 荻窪三丁目店,東京都杉並区荻窪3-47-23,1250
すき家 北本荒井店,埼玉県北本市荒井2-413-1,1080
すき家 藤岡IC店,群馬県藤岡市中栗須14-6,1100
すき家 10号大分大学前店,大分県大分市鴛野1373-1,950
すき家 6号北茨城店,茨城県北茨城市関南町神岡上字二ﾂ島26-2,1020
すき家 浜松西IC店,静岡県浜松市中央区湖東町5926-2,1100
すき家 氷上町店,兵庫県丹波市氷上町稲継68-6,1100
すき家 301号湖西店,静岡県湖西市古見字高田984-7,1200
すき家 市原松ヶ島店,千葉県市原市松ヶ島2-18-1,1100
すき家 栗東大宝店,滋賀県栗東市霊仙寺3-8-32,1100
すき家 佐野大橋店,栃木県佐野市大橋町3239-1,1100
すき家 116号吉田店,新潟県燕市吉田字流間3716-3,1030
