すき家 和泉はつが野店,大阪府和泉市はつが野1-1-13,1120
すき家 236号帯広大通店,北海道帯広市大通南3-1-1,1100
すき家 川崎宿河原店,神奈川県川崎市多摩区宿河原4-2-2,1200
すき家 266号宇城松橋店,熊本県宇城市松橋町曲野133-4,1000
すき家 千川駅前店,東京都豊島区要町3-10-10,1250
すき家 天下茶屋駅前店,大阪府大阪市西成区岸里1-1-79とれび天下茶屋,1150
すき家 柏原片山店,大阪府柏原市片山町14-1,1100
すき家 名古屋栄生店,愛知県名古屋市西区栄生1-34-17,1120
すき家 渋谷南平台店,東京都渋谷区南平台町1-10いちご南平台ﾋﾞﾙ1F,1400
すき家 126号山武松尾店,千葉県山武市松尾町八田7-1,1100
すき家 1国岡崎栄町店,愛知県岡崎市栄町5-2-1,1100
すき家 北赤羽駅浮間口店,東京都北区浮間3-28-9,1250
すき家 セントラルパーク店,愛知県名古屋市中区錦3-15-13先ｾﾝﾄﾗﾙﾊﾟｰｸ地下街内,1230
すき家 桜新町駅前店,東京都世田谷区桜新町1-12-13第5吉田ﾋﾞﾙ1F,1300
すき家 那覇真嘉比店,沖縄県那覇市真嘉比3-15-16,1000
すき家 秋葉原駅岩本町店,東京都千代田区岩本町3-3-5秋葉原SHﾋﾞﾙ1F,1300
すき家 名古屋大野木店,愛知県名古屋市西区大野木4-30,1150
すき家 博多駅前四丁目店,福岡県福岡市博多区博多駅前4-3-22産恵ﾋﾞﾙ1F,1000
すき家 331号南城店,沖縄県南城市佐敷津波古1356-2,950
すき家 桜上水駅前店,東京都世田谷区桜上水4-10-16間瀬ﾋﾞﾙ１F,1250
すき家 247号美浜店,愛知県知多郡美浜町新浦戸1-11-4,1080
すき家 防府新田店,山口県防府市大字新田573-1,1050
すき家 妙法寺駅前店,兵庫県神戸市須磨区横尾1-5ﾘﾌｧｰﾚ横尾1F,1050
すき家 博多ＢＰ店,福岡県福岡市東区原田3-9-22,1000
すき家 新越谷駅東口店,埼玉県越谷市南越谷1-17-11新越谷ﾌﾟﾗｻﾞﾋﾞﾙ1F,1100
すき家 京王リトナード東府中店,東京都府中市清水ヶ丘1-8-3京王ﾘﾄﾅｰﾄﾞ東府中1Ｆ,1200
すき家 10号都城都北店,宮崎県都城市都北町5928-1,1000
すき家 255号大井松田店,神奈川県足柄上郡大井町金子1627-1,1180
すき家 足利葉鹿店,栃木県足利市葉鹿町1-29-3,1070
すき家 うるま前原店,沖縄県うるま市前原169-4-3,960
すき家 福岡渡辺通五丁目店,福岡県福岡市中央区渡辺通5-2-27,1000
すき家 船橋三咲店,千葉県船橋市三咲4-19-1,1080
すき家 212号日田店,大分県日田市南元町20-7,1000
すき家 42号尾鷲店,三重県尾鷲市倉ノ谷町1034-40,1150
すき家 156号岐阜芥見店,岐阜県岐阜市芥見長山3-8-3,1000
すき家 1国鶴見下末吉店,神奈川県横浜市鶴見区下末吉4-4-18ｺｰﾎﾟ鶴石1F,1250
すき家 茨木IC店,大阪府茨木市郡4-11-36,1100
すき家 235号静内店,北海道日高郡新ひだか町静内末広町2-1-20,1080
すき家 29号宍粟店,兵庫県宍粟市山崎町今宿字中筋98-14,1100
すき家 4号小山間々田店,栃木県小山市間々田五料2416-5,1000
すき家 西宮北IC店,兵庫県西宮市山口町下山口3-5-23,1080
すき家 貝塚北町店,大阪府貝塚市北町17-15,1120
すき家 新青梅街道東村山店,東京都東村山市富士見町3-2-1,1180
すき家 文京白山店,東京都文京区向丘1-10-4,1250
すき家 324号天草店,熊本県天草市小松原町7-12,1000
すき家 川口駅東口店,埼玉県川口市栄町3-9-13K21ﾋﾞﾙ1F,1130
すき家 内環状新深江店,大阪府大阪市東成区深江南2-12-22,1100
すき家 310号大阪狭山店,大阪府大阪狭山市東茱萸木1-691-1,1100
すき家 イオンモール茨木店,大阪府茨木市松ヶ本町8-30-3ｲｵﾝ茨木店1F,1100
すき家 26号西住之江店,大阪府大阪市住之江区西住之江1-9-21,1100
すき家 329号西原店,沖縄県中頭郡西原町字我謝786-2,1000
すき家 西鉄久留米駅前店,福岡県久留米市東町1-5,980
すき家 勝どき三丁目店,東京都中央区勝どき3-7-6,1300
すき家 東淀川大桐店,大阪府大阪市東淀川区大桐1-7-8,1120
すき家 183号広島可部店,広島県広島市安佐北区可部7-1-26,1020
すき家 浦和仲町店,埼玉県さいたま市浦和区仲町1-4-12誠志堂ﾋﾞﾙ1F,1150
すき家 印西西の原店,千葉県印西市草深字天王前1048-7,1150
すき家 札幌屯田店,北海道札幌市北区屯田六条4-4-20,1020
すき家 横須賀中央店,神奈川県横須賀市若松町1-4味ﾋﾞﾙ1F,1200
すき家 浅草六区店,東京都台東区浅草2-9-14木村ﾋﾞﾙ1F,1300
すき家 都島本通店,大阪府大阪市都島区都島本通3-20-1,1120
すき家 周南久米店,山口県周南市大字久米1142-1,1100
すき家 所沢下新井店,埼玉県所沢市下新井1454-3,1100
すき家 499号長崎江川町店,長崎県長崎市柳田町28-1,970
すき家 184号尾道店,広島県尾道市栗原西2-7-14,1000
すき家 阪急園田駅前店,兵庫県尼崎市東園田町9-17-16ﾒｿﾞﾝ･ﾄﾞｩ･ﾌｧﾐﾘｰ1F,1100
すき家 堺高須店,大阪府堺市堺区高須町2-1-16,1100
すき家 221号小林店,宮崎県小林市堤3013-1,970
すき家 上越高土店,新潟県上越市高土町1-1-4,1100
すき家 伏見通り栄店,愛知県名古屋市中区栄1-24-7,1200
すき家 135号下田店,静岡県下田市柿崎字間戸浜6-22,1200
すき家 東高円寺駅前店,東京都杉並区高円寺南1-7-1陽輪台高円寺1F,1250
すき家 16号千葉北IC店,千葉県千葉市稲毛区長沼町135-4,1100
すき家 42号有田店,和歌山県有田市宮崎町34-1,1050
すき家 築地四丁目店,東京都中央区築地4-12-2ｼｸﾞﾈｯﾄﾋﾞﾙ1F,1300
すき家 横浜日野中央店,神奈川県横浜市港南区日野中央2-42-1,1230
すき家 松山大街道店,愛媛県松山市大街道2-5-6だるまやﾋﾞﾙ1F,1000
すき家 新座駅前店,埼玉県新座市野火止5-3-11,1100
すき家 鳩ヶ谷里店,埼玉県川口市里466-1,1100
すき家 堺筋本町店,大阪府大阪市中央区本町1-7-1三星本町ﾋﾞﾙ1F,1200
すき家 毛呂山小田谷店,埼玉県入間郡毛呂山町大字小田谷220-1,1080
すき家 港南二丁目店,東京都港区港南2-4-7石橋ﾋﾞﾙ1F,1380
すき家 161号安曇川店,滋賀県高島市安曇川町青柳1199-1,1050
すき家 伊勢崎連取店,群馬県伊勢崎市連取町1804-2,1050
すき家 仙台定禅寺通店,宮城県仙台市青葉区一番町4-11-1-101,1000
すき家 小平上水本町店,東京都小平市上水本町4-12-7,1200
すき家 219号人吉店,熊本県人吉市下薩摩瀬町1587-5,950
すき家 六本木五丁目店,東京都港区六本木5-9-22第2千陽ﾋﾞﾙ1F,1380
すき家 広島堀越店,広島県広島市南区堀越2-3-7,1100
すき家 梅田茶屋町店,大阪府大阪市北区茶屋町1-52ｺﾓﾄﾞ梅田ﾋﾞﾙ1F,1220
すき家 磐田一言店,静岡県磐田市一言2626-1,1080
すき家 高円寺駅南口店,東京都杉並区高円寺南4-45-2ﾒｲﾝﾛｰﾄﾞﾋﾞﾙ1F,1300
すき家 10号宮崎島之内店,宮崎県宮崎市大字島之内997-1,970
すき家 高知本町店,高知県高知市本町1-2-1白木ﾋﾞﾙ1F,1020
すき家 安城桜井店,愛知県安城市桜井町山ノ寺61-3,1100
すき家 八王子東町店,東京都八王子市東町5-5,1150
すき家 上前津駅南店,愛知県名古屋市中区上前津1-4-12上前津ｸﾞﾘｰﾝﾋﾞﾙ,1200
すき家 小倉北神岳店,福岡県北九州市小倉北区神岳2-6-30,1000
すき家 17号沼田店,群馬県沼田市硯田町590-5,1120
すき家 等々力駅前店,東京都世田谷区等々力3-5-6,1250
すき家 川崎塩浜店,神奈川県川崎市川崎区四谷下町1-3,1300
すき家 151号新城店,愛知県新城市稲木字仲野69-10,1100
すき家 横須賀野比店,神奈川県横須賀市野比1-4-25,1130
すき家 新座大和田店,埼玉県新座市大和田4-14-7,1100
すき家 神保町駅前店,東京都千代田区神田神保町1-14KDX神保町ﾋﾞﾙ1F,1350
すき家 武蔵小金井北口店,東京都小金井市本町5-18-5第55東京ﾋﾞﾙ,1200
すき家 鴨居駅北口店,神奈川県横浜市緑区鴨居1-15-13,1200
すき家 名古屋古出来店,愛知県名古屋市東区古出来1-5-10,1120
すき家 294号那須烏山店,栃木県那須烏山市城東21-1,1150
すき家 高知中万々店,高知県高知市中万々27-1,1000
すき家 中川山王駅前店,愛知県名古屋市中川区山王3-13-14,1100
すき家 463号BP所沢上新井店,埼玉県所沢市上新井3-1-3,1080
すき家 東京駅京橋店,東京都中央区京橋1-1-9ﾚｵ八重洲ﾋﾞﾙ,1350
すき家 東海加木屋店,愛知県東海市加木屋町大清水77-1,1100
すき家 香里園駅前店,大阪府寝屋川市香里南之町20-23,1100
すき家 294号真岡東光寺店,栃木県真岡市東光寺1-25-10,1080
すき家 綱島駅西口店,神奈川県横浜市港北区綱島西1-10-10第5吉田ビル1F,1230
すき家 西日暮里一丁目店,東京都荒川区西日暮里1-1-1ﾊﾟﾚｽいしかわ1F,1250
すき家 東久留米下里店,東京都東久留米市下里2-6-7,1180
すき家 ベイドリーム清水店,静岡県静岡市清水区駒越北町8-3,1120
すき家 496号行橋店,福岡県行橋市西宮市4-2-11,1050
すき家 枚方山之上店,大阪府枚方市山之上北町1-8,1100
すき家 中村烏森店,愛知県名古屋市中村区烏森町6-195,1100
すき家 11号高松春日店,香川県高松市春日町1626-1,1000
すき家 17号さいたま辻店,埼玉県さいたま市南区辻3-2-28,1150
すき家 3号黒崎店,福岡県北九州市八幡西区熊西2-1-29,950
すき家 玉津IC南店,兵庫県神戸市西区小山3-13-13,1080
すき家 名東大針店,愛知県名古屋市名東区大針3-3,1100
すき家 20号笛吹一宮店,山梨県笛吹市一宮町東原25-1,1070
すき家 豊洲四丁目店,東京都江東区豊洲4-8-14,1300
すき家 豊中浜店,大阪府豊中市浜4-3-7-2,1100
すき家 名鉄岐阜駅前店,岐阜県岐阜市神田町9-14,1030
すき家 西新宿五丁目駅前店,東京都新宿区西新宿4-3-12渡辺西新宿ビル1F,1350
すき家 325号菊池店,熊本県菊池市隈府字北原597-2,980
すき家 1国緑区境松店,愛知県名古屋市緑区境松1-327-1,1100
すき家 1国城東関目店,大阪府大阪市城東区関目5-3-3,1150
すき家 イオン那覇店,沖縄県那覇市金城5-10-2ｲｵﾝ那覇1F,970
すき家 アリオ上田店,長野県上田市天神3-5-1ｱﾘｵ上田ﾌｰﾄﾞｺｰﾄ2F,1050
すき家 みらい長崎ココウォーク店,長崎県長崎市茂里町1-55みらい長崎ｺｺｳｫｰｸ3F,950
すき家 八王子みなみ野駅前店,東京都八王子市みなみ野1-3-1,1150
すき家 大国町駅前店,大阪府大阪市浪速区敷津東3-11-10AKI難波ﾋﾞﾙ1F,1150
すき家 神宮前三丁目店,東京都渋谷区神宮前3-23-3ﾄﾘﾆﾃｨﾋﾞﾙ1F,1380
すき家 赤坂六丁目店,東京都港区赤坂6-3-1ｱｽﾓﾋﾞﾙ,1380
すき家 石狩花川店,北海道石狩市花川南6条1-11-50,1020
すき家 155号知多新舞子店,愛知県知多市旭南2-48-1,1100
すき家 静岡八幡店,静岡県静岡市駿河区八幡2-14-16,1100
すき家 高田馬場駅北店,東京都豊島区高田3-15-7第1大島ビル1F,1300
すき家 蓮田西新宿店,埼玉県蓮田市西新宿2-105,1100
すき家 馬込沢駅前店,千葉県船橋市藤原7-2-2Ｌｕｚ船橋1Ｆ,1100
すき家 車道駅前店,愛知県名古屋市東区筒井3-26-25第29ｵｰｼｬﾝﾋﾞﾙ1F,1120
すき家 西千葉駅前店,千葉県千葉市中央区春日2-25-1竹久ビル1F,1080
すき家 1国横浜権太坂店,神奈川県横浜市保土ヶ谷区狩場町218-21,1200
すき家 サカエチカ店,愛知県名古屋市中区栄3-4-6先路下の地下街路付設北第１号,1230
すき家 新青梅街道花小金井店,東京都小平市花小金井3-21-14,1180
すき家 生野巽東店,大阪府大阪市生野区巽東3-13-10,1120
すき家 大和りんかんモール店,神奈川県大和市中央林間7丁目6-1,1250
すき家 練馬南大泉店,東京都練馬区南大泉1-17-17,1250
すき家 高槻下田部店,大阪府高槻市下田部町1-3-28,1100
すき家 八千代村上店,千葉県八千代市村上南3-2-4,1080
すき家 10号宇佐店,大分県宇佐市大字辛島286-1,980
すき家 横浜羽衣町店,神奈川県横浜市中区羽衣町2-8-5ﾎﾃﾙα-1横浜関内1F,1200
すき家 グリナード永山店,東京都多摩市永山1-4ｸﾞﾘﾅｰﾄﾞ永山1F,1150
すき家 朝倉甘木店,福岡県朝倉市一木626-1,1000
すき家 富山五福店,富山県富山市五福字中割2325-3,1030
すき家 248号幸田大草店,愛知県額田郡幸田町大字大草字検行132-2,1100
すき家 3号八女店,福岡県八女市本村字荷稲559-1,1000
すき家 日本橋小伝馬町店,東京都中央区日本橋小伝馬町15-18EDGE小伝馬町ﾋﾞﾙ1F,1300
すき家 西葛西駅前店,東京都江戸川区西葛西6-8-11葛西産業ﾋﾞﾙ,1250
すき家 八幡東枝光店,福岡県北九州市八幡東区枝光1-5,1000
すき家 世田谷赤堤通り店,東京都世田谷区桜上水2-1-8,1250
すき家 258号多度店,三重県桑名市多度町香取284-2,1100
すき家 14号江戸川松江店,東京都江戸川区松江1-8-8,1210
すき家 8号加賀加茂店,石川県加賀市加茂町チ65-1,1050
すき家 不動前駅西店,東京都品川区西五反田4-29-14ｵｻﾞﾜSANTﾋﾞﾙ1F,1300
すき家 門真下馬伏店,大阪府門真市下馬伏町26-6,1150
すき家 297号大多喜店,千葉県夷隅郡大多喜町船子311-3,1080
すき家 大正泉尾店,大阪府大阪市大正区泉尾5-1-4,1150
すき家 成城学園駅前店,東京都世田谷区成城2-35-12,1300
すき家 川越笠幡店,埼玉県川越市笠幡181-1,1080
すき家 柏増尾台店,千葉県柏市増尾台4-13-4,1100
すき家 広島高取北店,広島県広島市安佐南区高取北1-2-32,1000
すき家 港区小割通店,愛知県名古屋市港区小割通2-33,1150
すき家 414号沼津三枚橋店,静岡県沼津市三枚橋町10-1,1080
すき家 豊中熊野町店,大阪府豊中市熊野町1-7-15,1100
すき家 江田駅前店,神奈川県横浜市青葉区荏田町2364-1,1200
すき家 三好莇生店,愛知県みよし市莇生町川向29-1,1180
すき家 浜松入野店,静岡県浜松市中央区入野町6148-1,1100
すき家 足立入谷店,東京都足立区入谷7-1-7ﾌｰﾌｧｲｾﾞﾝﾊｳｽ1F,1210
すき家 西淀川大和田店,大阪府大阪市西淀川区大和田2-1-17,1120
すき家 19号瑞浪店,岐阜県瑞浪市穂並1-64,1100
すき家 1国三島谷田店,静岡県三島市谷田60-1,1130
すき家 野田花井店,千葉県野田市花井200-1,1150
すき家 39号北見大町店,北海道北見市大町21-1,1030
すき家 四ツ橋駅前店,大阪府大阪市西区北堀江1-7-12四ツ橋北堀江ﾋﾞﾙ1F,1150
すき家 日野大坂上店,東京都日野市大坂上1-29-2-1,1150
すき家 水戸駅南口店,茨城県水戸市宮町1-7-44COMBOX310-302号室,1050
すき家 札幌ポールタウン店,北海道札幌市中央区南三条西3-10さっぽろ地下街ﾎﾟｰﾙﾀｳﾝ,1020
すき家 道頓堀一丁目店,大阪府大阪市中央区道頓堀1-1-11K-24ﾋﾞﾙ1F,1200
すき家 蒲郡三谷北通店,愛知県蒲郡市三谷北通2-122,1100
すき家 葛飾東新小岩店,東京都葛飾区東新小岩2-2-8,1210
すき家 東大宮駅前店,埼玉県さいたま市見沼区東大宮5-1-2東大宮東口扶桑ﾋﾞﾙ1Ｆ,1100
すき家 新宿二丁目店,東京都新宿区新宿2-15-15新宿ﾔﾏﾄﾋﾞﾙ1F,1330
すき家 宇治東IC店,京都府宇治市菟道西隼上り1-26,1100
すき家 イーアスつくば店,茨城県つくば市研究学園5-19ｲｰｱｽつくばｼｮｯﾋﾟﾝｸﾞｾﾝﾀｰ3F,1050
すき家 1国静岡馬渕店,静岡県静岡市駿河区馬渕1-17-38,1100
すき家 高松寿町店,香川県高松市寿町1-4-3高松中央通りﾋﾞﾙ1F,1100
すき家 49号郡山菜根店,福島県郡山市字菜根屋敷59-22,950
すき家 263号福岡野芥店,福岡県福岡市早良区野芥4-45-5,980
すき家 2国広島東雲店,広島県広島市南区東雲3-13-6,1100
すき家 126号千葉弁天店,千葉県千葉市中央区弁天4-11-26,1080
すき家 一宮駅前店,愛知県一宮市栄3-7-1石照ﾋﾞﾙ1F,1100
すき家 武蔵小金井南口店,東京都小金井市本町6-14-45O.Sﾋﾞﾙ1Ｆ,1200
すき家 八潮南川崎店,埼玉県八潮市南川崎590-1,1100
すき家 西宮今津巽店,兵庫県西宮市今津巽町4-37,1080
すき家 川越諏訪町店,埼玉県川越市諏訪町16-13,1080
すき家 ライフガーデン新浦安店,千葉県浦安市富岡3-2-1,1200
すき家 須磨車店,兵庫県神戸市須磨区車字奥中ノ尾767-1,1150
すき家 群馬吉井町店,群馬県高崎市吉井町池46-4,1050
すき家 イオンモール浜松市野店,静岡県浜松市中央区天王町字諏訪1981-3ｲｵﾝﾓｰﾙ浜松市野ｼｮｯﾋﾟﾝｸﾞｾﾝﾀｰ2F,1100
すき家 16号上尾瓦葺店,埼玉県上尾市瓦葺708-1,1100
すき家 アキバ田代通り店,東京都千代田区外神田4-5-8松孝商事ﾋﾞﾙ1F,1300
すき家 松戸六高台店,千葉県松戸市六高台1-71,1080
すき家 日高鹿山店,埼玉県日高市鹿山247-5,1080
すき家 宇都宮インターパーク店,栃木県宇都宮市ｲﾝﾀｰﾊﾟｰｸ6-5-2,1150
すき家 横浜善部町店,神奈川県横浜市旭区善部町16-1,1200
すき家 調布入間店,東京都調布市入間町2-4-1,1200
すき家 23号南区元塩店,愛知県名古屋市南区元塩町1-5-7,1120
すき家 中川篠原橋通店,愛知県名古屋市中川区篠原橋通3-4,1120
すき家 八街稲荷丘店,千葉県八街市八街ほ945-84,1080
すき家 4号盛岡上田店,岩手県盛岡市上田4-20-47,950
すき家 浅草橋駅前店,東京都台東区柳橋1-23-3田中ﾋﾞﾙ1F,1300
すき家 17号魚沼店,新潟県魚沼市井口新田277-1,1050
すき家 綾瀬駅南店,東京都葛飾区小菅4-10-2,1220
すき家 知多つつじが丘店,愛知県知多市つつじが丘1-19-11,1100
すき家 川崎木月店,神奈川県川崎市中原区木月3-53-7,1220
すき家 川崎藤崎店,神奈川県川崎市川崎区藤崎4-19-3,1300
すき家 4号矢板店,栃木県矢板市中691-1,1000
すき家 42号新宮神倉店,和歌山県新宮市神倉3-1291-1,1100
すき家 1国横浜不動坂店,神奈川県横浜市戸塚区柏尾町928-1,1200
すき家 東村山秋津店,東京都東村山市秋津町3-47-3,1180
すき家 ４号越谷大間野店,埼玉県越谷市大間野町2-207-4,1100
すき家 下関赤間店,山口県下関市赤間町3-35,1020
すき家 153号日進赤池店,愛知県日進市浅田町笹原8-11,1150
すき家 31号呉海岸通り店,広島県呉市海岸1-7-12,1000
すき家 豊田堤本町店,愛知県豊田市堤本町本地8-3,1180
すき家 105号大仙北長野店,秋田県大仙市北長野字道ノ下117-1,950
すき家 サンライズ蒲田店,東京都大田区西蒲田7-51-2ﾍﾞﾙｺｰｻ1F,1300
すき家 神戸キャンパススクエア店,兵庫県神戸市西区学園西町1-4,1050
すき家 50号岩舟静店,栃木県栃木市岩舟町静2167-1,1120
すき家 葛飾亀有一丁目店,東京都葛飾区亀有1-14-5,1220
すき家 足立鹿浜店,東京都足立区鹿浜2-34-17,1210
すき家 十和田元町店,青森県十和田市元町東1-2-19,940
すき家 代々木一丁目店,東京都渋谷区代々木1-37-6,1350
すき家 北谷国体道路店,沖縄県中頭郡北谷町上勢頭544-6,1000
すき家 153号天白植田西店,愛知県名古屋市天白区植田西3-902,1150
すき家 清水IC店,静岡県静岡市清水区八坂東2-16-21,1080
すき家 府中栄店,東京都府中市栄町2-22-1,1200
すき家 さいたま本郷町店,埼玉県さいたま市北区本郷町689-1,1120
すき家 小田原扇町店,神奈川県小田原市扇町2-5-9,1150
すき家 140号秩父野坂店,埼玉県秩父市野坂町2-1-21,1080
すき家 16号相模原橋本店,神奈川県相模原市緑区橋本2-22-18,1130
すき家 和歌山秋月店,和歌山県和歌山市秋月304-5,1050
すき家 環八高井戸店,東京都杉並区高井戸西1-1-28,1250
すき家 千葉蘇我店,千葉県千葉市中央区南町1-2-9,1080
すき家 緑区鳴海店,愛知県名古屋市緑区浦里3-317,1150
すき家 大田東邦医大通店,東京都大田区大森西1-8-17,1300
すき家 春日部ユリノキ通り店,埼玉県春日部市大沼4-19,1100
すき家 太宰府向佐野店,福岡県太宰府市向佐野3-3-35,1000
すき家 堺黒土店,大阪府堺市北区黒土町2355-1,1120
すき家 8号金沢福久店,石川県金沢市福久東1-37,1050
すき家 名古屋品川町店,愛知県名古屋市港区品川町1-2-3,1150
すき家 青梅新町店,東京都青梅市新町7-6-10,1150
すき家 仙台泉中央店,宮城県仙台市泉区泉中央1-1-4,1000
すき家 摂津鳥飼中店,大阪府摂津市鳥飼中2-2-50,1150
すき家 京阪枚方市駅前店,大阪府枚方市岡本町3-4N´sSquare1F,1100
すき家 戸塚駅西口店,神奈川県横浜市戸塚区戸塚町4080-1LEON-K1F,1200
すき家 鹿島田駅前店,神奈川県川崎市幸区鹿島田1丁目18-6KSﾋﾞﾙ1F,1200
すき家 宮原駅東口店,埼玉県さいたま市北区宮原町3-321杉ﾋﾞﾙ・21Ｆ,1100
すき家 12号岩見沢店,北海道岩見沢市九条西10-1-39,1000
すき家 川口芝店,埼玉県川口市芝宮根町7-2,1130
すき家 37号室蘭中島店,北海道室蘭市中島町2-6-12,1000
すき家 鹿児島下荒田店,鹿児島県鹿児島市下荒田1-2-1,970
すき家 東大阪菱屋西店,大阪府東大阪市菱屋西6-9-15,1100
すき家 さいたま与野本町店,埼玉県さいたま市中央区鈴谷9-10-4,1200
すき家 4号矢吹店,福島県西白河郡矢吹町新町205-1,1050
すき家 1国藤沢辻堂店,神奈川県藤沢市辻堂神台2-8-17,1200
すき家 204号佐世保田原店,長崎県佐世保市田原町17-23,970
すき家 立売堀二丁目店,大阪府大阪市西区立売堀2-4-6DGﾋﾞﾙなにわ筋1Ｆ,1200
すき家 宮崎東大淀店,宮崎県宮崎市東大淀2-3-41,980
すき家 港北箕輪町店,神奈川県横浜市港北区箕輪町2-5-5,1230
すき家 内環状守口太子橋店,大阪府守口市緑町3-12,1120
すき家 江東新砂店,東京都江東区新砂3-2-6SGHﾚｼﾞﾃﾞﾝｽ新砂1Ｆ,1300
すき家 桜川駅前店,大阪府大阪市浪速区幸町2-8-8常盤機械ﾋﾞﾙ1Ｆ,1150
すき家 開成店,神奈川県足柄上郡開成町吉田島783-1,1150
すき家 川崎南加瀬店,神奈川県川崎市幸区南加瀬4-16-9,1250
すき家 2国明石天文町店,兵庫県明石市天文町1-8-6,1080
すき家 福島西BP店,福島県福島市東中央3-47-2,980
すき家 横浜南幸二丁目店,神奈川県横浜市西区南幸2-9-16第8浅川ﾋﾞﾙ1Ｆ,1300
すき家 鶴ヶ峰駅前店,神奈川県横浜市旭区鶴ヶ峰2-82-1ｺｺﾛｯﾄ鶴ヶ峰1F,1200
すき家 507号八重瀬店,沖縄県島尻郡八重瀬町字伊覇46-4,1000
すき家 近畿大学店,大阪府東大阪市新上小阪5-86近畿大学Eｷｬﾝﾊﾟｽ構内,1100
すき家 303号大野店,岐阜県揖斐郡大野町大字中之元字下姥田928-4,1080
すき家 環七山王店,東京都大田区山王4-12-4,1300
すき家 越谷相模町店,埼玉県越谷市相模町1-233-1,1100
すき家 船橋夏見台店,千葉県船橋市夏見台5-9-1,1100
すき家 足立扇店,東京都足立区扇2-26-42,1210
すき家 甲州街道柴崎店,東京都調布市菊野台1-47-1,1200
すき家 阪急伊丹店,兵庫県伊丹市中央1-6-14,1080
すき家 津上浜町店,三重県津市上浜町6-101-3,980
すき家 170号熊取店,大阪府泉南郡熊取町紺屋2-5-5,1100
すき家 竹芝店,東京都港区海岸1-9-11,1380
すき家 福山蔵王店,広島県福山市南蔵王町5-16-23,1000
すき家 大阪鶴見今津北店,大阪府大阪市鶴見区今津北4-4-3,1100
すき家 岐阜本荘店,岐阜県岐阜市鹿島町6-3-2,1080
すき家 札幌北野店,北海道札幌市清田区北野七条3-5-5,1020
すき家 下赤塚駅前店,東京都板橋区赤塚新町1-23-5ﾌﾟﾛｽﾊﾟｰﾋﾞﾙ上野1Ｆ,1250
すき家 谷町三丁目店,大阪府大阪市中央区谷町3-5-5ｱｲﾄﾞｭﾋﾞﾙ1F,1200
すき家 413号津久井三ケ木店,神奈川県相模原市緑区三ケ木405-1,1130
すき家 170号寝屋川高宮店,大阪府寝屋川市高宮1-10-27,1100
すき家 19号多治見音羽店,岐阜県多治見市音羽町4-1,1130
すき家 姫路中地店,兵庫県姫路市飾磨区構2-112,1050
すき家 南港通り北加賀屋店,大阪府大阪市住之江区北加賀屋2-11-8北加賀屋千島ﾋﾞﾙ,1150
すき家 新小岩店,東京都葛飾区西新小岩1-9-7,1210
すき家 奈良富雄店,奈良県奈良市三碓7-1-23,1050
すき家 池袋サンシャイン前店,東京都豊島区東池袋4-25-9ﾀｲﾑｽﾞｽﾃｰｼｮﾝ池袋,1300
すき家 大宮桜木町店,埼玉県さいたま市大宮区桜木町2-362ｼﾝﾒｲ桜木ﾋﾞﾙ1F,1200
すき家 仙台広瀬通一番町店,宮城県仙台市青葉区一番町4-3-1菅原酒店ﾋﾞﾙ1Ｆ,1000
すき家 188号光浅江店,山口県光市浅江1-11-7,1050
すき家 17号BP戸田美女木店,埼玉県戸田市美女木7-1-1,1100
すき家 330号浦添内間店,沖縄県浦添市内間2-6-9,980
