すき家 42号田辺店,和歌山県田辺市下万呂362-2,1100
すき家 津IC店,三重県津市西古河町19-13,1030
すき家 151号豊川IC店,愛知県豊川市大橋町2-1,1100
すき家 大田久が原店,東京都大田区久が原5-3-6,1300
すき家 八丁堀四丁目店,東京都中央区八丁堀4-8-2いちご桜橋ﾋﾞﾙ1F,1330
すき家 4号下野笹原店,栃木県下野市笹原83-1,1000
すき家 川崎潮見台店,神奈川県川崎市宮前区潮見台10-2,1200
すき家 11号高松檀紙店,香川県高松市檀紙町1513-5,1050
すき家 成田取香店,千葉県成田市取香529-1,1350
すき家 4号福島伊達店,福島県伊達市鍛治屋川27-1,980
すき家 札幌北33条店,北海道札幌市北区北三十三条西4-1-12,1020
すき家 尼崎浜田店,兵庫県尼崎市浜田4-41-1,1050
すき家 さいたま領家店,埼玉県さいたま市浦和区領家4-14-5,1150
すき家 太田内ヶ島店,群馬県太田市内ヶ島町1492-5,1110
すき家 小樽有幌店,北海道小樽市有幌町2-14,1000
すき家 豊田吉原店,愛知県豊田市吉原町向イ野8-5,1180
すき家 堺筋恵美須町店,大阪府大阪市浪速区日本橋5-13-18ﾌｫﾚｼﾃｨ日本橋V1F,1150
すき家 19号松本村井店,長野県松本市村井町北2-8-45,1100
すき家 フォレオせんだい宮の杜店,宮城県仙台市宮城野区東仙台4-14-3,1000
すき家 155号津島店,愛知県津島市申塚町2-143-1,1100
すき家 フレスポ若葉台店,東京都稲城市若葉台2-1-1,1150
すき家 柏松葉町店,千葉県柏市松葉町7-36-1,1080
すき家 ウィラ大井店,東京都品川区勝島1-6-16,1350
すき家 122号騎西店,埼玉県加須市騎西字高道460-1,1080
すき家 40号名寄店,北海道名寄市西四条南10-56-1,1020
すき家 愛知学院大学前店,愛知県長久手市長配2-601,1100
すき家 329号北中城店,沖縄県中頭郡北中城村字渡口456-3,980
すき家 阪神野田駅前店,大阪府大阪市福島区海老江1-1-17野田ｱﾌﾟﾗ105,1200
すき家 41号豊山店,愛知県西春日井郡豊山町青山字江川73-1,1150
すき家 港南台店,神奈川県横浜市港南区港南台4-3-1ﾋﾞ-ﾊﾞ-ﾋﾞﾙ1F,1160
すき家 52号甲府宝店,山梨県甲府市宝2-25-8,1070
すき家 上尾駅西口店,埼玉県上尾市谷津2-1-41,1100
すき家 289号三条東裏館店,新潟県三条市東裏館3-1-7,1050
すき家 16号横浜下白根店,神奈川県横浜市旭区川島町2846-5,1200
すき家 288号田村店,福島県田村市船引町船引字舘柄前89-1,980
すき家 姫路南条店,兵庫県姫路市南条191-1,1100
すき家 168号生駒壱分店,奈良県生駒市有里町108-1,1050
すき家 目白通り高野台店,東京都練馬区高野台2-5-15,1250
すき家 14号江戸川篠崎店,東京都江戸川区篠崎町7-1-17,1210
すき家 静岡松富店,静岡県静岡市葵区松富2-1-51,1100
すき家 18号上田大屋店,長野県上田市大屋347-8,1150
すき家 環状4号泉区和泉店,神奈川県横浜市泉区下和泉1-4-3,1160
すき家 東白楽駅前店,神奈川県横浜市神奈川区白楽4-6ﾊ-ﾄﾋﾞﾙ,1140
すき家 松戸古ヶ崎店,千葉県松戸市古ヶ崎764-1,1080
すき家 16号木更津貝渕店,千葉県木更津市貝渕4-10-10,1100
すき家 西九条駅前店,大阪府大阪市此花区西九条4-3-39村本ﾋﾞﾙ1F,1150
すき家 長崎銅座町店,長崎県長崎市銅座町6-1銅座松尾ﾋﾞﾙ1F,1000
すき家 川西火打店,兵庫県川西市火打2-9-23,1050
すき家 150号御前崎浜岡店,静岡県御前崎市池新田字下水神7625-2,1080
すき家 大船駅前店,神奈川県鎌倉市大船1-5-9ｲﾄｰﾋﾞﾙ1F,1200
すき家 住吉長居公園通店,大阪府大阪市住吉区長居東1-31,1120
すき家 福井日光店,福井県福井市日光2-27-13,1000
すき家 高崎棟高店,群馬県高崎市棟高町1868-113,1080
すき家 天神橋二丁目店,大阪府大阪市北区天神橋2-4-14盛岡ﾋﾞﾙ1F,1200
すき家 瑞穂弥富通店,愛知県名古屋市瑞穂区弥富通5-31,1150
すき家 垂水塩屋北店,兵庫県神戸市垂水区朝谷町20-7,1060
すき家 35号佐世保大和店,長崎県佐世保市大和町749-1,970
すき家 岡山大学前店,岡山県岡山市北区学南町2-811-1ﾒｿﾞﾝ仏蘭西1F,980
すき家 長吉出戸店,大阪府大阪市平野区長吉出戸5-3-62,1100
すき家 中村黄金通店,愛知県名古屋市中村区黄金通2-55,1100
すき家 川崎下麻生店,神奈川県川崎市麻生区下麻生3-46-6,1230
すき家 新田市野井店,群馬県太田市新田市野井町771-1,1060
すき家 248号岡崎岩津店,愛知県岡崎市岩津町字新城107-7,1150
すき家 41号下呂店,岐阜県下呂市萩原町上呂字堂前1624-1,1150
すき家 豊岡野田店,兵庫県豊岡市野田95-1,1120
すき家 小牧春日寺店,愛知県小牧市春日寺2-329,1080
すき家 浜松三方原店,静岡県浜松市中央区三方原町795-5,1100
すき家 愛川中津店,神奈川県愛甲郡愛川町中津160-1,1150
すき家 京都太秦店,京都府京都市右京区常盤東ノ町6-3,1050
すき家 26号岸和田下池田店,大阪府岸和田市下池田町1-2-3,1100
すき家 緑区平手北店,愛知県名古屋市緑区平手北1-920,1150
すき家 1国浜松卸本町店,静岡県浜松市中央区卸本町103-1,1100
すき家 狭山広瀬店,埼玉県狭山市広瀬2-35-12,1100
すき家 199号若松東二島店,福岡県北九州市若松区東二島3-2-45,950
すき家 浜松鍛冶町店,静岡県浜松市中央区鍛冶町320-20有楽ﾋﾞﾙ1F,1100
すき家 41号大口店,愛知県丹羽郡大口町中小口3-72-1,1150
すき家 248号岡崎上六名店,愛知県岡崎市上六名町2-7-7,1100
すき家 横浜山下町店,神奈川県横浜市中区山下町195-3,1200
すき家 弘前中野店,青森県弘前市中野2-1-6,920
すき家 梅田太融寺店,大阪府大阪市北区太融寺町5-8ﾀﾞｲﾔﾓﾝﾄﾞﾚｼﾞｬ-ﾋﾞﾙ本館1F,1220
すき家 狭山富士見店,埼玉県狭山市富士見1-16-24,1100
すき家 25号八尾永畑店,大阪府八尾市永畑町1-2-58,1100
すき家 上石神井駅前店,東京都練馬区上石神井1-13-17,1250
すき家 福岡舞鶴店,福岡県福岡市中央区舞鶴1-2-12,1000
すき家 21号可児御嵩IC店,岐阜県可児市柿田829-1,1120
すき家 16号狭山上奥富店,埼玉県狭山市上奥富51-1,1100
すき家 12号滝川東町店,北海道滝川市東町2-42-7,1020
すき家 34号大村店,長崎県大村市桜馬場2-370-1,970
すき家 25号平野加美西店,大阪府大阪市平野区加美西1-6-16,1100
すき家 464号千葉NT白井店,千葉県白井市根447-2,1150
すき家 13号米沢花沢店,山形県米沢市花沢710-7,980
すき家 札幌北郷店,北海道札幌市白石区北郷三条8-1-1,1020
すき家 3号小倉北到津店,福岡県北九州市小倉北区上到津2-3-151F,1000
すき家 町田小山店,東京都町田市小山町959-1,1150
すき家 26号堺山本店,大阪府堺市堺区山本町3-78,1100
すき家 伊勢崎上諏訪店,群馬県伊勢崎市上諏訪町1523-14,1050
すき家 幡ヶ谷駅前店,東京都渋谷区幡ヶ谷1-33-1ｼｬﾄ-ﾌﾀﾊﾞ1F,1250
すき家 稲敷江戸崎店,茨城県稲敷市江戸崎甲2141-3,1020
すき家 久米川駅前店,東京都東村山市栄町2-9-32晃正ﾌﾟﾗｻﾞﾋﾞﾙ1F,1180
すき家 3号薩摩川内店,鹿児島県薩摩川内市御陵下町字住連木14-18,970
すき家 七尾藤橋店,石川県七尾市藤橋町戌12-1,1200
すき家 イオンタウン太子店,兵庫県揖保郡太子町東出262-1,1050
すき家 池上通り中央店,東京都大田区中央7-3-1ｶﾊﾞﾔﾋﾞﾙ1F,1300
すき家 三軒茶屋二丁目店,東京都世田谷区三軒茶屋2-11-24ｻﾝﾀﾜ-ｽﾞA101,1350
すき家 三郷上彦名店,埼玉県三郷市上彦名231-1,1150
すき家 江東千石店,東京都江東区千石2-9-9,1300
すき家 葛飾南水元店,東京都葛飾区南水元2-30-5,1220
すき家 西京区樫原店,京都府京都市西京区樫原分田16-3,1100
すき家 14号江戸川一之江店,東京都江戸川区一之江1-8-4,1220
すき家 155号豊田浄水店,愛知県豊田市浄水町南平187-371,1120
すき家 大田南六郷店,東京都大田区南六郷2-34-7,1300
すき家 1国茅ヶ崎十間坂店,神奈川県茅ヶ崎市十間坂3-2-2,1150
すき家 吉野町店,神奈川県横浜市南区吉野町5-22-17朝日ヶ丘ﾆｭ-ｽｶｲﾏﾝｼｮﾝ1F,1200
すき家 千葉小倉店,千葉県千葉市若葉区小倉町862-3,1080
すき家 名古屋志賀本通店,愛知県名古屋市北区志賀本通2-2,1120
すき家 柴又街道小岩店,東京都江戸川区東小岩6-3-5,1210
すき家 3号熊本藤崎店,熊本県熊本市中央区妙体寺町2-1,950
すき家 新潟大学前店,新潟県新潟市西区五十嵐一の町6711-1,980
すき家 58号名護東江店,沖縄県名護市東江5-6517-1,1020
すき家 多摩乞田店,東京都多摩市乞田791-1,1160
すき家 新御徒町店,東京都台東区東上野1-1-1,1300
すき家 19号土岐店,岐阜県土岐市泉仲森町1-17,1100
すき家 1国豊川御油店,愛知県豊川市御油町池田53-4,1100
すき家 1国戸塚店,神奈川県横浜市戸塚区戸塚町3153-45,1160
すき家 11号松山久米窪田店,愛媛県松山市久米窪田町1162-1,1000
すき家 磐田二之宮店,静岡県磐田市二之宮332-1,1080
すき家 ワンザ有明店,東京都江東区有明3-6-11TFTﾋﾞﾙ東館2F,1400
すき家 ニッケコルトンプラザ店,千葉県市川市鬼高1-1-1,1100
すき家 荻窪駅西口店,東京都杉並区荻窪5-26-11ﾏﾁﾀﾞﾋﾞﾙ1F,1250
すき家 23号津栗真中山店,三重県津市栗真中山町2-1,980
すき家 三鷹牟礼店,東京都三鷹市牟礼4-8-7,1230
すき家 50号伊勢崎赤堀店,群馬県伊勢崎市赤堀今井町1-557-1,1050
すき家 松山空港通店,愛媛県松山市空港通4-7-8,1000
すき家 堺IC店,大阪府堺市南区小代457-1,1120
すき家 江東塩浜店,東京都江東区塩浜2-14-3,1300
すき家 美濃加茂山手店,岐阜県美濃加茂市山手町2-20,1050
すき家 境町上小橋店,茨城県猿島郡境町上小橋98-2,1120
すき家 251号島原宮の町店,長崎県島原市宮の町648-1,1050
すき家 土浦荒川沖店,茨城県土浦市荒川沖東2-17-10,1030
すき家 鴻巣鎌塚店,埼玉県鴻巣市鎌塚1775-6,1070
すき家 北名古屋弥勒寺店,愛知県北名古屋市弥勒寺東3-1,1100
すき家 18号上田材木店,長野県上田市材木町1-9-16,1100
すき家 329号那覇上間店,沖縄県那覇市上間276-1,980
すき家 東住吉杭全店,大阪府大阪市東住吉区杭全5-13-7,1120
すき家 153号千種本町店,愛知県名古屋市千種区千種1-21-3,1120
すき家 町田能ヶ谷店,東京都町田市能ヶ谷町7-12-11,1160
すき家 前橋堀越店,群馬県前橋市堀越町366-1,1100
すき家 藤井寺駅前店,大阪府藤井寺市岡2-8-46ｱｺ-ﾙｱﾝ1Ｆ,1100
すき家 横浜平沼店,神奈川県横浜市西区平沼1-4-28横浜藤和ﾋﾞﾙ1F,1250
すき家 1国豊橋下地店,愛知県豊橋市下地町字宮腰11-9,1080
すき家 500号別府石垣店,大分県別府市石垣西10-3-30,950
すき家 2国岡山早島店,岡山県都窪郡早島町早島3444-1,1050
すき家 171号箕面牧落店,大阪府箕面市牧落3-20-30,1100
すき家 淵野辺北口店,神奈川県相模原市中央区淵野辺3-19-11大黒屋ﾋﾞﾙ1Ｆ,1140
すき家 8号糸魚川寺島店,新潟県糸魚川市寺島3-2-34,1100
すき家 交野星田北店,大阪府交野市星田北3-37-4,1100
すき家 鉾田店,茨城県鉾田市塔ヶ崎1017-1,1020
すき家 伊丹瑞穂店,兵庫県伊丹市瑞穂町2-21,1080
すき家 千葉貝塚店,千葉県千葉市若葉区貝塚2-10-1,1080
すき家 鹿児島卸本町店,鹿児島県鹿児島市卸本町6-2,1000
すき家 21号垂井店,岐阜県不破郡垂井町宮代字提3018-1,1080
すき家 1国山科西野店,京都府京都市山科区西野山階町11-5,1050
すき家 阿倍野店,大阪府大阪市阿倍野区阿倍野筋2-4-49ｱﾍﾞﾆｭ-ﾎ-ﾙ1F,1120
すき家 渋谷円山町店,東京都渋谷区円山町28-4大場ﾋﾞﾙ1F,1400
すき家 四日市西日野店,三重県四日市市西日野町字八幡5031-1,1100
すき家 1国湖南石部店,滋賀県湖南市石部口1-10-5,1050
すき家 幕張本郷店,千葉県千葉市花見川区幕張本郷6-24-26鈴木本郷ビル1F,1080
すき家 仙台クリスロード店,宮城県仙台市青葉区中央2-2-29,1000
すき家 下石神井店,東京都練馬区下石神井5-16-3,1250
すき家 府中けやき並木通り店,東京都府中市宮西町2-21Ｆ,1200
すき家 成増店,東京都板橋区成増2-18-7吉田屋第一ﾋﾞﾙ1F,1250
すき家 此花四貫島店,大阪府大阪市此花区四貫島2-4-5,1160
すき家 芝浦四丁目店,東京都港区芝浦4-9-18ｸﾞﾗﾝﾄﾞﾊﾟﾚｽ田町1F,1380
すき家 40号稚内大黒店,北海道稚内市大黒2-6-24,1300
すき家 421号いなべ店,三重県いなべ市員弁町大泉新田字野溜42-5,1100
すき家 52号清水興津店,静岡県静岡市清水区興津中町字金山下1371-1,1080
すき家 7号にかほ店,秋田県にかほ市平沢字町田129-1,1000
すき家 鹿児島天文館店,鹿児島県鹿児島市呉服町1-3ｾﾝﾁｭﾘｵﾝﾎﾃﾙ鹿児島1F,1000
すき家 39号網走新町店,北海道網走市新町2-3-5,1050
すき家 藍住笠木店,徳島県板野郡藍住町笠木字中野71-2,1020
すき家 松本出川店,長野県松本市出川3-6-10,1100
すき家 245号日立久慈店,茨城県日立市久慈町4-6-6,1030
すき家 札幌山鼻店,北海道札幌市中央区南十三条西15-3-6,1020
すき家 八王子小宮店,東京都八王子市小宮町924-1,1150
すき家 吹田五月が丘店,大阪府吹田市五月が丘東13-19,1100
すき家 14号習志野谷津店,千葉県習志野市谷津2-18-45,1100
すき家 28号鳴門大津店,徳島県鳴門市大津町吉永四番越471-1,1020
すき家 朝霞朝志ヶ丘店,埼玉県朝霞市朝志ヶ丘4-7-19ｱ-ﾙﾌｫﾝﾃｨ-ﾇ1Ｆ,1080
すき家 2国西宮北今津店,兵庫県西宮市津門稲荷町5-8,1050
すき家 町田高ヶ坂店,東京都町田市高ヶ坂6-4-1,1160
すき家 163号門真殿島店,大阪府門真市殿島町7-13,1150
すき家 小田原駅東口店,神奈川県小田原市栄町1-14-1実正堂ﾋﾞﾙ1F,1150
すき家 新4号BP上三川店,栃木県河内郡上三川町しらさぎ2-1-10,1050
すき家 208号荒尾原万田店,熊本県荒尾市原万田字八反田618-3,1000
すき家 甲斐島上条店,山梨県甲斐市島上条207-1,1070
すき家 169号奈良紀寺町店,奈良県奈良市紀寺町682-1,1050
すき家 6号日立城南店,茨城県日立市城南町2-10-1,1000
すき家 上大岡カミオ店,神奈川県横浜市港南区上大岡西1-15-1CAMIO1F,1200
すき家 331号糸満店,沖縄県糸満市潮平603-1,1000
すき家 こどもの国店,神奈川県横浜市青葉区奈良5-4-13,1200
すき家 葛飾柴又店,東京都葛飾区柴又5-9-1,1210
すき家 福岡博多駅南店,福岡県福岡市博多区博多駅南5-22-16,1000
すき家 旭川豊岡店,北海道旭川市豊岡十四条6-8-15,1020
すき家 高松十川店,香川県高松市十川西町583-1,1050
すき家 王子駅前店,東京都北区王子1-4-1ｻﾝｽｸｴｱ前庭,1250
すき家 イオンモール秋田店,秋田県秋田市御所野地蔵田1-1-1,950
すき家 モラージュ菖蒲店,埼玉県久喜市菖蒲町菖蒲6005-1,1250
すき家 津田の松原SA上り店,香川県さぬき市津田町鶴羽935-5,1000
すき家 津田の松原SA下り店,香川県さぬき市津田町鶴羽939-1,1000
すき家 アクロスプラザ東神奈川店,神奈川県横浜市神奈川区西寺尾１-16-15,1250
すき家 高槻古曽部店,大阪府高槻市古曽部町2-21-32,1100
すき家 310号堺大野芝店,大阪府堺市中区大野芝町209-1,1100
すき家 垂水名谷店,兵庫県神戸市垂水区名谷町字横尾1818-1,1040
すき家 藤沢菖蒲沢店,神奈川県藤沢市菖蒲沢730-1,1180
すき家 船橋古作店,千葉県船橋市古作2-1-1,1200
すき家 徳島住吉店,徳島県徳島市住吉4-41,1020
すき家 大久保百人町店,東京都新宿区百人町1-16-14ﾏｷﾊﾞﾋﾞﾙ1Ｆ,1300
すき家 碧南善明店,愛知県碧南市善明町1-37-1,1150
すき家 西武東戸塚S.C.店,神奈川県横浜市戸塚区品濃町537-1,1200
すき家 高津向ヶ丘店,神奈川県川崎市高津区向ヶ丘147-1,1250
すき家 西国分寺駅前店,東京都国分寺市西恋ヶ窪2-5-1積丹ﾋﾞﾙ1Ｆ,1180
すき家 東大阪菱屋東店,大阪府東大阪市菱屋東2-3-29,1100
すき家 49号阿賀野水原店,新潟県阿賀野市庄ヶ宮679-1,1000
すき家 三軒茶屋北店,東京都世田谷区太子堂2-24-6ドミ-三軒茶屋1Ｆ,1350
すき家 大治西條店,愛知県海部郡大治町大字西條字坂牧島8-1,1100
すき家 12号江別野幌店,北海道江別市野幌町48-4,1000
すき家 日の出IC店,東京都西多摩郡日の出町平井15-16,1200
すき家 イオンモール下妻店,茨城県下妻市堀篭972-1,1000
すき家 398号湯沢沖鶴店,秋田県湯沢市沖鶴234-1,950
すき家 58号北谷店,沖縄県中頭郡北谷町北谷2-12-6第5松栄ﾋﾞﾙ1Ｆ,1030
すき家 玉野宇野店,岡山県玉野市宇野1-20-25,1050
すき家 1国蟹江新田店,愛知県海部郡蟹江町大字蟹江新田字大海用38-4,1100
すき家 松阪嬉野店,三重県松阪市嬉野中川新町4-217,1050
すき家 環八矢口渡店,東京都大田区多摩川1-7-11榎本ﾋﾞﾙ1Ｆ,1300
すき家 463号入間東店,埼玉県入間市東町6-1-24,1100
すき家 桶川下日出谷店,埼玉県桶川市下日出谷西3-3-2,1100
すき家 7号弘前高崎店,青森県弘前市大字高崎字広田115-2,950
すき家 1国豊橋岩屋店,愛知県豊橋市岩屋町字岩屋下47-11,1080
すき家 立会川店,東京都品川区南大井1-6-10加藤ﾋﾞﾙ1Ｆ,1300
すき家 吉川栄店,埼玉県吉川市栄834-1,1080
すき家 イオンモール日吉津店,鳥取県西伯郡日吉津村日吉津1160-1,1030
すき家 岡崎牧御堂店,愛知県岡崎市牧御堂町字油田15-1,1200
すき家 3号門司黄金町店,福岡県北九州市門司区黄金町3-22,1000
すき家 56号大洲松ヶ花店,愛媛県大洲市新谷乙543-1,1050
すき家 八尾青山店,大阪府八尾市青山町4-2-38,1100
すき家 56号土佐高岡店,高知県土佐市高岡町字野田南ノ丁乙3369-1,1050
すき家 枚方渚内野店,大阪府枚方市渚内野4-25-1,1100
すき家 五泉東本町店,新潟県五泉市東本町2-78-1,980
すき家 伊勢原歌川店,神奈川県伊勢原市歌川1-3-11,1150
すき家 笹塚店,東京都渋谷区笹塚2-19-2TSK笹塚ﾋﾞﾙ,1250
すき家 イオンモール高の原店,京都府木津川市相楽台1-1-1,1100
すき家 玉川学園駅前店,東京都町田市玉川学園7-5-2,1150
すき家 広島商工センター店,広島県広島市西区商工ｾﾝﾀｰ8-2-49,1100
すき家 相模原小町通店,神奈川県相模原市中央区小町通2-4-12,1150
すき家 286号仙台山田店,宮城県仙台市太白区山田字汚田通17-1,1000
すき家 弥富イオンタウン前店,愛知県弥富市鯏浦町未新田21-1,1100
すき家 宇都宮ゆいの杜店,栃木県宇都宮市ゆいの杜5-8-9,1100
すき家 4号盛岡茶畑店,岩手県盛岡市茶畑2-22-1,950
すき家 静岡安西店,静岡県静岡市葵区安西1-2-18,1100
すき家 8号上越下荒浜店,新潟県上越市大字下荒浜字大谷内横田346-1,1030
すき家 豊田駅前店,東京都日野市多摩平1-2-26ｼﾝﾃﾞﾚﾗﾋﾞﾙ1F,1150
すき家 5号函館亀田店,北海道函館市亀田町17-11,1000
すき家 10号都城上町店,宮崎県都城市上町1-15,980
すき家 木場店,東京都江東区木場5-11-19達摩堂ﾋﾞﾙ1F,1300
すき家 4号春日部備後店,埼玉県春日部市備後東5-11-17,1100
すき家 ゆめタウン佐賀店,佐賀県佐賀市兵庫北5-14-1ゆめﾀｳﾝ佐賀２F,970
すき家 倉吉伊木店,鳥取県倉吉市伊木241-18,1020
すき家 栄三丁目店,愛知県名古屋市中区栄3-8-32山田ﾋﾞﾙ,1200
すき家 氷川台駅前店,東京都練馬区氷川台3-40-15氷川ｶﾞ-ﾃﾞﾝﾊｳｽ1Ｆ,1250
すき家 56号四万十古津賀店,高知県四万十市古津賀1-8,1020
すき家 1国枚方北中振店,大阪府枚方市北中振4-10-5,1100
すき家 横浜アリーナ前店,神奈川県横浜市港北区新横浜3-17-20ﾋｭｰﾏﾝﾊｲﾑ新横浜,1250
すき家 草加松江店,埼玉県草加市松江3-7-5,1100
すき家 25号斑鳩法隆寺店,奈良県生駒郡斑鳩町法隆寺東2-1-22,1050
すき家 我孫子寿店,千葉県我孫子市寿2-14-24,1080
すき家 ゆめタウン出雲店,島根県出雲市大塚町650-1,1050
すき家 坂戸塚越店,埼玉県坂戸市石井2901-3,1080
すき家 4号柴田店,宮城県柴田郡柴田町西船迫1-1-55,980
すき家 松山はなみずき通り店,愛媛県松山市古川北2-172-1,1000
すき家 戸部駅前店,神奈川県横浜市西区戸部本町50-25ｳﾞｨﾗにしむら1F,1250
すき家 246号伊勢原白根店,神奈川県伊勢原市白根95-1,1130
すき家 16号横須賀安浦店,神奈川県横須賀市安浦町3-24-3,1200
すき家 八王子椚田店,東京都八王子市椚田町580-2ﾒｿﾞﾝくぬぎだ1Ｆ,1150
すき家 378号八幡浜店,愛媛県八幡浜市産業通13-12,1020
すき家 イオンモール綾川店,香川県綾歌郡綾川町萱原822-1ｲｵﾝ綾川ｼｮｯﾋﾟﾝｸﾞセンター3F,1150
すき家 20号日野万願寺店,東京都日野市万願寺5-14-8,1150
すき家 いわき錦店,福島県いわき市錦町江栗大町1-1,1050
すき家 丸亀土器店,香川県丸亀市土器町東8-11,1050
すき家 名東猪子石店,愛知県名古屋市名東区猪子石1-106,1100
すき家 錦糸公園前店,東京都墨田区太平3-4-8ｸﾞﾚｲｽMM1F,1250
すき家 足立一ツ家店,東京都足立区一ツ家1-15-6,1220
すき家 札幌美香保店,北海道札幌市東区北二十条東8-3-5,1020
すき家 1国沼津共栄店,静岡県沼津市共栄町19-4,1080
すき家 JR町田駅南口店,東京都町田市原町田1-2-6第2ひろせﾋﾞﾙ1F,1160
すき家 瑞江店,東京都江戸川区瑞江2-1-23田所ﾋﾞﾙ1F,1210
すき家 アクロスプラザ鈴鹿店,三重県鈴鹿市庄野共進2-7-12,1100
すき家 赤羽南口店,東京都北区赤羽1-1-24,1250
すき家 港南四丁目店,東京都港区港南4-2-6,1380
すき家 56号伊予松前店,愛媛県伊予郡松前町大字恵久美617-1,1020
すき家 171号箕面今宮店,大阪府箕面市今宮2-3-1,1100
すき家 イトーヨーカドー国領店,東京都調布市国領町8-2-64ｲﾄ-ﾖ-ｶﾄﾞ-国領店1F,1200
すき家 足立六木店,東京都足立区六木2-7-8,1220
すき家 16号瑞穂南平店,東京都西多摩郡瑞穂町南平1-6-6,1150
すき家 10号宮崎大橋店,宮崎県宮崎市大橋2-30,980
すき家 岡山妹尾店,岡山県岡山市南区妹尾2342-1,1000
すき家 さいたま西堀店,埼玉県さいたま市桜区西堀8-4,1100
すき家 9号松江西津田店,島根県松江市西津田5-1-11,1000
すき家 467号藤沢長後店,神奈川県藤沢市長後754-1,1160
すき家 沼田IC店,群馬県沼田市下久屋町1043-1,1120
すき家 五所川原唐笠柳店,青森県五所川原市大字唐笠柳字藤巻521-8,980
すき家 和歌山大谷店,和歌山県和歌山市大谷字藤原田87-2,1050
すき家 246号秦野渋沢店,神奈川県秦野市並木町188-1,1130
すき家 高砂松陽店,兵庫県高砂市松陽1-7-15,1080
すき家 垂水多聞店,兵庫県神戸市垂水区本多聞1-22-30,1050
すき家 106号宮古店,岩手県宮古市長町1-5-17,980
すき家 相生垣内店,兵庫県相生市垣内町1310-7,1050
すき家 金沢畝田店,石川県金沢市畝田中3-561,1080
すき家 さいたま太田窪店,埼玉県さいたま市緑区太田窪3-17-25,1100
すき家 412号厚木中荻野店,神奈川県厚木市中荻野580-1,1120
すき家 高松郷東店,香川県高松市郷東町483-1,1050
すき家 10号日向原町店,宮崎県日向市原町2-11,950
すき家 モリシア津田沼店,千葉県習志野市谷津1-16-1ﾓﾘｼｱ津田沼1F,1150
すき家 大分明野店,大分県大分市明野東2-32-26,1000
すき家 烏丸七条店,京都府京都市下京区七条通烏丸東入真苧屋町197ﾌﾞ-ｹｶﾞﾙﾆ1F,1120
すき家 小平鈴木店,東京都小平市鈴木町1-215-3,1180
すき家 刈谷東陽店,愛知県刈谷市東陽町2-24,1150
すき家 平塚上平塚店,神奈川県平塚市上平塚1-54,1130
すき家 玉村上之手店,群馬県佐波郡玉村町大字上之手1628-2,1050
すき家 349号那珂店,茨城県那珂市竹ノ内4-11-8,1050
すき家 伊東桜木店,静岡県伊東市桜木町1-3-18,1130
すき家 甲府国玉店,山梨県甲府市国玉町975-1,1070
すき家 鎌ヶ谷初富店,千葉県鎌ヶ谷市新鎌ヶ谷2-1-14,1100
すき家 渋谷桜丘店,東京都渋谷区桜丘町15-19,1380
すき家 24号五條今井店,奈良県五條市今井1-11-57,1000
すき家 56号宇和島宮下店,愛媛県宇和島市宮下字太田甲191-1,1020
すき家 徳島大原店,徳島県徳島市大原町千代ケ丸山5-1,1020
すき家 鳥取南吉方店,鳥取県鳥取市南吉方2-25,1020
すき家 半田州の崎店,愛知県半田市州の崎町2-182,1100
