すき家 22号一宮浅野店,愛知県一宮市浅野字土井ノ内117-1,1100
すき家 阿波吉野店,徳島県阿波市吉野町柿原153-1,1020
すき家 いわき平店,福島県いわき市平谷川瀬一丁目5-7,1050
すき家 足利芳町店,栃木県足利市芳町57-1,1070
すき家 津山小田中店,岡山県津山市小田中1309-10,1050
すき家 大崎シンクパーク店,東京都品川区大崎2丁目1-1シンクパークタワー1F,1500
すき家 日ノ出町駅前店,神奈川県横浜市中区日ノ出町1-51日ノ出町サクアス1階,1200
すき家 7号村上店,新潟県村上市村上字牛沢22-1,1200
すき家 28号南あわじ店,兵庫県南あわじ市市福永字大道ノ上695-4の一部、695-1,1350
すき家 鹿沼栄町店,栃木県鹿沼市栄町1丁目35-16,1200
すき家 なんば千日前店,大阪府大阪市中央区難波千日前11-20遊企画ビル1階,1200
すき家 長崎滑石店,長崎県長崎市大園町5-1,950
すき家 190号宇部西岐波店,山口県宇部市大字西岐波4165-1,970
すき家 11号三豊高瀬店,香川県三豊市高瀬町下勝間2550-1,1050
すき家 13号新庄店,山形県新庄市金沢704-1,1010
すき家 9号江津店,島根県江津市二宮町神主ハ200-2,1100
すき家 つがる柏店,青森県つがる市柏稲盛幾世121-1,980
すき家 124号神栖木崎店,茨城県神栖市木崎2848-1,1100
すき家 13号大仙大曲店,秋田県大仙市大曲戸巻町484-1,980
すき家 東武谷塚駅前店,埼玉県草加市谷塚1-1-22,1130
すき家 136号伊豆の国大仁店,静岡県伊豆の国市吉田363-4,1120
すき家 伊達保原店,福島県伊達市保原町字市柳町7-1,980
すき家 56号宿毛店,高知県宿毛市宿毛1761-1,1000
すき家 甲州塩山店,山梨県甲州市塩山下於曽1559-1,1030
すき家 7号酒田こあら店,山形県酒田市こあら二丁目1-1,1100
すき家 下関稗田西町店,山口県下関市稗田西町10-13,1000
すき家 袋井川井店,静岡県袋井市川井字杉ノ木996-2,1100
すき家 滑川柳原店,富山県滑川市柳原59-14,1080
すき家 160号氷見窪店,富山県氷見市窪841-1,1050
すき家 熊本武蔵ケ丘店,熊本県熊本市北区武蔵ケ丘一丁目4-17,960
すき家 水戸河和田店,茨城県水戸市河和田１丁目1704番14-13,1050
すき家 20号甲府向町店,山梨県甲府市向町729-1,1070
すき家 8号見附店,新潟県見附市今町四丁目9番34-1号,1000
すき家 高幡不動駅店,東京都日野市高幡116-10京王高幡SC1階A106号区画,1150
すき家 太田尾島店,群馬県太田市阿久津町113-1,1050
すき家 下北沢店,東京都世田谷区北沢2丁目12-7大町ビル,1250
すき家 105号由利本荘店,秋田県由利本荘市御門228-1,950
すき家 125号下妻店,茨城県下妻市下妻戊111-1,1100
すき家 瀬戸内邑久店,岡山県瀬戸内市邑久町豊原90-3,1000
すき家 254号富岡店,群馬県富岡市富岡2364-5,1050
すき家 4号紫波店,岩手県紫波郡紫波町桜町字浦田14-1,930
すき家 桶川加納店,埼玉県桶川市加納2149-1,1100
すき家 羽生店,埼玉県羽生市南6丁目21-2,1100
すき家 282号八幡平店,岩手県八幡平市大更第18地割88-12,950
すき家 409号八街店,千葉県八街市八街ほ26-1,1080
すき家 相模原田名店,神奈川県相模原市中央区田名4679-10,1130
すき家 296号多古店,千葉県香取郡多古町多古1534-1,1100
すき家 京成船橋駅前店,千葉県船橋市本町一丁目9-9パークタワー船橋1階104号,1200
すき家 保土ヶ谷今井店,神奈川県横浜市保土ヶ谷区今井町600-1,1230
すき家 品川シーサイド店,東京都品川区東品川4-12-4品川シーサイドパークタワー1階,1400
すき家 岡山瀬戸店,岡山県岡山市東区瀬戸町沖120-1,980
すき家 登別新生町店,北海道登別市新生町4-16-4,1000
すき家 川崎今井店,神奈川県川崎市中原区今井西町1-56,1280
すき家 ９号亀岡篠町店,京都府亀岡市篠町野条上又13-1,1050
すき家 松戸秋山店,千葉県松戸市秋山1-8-8,1120
すき家 小牧駅西店,愛知県小牧市小牧3丁目86-1,1100
すき家 4号福島黒岩店,福島県福島市黒岩堂之後55-1,980
すき家 南港ATC店,大阪府大阪市住之江区南港北2-1-10O&#x27;s215区画,1200
すき家 12号美唄店,北海道美唄市大通東一条南6丁目1-1,1000
すき家 新潟巻店,新潟県新潟市西蒲区巻甲4438-4,1000
すき家 1国横浜久保店,神奈川県横浜市西区久保町1-32,1200
すき家 戸塚上倉田店,神奈川県横浜市戸塚区上倉田町1465-1,1200
すき家 札幌桑園店,北海道札幌市中央区北十一条西20丁目1-10,1020
すき家 中標津店,北海道標津郡中標津町東6条南11-1-2,1080
すき家 小倉北西港店,福岡県北九州市小倉北区西港町15-70,1000
すき家 56号高知大原町店,高知県高知市大原町101-1,1000
すき家 塩竈北浜店,宮城県塩竈市北浜1-13-30,980
すき家 平塚松風店,神奈川県平塚市松風町11-20,1130
すき家 3号鹿児島草牟田店,鹿児島県鹿児島市草牟田町3-1,980
すき家 159号かほく店,石川県かほく市内日角6-1-1,1050
すき家 150号牧之原店,静岡県牧之原市静波2161-1,1080
すき家 三河島駅前店,東京都荒川区東日暮里6-1-1ｱﾄﾗｽﾌﾞﾗﾝｽﾞﾀﾜｰ三河島1F,1250
すき家 豊見城名嘉地店,沖縄県豊見城市名嘉地277-2,980
すき家 3号いちき串木野店,鹿児島県いちき串木野市浜ケ城12283-2,970
すき家 豊中曽根店,大阪府豊中市曽根南町3-19-24,1100
すき家 立山利田店,富山県中新川郡立山町利田629-1,1080
すき家 うるま石川店,沖縄県うるま市石川2-11-1,1000
すき家 486号備後府中店,広島県府中市高木町本堀田643-1,1000
すき家 宇都宮平松店,栃木県宇都宮市平松本町1223-12,1050
すき家 34号小城三日月店,佐賀県小城市三日月町金田1101-1,980
すき家 松原南新町店,大阪府松原市南新町4-107-17,1100
すき家 2国福山引野店,広島県福山市引野町5-19-30,1000
すき家 11号東かがわ店,香川県東かがわ市白鳥字田高田131-1,1050
すき家 東根店,山形県東根市中央南2-8-20,1000
すき家 広島新天地店,広島県広島市中区新天地5-3ﾄﾞﾝ･ｷﾎｰﾃ１F,1080
すき家 取手中央タウン店,茨城県取手市西1-31-29,1050
すき家 202号伊万里店,佐賀県伊万里市二里町大里乙102-1,970
すき家 296号酒々井店,千葉県印旛郡酒々井町上本佐倉193-1,1100
すき家 福崎店,兵庫県神崎郡福崎町南田原字ﾊﾂｸﾞﾛ2970-1,1050
すき家 伊勢西IC店,三重県伊勢市勢田町419-6,1100
すき家 フォレストモール富士川店,山梨県南巨摩郡富士川町青柳町973-1,1070
すき家 東近江能登川店,滋賀県東近江市垣見町523-1,1050
すき家 川崎新川通り店,神奈川県川崎市川崎区渡田1-17-5石田ﾋﾞﾙ1F,1250
すき家 210号うきは店,福岡県うきは市吉井町清瀬515-2,980
すき家 近鉄奈良駅前店,奈良県奈良市中筋町6-1奈良ﾗｲﾝﾊｳｽ1F,1050
すき家 地下鉄弘明寺駅前店,神奈川県横浜市南区大岡2-3-1,1200
すき家 藤が丘駅前店,神奈川県横浜市青葉区藤が丘2-5-1,1200
すき家 水戸柳町店,茨城県水戸市柳町1-1-8,1050
すき家 313号真庭店,岡山県真庭市惣146-1,1100
すき家 4号本宮店,福島県本宮市本宮字南ノ内34-7,980
すき家 51号水戸大洗IC店,茨城県水戸市大串町965-3,1050
すき家 長田浜添通店,兵庫県神戸市長田区浜添通6-1-25,1080
すき家 札幌石山通南一条店,北海道札幌市中央区南1条西11-327-27ｼﾞｭﾋﾟﾀｰﾌﾟﾚｲｽ1F,1020
すき家 170号羽曳野西浦店,大阪府羽曳野市西浦3-2-1,1100
すき家 9号浜田店,島根県浜田市熱田町1418-1,1050
すき家 大倉山駅前店,神奈川県横浜市港北区大倉山1-17-4秋本庄次ﾋﾞﾙ1F,1180
すき家 4号仙台郡山店,宮城県仙台市太白区郡山字出丸1-1,1000
すき家 10号延岡別府町店,宮崎県延岡市別府町3895-1,980
すき家 広島西風新都店,広島県広島市佐伯区石内北一丁目3-36,1000
すき家 松山道後樋又店,愛媛県松山市道後樋又11-20,950
すき家 高岡中曽根店,富山県高岡市中曽根290-3,1080
すき家 イオンモール浦和美園店,埼玉県さいたま市緑区美園5-50-1ｲｵﾝﾓｰﾙ浦和美園3Fﾌｰﾄﾞｺｰﾄ,1150
すき家 鈴鹿ＩＣ店,三重県鈴鹿市伊船町1910-1,1100
すき家 目黒三丁目店,東京都目黒区目黒3-9-3目黒パークスクエア102号室,1300
すき家 113号角田店,宮城県角田市角田字扇町5-5,980
すき家 9号大田店,島根県大田市長久町土江103-3,1100
すき家 56号須崎店,高知県須崎市神田2503-1,1020
すき家 254号本庄児玉店,埼玉県本庄市児玉町吉田林397-3,1110
すき家 大船渡赤崎店,岩手県大船渡市赤崎町字諏訪前38-5,1100
すき家 156号砺波店,富山県砺波市新又135-1,1100
すき家 摂津南別府店,大阪府摂津市南別府町3-19,1120
すき家 瑞穂牛巻店,愛知県名古屋市瑞穂区牛巻町8-11,1100
すき家 2国尼崎杭瀬店,兵庫県尼崎市杭瀬北新町3-2-18,1080
すき家 4号金ヶ崎店,岩手県胆沢郡金ヶ崎町三ケ尻荒巻159-1,980
すき家 407号熊谷弥藤吾店,埼玉県熊谷市弥藤吾1519-2,1080
すき家 宮崎新別府店,宮崎県宮崎市新別府町山宮986-6,1030
すき家 21号岐阜各務原IC店,岐阜県各務原市那加緑町1-24-1,1080
すき家 57号大津店,熊本県菊池郡大津町大字大津1302-1,1000
すき家 121号喜多方店,福島県喜多方市関柴町上高額字前田1737-16,980
すき家 36号苫小牧日吉店,北海道苫小牧市日吉町1-1-5,1020
すき家 平野町一丁目店,大阪府大阪市中央区平野町1-8-11ﾙｰﾄ北浜ﾋﾞﾙ1F,1200
すき家 23号豊橋花田店,愛知県豊橋市花田町字荒木37-1,1080
すき家 387号合志店,熊本県合志市御代志1736-4,970
すき家 9号福知山店,京都府福知山市駅南町3-139,1100
すき家 稲毛駅西口店,千葉県千葉市稲毛区稲毛東3-19-18能瀬ﾋﾞﾙ1F,1100
すき家 広島丹那店,広島県広島市南区丹那町5-10,1100
すき家 釧路桜ヶ岡店,北海道釧路市桜ヶ岡1-9-21,1000
すき家 淀川加島店,大阪府大阪市淀川区加島2-3-4,1120
すき家 川崎西生田店,神奈川県川崎市多摩区西生田2-7-23,1140
すき家 217号臼杵店,大分県臼杵市市浜1128-1,980
すき家 大阪港駅前店,大阪府大阪市港区築港3-6-13,1200
すき家 34号武雄店,佐賀県武雄市武雄町昭和795-1,970
すき家 宝塚小林店,兵庫県宝塚市小林5-9-100,1050
すき家 309号堺黒山店,大阪府堺市美原区黒山168-1,1120
すき家 御徒町駅南口店,東京都台東区上野5-27-2,1300
すき家 西都右松店,宮崎県西都市右松3-33,970
すき家 大鳥居店,東京都大田区西糀谷3-21-2,1300
すき家 50号桐生広沢店,群馬県桐生市広沢町三丁目字反町4023-2,1070
すき家 135号熱海店,静岡県熱海市下多賀572-2,1030
すき家 本川越クレアモール店,埼玉県川越市新富町1-19-4本川越ASﾋﾞﾙ1F,1070
すき家 千歳船橋駅前店,東京都世田谷区船橋1-9-24千歳船橋振興組合会館1F,1250
すき家 222号日南店,宮崎県日南市中央通1-11-23,1000
すき家 283号遠野店,岩手県遠野市早瀬町4-7-36,970
すき家 うるま安慶名店,沖縄県うるま市安慶名1-4-10,960
すき家 港北小机店,神奈川県横浜市港北区小机町78-1,1250
すき家 八尾南木の本店,大阪府八尾市南木の本4-101-1,1100
すき家 34号吉野ヶ里店,佐賀県神埼郡吉野ヶ里町田手1678-16,970
すき家 165号久居IC店,三重県津市久居北口町47-6,1050
すき家 江戸川興宮店,東京都江戸川区興宮町33-17,1210
すき家 4号滝沢店,岩手県滝沢市巣子109-2,920
すき家 八潮西袋店,埼玉県八潮市西袋1030-1,1100
すき家 熊本野中店,熊本県熊本市西区野中1-6-12,1000
すき家 202号唐津鏡店,佐賀県唐津市鏡4664-1,970
すき家 犬山五郎丸店,愛知県犬山市五郎丸東3-7-1,1080
すき家 平塚豊田店,神奈川県平塚市豊田本郷1740-1,1150
すき家 407号鶴ヶ島IC店,埼玉県鶴ヶ島市脚折町5-5-40,1080
すき家 312号姫路砥堀店,兵庫県姫路市砥堀350-2,1120
すき家 佐倉石川店,千葉県佐倉市石川535-6,1100
すき家 4号二戸店,岩手県二戸市米沢字下村6-1,960
すき家 今池店,愛知県名古屋市千種区今池5-22-16,1120
すき家 bono相模大野店,神奈川県相模原市南区相模大野3-3-2-203bono相模大野,1140
すき家 ポルカ高梁店,岡山県高梁市中原町1079-1,950
すき家 港区甚兵衛通店,愛知県名古屋市港区甚兵衛通2-24-1,1150
すき家 船橋日大前店,千葉県船橋市坪井東1-2-38,1080
すき家 鶴瀬駅西口店,埼玉県富士見市鶴馬2602-2鶴瀬駅西口ﾋﾞﾙ1F,1080
すき家 54号広島IC店,広島県広島市安佐南区緑井5-19-36,1000
すき家 13号尾花沢店,山形県尾花沢市大字尾花沢下新田1731-2,950
すき家 中葛西店,東京都江戸川区中葛西6-1-10ﾒｿﾞﾝﾄﾞ佐久間Ⅱ,1250
すき家 イオン東雲店,東京都江東区東雲1-9-10ｲｵﾝ東雲店2Fﾌｰﾄﾞｺｰﾄ内,1300
すき家 117号飯山店,長野県飯山市静間2085-1,1100
すき家 10号高鍋店,宮崎県児湯郡高鍋町大字北高鍋2970-1,950
すき家 大森ベルポート店,東京都品川区南大井6-26-3大森ﾍﾞﾙﾎﾟｰﾄD館1F,1300
すき家 阪急茨木市駅前店,大阪府茨木市双葉町8-1奥村ビル1F,1100
すき家 191号益田店,島根県益田市あけぼの西町13-1,1100
すき家 相模大野駅南口店,神奈川県相模原市南区相模大野8-2-6第一島ﾋﾞﾙ1F,1140
すき家 宝塚中筋店,兵庫県宝塚市中筋6-13-22,1050
すき家 大森駅西口店,東京都大田区山王2-4-4,1300
すき家 船堀駅前店,東京都江戸川区船堀3-5-7船堀駅前ﾄｷﾋﾞﾙ1F,1210
すき家 鹿児島宇宿店,鹿児島県鹿児島市宇宿6-22-1,970
すき家 2国岩国室の木店,山口県岩国市室の木町1-8-38,1050
すき家 本八幡駅南口店,千葉県市川市南八幡4-6-2高橋ﾋﾞﾙ1F,1200
すき家 2国下関長府店,山口県下関市長府松小田本町24-6,1050
すき家 永福町駅前店,東京都杉並区永福2-51-13,1200
すき家 市原能満店,千葉県市原市能満4-8,1100
すき家 加須南大桑店,埼玉県加須市南大桑2877-1,1080
すき家 上池袋二丁目店,東京都豊島区上池袋2-40-10ﾆｭｰｷｬｯｽﾙ上池袋1F,1300
すき家 札幌駅前通北一条店,北海道札幌市中央区北1条西3-2-5北尾ﾋﾞﾙ1F,1020
すき家 202号糸島前原店,福岡県糸島市前原東1-6-13,980
すき家 188号柳井店,山口県柳井市南町3-7-1,1000
すき家 住吉遠里小野店,大阪府大阪市住吉区遠里小野2-10-30,1100
すき家 44号根室店,北海道根室市西浜町8-92-1,1020
すき家 500号小郡店,福岡県小郡市小郡字江下1483-4,1000
すき家 イトーヨーカドー三郷店,埼玉県三郷市ﾋﾟｱﾗｼﾃｨ1-1-1ｲﾄｰﾖｰｶﾄﾞｰ三郷1F,1100
すき家 長岡天神駅前店,京都府長岡京市天神1-1-2ﾏﾙｵｶﾋﾞﾙ1F,1080
すき家 153号飯田IC店,長野県飯田市上殿岡576-1,1220
すき家 125号久喜栗橋店,埼玉県久喜市栗橋1301-3,1150
すき家 58号読谷店,沖縄県中頭郡読谷村伊良皆661-1,1000
すき家 ノクティプラザ店,神奈川県川崎市高津区溝口1-4-1ﾉｸﾃｨﾌﾟﾗｻﾞ21Fﾌｰﾄﾞｺｰﾄ内,1280
すき家 東池袋五丁目店,東京都豊島区東池袋5-7-7金誠堂ﾋﾞﾙ1F,1300
すき家 ときわ台駅北口店,東京都板橋区常盤台2-6-5,1250
すき家 大森町駅前店,東京都大田区大森西3-25-7ｴｽﾄｼﾞｭｰﾙ大森町1F、2F,1300
すき家 福知山東野パーク店,京都府福知山市字土小字東野1117-594,1100
すき家 勝田台駅南店,千葉県八千代市勝田台1-37-8ｽﾌﾟﾘﾝｸﾞⅡ1F,1100
すき家 イオンモール柏店,千葉県柏市豊町2-5-25ｲｵﾝﾓｰﾙ柏2F,1120
すき家 36号千歳店,北海道千歳市新富1-19-4,1100
すき家 関平賀店,岐阜県関市市平賀字岩下394-1,1050
すき家 大井町一丁目店,東京都品川区大井1-16-2ブリリア大井町ラヴィアンタワ-1F,1300
すき家 富士見下南畑店,埼玉県富士見市下南畑字島崎5006-4,1100
すき家 4号栗原店,宮城県栗原市志波姫堀口宮中113-8,960
すき家 鶴見市場駅前店,神奈川県横浜市鶴見区市場大和町8-8戸川ﾋﾞﾙ1F,1250
すき家 南堀江店,大阪府大阪市西区南堀江2-1-1EG堀江ﾋﾞﾙ1F,1200
すき家 梅屋敷駅東店,東京都大田区東蒲田1-1-1ﾌﾟﾗﾑﾊﾟｰｸ嶋田1Ｆ,1300
すき家 西台駅西店,東京都板橋区高島平1-75-15高桐ﾏﾝｼｮﾝ1F,1250
すき家 二本松店,福島県二本松市松岡265-10,980
すき家 熊本新市街店,熊本県熊本市中央区新市街7-25第二新世界会館ﾋﾞﾙ1F,1000
すき家 草加八幡店,埼玉県草加市八幡町26-1,1100
すき家 川口末広店,埼玉県川口市末広1-19-3,1100
すき家 4号郡山安積店,福島県郡山市安積3-43,950
すき家 横浜笠間店,神奈川県横浜市栄区笠間5-33-26,1200
すき家 238号紋別店,北海道紋別市落石町4-13-13,1200
すき家 川口青木店,埼玉県川口市青木3-8-5,1100
すき家 45号おいらせ店,青森県上北郡おいらせ町菜飯52-4,980
すき家 渋谷二丁目店,東京都渋谷区渋谷2-12-13八千代ﾋﾞﾙ1F,1400
すき家 京王稲田堤駅前店,神奈川県川崎市多摩区菅3-1-1,1180
すき家 8号彦根野口店,滋賀県彦根市野口町277-2,1050
すき家 明石大久保IC店,兵庫県明石市大久保町大窪字大澤2700-1,1080
すき家 16号見沼深作店,埼玉県さいたま市見沼区深作2-29-14,1100
すき家 愛知大学店,愛知県名古屋市中村区平池町4-60-6,1200
すき家 220号志布志店,鹿児島県志布志市志布志町安楽123-21,1000
すき家 筑紫野永岡店,福岡県筑紫野市大字永岡169-1,950
すき家 一之江駅前店,東京都江戸川区一之江3-2-14,1210
すき家 追浜駅前店,神奈川県横須賀市追浜町3-8,1120
すき家 取手青柳店,茨城県取手市青柳132-1,1000
すき家 金沢増泉店,石川県金沢市増泉4-3-2,1050
すき家 千種鏡池通店,愛知県名古屋市千種区川崎町2-7,1120
すき家 札幌新道発寒店,北海道札幌市西区発寒12条1-2-30,1020
すき家 268号伊佐店,鹿児島県伊佐市大口里801-1,950
すき家 3号山鹿店,熊本県山鹿市大橋通401-2,970
すき家 183号三次店,広島県三次市十日市中1-1-10,1100
すき家 JR神戸駅北店,兵庫県神戸市中央区多聞通2-4-4神戸ﾌﾞｯｸﾛｰﾝﾋﾞﾙ東館1F,1100
すき家 イオンモール桑名店,三重県桑名市新西方1-22ｲｵﾝﾓｰﾙ桑名ｼｮｯﾋﾟﾝｸﾞｾﾝﾀｰ1番街1F,1100
すき家 亀戸駅北口店,東京都江東区亀戸2-22-10ｶﾄｳﾋﾞﾙ1F,1250
すき家 312号和田山IC店,兵庫県朝来市和田山町枚田592-1,1120
すき家 9号安来店,島根県安来市黒井田町452-17,980
すき家 摂津本山駅前店,兵庫県神戸市東灘区岡本1-3-33,1050
すき家 京成大久保駅前店,千葉県習志野市大久保1-21-14琴富ﾋﾞﾙ1F,1100
すき家 都島IC店,大阪府大阪市都島区高倉町3-14-27,1120
すき家 226号指宿店,鹿児島県指宿市西方2164-1,1000
すき家 247号西尾一色店,愛知県西尾市一色町味浜上浜47-1,1100
すき家 200号直方店,福岡県直方市大字頓野字縄手下3891-11,1000
すき家 新橋三丁目店,東京都港区新橋3-10-9ﾎﾃﾙ新橋三番館1F,1330
すき家 新宿ＮＳビル店,東京都新宿区西新宿2-4-1新宿NSﾋﾞﾙ1F,1350
すき家 4号福島松浪店,福島県福島市松浪町11-7,980
すき家 美馬脇町店,徳島県美馬市脇町大字猪尻字東分63-1,1020
すき家 53号岡山IC店,岡山県岡山市北区津島京町1-3-18,980
すき家 小手指駅北口店,埼玉県所沢市小手指町1-1-1,1080
すき家 宜野湾我如古店,沖縄県宜野湾市我如古4-7-3,1000
すき家 花小金井駅北口店,東京都小平市花小金井1-9-18花小金井第一ﾋﾞﾙ1F,1200
すき家 3号水俣店,熊本県水俣市百間町1-12-1,970
すき家 26号泉大津店,大阪府泉大津市北豊中町2-17-24,1100
すき家 高津末長店,神奈川県川崎市高津区末長2-11-18,1250
すき家 江古田駅前店,東京都練馬区旭丘1-71-7土井ﾋﾞﾙ1F,1250
すき家 北九州空港通り店,福岡県京都郡苅田町大字苅田3787-11,1050
すき家 武豊IC店,愛知県知多郡武豊町嶋田58-200,1080
すき家 深川店,北海道深川市三条18-25,1000
すき家 134号横須賀池田店,神奈川県横須賀市池田町5-14-12,1130
すき家 鵜の木駅前店,東京都大田区鵜の木2-15-2山口ﾋﾞﾙ1F,1300
すき家 松戸駅西口店,千葉県松戸市本町19-23宝星ﾋﾞﾙ1F,1080
すき家 270号南さつま店,鹿児島県南さつま市加世田本町13-5,1000
すき家 四街道IC店,千葉県四街道市栗山812-6,1100
すき家 269号宮崎清武店,宮崎県宮崎市清武町正手3-17-1,950
すき家 小金井中町店,東京都小金井市中町2-8-2,1200
すき家 イオンモール福津店,福岡県福津市日蒔野6-16-1ｲｵﾝﾓｰﾙ福津3F,1000
すき家 那覇曙店,沖縄県那覇市曙2-23-1,1000
すき家 三郷中央駅前店,埼玉県三郷市中央3-48-5,1150
すき家 枚方中宮東之町店,大阪府枚方市中宮東之町22-13,1100
すき家 足立西綾瀬店,東京都足立区西綾瀬3-11-13,1220
すき家 19号長野中御所店,長野県長野市中御所4-3-4,1100
すき家 笠間友部店,茨城県笠間市旭町427-2,1080
すき家 広島深川店,広島県広島市安佐北区深川6-2-12,980
すき家 209号筑後店,福岡県筑後市山ノ井346-3,980
すき家 25号王寺本町店,奈良県北葛城郡王寺町本町１-17-17,1000
すき家 16号袖ヶ浦神納店,千葉県袖ヶ浦市神納1154-1,1100
すき家 清水鳥坂店,静岡県静岡市清水区鳥坂1231-1,1080
すき家 新丸子駅東口店,神奈川県川崎市中原区新丸子東1-827ｸﾘｱ･ﾊｳｽ田中1F,1250
すき家 192号吉野川店,徳島県吉野川市鴨島町上下島字宮内87-8,1020
すき家 須坂墨坂店,長野県須坂市墨坂4-2-20,1050
すき家 船橋市場店,千葉県船橋市市場5-1-19,1150
すき家 東十条三丁目店,東京都北区東十条3-15-12ｼﾃｨﾊｲﾂ東十条103,1250
すき家 50号筑西蓮沼店,茨城県筑西市蓮沼1534-1,1050
すき家 十三駅西口店,大阪府大阪市淀川区十三本町1-7-1ｶﾈｲｼﾋﾞﾙ,1150
すき家 13号福島矢野目店,福島県福島市北矢野目字原田66-13,980
すき家 灘中郷店,兵庫県神戸市灘区中郷町3-2-13,1100
すき家 三鷹井口店,東京都三鷹市井口2-13-42,1250
すき家 函館鍛治店,北海道函館市鍛治2-9-11,1000
すき家 白岡岡泉店,埼玉県白岡市太田新井1187-4,1100
すき家 329号那覇古波蔵店,沖縄県那覇市古波蔵3-14-2,1000
すき家 朝霞駅南口店,埼玉県朝霞市本町2-3-18,1100
すき家 姫路継店,兵庫県姫路市継205-1,1080
すき家 横浜羽沢店,神奈川県横浜市神奈川区羽沢町1566-1,1250
すき家 16号春日部八丁目店,埼玉県春日部市八丁目1156-1,1120
すき家 丹南篠山口IC店,兵庫県丹波篠山市網掛字十ノ坪403-1,1100
すき家 東郷三ツ池店,愛知県愛知郡東郷町三ツ池2-3-5,1100
すき家 古河坂間店,茨城県古河市坂間253-178,1030
すき家 浜松志都呂店,静岡県浜松市中央区志都呂2-20-24,1100
すき家 練馬関町南店,東京都練馬区関町南1-11-2,1250
すき家 水道橋駅東口店,東京都千代田区神田三崎町1-4-26,1300
すき家 富田林小金台店,大阪府富田林市小金台1-3-10,1100
すき家 井ノ頭通り吉祥寺店,東京都武蔵野市吉祥寺南町3-33-3,1250
すき家 新宿御苑前駅店,東京都新宿区新宿1-19-7新花ビル1F,1330
すき家 231号留萌店,北海道留萌市旭町2-1-1,1000
すき家 ＪＲ尼崎駅北口店,兵庫県尼崎市潮江1-3-43,1100
すき家 西五反田一丁目店,東京都品川区西五反田1-24-4ﾀｷｹﾞﾝﾋﾞﾙ1F,1350
すき家 34号長崎矢上町店,長崎県長崎市矢上町52-2,970
すき家 豊田曙店,愛知県豊田市曙町2-81-1,1180
すき家 東神奈川駅東口店,神奈川県横浜市神奈川区東神奈川1-10-1ｻﾞ･ｽﾃｰｼｮﾝﾀﾜｰ東神奈川1F,1140
すき家 府中浅間店,東京都府中市浅間町4-19-1,1200
すき家 淀川通塚本店,大阪府大阪市淀川区塚本2-14-19,1120
すき家 中山駅南口店,神奈川県横浜市緑区台村町278-4石渡ﾌﾗﾜｰｾﾝﾀｰﾋﾞﾙ1F,1200
すき家 晴海二丁目店,東京都中央区晴海2-5-24晴海ｾﾝﾀｰﾋﾞﾙ1F,1300
すき家 寺田町駅前店,大阪府大阪市阿倍野区天王寺町北2-1-5,1150
すき家 台東下谷店,東京都台東区下谷3-19-8,1250
すき家 桜土浦IC店,茨城県つくば市下広岡字向山1055-321,1050
すき家 287号長井店,山形県長井市東町6-31,980
すき家 207号時津店,長崎県西彼杵郡時津町浜田郷627-1,970
